date,username,to,replies,retweets,favorites,text,geo,mentions,hashtags,id,permalink
2020-02-12 02:11:32,hermitary,hannahmosk,0,0,2,"Destigmatizing mental illness: My name is Jeff, and I’m 43 years old. Diagnosed a little over a year ago with bipolar 2, DID, major depressive disorder, and more. Currently unemployed & trying to rebuild my life. I take Abilify, Trazodone, Vistaril,Depakote, and Zoloft.",,,,1227414905550200833,https://twitter.com/hermitary/status/1227414905550200833
2020-02-11 23:33:52,sadiepris,JamieTheJedi,0,0,1,"I took the abilify for a while...it's supposed to be an adjunct to make the other med work better. I stopped that and was switched to wellbutrin. It did the trick! you have to ease into wellbutrin...or I did. 1 pill a day for 2 weeks then 2 pills a day",,,,1227375227388096512,https://twitter.com/sadiepris/status/1227375227388096512
2020-02-11 23:31:53,olivebrinker,JoametteGil,0,7,82,"i’m olive, a cartoonist and animator. I live with severe anxiety and depression. I’m currently on an antidepressant called Viibryd and an antipsychotic called Abilify, on top of weekly cognitive behavioral therapy appointments ",,,,1227374728861671425,https://twitter.com/olivebrinker/status/1227374728861671425
2020-02-11 23:23:52,ban_islands,,0,0,0,"Fuck me why did i let my abilify run out",,,,1227372709350461441,https://twitter.com/ban_islands/status/1227372709350461441
2020-02-11 23:16:48,ShayRaeInGame,,0,0,0,"Any of y’all on Abilify? I know there’s always a couple weeks of wonkiness but like DAMN. I feel like I can’t stay still but at the same time I’m sleepy. And I feel like I can’t stick to doing anything my brain is like ZOOOOM.",,,,1227370931368034304,https://twitter.com/ShayRaeInGame/status/1227370931368034304
2020-02-11 22:58:25,laurendanger,JamieTheJedi,0,0,1,"I hope the Abilify will help out. I know the chest-crushing anxiety feel too well for one life, so hopefully the adjustments will get you to a good place. It does take time and tinkering!",,,,1227366305507901440,https://twitter.com/laurendanger/status/1227366305507901440
2020-02-11 22:57:07,JamieTheJedi,laurendanger,2,0,0,"I'm currently on 25mg of Cipralex, but it wasn't helping. He reduced my dosage to 20mg, and added 2mg of Abilify.",,,,1227365979534966784,https://twitter.com/JamieTheJedi/status/1227365979534966784
2020-02-11 22:45:55,geekmonkey5x5,,0,0,1,"I can’t really function in a healthy manner on these meds and I’m half ready to wean myself back off the Abilify and onto the Lexapro bc fuck my psychiatrist",,,,1227363160350511107,https://twitter.com/geekmonkey5x5/status/1227363160350511107
2020-02-11 22:41:59,JamieTheJedi,,3,0,4,"So it's time to change up my medication; my doctor is keeping me on Cipralex, and adding 2mg of Abilify. Hopefully that'll stabilize my mood. I take that for 2 weeks, and if it doesn't work, he's gonna switch me to Wellbutrin.",,,,1227362168984596482,https://twitter.com/JamieTheJedi/status/1227362168984596482
2020-02-11 22:13:22,DAddh8,psychunseen,2,0,2,"“We desperately need safer and more effective medications”. The gravy train is flowing for Lilly, Johnson and Johnson, and Pfizer. Why innovate? Risperdal is a winner. Abilify is a winner. Everybody wins! (Except patients)",,,,1227354969197686784,https://twitter.com/DAddh8/status/1227354969197686784
2020-02-11 21:37:52,sailorpeepo,brutalshell,1,0,0,"after like 3 years and 50 pound weight gain that started when I started take abilify also everyone I know who has taken abilify has gained at least 30 pounds rapidly. I switched to Latuda at one point and then like. this last summer I stopped that too.",,,,1227346036244414464,https://twitter.com/sailorpeepo/status/1227346036244414464
2020-02-11 21:33:45,_InnocentAsh,___myreee,0,0,0,"It’s working so well that i volunteered to dial back my dosage .. im even able to take it without my abilify",,,,1227345000029184001,https://twitter.com/_InnocentAsh/status/1227345000029184001
2020-02-11 21:30:34,sailorpeepo,brutalshell,1,0,0,"girl abilify made me so fat",,,,1227344197838983168,https://twitter.com/sailorpeepo/status/1227344197838983168
2020-02-11 21:29:51,brutalshell,,1,0,4,"OMFG I LITERALLY JUST WENT IN FOR MY ABILIFY AND THE PHARMACIST TOLD ME THEY HAD MY ADDERALL IN ",,,,1227344019237138432,https://twitter.com/brutalshell/status/1227344019237138432
2020-02-11 17:16:13,annmarcos1,PlanetJanice,0,0,0,"Abilify advertised as an antidepressant. ",,,,1227280188133855233,https://twitter.com/annmarcos1/status/1227280188133855233
2020-02-11 16:30:27,Lil_hamilton_,TommyWilliford,1,0,1,"I was on that for a short time. Knocked me on my ass... but also drowsy All Day Long. I'm on Abilify now. It is for my Major Depressive Disorder. That one doesn't affect sleep at all. I take a sleeping pill for that. He is on amitriptyline; generally he has no issues with sleep",,,,1227268673347284994,https://twitter.com/Lil_hamilton_/status/1227268673347284994
2020-02-11 16:22:47,annmarcos1,PlanetJanice,1,0,0,"When did Abilify bc an antidepressant?",,,,1227266743283986433,https://twitter.com/annmarcos1/status/1227266743283986433
2020-02-11 14:28:01,DAddh8,psychunseen,2,0,0,"John Nash hated meds and stopped taking them I thought. I spoke with elyn saks. I meant not famous people. Can people on abilify hold down jobs?",,,,1227237861478608901,https://twitter.com/DAddh8/status/1227237861478608901
2020-02-11 13:32:39,SocomAndro,,0,0,0,"Seether-Fine Again #sober _abilify_ https://www.instagram.com/p/B8baftOAmew/?igshid=reqhu1owr8f5",,,#sober,1227223925622530049,https://twitter.com/SocomAndro/status/1227223925622530049
2020-02-11 10:45:14,tallorangeangry,nfactorial,0,0,2,"Yes. Cymbalta because it helps with chronic back pain and depression. Also a secondary: Abilify. Meds have changed my life for the better. I wish I could take a higher dose of Cymbalta, but if I do, I get up like seven times a night to pee. Not kidding.",,,,1227181795952799744,https://twitter.com/tallorangeangry/status/1227181795952799744
2020-02-11 07:35:46,Imogen34434177,,1,1,0,"I took abilify and now I've got some really bad intestinal cramping. Is this expected?",,,,1227134115423686656,https://twitter.com/Imogen34434177/status/1227134115423686656
2020-02-11 04:00:45,Clementine5000,,0,0,9,"Hey #bipolar friends; I’m off the Effexor for good. Haven’t taken it since Thursday pm. The Prozac trick worked. Was feeling depressed today though so am increasing the Abilify as I continue to experiment with cross tapering with Seroquel. #bipolarclub",,,#bipolar #bipolarclub,1227080003562680320,https://twitter.com/Clementine5000/status/1227080003562680320
2020-02-10 22:59:55,squintillian,,2,0,3,"for real though this woman tried to put me on neurontin and abilify without even giving me a standard MDQ thanks no thanks",,,,1227004294966149121,https://twitter.com/squintillian/status/1227004294966149121
2020-02-10 22:54:30,savannahbeaton,SsssamanthaaMUA,0,0,0,"I’ve been on it 2 years My experience is great especially coupled with abilify. weight gain has been my only side effect.",,,,1227002932513722368,https://twitter.com/savannahbeaton/status/1227002932513722368
2020-02-10 22:18:53,toryerp,,1,0,4,"i've officially passed the half-life of that 1 abilify pill i took and i feel about half-human",,,,1226993971731271683,https://twitter.com/toryerp/status/1226993971731271683
2020-02-10 21:56:24,supermommyto5,,1,0,22,"I am feeling much better I just had a mental build up I’m dedicated and driven to fighting to get Holly on the best Med combo she stated abilify and it slowly seems to be helping we are doing the best 1 day at a time she needs us both to be strong for her and",,,,1226988312310812673,https://twitter.com/supermommyto5/status/1226988312310812673
2020-02-10 21:40:23,chubbygoth,chubbygoth,1,0,1,"they mainly prescribed to because it can help with weight loss to counteract the weight gain of abilify",,,,1226984280829693959,https://twitter.com/chubbygoth/status/1226984280829693959
2020-02-10 21:39:31,chubbygoth,yungeateat,1,0,1,"wellbutrin!! i take it with Abilify.",,,,1226984061077479424,https://twitter.com/chubbygoth/status/1226984061077479424
2020-02-10 19:32:49,olivebrinker,,1,0,75,"I’m glad I’m leaving for vacation tomorrow because my abilify makes me want to do nothing else but lay down and at the beach that’s more acceptable lol",,,,1226952178281086977,https://twitter.com/olivebrinker/status/1226952178281086977
2020-02-10 19:10:05,anajpg_,,0,0,2,"abilify is just prescribed coke",,,,1226946457153961984,https://twitter.com/anajpg_/status/1226946457153961984
2020-02-10 17:04:04,D2019Rebel,BipolarDisorder,0,0,1,"I used to take Risperidone until it started messing with my liver. I now take Abilify for my schizoaffective disorder.",,,,1226914742838734860,https://twitter.com/D2019Rebel/status/1226914742838734860
2020-02-10 15:25:42,GaryHow08605462,blandwifeyhiggs,1,0,0,"your not fat abilify does that to me",,,,1226889986831790080,https://twitter.com/GaryHow08605462/status/1226889986831790080
2020-02-10 15:15:06,Med_Shadow,,0,2,0,"#Abilify is used for bi-polar, #depression, #ADHD, schizophrenia, autism and more. The side effects are significant and can be life altering. What do you need to know?",,,#Abilify #depression #ADHD,1226887322358165506,https://twitter.com/Med_Shadow/status/1226887322358165506
2020-02-10 13:30:16,sassybworm,lilylefae,0,0,1,"My doc said that since the seasons seem to be shifting quicker, the combo of lamictal, prozac and abilify might be pushing me up to high. Before I was too low; now I’m too high. Sheesh!",,,,1226860938650718208,https://twitter.com/sassybworm/status/1226860938650718208
2020-02-10 08:16:32,serenebruise36,CerrillosM,0,0,0,"abilify made me addicted to sex and gambling ",,,,1226781987454607361,https://twitter.com/serenebruise36/status/1226781987454607361
2020-02-10 07:39:19,romaisamalik001,,1,0,0,"I took abilify and now I've got some really bad intestinal cramping. Is this expected?",,,,1226772618906361856,https://twitter.com/romaisamalik001/status/1226772618906361856
2020-02-10 05:36:56,cheybringsthgai,,0,0,2,"Literally thinking about going back on abilify.. I don’t want to but my moods have been all over the place",,,,1226741822837252100,https://twitter.com/cheybringsthgai/status/1226741822837252100
2020-02-10 04:51:24,suckmydicktrump,,0,0,3,"maybe Abilify will help. my mind is made up that no one can help me lol BUT ME! I NEED TO LIVE FOR ME! I NEED TO DO IT FOR ME! BEING ALIVE FOR OTHER PEOPLE IS HOW I MOVE! I ONLY THINK OF OTHERS! I ONLY THINK OF THEM! I KEEP REACHING FOR MY PERSON THEY DONT EXIST",,,,1226730361763311616,https://twitter.com/suckmydicktrump/status/1226730361763311616
2020-02-10 04:46:51,CerrillosM,serenebruise36,1,0,0,"Hmmmm. I have many 400mg seroquels calling my name. Maybe to break in half or quarters. I have alot of Abilify in me. In my butt to be precise. 8 week injections. Im not sure if i should mix the two",,,,1226729215300685824,https://twitter.com/CerrillosM/status/1226729215300685824
2020-02-10 04:14:04,NickWebb30,recoveringmochi,1,0,1,"Ah Abilify, the akathisia champion of atypical anti-psychotics... I'm surprised they didn't give you warning. I'm surprised they prescribed it to you for depression, it's definitely not first line. Usually a last ditch effort.",,,,1226720965121343488,https://twitter.com/NickWebb30/status/1226720965121343488
2020-02-10 04:10:09,recoveringmochi,NickWebb30,1,0,3,"Thank you. And Abilify gave it to me. I wasn't aware at all that it could give me this condition. I just got out of a mental health center for depression and was prescribed it. The center was pretty shitty &amp; I was glad I got out but never thought my life would get this worse lol",,,,1226719982828081152,https://twitter.com/recoveringmochi/status/1226719982828081152
2020-02-10 03:53:22,cavernsking,,2,0,4,"じust took my abilify i hope i sleep real fuckin good",,,,1226715758778048513,https://twitter.com/cavernsking/status/1226715758778048513
2020-02-10 00:56:38,bipolarbih1,RCReed40,0,0,1,"Thanks! I just started Abilify. If I don’t like it I’m gonna get back on seroquel again",,,,1226671281791172610,https://twitter.com/bipolarbih1/status/1226671281791172610
2020-02-09 22:45:36,ihaveBED,hopelesscells,0,0,0,"Me with my abilify ",,,,1226638307376807936,https://twitter.com/ihaveBED/status/1226638307376807936
2020-02-09 22:24:04,RealDooovall,,0,0,0,". November 2014: I weighed 295 pounds -- the heaviest I'd ever been. I began to gain weight in 2004 after a @UCLA psychiatrist persuaded me to take Risperdal; eventually, I switched to Abilify. Years later, I was sleeping 12 consecutive hours per day and developed diabetes. ",,@UCLA,,1226632885811261441,https://twitter.com/RealDooovall/status/1226632885811261441
2020-02-09 22:10:39,JustinTheFox13,olivebrinker,1,0,1,"Abilify helped me but made me WAY too tired. Glad to know it might be helping you!!!",,,,1226629508205289472,https://twitter.com/JustinTheFox13/status/1226629508205289472
2020-02-09 22:08:26,olivebrinker,,5,0,68,"really happy to say I’ve been feeling a lot better recently. I’m not sure if abilify is helping or if I’m just feeling good about all the exciting stuff happening in my life rn. either way, I’m feeling good!",,,,1226628951986069504,https://twitter.com/olivebrinker/status/1226628951986069504
2020-02-09 20:04:07,Clementine5000,mentalstategame,0,0,1,"It’s not technically an addictive drug. Any medication can have withdrawal side effects if not tapered properly. I’m on seroquel as well but am cross tapering to Abilify because it also functions as an add on for #OCD.",,,#OCD,1226597667872149506,https://twitter.com/Clementine5000/status/1226597667872149506
2020-02-09 19:30:24,cavernsking,,0,0,2,"literally shaking i forgot abilify also makes me stop shaking as much",,,,1226589180475695109,https://twitter.com/cavernsking/status/1226589180475695109
2020-02-09 19:28:49,AaronM,,1,1,4,"I’ve experienced akathisia (as a bad reaction to Abilify) and it’s so awful I wouldn’t even wish it on Jordan Peterson",,,,1226588784936062977,https://twitter.com/AaronM/status/1226588784936062977
2020-02-09 19:06:15,bluephoenix1347,snowkonequeenie,1,0,1,"Yeah I don’t know if it was the larissia or me going off and then back on the brand name abilify that did the “you’re now a 20 instead of a 16” for me but that is just life. I will take buying snazzy new pants over those that could get stained with period blood",,,,1226583105127043077,https://twitter.com/bluephoenix1347/status/1226583105127043077
2020-02-09 18:10:48,liiilbirdy,imapples__,1,0,3,"Might take some time for you to adjust to the meds, I’m on abilify and I used to have the same side effects for a little while. If it continues I would definitely stop taking it and see if there’s something else out there for u.",,,,1226569151713546240,https://twitter.com/liiilbirdy/status/1226569151713546240
2020-02-09 17:18:35,xajirx00,iamrobineublind,0,0,1,"Uh, it's literally a crazy leftist that just drove over a GOP-organized voter registration booth, yet you're saying it's the GOP that doesn't play fair? Have you stopped taking your Abilify or something? #TrumpSupportersAttacked #Trump2020Landslide",,,#TrumpSupportersAttacked #Trump2020Landslide,1226556008710860800,https://twitter.com/xajirx00/status/1226556008710860800
2020-02-09 17:05:20,cavernsking,,0,0,4,"ive decided to start taking my abilify at night instead of morning in an attempt to normalize my sleep habits and i have so much more energy even tho i took half my adderall dose this morning the goddamn fuck",,,,1226552674167992320,https://twitter.com/cavernsking/status/1226552674167992320
2020-02-09 15:20:23,Lutleyisms,,1,0,1,"Abilify is supposed to calm the mind but that is very much not what it's done for me. I feel restless, but not usually in an unpleasant way. I can't concentrate though; I've not gotten any real writing done while I've been on it.",,,,1226526264166535168,https://twitter.com/Lutleyisms/status/1226526264166535168
2020-02-09 09:46:00,CarolElaine,CarolElaine,0,0,1,"I no longer have that psychiatrist. Although my impatience led to me stopping Lamictal, she had been trying to get me to try Topamax from the beginning. I'm now taking Lamictal, Neurontin, Prozac & Abilify for my bipolar II, depression &amp; anxiety. As I said, doing much better. 3/",,,,1226442111429406720,https://twitter.com/CarolElaine/status/1226442111429406720
2020-02-09 07:05:59,venusbetch,KellaHannaWayne,0,0,1,"I've been running around with an untreated head injury since I was 11 (medical neglect). I begged & negotiated my way to a psychiatrist at 14 but due to nobody believing me about abuse & therefore not digging deeper, I spent 5 years on 30mg Abilify for the resulting neuro issues.",,,,1226401841405218816,https://twitter.com/venusbetch/status/1226401841405218816
2020-02-09 01:30:54,canopenner,iamAtheistGirl,0,0,0,"I'm on abilify",,,,1226317517838307328,https://twitter.com/canopenner/status/1226317517838307328
2020-02-08 23:42:50,diptychbitch,,0,0,6,"Had a brief 32 hour paranoid episode (shaking in bed in fear, yakking my brains out every 30 min) but now we’re back in business baby (shaking in bed because of adderall+abilify, looking at a painting I should be working on every 30 min).",,,,1226290319102074880,https://twitter.com/diptychbitch/status/1226290319102074880
2020-02-08 22:40:19,philopsychotic,bipolarbih1,1,0,1,"Abilify was the only drug that didn’t give me side effects!",,,,1226274586498494465,https://twitter.com/philopsychotic/status/1226274586498494465
2020-02-08 21:11:42,lesmer13,UntoNuggan,1,0,12,"For me...More Rx's=More Symptoms=More Diagnoses Finally free from 30yrs of Antidepressants/Klonopin/Abilify/Lithium/+more Just discovered #EhlersDanlos at 52...finally validating it was never #allinmyhead afterall! #zebrastrong #hEDS #POTS #mastcell #benzowithdrawal ",,,#EhlersDanlos #allinmyhead #zebrastrong #hEDS #POTS #mastcell #benzowithdrawal,1226252284855713792,https://twitter.com/lesmer13/status/1226252284855713792
2020-02-08 20:59:50,ImmanuelTyrell,BondyBlue,0,0,3,"Sis U know our weather needs the strongest dose of Abilify...Bxtch is bipolar AF. ",,,,1226249301233487872,https://twitter.com/ImmanuelTyrell/status/1226249301233487872
2020-02-08 18:09:08,moneymantrick,,0,0,0,"MAYBE I WILL TRY TO WRITE A SONG SENSE OLD DOC PUT ME ON ABILIFY I HAVENT BEEN ABLE TO USE MY CREATIVE SIDE ",,,,1226206342307696641,https://twitter.com/moneymantrick/status/1226206342307696641
2020-02-08 17:37:15,sassybworm,bipolarbih1,0,0,0,"I too just started abilify!",,,,1226198319476535296,https://twitter.com/sassybworm/status/1226198319476535296
2020-02-08 17:04:55,zero_sweetbby,rudetrashbabe,0,0,1,"I adore u too!!! Being on remeron and abilify both are making me hungry every second I’m alive so it’s rly confusing",,,,1226190181599977473,https://twitter.com/zero_sweetbby/status/1226190181599977473
2020-02-08 15:47:50,bipolarbih1,,3,0,3,"Started Abilify today and I finally got my period.",,,,1226170784097411073,https://twitter.com/bipolarbih1/status/1226170784097411073
2020-02-08 13:59:48,XoMeganAshley,,1,0,7,"Started taking abilify during the day and I can’t sleeeeeep easy enough to switch back, but it’s weird when I haven’t had insomnia in forever to suddenly sleep like I did before meds. All that to say, I don’t miss it. Thank god for meds ",,,,1226143595398217728,https://twitter.com/XoMeganAshley/status/1226143595398217728
2020-02-08 13:51:35,phoebemzeitler,olivebrinker,0,0,1,"Yep. Spoon theory-- look it up, it's exactly what you're describing. I call it ""AP"" after a similar origin. It's kind of ironic that a drug called ""abilify"" is making you more aware of when you're tired.",,,,1226141529259102210,https://twitter.com/phoebemzeitler/status/1226141529259102210
2020-02-08 13:49:10,woofmute,,0,0,1,"fuck abilify and fuck risperidone",,,,1226140921210789890,https://twitter.com/woofmute/status/1226140921210789890
2020-02-08 13:48:29,photonicDog,olivebrinker,0,2,15,"i remember being on abilify for a little bit and it really does make you need to hit the fuckin inn every day after you cast one spell of Collecting Mail or Calling Someone",,,,1226140748044783616,https://twitter.com/photonicDog/status/1226140748044783616
2020-02-08 13:45:30,olivebrinker,,3,2,100,"now that I’m on abilify: you know those games where you can only do one thing and it’ll count as your entire day, like going to a dungeon in persona? it’s like that. but instead of going to a dungeon I’m getting groceries. now morgana (my medicine) is making me lay down",,,,1226139995406290944,https://twitter.com/olivebrinker/status/1226139995406290944
2020-02-08 12:44:44,Martina1230,,0,0,1,"Dear Mother Nature, Could you please stop being bipolar and make up your mind if you want to be cold or warm? I really think your doctor needs to put you on some Abilify!",,,,1226124703103901697,https://twitter.com/Martina1230/status/1226124703103901697
2020-02-08 08:09:01,drbotmd,,0,0,0,"Hepenfin (stimulant) Used recreationally for arming Developed in 1980 to replace Abilify",,,,1226055316254711811,https://twitter.com/drbotmd/status/1226055316254711811
2020-02-08 07:51:52,toryerp,,1,0,5,"wow I thought seroquel sucked, turns out abilify is way worse for me. being a zombie &gt; a full 24 hrs of horrible nausea equivalent to food poisoning. the med change game is fucked up",,,,1226051001175724032,https://twitter.com/toryerp/status/1226051001175724032
2020-02-08 04:05:04,cavernsking,,0,0,2,"ABILIFY AND ADDERALL ARE RAGING INSIDE ME",,,,1225993926366126080,https://twitter.com/cavernsking/status/1225993926366126080
2020-02-08 03:20:26,cavernsking,,0,0,4,"every single effect of adderall is the opposite of every single effect of abilify THIS is what shakespeare meant when he said the devil and god are raging inside of me",,,,1225982694175186945,https://twitter.com/cavernsking/status/1225982694175186945
2020-02-08 00:23:01,KarenTIrby1,memorymelt1,0,0,0,"Years ago my mother was started on Abilify. She was 6-7 years into her Alzheimers diagnosis. I lived 200 miles from my parents and had no idea this had happened until I visited. My mother was exhibiting several side effects of that awful drug by that time. I had it stopped STAT ",,,,1225938046807429120,https://twitter.com/KarenTIrby1/status/1225938046807429120
2020-02-07 23:46:04,Love_From_Twits,iamAtheistGirl,1,0,1,"Careful with the abilify, my ex-sister-in-law ended up in the hospital when they switched her onto that from her regular meds.",,,,1225928745296547840,https://twitter.com/Love_From_Twits/status/1225928745296547840
2020-02-07 23:44:09,Elfosaurio,,0,0,0,"Lexapro, duloxetine, divalproex, propanolol, fluoxetine, eszopiclone, buspirone, aripiprazole, clonazepam, paliperidone, hydroxizine, escitalopram, quetiapine, bupropion, olanzapine, gabapentine... they all dont do shit The only 2 that work are abilify and alprazolam.",,,,1225928264755171330,https://twitter.com/Elfosaurio/status/1225928264755171330
2020-02-07 23:17:54,iamAtheistGirl,,8,1,16,"i went to the doctor for a klonopin refill. he added abilify. failed to send the klonopin to the pharmacy with the abilify now i’m stuck here all weekend without klonopin US healthcare ftw!",,,,1225921659397341186,https://twitter.com/iamAtheistGirl/status/1225921659397341186
2020-02-07 20:30:54,hi_its_clayton,,0,0,0,"Curious if I know anyone who is/was taking abilify along with another antidepressant and how they feel about it.",,,,1225879630822789121,https://twitter.com/hi_its_clayton/status/1225879630822789121
2020-02-07 20:18:24,morgueages,dumbxtch_69,0,0,0,"i need abilify to do this to me",,,,1225876485723938817,https://twitter.com/morgueages/status/1225876485723938817
2020-02-07 20:09:56,ChelseaScotlan1,CapScorQuarius,1,0,1,"I've been through so much, i don't mind being honest. I'm also autistic so i'm compulsively honest and forthcoming. Meds can be helpful, like atypical antipsychotics risperdal, geodon, abilify, seroquel, zyprexa. Unless u have a personality disorder, which is a bit different.",,,,1225874354279456769,https://twitter.com/ChelseaScotlan1/status/1225874354279456769
2020-02-07 16:01:09,sandrineankara,,0,0,2,"So Turkey (randomly) stopped selling Dideral. We use it with Abilify. Any idea what we can replace it with (if there's no other propranolol med available)?",,,,1225811745706520576,https://twitter.com/sandrineankara/status/1225811745706520576
2020-02-07 15:47:10,SickAnimalBot,,0,0,0,"This lizard needs Abilify!",,,,1225808227130126336,https://twitter.com/SickAnimalBot/status/1225808227130126336
2020-02-07 11:50:25,ghostykooks,,0,0,0,"abilify",,,,1225748646483726336,https://twitter.com/ghostykooks/status/1225748646483726336
2020-02-07 08:18:07,Clementine5000,,0,0,3,"Hey #bipolarclub, who is awake at 2am Central? #bipolardisorder Abilify at 5mg did jack shit. Added 100mg of seroquel. Thus begins the cross tapering.",,,#bipolarclub #bipolardisorder,1225695221251338240,https://twitter.com/Clementine5000/status/1225695221251338240
2020-02-07 06:33:48,menstrualpsycho,,0,0,9,"not me getting back on abilify after stopping cold turkey in october and finally coming to terms with the fact that I (Really) Cannot Live Without My Meds",,,,1225668966657347584,https://twitter.com/menstrualpsycho/status/1225668966657347584
2020-02-07 05:58:20,sunflwrvoI666,,0,0,0,"I miss my Abilify",,,,1225660044336713728,https://twitter.com/sunflwrvoI666/status/1225660044336713728
2020-02-07 04:37:21,varrichio_jill,57student,0,0,0,"Yes. He is on Prozac, and Abilify.",,,,1225639660837228544,https://twitter.com/varrichio_jill/status/1225639660837228544
2020-02-07 04:13:54,SHSLLuck,,1,0,17,"Will continue badposting until the combination abilify-trazodone takes me out. Think it's really sexy that I have to literally drug myself into sleep every single night btw",,,,1225633762664493056,https://twitter.com/SHSLLuck/status/1225633762664493056
