date,username,to,replies,retweets,favorites,text,geo,mentions,hashtags,id,permalink
2020-02-23 01:35:13,Clementine5000,lizzirizzobls,0,0,0,"I take gabapentin. It’s my favorite out of all my meds. My others are Clonazepam, prozac, Abilify, seroquel, and Wellbutrin.",,,,1231392031521562629,https://twitter.com/Clementine5000/status/1231392031521562629
2020-02-23 01:20:53,ImNoSaint1,BeardsleeSherri,1,1,0,"His chances w/ Joe are about up.. the Abilify ain't taking the edge off his Alzheimer's. ",,,,1231388425946832898,https://twitter.com/ImNoSaint1/status/1231388425946832898
2020-02-22 21:40:03,dajjal_dd,MichaelTeeter1,1,0,1,"Hi ! I don't suffer stress on the drug. But I don't think the stress I experienced was due to untreated schizophrenia, I think it was because my brain has become conditioned to rely on abilify. ",,,,1231332851150442496,https://twitter.com/dajjal_dd/status/1231332851150442496
2020-02-22 21:30:26,seventhhousesun,astrobydeon,2,1,11,"Lithium abuse will make you throw up everything you eat, Lamotringe abuse will give you a life threatening rash, and too much abilify will give you micro seizures.",,,,1231330433004179456,https://twitter.com/seventhhousesun/status/1231330433004179456
2020-02-22 21:27:51,dajjal_dd,jf_moore,1,0,1,"Thanks, I am stable on the drug abilify, but I dread what I will go through if I stop taking it again. I am not sure how I could gradually reduce the amount of the drug. I wish there was some advice on the matter. ",,,,1231329783021232131,https://twitter.com/dajjal_dd/status/1231329783021232131
2020-02-22 21:20:37,dajjal_dd,jf_moore,2,3,7,"I stopped taking abilify last year, and I lasted one month. At the end of it I was so stressed I had to start taking it again. Stress in itself is not a symptom of my condition of schizophrenia, so I conclude it was withdrawl symptoms. The drug makes your brain dependent on it. ",,,,1231327960956899329,https://twitter.com/dajjal_dd/status/1231327960956899329
2020-02-22 20:59:47,sluggityslug,FatsoCatso_,1,0,4,"Okay that’s true. That’s very true and i gotta remind myself. It’s hard I’m on the manic sliding to depression part of my brain cycle and it’s HARD. Hopefully this new abilify will stop it and I’ll level out",,,,1231322719074971648,https://twitter.com/sluggityslug/status/1231322719074971648
2020-02-22 20:07:48,Shnoune,,1,0,8,"Mental health update. My prescription for Abilify ran out, and I've been on it for over a year so though I could do without. I was wrong. I'll be going to get the script renewed next week.",,,,1231309637170946054,https://twitter.com/Shnoune/status/1231309637170946054
2020-02-22 20:03:15,breakupsuite,,0,0,0,"fuck u lexapro, Prozac, or abilify for fucking w my neurotransmitters",,,,1231308492348112896,https://twitter.com/breakupsuite/status/1231308492348112896
2020-02-22 19:38:52,mailbox1234567,joycicouture,0,0,0,"this was my thought process on prozac and abilify in 2017 when i got banned from sephora",,,,1231302354579812352,https://twitter.com/mailbox1234567/status/1231302354579812352
2020-02-22 18:39:10,borderlinemeow,,0,0,0,"An abilify a day keeps my feels in check yay",,,,1231287330738143232,https://twitter.com/borderlinemeow/status/1231287330738143232
2020-02-22 15:33:51,purplemoonmyst,,0,0,0,"I had forgotten what good health feels like. Seeing 1millon Drs over the past 2 years has finally paid off. Even my mental health is doing well.. I looked at my calendar and I don't have any more dr appts until March to get my Abilify shot in my ass ( that is once a month) a…",,,,1231240694636990464,https://twitter.com/purplemoonmyst/status/1231240694636990464
2020-02-22 13:16:24,MorteAmore,,0,0,3,"Why am I sleeping only 4 hrs? Please body let me sleep a full night before a work day. I know I'm getting older, and that can change your circadian rhythms, but I did 3 and a half last night. that's ridiculous. Convinced this is Abilify at work. The dosage changed",,,,1231206105633755138,https://twitter.com/MorteAmore/status/1231206105633755138
2020-02-22 12:01:53,TimClar29051149,TimClar29051149,0,0,0,"Abilify",,,,1231187352908976129,https://twitter.com/TimClar29051149/status/1231187352908976129
2020-02-22 11:18:33,GRamsbottom,,0,0,0,"A free pack of Cipralex is provided for all nerds in pre sales. Nerds in Customer Service get an Abilify boost for their Cipralex and a framed copy of the Sykes-Picot agreement. http://ramsbottom-lemieux.blogspot.com/2018/02/improved-healthcare-for-our-nerds-based.html?m=1",,,,1231176447378808834,https://twitter.com/GRamsbottom/status/1231176447378808834
2020-02-22 10:13:43,chaoz_k,EveGerbrandt,0,0,0,"My entire body aches, like I have the flu and i feel so entirely worn out but I can’t sleep. It’s misery. I never had such with Abilify. But I am currently on 100mg of Lamictal slowly increasing and it’s just rough.",,,,1231160128981938176,https://twitter.com/chaoz_k/status/1231160128981938176
2020-02-22 09:57:21,GRamsbottom,,0,0,0,"A free pack of Cipralex is provided for all nerds in pre sales. Nerds in Customer Service get an Abilify boost for their Cipralex and a framed copy of the Sykes-Picot agreement. http://ramsbottom-lemieux.blogspot.com/2018/02/improved-healthcare-for-our-nerds-based.html?m=1",,,,1231156011110731776,https://twitter.com/GRamsbottom/status/1231156011110731776
2020-02-22 08:30:06,RadioKSCR,,0,0,0,"Now Playing Abilify by Karby on http://www.radiokscr.com Listen Now! http://listen.samcloud.com/w/86676/Radio-KSCR #music onlineradio indiemusic listennow TuneIn RadioKSCR @RadioKSCR",,@RadioKSCR,#music,1231134056013799425,https://twitter.com/RadioKSCR/status/1231134056013799425
2020-02-22 07:58:52,AsheEmbers,,0,0,1,"Oh I know why, its cause you cant get addicted to hormones, but you can get addicted to welbutrin, abilify, and lamictal.",,,,1231126193501376512,https://twitter.com/AsheEmbers/status/1231126193501376512
2020-02-22 06:30:25,_flatpanda_,sluggityslug,1,0,1,"Omg it’s day 2 of abilify for me too!",,,,1231103934720200704,https://twitter.com/_flatpanda_/status/1231103934720200704
2020-02-22 06:10:44,aliahdomino,sluggityslug,2,0,2,"I loved abilify",,,,1231098979418423296,https://twitter.com/aliahdomino/status/1231098979418423296
2020-02-22 06:04:30,sluggityslug,,3,0,32,"Day 2 of abilify and I feel fine so here’s hoping day 3 and 4 are the same",,,,1231097411646324737,https://twitter.com/sluggityslug/status/1231097411646324737
2020-02-22 04:17:29,umefir,,0,0,3,"abilify works for my psychotic symptoms for 24 hours but only works for my anxiety for like 3 hours. Despicable",,,,1231070479865253888,https://twitter.com/umefir/status/1231070479865253888
2020-02-22 02:15:13,EveryKaczynski,,0,0,0,"Abilify and its consequences have been a disaster for the human race.",,,,1231039711361236992,https://twitter.com/EveryKaczynski/status/1231039711361236992
2020-02-22 02:10:57,Clementine5000,OtterlyHopeful,1,0,2,"Thank you Jess. I’m fine. I really am. My thyroid is just still messed up and I’m also cross tapering from seroquel over to Abilify.",,,,1231038636310900736,https://twitter.com/Clementine5000/status/1231038636310900736
2020-02-21 23:44:24,suprchi0dosbr0s,babuteefs,0,0,1,"I take a combo of 100 MG of Pristiq and 2 MG of Abilify. I noticed that I don’t get physical side effects like hives, or mental side effects like mania. I did experience weight gain but the only way I can explain how the meds make me feel is balanced. I feel like a “real” person",,,,1231001759100829696,https://twitter.com/suprchi0dosbr0s/status/1231001759100829696
2020-02-21 22:10:21,mymollydoll_,,0,0,0,"How do you know you’re good luck, when everyone steals clothes from you. It’s a compliment. I buy two of everything I like, I went shopping because I became 190lbs on abilify. I’m sorry I went shopping. #befrugal When trusted don’t abuse trust. ",,,#befrugal,1230978087577210880,https://twitter.com/mymollydoll_/status/1230978087577210880
2020-02-21 22:02:16,persephonetic,Papess_Sophia_C,0,0,2,"abilify hits different",,,,1230976054350827525,https://twitter.com/persephonetic/status/1230976054350827525
2020-02-21 21:23:16,lio_fotia,,0,0,2,"ok i got my 90-day supply of abilify now i’m prepared to move medication wise",,,,1230966239826206721,https://twitter.com/lio_fotia/status/1230966239826206721
2020-02-21 20:56:45,mymollydoll_,,0,0,0,"I’m 180lbs and just stopped taking #abilify, make fun of someone else’s looks I don’t deserve to be insulted based upon what I look like in photos, you’re either well or you’re not I’m not a jealous or possessive person bossy or controlling I’ve always been independent. ",,,#abilify,1230959565165875200,https://twitter.com/mymollydoll_/status/1230959565165875200
2020-02-21 20:25:23,stxfny,sabrinatmbks,0,0,1,"its called abilify",,,,1230951671326371841,https://twitter.com/stxfny/status/1230951671326371841
2020-02-21 18:22:05,MagickAscension,NickWebb30,0,1,3,"Its gotten better with time but still bothers me, all from 1 long acting injection of abilify maintena.",,,,1230920644918939648,https://twitter.com/MagickAscension/status/1230920644918939648
2020-02-21 18:21:08,grandma_groovy,GOPLeader,0,0,0,"Yeah. Unbelievable spirit and excitement when he’s snorted enough adderall. But like a zombie when his handlers give him Abilify so he can read a scripted speech in a monotone.",,,,1230920405843574789,https://twitter.com/grandma_groovy/status/1230920405843574789
2020-02-21 17:50:15,ariConference,,0,0,2,"""Aripiprazole, marketed as Abilify, is widely thought to be safer than risperidone, the only other drug approved for use in autistic children. A decade’s worth of data suggests that is not true."" ",,,,1230912632179187712,https://twitter.com/ariConference/status/1230912632179187712
2020-02-21 16:56:17,Sage_969,mothernuggett,1,0,0,"I've been given I tried Ciriquel Abilify zyprexa zoloft Leponex &amp; so many more I seemed to be a test subject",,,,1230899049605234688,https://twitter.com/Sage_969/status/1230899049605234688
2020-02-21 15:59:22,dogdownloader,,1,0,1,"do any of u guys take abilify?? my doctor thinks i shoukld go on it but idk anything abt it loll",,,,1230884727068020736,https://twitter.com/dogdownloader/status/1230884727068020736
2020-02-21 14:02:45,AutisticTHCdad,,0,0,0,"Imagine if I actually started taking the abilify without question. Doctors enjoy prescription drugs too much. Even when they know its dangerous, they chose it over THC. Who will ever think of the fucking children. THC IS THE FUCKING CURE.",,,,1230855380194021382,https://twitter.com/AutisticTHCdad/status/1230855380194021382
2020-02-21 12:58:57,GirlHabb,dabigbadalex,0,0,0,"Abilify is awful! I’m on Effexor too and If I don’t take Effexor for one night I start to get mini black outs. It’s crazy ",,,,1230839322804273152,https://twitter.com/GirlHabb/status/1230839322804273152
2020-02-21 12:51:18,blicksflicks,,0,0,2,"@realDonaldTrump, I'm a schizophrenic who takes shots of Abilify every 2 months. It's expensive medication, but SSI pays for it. You won't take my SSI in your second term will you? I plan on voting for you on November 2020. #KAG2020Landslide #GeorgiaForTrump",,@realDonaldTrump,#KAG2020Landslide #GeorgiaForTrump,1230837398529028096,https://twitter.com/blicksflicks/status/1230837398529028096
2020-02-21 12:39:58,blicksflicks,,0,0,0,"@POTUS, Mr. President Trump, I'm a schizophrenic who takes shots of Abilify every two months. It's expensive medication, but I'm on SSI that pays for it. You won't take my SSI away in your second term will you? I plan on voting for you in 2020. I still would.",,@POTUS,,1230834546721140736,https://twitter.com/blicksflicks/status/1230834546721140736
2020-02-21 10:40:32,pash22,,0,2,2,"Aripiprazole, marketed as Abilify, is widely thought to be safer than risperidone, the only other drug approved for use in autistic children: A decade’s worth of data suggests that is not true. http://www.spectrumnews.org/features/deep-dive/the-rise-of-aripiprazole/ via @Spectrum &amp; @HannahFurfaro",,@Spectrum @HannahFurfaro,,1230804490581921793,https://twitter.com/pash22/status/1230804490581921793
2020-02-21 03:56:54,ap_ycm,,0,1,6,"Oxcarbazepine Guanfacine Lorazepam Clonazepam Lithium Latuda Seroquel Abilify Cetalipam Escitalipam Adderal Risperidone Venlafaxine Depakote .... all in the past 24 months like bro I am not a fucking LAB RAT",,,,1230702914785595393,https://twitter.com/ap_ycm/status/1230702914785595393
2020-02-21 02:50:23,gingerb0nes,,0,0,1,"So my doctors apt went to shit kinda today but overall they prescribed me abilify to take alongside the cipralex so we shall see ?????????",,,,1230686172508233729,https://twitter.com/gingerb0nes/status/1230686172508233729
2020-02-21 02:42:32,mymollydoll_,,0,0,0,"I recently stopped taking Abilify.",,,,1230684197678772230,https://twitter.com/mymollydoll_/status/1230684197678772230
2020-02-21 01:59:47,meltyalamode,,1,0,1,"like 30 mins after taking it, i'd get this random feeling of. optimism? contentment? like i just suddenly felt Good & i realized that it was bc abilify's an antipsychotic &amp; was literally jsut balancing out my dopamine levels (bc mine are thru the fuckin roof)",,,,1230673441675759617,https://twitter.com/meltyalamode/status/1230673441675759617
2020-02-21 01:59:47,meltyalamode,,1,0,1,"out of all the psychiatric meds i've been on, abilify was absolutely the weirdest bc i could literally Feel it messing w my dopamine receptors",,,,1230673441059168259,https://twitter.com/meltyalamode/status/1230673441059168259
2020-02-21 01:21:45,BogartMcJoint,,1,0,1,"Wonder what my life would be like if I had actually trusted my gp’s 10 min assessment and taken that abilify lmao",,,,1230663868671758337,https://twitter.com/BogartMcJoint/status/1230663868671758337
2020-02-21 00:59:17,HopefulTears,,0,0,0,"Day 2 of Abilify: 2nd night in a row where I barely slept and I can't concentrate on my homework at all. Here's hoping it gets better.",,,,1230658215353954310,https://twitter.com/HopefulTears/status/1230658215353954310
2020-02-21 00:27:02,jeannie_412,nakedpastor,0,0,1,"Maybe when Biblical writers wrote about demons, they didn't mean disabilities, but mental illness? Severe mental illness can be debilitating without meds. And since Jesus didn't have alprazolam or Abilify, he just healed them, and people assumed ""Oh he cast out their demons"" ",,,,1230650098952044549,https://twitter.com/jeannie_412/status/1230650098952044549
2020-02-20 23:36:35,WhalesJose,tsmit103,2,0,1,"I noticed Trump's eyes too. What kind of drugs is he taking? Anti-psychotic to treat his Delusions of Grandeur? 2nd Generation, Abilify or Clozapine? Side Effects: Tardive Dyskinesia, movement disorder. Your facial, tongue, &amp; neck muscles move uncontrollably. Sound familiar?",,,,1230637404085719040,https://twitter.com/WhalesJose/status/1230637404085719040
2020-02-20 22:59:41,FebruaryGrace,mattbc,0,0,1,"I had an allergic reaction to Rexulti even though I had been taking Abilify for years. Doctor was baffled. Can’t afford brand Abilify, so I take a generic I swear is utterly useless. They stopped making the only generic that felt effective. Pharmacy sells what they get cheapest.",,,,1230628118131552257,https://twitter.com/FebruaryGrace/status/1230628118131552257
2020-02-20 21:07:34,hazeldouggie,dylanmcfarty,1,0,1,"omg i have ocd and my doctor recommended abilify for me and i only remember because she was so weirdly persistent about it. like she wouldnt stop bringing it up and talking about how amazing it was",,,,1230599901714800650,https://twitter.com/hazeldouggie/status/1230599901714800650
2020-02-20 19:27:33,dylanmcfarty,,2,0,2,"realized im not bipolar and there’s def something sketch with how much doctors are pushing abilify...",,,,1230574729137967105,https://twitter.com/dylanmcfarty/status/1230574729137967105
2020-02-20 17:59:44,SidewinderMedia,,0,1,1,"I am excited to have been invited to #WPPI this year to work with #Canon. I will be doing the camera side of things this time rather than the gaming/streaming as #Abilify as I did in #CES2020. Are you going to be there? If so please come and say hello at the Canon booth!",,,#WPPI #Canon #Abilify #CES2020,1230552629291278337,https://twitter.com/SidewinderMedia/status/1230552629291278337
2020-02-20 17:00:02,carebearfluff,allythe_cat,1,0,1,"abilify,,,, youm r so quoot",,,,1230537605558697984,https://twitter.com/carebearfluff/status/1230537605558697984
2020-02-20 16:59:19,d_dipalermo,,0,0,0,"Smoking ABILIFY ",,,,1230537426294145024,https://twitter.com/d_dipalermo/status/1230537426294145024
2020-02-20 16:45:31,twinfxntasy,,0,0,2,"hey quick question who lied to me saying abilify had withdrawal symptoms bc all ive felt aince cold turkeying is - not pathetically tired all the time - actual happiness - motivation to get out of bed maybe i Was just in a depressive episode wow",,,,1230533954375225344,https://twitter.com/twinfxntasy/status/1230533954375225344
2020-02-20 15:33:10,SidewinderMedia,,0,0,0,"Season 2 is live! YouTube Filming... #fortnite #season2 #youtube #twitch #abilify #sidewindermedia",,,#fortnite #season2 #youtube #twitch #abilify #sidewindermedia,1230515748113612802,https://twitter.com/SidewinderMedia/status/1230515748113612802
2020-02-20 12:31:59,bipolarbih1,,0,0,0,"Idk if it’s the abilify or my eating habits that are causing this stomach pain and nausea",,,,1230470150178168832,https://twitter.com/bipolarbih1/status/1230470150178168832
2020-02-20 11:45:37,KamenLovesYou,,0,0,0,"Ah that abilify shot she really jabbed that thing in there",,,,1230458480743657474,https://twitter.com/KamenLovesYou/status/1230458480743657474
2020-02-20 11:05:58,DuncanJamisonJ,,0,1,0,"https://youtu.be/KRZUAxiDuWg #mentalhealthawareness I was diagnosed with schizophrenia back in like 201x. I have an overactive imagination that sometimes gets me angry. #Christianpsychiatry I take abilify when needed. I'm a Taurus. #astrology #aesthetics",,,#mentalhealthawareness #Christianpsychiatry #astrology #aesthetics,1230448502821543942,https://twitter.com/DuncanJamisonJ/status/1230448502821543942
2020-02-20 10:07:33,annmarcos1,StuartMcCarthy_,0,0,9,"Why is it out of control? The next opioid, benzo, AD crisis. I think antipsychotics off label are replacing AD what a fucking disaster that is/will bring. Where are the regulators? Hello! Abilify also marketed as an antidepressants. 10-20yrs knock off your life guaranteed. ",,,,1230433803165892608,https://twitter.com/annmarcos1/status/1230433803165892608
2020-02-20 06:57:41,DarkFloatingCat,,1,0,1,"was no one gonna tell me that abilify can increase suicidal thoughts??",,,,1230386022103605248,https://twitter.com/DarkFloatingCat/status/1230386022103605248
2020-02-20 02:54:46,borderlinemeow,borderlinemeow,0,0,0,"Update abilify is working wonderfully. Bless mood stabilizers and antipsychotics ",,,,1230324889619320833,https://twitter.com/borderlinemeow/status/1230324889619320833
2020-02-20 02:19:54,sluggityslug,,0,0,11,"Mad at my doctor. They filled my abilify rx b4 my drug panel. AND they filled my vraylar and mailed both to me today and charged me for both. I do not take vraylar. They even called me THIS MORNING to verify abilify was all i was on &amp; I said Im not taking it till after my panel",,,,1230316115873525760,https://twitter.com/sluggityslug/status/1230316115873525760
2020-02-20 00:16:39,mcampnh,SpicyDong2,0,0,4,"this emotion is why i have to take abilify ",,,,1230285096571166720,https://twitter.com/mcampnh/status/1230285096571166720
2020-02-20 00:00:55,Spectrum,,0,4,5,"Aripiprazole, marketed as Abilify, is widely thought to be safer than risperidone, the only other drug approved for use in autistic children. A decade’s worth of data suggests that's not true. #SpectrumDeepDive",,,#SpectrumDeepDive,1230281137517465601,https://twitter.com/Spectrum/status/1230281137517465601
2020-02-19 22:53:18,Dragonl33149697,TheAnonNetwork,0,0,0,"Sounds like in hospital when they say u can't leave unless we shoot u full of ability abilify ",,,,1230264119854600193,https://twitter.com/Dragonl33149697/status/1230264119854600193
2020-02-19 22:18:10,Clementine5000,EromenaJ,1,0,1,"Thank you. It’s mostly my OCD and anxiety that are kind of through the roof. I’ve not had any side effects with the abilify so I think I should be able to go up pretty quickly.",,,,1230255282250539008,https://twitter.com/Clementine5000/status/1230255282250539008
2020-02-19 22:14:00,DrEvgenyLegedin,JeremyM72014840,2,5,6,"An advertising budget of $2.4 billion per year spent on Quetiapine (Seroquel) and Aripiprazole (Abilify) has put these neuroleptics to 5th and 6th place as revenue producers among all drugs in the US.",,,,1230254230482685953,https://twitter.com/DrEvgenyLegedin/status/1230254230482685953
2020-02-19 21:31:27,morgueages,,2,0,1,"genuinely mind-blowing to me that ppl are out there taking 15x as much abilify as me... how the fuck do you wake up",,,,1230243523451965440,https://twitter.com/morgueages/status/1230243523451965440
2020-02-19 20:21:00,HannahFurfaro,,1,1,7,"I'm grateful to the families who shared their stories, and to the clinicians who offered perspective on how Abilify affects children they treat. Big thx to @Spectrum editors, fact-checkers + staff who created a data viz that illustrates the drug's side effects.",,@Spectrum,,1230225795303403520,https://twitter.com/HannahFurfaro/status/1230225795303403520
2020-02-19 20:21:00,HannahFurfaro,,1,0,2,"Abilify has been one of the top-grossing drugs in the U.S., and was prescribed to 500K+ children between 2014 and 2016. Some evidence suggests it's linked to side effects that aren't on the drug's label, including heart problems. There's no evidence it works long-term. 2/",,,,1230225792988135425,https://twitter.com/HannahFurfaro/status/1230225792988135425
2020-02-19 20:20:59,HannahFurfaro,,2,9,19,"The last story I wrote as a reporter @Spectrum is live. We took a close look at the antipsychotic Abilify, which is widely thought to be safer than the only other drug approved for autistic children. A decade’s worth of data suggests that isn't true: https://www.spectrumnews.org/features/deep-dive/the-rise-of-aripiprazole/ 1/",,@Spectrum,,1230225791809490945,https://twitter.com/HannahFurfaro/status/1230225791809490945
2020-02-19 19:55:16,PeterNHess,,0,1,5,"""The drug, marketed as Abilify, initially had a reputation of having fewer side effects than risperidone, its only competitor in this population. But a decade’s worth of data suggest that is untrue."" https://www.spectrumnews.org/features/deep-dive/the-rise-of-aripiprazole/ via @Spectrum",,@Spectrum,,1230219317863702529,https://twitter.com/PeterNHess/status/1230219317863702529
2020-02-19 19:10:33,doggyhellSIRA,,0,0,0,"In need of an abilify",,,,1230208063245709312,https://twitter.com/doggyhellSIRA/status/1230208063245709312
2020-02-19 17:10:52,ChetcutiMark,,0,0,0,"Thank you @CMHAPeelDuff for ordering me a taxi today so that I could go to the Trillium Healthcare Creditvalley Hospital to see my psychiatrist and get my Abilify injection from nurse Sandra!",,@CMHAPeelDuff,,1230177946016583680,https://twitter.com/ChetcutiMark/status/1230177946016583680
2020-02-19 13:31:06,Clementine5000,,3,0,15,"Can’t go to psychiatrist appointment today. Didn’t sleep enough to drive. Talked on phone and she’s raising Abilify to 15mg. Will probably keep going up until I get to 30mg, I suspect. That’s okay. Just want something to work. #bipolar #bipolarclub",,,#bipolar #bipolarclub,1230122639538245632,https://twitter.com/Clementine5000/status/1230122639538245632
2020-02-19 11:58:04,CRach48780140,johnnydollar01,0,0,0,"Lots of people who have no lives watch stupid TV, brought to you by Abilify and legalzoom.",,,,1230099227688099840,https://twitter.com/CRach48780140/status/1230099227688099840
2020-02-19 09:02:38,vaporwavehello,nikocadoavocado,0,0,0,"abilify",,,,1230055076397568000,https://twitter.com/vaporwavehello/status/1230055076397568000
2020-02-19 05:09:16,laditonka,omeretta4l,0,0,0,"I’m talm bout stoopid RETAREDED , not even a 250MG of #Abilify or #Zoloft can help w my craziness ",,,#Abilify #Zoloft,1229996349782884352,https://twitter.com/laditonka/status/1229996349782884352
2020-02-19 05:04:09,sluggityslug,tessiibil,0,0,2,"Good to know. That sounds like a substitute for my abilify",,,,1229995062764789760,https://twitter.com/sluggityslug/status/1229995062764789760
2020-02-19 04:15:31,MysticalMeadow,ada_sellers,1,0,0,"Ah. Word. Abilify has been good for me so far.",,,,1229982821114093569,https://twitter.com/MysticalMeadow/status/1229982821114093569
2020-02-19 01:06:39,anajpg_,ppo158,0,0,0,"abilify* ",,,,1229935294092390400,https://twitter.com/anajpg_/status/1229935294092390400
2020-02-19 00:36:59,RadioKSCR,,0,0,0,"Now Playing Abilify by Karby on http://www.radiokscr.com Listen Now! http://listen.samcloud.com/w/86676/Radio-KSCR #music onlineradio indiemusic listennow TuneIn RadioKSCR @RadioKSCR",,@RadioKSCR,#music,1229927825790111744,https://twitter.com/RadioKSCR/status/1229927825790111744
2020-02-19 00:33:41,Clementine5000,,2,0,5,"Hey #bipolar friends: are any of you on two atypical antipsychotics? I was supposed to cross taper to get off of seroquel onto abilify, but I’m pretty sure I’ll end up staying on both. #bipolarclub #CPTSD #OCD #MentalHealthAwareness #mentalhealth",,,#bipolar #bipolarclub #CPTSD #OCD #MentalHealthAwareness #mentalhealth,1229926994877538307,https://twitter.com/Clementine5000/status/1229926994877538307
2020-02-18 22:56:43,SchizoScientist,MentalSnapback,0,0,1,"I'm switching over to Abilify, which made me really sleepy and caused me to gain weight the last time I was on it but fingers crossed it works better with me this time around!",,,,1229902593549373441,https://twitter.com/SchizoScientist/status/1229902593549373441
