date,username,to,replies,retweets,favorites,text,geo,mentions,hashtags,id,permalink
2020-03-04 18:45:00,RebeccaEstherxo,RebeccaEstherxo,0,0,0,"A short thread from last night about augmenting my other mental health meds with Abilify. #MentalHealth",,,#MentalHealth,1235275066889441280,https://twitter.com/RebeccaEstherxo/status/1235275066889441280
2020-03-04 18:08:19,VegasOnAciid,,0,0,0,"Abilify gives me back pains fuck",,,,1235265835075350528,https://twitter.com/VegasOnAciid/status/1235265835075350528
2020-03-04 16:11:29,JonEntine,,0,1,0,"Once promising autism drug Abilify linked to heart problems, substantial weight gains ",,,,1235236432756776960,https://twitter.com/JonEntine/status/1235236432756776960
2020-03-04 16:08:30,morgueages,,0,0,7,"and on the eighth day god created abilify",,,,1235235682605506561,https://twitter.com/morgueages/status/1235235682605506561
2020-03-04 15:32:37,Justicia702,marklevinshow,0,0,2,"Right @marklevinshow. They made Trump jump on a scale, get his blood pressure, heart rate, respiratory rate, caliper test, temperature, colonoscopy....and here's Joe with a demented brain and not a word about it. At least they could suggest Abilify to make it look less biased!",,@marklevinshow,,1235226648812781568,https://twitter.com/Justicia702/status/1235226648812781568
2020-03-04 15:26:31,Justicia702,realDonaldTrump,0,0,0,"The Dimwitcrats disagree because they are sticking up for the deceitful, shitty, dirty way they play. They stuck up for the DNC when they played dirty with @POTUS too. Their candidate is Biden. He has dementia and needs Abilify. Killary may be his VP. The most crooked Dem of all",,@POTUS,,1235225114288869378,https://twitter.com/Justicia702/status/1235225114288869378
2020-03-04 15:24:10,Justicia702,LATiffani1,0,0,0,"On point Tiff! Poor Joe probably doesn't even realize he won or for what seat! I have 1 word for Joe...Abilify!",,,,1235224524456484865,https://twitter.com/Justicia702/status/1235224524456484865
2020-03-04 13:57:53,amelianewburg,,1,0,5,"- abilify weight I can't lose - missing my friends - people who oppose student debt relief because they paid their student loans - people who oppose debt-free college because they ""made better choices"" - people who oppose socialized health care because who knows why 4/?",,,,1235202808095232000,https://twitter.com/amelianewburg/status/1235202808095232000
2020-03-04 13:30:05,SciSeekFeed,,0,1,0,"Hannah Furfaro: Once promising autism drug Abilify linked to heart problems, substantial weight gains https://buff.ly/39lDeLq",,,,1235195812906438656,https://twitter.com/SciSeekFeed/status/1235195812906438656
2020-03-04 13:07:03,WTEpaminondas,reason,0,0,1,"Yes. Sure. Nice Bill. Good Bill. Here is your Abilify. Bill ",,,,1235190015874998272,https://twitter.com/WTEpaminondas/status/1235190015874998272
2020-03-04 12:16:36,drbotmd,,0,0,0,"Lurapivarane (psychedelic) Prescribed for antiarrhythmic discontinuation syndrome Contraindicated by Abilify",,,,1235177319649685504,https://twitter.com/drbotmd/status/1235177319649685504
2020-03-04 08:55:02,RebeccaEstherxo,,0,0,0,"If you have OCD, have you tried Abilify? I'd love to know what your experience was/is if you're keen to share #ActuallyOCD #MentalHealth #AnxietyFeelsLike",,,#ActuallyOCD #MentalHealth #AnxietyFeelsLike,1235126595410681856,https://twitter.com/RebeccaEstherxo/status/1235126595410681856
2020-03-04 08:52:27,RebeccaEstherxo,,1,0,0,"But: DOES IT HELP? With sleep: Very much. I've always had a lot of trouble falling asleep, because of insomnia and anxious and obsessive thoughts. Abilify is a game changer in this regard and has been since the second day or so. #ActuallyOCD",,,#ActuallyOCD,1235125945905950726,https://twitter.com/RebeccaEstherxo/status/1235125945905950726
2020-03-04 08:46:12,RebeccaEstherxo,,1,0,0,"Adjusting to high-ish dose Topiramate for OCD was a breeze (mostly). Adding Abilify as been a wild ride (I'm on other meds for #MentalHealth but these are the only ones specifically for my OCD)",,,#MentalHealth,1235124372433711104,https://twitter.com/RebeccaEstherxo/status/1235124372433711104
2020-03-04 07:44:45,mallekadalov,,0,0,0,"Feel my abilify withdrawal wrath",,,,1235108907028111360,https://twitter.com/mallekadalov/status/1235108907028111360
2020-03-04 06:21:16,Justicia702,ScottPresler,0,0,0,"I have 1 word for Joe....Abilify!",,,,1235087898489155589,https://twitter.com/Justicia702/status/1235087898489155589
2020-03-04 05:17:10,ayyygender,,1,0,1,"i didn't have panic attacks until i started abilify :/ even though i've been off them since dec, i'm still having attacks,,,,homophobic",,,,1235071768215212032,https://twitter.com/ayyygender/status/1235071768215212032
2020-03-04 04:58:44,yowaisan,tumblrhatemail,1,0,1,"abilify is the worst it made me stupid",,,,1235067129839439872,https://twitter.com/yowaisan/status/1235067129839439872
2020-03-04 04:27:38,dumpsterking613,,0,0,0,"*aggressively shakes abilify prescription* please don't make me vote for Joe Biden",,,,1235059299732213765,https://twitter.com/dumpsterking613/status/1235059299732213765
2020-03-04 01:07:37,bloatedkoala,EzariaC,0,0,2,"It's from an SNL sketch about abilify, the pills that can makes you realize not everybody can become president",,,,1235008966964342784,https://twitter.com/bloatedkoala/status/1235008966964342784
2020-03-04 00:35:43,hopelessonelost,,0,0,5,"Hubs took Abilify for a little over a week and stopped it today as the side effects were too much for him. The crash is hard. And painful. For us both.",,,,1235000938370232320,https://twitter.com/hopelessonelost/status/1235000938370232320
2020-03-03 23:55:20,JustBruniWight,,0,0,1,"Hmmm i think abilify is fucking my stomach over.",,,,1234990773189242880,https://twitter.com/JustBruniWight/status/1234990773189242880
2020-03-03 23:26:04,amaeranth,,0,0,0,"I didn’t take abilify last night and I’ve never felt so human before",,,,1234983409681719298,https://twitter.com/amaeranth/status/1234983409681719298
2020-03-03 20:16:04,foolshollieday,_wildflowerhigh,1,0,1,"Hello, I take abilify! Injections and orally dm me if you need any advice xx",,,,1234935596860067840,https://twitter.com/foolshollieday/status/1234935596860067840
2020-03-03 20:14:34,_wildflowerhigh,,4,0,3,"Hey Hello,do any of you take abilify? have you experienced significant weight gain from it? is it easy to combat?",,,,1234935217531629568,https://twitter.com/_wildflowerhigh/status/1234935217531629568
2020-03-03 19:27:23,ilovesexwork,,0,0,0,"feel like my lifes actually working out shoutout #abilify",,,#abilify,1234923342517428225,https://twitter.com/ilovesexwork/status/1234923342517428225
2020-03-03 19:23:35,Conscience_Abe,BlancaCamachoNY,1,0,0,"Doc called, your Abilify prescription is ready.",,,,1234922388011261957,https://twitter.com/Conscience_Abe/status/1234922388011261957
2020-03-03 17:58:29,laurennus,,0,0,2,"Day 4 without Abilify: I felt a drop of rain on my back and it was like God was crying with me #depression #bipolar #Abilify",,,#depression #bipolar #Abilify,1234900972775800835,https://twitter.com/laurennus/status/1234900972775800835
2020-03-03 17:26:48,comradexuxi,,0,0,0,"Abilify is a trash ass antipsychotic. That shit don't work",,,,1234892998963580929,https://twitter.com/comradexuxi/status/1234892998963580929
2020-03-03 16:29:16,Bipolaronfire,gnewfry,0,0,1,"Well abilify makes your cholesterol high but I have been eating like a health nut",,,,1234878517717995521,https://twitter.com/Bipolaronfire/status/1234878517717995521
2020-03-03 15:32:14,panzer_dan,vickorano,1,1,3,"That sounds rough man. My experience with Akathisia was enough to make me go to my doctor and demand something else though I think my dosage of abilify was reduced and that was enough. some of these medicines seem like they have side effects nearly as bad as what they're for",,,,1234864165329788930,https://twitter.com/panzer_dan/status/1234864165329788930
2020-03-03 14:12:19,PsalmOfSin,SecretBaboon,1,0,0,"Yeah, I'm trying. Got put on Abilify but it was torturous. Working on alternatives.",,,,1234844056150085632,https://twitter.com/PsalmOfSin/status/1234844056150085632
2020-03-03 14:06:15,Justicia702,johncardillo,0,0,1,"I have 1 word for Dementia Joe....Abilify!",,,,1234842528739840000,https://twitter.com/Justicia702/status/1234842528739840000
2020-03-03 14:00:03,triistesaaa,,0,0,0,"Abilify hate gang where you at",,,,1234840965996634116,https://twitter.com/triistesaaa/status/1234840965996634116
2020-03-03 13:31:37,bones_dietcokes,,1,0,3,"why is my psychiatrist actually super hot tho like yessir, tell me all about abilify,, mmm that’s so sexi",,,,1234833811751555072,https://twitter.com/bones_dietcokes/status/1234833811751555072
2020-03-03 12:43:42,Dragonl33149697,,0,0,0,"N a shot of abilify",,,,1234821752456450048,https://twitter.com/Dragonl33149697/status/1234821752456450048
2020-03-03 08:33:27,Rawr_Ebooks,,0,0,0,"The furries are hopeless. that's Not How that song goes: I Have No abilify Because she doesn't know why people keep looking at her and what",,,,1234758775116050432,https://twitter.com/Rawr_Ebooks/status/1234758775116050432
2020-03-03 03:02:53,gikjones,AutismHoodjay,0,0,3,"Mine had major meltdowns involving headaches, kicking, scratching. Finally went to a neurologist. She had me stop the adult vitamins (as was directed by a diff doc). She then prescribed Abilify. He’s so much better. We also think he has histamine issues too. Reduce them.",,,,1234675586196361217,https://twitter.com/gikjones/status/1234675586196361217
2020-03-03 02:14:46,bones_dietcokes,,0,0,1,"i’m gonna be taking clonazepam for 2 weeks and then abilify as my mood stabilizer and i’m highkey terrified it’s going to make me gain weight but the psychiatrist promised me it’s one of the most weight neutral anti-psychotics they have ",,,,1234663478989750278,https://twitter.com/bones_dietcokes/status/1234663478989750278
2020-03-03 02:01:48,ImNoSaint1,JustMePammy,1,1,1,"At least double his dose of Abilify..",,,,1234660215380828162,https://twitter.com/ImNoSaint1/status/1234660215380828162
2020-03-03 01:40:30,PresTrump4ever1,,0,0,1,"I think it’s time for @JoeBiden’s doctor to up his Abilify dosage!",,@JoeBiden,,1234654854838013952,https://twitter.com/PresTrump4ever1/status/1234654854838013952
2020-03-03 00:37:33,crazEDqueen_,112lbs,0,0,1,"Also lost a bunch going off abilify last week actually",,,,1234639012935106560,https://twitter.com/crazEDqueen_/status/1234639012935106560
2020-03-03 00:29:27,Justicia702,PalmerReport,0,0,0," Afraid of dementia Joe? POTUS Trump is going to hand him a new asshole! Corn pop had better dose up on Abilify to debate with our president! He's going to be forgetful, stammering and stuttering all the way to a Trump victory!",,,,1234636973014274048,https://twitter.com/Justicia702/status/1234636973014274048
2020-03-03 00:28:24,112lbs,crazEDqueen_,1,0,0,"Ehh. I did stop taking Abilify, though. Switched to lithium. That helped.",,,,1234636709318533120,https://twitter.com/112lbs/status/1234636709318533120
2020-03-03 00:20:13,RaulDuke18,IANfidance,0,0,0,"i had the same issue with abilify years ago. I choose to treat my depression by cumming and smoking weed now. Some of that shits real nasty it also made me almost unable to do simple math in my head.",,,,1234634650942873601,https://twitter.com/RaulDuke18/status/1234634650942873601
2020-03-02 21:04:30,AbbeyMikha,,0,0,0,"I’m taking 9 MG of Invega right now and 5 MG of Abilify because my doctor is switching me over to Abilify. He’s gradually increasing the medication. Lately I’ve felt my heart fluttering or beating a little faster. I am going to ask my doctor about that…",,,,1234585395758845955,https://twitter.com/AbbeyMikha/status/1234585395758845955
2020-03-02 20:26:26,hobittae,taehyunggay420,0,0,1,"sorry if you don’t want responses to this bUT I HATE ABILIFY SO MUCH",,,,1234575814936711174,https://twitter.com/hobittae/status/1234575814936711174
2020-03-02 20:23:57,gingerb0nes,,0,0,0,"I thought abilify was supposed to make me NOT rage",,,,1234575189297508352,https://twitter.com/gingerb0nes/status/1234575189297508352
2020-03-02 19:11:25,2020fixion,,0,0,0,"I currently take Abilify to stabilize my degenerative neurological disorder. It's the least damaging antipsychotic on the market with almost no visible negative symptomology, and no constant blood testing required. I don't know how bad it is, they are all bad really.",,,,1234556937259208704,https://twitter.com/2020fixion/status/1234556937259208704
2020-03-02 18:57:30,deSaintPhalle,CANCEL_SAM,0,1,3,"Andrew took it. Pete took it. Amy Andrew took it. Pete took it. Any took it. If only Liz would take “Abilify For Candidates” !!! ",,,,1234553436231913475,https://twitter.com/deSaintPhalle/status/1234553436231913475
2020-03-02 18:12:17,Altostrata,,0,1,1,"""Drug history: various SSRIs (all of which made me much worse), Seroquel, Olanzapine, Abilify, Trazedone, Remeron, Gabapentin, Lyrica, klonopin.... #Antidepressants ramped up my anxiety to crazy levels...."" Eventually, ECT. FOR ADVERSE DRUG REACTIONS!!!!",,,#Antidepressants,1234542055482806272,https://twitter.com/Altostrata/status/1234542055482806272
2020-03-02 16:14:50,ardeetootoo,MagsVisaggs,1,0,1,"I get my HRT from Richie. He told me it was okay to stop hormones when I saw him Thursday. I also saw my psychiatrist, Dr. Nik, on Thursday. He's the one who prescribed my Effexor and Abilify.",,,,1234512500592455681,https://twitter.com/ardeetootoo/status/1234512500592455681
2020-03-02 14:53:06,Justicia702,robreiner,0,0,2,"I see a man with dementia who needs Abilify",,,,1234491928420454405,https://twitter.com/Justicia702/status/1234491928420454405
2020-03-02 14:35:31,MagsVisaggs,MagsVisaggs,1,0,0,"Abilify isn't a primary antidepressant, though, so that feels like an odd choice for me. It's primarily an antipsychotic used to treat bipolar and schizophrenia (unless you are bipolar or schizophrenic in which case ignore me)",,,,1234487506156040192,https://twitter.com/MagsVisaggs/status/1234487506156040192
2020-03-02 14:30:25,ardeetootoo,MagsVisaggs,0,0,0,"Side effect of what? Abilify or HRT withdrawal? I don't remember jitters the last time I was on Abilify.",,,,1234486222690672641,https://twitter.com/ardeetootoo/status/1234486222690672641
2020-03-02 14:11:59,MagsVisaggs,ardeetootoo,1,0,1,"Maybe get back on it, just so you have a control? like, you cant know if its the abilify or stopping HRT if you do both at the same time. (of course, DISCUSS WITH YOUR DOCTOR before you change anything)",,,,1234481582989246464,https://twitter.com/MagsVisaggs/status/1234481582989246464
2020-03-02 14:10:40,curehime,,1,0,1,"what does abilify even do like chemically",,,,1234481250615930880,https://twitter.com/curehime/status/1234481250615930880
2020-03-02 14:02:18,ardeetootoo,ardeetootoo,1,0,0,"And yeah I probably should have done one at a time. But I didn't know I would be getting Abilify on Thursday. I had already stopped the spiro and progesterone for a day when I saw my doctor.",,,,1234479146337808385,https://twitter.com/ardeetootoo/status/1234479146337808385
2020-03-02 12:43:07,recoveringmochi,harrietKay5,2,0,3,"I was on abilify for about 3 weeks. I stopped taking it like 4 weeks ago and started taking propranolol to help with the symptoms",,,,1234459216800288769,https://twitter.com/recoveringmochi/status/1234459216800288769
2020-03-02 11:42:57,sapphichepburn,sapphichepburn,1,0,18,"Just a little backstory I was 16 and my meds (abilify) gave me gallstones, and my doctor never really told me ""hey btw just a heads up-"" so yeah if anyone is on abilify one of the side effects is gallstones. But it's a rare side effect and only like effects?? 1%??",,,,1234444079162961920,https://twitter.com/sapphichepburn/status/1234444079162961920
2020-03-02 09:07:25,lastdaymust,,0,0,0,"I took abilify and now I've got some really bad intestinal cramping. Is this expected?",,,,1234404934214455297,https://twitter.com/lastdaymust/status/1234404934214455297
2020-03-02 08:40:12,luvmelodys,,0,0,0,"me: why do i keep staying up until 4am every night also me: ah yes abilify causes drowsiness but also insomnia!",,,,1234398085650014208,https://twitter.com/luvmelodys/status/1234398085650014208
2020-03-02 03:41:01,meatcIown,,0,0,0,"anyways. abilify has made me eat again but i am also so exhausted from the smallest amount of social interaction and i hit my own head until i bruise or bleed and impulsively cut my body apart with any shiny thing i can find",,,,1234322793103155200,https://twitter.com/meatcIown/status/1234322793103155200
2020-03-02 02:53:58,caedmonofficial,ambernoelle,1,0,3,"I am. And Abilify. And Wellbutrin",,,,1234310952058638336,https://twitter.com/caedmonofficial/status/1234310952058638336
2020-03-01 23:44:26,terminalgrain,skeletonpup,1,0,1,"i didn’t have the urge to steal on wellbutrin it just made me have seizures LMAO but abilify activated the urge to steal for me",,,,1234263258418352128,https://twitter.com/terminalgrain/status/1234263258418352128
2020-03-01 23:04:39,PieSigma,BernieWon2016,1,0,1,"I currently take Latuda. I've tried Abilify, it was also too much for me. I was supposed to go on Vraylar a while back but my insurance denied coverage and that cost something like $1400 per refill.",,,,1234253245809385472,https://twitter.com/PieSigma/status/1234253245809385472
2020-03-01 22:53:06,drpaul415,mayawiley,0,0,0,"Extreme halitosis with psychotic features. Treatment consists Of Extended-release TicTacs and Abilify.",,,,1234250337286049799,https://twitter.com/drpaul415/status/1234250337286049799
2020-03-01 22:44:58,quinncy,TheCut,2,1,66,"Dude, just take the Abilify. ",,,,1234248292331974656,https://twitter.com/quinncy/status/1234248292331974656
2020-03-01 17:09:37,StormyXdreamers,StormyXdreamers,1,0,1,"Here is one example of medications which cause weight gain. I was on abilify for 4 years and gained 70 lbs. I recently asked my dr to take me off of it...btw google is your friend you may want to inform your mouth before you open it ",,,,1234163895968755717,https://twitter.com/StormyXdreamers/status/1234163895968755717
2020-03-01 15:55:33,Jingle_Jess,,0,0,0,"Abilify &amp; Wellbutrin are REALLY doin it for me so I was just grinning so hard for no reason in the car &amp; I had to act like I was talking about something funny on the phone so I didn't look like an absolute psychopath",,,,1234145256846823424,https://twitter.com/Jingle_Jess/status/1234145256846823424
2020-03-01 15:17:34,LEPRA_LEGUAANI,,0,0,2,"my shoulder hurts like fug after my med injection :)) abilify is making my life the dark souls of life",,,,1234135697394720768,https://twitter.com/LEPRA_LEGUAANI/status/1234135697394720768
2020-03-01 14:56:56,TheRealAlphrita,,0,0,0,"@usa @GOP @potus @fbi @katyperry @FINALLEVEL @icecube @tariqnasheed @WarrenBuffett @CIA @S_C_ @foxnews @CondoleezzaRice @arod @apple @CliveDavis @spike. @SecretaryCarson Filipinos use drugs to be mediums. I used Invega then Abilify. Fanapt takes away the delusions. You hear Right",,@usa @GOP @POTUS @FBI @katyperry @FINALLEVEL @icecube @tariqnasheed @WarrenBuffett @CIA @S_C_ @FoxNews @CondoleezzaRice @AROD @Apple @CliveDavis @spike @SecretaryCarson,,1234130508575059968,https://twitter.com/TheRealAlphrita/status/1234130508575059968
2020-03-01 14:39:34,annmarcos1,MicheleBuring1,1,0,1,"Yes. They are now prescribing Seroquel at a low dosage for insomnia and people don't even know they are an antipsychotic. I have seen Abilify advertised as an antidepressant. Now they want to use clozapine for ”Personality Disorders”. The madness.",,,,1234126135472148481,https://twitter.com/annmarcos1/status/1234126135472148481
2020-03-01 11:54:19,CrazyDevoYT,OzzyOzrock,0,0,0,"I may have a few suggestions. There r seven commonly prescribed atypical antipsychotic medications for schizophrenia: Abilify Risperdal Zyprexa Seroquel Cloazril Symbyax Geodon Good luck &amp; may the odds be ever in your favor ",,,,1234084548146802688,https://twitter.com/CrazyDevoYT/status/1234084548146802688
2020-03-01 06:27:30,tanjiruo,,0,0,0,"if i even THINK about skipping my abilify i get withdrawals",,,,1234002303524495361,https://twitter.com/tanjiruo/status/1234002303524495361
2020-03-01 02:00:11,themfatale69,,0,0,0,"I’m on abilify AND lexapro now literally no one can stop me",,,,1233935030625243136,https://twitter.com/themfatale69/status/1233935030625243136
2020-03-01 01:31:39,CNAFAutism,,0,0,0,"How Aripiprazole’s Promise for Treating #Autism Fell Short #Aripiprazole, marketed as #Abilify, is widely thought to be safer than risperidone, the only other drug approved for use in autistic children. A decade’s worth of data suggests that is not true. https://www.the-scientist.com/news-opinion/how-aripiprazoles-promise-for-treating-autism-fell-short-67198",,,#Autism #Aripiprazole #Abilify,1233927848815210496,https://twitter.com/CNAFAutism/status/1233927848815210496
2020-03-01 01:29:59,TheScientistLLC,,0,4,6,"Aripiprazole, marketed as Abilify, is widely thought to be safer than risperidone, the only other drug approved for use in autistic children. A decade’s worth of data suggests that is not true. ",,,,1233927431989407744,https://twitter.com/TheScientistLLC/status/1233927431989407744
2020-03-01 01:28:50,PoePoeYou1,,0,3,7,"There are NO good psychotropic drugs. Tell your psychologist/psychiatrist to go f#ck themselves. Consider suing them, and let everyone you ever met know they should do the same. Sertraline, abilify, citalopram &amp; escitalopram...&amp; more...dump them out! Weed is still weed. Junk. ",,,,1233927140271382528,https://twitter.com/PoePoeYou1/status/1233927140271382528
2020-03-01 01:08:09,ardeetootoo,,1,0,1,"For maybe the first time I feel pretty good after a support group meeting. I also feel better about being trans. I don't know if the improvement in depression is from cessation of HRT or from the addition of Abilify to my antidepressants.",,,,1233921938671755264,https://twitter.com/ardeetootoo/status/1233921938671755264
2020-03-01 00:18:38,spaghettiinbed,,2,0,2,"shoutout to celexa and abilify u the real MVPs",,,,1233909475943309318,https://twitter.com/spaghettiinbed/status/1233909475943309318
2020-03-01 00:01:11,MightyNeck,IvanMosovitch,0,0,0,"SSRIs don't work fer me, not even with the addition of the atypical anti-psychotic Abilify in the mix. &amp; Abilify likely gave me the blood clots that cost me my foot! Hell, this Ketamine thing can't happen soon enough! I imagine the doses would be smaller than recreational doses.",,,,1233905084448288768,https://twitter.com/MightyNeck/status/1233905084448288768
2020-02-29 22:33:57,DonTonyD,JWrestlingV2,1,0,1,"Want added fun? Do an advanced twitter search using 'Cena' on said podcasters and/or youtubers. And the select few who ripped The Fiend as Champion in recent weeks. It seems most misplaced their Abilify last night.",,,,1233883129917706245,https://twitter.com/DonTonyD/status/1233883129917706245
2020-02-29 22:32:58,T_A_Psupport,,1,7,5,"PETITION COMMENT ‘My son is suffering . He was prescribe Benzo from anxiety . After three weeks he Stabbed my husband to death. And now he has been forced drugged with Abilify and the side effect is horrible. We need help.’ ",,,,1233882883439439874,https://twitter.com/T_A_Psupport/status/1233882883439439874
2020-02-29 21:15:29,drbotmd,,0,0,0,"Levocerne (contraceptive) Used with Abilify to treat obsessive calumet disorder Contraindicated by adrenaline",,,,1233863384434651136,https://twitter.com/drbotmd/status/1233863384434651136
2020-02-29 20:49:29,shoegalhms,TeriCottone,1,0,1,"I hate those meds like Abilify &amp; more so antidepressants in general. I know they help ppl but they’re pushed almost forced on ppl. Clinical depression couldn’t have skyrocketed by 10,000% in a couple years if so it’s in the water and contagious.",,,,1233856840426979328,https://twitter.com/shoegalhms/status/1233856840426979328
2020-02-29 20:45:43,PedanticBohemia,Sanity4243,0,0,0,"I have the same issue with my right eyelid and brow. They say it comes from my Tardive Dyskinesia due to being on the maximum dose of Abilify for 8 years. It's permanent/can't be undone as it's damaged my brain. I take Ingrezza to quell the worst of the symptoms. ",,,,1233855890995871744,https://twitter.com/PedanticBohemia/status/1233855890995871744
2020-02-29 20:37:50,TeriCottone,shoegalhms,2,0,1,"Most Drs would not. Honestly most Drs I’ve run across are great. It’s that few. In my experience it’s been female Drs who were demagogues. Two I know of were let go One was forcing Abilify on all her patients. Pharmacists caught it.",,,,1233853908461682688,https://twitter.com/TeriCottone/status/1233853908461682688
2020-02-29 19:49:48,Auras_Journey,TheBookPosh,0,0,1,"It's hard isn't it...finding the right dose that works well but doesn't give you side effects. The restlessness has eased a lot for me recently but I am now exhausted in the daytime and feel really heavy! Sorry you've gained weight on Abilify - pleased it's working for u though x",,,,1233841819902992385,https://twitter.com/Auras_Journey/status/1233841819902992385
2020-02-29 19:44:29,TheBookPosh,Auras_Journey,1,0,1,"I had to reduce the dosage in order for the restlessness to stop. I’ve been on 7.5mg for awhile now. I’ve had no restlessness, but I’ve gained weight. I’m not sure if it’s the Abilify that’s causing it or not.",,,,1233840484012916748,https://twitter.com/TheBookPosh/status/1233840484012916748
2020-02-29 19:03:09,aarthurfleckk,saulsgoodman1,1,0,0,"I’m on lexapro and abilify, im not sure which is responsible for my flattened affect.",,,,1233830082046840833,https://twitter.com/aarthurfleckk/status/1233830082046840833
2020-02-29 18:02:05,GoldHardShell,Lone_Horse,1,0,1,"I haven't heard of it but I've heard of Abilify - I was given Risperdal, apparently boys are growing breasts from it (that's just a coincidence BTW) big lawsuit in the US. Maybe it's been re-branded.",,,,1233814712598401025,https://twitter.com/GoldHardShell/status/1233814712598401025
