date,username,to,replies,retweets,favorites,text,geo,mentions,hashtags,id,permalink
2020-03-14 16:41:14,ProudMary4,ProudMary4,1,0,0,"2/10 a)Dry cough: take some cough med & call your Dr. if it doesn’t improve within about 10 days b)Fever: if it’s 103 or over, go to the ER. If less than 103, take acetaminophen or aspirin and if it doesn’t break in a couple of days, call your Dr.",,,,1238867798304198656,https://twitter.com/ProudMary4/status/1238867798304198656
2020-03-14 16:39:54,bhavikaka10,shrinkingkoneko,1,0,3,"take vitamin c pills to boost your immune system and alternate between ibuprofen (advil) and acetaminophen (tylenol)",,,,1238867462684278790,https://twitter.com/bhavikaka10/status/1238867462684278790
2020-03-14 16:38:59,RoscoeTheRev,ShimonPro,0,0,0,"So the question that should be obvious is did the reporter taken ibuprofen or acetaminophen prior to having a temp taken?",,,,1238867230043103232,https://twitter.com/RoscoeTheRev/status/1238867230043103232
2020-03-14 16:37:27,janergherardi,ChefShwasty,2,0,10,"From the front lines in Italy: stay home. Check your temp. Take alternating ibuprofen and acetaminophen. Drink plenty of fluids including Gatorade. Keep you nasal passages clear with Afrin and Sudafed or Benadryl. STAY HOME. ISOLATE. If you",,,,1238866843139559426,https://twitter.com/janergherardi/status/1238866843139559426
2020-03-14 16:32:17,bkeithb,,1,0,3,"Prepared my #COVID19 emergency kit: acetaminophen ibuprofen Mucinex cough drops Kleenex extra food I'm not ill but taking prudent measures just in case. And of course, I'm washing my hands!",,,#COVID19,1238865545451253763,https://twitter.com/bkeithb/status/1238865545451253763
2020-03-14 16:29:45,frenchpatriotus,VictoriaSanchez,0,0,0,"DO NOT TAKE ADVIL . If you have any symptoms don't take any anti-inflammatory (ibuprofen, aspirin, corticoids...) it's making worst ! ONLY acetaminophen !",,,,1238864905454804993,https://twitter.com/frenchpatriotus/status/1238864905454804993
2020-03-14 16:29:33,zoegalland,,0,0,1,"Has there been other reporting yet on ibuprofen vs. acetaminophen? Would be great to have an answer on this ASAP ",,,,1238864857384071169,https://twitter.com/zoegalland/status/1238864857384071169
2020-03-14 16:27:46,frenchpatriotus,lamarshall,0,0,0,"DO NOT TAKE ADVIL . If you have any symptoms don't take any anti-inflammatory (ibuprofen, aspirin, corticoids...) it's making worst ! ONLY acetaminophen !",,,,1238864409721798658,https://twitter.com/frenchpatriotus/status/1238864409721798658
2020-03-14 16:23:07,AbiWilks,,34,548,890,"paracetamol (acetaminophen) not ibuprofen if you get symptoms https://www.theguardian.com/world/2020/mar/14/anti-inflammatory-drugs-may-aggravate-coronavirus-infection",,,,1238863237359304704,https://twitter.com/AbiWilks/status/1238863237359304704
2020-03-14 16:17:13,True_AG_Grit,,1,2,2,"“Taking anti-inflammatory drugs (ibuprofen, cortisone ...) could be an aggravating factor for the infection. If you have a fever, take paracetamol,” Oliver Veran (France’s health minister) Generic Name: paracetamol Alternate Name: acetaminophen",,,,1238861752907022340,https://twitter.com/True_AG_Grit/status/1238861752907022340
2020-03-14 16:14:39,MichaelSKerekes,olivierveran,0,0,0,"French health minister says acetaminophen may be safer than alternative fever-reducers in COVID-19 cases. ",,,,1238861107709661184,https://twitter.com/MichaelSKerekes/status/1238861107709661184
2020-03-14 16:13:08,ediebellemom,AP,1,0,1,"Wait....the White House does know about acetaminophen, right? #NoFevers",,,#NoFevers,1238860724115570689,https://twitter.com/ediebellemom/status/1238860724115570689
2020-03-14 16:08:21,GerrardIndiaBaz,,1,0,0,"Health Care thermometer fever-reducing medications (acetaminophen or ibuprofen for adults and children) Cleaning paper towels plastic garbage bags dish soap laundry detergent household bleach / bleach wipes household cleaning products",,,,1238859521327538181,https://twitter.com/GerrardIndiaBaz/status/1238859521327538181
2020-03-14 16:07:31,PiccolaDonnina,bellisaurius,1,0,1,"Yep. In France it’s called paracetamol (if you open the article), here it’s called acetaminophen",,,,1238859311046164481,https://twitter.com/PiccolaDonnina/status/1238859311046164481
2020-03-14 16:04:37,hofo,,0,0,0,"Items hit hard: ibuprofen, acetaminophen, cold/flu meds, normal milk, seriously depleted yogurt, normal butter, smoothie ingredients, one package of paper towels, maybe a dozen small packages TP.",,,,1238858583216926720,https://twitter.com/hofo/status/1238858583216926720
2020-03-14 16:01:35,bellisaurius,PiccolaDonnina,1,0,1,"So, it looks like acetaminophen is it. Good to know.",,,,1238857817676812289,https://twitter.com/bellisaurius/status/1238857817676812289
2020-03-14 16:01:30,mambatuley,BethSoch,0,0,0,"Same with ibuprofen. All of them have dangers. I am diabetic and a history of heart disease, arthritis and have researched for 20 years and acetaminophen is the safest taken correctly. Cripes opioids are easier on your body in small doses but the medical field will not prescribe.",,,,1238857798919872514,https://twitter.com/mambatuley/status/1238857798919872514
2020-03-14 16:00:15,UCLASemelFriend,,0,0,4,"#Research by George Slavich, PhD, director of the @UCLA Laboratory for Stress Assessment&amp; Research, found that a daily dose of #forgiveness and acetaminophen helps to alleviate the #pain of social rejection and exclusion.",,@UCLA,#Research #forgiveness #pain,1238857481704607745,https://twitter.com/UCLASemelFriend/status/1238857481704607745
2020-03-14 15:59:01,MojKristi,Geurtie,0,0,0,"Note: Advil/ibuprofen may not be the best if you think you have Covid-19. Use Tylenol/acetaminophen. Also watch out for cold meds that already contain one or the other. ",,,,1238857171288408065,https://twitter.com/MojKristi/status/1238857171288408065
2020-03-14 15:43:29,KraftTea,olivierveran,0,0,0,"The French Minister of Health tweets: ""Taking anti-inflammatory drugs (ibuprofen, cortisone, ...) could be a factor in worsening the infection. If you have a fever, take acetaminophen. If you are already on anti-inflammatory drugs or in doubt, ask your doctor for advice."" ",,,,1238853265049055232,https://twitter.com/KraftTea/status/1238853265049055232
2020-03-14 15:40:13,dberto,MileMarker333,0,0,0,"Tylenol or acetaminophen based pills",,,,1238852441619214339,https://twitter.com/dberto/status/1238852441619214339
2020-03-14 15:39:53,NikhilHaksar,,1,0,1,"French health ministry: avoid ibuprofen, naproxen if you have COVID-19. Use acetaminophen instead. ",,,,1238852358165213186,https://twitter.com/NikhilHaksar/status/1238852358165213186
2020-03-14 15:37:27,Erinescence,,0,4,3,"With all the recommendations to stock up on Tylenol (acetaminophen), good time to remind everyone NOT TO EXCEED THE RECOMMENDED DOSE. And watch out for accidental overdose by taking Tylenol + a multi-symptom cold/flu med, most of which contain it already. ",,,,1238851745540947968,https://twitter.com/Erinescence/status/1238851745540947968
2020-03-14 15:36:17,BethSoch,mambatuley,2,0,2,"Acetaminophen is VERY hard on the liver, has an extremely narrow therapeutic window. It’s easier on the kidneys and stomach than NSAIDs. It can be deadly if you exceed the recommended dose.",,,,1238851452065452033,https://twitter.com/BethSoch/status/1238851452065452033
2020-03-14 15:35:26,PanamStyle,lifesafeast,0,0,1,"Conundrum for those who are restricted from taking acetaminophen. Naturally, call your doctor, public health service, etc.",,,,1238851237568819202,https://twitter.com/PanamStyle/status/1238851237568819202
2020-03-14 15:32:46,soychicka,soychicka,2,3,13,"But I’m still waking up, and didn’t realize E meant acetaminophen exclusively. That said, paracetamol = acetaminophen = Tylenol But keep in mind- elevated temp serves a purpose. Consult a doc before medicating it this time.",,,,1238850564752056320,https://twitter.com/soychicka/status/1238850564752056320
2020-03-14 15:29:32,backrow,soychicka,1,0,0,"He's saying to take acetaminophen though",,,,1238849752923607042,https://twitter.com/backrow/status/1238849752923607042
2020-03-14 15:28:53,mambatuley,nycsouthpaw,1,0,0,"Acetaminophen is easier on the heart and liver than other NSAIDS. I have yet to find a source that explains the exact progression of this virus and the actual course one should administer at home. Eat well, sleep and social distancing seem to be the best course of action.",,,,1238849588330737664,https://twitter.com/mambatuley/status/1238849588330737664
2020-03-14 15:25:34,kfunk937,LauraDekker1,0,0,1,"Thank you. Ice pack and acetaminophen/paracetamol, lol ",,,,1238848753320239109,https://twitter.com/kfunk937/status/1238848753320239109
2020-03-14 15:23:55,DuprasJanine,TracyLCooper2,1,0,3,"I couldn't even get my brand of coffee, I'm not happy. I'm glad I had enough acetaminophen at home. It took 3 stores to find toilet paper.",,,,1238848339325652994,https://twitter.com/DuprasJanine/status/1238848339325652994
2020-03-14 15:22:36,alamajeure,olivierveran,0,0,0,"France’s Minister of Health alerts that ibuprofen can make #Covid_19 worse- he says to take paracetamol instead, which is Acetaminophen in the US. #CoronaVirusUpdates",,,#Covid_19 #CoronaVirusUpdates,1238848007300427776,https://twitter.com/alamajeure/status/1238848007300427776
2020-03-14 15:22:32,alliekitten23,,0,0,2,"Also since this may not be common knowledge: read your med labels. Most over the counter cold/flu meds contain acetaminophen aka Tylenol. Recommended daily limit of acetaminophen for an adult is 4000mg. So just be careful and incorporate other NSAIDs for pain/fever if possible.",,,,1238847990640431105,https://twitter.com/alliekitten23/status/1238847990640431105
2020-03-14 15:20:41,elissa_redman,ThatShockratees,1,0,1,"Ibuprofen is the immune suppressant. Has been associated with other immune issues in the past. Aspirin in this house-acetaminophen can be as hard on the liver as heavy drinking.",,,,1238847526062751744,https://twitter.com/elissa_redman/status/1238847526062751744
2020-03-14 15:19:41,ericgarland,nycsouthpaw,3,15,107,"Which means ease up on the booze despite the reality-appropriate temptation. Give your liver all the help it needs because acetaminophen is processed in the liver.",,,,1238847272332525569,https://twitter.com/ericgarland/status/1238847272332525569
2020-03-14 15:10:06,JonnieReynolds,Stop_Trump20,0,0,0,"Just looked up paracetamol. Would never of known it is acetaminophen.",,,,1238844862629400578,https://twitter.com/JonnieReynolds/status/1238844862629400578
2020-03-14 15:07:32,HendryVictoria,,0,0,0,"Ferroptosis driven by radical oxidation of n-6 polyunsaturated fatty acids mediates acetaminophen-induced acute liver failure. https://www.qxmd.com/r/32094346 ⁦@drlaurarandle⁩",,@drlaurarandle,,1238844217608323075,https://twitter.com/HendryVictoria/status/1238844217608323075
2020-03-14 15:03:45,Elspeth_IRL,,0,0,3,"me: why aren't these acetaminophen tablets working expiration date: 03/16",,,,1238843266491187203,https://twitter.com/Elspeth_IRL/status/1238843266491187203
2020-03-14 14:57:02,KnowYourOTCs,,0,0,0,"There are a few important things to keep in mind when giving medicines with acetaminophen to a child—learn about them here: http://bit.ly/ped-acet #KYDpain",,,#KYDpain,1238841572072054784,https://twitter.com/KnowYourOTCs/status/1238841572072054784
2020-03-14 14:55:59,TonyFlowersinCO,mostlyadam,0,0,1,"This is 100% correct. There is only the same treatment that they give to flu sufferers which is IV saline to stay hydrated and ibuprofen/acetaminophen for fever. There’s no “Coronavirus specific” treatment.",,,,1238841310301130752,https://twitter.com/TonyFlowersinCO/status/1238841310301130752
2020-03-14 14:54:01,rhonhahn,AllanRicharz,0,0,0,"Yeah, I’ve seen recommendations to alternate ibuprofen and acetaminophen if you get a fever and to have it on hand, just in case",,,,1238840814211653632,https://twitter.com/rhonhahn/status/1238840814211653632
2020-03-14 14:48:58,runradrun,BrightRedStool,0,0,0,"No need to be tested if you have no or even mild symptoms. Tests are a finite resource. If you do have mild symptoms then you treat it as you would a normal cold/flu and stay home and look after yourself with fluids, acetaminophen, rest, etc",,,,1238839543039758336,https://twitter.com/runradrun/status/1238839543039758336
2020-03-14 14:47:13,wendy_talmage,,1,0,0,".. for how to try to AVOID it. So as your friendly neighborhood RN, a wee thread: Things you should *actually* buy ahead of time (Erm, not sure what the obsession with toilet paper is?): Kleenex, Acetaminophen (Tylenol) in 325 mg tablets, Ibuprofen (Advil) in 200 mg tablets,...",,,,1238839105682882560,https://twitter.com/wendy_talmage/status/1238839105682882560
2020-03-14 14:46:34,claudester,LfBambi,1,0,1,"Wouldn’t Acetaminophen do the same?",,,,1238838939739455488,https://twitter.com/claudester/status/1238838939739455488
2020-03-14 14:42:44,autismepi,,0,1,1,"Tylenol (acetaminophen, paracetamol) induced brain synapse degeneration from prolonged use in adult rats. https://ncbi.nlm.nih.gov/pubmed/31364032/… Pregnancy #Tylenol use linked to offspring #Autism &amp; #ADHD",,,#Tylenol #Autism #ADHD,1238837974269386753,https://twitter.com/autismepi/status/1238837974269386753
2020-03-14 14:37:57,FerretXilla,,1,0,0,"ALWAYS CHECK OVERDOSE CONSEQUENCES. Some are very minor. Some are very not. A LOT of cold/flu medication is compounded with tylenol/acetaminophen. This is bad because thats one of the ones that will actually kill you. Make sure you know how much you're taking total.",,,,1238836773368799233,https://twitter.com/FerretXilla/status/1238836773368799233
2020-03-14 14:36:13,sguellati1,,0,0,0,"Acetaminophen is preferred to ibuprofen and corticosteroids to address COVID-19 symptoms.",,,,1238836333789003778,https://twitter.com/sguellati1/status/1238836333789003778
2020-03-14 14:36:06,goal0x,,1,0,0,"Anyone ever had/get tonsil stones? looking for some real-life experience info have been using Acetaminophen w/ Aspirin and salt water gargle 3x a day",,,,1238836304537956354,https://twitter.com/goal0x/status/1238836304537956354
2020-03-14 14:35:14,DotyBilly,DeItaOne,0,0,2,"Could totally understand how slowing the body’s inflammation response with nsaids could be harmful. Acetaminophen for win here",,,,1238836086840926214,https://twitter.com/DotyBilly/status/1238836086840926214
2020-03-14 14:33:12,autismepi,,0,1,0,"Women who took acetaminophen, best known as Tylenol, at the end of their pregnancies were almost twice as likely to have a child with ADHD or autism, according to new research. ",,,,1238835578105409536,https://twitter.com/autismepi/status/1238835578105409536
2020-03-14 14:32:17,DotyBilly,plaidCPA,1,0,4,"Properly used acetaminophen is safer than Advil",,,,1238835344944050176,https://twitter.com/DotyBilly/status/1238835344944050176
2020-03-14 14:29:56,DaynaLiffey,,0,0,0,"Ibuprofen (Advil) and other NSAIDs could worsen #coronavirus, French doctor warns; France removes products from shelves; take paracetemol or acetaminophen (Tylenol) instead -- https://www.lemonde.fr/societe/article/2020/03/14/face-au-coronavirus-le-ministre-de-la-sante-recommande-de-ne-pas-prendre-d-ibuprofene_6033095_3224.html via @lemondefr",,@lemondefr,#coronavirus,1238834753123618816,https://twitter.com/DaynaLiffey/status/1238834753123618816
2020-03-14 14:26:46,ChrisChinni,TomFitton,1,0,4,"Far too long the world has kissed Chinas ass. Now they want to hold out medical supplies? All pharma should be brought back to the US! I'll gladly pay $10 instead of $5 for 100 US made acetaminophen!",,,,1238833955299889152,https://twitter.com/ChrisChinni/status/1238833955299889152
2020-03-14 14:26:16,bobeaubreaux,,2,3,0,"Any RNs on the tl? I know we are supposed to prep by buying medicines to beat chest infections. Is mucinex good to buy in addition or is tussin/theraflu and acetaminophen/ibuprofen cycling by itself just better?",,,,1238833831634968576,https://twitter.com/bobeaubreaux/status/1238833831634968576
2020-03-14 14:24:01,HeartTampaBay,,0,0,0,"Some over-the-counter pain relievers can raise blood pressure (BP) or even interfere with BP medication. Read labels and talk to your doctor about choosing a pain reliever such as acetaminophen, which won’t raise your BP like other pain relievers can. http://spr.ly/60101SPS6",,,,1238833264695140359,https://twitter.com/HeartTampaBay/status/1238833264695140359
2020-03-14 14:23:22,LaurenFishDC,ConnorJWangler,2,0,2,"From my read the acetaminophen is fine - that’s the same as paracetamol",,,,1238833100148428800,https://twitter.com/LaurenFishDC/status/1238833100148428800
2020-03-14 14:15:00,JacobMargolis,,1,0,2,"Medicine: acetaminophen and ibuprofen. Easy to produce easy to ship. @tylenol (US based) said they were full bore, focused on making the easiest to produce pills to keep shelves stocked. Store generics, often from India, could see a lag if that supply chain is disrupted. 3/8",,@tylenol,,1238830995672977408,https://twitter.com/JacobMargolis/status/1238830995672977408
2020-03-14 14:11:31,MabstersH,MabstersH,0,1,1,"From The French Surgeon Gen. @olivierveran Ibuprofen May have an aggravating effect....so acetaminophen is recommended.",,@olivierveran,,1238830121177493505,https://twitter.com/MabstersH/status/1238830121177493505
2020-03-14 14:06:09,FordPrefect747,kakape,0,0,1,"It's curious. I read many Chinese pre-prints during February and they used ibuprofen copiously (along with acetaminophen) and I don't recall ever seeing a report of a problem.",,,,1238828767256219648,https://twitter.com/FordPrefect747/status/1238828767256219648
2020-03-14 14:04:06,reklined,tedivm,1,0,1,"Reckon that Tylenol and acetaminophen would be top purchases",,,,1238828254024228865,https://twitter.com/reklined/status/1238828254024228865
2020-03-14 14:03:23,notdred,,3,2,25,"I’m going to add a 7/6 here - if you want to follow the acetaminophen-only advice, I see nothing wrong with doing so. Please just watch the doses you are taking and follow the label instructions as well as your doctor’s instructions.",,,,1238828073304436737,https://twitter.com/notdred/status/1238828073304436737
2020-03-14 14:01:14,stevenmunger,matthewcobb,1,0,0,"Generic name acetaminophen, yes (Tylenol in the US)?",,,,1238827529584214018,https://twitter.com/stevenmunger/status/1238827529584214018
2020-03-14 13:57:26,altontw,MollyMcKew,0,0,0,"#Taiwan and surrounding countries: Panadol is fine. The active ingredient is acetaminophen. ",,,#Taiwan,1238826574801231879,https://twitter.com/altontw/status/1238826574801231879
2020-03-14 13:56:05,jonalft,olivierveran,0,0,0,"The French health minister states that ibuprofen could worsen a Covid infection. He recommends taking paracetamol (acetaminophen/Tylenol) instead of other anti-inflammatory medicines. ",,,,1238826236081815555,https://twitter.com/jonalft/status/1238826236081815555
2020-03-14 13:52:24,GreensArchive,angrymodelboy,0,0,0,"I understand. Just don't push yourself like you usually do and take some acetaminophen.",,,,1238825310407266304,https://twitter.com/GreensArchive/status/1238825310407266304
2020-03-14 13:51:16,Ayo_mide007,bigOprash,0,0,0,"You don't have future here man. You can never make it",,,,1238825025366642691,https://twitter.com/Ayo_mide007/status/1238825025366642691
2020-03-14 13:42:28,CrazyMomma007,KatherineEWyatt,0,0,2,"TY for sharing this great, easy-to-understand article. I especially liked the graphs AND the way it explained to get Tylenol/acetaminophen based fever-reducer (as the ibuprofen type-all NSAIS?- can aggravate conditions w/COVID-19). cc: @karolcummins",,@karolcummins,,1238822810224668673,https://twitter.com/CrazyMomma007/status/1238822810224668673
2020-03-14 13:42:24,notdred,weeklywhinge,1,3,5,"Yes, the key question is whether ibuprofen use increases ACE2 receptors enough to make a difference. Using for a few days for fever, alternating with acetaminophen, should decrease that risk if it is real. People chronically on NSAIDs may be a different story though.",,,,1238822792235286530,https://twitter.com/notdred/status/1238822792235286530
2020-03-14 13:42:19,Elyrya_Ylnae,Geurtie,1,2,4,"IMPORTANT: Advisory out now about the possibility of NSAIDs (Nonsteroidal anti-inflammatory drugs) like Ibuprofen, Advil, aspirin not being safe to use for fever in COVID-19 cases. Acetaminophen (Tylenol) should be used instead to alleviate fever instead with doctor's approval. ",,,,1238822770286505984,https://twitter.com/Elyrya_Ylnae/status/1238822770286505984
2020-03-14 13:42:03,relevanne,olivierveran,0,0,0," #COVIDー19 | Taking anti-inflammatory drugs (ibuprofen, cortisone, ...) could be an aggravating factor of the infection. If you have a fever, take paracetamol [aka acetaminophen/Tylenol]. If you are already on anti-inflammatory drugs or in doubt, ask your doctor for advice. ",,,#COVID,1238822705044107265,https://twitter.com/relevanne/status/1238822705044107265
2020-03-14 13:42:01,MabstersH,dcherring,1,0,1,"I heard that ibuprofen was counter indicated. Take Acetaminophen. I’ll look for the PSA, I believe from Ireland",,,,1238822695229427712,https://twitter.com/MabstersH/status/1238822695229427712
2020-03-14 13:33:17,TheFakestAlfred,sterotume,1,2,2,"You are such an amazing spirit",,,,1238820495723843585,https://twitter.com/TheFakestAlfred/status/1238820495723843585
2020-03-14 13:32:58,TheFakestAlfred,sterotume,0,1,2,"Damnnn I still do have a crush on him but he va diff me so I just have to move on",,,,1238820418087079936,https://twitter.com/TheFakestAlfred/status/1238820418087079936
2020-03-14 13:27:03,jspath55,kalev78,1,0,0,"In their defense, weakly, they serve alcohol. That got me through the 2 parties I attended there. But, Bring Your Own Acetaminophen.",,,,1238818927578357761,https://twitter.com/jspath55/status/1238818927578357761
2020-03-14 13:25:11,FalaMargareth,olivierveran,0,0,0,"I'm very sorry you guys don't know dipyrone. It’s much much better than paracetamol/acetaminophen.",,,,1238818460454584320,https://twitter.com/FalaMargareth/status/1238818460454584320
2020-03-14 13:24:37,dtm609,crysthecat,0,0,0,"Yeah, it's weird to have two generic names for the drug, but ""acetaminophen"" is really only used in the US, Canada, and Japan. (And if Wikipedia is right, in Iran, Colombia and Venezuela too) It's ""paracetamol"" elsewhere.",,,,1238818315772067843,https://twitter.com/dtm609/status/1238818315772067843
2020-03-14 13:23:24,PhoenixTaino,,1,0,0,"As your friendly neighborhood nurse, things you should *actually* buy ahead of time (erm, not sure what the TP obsession is?): Kleenex, 325mg Acetaminophen (Tylenol), 200mg Ibuprofen (Advil, Mucinex, Robitussin or DayQuil/NyQuil, whatever your cough medicine of choice is. (2/11)",,,,1238818009331961857,https://twitter.com/PhoenixTaino/status/1238818009331961857
2020-03-14 13:21:33,SinaSpacetoast,dduane,0,0,0,"That's a problem. I can't take acetaminophen/paracetamol because of med interactions.",,,,1238817543831371778,https://twitter.com/SinaSpacetoast/status/1238817543831371778
2020-03-14 13:11:13,AlexzandriaCori,,1,0,4,"how the HELL am i supposed to deal with the end of my medication’s cycle (half life of 28 days) when i’m most susceptible to migraines when all of Michigan bought out the Tylenol/acetaminophen?? if i end up in the ER, someone is getting spanked",,,,1238814943715221504,https://twitter.com/AlexzandriaCori/status/1238814943715221504
2020-03-14 13:10:55,wingsformarie2,ISCResearch,1,0,1,"I take about 600mg a day and about 1000mg of acetaminophen sometimes for arthritis",,,,1238814867479572482,https://twitter.com/wingsformarie2/status/1238814867479572482
2020-03-14 13:10:19,JanelleLouise22,olivierveran,0,0,0,"French Health Minister advising that ibuprofen could worsen coronavirus infection and to take acetaminophen (Tylenol) in case of fever. ",,,,1238814716354535426,https://twitter.com/JanelleLouise22/status/1238814716354535426
2020-03-14 13:06:33,JRobie_1970,whoareyou7,1,0,3,"Just for clarity, Tylenol is a brand name, it's the same thing as paracetamol and acetaminophen. All the same.",,,,1238813768139845633,https://twitter.com/JRobie_1970/status/1238813768139845633
2020-03-14 13:05:10,Dolebet,,1,0,0,"2/ So as your friendly neighborhood RN, a wee thread: Things you should *actually* buy ahead of time (Erm, not sure what the obsession with toilet paper is?): Kleenex, Acetaminophen (Tylenol) in 325 mg tablets, Ibuprofen (Advil) in 200 mg tablets, Mucinex, Robitussin or DayQuil",,,,1238813420767641600,https://twitter.com/Dolebet/status/1238813420767641600
2020-03-14 13:05:03,Cheaptarts,olivierveran,0,0,0,"This tweet is going to flood non-medical ppl tweeting, a debate, of which fever reducer to use for #coronavirus #COVID19 Ugh. Ibuprofen vs acetaminophen Advil vs Tylenol Already seeing non-med opinions.#fail Ask your doctor, not Twitter!",,,#coronavirus #COVID19 #fail,1238813394507005953,https://twitter.com/Cheaptarts/status/1238813394507005953
2020-03-14 13:03:14,ImKatrinaWu,olivierveran,0,0,0,"IMPORTANT! Use/utilizer Paracetamol = acetaminophen; “Tylenol”, “Calpol” (pour les enfants/for children in UK, Ireland), “Panadol” #COVIDー19",,,#COVID,1238812935151063040,https://twitter.com/ImKatrinaWu/status/1238812935151063040
2020-03-14 13:00:11,OrangenFuhrer,ISCResearch,1,0,0,"Paracetamol, also known as acetaminophen and APAP, is a medication used to treat pain and fever. https://www.amazon.com/Basic-Care-Strength-Acetaminophen-Caplets/dp/B074F2TF79/ref=sr_1_4?keywords=Acetaminophen&amp;qid=1584190724&amp;s=hpc&amp;sr=1-4",,,,1238812169916919808,https://twitter.com/OrangenFuhrer/status/1238812169916919808
2020-03-14 12:59:36,TheFakestAlfred,sterotume,1,0,3,"OMG it was amazing getting to meet you LOVED IT !!!!",,,,1238812022285856768,https://twitter.com/TheFakestAlfred/status/1238812022285856768
