date,username,to,replies,retweets,favorites,text,geo,mentions,hashtags,id,permalink
2020-03-13 08:45:22,TheFakestAlfred,,1,0,10,"Waiting for Holi Celebration !!!",,,,1238385654360199169,https://twitter.com/TheFakestAlfred/status/1238385654360199169
2020-03-13 08:44:49,TheFakestAlfred,SemiTuraga,0,0,2,"I mean dont Snitches get Stitches",,,,1238385513137987586,https://twitter.com/TheFakestAlfred/status/1238385513137987586
2020-03-13 08:06:32,Vodkasour1,lilangelmegs,2,0,3,"The odds of Yellowstone going off in your lifetime are literally 1:1,000,000 For reference, the odds of you experiencing a severe acetaminophen (Tylenol) injury are 1:12,000 Worry about real risks, like, say, a highly transmissible pandemic that’s currently active",,,,1238375880411377665,https://twitter.com/Vodkasour1/status/1238375880411377665
2020-03-13 07:59:20,carlamitchell97,shrillandchill,0,0,1,"Throat lozenges, acetaminophen, and ibuprofen. As a person that works for the health department, please take my advice. Stay home if you can. If later you fell ok with no fever, you're probably fine Better to be safe than sorry.",,,,1238374070644867073,https://twitter.com/carlamitchell97/status/1238374070644867073
2020-03-13 07:53:23,Ayo_mide007,Ktown_Spurs,0,0,1,"A condom would have totally prevented this tweet. Your stupidity defo knows no bounds.",,,,1238372571202179072,https://twitter.com/Ayo_mide007/status/1238372571202179072
2020-03-13 07:42:32,SoamHarish,,0,0,0,"Infants' Tylenol Acetaminophen Liquid Medicine, Grape, 2 fl. oz Infants' Tylenol Acetaminophen Liquid Medicine, Grape, 2 fl. oz ",,,,1238369841666502657,https://twitter.com/SoamHarish/status/1238369841666502657
2020-03-13 07:42:32,theprimeJP,_NiaTheGreat,1,0,0,"Okay I currently have a bunch of acetaminophen (Ny/DayQuil and Tylenol) and Advil. Yet still experiencing pain, go for exedrin?",,,,1238369841494573056,https://twitter.com/theprimeJP/status/1238369841494573056
2020-03-13 07:42:16,SoamHarish,,0,0,0,"Children's Tylenol Cold + Cough + Runny Nose & Fever Medicine with Acetaminophen, Grape, 4 fl. oz Children's Tylenol Cold + Cough + Runny Nose &amp; Fever Medicine with Acetaminophen, Grape, 4 fl. oz ",,,,1238369773861449729,https://twitter.com/SoamHarish/status/1238369773861449729
2020-03-13 07:39:22,_NiaTheGreat,theprimeJP,1,0,1,"Excedrin is i think acetaminophen + caffeine. It’s a name brand. Ibuprofen is the name of the drug that’s usually in Advil. It’s usually my go to. But if i have a bad headache i take 200 mg of Ibuprofen and 500 mg of excedrin. You could also try Aleve which is naproxen",,,,1238369041846321152,https://twitter.com/_NiaTheGreat/status/1238369041846321152
2020-03-13 07:37:15,CreoleBabyBritt,brittanyalauren,1,0,0,"I'm hoping I can get something other than ibuprofen. Even the acetaminophen didn't work. I have had no improvement in my pain since the procedure. I even went back on Wednesday.",,,,1238368512600670208,https://twitter.com/CreoleBabyBritt/status/1238368512600670208
2020-03-13 07:26:59,rojinharan,,1,0,0,"IF YOU'RE AT HOME: Take acetaminophen, basically paracetmol or tylenol Ibuprofen Cough syrup Steam! So your airways will open up",,,,1238365928003375109,https://twitter.com/rojinharan/status/1238365928003375109
2020-03-13 07:14:43,Spacemania,ratten_matthias,0,0,2,"He's in Texas, paracetamol is known as Acetaminophen there. It's one of those rare times generic names vary *shrug*",,,,1238362841347788800,https://twitter.com/Spacemania/status/1238362841347788800
2020-03-13 06:56:28,seefoodcamino,,0,0,2,"self care is taking acetaminophen after drinking a shit ton so the hangover isn’t as bad when you have to wake up for work in like 4 hours",,,,1238358248534749187,https://twitter.com/seefoodcamino/status/1238358248534749187
2020-03-13 06:42:34,daleytwin2,,1,0,2,"Over the course of today, between 4:30 am and 7 pm, i safely ingested 2000 mg of acetaminophen, 1400 mg of ibuprofen, and 100 mg of gabapentin. None of which did SHIT for my period. Shout out to my rice sock &amp; my roommate's banana &amp; my impromptu nap for being the real homies",,,,1238354749373612033,https://twitter.com/daleytwin2/status/1238354749373612033
2020-03-13 06:39:21,TheFakestAlfred,Mflelei,1,0,3,"But She said she was A Sex worker tho",,,,1238353942066524167,https://twitter.com/TheFakestAlfred/status/1238353942066524167
2020-03-13 06:32:57,TheFakestAlfred,,0,0,4,"Sucking dick don't count eh #coronawirus",,,#coronawirus,1238352327947382789,https://twitter.com/TheFakestAlfred/status/1238352327947382789
2020-03-13 06:29:35,JohnDesMarteau,chrislhayes,0,0,0,"Ibuprofen is for fever control and will help you feel better overall. If you can’t take ibuprofen then you can substitute acetaminophen (Tylenol).",,,,1238351481163702272,https://twitter.com/JohnDesMarteau/status/1238351481163702272
2020-03-13 06:23:01,fictograph,KeezyBees,2,1,9,"You can mitigate a fever by alternating ibuprofen (Advil) and acetaminophen (Tylenol, Panadol, paracetamol) every 2-4 hours. One is processed by your liver and the other your kidneys which is why you can alternate . ",,,,1238349828788117504,https://twitter.com/fictograph/status/1238349828788117504
2020-03-13 06:08:28,armadashari,olddominiongirl,0,0,0,"Advil and ibuprofen are the same thing. You want to alternate ibuprofen 400 mg and acetaminophen 650 mg (for adults without allergy to them) every 3 hours. Don’t exceed 4000 mg acetaminophen in a 24 hour period.",,,,1238346167773270016,https://twitter.com/armadashari/status/1238346167773270016
2020-03-13 06:04:35,timothystoner,LucyLyo1,1,0,0,"Correct. So if someone had COVID-19 symptoms of fever, cough, and shortness of breath. They could be treated with acetaminophen/ibuprofen, albuterol inhaler, and codeine. All without having the test results.",,,,1238345191909724160,https://twitter.com/timothystoner/status/1238345191909724160
2020-03-13 06:00:13,ssanxiago,,0,0,4,"i just wanted a yes or no answer if i can take cetrizine with acetaminophen not a big ass paragraph cmon now google",,,,1238344092490379264,https://twitter.com/ssanxiago/status/1238344092490379264
2020-03-13 05:57:22,TheFakestAlfred,lolaQoro,1,0,1,"Have someone else you trust who has a small mouth and no spouse read it. then tear it up. it's easier to pester a person to tell you even if you can keep it together rather than having it on the back of your mind ",,,,1238343372969881601,https://twitter.com/TheFakestAlfred/status/1238343372969881601
2020-03-13 05:56:17,TheFakestAlfred,truBlueNova,1,0,3,"smart mouth but can't use it on me smh",,,,1238343101229359104,https://twitter.com/TheFakestAlfred/status/1238343101229359104
2020-03-13 05:37:05,carlthomasr,,0,0,0,"For a pandemic virus that causes flu-like symptoms, the cold and flu, ibuprofen, and acetaminophen aisle was completely untouched. But the toilet paper aisle. The toilet paper. ",,,,1238338270548889605,https://twitter.com/carlthomasr/status/1238338270548889605
2020-03-13 05:31:21,asummersby,jamie_agust,0,0,0,"And yes second the Acetaminophen for if you do get sick with a fever.",,,,1238336829167976451,https://twitter.com/asummersby/status/1238336829167976451
2020-03-13 05:30:10,TheFakestAlfred,fiji_force,0,0,13,"Yo see This is why I never said anything about that story. It sounded like a movie to me. Too good to be true. Never really believe anyone unless there are some hard was facts. Your words dont count cause People Lie ""Worse than Hell"" Damn she be tripping Ew @DaddyWake",,@DaddyWake,,1238336531640676353,https://twitter.com/TheFakestAlfred/status/1238336531640676353
2020-03-13 05:23:34,TheFakestAlfred,tu_fili,0,1,5,"HEY SHUT UP YOUR MOUTH YOU ONE SUIT ",,,,1238334867718299648,https://twitter.com/TheFakestAlfred/status/1238334867718299648
2020-03-13 05:21:52,znmeb,asiangrrlMN,1,0,0,"My normal temperature is under the ""official"" 98.6 - usually in the mid-97 range. I had a cold back in February and it was about 100.2 for a day without any aspirin / ibuprofen / acetaminophen. It came down to normal with a single ibuprofen.",,,,1238334439475646465,https://twitter.com/znmeb/status/1238334439475646465
2020-03-13 05:21:02,LoveyDani,,0,0,0,"I have emetophobia: the fear of throwing up. They prescribed me a mix of amoxicillin, acetaminophen, and hydrocodone for the wisdom tooth pain and infection. I’ve literally been immobilized by fear all day because medicine side effects= stomach problems. Why can’t I just TAKE EM",,,,1238334230477897729,https://twitter.com/LoveyDani/status/1238334230477897729
2020-03-13 05:18:32,TheFakestAlfred,pseudofijian,0,0,2,"I had a non stop 1-5 class in 2018 ",,,,1238333600048664577,https://twitter.com/TheFakestAlfred/status/1238333600048664577
2020-03-13 05:16:07,RiantRenascence,flowerrqqueen,0,0,2,"She said her chest hurts from coughing so much but she isn't having a hard time breathing, so I'm relieved by that at least. She took some acetaminophen earlier and her temp went to 101, but that's still too high for my liking especially since she's been on antibiotics since Tues",,,,1238332995624480768,https://twitter.com/RiantRenascence/status/1238332995624480768
2020-03-13 05:14:06,lauravaldez0206,,0,0,1,"shipping 26 pharmaceutical ingredients for those drugs, including acetaminophen, Tylenol, due to this. All I see is the media focusing on people hoarding supplies, and the closure of this or that, but not on the damage that’s being caused at a larger scale especially the economy!",,,,1238332487043936258,https://twitter.com/lauravaldez0206/status/1238332487043936258
2020-03-13 05:13:07,breal_xo,QueenKongC,1,0,0,"Z pack, steroids, asthma meds, codeine/acetaminophen, tessalon pearls the holy grails!",,,,1238332239567519745,https://twitter.com/breal_xo/status/1238332239567519745
2020-03-13 05:09:21,pyrrhicfiend,licoricetongues,1,0,1,"[scream] i might just recreate it out of spite. but it also took me five days to make it in the first place. but i also hate that it was destroyed. mmmmmmmmm. anyway. yes. something Will get crushed. acetaminophen, maybe",,,,1238331290002259969,https://twitter.com/pyrrhicfiend/status/1238331290002259969
2020-03-13 05:09:15,tyla_toppin,,0,0,0,"This virus make me want to go home. I make leave this place to be honest",,,,1238331267617300480,https://twitter.com/tyla_toppin/status/1238331267617300480
2020-03-13 05:08:39,locconsulting,locconsulting,1,0,0,"While I don’t have ample supply of acetaminophen, I do have an ample supply of 400 mg Ibuprofen (Advil). I’ll be getting a 3 month supply of Acetaminophen (Tylenol) this week, as my PCP just wrote the script late this pm. (2/2)",,,,1238331115477381121,https://twitter.com/locconsulting/status/1238331115477381121
2020-03-13 05:03:14,See_no1_cares,AtomicDoor,0,0,0,"We are looking a fever ~ 103 (take acetaminophen) and aches (ibuprofen). Alternate every 2 hours. If you have difficulty breathing, contact your doctor. Seems there is still risk of infection to others, isolate for 72 hours after the fever breaks. Worst symptoms are 8h to 2d. 2/",,,,1238329752534102017,https://twitter.com/See_no1_cares/status/1238329752534102017
2020-03-13 04:29:59,elektritekt,chadloder,0,0,0,"IANAD but Ibuprofen & Acetaminophen are both good to have as alternating agents reducing dangerous fevers.",,,,1238321385233100800,https://twitter.com/elektritekt/status/1238321385233100800
2020-03-13 04:22:54,tyla_toppin,,0,3,14,"Tipsy me is such a fun me ",,,,1238319602192519168,https://twitter.com/tyla_toppin/status/1238319602192519168
2020-03-13 04:15:31,adriennelj,jasmineelgamal,1,0,0,"Get a Sp02 (pulse oximeter) monitor &check oxygen levels.If 90 or less call 911. Give 1000mgs of acetaminophen(Tylenol)every 4-6 hours initially to get fever down,then max 3000mgs/day. Make sure he drinks LOTS of fluids (pref Gatorade or pedialyte) to replace electrolytes.",,,,1238317744266903552,https://twitter.com/adriennelj/status/1238317744266903552
2020-03-13 04:04:06,Teach2Progress,chrislhayes,0,0,0,"This is absolutely right, though acetaminophen works too. But fluids, rest, ibuprofen or acetaminophen, self-isolation if you get sick and are not 60+ or immune-system compromised. If you are higher risk read the rest of Chris’s thread. ",,,,1238314869922959360,https://twitter.com/Teach2Progress/status/1238314869922959360
2020-03-13 03:48:21,S_R_Paul,MrsYosemiteSam,1,0,4,"There is no current antiviral that will work. If you are relatively healthy think things you'd do to help yourself over a bad bronchial cold or flu- Tylenol/ acetaminophen for fever, expectorant cough meds, Mucinex, humidifier, rest, liquids: soup, hot tea-lemon &amp; honey.",,,,1238310906141888512,https://twitter.com/S_R_Paul/status/1238310906141888512
2020-03-13 03:45:49,follower9823,thebiologistisn,1,0,1,"This all makes me happy that I use acetaminophen. Don't tell me anything about it!",,,,1238310267706060800,https://twitter.com/follower9823/status/1238310267706060800
2020-03-13 03:32:04,YesYvonne,mangelesrichesx,0,0,0,"Except that nephrologist has warned anything but Tylenol (acetaminophen) is disallowed for spouse with kidney failure.",,,,1238306809019916289,https://twitter.com/YesYvonne/status/1238306809019916289
2020-03-13 03:28:04,ashleyLDenham,,0,0,1,"I have a feeling they are going to quarantine Nashville and the middle Tennessee area.. Stocked up on diapers and grabbed some acetaminophen for the kids and about $300 of groceries. Grabbing more supplies tomorrow and staying inside",,,,1238305802974375938,https://twitter.com/ashleyLDenham/status/1238305802974375938
2020-03-13 03:17:58,grievable,,0,0,1,"off of pseudoephedrine AND acetaminophen rn so if i dont wake up its from this and not corona virus........",,,,1238303258826780672,https://twitter.com/grievable/status/1238303258826780672
2020-03-13 03:05:46,CC_Diamon,,0,0,0,"Trying to dry swallow some acetaminophen and yacked. Now someone’s going to associate it with this bullshit",,,,1238300191163207680,https://twitter.com/CC_Diamon/status/1238300191163207680
2020-03-13 02:59:27,rlorenxo,,3,1,5,"Y’all, please be cognizant of the OTC meds you’re buying. My kids legit need ibuprofen or acetaminophen to help with their fevers bc THEY HAVE FUCKING PNEUMONIA and I can’t find the meds they need. And I can’t leave home with them. Their dad works graveyard. .@norasack real shit",,@norasack,,1238298598950883330,https://twitter.com/rlorenxo/status/1238298598950883330
2020-03-13 02:56:07,MsFitzieBaby,,4,0,2,"I have TP, paper towels, disinfectant wipes (2 jugs), disinfectant spray, bottle of ibuprofen, bottle of acetaminophen, Emergen C &amp; some perishable food, soooooo",,,,1238297760572432384,https://twitter.com/MsFitzieBaby/status/1238297760572432384
2020-03-13 02:18:33,rzabrodski,KenDBerryMD,0,0,2,"I remember doing my pediatric rotation 40+ years ago when we gave Asa as well as acetaminophen to kids. I also remember my pediatric profs telling me they didn’t give either to their own kids unless they were in serious distress. This is last century stuff.....",,,,1238288307995340800,https://twitter.com/rzabrodski/status/1238288307995340800
2020-03-13 02:14:43,yetidisplay,yetidisplay,1,0,0,"fraction of the attention the FAR rarer school shooters do. Do you watch your kids at all times in the bath? Secure all dangerous meds (to include acetaminophen)? Kids FAR more at danger from these.",,,,1238287341396963329,https://twitter.com/yetidisplay/status/1238287341396963329
2020-03-13 02:08:57,dimmedbulb,,0,0,0,"Gonna take the pain killer (which contains acetaminophen) and go to bed. No dinner. No other meds. I'm in pain. Hopefully I'll be able to warm up in bed and fall asleep all night long.",,,,1238285891543629825,https://twitter.com/dimmedbulb/status/1238285891543629825
2020-03-13 02:01:54,neil_rr,GHEB1978,0,0,1,"It’s not false info, the advice given by top health experts and bodies IS to take medications such as ibuprofen and acetaminophen if exhibiting symptoms. Easiest authoritative sources of such info are PHAC and the like.",,,,1238284118917513218,https://twitter.com/neil_rr/status/1238284118917513218
2020-03-13 01:52:27,RealManInCharge,,1,0,0,"Next step medicine, (get it now before the inevitable rush) acetaminophen - Tylenol Ibuprofen - Advil guaifenesin - Mucinex COVID-19 causes high fevers and attacks the lungs. Tylenol reduces fever, mucinex clears the pathways , Advil is a safe alternative pain reliever",,,,1238281740839464960,https://twitter.com/RealManInCharge/status/1238281740839464960
2020-03-13 01:52:16,osteenam,,3,0,3,"Target was out of: •toilet paper (obviously) •ramen •baby wipes •fig bars ( ) •cold and flu meds (but plenty of ibuprofen and acetaminophen?)",,,,1238281691363328000,https://twitter.com/osteenam/status/1238281691363328000
2020-03-13 01:52:09,wheremoegoes,,0,0,0,"#coronavirus things you should *actually* buy ahead of time (Erm, not sure what the obsession with toilet paper is?): Kleenex, Acetaminophen in 350 mg tablets, Ibuprofen in 200 mg tablets, Mucinex, Robitussin/DayQuil/NyQuil (your cough medicine of choice), and a humidifier.",,,#coronavirus,1238281664947793920,https://twitter.com/wheremoegoes/status/1238281664947793920
2020-03-13 01:47:40,NickMatt1356,thehill,0,0,0,"from my experience fighting the flue for 20 years. Here is the Medicine to fight the Corona. Please read Instructions before you use. Acetaminophen 500mg Dextromethorphan HBr 10mg Dextromethorphan HCl 10mg Guaifenesin 200mg Phenylephrine HCl 6mg",,,,1238280534507368448,https://twitter.com/NickMatt1356/status/1238280534507368448
2020-03-13 01:41:23,OMGquitwhining,bradrudolph,0,0,0,"As if 2018 6.2T in US debt is owned by foreigners, in 2011 China owned 1.3T of our debt, and they are the largest foreign holder of US treasury securities 1.3 direct ownership and $250B of quasi-government paper. And they supply 90% of our antibiotics, acetaminophen,ibuprofen,etc",,,,1238278955725205505,https://twitter.com/OMGquitwhining/status/1238278955725205505
2020-03-13 01:37:16,Pheegie00,Pheegie00,0,0,2,"I should also mention we got 500 pack of acetaminophen, immune builders, and cold/flu meds - just in case as well",,,,1238277920285700096,https://twitter.com/Pheegie00/status/1238277920285700096
2020-03-13 01:34:32,sunshinegrl69,,0,0,1,"i feel really good right now i think i'm just happy but also i took a pain pill and a half plus like 4 acetaminophen so that could be contributing. idk loo",,,,1238277231518064640,https://twitter.com/sunshinegrl69/status/1238277231518064640
2020-03-13 01:30:50,fairysneeze,,0,0,2,"Just did some #panicshopping The suggestion was to stock up on Day- or Nyquil, Mucinex, Acetaminophen (Tylenol), Ibuprofen (Motrin or Advil), and tissues. I'm no medical expert but it sounded more useful than… https://www.instagram.com/p/B9p8uk6nwDM/?igshid=hbawvpk9tue8",,,#panicshopping,1238276301506711553,https://twitter.com/fairysneeze/status/1238276301506711553
2020-03-13 01:24:19,JeanneHiggins13,KatyTurNBC,0,0,0,"Small town Wisconsin today. Panic buying for the first time. Workers in grocery stores characterized it as a “weird day”. One customer bought all the TP. 23 large pkg. Saw a woman take 6 each of Acetaminophen and Ibuprofen. ???? I bought xtra diapers and milk for grandchild.",,,,1238274658144858112,https://twitter.com/JeanneHiggins13/status/1238274658144858112
2020-03-13 01:18:01,goshawke,,1,0,0,"In lieu of panic buying TP for no reason, may I suggest making sure you have acetaminophen and some kind of cough suppressant/expectorant and cold meds, plus soup you in the freezer? Cuz if you DO get sick, and you're not in a risk group, you'll probably be miserable but fine. /1",,,,1238273075000549378,https://twitter.com/goshawke/status/1238273075000549378
2020-03-13 01:00:53,RxOutreach,,0,2,2,"How to keep yourself from getting coronavirus? People can take several steps, including: resting and avoiding overexertion drinking enough water taking acetaminophen, ibuprofen, or naproxen for pain and fever https://bit.ly/2PC4DAY #RxOutreach #Coronavirus",,,#RxOutreach #Coronavirus,1238268760374628352,https://twitter.com/RxOutreach/status/1238268760374628352
2020-03-13 00:55:00,Boaz1951,Kris_Sacrebleu,0,0,0,"REST! hydrate with non-alcoholic, non-caffeinated beverages (water, tea, flavored water, mineral water, carbonated uncolas, etc.). Control aches/pain and fever with appropriate doses of: NSAID, Aspirin or Acetaminophen. Eat! (Soup, salad, fruit, carrots, celery, etc.) Hunker Down",,,,1238267280666001409,https://twitter.com/Boaz1951/status/1238267280666001409
2020-03-13 00:50:29,Mercede12235711,reddy_fisherman,0,0,1,"Lol never mind buying cough syrup or acetaminophen for fever. Something they might actually need to ease the symptoms. They get sick they won’t need toilet paper because they’ll be shittin in their pants..to sick to go to the bathroom lol.",,,,1238266143628038144,https://twitter.com/Mercede12235711/status/1238266143628038144
2020-03-13 00:49:42,Juls4Change,AnyFA2020,0,0,1,"I got Tylenol and Advil because alot of times they will say to alternate ibuprofen and acetaminophen for fever. Bought Gatorade for hydration and electrolytes and chicken soup. Did not buy Mucinex but that probably would not hurt either.",,,,1238265945833066498,https://twitter.com/Juls4Change/status/1238265945833066498
2020-03-13 00:47:21,vespers_cals,,1,0,1,"Time to have a panic attack about the coronavirus and obsessively clean my room and take some Tylenol cause fuck that shit I need acetaminophen and cherry coke fuck I can't sit hai I hate myself whaybisbhaooening I don't know hay to do I'm svared what if I get sixk",,,,1238265355686105088,https://twitter.com/vespers_cals/status/1238265355686105088
2020-03-13 00:46:58,JohnsonDouge,,0,0,0,"ASPIRIN acetaminophen and caffeine kills all bacteria in your system in 1 hour maybe it could kill coronavirus",,,,1238265259237896192,https://twitter.com/JohnsonDouge/status/1238265259237896192
2020-03-13 00:46:33,Renate1217,TheHeatherEm,1,0,1,"I wanted to get some acetaminophen bc I really like the Walmart brand little red ones - it honestly didn’t occur to me that this would be such a hot item tho in hindsight that was rather dumb of me lol. ",,,,1238265156339224578,https://twitter.com/Renate1217/status/1238265156339224578
2020-03-13 00:38:12,RohannenZorbia,,1,0,0,"I didn't go to the game last night, though it broke my heart. I went to the grocery store just to pick up acetaminophen &amp; ibuprofen. I'm assuming I have about a 30% chance of catching this thing eventually and I'm prepared to stay in my basement if so. I think I'm doing my part.",,,,1238263054518956032,https://twitter.com/RohannenZorbia/status/1238263054518956032
2020-03-13 00:37:45,OMGquitwhining,OMGquitwhining,1,0,11,"As if 2018 6.2T in US debt is owned by foreigners, in 2011 China owned 1.3T of our debt, and they are the largest foreign holder of US treasury securities 1.3 direct ownership and $250B of quasi-government paper. And they supply 90% of our antibiotics, acetaminophen,ibuprofen,etc",,,,1238262941868347393,https://twitter.com/OMGquitwhining/status/1238262941868347393
2020-03-13 00:37:21,Kynsik,,1,0,0,"What OTC’s should people have on hand (if even still available to buy)? #Covid_19 My list includes acetaminophen, ibuprofen, zinc and electrolytes. What else?",,,#Covid_19,1238262841725145091,https://twitter.com/Kynsik/status/1238262841725145091
2020-03-13 00:34:57,LibraryRaya,lieberian,0,0,0,"I’m so sorry that you’re sick. Are you taking acetaminophen to reduce the fever?",,,,1238262237753638913,https://twitter.com/LibraryRaya/status/1238262237753638913
2020-03-13 00:33:50,Samantha_Eaton3,ScottJ_Moses,0,0,1,"I’m very low key with this stuff but I am also PREPARED. Stocked up on animal feed, cat litter, SOUP!, acetaminophen and NyQuil, etc. I’m ready.",,,,1238261955011530752,https://twitter.com/Samantha_Eaton3/status/1238261955011530752
2020-03-13 00:21:39,zootytang,,0,0,3,"i got beans, acetaminophen, ginger ale, and weed. if that don’t do it then idk bruh.",,,,1238258888497156099,https://twitter.com/zootytang/status/1238258888497156099
2020-03-13 00:21:25,alsoJulZ,ClevelandChick,1,0,0,"Bought Mucinex this am and Charles and I have always had enough acetaminophen and ibuprofen on hand to choke a horse, regardless.",,,,1238258830158573568,https://twitter.com/alsoJulZ/status/1238258830158573568
2020-03-13 00:13:24,DeadAirJeff,,2,0,9,"Everyone is obviously brawling over toilet paper, soap, sanitizer, etc... But please don't forget to make sure you have stuff to take care of yourself if you do get sick... - ibuprofen - acetaminophen - electrolyte drinks - extra inhalers (for those who need them)",,,,1238256810877992961,https://twitter.com/DeadAirJeff/status/1238256810877992961
2020-03-13 00:08:45,maryangelafitz,jasmineelgamal,1,1,1,"Alternate acetaminophen &amp; ibuprofen every 3 hours (unless he has liver or stomach problems or takes other meds that would interact) Drink lots of water, electrolyte solution Monitor the fever, keep him isolated Treat the cough with OTC cough medicine (check for acetaminophen)",,,,1238255641942163458,https://twitter.com/maryangelafitz/status/1238255641942163458
2020-03-13 00:07:39,High_Blood_PrJN,,0,0,0,"Certain Drugs Can Affect The Effectiveness Of Hypertension Medication Among Them Are Non-Steroidal Anti-Inflammatory Drugs (NSAIDs), Acetaminophen, Or Hormones There are drugs that can restrict ... - ",,,,1238255365420126210,https://twitter.com/High_Blood_PrJN/status/1238255365420126210
2020-03-13 00:00:51,HarmlessYardDog,SelimSeesYou,4,10,48,"- Canned fruits, veggies, soup - Pasta and jarred sauces - Granolas, nuts, peanut butter - Distilled water - Toilet paper - Oatmeal - Ibuprofen, acetaminophen, popsicles (for fever) - anti-nausea/diarrhea meds - electrolytes, crackers, jello (in case of above) - Hand sanitizer",,,,1238253654601338881,https://twitter.com/HarmlessYardDog/status/1238253654601338881
