date,username,to,replies,retweets,favorites,text,geo,mentions,hashtags,id,permalink
2020-03-11 12:45:25,AndLucro,IngriPauline,1,0,1,"Amphetamine and smoking",,,,1237721290187948032,https://twitter.com/AndLucro/status/1237721290187948032
2020-03-11 12:41:32,amphetamine47,,0,0,1,"Two old white dudes just walked in to this Panera and took a 10-top. For two of them. Why are you like this?",,,,1237720312009146369,https://twitter.com/amphetamine47/status/1237720312009146369
2020-03-11 12:25:28,patty_omalley,Hermit_Thrush,0,0,0,"It's never too late to turn things around king! Save up for a lab to synthesize your own amphetamine if you can't access your prescription, go back to school or a different school if that one won't have you and most importantly start getting yourself out there and getting pussy!",,,,1237716267290619904,https://twitter.com/patty_omalley/status/1237716267290619904
2020-03-11 12:05:37,MCWronski,discoposse,0,0,0,"If it’s a Mac, the amphetamine app does a great job.",,,,1237711271375581184,https://twitter.com/MCWronski/status/1237711271375581184
2020-03-11 11:39:25,TrumpyGrl,,0,0,0,"This is what scumbag ILLEGALS are bringing to the US! U.S. Customs and Border Protection, apprehended 2 men from Mexico in separate drug smuggling attempts of alleged amphetamine and cocaine worth almost $800K at the Hidalgo Bridge in the last few days. ",,,,1237704676985966593,https://twitter.com/TrumpyGrl/status/1237704676985966593
2020-03-11 10:33:50,HotgluNGlitter,keystonekabes,0,0,0,"My money is on Dexedrine. He’s got that straight OG amphetamine edge all the time. Adderal is a little smoother.",,,,1237688172605104128,https://twitter.com/HotgluNGlitter/status/1237688172605104128
2020-03-11 10:12:16,Spacejunkie4,MysterySolvent,0,0,1,"Disengaged & zoned-out. I used to think he was having a crash from snorting his favorite amphetamine, but now I think it's dementia, AND a crash from snorting his favorite amphetamine. ",,,,1237682746337775616,https://twitter.com/Spacejunkie4/status/1237682746337775616
2020-03-11 10:02:17,dogriguez,pibblecollector,1,0,0,"I don’t even know how to respond to that. Have you read any of the articles by mental healthcare professionals? He exhibits all the signs of frontotemporal dementia exacerbated by amphetamine abuse.",,,,1237680234138341377,https://twitter.com/dogriguez/status/1237680234138341377
2020-03-11 09:56:04,NewCryptoGuide,Proof_of_Skate,0,0,0,"It’s a stim, just not an amphetamine.",,,,1237678671877505024,https://twitter.com/NewCryptoGuide/status/1237678671877505024
2020-03-11 09:25:55,Amphetamine789,DrLalKhanKakar,0,0,3,"No doubt. ",,,,1237671084234805248,https://twitter.com/Amphetamine789/status/1237671084234805248
2020-03-11 08:41:18,weirdwithwords,majorsimp,1,0,1,"I dunno I'm not less happy than before I started using twitter. quite the opposite. but I'm also not joking when I say this is filling the whole amphetamine left behind. I dunno what that says. maybe this is coping, maybe it's perpetuation.",,,,1237659854430445568,https://twitter.com/weirdwithwords/status/1237659854430445568
2020-03-11 08:26:09,Drugtruthaust,once_great,1,0,0,"Amphetamine and caffeine are stimulants, so in terms of their basic effects, yes. They are however, different substances. 'Ice' is not as toxic as alcohol. If you want to talk about associations with violence and sexual assault, then alcohol is the drug we will be discussing.",,,,1237656041598279681,https://twitter.com/Drugtruthaust/status/1237656041598279681
2020-03-11 07:41:20,ahealthgothgf,christapeterso,1,0,0,"I feel this so so strongly. I border on non-functionality without my daily amphetamine-fueled cocktail, and my psychiatrist told me my addiction is more emotional dependence for the mood effects LOL. It's like you just can't win, right?",,,,1237644764163399680,https://twitter.com/ahealthgothgf/status/1237644764163399680
2020-03-11 07:20:23,KZSCspins,,0,0,0,"Mad River - Amphetamine Gazelle (Love Is the Song We Sing: San Francisco Nuggets 1965-1970) ",,,,1237639488744103937,https://twitter.com/KZSCspins/status/1237639488744103937
2020-03-11 07:01:23,SaveEarthFromUs,concit1USA,0,0,0,"Evidence that @realDonaldTrump is snorting Adderall is a combination medication containing four salts of amphetamine. is used in the treatment of attention deficit hyperactivity disorder &amp; narcolepsy, is also used as an athletic performance enhancer and cognitive enhancer ",,@realDonaldTrump,,1237634707883315200,https://twitter.com/SaveEarthFromUs/status/1237634707883315200
2020-03-11 06:03:55,ctbeiser,,1,0,10,"on the other hand I have heard about someone who started staying up all night and taking large doses of amphetamine to prepare for coronavirus, which led directly to a schizophrenic break. so maybe it's true for some people.",,,,1237620247483441152,https://twitter.com/ctbeiser/status/1237620247483441152
2020-03-11 05:02:52,fredward1129,,0,0,2,"Amphetamine by smino is one of those songs that puts me in a really good head space",,,,1237604884519596033,https://twitter.com/fredward1129/status/1237604884519596033
2020-03-11 04:47:49,SinCalChewy,,0,0,0,"Amphetamine got my stummy feelin’ sicklyyy... #selfie #LongHair #Tubeie #Spoonie #JTube #JTubeButton #MICKeyButton #TubeFeeding #FeedingTube #Health #Gastroparesis #ChronicHealth #ChronicPain… https://www.instagram.com/p/B9lJrazAZba/?igshid=28c70eejmlcs",,,#selfie #LongHair #Tubeie #Spoonie #JTube #JTubeButton #MICKeyButton #TubeFeeding #FeedingTube #Health #Gastroparesis #ChronicHealth #ChronicPain,1237601094643007489,https://twitter.com/SinCalChewy/status/1237601094643007489
2020-03-11 04:47:05,mochajaya,,0,0,0,"Been thinking to try amphetamine",,,,1237600913436467200,https://twitter.com/mochajaya/status/1237600913436467200
2020-03-11 04:45:02,mel_amphetamine,,0,0,12,"Nobody asked, but the Foreigner concert was sick as frick",,,,1237600396475916289,https://twitter.com/mel_amphetamine/status/1237600396475916289
2020-03-11 04:32:01,petty_bourgeois,,1,0,0,"they had benzedrine, like, just available everywhere, whenever you wanted it. think about it: you could just buy amphetamine back then with your groceries",,,,1237597121445937152,https://twitter.com/petty_bourgeois/status/1237597121445937152
2020-03-11 03:29:14,Whatarewetalki1,paulahe45735014,1,0,1,"I totally agree with you. He would test positive for Adderall & any other kind of amphetamine. Also some kind of downer to make him sleep. My question is, he is already wetting his pants. Who’s going to be changing his diapers when he’s out of office in November? Oh Rudy will ",,,,1237581321800540160,https://twitter.com/Whatarewetalki1/status/1237581321800540160
2020-03-11 03:27:53,spooky_spectres,not_like_thecar,1,0,2,"Joe gonna develop amphetamine psychosis at some point I guarantee it",,,,1237580979385991168,https://twitter.com/spooky_spectres/status/1237580979385991168
2020-03-11 03:11:15,SonjaHHarris,,0,0,0,"U.S. Customs and Border Protection, Office of Field Operations apprehended two men from Reynosa, Mexico in two separate drug smuggling attempts of alleged amphetamine and cocaine worth almost $800K at the Hidalgo International Bridge in the last few days. ",,,,1237576792283607040,https://twitter.com/SonjaHHarris/status/1237576792283607040
2020-03-11 03:06:15,mauricioibrr,,0,0,1,"high like amphetamine, maybe you’re just a dream",,,,1237575536924184576,https://twitter.com/mauricioibrr/status/1237575536924184576
2020-03-11 02:51:36,gstayupp,,1,0,0,"Selalu suka sensasi abis minum espresso. That's why, If you give me something more than caffeine less than amphetamine, then I love you. #prinsip",,,#prinsip,1237571848872714240,https://twitter.com/gstayupp/status/1237571848872714240
2020-03-11 02:21:35,Anthony63121690,Anthony63121690,2,0,0,"Having ""de-fatted"" neurons is indicative of a horribly inflammatory auto-immune response to an induced foreign body stimulus. The fact that an amphetamine derivative treats it ought to make anyone realize the source point is immune response related.",,,,1237564293375115264,https://twitter.com/Anthony63121690/status/1237564293375115264
2020-03-11 02:18:40,WalangHiyaDMV,BookOfJJ,0,0,0,"Amphetamine - Smino, wait on the beat switch",,,,1237563562974797826,https://twitter.com/WalangHiyaDMV/status/1237563562974797826
2020-03-11 02:15:44,omarrojasxo,,0,0,1,"Amphetamine got my stomach feeling sickly",,,,1237562821052784642,https://twitter.com/omarrojasxo/status/1237562821052784642
2020-03-11 02:10:32,zazenpractise,,0,0,0,"Now we need to pump Biden full of amphetamine to get him across the finish line.",,,,1237561514342543360,https://twitter.com/zazenpractise/status/1237561514342543360
2020-03-11 01:53:38,BisgroveRhys,thewanreport,0,0,0,"You must try housing amphetamine solphate at 90 proff for two week only the amphetamine will corrode the coronavirus or youus anntynervers gass compound from UK which will stop nervous sistem from corlapsing",,,,1237557259418263552,https://twitter.com/BisgroveRhys/status/1237557259418263552
2020-03-11 01:22:55,LouisHtheLoser,,0,0,0,"Amphetamine got my stummy feeling sicklyyyyyy",,,,1237549533086617601,https://twitter.com/LouisHtheLoser/status/1237549533086617601
2020-03-11 01:08:53,hot_jughead,,0,0,2,"i don't think a website tracking algorithm is ever gna own me harder than the time amazon filled my suggested purchases list w/ awful pastel skirts & babydoll t-shirts after a weekend amphetamine binge led me 2 watch nothing but fully-clothed JOI vids",,,,1237545998597021700,https://twitter.com/hot_jughead/status/1237545998597021700
2020-03-11 00:52:24,bitsniper1,rahm3sh,0,0,0,"Wtf are they 2in amphetamine or coke. Really disturbing watch how they move",,,,1237541852858859521,https://twitter.com/bitsniper1/status/1237541852858859521
2020-03-11 00:52:00,AntifaPhanatic,Boudiccea3,0,0,0,"Trump is an amphetamine addict. I’ll take Biden",,,,1237541750605934593,https://twitter.com/AntifaPhanatic/status/1237541750605934593
2020-03-11 00:51:45,S0YHANNAH,only2alive,0,0,3,"Soulfight- The Revivalists Ttktv- Injury Reserve GONE GONE/THANK YOU - Tyler, the creator to build a home - cinematic orchestra stand tall - childish gambino weight of love - the black keys Amphetamine - Smino Transatlantic Flight - Leif Vollebekk Orange Sky-Alexi Murdoch",,,,1237541686332420096,https://twitter.com/S0YHANNAH/status/1237541686332420096
2020-03-11 00:51:44,Edgwyz1,TomJChicago,0,0,0,"Look how dilated his eyes are. It’s 100% impossible to hide hard-core amphetamine addition...you can’t hide those BIG BLACK PUPILS NUMBSKULL!!!",,,,1237541684012929027,https://twitter.com/Edgwyz1/status/1237541684012929027
2020-03-11 00:51:25,ManoLife,,0,0,0,"Amphetamine got my stummy feeling sickly",,,,1237541602890887168,https://twitter.com/ManoLife/status/1237541602890887168
2020-03-10 23:57:35,AmpSulphate,SJXSJC,0,0,3,"Years from now you guys will be forming a support group Honoured to have you and @chriszeischegg all on board!",,@chriszeischegg,,1237528054638891008,https://twitter.com/AmpSulphate/status/1237528054638891008
2020-03-10 23:57:10,psychmd1,MysterySolvent,0,0,1,"Amphetamine withdrawl perhaps.",,,,1237527949709955073,https://twitter.com/psychmd1/status/1237527949709955073
2020-03-10 22:46:43,kaylacksleep,,1,1,2,"Listened to Amphetamine for the first time and wow noname coming in out of nowhere was magical lol",,,,1237510220693340160,https://twitter.com/kaylacksleep/status/1237510220693340160
2020-03-10 21:51:17,thesunlounge23,,0,0,0,"freaky funk basslines, amphetamine-fueled disco rhythms, and flamboyant string melodies guide a proto-house fever dream while a radiant diva soars through the sky thanks to #Masarima (@MWhodamanny, @MysticJungle, #Milord) and @Clonedotnl",,@MWhodamanny @MysticJungle @Clonedotnl,#Masarima #Milord,1237496273248251904,https://twitter.com/thesunlounge23/status/1237496273248251904
2020-03-10 21:44:20,KInfusionCenter,,0,0,0,"#Ketamine is an excellent solution to treating your #PTSD #KetamineInfusionCenter #ketamine #drugs #amphetamine #opiates #drugtest #drugtesting #legalhighs",,,#Ketamine #PTSD #KetamineInfusionCenter #ketamine #drugs #amphetamine #opiates #drugtest #drugtesting #legalhighs,1237494521383890944,https://twitter.com/KInfusionCenter/status/1237494521383890944
2020-03-10 21:42:13,mcmannello,Chenbariatrics1,1,0,9,"I know this is not an important piece of the COVID-19 battle to focus on right now, but I’m curious whether this will “unmask” genetic cardiomyopathies as we’ve seen in things like amphetamine use or pregnancy? #cardiogen #gcchat",,,#cardiogen #gcchat,1237493991383257089,https://twitter.com/mcmannello/status/1237493991383257089
2020-03-10 21:34:19,Derrzerker,realDonaldTrump,0,0,0,"Nothing quite like that late afternoon amphetamine kick, amirite?",,,,1237492003874709504,https://twitter.com/Derrzerker/status/1237492003874709504
2020-03-10 21:32:17,DingoCobber,RobertArnol,1,0,3,"The amount of amphetamine in his nostrils will kill viruses?",,,,1237491492190449664,https://twitter.com/DingoCobber/status/1237491492190449664
2020-03-10 21:28:57,JBenjaminRose1,,1,0,2,"Apparently my charm, in the southwest, Can read like meth amphetamine But actually I was a heroin addict Who now gets by on weed And a lil drink Some sex Shopping Power plays Manipulation Yoga Self-slut-shaming etc",,,,1237490653120036866,https://twitter.com/JBenjaminRose1/status/1237490653120036866
2020-03-10 21:23:45,EggExodus,JonathanSimon14,0,0,1,"Amphetamine for everyone??? ",,,,1237489342781599744,https://twitter.com/EggExodus/status/1237489342781599744
2020-03-10 21:21:03,JonathanSimon14,Hope012015,0,0,5,"Well, back when I was a kid, my mother once gave me Dexamil (amphetamine), having confused them with my Erythromycin (antibiotic). For a few hours there I became a very stable genius and it certainly did cure my flu. ",,,,1237488664172617728,https://twitter.com/JonathanSimon14/status/1237488664172617728
2020-03-10 21:20:41,JonathanSimon14,Hope012015,3,1,15,"Well, back when I was a kid, my mother once gave me Dexamil (amphetamine), having confused them with my Erythromycin (antibiotic). For a few hours there I became a very stable genius and it certainly did cure my flu.",,,,1237488571541377024,https://twitter.com/JonathanSimon14/status/1237488571541377024
2020-03-10 20:54:09,Shaila_MT,,0,0,0,"God hid in amphetamine waves, margaritas and disposable days",,,,1237481894536720384,https://twitter.com/Shaila_MT/status/1237481894536720384
2020-03-10 20:54:07,capecipher1,putinsgay,0,0,0,"Even the Adderall Amphetamine won't keep you up forever ",,,,1237481884470345730,https://twitter.com/capecipher1/status/1237481884470345730
2020-03-10 20:53:26,teemcee,,3,0,1,"$19 per pill is just crazy! Thing is, I could probably take a generic like amphetamine salts but the same insurance company refuses to allow this for some reason. I’ll never understand the healthcare industry.",,,,1237481713778839552,https://twitter.com/teemcee/status/1237481713778839552
2020-03-10 20:41:51,richardalunw,DrJillStein,0,1,0,"@TheDemocrats @GOP Jill Stein is a reality denier. Refusing to focus on the real problem of those in the 2020 Pres. race! For some time, Trump has been presenting the obvious signs/symptoms of dementia-not to mention amphetamine snorting addiction! See video evidence of each ",,@TheDemocrats @GOP,,1237478797835993090,https://twitter.com/richardalunw/status/1237478797835993090
2020-03-10 20:39:09,mel_amphetamine,EmmaVigeland,0,0,1,"Imagine thinking an endorsement from Warren will mean a win for Bernie. Couldn’t be me.",,,,1237478121122775040,https://twitter.com/mel_amphetamine/status/1237478121122775040
2020-03-10 20:27:57,haiku_high,TimInHonolulu,0,0,0,"Amphetamine addicts often do. #MAGA fear and inferiority kill at home and abroad",,,#MAGA,1237475299669020672,https://twitter.com/haiku_high/status/1237475299669020672
2020-03-10 20:19:24,iShrike,,1,0,0,"Yeah, AR-14, AR-15...whatever it takes. They can spike Biden's oatmeal with amphetamine like they did for the debate with Paul Ryan where he folded like a bad lawn chair when faced with feisty Joe but Trump isn't a wussy like Ryan...not by a LONG shot ",,,,1237473147814727681,https://twitter.com/iShrike/status/1237473147814727681
2020-03-10 20:12:44,Furkan_Ozdmir,,0,0,1,"I don't need eyes to see I felt you touchin' me High like amphetamine Maybe you're just a dream ",,,,1237471471812915202,https://twitter.com/Furkan_Ozdmir/status/1237471471812915202
2020-03-10 19:36:36,sethdmichaels,jesseltaylor,0,1,5,"to be a nailbiter in this age is to be in a constant state of total, amphetamine-level awareness, fully cognizant that even the slightest drift in attention will result in face-touching on the most egregious kind",,,,1237462378662572034,https://twitter.com/sethdmichaels/status/1237462378662572034
2020-03-10 19:17:42,hippiegypsyslut,,0,0,0,"Once men have tasted caviar, it baffles me how they settle for catfish.",,,,1237457623605223425,https://twitter.com/hippiegypsyslut/status/1237457623605223425
2020-03-10 19:16:37,MsReyda,Maine_Char,0,0,0,"Amphetamine got his stomach feeling sickly! ",,,,1237457350547529729,https://twitter.com/MsReyda/status/1237457350547529729
2020-03-10 18:49:51,d0v813v,zenjen53,0,0,1,"He's a germaphobe. It's just that he's not very bright. Also the term ""scatter-brained"" comes to mind. I honestly can't imagine what amphetamine corroded, syphilitic infested, old, paranoid synapse firings in his brain must be like.",,,,1237450611295236097,https://twitter.com/d0v813v/status/1237450611295236097
2020-03-10 18:47:26,dirtnastybot,,0,0,0,"no amphetamine morning it's natural state ",,,,1237450004261941249,https://twitter.com/dirtnastybot/status/1237450004261941249
2020-03-10 18:41:51,MWilliwaw,ddale8,0,0,0,"The ramblings of an amphetamine addict. MF is high. #TrumpLiesAboutCoronavirus",,,#TrumpLiesAboutCoronavirus,1237448601653202946,https://twitter.com/MWilliwaw/status/1237448601653202946
2020-03-10 18:40:12,amphetamine47,mollyhc,0,0,1,"Fuck US Soccer, a thread:",,,,1237448183019700224,https://twitter.com/amphetamine47/status/1237448183019700224
2020-03-10 18:37:31,_start_me_up,,0,0,0,"@ScotRail sack Brendan x",,@ScotRail,,1237447510161010694,https://twitter.com/_start_me_up/status/1237447510161010694
2020-03-10 18:34:47,amphetamine47,,0,0,5,"Video interview with a second employer!! Sacrifice goats for me y'all!",,,,1237446821770919936,https://twitter.com/amphetamine47/status/1237446821770919936
2020-03-10 18:30:30,2daysamejane,TheRickWilson,0,0,0,"Travel restrictions cutting into his necessary amphetamine supply.",,,,1237445744853999618,https://twitter.com/2daysamejane/status/1237445744853999618
2020-03-10 18:19:27,FPerturbed,Barbara73663852,0,0,0,"If you look at her eyes, she has an Amphetamine problem...",,,,1237442962981900288,https://twitter.com/FPerturbed/status/1237442962981900288
2020-03-10 18:16:16,dbaofdoom,prchovanec,0,0,0,"They've got to spin his amphetamine use somehow.",,,,1237442162532462592,https://twitter.com/dbaofdoom/status/1237442162532462592
2020-03-10 18:12:31,thehumanworld,,0,0,0,"The closest I ever got to legal amphetamine was eating 12 @dunkindonuts long johns in 8 mins",,@dunkindonuts,,1237441215689363458,https://twitter.com/thehumanworld/status/1237441215689363458
2020-03-10 18:08:14,kiellingshit,,0,0,0,"its like the amphetamine, how it marinate on my mind",,,,1237440137765597184,https://twitter.com/kiellingshit/status/1237440137765597184
2020-03-10 18:07:41,daramola_amos,Shegsmith5,1,0,0,"What's their problem with this man?",,,,1237440003120209921,https://twitter.com/daramola_amos/status/1237440003120209921
2020-03-10 17:44:46,sarabelxo,,0,0,0,"amphetamine got my stummy feeling sicklyyy",,,,1237434233305661440,https://twitter.com/sarabelxo/status/1237434233305661440
2020-03-10 17:24:39,phyliciamariee,,0,0,1,"amphetamine is truly an elite song",,,,1237429169677533185,https://twitter.com/phyliciamariee/status/1237429169677533185
2020-03-10 17:14:42,tomspeed,putinsgay,0,0,0,"Third option: he’s an amphetamine addict",,,,1237426669348179969,https://twitter.com/tomspeed/status/1237426669348179969
2020-03-10 17:12:57,joshuaglidden,ThatEricAlper,0,0,0,"I've always thought this line from Return of the Grievous Angel was referring to Elvis, but after looking at the lyrics again, maybe it's not...? Any thoughts from anyone? ""The news I could bring I met up with the king On his head an amphetamine crown""",,,,1237426225578160131,https://twitter.com/joshuaglidden/status/1237426225578160131
2020-03-10 17:06:13,ZhangFei33,ZhangFei33,1,0,0,"This amphetamine plan has been hidden under the veil of a huge pachinko remittance system. Japanese politics, education and journalism are under the control of CCP. Conservative, liberal, mafia, and religious socialism are all under the control of CCP in Japan.",,,,1237424533998424064,https://twitter.com/ZhangFei33/status/1237424533998424064
2020-03-10 17:06:06,ZhangFei33,ZhangFei33,1,0,0,"North Korea made amphetamine and pour it into Japan. Japanese become better Mathematic by amphetamine and take away American jobs. Japanese drive around the world and Chinese culture will dominate the whole world. Japan is Chinese Communist Party vanguard.",,,,1237424505431060482,https://twitter.com/ZhangFei33/status/1237424505431060482
2020-03-10 16:59:52,robertryan323,joncoopertweets,0,1,3,"A fine example for the republic . A court mandated Syphilis exam , An Amphetamine screening , and Coronavirus test should be mandatory for emperor Don",,,,1237422934140039170,https://twitter.com/robertryan323/status/1237422934140039170
2020-03-10 16:52:15,EvilxxTwin,,0,0,1,"tou mt preso a “amphetamine” do smino e “my favorite” da heather victoria",,,,1237421018152611842,https://twitter.com/EvilxxTwin/status/1237421018152611842
2020-03-10 16:48:18,k3tameme,,3,2,24,"I would like a nice cocktail of ketamine, amphetamine and alprazolan",,,,1237420024047882240,https://twitter.com/k3tameme/status/1237420024047882240
2020-03-10 16:24:15,beckness,DiojeanneSignup,1,0,1,"But you see, that was conflating amphetamine abuse and narcissistic personality disorder as dementia. You can't just point out possibly real dementia symptoms as dementia -- that's uncalled for!",,,,1237413971696762880,https://twitter.com/beckness/status/1237413971696762880
2020-03-10 16:05:40,Mechalith,scretladyspider,1,0,2,"Vyvanse is a powerful amphetamine, so it will act like someone mainlining a ton of caffeine or doing cocaine on an NT person, they get much more Awake and may *feel* more functional, but the kind of reaction they get is pretty definitely different than what I do.",,,,1237409294435241986,https://twitter.com/Mechalith/status/1237409294435241986
2020-03-10 15:49:42,ridandy20,,0,0,0,"Amphetamine got my tummy feeling sickly ",,,,1237405277965750279,https://twitter.com/ridandy20/status/1237405277965750279
2020-03-10 15:34:42,barrettbites,ThatEricAlper,0,0,0,"Steve Wynn.. Amphetamine.. Song most likely to get you caught speeding.",,,,1237401502811140099,https://twitter.com/barrettbites/status/1237401502811140099
2020-03-10 15:32:58,_start_me_up,,0,0,4,"Little rip in the bum of my favourite jeans.. the struggles of being this damn thicc smh ",,,,1237401066314096644,https://twitter.com/_start_me_up/status/1237401066314096644
2020-03-10 15:26:15,crutchvax,,0,0,2,"Caffeine from sources other than coffee and tea consistently makes me feel crazier and closer to death than copious amphetamine usage ever has",,,,1237399374977777664,https://twitter.com/crutchvax/status/1237399374977777664
2020-03-10 15:15:24,MaidenSarah1,,0,0,9,"As we're not heading to Leeds tonight to see #TheSistersOfMercy we have their early stuff blasting out in the office. Boss-Guy Simon's just walked in: ""I can hear you lot wailing 'Amphetamine Logic' from the driveway!"" ",,,#TheSistersOfMercy,1237396644921925632,https://twitter.com/MaidenSarah1/status/1237396644921925632
2020-03-10 15:14:51,VinKohl,FT1965,1,0,3,"There's always a price to pay for decades of amphetamine abuse, Trump is finding that out now!",,,,1237396506891747328,https://twitter.com/VinKohl/status/1237396506891747328
2020-03-10 15:08:17,ZhangFei33,ZhangFei33,1,0,0,"I think Mao's crazy thought was the influence of amphetamine. Because amphetamine associat with brain arousal and sexual arousal. Mao's nympho was by drugs. (Some say that Mao was brain syphilis.)",,,,1237394854662959104,https://twitter.com/ZhangFei33/status/1237394854662959104
2020-03-10 15:06:57,ZhangFei33,ZhangFei33,1,0,0,"They sold amphetamine to Japan for long time. I think Now it has changed to Philippines route for Dec.22, 2001 Coronavirus infection is spreading to regain this drug route. They are begging, ""Buy amphetamine and give me money.""",,,,1237394518242025474,https://twitter.com/ZhangFei33/status/1237394518242025474
2020-03-10 14:23:12,ZhangFei33,ZhangFei33,1,0,0,"This amphetamine plan has been hidden under the veil of a huge pachinko remittance system. Japanese politics, education and journalism are under the control of CCP. Conservative, liberal, mafia, and religious socialism are all under the control of CCP in Japan.",,,,1237383508458237959,https://twitter.com/ZhangFei33/status/1237383508458237959
2020-03-10 14:22:51,ZhangFei33,ZhangFei33,1,0,0,"North Korea made amphetamine and pour it into Japan. Japanese become better Mathematic by amphetamine and take away American jobs. Japanese drive around the world and Chinese culture will dominate the whole world. Japan is Chinese Communist Party vanguard.",,,,1237383418914017288,https://twitter.com/ZhangFei33/status/1237383418914017288
2020-03-10 14:20:55,amphetamine47,,0,0,2,"Perks of being unemployed: lounging in bed with my cats while it rains outside.",,,,1237382935248019456,https://twitter.com/amphetamine47/status/1237382935248019456
2020-03-10 13:55:06,zara_amidala,,0,0,0,"amphetamine got my tummy feeling sickly",,,,1237376435897151488,https://twitter.com/zara_amidala/status/1237376435897151488
