date,username,to,replies,retweets,favorites,text,geo,mentions,hashtags,id,permalink
2020-03-13 18:09:03,WVKRFM,,0,0,0,"Just played: Amphetamine - Steve Wynn - Static Transmission",,,,1238527507923599364,https://twitter.com/WVKRFM/status/1238527507923599364
2020-03-13 18:02:27,Mambratom,IAMJUSTADONALD,1,0,2,"that would the kool-aid flavor ""Awesome Amphetamine!""",,,,1238525845867827200,https://twitter.com/Mambratom/status/1238525845867827200
2020-03-13 17:59:49,__solodolo__,,0,0,3,"11. @smino - blkswn (2017) Silky smooth production, clever lyricism, and country grammar that's more rewarding every listen Essential Tracks: Amphetamine, Spitshine, Edgar Allen Poe'd Up ft. @themind https://open.spotify.com/album/3bTjPEgPzm1XwXsNlMVHhs?si=t_Ni-bWeS4Scr1jF1r9c5w",,@smino @themind,,1238525186263126016,https://twitter.com/__solodolo__/status/1238525186263126016
2020-03-13 17:15:47,jotocoyotes,MichaelCoudrey,0,0,1,"And you support an amphetamine addict who sleeps with pornstars all while claiming to be christian. Shameful.",,,,1238514102307295234,https://twitter.com/jotocoyotes/status/1238514102307295234
2020-03-13 17:13:43,jotocoyotes,CarmineSabia,0,0,0,"As opposed to the amphetamine user who sleeps with pornstars who is currently Pres. Come on carmen",,,,1238513582142341120,https://twitter.com/jotocoyotes/status/1238513582142341120
2020-03-13 17:12:51,jotocoyotes,johncardillo,0,0,0,"I just remembered a pill head racist was awarded the medal of freedom and an amphetamine addict who sleeps with pornstars is the president",,,,1238513366701879296,https://twitter.com/jotocoyotes/status/1238513366701879296
2020-03-13 17:11:30,amphetamine47,RightWingWatch,0,0,1,"Dear Christians: stop this fucking nonsense for fucks sake.",,,,1238513025189117952,https://twitter.com/amphetamine47/status/1238513025189117952
2020-03-13 17:09:25,FindingMecca,cacaobunni,0,0,0,"He might’ve been doing another amphetamine and they labeled it meth, but Florida does have a history of planting meth on people just because",,,,1238512500829806593,https://twitter.com/FindingMecca/status/1238512500829806593
2020-03-13 17:03:38,jasonearlbass,,0,0,1,"I been dodging death in a six speeeed, amphetamine got my stummy feeling sicklyyyyyyyy",,,,1238511046702387203,https://twitter.com/jasonearlbass/status/1238511046702387203
2020-03-13 16:56:03,thebig10com,LisaMei62,0,0,2,"Yeah.....maybe.....amphetamine · analeptic · bennie · crank · restorative · speed · stimulant · tonic · upper · uppie ",,,,1238509136922492928,https://twitter.com/thebig10com/status/1238509136922492928
2020-03-13 16:54:05,Tattler0u812,seanhannity,0,0,0,"Yes the only thing wed on Thursday night was Amphetamine Andy's lips to a pipe...",,,,1238508641071902721,https://twitter.com/Tattler0u812/status/1238508641071902721
2020-03-13 16:50:21,jbsrq,,0,0,1,"Meth using dope fiend came within .49% of being governor of #Florida, the third largest state in the US by population Andrew Gillum is a criminal who uses meth amphetamine ",,,#Florida,1238507705133862918,https://twitter.com/jbsrq/status/1238507705133862918
2020-03-13 16:43:34,EmperorNune,MittRomney,0,0,0,"There is NO #coronavirus. Coronavirus is a chinese #HOAX, reminding everyone you need to get drunk of Mexico's national beer Corona's, every night for 2two years until your brain is don heal-reparing from crystal-meth amphetamine addiction. ",,,#coronavirus #HOAX,1238505996428800000,https://twitter.com/EmperorNune/status/1238505996428800000
2020-03-13 16:41:35,INeedGreenJob,Acosta,0,0,0,"Jim, Will you be reporting on CNN contributor and failed gubernatorial candidate Andrew Gillum overdosing on meth amphetamine in a hotel room with other men. I thought not.",,,,1238505496849592322,https://twitter.com/INeedGreenJob/status/1238505496849592322
2020-03-13 16:41:19,CaptMackSparrow,RealCandaceO,1,1,14,"The only things wedded on Thursday night were Amphetamine Andy’s lips to a pipe....",,,,1238505428218032129,https://twitter.com/CaptMackSparrow/status/1238505428218032129
2020-03-13 16:39:22,Roshan_Rinaldi,MAGATRON20201,0,0,1,"Of course he was. But they aren't mutually exclusive. I was wondering if he's not a Coronavirus positive amphetamine junky. ",,,,1238504940982743044,https://twitter.com/Roshan_Rinaldi/status/1238504940982743044
2020-03-13 16:27:17,lura12ab,dawso007,1,0,0,"In your opinion is methylphenidate less addictive than amphetamine? Canada has methylphenidate as schedule 3 opposed to schedule 2",,,,1238501899319599105,https://twitter.com/lura12ab/status/1238501899319599105
2020-03-13 16:26:30,seanmpatton,BootsRiley,0,0,0,"Bc he’s not as corrupt, not a narcissistic 8 year old with a heavy amphetamine problem that wants to run the country like one of his many, many failed and bankrupt businesses. Bc he’s not trying to personally enrich himself, quite as much. And because he’s not in debt to Putin.",,,,1238501700417306624,https://twitter.com/seanmpatton/status/1238501700417306624
2020-03-13 16:26:27,amphetamine47,,1,0,1,"My grandma is making absolutely no changes to her routine, because ""no one's sick"" ",,,,1238501686865518594,https://twitter.com/amphetamine47/status/1238501686865518594
2020-03-13 16:16:39,JBrinkins,AndrewGillum,0,0,2,"Sounds like amphetamine induced psychosis to me.",,,,1238499221075972096,https://twitter.com/JBrinkins/status/1238499221075972096
2020-03-13 16:10:05,_start_me_up,M44TE,0,0,1,"Ducks are my FAVOURITE",,,,1238497570395168769,https://twitter.com/_start_me_up/status/1238497570395168769
2020-03-13 15:49:38,freddyatton,realDonaldTrump,10,39,69," ""PHYSIOLOGICAL DISADVANTAGE"" — i'm guessing that he meant ""psychological disadvantage"" — or did he mean ""tactical disadvantage"" — or ""strategic disadvantage"" — somebody else is typing for him — trump is on drugs, he is addicted to amphetamine stimulants STIMULATE THIS ",,,,1238492424596369408,https://twitter.com/freddyatton/status/1238492424596369408
2020-03-13 15:46:43,mel_amphetamine,,2,1,18,"Everyone asks, what if I get coronavirus? but no one ever asks HOW is coronavirus ",,,,1238491689469214720,https://twitter.com/mel_amphetamine/status/1238491689469214720
2020-03-13 15:43:36,leonyaspb,Mobius1OW,0,0,0,"we’ll use your dick then",,,,1238490906887696384,https://twitter.com/leonyaspb/status/1238490906887696384
2020-03-13 15:42:20,kindofjeff,ChuckCallesto,0,0,0,"I’d like a full-investigation into our extremist Caesar President’s amphetamine addiction while we’re at it.",,,,1238490587671736320,https://twitter.com/kindofjeff/status/1238490587671736320
2020-03-13 15:36:49,1kimzo,CoconutBGaming,0,0,0,"try other meds, 20mg vyvanse is a softer amphetamine, long acting, works a lot better for lots of people.",,,,1238489197272432641,https://twitter.com/1kimzo/status/1238489197272432641
2020-03-13 15:36:04,amphetamine47,,0,0,2,"Grandma refers to her hearing aids as earphones and it will never not amuse me.",,,,1238489010101727232,https://twitter.com/amphetamine47/status/1238489010101727232
2020-03-13 15:18:21,amphetamine47,AlexSamuelsx5,0,0,1,"Eat the rich. Start with Bloomberg.",,,,1238484549346177024,https://twitter.com/amphetamine47/status/1238484549346177024
2020-03-13 15:10:31,EtaminPh,realDonaldTrump,0,0,0,"So would you like to get tested for coronavirus since it is reported Bolsonaro is tested positive? ",,,,1238482580451684353,https://twitter.com/EtaminPh/status/1238482580451684353
2020-03-13 15:00:08,amphetamine47,,0,0,2,"Good morning blep",,,,1238479965206781952,https://twitter.com/amphetamine47/status/1238479965206781952
2020-03-13 14:46:37,ChrisMriverrat,ChrisMriverrat,1,0,0,"Because I have really light blue eyes and I’m very light sensitive. I grew up around amphetamine addicts and I do not see any of those traits in Trump. This article is like me accusing you of being a Molly or Xtacy user because you have flower headband in your profile pic and....",,,,1238476566180421632,https://twitter.com/ChrisMriverrat/status/1238476566180421632
2020-03-13 14:35:00,megalorain,Pellemoe,3,0,23,"Amphetamine abuse weakens a person's immunity. He was up all night last night. He can take the antivirals but eventually his immune system will fail",,,,1238473642159177729,https://twitter.com/megalorain/status/1238473642159177729
2020-03-13 14:23:09,LBoucherAuthor,,3,6,10,"When you’re + for alcohol, meth, MJ, amphetamine...is there any wonder why your life is in dissary? Will someone please educate the doctors that until the person gets clean—none of the meds you give them will help. In fact, they will make everything worse! #addiction",,,#addiction,1238470657324847104,https://twitter.com/LBoucherAuthor/status/1238470657324847104
2020-03-13 14:16:31,Zizou_Shongwe,FcVtm,0,0,1,"Congratulations keep fighting the good fight.... you me a good football discussion I miss agreeing to disagree ",,,,1238468991229837316,https://twitter.com/Zizou_Shongwe/status/1238468991229837316
2020-03-13 13:54:48,AliasCivis,DontDMmeMofos,0,0,1,"Can relate. I often just want something that's more than an energy drink, but a bit less than an amphetamine. ",,,,1238463525711949824,https://twitter.com/AliasCivis/status/1238463525711949824
2020-03-13 13:54:34,AliasCivis,DontDMmeMofos,0,0,1,"Can relate. I often just want something that's more than an energy drink, but a bit less than an amphetamine.",,,,1238463467218259968,https://twitter.com/AliasCivis/status/1238463467218259968
2020-03-13 13:50:37,Newsweek,,6,23,35,"Study of wastewater from nearly 50 million people in Europe suggests rise in amphetamine, cocaine, ecstasy and meth consumption ",,,,1238462473532997635,https://twitter.com/Newsweek/status/1238462473532997635
2020-03-13 13:50:11,Real_Xi_Jinping,AryanChungus,1,0,5,"Any amphetamine is more beautiful than fucking Ket",,,,1238462362627309574,https://twitter.com/Real_Xi_Jinping/status/1238462362627309574
2020-03-13 13:36:45,AmpSulphate,DDDrewDaniel,0,0,1,"‘Sir Precious La Foole’ ain’t bad either",,,,1238458983872114694,https://twitter.com/AmpSulphate/status/1238458983872114694
2020-03-13 13:35:32,AmpSulphate,DDDrewDaniel,0,1,3,"Love it!",,,,1238458676584865792,https://twitter.com/AmpSulphate/status/1238458676584865792
2020-03-13 13:21:43,amphetamine47,,0,0,4,"My 90-year old grandmother, who caught both the flu and pneumonia at the same time earlier this year, doesn't believe she's immunocompromised. ",,,,1238455198483468293,https://twitter.com/amphetamine47/status/1238455198483468293
2020-03-13 13:12:55,amphetamine47,,0,0,1,"I may be a little stressed, but this made me laugh for like 10 minutes.",,,,1238452986172637184,https://twitter.com/amphetamine47/status/1238452986172637184
2020-03-13 13:12:04,k_morrissey,xjeremymx,0,0,1,"Just slamming an entire bag of amphetamine solution into the cannula and all the market got was a warm feeling on the back of its neck for 15 minutes",,,,1238452769771491328,https://twitter.com/k_morrissey/status/1238452769771491328
2020-03-13 12:22:48,ZhangFei33,ZhangFei33,1,0,0,"This amphetamine plan has been hidden under the veil of a huge pachinko remittance system. Japanese politics, education and journalism are under the control of CCP. Conservative, liberal, mafia, and religious socialism are all under the control of CCP in Japan.",,,,1238440373032079360,https://twitter.com/ZhangFei33/status/1238440373032079360
2020-03-13 12:22:39,ZhangFei33,ZhangFei33,1,0,0,"North Korea made amphetamine and pour it into Japan. Japanese become better Mathematic by amphetamine and take away American jobs. Japanese drive around the world and Chinese culture will dominate the whole world. Japan is Chinese Communist Party vanguard.",,,,1238440335207837696,https://twitter.com/ZhangFei33/status/1238440335207837696
2020-03-13 12:21:03,AubriGryphon,Riderius,0,0,0,"Keep in mind that Vyvanse is an amphetamine. Think of it as trading up!",,,,1238439930696806400,https://twitter.com/AubriGryphon/status/1238439930696806400
2020-03-13 11:56:18,thinkagainst,MetsMAGA,2,1,5,"Why did Pelosi’s real teeth rot? Amphetamine addiction leads to a loss of teeth. She appears to be addicted to something?",,,,1238433704525148160,https://twitter.com/thinkagainst/status/1238433704525148160
2020-03-13 11:44:23,knuthf,Sverige2019,0,0,0,"It's strange the statistics they can make, and Oslo / Stockholm are like twins - but beat you in amphetamine abuse.",,,,1238430704402419712,https://twitter.com/knuthf/status/1238430704402419712
2020-03-13 11:37:21,tech_incubation,NickTimiraos,0,0,0,"Massive amphetamine like drug injection! Lungs are clogged with a virus. Kidneys are damaged by corruption. Blood flow to all vital systems is not ensured. Fiscal fresh blood pumping will be done... Will the patient survive? #coronavirus #fed #bitcoin #gold #economy",,,#coronavirus #fed #bitcoin #bitcoin #gold #economy,1238428935370739712,https://twitter.com/tech_incubation/status/1238428935370739712
2020-03-13 11:29:13,KondrotSean,realDonaldTrump,0,0,0,"Snort some of your Euro amphetamine and synthesize a cure fearless leader!!!",,,,1238426887657066496,https://twitter.com/KondrotSean/status/1238426887657066496
2020-03-13 11:25:02,fesshole,,14,4,124,"I am a total sudafed junkie. Cursed with genetically shocking sinuses I discovered the joys of sudafed about 12 years ago. Recommended usage 3 days. Have recently discovered it is basically an over the counter amphetamine...explains a LOT!",,,,1238425833695514627,https://twitter.com/fesshole/status/1238425833695514627
2020-03-13 11:25:02,DDonn1,,0,0,0,"Jecelle is currently watching amphetamine pumped up Lars blitz with angel to a pompous choir and orchestra. She is getting people hype while eating opera cake. ",,,,1238425833573924870,https://twitter.com/DDonn1/status/1238425833573924870
2020-03-13 11:22:05,educatedpleb,,0,0,0,"Forgot to mention, herd ( ) on random radio yesterday, that police in Arkansas are offering to test your stash of meth amphetamine for COVID-19.",,,,1238425093795131393,https://twitter.com/educatedpleb/status/1238425093795131393
2020-03-13 11:16:09,MUNCHmma,ibdbmma,1,0,0,"How?? The average fight card is 9hrs you want a 24hr production crew and round the clock judges and commissioners and medics and doctors and a tag team commentary booth on speed Amphetamine??",,,,1238423599318544385,https://twitter.com/MUNCHmma/status/1238423599318544385
2020-03-13 11:07:10,tnsoe,EMCDDA,0,0,4,"Latest waste water analysis study published by @EMCDDA, which focuses on illicit stimulants, provides interesting view on amphetamine, cocaine, ecstasy and methamphetamine use in Europe. The study covers 68 European cities in 23 countries. ",,@EMCDDA,,1238421336453758976,https://twitter.com/tnsoe/status/1238421336453758976
2020-03-13 11:00:58,toooldforit,toooldforit,1,0,0,"Looks like I picked the wrong week to quit amphetamine.",,,,1238419776898314240,https://twitter.com/toooldforit/status/1238419776898314240
2020-03-13 10:58:05,ZhangFei33,ZhangFei33,1,0,0,"I think Mao's crazy thought was the influence of amphetamine. Because amphetamine associat with brain arousal and sexual arousal. Mao's nympho was by drugs. (Some say that Mao was brain syphilis.)",,,,1238419052499877888,https://twitter.com/ZhangFei33/status/1238419052499877888
2020-03-13 10:57:24,ZhangFei33,ZhangFei33,1,0,0,"They sold amphetamine to Japan for long time. I think Now it has changed to Philippines route for Dec.22, 2001 Coronavirus infection is spreading to regain this drug route. They are begging, ""Buy amphetamine and give me money.""",,,,1238418880994762752,https://twitter.com/ZhangFei33/status/1238418880994762752
2020-03-13 10:44:34,ZhangFei33,ZhangFei33,1,0,0,"Amphetamine poisoning and Methamphetamine poisoning destroys humans. Math humans lose their hearts. Cult cyborgs become fake conservative and the spread of cult religion and communist socialism dominate the country.",,,,1238415651431014401,https://twitter.com/ZhangFei33/status/1238415651431014401
2020-03-13 10:14:37,Tmfscott93,,0,0,0,"Pass me the amphetamine, when I can’t focus on anything.",,,,1238408114384310273,https://twitter.com/Tmfscott93/status/1238408114384310273
2020-03-13 09:20:37,NoonanJoe,drugsdotie,0,0,1,"Tests for traces of four amphetamine, cocaine, MDMA (ecstasy) and methamphetamine show an overall rise in the four drugs compared to previous years. #EU #itallcomesoutintheend",,,#EU #itallcomesoutintheend,1238394525443334144,https://twitter.com/NoonanJoe/status/1238394525443334144
2020-03-13 09:14:13,Cianomaidin,BrianCVC,0,0,8,"Clearly the Meth Amphetamine problem is much bigger than had been previously reported in the USA",,,,1238392915283578880,https://twitter.com/Cianomaidin/status/1238392915283578880
2020-03-13 09:03:59,Jura_Harris,SSPCA_Mike,0,1,1,"We could make a start with much stiffer sentencing as a deterrent. Recent sentencing has been woeful. And no prosecutions for 18 doping offences at Shawfield Greyhound Stadium in the last 2 years. Cocaine, amphetamine, beta blockers all used on dogs there and confirmed by GBGB ",,,,1238390337477005313,https://twitter.com/Jura_Harris/status/1238390337477005313
2020-03-13 08:20:56,Prince_Kropotkn,,0,0,2,"> He credits Adderall with his skill at writing so many provocative comments. Are we into the amphetamine crash years of smug's shitty posts yet?",,,,1238379504919179264,https://twitter.com/Prince_Kropotkn/status/1238379504919179264
2020-03-13 07:48:34,hippiegypsyslut,tatumchristine_,0,0,0,"But Sex and the City",,,,1238371357706072064,https://twitter.com/hippiegypsyslut/status/1238371357706072064
2020-03-13 07:29:36,dgwbirch,,0,2,2,"The War on (Some) Drugs is going well: ""Sewage was tested for traces of four illicit drugs: amphetamine, cocaine, MDMA (also known as ecstasy) and methamphetamine. The tests showed an overall rise in the four drugs compared to previous years."" ",,,,1238366586207174656,https://twitter.com/dgwbirch/status/1238366586207174656
2020-03-13 07:18:24,HookedOnBeth,,0,0,1,"This is a bad time to have seasonal allergies in public ",,,,1238363769253720064,https://twitter.com/HookedOnBeth/status/1238363769253720064
2020-03-13 07:00:12,patrickdamen,andyjmorgan,0,0,1,"Always love this tool, when switching to Mac, needed to find an alternative (amphetamine) as I was so used to this. Thanks @andyjmorgan",,@andyjmorgan,,1238359185303183360,https://twitter.com/patrickdamen/status/1238359185303183360
2020-03-13 06:48:49,pgaultier,,0,0,1,"“I know we can’t have [Bond] having amphetamine and speed. But inside, I know I’m doing that. And I wanted to inform the part and say that’s what he is. He’s kind of a fuckup. Because this job would fuck you up.” ",,,,1238356321424027649,https://twitter.com/pgaultier/status/1238356321424027649
2020-03-13 06:43:02,HansPZwetsloot,tofineapoint,2,0,2,"Amphetamine take edges of the Corona insure sourse",,,,1238354865568563201,https://twitter.com/HansPZwetsloot/status/1238354865568563201
2020-03-13 06:32:17,spooky_spectres,_curlytrill,0,0,3,"still at least like a 20% chance that biden forgets where he's at during the debate and drops out.",,,,1238352159726583810,https://twitter.com/spooky_spectres/status/1238352159726583810
2020-03-13 06:28:18,spooky_spectres,,0,0,0,"if i've learned one thing the past few days it's that the number 1 way coronavirus is transmitted is through PvP and online gameplay. in other words i'm redownloading outer worlds and the fallout games",,,,1238351159670312962,https://twitter.com/spooky_spectres/status/1238351159670312962
2020-03-13 06:10:53,niccagefan666,,0,0,3,"if i was gonna have my own infinity gauntlet to master my own reality it would have a blondness stone, a skinny stone, an amphetamine stone, a sparkle stone, and a fuit gummy stone",,,,1238346777297924096,https://twitter.com/niccagefan666/status/1238346777297924096
2020-03-13 05:29:43,spooky_spectres,,0,0,0,"bet they are regretting this slogan",,,,1238336417870331904,https://twitter.com/spooky_spectres/status/1238336417870331904
2020-03-13 05:25:59,spooky_spectres,_curlytrill,0,0,0,"brother i'm buying a bible",,,,1238335476366487552,https://twitter.com/spooky_spectres/status/1238335476366487552
2020-03-13 05:22:52,letmebefell,UberGuber,1,0,1,"It’s Scavino, an amphetamine-riddled troll who is not the president. I’m not sure that should make either of us feel better.",,,,1238334690681069568,https://twitter.com/letmebefell/status/1238334690681069568
2020-03-13 05:21:55,lyssluvsn0thing,,0,0,0,"I’ve being dodging death in the six speed, amphetamine got my stomach feeling sickly ",,,,1238334453149245440,https://twitter.com/lyssluvsn0thing/status/1238334453149245440
2020-03-13 04:25:39,amphetamineSalt,LDRdailys,0,0,0," Let us pray",,,,1238320292562378752,https://twitter.com/amphetamineSalt/status/1238320292562378752
2020-03-13 04:23:00,hungrie_shark,,0,0,4,"step aside bitches, bob_033221 thinks i’m perfect ",,,,1238319627429699584,https://twitter.com/hungrie_shark/status/1238319627429699584
2020-03-13 04:11:40,kxxngbee,,0,0,0,"Amphetamine got my stomach feeling sickly",,,,1238316773964951552,https://twitter.com/kxxngbee/status/1238316773964951552
2020-03-13 04:10:01,spooky_spectres,jinpaynus,0,0,1,"actually 38 years too old and 40 years not gay enough",,,,1238316360343662593,https://twitter.com/spooky_spectres/status/1238316360343662593
2020-03-13 04:03:35,heyitsjankdero,,0,0,0,"Amphetamine got my tummy feeling sicklyyyyyy ",,,,1238314738251182080,https://twitter.com/heyitsjankdero/status/1238314738251182080
2020-03-13 03:55:59,spooky_spectres,KyleKulinski,0,0,0,"what da?!",,,,1238312829280751617,https://twitter.com/spooky_spectres/status/1238312829280751617
2020-03-13 03:54:06,spooky_spectres,,0,0,1,"the absolute funniest time for empire to collapse would be right now, the last thing in the books before coronavirus would be ""they're doing a friends reboot"". simply poetic",,,,1238312352891756545,https://twitter.com/spooky_spectres/status/1238312352891756545
2020-03-13 03:50:54,spooky_spectres,kurdistannews24,1,0,2,"cmon man",,,,1238311547040137216,https://twitter.com/spooky_spectres/status/1238311547040137216
2020-03-13 03:49:11,spooky_spectres,MailOnline,0,0,0,"getting real end of the world vibes",,,,1238311116369022978,https://twitter.com/spooky_spectres/status/1238311116369022978
2020-03-13 03:40:48,amphetamine47,smartsassylib,0,0,1,"(also thank you for asking, because this was all very sudden and I'm still processing)",,,,1238309007653249030,https://twitter.com/amphetamine47/status/1238309007653249030
2020-03-13 03:39:42,amphetamine47,smartsassylib,1,0,1,"There's a lot of rage in me this week ",,,,1238308729822613505,https://twitter.com/amphetamine47/status/1238308729822613505
2020-03-13 03:38:37,amphetamine47,smartsassylib,2,0,2,"This week was going pretty well on the job hunting, I had several interviews BUT I'm pretty sure everyone's on a hiring freeze now because *gestures vaguely at everything*",,,,1238308455133466624,https://twitter.com/amphetamine47/status/1238308455133466624
2020-03-13 03:37:25,amphetamine47,smartsassylib,0,0,1,"Was working for a startup that paid quite well, apparently too well. Literally out of money, they called everyone in last Friday and told us we were out. No severance, because no money ",,,,1238308153575514112,https://twitter.com/amphetamine47/status/1238308153575514112
2020-03-13 03:31:34,amphetamine47,,1,0,2,"And I just got notified that I'd be flying to Argentina first class had the trip gone ahead?!",,,,1238306684981911552,https://twitter.com/amphetamine47/status/1238306684981911552
2020-03-13 03:30:46,qirenni,qirenni,0,0,0,"LSD, PCP, MDMA, cocaine, amphetamine, opioids, weed, alcohol, it doesn't matter. Little to no effect.",,,,1238306480262184962,https://twitter.com/qirenni/status/1238306480262184962
2020-03-13 03:23:14,amphetamine47,,1,0,0,"@LATAM_CHI I had to cancel my flight from NYC to Peru, but just got notified I was charged for an upgrade?! Help, please??",,@LATAM_CHI,,1238304586751979530,https://twitter.com/amphetamine47/status/1238304586751979530
2020-03-13 03:16:27,SeraphUlysses,JustJared,0,0,1,"It’s impossible to believe because it was an act of revenge by a psychopath high on amphetamine and and raging on pimple pills, while also drunk on wine thought the allegations up with her freeloading, perjurious friends. #JusticeForJohnnyDepp",,,#JusticeForJohnnyDepp,1238302879548653568,https://twitter.com/SeraphUlysses/status/1238302879548653568
2020-03-13 03:11:06,amphetamine008,iUj9nAlamCvJzsK,1,0,0,"論文中是這樣表述的：2020, state, local, and federal public health agencies investigated the first case of COVID-19 in Illinois, USA. Methods Patients with confirmed COVID-19 were defined as those with a positive SARS-CoV-2 test.",,,,1238301531469795329,https://twitter.com/amphetamine008/status/1238301531469795329
2020-03-13 02:57:35,AntifaPhanatic,AntifaPhanatic,1,0,0,"Also, Trump is an amphetamine addict sexual predator who watches Fox News instead of reading briefing books. Spare me.",,,,1238298129541132288,https://twitter.com/AntifaPhanatic/status/1238298129541132288
2020-03-13 02:43:41,teammlr1,secupp,0,0,0,"Trump’s addled by Adderall abuse. He’s on a deranged plane of amphetamine-existence.",,,,1238294630724239360,https://twitter.com/teammlr1/status/1238294630724239360
2020-03-13 02:18:15,noble_fish,,0,2,31,"step 1 is incite panic; flood the pharmacies with people trampling each other for masks and hand sanitizer. step 2 is break into all the back rooms in the chaos and clear out all the addy, store by store. step 3 is i become the amphetamine king of southeast MI",,,,1238288231839432706,https://twitter.com/noble_fish/status/1238288231839432706
2020-03-13 02:05:44,ihatecrayons,CatTheMarauder,1,0,1,"lmao Mrs. Amphetamine over here.",,,,1238285082386993155,https://twitter.com/ihatecrayons/status/1238285082386993155
2020-03-13 01:49:09,vladimirspvssy,,0,0,0,"oh so it’s friday the 13th",,,,1238280910400704512,https://twitter.com/vladimirspvssy/status/1238280910400704512
