date,username,to,replies,retweets,favorites,text,geo,mentions,hashtags,id,permalink
2020-03-08 17:53:28,BroncRad,Trubeque,0,0,8,"Adderall makes me use weird word order all the time so I'd assume that the Amphetamine Psychosis finally hit ",,,,1236711649496780802,https://twitter.com/BroncRad/status/1236711649496780802
2020-03-08 17:52:20,Dopeyf150,,1,2,4,"Me currently late to open mat but replace the the amphetamine with redbull @IamSasquatch702 @XoXoandstuff",,@IamSasquatch702 @XoXoandstuff,,1236711360571920384,https://twitter.com/Dopeyf150/status/1236711360571920384
2020-03-08 17:51:40,haiku_high,Surgeon_General,0,0,2,"Saw you giving slop bucket head. He doesn’t sleep b/c he is an amphetamine addict. #AdderallAddiction for 3 decades destroyed trump’s brain cells #TrumpDementia finishing off what’s left #MAGA fear and inferiority kill at home and abroad",,,#AdderallAddiction #TrumpDementia #MAGA,1236711193089396739,https://twitter.com/haiku_high/status/1236711193089396739
2020-03-08 17:44:06,scootermcdoog,paul_boy,2,0,5,"1 candidate has been manic depressive since the 80s from cocaine and amphetamine abuse 1 candidate has been hospitalized this campaign for a potentially leathal cardiac event 1 candidate is experiencing normal sundowning as he reaches octagenarian status Not =, that's right",,,,1236709292746686464,https://twitter.com/scootermcdoog/status/1236709292746686464
2020-03-08 17:29:37,psychopharmacol,,0,0,0,"Administration of CRMP2-phosphorylation suppressors were found to mimic lithium’s attenuation of amphetamine-induced hyperlocomotion in mice.",,,,1236705646881452032,https://twitter.com/psychopharmacol/status/1236705646881452032
2020-03-08 17:05:42,Karnickleon,crypto_baboon,1,0,1,"Hey Yupu, we need to find another amphetamine source, this batch ain't worth shit...",,,,1236699626939564034,https://twitter.com/Karnickleon/status/1236699626939564034
2020-03-08 17:04:19,crypto_baboon,Karnickleon,1,0,2,"I eat amphetabin *eats amphetamine* Baboon no happi. Btc ded. Baboon shleep.",,,,1236699279185588224,https://twitter.com/crypto_baboon/status/1236699279185588224
2020-03-08 17:02:48,Karnickleon,crypto_baboon,1,0,3,"fkn lazy monkie ting... *force feeds baboon some amphetamine*",,,,1236698896996368387,https://twitter.com/Karnickleon/status/1236698896996368387
2020-03-08 16:55:18,richardalunw,,0,1,0,"@GOP @WalterReedArmy @DrJillStein ...add to this the strong &amp; evident indications of DJT’s amphetamine abuse! ",,@GOP @WalterReedArmy @DrJillStein,,1236697009958129665,https://twitter.com/richardalunw/status/1236697009958129665
2020-03-08 16:29:39,AmpSulphate,,0,0,5,"""I see a cruise ship thick with people gliding past, high above the rooftops of an ancient, sinking city, and a shiver goes down my spine."" Knausgård, MIN KAMP VI",,,,1236690554198556672,https://twitter.com/AmpSulphate/status/1236690554198556672
2020-03-08 16:13:36,ResistsBob,cylyn2015,0,0,2,"To me they look drugged. He has tons of photos in bright light with giant pupils, consistent with amphetamine use, like snorting crushed Adderall. It can keep him awake, but the body is exhausted and the brain a confused mess.",,,,1236686514555441154,https://twitter.com/ResistsBob/status/1236686514555441154
2020-03-08 16:05:34,AnonSource_1,mkraju,0,0,0,"He’s invincible with the right doses of Adderall and amphetamine.",,,,1236684492082987008,https://twitter.com/AnonSource_1/status/1236684492082987008
2020-03-08 15:45:48,amphetamine47,,0,0,1,"Weird dream last night that included Captain Picard, Darius Rucker, and JaRule. Also professional wrestlers? I don't know either.",,,,1236679519085395968,https://twitter.com/amphetamine47/status/1236679519085395968
2020-03-08 15:37:48,JimOfficious,mkraju,0,0,0,"Horseshit... Trump is delusional as can be because of his dementia and decades of amphetamine abuse and his health has become so bad he has started pissing in his pants. ",,,,1236677505064431618,https://twitter.com/JimOfficious/status/1236677505064431618
2020-03-08 15:29:29,Spider_Hunter,DavidCornDC,1,0,27,"Surgeon General: ""An amphetamine addict sleeps less than I do. It may have something to do with the drugs he's addicted to.""",,,,1236675413595881473,https://twitter.com/Spider_Hunter/status/1236675413595881473
2020-03-08 15:13:05,amphetamine47,nbcsnl,0,0,4,"We don't deserve her. Jesus.",,,,1236671284693565440,https://twitter.com/amphetamine47/status/1236671284693565440
2020-03-08 14:42:09,bob_nixon1948,mhtexyankee,0,0,2,"Probably not meth. Just amphetamine. If it was meth he'd have rotten teeth and a terrible complexion. OOOh wait a minute",,,,1236663502472962048,https://twitter.com/bob_nixon1948/status/1236663502472962048
2020-03-08 14:31:58,Ericshere33324,dogriguez,1,0,0,"""I’m more concerned about the cognitive decline caused by his decades of amphetamine abuse and frontotemporal dementia."" But enough about Joe Biden.",,,,1236660938507456513,https://twitter.com/Ericshere33324/status/1236660938507456513
2020-03-08 14:21:19,dogriguez,Ericshere33324,4,0,0,"Nah. Trump’s an obese, orange, wannabe mobster, but I’m more concerned about the cognitive decline caused by his decades of amphetamine abuse and frontotemporal dementia.",,,,1236658260314411011,https://twitter.com/dogriguez/status/1236658260314411011
2020-03-08 14:12:47,Jody522,mkraju,0,2,4,"Did he address his rumored amphetamine intake? Or is it just the Diet Coke?",,,,1236656110133825541,https://twitter.com/Jody522/status/1236656110133825541
2020-03-08 13:55:36,AmpSulphate,,0,8,11,"Oz Oz Alice, the password-protected blog by SIMON MORRIS is back online. Keep playing those Mind Games https://ozozalice.blogspot.com Thanks @philblackpool",,@philblackpool,,1236651787496697856,https://twitter.com/AmpSulphate/status/1236651787496697856
2020-03-08 13:49:58,Joebotnik,nypost,0,1,3,"ANCIENT SWORD OF THE METH KING The true name of the Meth King has faded into the mists of time, but this vicious sword is a testament to the barbaric cruelty that built his amphetamine empire. +8 damage to DEA Agents ",,,,1236650367481458689,https://twitter.com/Joebotnik/status/1236650367481458689
2020-03-08 13:32:16,XVirginMary,patrickmkcirtap,0,0,1,"Does he really need one when his blood amphetamine concentration is near 100%_ he’s a walking embalmed corpse #TrumpPlague #TrumpNotFitForOffice",,,#TrumpPlague #TrumpNotFitForOffice,1236645913201967106,https://twitter.com/XVirginMary/status/1236645913201967106
2020-03-08 13:29:13,AshleyCellery,,1,0,1,"Once you go military grade pre workout laced with amphetamine analogues you never go back!",,,,1236645147338825728,https://twitter.com/AshleyCellery/status/1236645147338825728
2020-03-08 13:13:41,Michael80789776,Tanoui10,0,0,0,"I must be high on meth amphetamine without knowing it, or, selectively deaf?!",,,,1236641239853928450,https://twitter.com/Michael80789776/status/1236641239853928450
2020-03-08 12:45:46,ZhangFei33,ZhangFei33,1,0,0,"I think Mao's crazy thought was the influence of amphetamine. Because amphetamine associat with brain arousal and sexual arousal. Mao's nympho was by drugs. (Some say that Mao was brain syphilis.)",,,,1236634213748584455,https://twitter.com/ZhangFei33/status/1236634213748584455
2020-03-08 12:44:42,ZhangFei33,ZhangFei33,1,0,0,"They sold amphetamine to Japan for long time. I think Now it has changed to Philippines route for Dec.22, 2001 Coronavirus infection is spreading to regain this drug route. They are begging, ""Buy amphetamine and give me money.""",,,,1236633942838525952,https://twitter.com/ZhangFei33/status/1236633942838525952
2020-03-08 12:32:25,ZhangFei33,ZhangFei33,1,0,0,"This amphetamine plan has been hidden under the veil of a huge pachinko remittance system. Japanese politics, education and journalism are under the control of CCP. Conservative, liberal, mafia, and religious socialism are all under the control of CCP in Japan.",,,,1236630854127910913,https://twitter.com/ZhangFei33/status/1236630854127910913
2020-03-08 12:32:16,ZhangFei33,ZhangFei33,1,0,0,"North Korea made amphetamine and pour it into Japan. Japanese become better Mathematic by amphetamine and take away American jobs. Japanese drive around the world and Chinese culture will dominate the whole world. Japan is Chinese Communist Party vanguard.",,,,1236630816593076224,https://twitter.com/ZhangFei33/status/1236630816593076224
2020-03-08 12:21:49,daramola_amos,Tickytee01,0,0,1,"Pretty !",,,,1236628184579350528,https://twitter.com/daramola_amos/status/1236628184579350528
2020-03-08 11:29:02,DeltaBehavioral,,0,0,0,"What Are the Signs of Amphetamine Addiction? http://dlvr.it/RRTC7g",,,,1236614902250221568,https://twitter.com/DeltaBehavioral/status/1236614902250221568
2020-03-08 11:08:19,daramola_amos,DrOlufunmilayo,0,0,0,"@Shegsmith5 check this out.",,@Shegsmith5,,1236609690043396096,https://twitter.com/daramola_amos/status/1236609690043396096
2020-03-08 09:44:31,Bill_Gerrard,,0,0,1,"If I were Pac-Man, I would simply pop an amphetamine pellet and eat the souls of my enemies as they flee in terror of my sudden access of power",,,,1236588598280876039,https://twitter.com/Bill_Gerrard/status/1236588598280876039
2020-03-08 09:11:01,elvis_greyson,,0,0,0,"What Are the Signs of Amphetamine Addiction? ",,,,1236580170695352320,https://twitter.com/elvis_greyson/status/1236580170695352320
2020-03-08 08:42:23,drbrown1955,,0,0,1,"Pupils in overdose: morphine vs. amphetamine “MorPHINE: Fine. AmPHETamine: Fat”: Morphine overdose: pupils constricted (fine). Amphetamine overdose: pupils dilated (fat).",,,,1236572963547185153,https://twitter.com/drbrown1955/status/1236572963547185153
2020-03-08 08:35:25,therealRick12,,0,0,0,"Everybody. And I mean pretty much everybody. Under the age of 24 was on Legal Amphetamine x",,,,1236571208839282688,https://twitter.com/therealRick12/status/1236571208839282688
2020-03-08 08:24:31,KitekiFoxFire,,0,0,1,"i am going running at 4:30 am because I'm very absolutely stoked and this drug feels like I'm on an amphetamine. Help. ",,,,1236568466502684673,https://twitter.com/KitekiFoxFire/status/1236568466502684673
2020-03-08 08:21:40,LukeJohnTC1,YutaMoxley,0,0,0,"thanks!",,,,1236567749750444037,https://twitter.com/LukeJohnTC1/status/1236567749750444037
2020-03-08 08:10:56,hippiegypsyslut,ButchMeathook_,1,0,1," of course",,,,1236565047507386368,https://twitter.com/hippiegypsyslut/status/1236565047507386368
2020-03-08 08:10:05,hippiegypsyslut,ButchMeathook_,1,0,0,"Where there fuck do you find this shit? ",,,,1236564834822631425,https://twitter.com/hippiegypsyslut/status/1236564834822631425
2020-03-08 08:08:01,horror_jock,VoteFairness,0,0,0,"Fentanyl laced opiates and MDMA pills suggests its the policy thats causing the problems Drugs policy gave us; Spice (people want cannabis) PMA (people want MDMA) DOM (LSD) Amphetamine (crystal meth) Cocaine (crack) Fentanyl (diamorphine)",,,,1236564314221404160,https://twitter.com/horror_jock/status/1236564314221404160
2020-03-08 08:06:13,agraragar,,0,0,0,"Feel my pulse pump from the 808 drum like amphetamine... If you know what I mean",,,,1236563862469709824,https://twitter.com/agraragar/status/1236563862469709824
2020-03-08 07:45:28,TheXmasFish,TwinklingTania,0,0,5,"bernie bros: getting lightly toasted, maybe some edibles, occasional amphetamine abuse liz lads: blacking out on bars, ambien, and cabernet",,,,1236558639890128896,https://twitter.com/TheXmasFish/status/1236558639890128896
2020-03-08 07:39:09,commelesfilless,,0,0,2,"when the weeknd said amphetamine got my stummy feeling sickly i felt that ",,,,1236557049003225088,https://twitter.com/commelesfilless/status/1236557049003225088
2020-03-08 07:01:08,hobisdead,goldenpolaroid,0,0,3,"AMPHETAMINE-FUELED ARTISTS RIGHTS ",,,,1236547482001313792,https://twitter.com/hobisdead/status/1236547482001313792
2020-03-08 06:44:37,j0hnr1ch,CarpingInfidel,3,0,0,"What the matter with this bloke, rocking from side to side like he's overdosed on amphetamine! If that was his state when he restrained the perv in the park, no wonder the police arrested him! #JustSaying",,,#JustSaying,1236543327975153665,https://twitter.com/j0hnr1ch/status/1236543327975153665
2020-03-08 06:39:34,minazoko_,,0,0,0,"Caffeine & amphetamine intoxication is not nearly as fun as it sounds",,,,1236542054634622976,https://twitter.com/minazoko_/status/1236542054634622976
2020-03-08 06:04:02,LukeJohnTC1,,0,0,3,"back down the abletone hole",,,,1236533113225801728,https://twitter.com/LukeJohnTC1/status/1236533113225801728
2020-03-08 06:03:00,Dillyn_Amara,,0,0,2,"Amphetamine would make a great name for a baby girl",,,,1236532852763885568,https://twitter.com/Dillyn_Amara/status/1236532852763885568
2020-03-08 05:48:57,kwqcnews,,0,0,1,"Three pounds of marijuana, cocaine, and amphetamine pills were found during the search, according to Sterling Police. https://www.kwqc.com/content/news/Sterling-Police-arrest-man-after-traffic-stop-568604251.html????",,,,1236529319364739072,https://twitter.com/kwqcnews/status/1236529319364739072
2020-03-08 05:32:37,Canthemum1212,Okapuer,0,0,0,"They portray their criminals as icons, like mobbed up, amphetamine abusing, womanizer who escalated Vietnam War and nearly caused nuclear war, spy of MLK-- JFK-- is their top hero. ",,,,1236525206518353920,https://twitter.com/Canthemum1212/status/1236525206518353920
2020-03-08 05:23:02,sktea,realDonaldTrump,0,0,0,"Garbled and unintelligible. Maybe you should ease off on the amphetamine, war criminal.",,,,1236522793182904321,https://twitter.com/sktea/status/1236522793182904321
2020-03-08 04:57:33,pookleblinky,,1,3,10,"At the next debate, every question to biden should just be accompanied by a blowgun dart of modafinil and amphetamine salts",,,,1236516383472705537,https://twitter.com/pookleblinky/status/1236516383472705537
2020-03-08 04:52:19,mba382,michaeljohns,1,0,0,"Hillary will get in there and shoot him up with amphetamine –just like Hitler will be OK — ",,,,1236515065328586753,https://twitter.com/mba382/status/1236515065328586753
2020-03-08 04:20:02,MookieWilson7,,0,0,0,"I went on an amphetamine binge and applied for a PhD in Sweden, now I'm TERRIFIED I'll actually get it https://old.reddit.com/r/Drugs/comments/fex179/i_went_on_an_amphetamine_binge_and_applied_for_a/?ref=share&amp;ref_source=twitter via @reddit",,@reddit,,1236506940705886208,https://twitter.com/MookieWilson7/status/1236506940705886208
2020-03-08 04:13:30,juiceboxpupyman,midsiee,0,0,1,"Hopefully it contains some kind of amphetamine",,,,1236505297264533504,https://twitter.com/juiceboxpupyman/status/1236505297264533504
2020-03-08 03:55:39,ExciterAural,brettgraysondad,0,0,0,"Nah, she's an ADHDer w/new amphetamine script. (allowed to joke, has ADHD)",,,,1236500803273265152,https://twitter.com/ExciterAural/status/1236500803273265152
2020-03-08 03:53:25,inky369,HoltonJt,0,0,0,"Lemmy once tried to donate blood to someone in dire need of a transfusion. Doctors unanimously agreed it was a bad idea, but were split on whether the patient would die of alcohol poisoning or an amphetamine overdose if they received Lemmy's blood.",,,,1236500242465521664,https://twitter.com/inky369/status/1236500242465521664
2020-03-08 03:25:41,Pyroluminescent,,1,0,0,"I [not a medical professional] also strongly suspect that President Trump's speech gaffes are due not to dentures (he very clearly has full crowns or implants) but due to neurological problems resulting from amphetamine abuse. Even MILD withdrawal causes aphasia and ataxia...",,,,1236493262539632640,https://twitter.com/Pyroluminescent/status/1236493262539632640
2020-03-08 03:25:22,ja_nellie_,TheCrecken,0,0,3,"Thirded",,,,1236493183514624000,https://twitter.com/ja_nellie_/status/1236493183514624000
2020-03-08 03:22:52,ZarAlexander,ZachEvans79,1,0,0,"Nicotine patches are considered not depencence forming for the same reason the amphetamine prodrug I get for my ADHD is considered safe: no kick. Same does not necessarily apply to vaping. Anyway, I liked smoking. I didn't like vaping much the few times I tried ;)",,,,1236492553844928515,https://twitter.com/ZarAlexander/status/1236492553844928515
2020-03-08 03:18:44,softestbeard,ASegals,0,0,2,"I wonder how much amphetamine they pumped him up with to get the job done?",,,,1236491514739474432,https://twitter.com/softestbeard/status/1236491514739474432
2020-03-08 03:17:54,TheCrecken,mel_amphetamine,1,0,3,"Seconded",,,,1236491303573020672,https://twitter.com/TheCrecken/status/1236491303573020672
2020-03-08 02:53:39,bearinghead,JRehling,0,0,2,"Amphetamine been berry berry good to Donnie. #trumpondrugs. #TrumpDementia #trumpfallingapart.",,,#trumpondrugs #TrumpDementia #trumpfallingapart,1236485201003302912,https://twitter.com/bearinghead/status/1236485201003302912
2020-03-08 02:38:23,lindadean3,BeChangeToday,0,0,0,"@CaslerNoel was on the Apprentice and said that he had #1 and #2 accidents all the time on set and his kids laughed at him. Years of amphetamine abuse made him incontinent.",,@CaslerNoel,,1236481360526704640,https://twitter.com/lindadean3/status/1236481360526704640
2020-03-08 02:27:46,mel_amphetamine,laurensydney97,1,0,3,"Pleeeeease do pink",,,,1236478688008507392,https://twitter.com/mel_amphetamine/status/1236478688008507392
2020-03-08 02:23:46,lindadean3,beigeart,3,0,3,"I heard it was incontinence due to long term amphetamine use.",,,,1236477680385757184,https://twitter.com/lindadean3/status/1236477680385757184
2020-03-08 01:29:53,BigDawgDreDay,,0,0,0,"I need more songs on my vibe music playlist. What vibe artist/songs are you listening to? Some examples would be Heaven all around me by Saba, Snoh Aalegra, Smino- Amphetamine, Lucky Daye.....",,,,1236464120918159361,https://twitter.com/BigDawgDreDay/status/1236464120918159361
2020-03-08 01:23:57,mew_tang_clan,cushbomb,0,0,4,"Trump's going to have to add Peptobismol to his amphetamine cocktails.",,,,1236462629037543425,https://twitter.com/mew_tang_clan/status/1236462629037543425
2020-03-08 01:17:41,amphetamine47,neums,0,0,0,"I'm hoping! There are, at least, digital marketing jobs here to apply for!",,,,1236461052541501440,https://twitter.com/amphetamine47/status/1236461052541501440
2020-03-08 01:15:16,nowontrax,,0,0,0,"Drax - Amphetamine (Original Version) is #NowPlaying on @TraxDublin",,@traxdublin,#NowPlaying,1236460442081538048,https://twitter.com/nowontrax/status/1236460442081538048
2020-03-08 01:01:26,Privvey_Poo,atticada,1,0,1,"Yeah that’s an amphetamine high if I’ve ever seen one",,,,1236456962260418560,https://twitter.com/Privvey_Poo/status/1236456962260418560
2020-03-08 00:42:42,born2bear,azsweetheart013,0,0,0,"The chemicals in Adderall, ammonium chloride, sodium acid phosphate, that make it an amphetamine are the ones that also make you pee more often.",,,,1236452247862738944,https://twitter.com/born2bear/status/1236452247862738944
2020-03-08 00:33:42,a215jacob,,0,0,0,"Amphetamine got my stummy feelin sickly",,,,1236449983278321664,https://twitter.com/a215jacob/status/1236449983278321664
2020-03-08 00:04:03,EL44766671,BurlBurlington,1,0,0,"curious no argument- are there policy papers from Bernie and what drugs? Marijuana, Oxy, Heroin, Amphetamine- how specifically will he 'end' the war thanks",,,,1236442518377631750,https://twitter.com/EL44766671/status/1236442518377631750
2020-03-07 23:31:14,ClassicDeepCuts,,0,0,0,"http://ClassicDeepCuts.com Amphetamine Annie by Canned Heat #MoscowMitch #GOPCoverup #SOS",,,#MoscowMitch #GOPCoverup #SOS,1236434259738603528,https://twitter.com/ClassicDeepCuts/status/1236434259738603528
2020-03-07 23:28:11,BigTamShort1,ClarkeMicah,0,0,0,"Most of the “ drug induced psychoses” i dealt with in the ward in new Zealand was cannabis NOT drugs like lsd, amphetamine or others, due to the strength and freely growing availability of it, it grew in the countryside too !",,,,1236433495720894464,https://twitter.com/BigTamShort1/status/1236433495720894464
2020-03-07 23:27:35,amphetamine47,motelcowboy,0,0,0,"They're having extra off on North Face and Columbia right now, if anything there tempts you ;)",,,,1236433341995528192,https://twitter.com/amphetamine47/status/1236433341995528192
2020-03-07 23:03:20,mcarr0831,,0,0,2,"""...never need a bitch, I'm what a bitch need, tryna find the one that can fix me, I've been dodging death in the six-speed, amphetamine got my stummy feeling sickly...""",,,,1236427241191399425,https://twitter.com/mcarr0831/status/1236427241191399425
2020-03-07 22:56:08,CJAMcMahon,histoftech,0,0,2,"perhaps industrial quantities of amphetamine?",,,,1236425428837031937,https://twitter.com/CJAMcMahon/status/1236425428837031937
2020-03-07 22:41:23,Popnlocks_ebook,,0,0,0,"We're amphetamine superhumans ;) parenthesis instead of tomorrow, today.",,,,1236421716726988801,https://twitter.com/Popnlocks_ebook/status/1236421716726988801
2020-03-07 22:24:44,lyssroj,,0,0,0,"Amphetamine got my stummy feeling sickly ",,,,1236417524767567872,https://twitter.com/lyssroj/status/1236417524767567872
2020-03-07 22:01:18,Richard_Oak5,,0,0,0,"Imagine what weird caffeine amphetamine cocktail they’re giving to Biden to keep him animated.",,,,1236411629333385216,https://twitter.com/Richard_Oak5/status/1236411629333385216
2020-03-07 21:41:48,MadMolly10,andylassner,1,1,2,"I guess you were unaware that #DiaperDon has an anal leakage problem and has to wear diapers because of many years of amphetamine abuse.....allegedly.",,,#DiaperDon,1236406723222679552,https://twitter.com/MadMolly10/status/1236406723222679552
2020-03-07 21:29:44,TheRealNikkiOh,TMZ,0,0,1,"Sings “Amphetamine got my stummy feelin' sickly” ",,,,1236403684327731200,https://twitter.com/TheRealNikkiOh/status/1236403684327731200
2020-03-07 21:15:12,verocypher,,1,1,22,"Say you can't forget me Cause every time I leave know you need it more Like an amphetamine Take you for a ride til you lose control Overdose-Rhea Raj ",,,,1236400026471075843,https://twitter.com/verocypher/status/1236400026471075843
2020-03-07 21:08:19,RootedRainbow,,0,0,2,"Obama really does put things into perspective in such a wholesome gangsta way.. Like if Obama was gang leader, I think I'd sign up. He'd be like: hey young blood, what's the probability of you advertising this here proscribed amphetamine",,,,1236398294596755460,https://twitter.com/RootedRainbow/status/1236398294596755460
2020-03-07 21:08:06,ruth25389077,DuchessSalty,0,0,0,"combination medication containing four salts of amphetamine. used in the treatment of attention deficit hyperactivity disorder (ADHD) and narcolepsy. It is also used as an athletic performance enhancer and cognitive enhancer, and recreationally as an aphrodisiac and euphoriant.",,,,1236398240628641792,https://twitter.com/ruth25389077/status/1236398240628641792
2020-03-07 20:44:18,ZhangFei4321,ZhangFei4321,1,0,0,"I think Mao's crazy thought was the influence of amphetamine. Because amphetamine associat with brain arousal and sexual arousal. Mao's nympho was by drugs. (Some say that Mao was brain syphilis.)",,,,1236392252974366720,https://twitter.com/ZhangFei4321/status/1236392252974366720
2020-03-07 20:42:48,ZhangFei4321,ZhangFei4321,1,0,0,"They sold amphetamine to Japan for long time. I think Now it has changed to Philippines route for Dec.22, 2001 Coronavirus infection is spreading to regain this drug route. They are begging, ""Buy amphetamine and give me money.""",,,,1236391873259814912,https://twitter.com/ZhangFei4321/status/1236391873259814912
2020-03-07 20:34:56,MPSCrayValleyW,,1,2,7,"Pc O'keeffe has tested some drugs that were seized from a youth a while ago at Hoblingwell. This has now been confirmed as amphetamine. The youth has been interviewed and an outcome will be decided shortly. ",,,,1236389896186707968,https://twitter.com/MPSCrayValleyW/status/1236389896186707968
2020-03-07 20:30:06,ZhangFei4321,ZhangFei4321,1,0,0,"This amphetamine plan has been hidden under the veil of a huge pachinko remittance system. Japanese politics, education and journalism are under the control of CCP. Conservative, liberal, mafia, and religious socialism are all under the control of CCP in Japan.",,,,1236388677669933056,https://twitter.com/ZhangFei4321/status/1236388677669933056
2020-03-07 20:29:40,ZhangFei4321,ZhangFei4321,1,0,0,"North Korea made amphetamine and pour it into Japan. Japanese become better Mathematic by amphetamine and take away American jobs. Japanese drive around the world and Chinese culture will dominate the whole world. Japan is Chinese Communist Party vanguard.",,,,1236388570664853504,https://twitter.com/ZhangFei4321/status/1236388570664853504
2020-03-07 20:24:57,Patient0ZS,ProgressPickle,0,1,8,"Ohio. Guy had holes in his scalp. Likely amphetamine related.",,,,1236387384041840645,https://twitter.com/Patient0ZS/status/1236387384041840645
2020-03-07 20:18:28,jdhardy70,AirballWestfall,0,0,0,"It could be the amphetamine version you know!",,,,1236385748896616454,https://twitter.com/jdhardy70/status/1236385748896616454
2020-03-07 20:14:21,kIKididit,,0,0,0,"This Concerta ain’t doing shit, I still fell asleep in my session. Maybe Meth is the amphetamine for me. ",,,,1236384712857464833,https://twitter.com/kIKididit/status/1236384712857464833
2020-03-07 20:11:38,zagancult,,0,0,3,"NEVER NEED A BITCH IM WHAT A BITCH NEED TRYNA FIND THE ONE THAT CAN FIX ME IVE BEEN DODGING DEATH IN THE SIX SPEED AMPHETAMINE GOT STUMMY FEELING SICKLY YEAH I WANT IT ALL NOW IVE BEEN RUNNIN THROUGH THE PUSSY NEED A DOG POUND ",,,,1236384030523887617,https://twitter.com/zagancult/status/1236384030523887617
2020-03-07 20:08:38,siw711,BrooklynYenta,0,0,10,"What drug is this, pupils wide open, cocaine or just amphetamine, hysterically happy?",,,,1236383277759545345,https://twitter.com/siw711/status/1236383277759545345
2020-03-07 19:56:30,RedAxis4,KellyIris19,0,0,1,"He’s also a raging amphetamine freak.",,,,1236380224138461185,https://twitter.com/RedAxis4/status/1236380224138461185
