date,username,to,replies,retweets,favorites,text,geo,mentions,hashtags,id,permalink
2020-03-15 05:18:16,lilavarisi,GoddardCaroline,0,0,0,"The difference between Methamphetamine and Amphetamines(Adderal.alsp known as Addy) is pure amphetamine and meth is dirty. They have different chemical structures. Ones made in a safehouse (illegal storage/cook lab and ines made my a legit pharmaceutical co that cant make meth.",,,,1239058308704731136,https://twitter.com/lilavarisi/status/1239058308704731136
2020-03-15 05:10:28,rammesvt_,smino,0,0,0,"amphetamine still my favorite. ",,,,1239056345619365889,https://twitter.com/rammesvt_/status/1239056345619365889
2020-03-15 05:06:39,bushpresser,Supreme_Bashar,0,0,0,"They fukt up the Rainbow the word gay the term for a hand rolled cigarette and now good old fashioned s Crystal Meth Amphetamine ",,,,1239055385329205248,https://twitter.com/bushpresser/status/1239055385329205248
2020-03-15 04:51:28,IamBogotti,smino,0,0,0,"Amphetamine will forever be the best song on this album ",,,,1239051566075838466,https://twitter.com/IamBogotti/status/1239051566075838466
2020-03-15 04:12:04,sophiaxespinosa,Chey_Burton,0,0,1,"No, that’s Vaseline. Quarantine is a synthetic drug with more rapid and lasting effects than amphetamine, and used illegally as a stimulant",,,,1239041650854330368,https://twitter.com/sophiaxespinosa/status/1239041650854330368
2020-03-15 04:10:34,dennisbhooper,,0,0,7,"Just a reminder that when Shakespeare was quarantined because of the plague, he wrote the Mad Men episode where they all get amphetamine shots",,,,1239041272691576832,https://twitter.com/dennisbhooper/status/1239041272691576832
2020-03-15 03:09:11,X_ZackIy,,1,0,2,"@smino He starting to get some recognition but he got need mo for what he makes. My top 5 rn: Wild Irish Roses Amphetamine Innamission Trina Kovert ",,@smino,,1239025825011445760,https://twitter.com/X_ZackIy/status/1239025825011445760
2020-03-15 02:22:59,mel_amphetamine,,0,0,0,"I can finally afford to buy groceries for myself and there’s nothing left... we love to see it",,,,1239014197863821313,https://twitter.com/mel_amphetamine/status/1239014197863821313
2020-03-15 01:58:19,MightyNeck,,1,0,1,"@CH88keys -- hey there Brother Hoyer! As always, thanks fer reading my amphetamine-addled doggerel &amp; filthy, abusive limericks (stay tuned!) ",,@CH88keys,,1239007991799611392,https://twitter.com/MightyNeck/status/1239007991799611392
2020-03-15 01:39:34,LoveeeLoren,smino,0,0,0,"Amphetamine ugh fuck ",,,,1239003271144013826,https://twitter.com/LoveeeLoren/status/1239003271144013826
2020-03-15 01:02:52,Kayla_H_650,smino,0,0,0,"Amphetamine is a whole movie. Many unexpected surprises and turns. ",,,,1238994035634831363,https://twitter.com/Kayla_H_650/status/1238994035634831363
2020-03-15 00:21:35,dragonstne,,0,0,0,"Can... can I pwese get an amphetamine ",,,,1238983648281595904,https://twitter.com/dragonstne/status/1238983648281595904
2020-03-15 00:02:51,amphetamine47,,0,0,0,"We had the ducts cleaned today and now my room is a sauna ",,,,1238978931816108034,https://twitter.com/amphetamine47/status/1238978931816108034
2020-03-14 23:56:38,KendallMckasson,mel_amphetamine,0,0,1,"It’s okay. Coronavirus isn’t allowed here so you’re good! ",,,,1238977367764275205,https://twitter.com/KendallMckasson/status/1238977367764275205
2020-03-14 23:55:01,saputawsit,SaraGonzalesTX,4,2,41,"Is this from the same doctor who said he couldn't fight in Vietnam due to bone spurs, or the same doctor who said the 70+, obese amphetamine addicted president was in ""extraordinary"" health.",,,,1238976961273311232,https://twitter.com/saputawsit/status/1238976961273311232
2020-03-14 23:51:58,williamphister,eggbotme,0,0,2,"And amphetamine",,,,1238976193258557441,https://twitter.com/williamphister/status/1238976193258557441
2020-03-14 23:51:11,AtheistLiberal,politico,0,0,0,"I bet he tested positive for Adderall (amphetamine). @realDonaldTrump is our junkie president.",,@realDonaldTrump,,1238975997585682435,https://twitter.com/AtheistLiberal/status/1238975997585682435
2020-03-14 23:41:53,AtheistLiberal,JeromeAdamsMD,0,0,0,"Are you the doc who prescribes Adderall (amphetamine) for Trump? Do you approve of him crushing the pills and snorting it before every rally and speech? ",,,,1238973658623705088,https://twitter.com/AtheistLiberal/status/1238973658623705088
2020-03-14 23:39:48,GarethSpor,bigchaz,0,0,0,"Amphetamine-use-related-immunity?",,,,1238973132913831937,https://twitter.com/GarethSpor/status/1238973132913831937
2020-03-14 23:21:19,PastulioKun,,0,0,1,"Thank goodness my ADHD medicine contains amphetamine, otherwise I would have eaten all the food I've bought.",,,,1238968480185159682,https://twitter.com/PastulioKun/status/1238968480185159682
2020-03-14 23:16:59,monkeyonahill,MysterySolvent,0,0,0,"phlegm covered amphetamine grains",,,,1238967388697133059,https://twitter.com/monkeyonahill/status/1238967388697133059
2020-03-14 23:13:18,_jesslife,japanesefae,1,0,3,"Amphetamine by @smino",,@smino,,1238966462506766336,https://twitter.com/_jesslife/status/1238966462506766336
2020-03-14 23:05:10,AstronautArnie,SHREKRAP,0,0,0,"Bro “Amphetamine” by Smino be HITTING",,,,1238964418584739840,https://twitter.com/AstronautArnie/status/1238964418584739840
2020-03-14 23:01:49,StevenA39447886,StevenA39447886,0,0,0,"If simultaneously fentanyl & any opioids ,or amphetamine type of drugs were banned from China while the Mexican border was closed the US would resemble an apocalyptic madhouse where everyone would have their guns loaded out of necessity",,,,1238963574006886400,https://twitter.com/StevenA39447886/status/1238963574006886400
2020-03-14 22:54:37,Mista_Craw4ed,,0,0,0,"Study of Wastewater From Nearly 50 Million People in Europe Suggests Rise in Amphetamine, Cocaine, Ecstasy and Meth Consumption https://www.newsweek.com/study-wastewater-50-million-people-europe-amphetamine-cocaine-ecstasy-meth-1492148 #SmartNews",,,#SmartNews,1238961760280834048,https://twitter.com/Mista_Craw4ed/status/1238961760280834048
2020-03-14 22:53:36,SproutyJack,Seamus_Malek,0,0,0,"First we take the Northern Marianas Islands, and then, maybe - if Biden's handlers get the amphetamine mix wrong - we take Washington DC. ",,,,1238961504009048066,https://twitter.com/SproutyJack/status/1238961504009048066
2020-03-14 22:52:07,BABarac07260188,mikeozmun,0,0,0,"Every dollar he spends and every point he consumes hurts his family. I do drugs, I condone drugs but I'm not a idiot. I understand the differences betweem paracetamol, caffeine, morphine and meth amphetamine. If you think these people are only hurting themselves then, wow.",,,,1238961132951330816,https://twitter.com/BABarac07260188/status/1238961132951330816
2020-03-14 22:50:57,Tajye_Roberson,iitsdbook,1,0,1,"Just listened to “Amphetamine” today! But I gotta throw in. “Glass flows” and “Netflix and Dussé”",,,,1238960838654001152,https://twitter.com/Tajye_Roberson/status/1238960838654001152
2020-03-14 22:43:03,Yungsandwitch,smino,0,0,0,"Amphetamine will forever slap ",,,,1238958851631845376,https://twitter.com/Yungsandwitch/status/1238958851631845376
2020-03-14 22:42:37,GoddardCaroline,scatpep54,1,0,2,"It’s an amphetamine.",,,,1238958742533599232,https://twitter.com/GoddardCaroline/status/1238958742533599232
2020-03-14 22:27:02,ZetsubouStir,vesserix1,1,0,0,"For starters, adderall is an amphetamine+dextroamphetamine salt combo, whereas meth is double methylated (and thus fat-soluble) phenylethylamine. Meth is significantly more toxic and capable of crossing the blood-brain barrier. Adderall isn't.",,,,1238954818913304577,https://twitter.com/ZetsubouStir/status/1238954818913304577
2020-03-14 22:08:56,uCanCallMeTuks,smino,0,0,0,"Amphetamine Wild Irish Roses Blkswn ",,,,1238950265178525696,https://twitter.com/uCanCallMeTuks/status/1238950265178525696
2020-03-14 22:05:23,iSMYLZ,,0,0,0,"I’m lowkey in love wit @smino I just wanna braid his hair and roll a few blunts for buddy. while he sing Amphetamine to me. #groupie",,@smino,#groupie,1238949372483665920,https://twitter.com/iSMYLZ/status/1238949372483665920
2020-03-14 21:48:43,coilingoracle,,1,0,4,"I take drugs frequently! I believe in risk assessed behavior, for example the worst reaction I’ve had to an SNRI I was given to make sure I “had” to take amphetamine salts for ADHD which caused me to have multiple psychotic breaks, paranoia attacks and sudden bouts of crying",,,,1238945177114488832,https://twitter.com/coilingoracle/status/1238945177114488832
2020-03-14 21:45:45,Qisbetterthanu,,2,3,14,"Smino really gave us Amphetamine, a melodic 7 min song w features and hella flow changes and it had noname on it. That man gave us a musical masterpiece",,,,1238944429135867906,https://twitter.com/Qisbetterthanu/status/1238944429135867906
2020-03-14 21:43:59,GothLain,Comrade_Yui,0,0,0,"""(Coronavirus) is like undead vampire or whatever, it returns stronger and stronger..."" snifs",,,,1238943985072308227,https://twitter.com/GothLain/status/1238943985072308227
2020-03-14 21:42:21,FIONAKNOWSMUSIC,smino,0,0,0,"Wild Irish Roses!? Father Son Holy Smoke!? Amphetamine!? Every single feature from a woman was AMAZING. This album is Black Excellence ",,,,1238943577016860673,https://twitter.com/FIONAKNOWSMUSIC/status/1238943577016860673
2020-03-14 21:40:27,Obvomania,SHREKRAP,0,0,3,"SMINO'S TRACK: AMPHETAMINE IS STUCK IN MA HEAD",,,,1238943096932651009,https://twitter.com/Obvomania/status/1238943096932651009
2020-03-14 21:38:36,dbxmustard,smino,0,0,0,"Amphetamine, Glass Flows, Long Run Favorites Wild Irish Rose's was the first song I heard off this I'm like yooooo who this, Boom, Ever Since ",,,,1238942631301746688,https://twitter.com/dbxmustard/status/1238942631301746688
2020-03-14 21:23:26,DVOWoods,,0,0,0,"Pass me the amphetamine",,,,1238938813600325633,https://twitter.com/DVOWoods/status/1238938813600325633
2020-03-14 21:01:10,spooky_spectres,WhiteSoxSlater,0,0,1,"Wouldn’t surprise me one bit if they fuck with the levels when they cut to him",,,,1238933209842417668,https://twitter.com/spooky_spectres/status/1238933209842417668
2020-03-14 20:56:02,CAFA1968,AdamParkhomenko,0,0,1,"I don’t either. I wonder if he doesn’t want it tested bc it could be completely checked and the high level of amphetamine (Adderall) would be found. Possibly a STD too. I also believe if Trump has the Coronavirus, he’d want to pass it to others too.",,,,1238931919489978368,https://twitter.com/CAFA1968/status/1238931919489978368
2020-03-14 20:52:48,reillymorganr,mel_amphetamine,0,0,1,"I just want to know the criteria of apocalypse grocery shopping. The instructions are unclear.",,,,1238931107351089154,https://twitter.com/reillymorganr/status/1238931107351089154
2020-03-14 20:50:57,mel_amphetamine,reillymorganr,1,0,0,"My mom and I were literally just talking about this today ",,,,1238930641867194369,https://twitter.com/mel_amphetamine/status/1238930641867194369
2020-03-14 20:50:53,Leo_072700,MakTheFlower,1,1,2,"Amphetamine my shit",,,,1238930623387107334,https://twitter.com/Leo_072700/status/1238930623387107334
2020-03-14 20:47:56,mmchars,RealCandaceO,0,0,0,"there might be feces and blood on the bed if it was anal intercourse. No one should be shocked or surprised by that.. @cnn @msnbc @CBSNews @FoxNews Did Miami police not check Gillum for amphetamine usage. Is it legal in Florida?",,@CNN @MSNBC @CBSNews @FoxNews,,1238929879531278337,https://twitter.com/mmchars/status/1238929879531278337
2020-03-14 20:44:33,mel_amphetamine,,1,0,5,"Can’t believe I agreed to work a changeover at Circa 21 in this pandemic climate but hey money is money tho, amirite?",,,,1238929029127954433,https://twitter.com/mel_amphetamine/status/1238929029127954433
2020-03-14 20:39:24,iitsdbook,smino,1,0,2,"Its a tie between ""Anita"" & ""Amphetamine"". I play it like it just came out. ",,,,1238927735432654848,https://twitter.com/iitsdbook/status/1238927735432654848
2020-03-14 20:38:51,MakTheFlower,shadyjody,2,1,3,"edgar allen poe’d up, blkswn, amphetamine and maraca honestly the whole album is 11/10 ",,,,1238927593979731968,https://twitter.com/MakTheFlower/status/1238927593979731968
2020-03-14 20:38:49,topdawgeastside,ZyahnaB,1,0,1,"Amphetamine hitssss late at night",,,,1238927587415556096,https://twitter.com/topdawgeastside/status/1238927587415556096
2020-03-14 20:33:04,saINNERgy,sindyyykidd,0,0,1,"Silk Pillows, Amphetamine, Netflix &amp; Dusse, Innamission, Edgar Allen",,,,1238926138241699841,https://twitter.com/saINNERgy/status/1238926138241699841
2020-03-14 20:24:29,psychmd1,Franktheshank88,0,0,2,"The same ""Dr. who last week said, DT is healthier than me, he needs less sleep"". So DT takes more amphetamine. DT is obese with coronary artery disease. Broke his Hippocratic oath. Doing harm @Surgeon_General resign",,@Surgeon_General,,1238923977902493696,https://twitter.com/psychmd1/status/1238923977902493696
2020-03-14 20:11:37,Choaro9X,certifiedtsogo,1,0,0,"Amphetamine is like when you hear a song for the first time and you can already tell it's a classic, well at least that's how I felt when I first heard it and Noname just went in",,,,1238920742131191808,https://twitter.com/Choaro9X/status/1238920742131191808
2020-03-14 20:05:18,certifiedtsogo,Choaro9X,1,0,0,"my first fav on there was amphetamine and it's been since. but same at first i didnt listen but the day i did i became HOOKED",,,,1238919153559523343,https://twitter.com/certifiedtsogo/status/1238919153559523343
2020-03-14 20:05:16,mel_amphetamine,,0,0,4,"Day 3 of self quarantine: I have started communicating to my dogs with a variety of beep boop bops instead of words",,,,1238919143031783424,https://twitter.com/mel_amphetamine/status/1238919143031783424
2020-03-14 19:58:43,mel_amphetamine,lippaofficial,0,0,0,"This is peak comedy right here",,,,1238917495622438913,https://twitter.com/mel_amphetamine/status/1238917495622438913
2020-03-14 19:58:18,Jfrie_,smino,0,0,0,"I remember when I heard amphetamine the first time... man ",,,,1238917391595298816,https://twitter.com/Jfrie_/status/1238917391595298816
2020-03-14 19:49:06,RedWingGrips,cenkuygur,0,2,3,"Which weddings have you attended that ends with a hotel room , a Male escort and meth amphetamine? Please do share ",,,,1238915074158452737,https://twitter.com/RedWingGrips/status/1238915074158452737
2020-03-14 19:41:07,SSBShepherd,KitsuneKassie,0,0,1,"correction: vyvanse isn't methylphenidate, but its still a horny because of amphetamine",,,,1238913066890338304,https://twitter.com/SSBShepherd/status/1238913066890338304
2020-03-14 19:37:52,thiaffs,,0,0,0,"high like amphetamine",,,,1238912246237007875,https://twitter.com/thiaffs/status/1238912246237007875
2020-03-14 19:34:42,GothLain,,0,1,8,"Got this in the mail, just in time for quarantine! @xenogothic",,@xenogothic,,1238911451391197186,https://twitter.com/GothLain/status/1238911451391197186
2020-03-14 19:26:28,pjotrpusht0r,atparkslope,0,0,0,"History repeats itself, hitler spend most of his last years on some amphetamine cocktail, even if he probably didn't know wtf is was that his doc injected him a couple of times a day.",,,,1238909380885692417,https://twitter.com/pjotrpusht0r/status/1238909380885692417
2020-03-14 19:17:00,b2kae,smino,0,1,1,"Amphetamine &amp; Wild Irish Roses &gt;&gt;&gt; ",,,,1238906998252605448,https://twitter.com/b2kae/status/1238906998252605448
2020-03-14 19:10:00,klittle197,imraansiddiqi,1,0,3,"I think he just raided Trump's amphetamine stash.",,,,1238905236561027074,https://twitter.com/klittle197/status/1238905236561027074
2020-03-14 19:09:15,spooky_spectres,big_strongman,0,0,1,"Those are the same sheets Epstein used",,,,1238905047938936836,https://twitter.com/spooky_spectres/status/1238905047938936836
2020-03-14 19:01:53,nossan__,smino,0,0,2,"Nobody asked but Amphetamine. ",,,,1238903191317753857,https://twitter.com/nossan__/status/1238903191317753857
2020-03-14 18:57:47,dtxtc13,CraigRozniecki,0,0,0,"Adderall (amphetamine and dextroamphetamine salts) is an amphetamine used for treating: attention deficit hyperactivity disorder (ADHD) and ",,,,1238902159904825345,https://twitter.com/dtxtc13/status/1238902159904825345
2020-03-14 18:53:48,salted_eg0,,0,0,0,"if i’ve learned anything, it’s that in order to be a great and prolific artist, one should cultivate an amphetamine addiction",,,,1238901158900457473,https://twitter.com/salted_eg0/status/1238901158900457473
2020-03-14 18:46:58,gaston_marian,PiperPolite,1,0,2,"You might look into modafinil. It's a narcolepsy drug, so still a stimulant, but not amphetamine-based, which might help depending on what trouble stims give you. Also, not addictive, which is nice When I found out how I could focus and actually get things done, I nearly cried",,,,1238899439642836992,https://twitter.com/gaston_marian/status/1238899439642836992
2020-03-14 18:44:57,mel_amphetamine,tj_tgnachoman,0,0,0,"It’s okay buddy it happens to the best of us",,,,1238898929800040448,https://twitter.com/mel_amphetamine/status/1238898929800040448
2020-03-14 18:39:24,mikehun05090651,TerryLogue,0,0,0,"There are ways of doing hard drugs responsibly? Yeah, it’s called have them administered by a doctor when you actually need them. There is no way to do meth amphetamine responsibly ,Jesus Christ , I hope you don’t have any kids.",,,,1238897536301068288,https://twitter.com/mikehun05090651/status/1238897536301068288
2020-03-14 18:34:59,hippiegypsyslut,ChelseaJ_Carpio,0,0,0,"Not to mention if everyone doesn't have access to basic sanitary necessities this virus is just going to linger longer.",,,,1238896422285717504,https://twitter.com/hippiegypsyslut/status/1238896422285717504
2020-03-14 18:26:33,internetimal,,0,0,1,"What is the amphetamine community doing with the $50b?",,,,1238894302710755333,https://twitter.com/internetimal/status/1238894302710755333
2020-03-14 18:25:58,amphetamine47,,0,0,0,"How did I not know that Donnie Yen is in life action Mulan?! ",,,,1238894154408697857,https://twitter.com/amphetamine47/status/1238894154408697857
2020-03-14 18:22:59,Sevenisgone,,0,0,0,"I'm off the sedative, amphetamine..",,,,1238893404140036096,https://twitter.com/Sevenisgone/status/1238893404140036096
2020-03-14 18:16:49,HeartlessCoward,feeIIikecrying,0,0,2,"Little bit of amphetamine never hurt anybody",,,,1238891850733359105,https://twitter.com/HeartlessCoward/status/1238891850733359105
2020-03-14 17:51:47,Sevenisgone,montebooker,0,0,1,"Amphetamine hits differently ",,,,1238885549907365889,https://twitter.com/Sevenisgone/status/1238885549907365889
2020-03-14 17:51:06,luisb239,smino,0,0,1,"Amphetamine is still one of the greatest outros ever ",,,,1238885380356747270,https://twitter.com/luisb239/status/1238885380356747270
2020-03-14 17:41:39,freddyatton,,3,15,32,"Trump is addicted to amphetamine drugs. We can verify that statement with a urine test. ",,,,1238883001024405504,https://twitter.com/freddyatton/status/1238883001024405504
2020-03-14 17:37:30,shadyjody,,1,1,7,"blkswn turns three today, what’s your favorite cut from the album? mine r amphetamine and swANITA of course :)",,,,1238881955866980353,https://twitter.com/shadyjody/status/1238881955866980353
2020-03-14 17:36:03,dm__ricky,smino,0,0,2,"Amphetamine still the best. ",,,,1238881590832500739,https://twitter.com/dm__ricky/status/1238881590832500739
2020-03-14 17:35:38,YokaiRye,KodaStone_,1,0,0,"Favorite song off this album was Amphetamine. but every single sing slapped from here. Can listen to this from start to finish!",,,,1238881487761612800,https://twitter.com/YokaiRye/status/1238881487761612800
2020-03-14 17:30:38,444sara444,smino,0,1,0,"Amphetamine changed me ",,,,1238880228392534017,https://twitter.com/444sara444/status/1238880228392534017
2020-03-14 17:30:28,ameriKKKen,smino,1,2,24,"amphetamine still my fave.",,,,1238880188068515841,https://twitter.com/ameriKKKen/status/1238880188068515841
2020-03-14 17:30:17,TaraAngel94,smino,0,0,3,"Amphetamine is literally a masterpiece on this album ",,,,1238880141771788288,https://twitter.com/TaraAngel94/status/1238880141771788288
2020-03-14 17:28:23,Captain_Guerra,smino,0,0,1,"Amphetamine a banger til this day ",,,,1238879664011083776,https://twitter.com/Captain_Guerra/status/1238879664011083776
2020-03-14 17:15:27,IRETApgh,,0,1,3,"#Methamphetamine use is growing in the U.S. Behavioral treatments can be effective, although there are no FDA-approved medications currently. Here's a harm reduction guide for amphetamine users: https://buff.ly/2CKf91N",,,#Methamphetamine,1238876408648208384,https://twitter.com/IRETApgh/status/1238876408648208384
2020-03-14 17:11:13,ImLanceJackson,RickyFelixx,0,0,3,"They Say - Kanye Knicks - Madlib T.R.O.Y. - Pete Rock Groupies - Metro Amphetamine - Monte ",,,,1238875344284852224,https://twitter.com/ImLanceJackson/status/1238875344284852224
2020-03-14 16:55:00,spooky_spectres,,0,0,0,"Promoted by Air Force recruiting",,,,1238871260584689665,https://twitter.com/spooky_spectres/status/1238871260584689665
2020-03-14 16:50:01,Pastcaring,CrowleyOnAir,0,0,0,"Speed you say? Amphetamine Blue - The Vibrators ",,,,1238870008949809159,https://twitter.com/Pastcaring/status/1238870008949809159
2020-03-14 16:41:52,MWilliwaw,Anthony57178437,0,0,4,"He's an amphetamine addict",,,,1238867957717127170,https://twitter.com/MWilliwaw/status/1238867957717127170
2020-03-14 16:41:04,ajlees,,0,3,14,"Hanna Steinberg examined me for my doctoral thesis in 1978. She was a kind examiner and we discussed backward walking in amphetamine treated rats.I learned much later that she was a great self-experimenter with psychotropics #MentoredbyaMadman",,,#MentoredbyaMadman,1238867755329298432,https://twitter.com/ajlees/status/1238867755329298432
2020-03-14 16:39:31,spooky_spectres,adamjohnsonNYC,0,0,0,"You can see the Great Barrier Reef from space",,,,1238867367012249601,https://twitter.com/spooky_spectres/status/1238867367012249601
2020-03-14 16:25:51,tj_tgnachoman,mel_amphetamine,1,0,1,"I’m just jealous I didn’t think of it first.",,,,1238863926634438666,https://twitter.com/tj_tgnachoman/status/1238863926634438666
2020-03-14 16:05:56,RealBerwickW,BoSnerdley,0,0,1,"I’m just trying to understand the apparent Democrat obsession with amphetamine fueled gay male sex?",,,,1238858913308717056,https://twitter.com/RealBerwickW/status/1238858913308717056
2020-03-14 15:41:17,h0rk,patrickcook28,0,0,0,"“I sucked some amphetamine-fueled pornstar cock, though. I mean, I *have* done that,” he said in a rare moment of candor.",,,,1238852711107284992,https://twitter.com/h0rk/status/1238852711107284992
2020-03-14 15:38:14,patschurman,atrupar,0,0,0,"Ask him about the rumored amphetamine/upper addiction, which causes Trump to sniff, sniff, sniff and speak to robotically. Difficult to watch him.",,,,1238851944078282754,https://twitter.com/patschurman/status/1238851944078282754
2020-03-14 15:37:28,GothLain,AnimeWifeLover,0,0,0,"When you die can I have ur waifu?",,,,1238851749986926596,https://twitter.com/GothLain/status/1238851749986926596
2020-03-14 15:37:17,mel_amphetamine,tj_tgnachoman,2,0,0,"Damn. I’m just out here trying to kickstart my online comedienne business and the master of jokes just boo’d me ",,,,1238851704306753538,https://twitter.com/mel_amphetamine/status/1238851704306753538
2020-03-14 15:31:10,freddyatton,realDonaldTrump,13,49,89," (latter dude) TRUMP IS HIGH ON DRUGS — why didn't trump see that spelling error (""latter"")? — because amphetamines make us hyper-impulsive — trump is under the influence of amphetamine drugs — the frontal-lobe of his brain has been disengaged PROVE ME WRONG! ",,,,1238850166070710272,https://twitter.com/freddyatton/status/1238850166070710272
2020-03-14 15:27:27,TheMe_twitr,,0,0,0,"#TheMe have had this track in the can for a while. The track attempts to get close to the fabulous post punk chaos of #TheCows. We put together a brass section to create the chaotic post-punk sound of Shannon and the band on #Amphetamine label. https://soundcloud.com/the-me-873211234/babe-im-comin-home. Enjoy.",,,#TheMe #TheCows #Amphetamine,1238849229172465664,https://twitter.com/TheMe_twitr/status/1238849229172465664
2020-03-14 15:21:12,TheMe_twitr,,0,0,0,"Have you heard ‘Babe I'm Comin Home’ by The Me on #SoundCloud? #np https://soundcloud.com/the-me-873211234/babe-im-comin-home . This track from #TheMe attempts to get close to the chaos and fabulous sound of #TheCows who recorded on the amazing #Amphetamine label. Hope you like it.",,,#SoundCloud #np #TheMe #TheCows #Amphetamine,1238847657386356736,https://twitter.com/TheMe_twitr/status/1238847657386356736
2020-03-14 15:04:29,stewonthis1,RealCandaceO,2,0,4,"There is not a reason in the world he was not charged with possession of Meth Amphetamine. None!",,,,1238843449656426497,https://twitter.com/stewonthis1/status/1238843449656426497
2020-03-14 14:57:57,amphetamine47,atheisthusker,1,0,0,"Car dealers are especially in need of in house marketing advisors. Another set of eyes could've saved this career.",,,,1238841806189670404,https://twitter.com/amphetamine47/status/1238841806189670404
2020-03-14 14:36:50,akbarjenkins,,0,0,3,"In undergrad I majored in pot, with a minor in amphetamine studies ",,,,1238836490760790017,https://twitter.com/akbarjenkins/status/1238836490760790017
2020-03-14 14:14:59,amphetamine47,,0,0,2,"BREAKING NEWS: I am trapped. Send cuddles.",,,,1238830990920953859,https://twitter.com/amphetamine47/status/1238830990920953859
2020-03-14 13:56:27,CatintheHome,RealCandaceO,0,0,1,"Tell that to your amphetamine addicted *president*.",,,,1238826328134168576,https://twitter.com/CatintheHome/status/1238826328134168576
2020-03-14 13:19:51,ZhangFei4321,ZhangFei4321,1,0,0,"I think Mao's crazy thought was the influence of amphetamine. Because amphetamine associat with brain arousal and sexual arousal. Mao's nympho was by drugs. (Some say that Mao was brain syphilis.)",,,,1238817118797234180,https://twitter.com/ZhangFei4321/status/1238817118797234180
