date,username,to,replies,retweets,favorites,text,geo,mentions,hashtags,id,permalink
2013-08-26 18:55:12,EyeSupplyUSA,,0,0,0,"Deal of the Day! Homatropine 5% Sol. 5ml - $19.95 - http://www.eyesupplyusa.com/deal-of-the-day #ophthalmic #optometry",,,#ophthalmic #optometry,372069738245263360,https://twitter.com/EyeSupplyUSA/status/372069738245263360
2013-08-26 15:05:30,EyeSupplyUSA,,0,0,0,"Deal of the Day! Homatropine 5% Sol. 5ml - $19.95 - http://www.eyesupplyusa.com/deal-of-the-day",,,,372011930854359040,https://twitter.com/EyeSupplyUSA/status/372011930854359040
2013-08-25 10:57:06,Muhannadmuaid,,0,0,0,"The treatment of the antimuscarinic effects can be carried out with: a) Neostigmine b) Hexametonium c) Homatropine d) Acetylcholine",,,,371587029689438208,https://twitter.com/Muhannadmuaid/status/371587029689438208
2013-08-25 05:38:13,koreanboiz,,0,0,0,"i expected this hydrocodone-homatropine syrup to taste like booty but it's pretty good actually",,,,371506779412131840,https://twitter.com/koreanboiz/status/371506779412131840
2013-08-23 07:05:32,ButtercupD,robcuzican,2,0,0,"@robcuzican best stuff ever is hydrocodone-homatropine prescription stuff! @itsjustDi",,@robcuzican @itsjustDi,,370803978822352896,https://twitter.com/ButtercupD/status/370803978822352896
2013-07-31 19:06:59,brenda_stlouis,,2,0,0,"Hydrocodone bitartrate & homatropine methylbromide syrup are you kidding me. Who named these drugs?",,,,362650617161854977,https://twitter.com/brenda_stlouis/status/362650617161854977
2013-07-22 18:57:25,EyeSupplyUSA,,0,0,0,"Deal of the Day! Homatropine 5% Sol. 5ml - $19.95 - http://www.eyesupplyusa.com/deal-of-the-day #ophthalmology #optometry",,,#ophthalmology #optometry,359386719595937793,https://twitter.com/EyeSupplyUSA/status/359386719595937793
2013-07-22 15:50:12,EyeSupplyUSA,,0,0,0,"Deal of the Day! Homatropine 5% Sol. 5ml - $19.95 - http://www.eyesupplyusa.com/deal-of-the-day",,,,359339604442619904,https://twitter.com/EyeSupplyUSA/status/359339604442619904
2013-06-27 19:04:33,EyeSupplyUSA,,0,0,0,"Super Deals for #Eyedocs! Homatropine 5% Solution 5ml - $19.95 - http://www.eyesupplyusa.com/deal-of-the-day #ophthalmology #optometry",,,#Eyedocs #ophthalmology #optometry,350328818973675520,https://twitter.com/EyeSupplyUSA/status/350328818973675520
2013-06-27 15:06:01,EyeSupplyUSA,,0,0,0,"Deals for #Eyedocs! Homatropine 5% Solution 5ml - $19.95 - http://www.eyesupplyusa.com/deal-of-the-day",,,#Eyedocs,350268788740067331,https://twitter.com/EyeSupplyUSA/status/350268788740067331
2013-05-31 19:07:35,EyeSupplyUSA,,0,0,0,"Save more on Homatropine 5% Sol. 5ml. $19.95 http://www.eyesupplyusa.com/deal-of-the-day #ophthalmology #optometry",,,#ophthalmology #optometry,340545109638664193,https://twitter.com/EyeSupplyUSA/status/340545109638664193
2013-05-31 15:05:05,EyeSupplyUSA,,0,1,0,"Save on #ophthalmologist and #optometrist supplies! Homatropine 5% Sol. 5ml. $19.95 http://www.eyesupplyusa.com/deal-of-the-day #doctor",,,#ophthalmologist #optometrist #doctor,340484081986965504,https://twitter.com/EyeSupplyUSA/status/340484081986965504
2013-05-22 07:51:39,MedsLib,,0,0,0,"Rx Label Update: HOMATROPINE HYDROBROMIDE OPHTHALMIC (Altaire Pharmaceuticals Inc.) http://bit.ly/16N7WdT",,,,337113513027858432,https://twitter.com/MedsLib/status/337113513027858432
2013-05-22 05:55:32,RxDrugLabels,,0,0,0,"Rx Package Insert: HOMATROPINE HYDROBROMIDE OPHTHALMIC, by Altaire Pharmaceuticals Inc.: A moderately long-act... http://bit.ly/16MLBgw",,,,337084289546063872,https://twitter.com/RxDrugLabels/status/337084289546063872
2013-05-18 17:34:41,Martinrillo_,,0,0,0,"That Hydrocodone/Homatropine had me feeelinn goood",,,,335810686699581441,https://twitter.com/Martinrillo_/status/335810686699581441
2013-05-18 15:44:18,Martinrillo_,,0,0,0,"Its some Hydrocodone/Homatropine c':",,,,335782906670743554,https://twitter.com/Martinrillo_/status/335782906670743554
2013-05-09 12:50:20,IHUB_1E,,0,0,0,"$ESSI is not marketing Tropine 3. Homatropine is a generic drug that doctors can purchase. What $ESSI is doi http://investorshub.advfn.com/boards/read_msg.aspx?message_id=87736037",,,,332477638507655169,https://twitter.com/IHUB_1E/status/332477638507655169
2013-05-04 21:44:34,baileykutsch,,0,0,0,"@WingWang07 hydrocodone - homatropine syrup, to be exact. ",,,,330800141848162306,https://twitter.com/baileykutsch/status/330800141848162306
2013-04-24 21:51:43,kelctwin,,0,0,0,"No more vigamox! No more homatropine! No more Zymar! And soon to be no more sunglasses!",,,,327178064461176832,https://twitter.com/kelctwin/status/327178064461176832
2013-04-23 07:26:01,medschat,,0,1,0,"Forum: Tussigon For Dogs - Hello, Based on my research, the Tussigon (Hydrocodone bitartrate + homatropine methyl... http://ow.ly/2wmku0",,,,326597815524552705,https://twitter.com/medschat/status/326597815524552705
2013-04-23 07:25:16,druginfo,,0,0,0,"Forum: Tussigon For Dogs - Hello, Based on my research, the Tussigon (Hydrocodone bitartrate + homatropine methyl... http://ow.ly/2wmkId",,,,326597623882592256,https://twitter.com/druginfo/status/326597623882592256
2013-04-17 15:16:05,EyeSupplyUSA,,0,0,0,"New daily #ophthalmology deals. Homatropine 5% Sol. 5ml. $19.95. Save 20% http://www.eyesupplyusa.com/deal-of-the-day",,,#ophthalmology,324541784891990017,https://twitter.com/EyeSupplyUSA/status/324541784891990017
2013-04-17 14:35:11,Medi4all,,0,0,0,"http://www.m4al.com Where to Order Triamcinolone Oral Paste Online , Homatropaire Homatropine Mydri -... http://fb.me/2xOacJCkH",,,,324531492573282305,https://twitter.com/Medi4all/status/324531492573282305
2013-04-17 14:33:33,Medi4all,,0,0,0,"http://www.m4al.com Where to Order Triamcinolone Oral Paste Online , Homatropaire Homatropine Mydri -... http://fb.me/2do0HSfTf",,,,324531079581163521,https://twitter.com/Medi4all/status/324531079581163521
2013-04-15 19:01:43,EyeSupplyUSA,,0,0,0,"Stock up for great savings! Homatropine 5% Solution 5ml $19.95. Save 20%! http://dld.bz/cxRPj #ophthalmology",,,#ophthalmology,323873788439707648,https://twitter.com/EyeSupplyUSA/status/323873788439707648
2013-04-15 15:02:21,EyeSupplyUSA,,0,0,0,"Save on #ophthalmology supplies. Homatropine 5% Solution 5ml $19.95. Save 20%! http://dld.bz/cxRPj",,,#ophthalmology,323813549468164096,https://twitter.com/EyeSupplyUSA/status/323813549468164096
2013-04-06 03:57:47,rachieee_lea,,0,0,0,"This hydrocodone/homatropine syrup they gave me for my throat is wonderful ",,,,320384815612432384,https://twitter.com/rachieee_lea/status/320384815612432384
2013-03-24 03:56:45,geraldineex3,,0,0,1,"reckless with homatropine",,,,315673514482999296,https://twitter.com/geraldineex3/status/315673514482999296
2013-03-13 02:51:57,intentionalbird,myregularface,0,0,0,"@mybruinsOface Hydrocodone/homatropine syrup. On one hand, my lung doesn't hurt anymore. On the other hand, aslkdjfalsjdkfahkl",,@mybruinsOface,,311670941795102720,https://twitter.com/intentionalbird/status/311670941795102720
2013-03-12 18:05:04,wtmrockk,,0,0,0,"The atropine derivative used in the treatment of bronchial asthma is a. Homatropine b. Oxybutynin c. Pirenzepine d. Ipratropium",,,,311538344611954688,https://twitter.com/wtmrockk/status/311538344611954688
2013-03-12 15:50:37,JenBermanMD,,0,0,0,"FDA Panel Says No To Non Hormonal Drugs for Hot Flashes http://shar.es/eocSq via @sharethis; new drug in development HOMATROPINE;",,@ShareThis,,311504512672215040,https://twitter.com/JenBermanMD/status/311504512672215040
2013-03-08 19:10:17,bakedbbeauty,,0,0,0,"Hydrocone-Homatropine syrup. Score. Gunna get fucked up",,,,310105207105269760,https://twitter.com/bakedbbeauty/status/310105207105269760
2013-03-07 22:20:56,Taylormade864,,0,0,0,"Hydrocodone-Homatropine? Why yes!! #feelgood #sippin",,,#feelgood #sippin,309790798852026369,https://twitter.com/Taylormade864/status/309790798852026369
2013-03-07 12:08:13,Baqirsaad,,0,0,0,"Homatropine bitches!",,,,309636604199325696,https://twitter.com/Baqirsaad/status/309636604199325696
2013-03-05 04:36:31,msscarpenter,,4,1,1,"The shitty thing about Homatropine eye drops is I'm no longer able to see Internet porn properly. Oh yeah, and work stuff...",,,,308798152755015681,https://twitter.com/msscarpenter/status/308798152755015681
2013-02-11 12:46:15,Basweti14,,0,0,0,"""@karimaisME: oxybutynin, tolteradine, tropicamide. Homatropine... Your guess is as good as mine... #looost and i presented..smh"" rocket snc",,,#looost,300948865958424577,https://twitter.com/Basweti14/status/300948865958424577
2013-02-05 16:24:39,fahadshayhan,,0,0,0,"#med432 Tropicamide is better than Homatropine for the treatment of Opthalmological disorders",,,#med432,298829501863968768,https://twitter.com/fahadshayhan/status/298829501863968768
2013-02-05 03:53:03,DreaaDgaf,,1,0,0,"i hate all that shxt lol, i be at work filling prescriptions mad RT @ThatBkGuy: Hydrocodone homatropine Syrup get with it",,@ThatBkGuy,,298640355434328064,https://twitter.com/DreaaDgaf/status/298640355434328064
2013-02-03 20:40:04,Jenna_Burton,RyanCPratt,1,0,0,"@RyanCPratt he didn't say, but I don't think so bc I don't have the main symptom haha. He gave me cefuroxime and hydrocodone homatropine",,@RyanCPratt,,298169000595185665,https://twitter.com/Jenna_Burton/status/298169000595185665
2013-01-23 03:02:28,SpottySkunk,Rattnip,0,0,0,"@Grioden Gave me Hycodan, same Hydrocodone but has Homatropine. Isnt working worth a damn right now. Gonna go back to DXM.",,,,293916581673701377,https://twitter.com/SpottySkunk/status/293916581673701377
2013-01-14 19:07:39,NYdelight,,0,0,0,"finally my hydrocodone-homatropine arrived",,,,290897985880092672,https://twitter.com/NYdelight/status/290897985880092672
2013-01-14 09:41:35,food_qna,,0,0,0,"""how to stop hydrocodone/homatropine syrup?"" http://aolanswers.com/qp/504128573036392?ta",,,,290755532229341186,https://twitter.com/food_qna/status/290755532229341186
2013-01-14 09:41:35,myquestions1,,0,0,0,"""how to stop hydrocodone/homatropine syrup?"" http://aolanswers.com/qp/504128573036392?ta",,,,290755531424018433,https://twitter.com/myquestions1/status/290755531424018433
2013-01-11 11:28:24,BFKrueger,,0,0,0,"My aunt have hydrocodone homatropine cough syrup aka Codeine.",,,,289695248597254144,https://twitter.com/BFKrueger/status/289695248597254144
2012-12-25 06:32:54,tukquestions,,0,0,0,"""why can't you take hydrocodone homatropine syrup if you have diarrhea due to food"" http://aolanswers.com/qp/149338919809759?ta",,,,283460289326878720,https://twitter.com/tukquestions/status/283460289326878720
2012-12-25 00:23:13,Prodigy_1914,vmjmediagroup,3,0,0,"@techdiva1977 LOL. A whole bunch of stuff. Lol. Azithromycin, prednisone, and hydrocodone-homatropine cough syrup. #DopedUp",,,#DopedUp,283367259341213697,https://twitter.com/Prodigy_1914/status/283367259341213697
2012-12-20 21:51:12,jadedibaje,,0,0,0,"IT'S ABOUT TO GO DOWN! Got me some hydrocodone homatropine syrup, pseudoephedrine MAXIMUM STRENGTH, and ibup http://instagr.am/p/TeVeDUvOBM/",,,,281879449564233730,https://twitter.com/jadedibaje/status/281879449564233730
2012-12-20 09:31:58,DrNIRAVparmar,,0,0,0,"Homatropine in my eyes ready for Refraction. Though everything looks bright, but vision is blurred. Just like my Life... :)",,,,281693416822292480,https://twitter.com/DrNIRAVparmar/status/281693416822292480
2012-11-23 01:36:56,Capitancinema,,0,0,0,"Noticias C.C. Foros • Where to Buy Dilucid Online , Tussigon Homatropine/hydrocod http://goo.gl/fb/Y0Jsc",,,,271789395923841024,https://twitter.com/Capitancinema/status/271789395923841024
2012-11-07 14:02:51,ZayLewi_Mommy,SharkProjectboy,1,0,0,"@SharkProjectboy I'm on hydrocodone-homatropine &amp; ibuprofen..",,@SharkProjectboy,,266178905432547329,https://twitter.com/ZayLewi_Mommy/status/266178905432547329
2012-10-16 02:41:52,KrysAbbott,ATMonaghan,1,0,1,"@ATMonaghan Nahh its like hydrocodone homatropine syrup..lol",,@ATMonaghan,,258034998400135168,https://twitter.com/KrysAbbott/status/258034998400135168
2012-10-02 12:56:14,Mell0w_m3,rello_dgaf15,0,0,0,"@rello_dgaf15 I amoxicillin and homatropine syrup at 11 ish",,@rello_dgaf15,,253116180464803841,https://twitter.com/Mell0w_m3/status/253116180464803841
2012-09-28 23:20:31,EyeKaDoctor,RJHallner,0,0,0,"@RJHallner in most cases, just plain simple rest... Other cases Homatropine or some such... Differs from case to case",,@RJHallner,,251823732052619264,https://twitter.com/EyeKaDoctor/status/251823732052619264
2012-09-26 16:00:53,Kyng_Kyren,,0,0,0,"Hydrocodone W/ Homatropine Medicine For This Cold &amp; Sore Throat Got Me Geeking... Damnnn",,,,250988321919086592,https://twitter.com/Kyng_Kyren/status/250988321919086592
2012-09-26 04:07:09,Kyng_Kyren,,1,0,0,"This Hydrocodone W/ Homatropine For My Sore Throat Got Me Tripping... #Sleepy",,,#Sleepy,250808704402862080,https://twitter.com/Kyng_Kyren/status/250808704402862080
2012-09-04 13:10:25,thestock411,,0,0,0,"Eaton Scientific Discusses Positive Anecdotal Feedback from Pharmacist Compounding Homatropine for Doctors Treat... http://bit.ly/Q0KKuF",,,,242972889215795200,https://twitter.com/thestock411/status/242972889215795200
2012-09-01 11:16:17,SciBite,,0,0,0,"ClinicalNews:#Homatropine #Hot_Flashes Eaton Scientific Discusses Positive Anecdotal Feedback from Pharmacist.. http://www.scibite.com/site/library/2012_9/3/1/1_a9de284839d8ec6ad0a738308b5a1d06.html",,,#Homatropine #Hot_Flashes,241857003595628545,https://twitter.com/SciBite/status/241857003595628545
2012-09-01 09:42:22,Health_Pros_OW,,0,0,0,"Eaton Scientific Discusses Positive Anecdotal Feedback from Pharmacist Compounding Homatropine for Doctors Treat... http://yhoo.it/OF4aFI",,,,241833365727223808,https://twitter.com/Health_Pros_OW/status/241833365727223808
2012-09-01 09:23:04,allprnews,,0,0,0,"Eaton Scientific Discusses Positive Anecdotal Feedback from Pharmacist Compounding Homatropine for Doctors Treating ... http://ow.ly/1meSGd",,,,241828510308646912,https://twitter.com/allprnews/status/241828510308646912
2012-09-01 02:23:51,DanDayTrader,,0,0,0,"Eaton Scientific Discusses Positive Anecdotal Feedback from Pharmacist Compounding Homatropine for Doctors Treating ... http://ow.ly/1meHlI",,,,241723011940634624,https://twitter.com/DanDayTrader/status/241723011940634624
2012-09-01 02:23:39,hcimarket,,0,0,0,"Eaton Scientific Discusses Positive Anecdotal Feedback from Pharmacist Compounding Homatropine for Doctors Treating ... http://ow.ly/1meHBi",,,,241722962426859520,https://twitter.com/hcimarket/status/241722962426859520
2012-09-01 02:22:12,securitystocks,,0,0,0,"Eaton Scientific Discusses Positive Anecdotal Feedback from Pharmacist Compounding Homatropine for Doctors Treating ... http://ow.ly/1meISC",,,,241722595765006336,https://twitter.com/securitystocks/status/241722595765006336
2012-09-01 02:22:12,HotTrades,,0,0,0,"Eaton Scientific Discusses Positive Anecdotal Feedback from Pharmacist Compounding Homatropine for Doctors Treating ... http://ow.ly/1meISB",,,,241722595739828224,https://twitter.com/HotTrades/status/241722595739828224
2012-09-01 01:51:17,newsgnomes,,0,0,0,"Eaton Scientific Discusses Positive Anecdotal Feedback from Pharmacist Compounding Homatropine for Doctors Treating… http://goo.gl/fb/mqf8L",,,,241714816056705025,https://twitter.com/newsgnomes/status/241714816056705025
2012-09-01 01:25:56,PRNhealth,,0,0,0,"Eaton Scientific Discusses Positive Anecdotal Feedback from Pharmacist Compounding Homatropine for Doctors Treat... http://prn.to/OzVIJr",,,,241708435559813120,https://twitter.com/PRNhealth/status/241708435559813120
2012-09-01 01:19:17,3BL_Health,,0,1,0,"Eaton Scientific Discusses Positive Anecdotal Feedback from Pharmacist Compounding Homatropine... http://prn.to/R43Jo3 #health @PRNHealth",,@PRNhealth,#health,241706761650851840,https://twitter.com/3BL_Health/status/241706761650851840
2012-09-01 01:14:25,SiaranPers,,0,0,0,"Eaton Scientific Discusses Positive Anecdotal Feedback from Pharmacist Compounding Homatropine for... http://prn.to/PIz7IB #PressRelease",,,#PressRelease,241705538264645633,https://twitter.com/SiaranPers/status/241705538264645633
2012-09-01 01:10:42,PRNfinance,,0,0,0,"Eaton Scientific Discusses Positive Anecdotal Feedback from Pharmacist Compounding Homatropine for Doctors Treat... http://prn.to/OzVIJr",,,,241704600367947776,https://twitter.com/PRNfinance/status/241704600367947776
2012-09-01 01:09:34,health_today,,0,0,0,"Eaton Scientific Discusses Positive Anecdotal Feedback from Pharmacist Compounding Homatropine for Doctors Treat... http://prn.to/R41Tnb",,,,241704317860601856,https://twitter.com/health_today/status/241704317860601856
2012-08-25 07:49:30,Capitancinema,,0,0,0,"Noticias C.C. Foros • Order Homatropine Online No Prescription, Methotrexate Blood http://goo.gl/fb/zMt7S",,,,239268248405811201,https://twitter.com/Capitancinema/status/239268248405811201
2012-08-15 17:23:20,SameeraHajat,,0,0,0,"Atropine homatropine cocaine and tropicamide can all have an orgy in the back of some clinic. I'm done",,,,235788779489726465,https://twitter.com/SameeraHajat/status/235788779489726465
2012-07-18 23:06:10,maria_thaler,maria_thaler,3,0,0,"@maria_thaler @dr_mz13 For example there is a drug made in Jordan called Allospasmine (sp?). It has Homatropine and Allobarbital.",,@maria_thaler @Dr_mz13,,225728196732149760,https://twitter.com/maria_thaler/status/225728196732149760
2012-07-18 22:57:26,maria_thaler,Dr_mz13,2,0,0,"@dr_mz13 Actually homatropine is used outside US in some IBS medications and anti- spasmodic compounds",,@Dr_mz13,,225725999415971840,https://twitter.com/maria_thaler/status/225725999415971840
2012-07-18 18:00:21,maria_thaler,Dr_mz13,2,0,0,"@dr_mz13 Would homatropine, which has fewer side effects than atropine, also be effective?",,@Dr_mz13,,225651235779391488,https://twitter.com/maria_thaler/status/225651235779391488
2012-07-11 10:25:09,BrunoMacklin,,0,0,0,"hydrocodone-homatropine syrmor high ",,,,222999963326611456,https://twitter.com/BrunoMacklin/status/222999963326611456
2012-07-07 13:16:56,ElmerPortillo4,,0,0,0,"will hydrocodone homatropine syrmor get you high http://bit.ly/N6vCLX",,,,221593643935477760,https://twitter.com/ElmerPortillo4/status/221593643935477760
2012-07-05 22:36:55,DennisVargas10,,0,0,0,"will hydrocodone homatropine syrmor get you high http://bit.ly/NbhnHJ",,,,221009793152851968,https://twitter.com/DennisVargas10/status/221009793152851968
2012-07-05 10:39:39,OliverMims,,0,0,0,"Getting high hydrocodone homatropine syrup high http://bit.ly/O8vRWB",,,,220829287207538688,https://twitter.com/OliverMims/status/220829287207538688
2012-07-04 07:17:02,SimonMichaud3,,0,0,0,"can you get hydrocodone-homatropine ",,,,220415907497910272,https://twitter.com/SimonMichaud3/status/220415907497910272
2012-07-03 10:35:51,aril_izwansha,,0,0,0,"homatropine used to dilate (enlarge) the pupil of the eye.pupils will become unusually large and you will have blurring of vision..",,,,220103556672389120,https://twitter.com/aril_izwansha/status/220103556672389120
2012-07-01 07:57:28,BernardEnglish,,0,0,0,"Ic hydrocodone homatropine syrmor use past expiration http://bit.ly/OSloEA",,,,219338920658345985,https://twitter.com/BernardEnglish/status/219338920658345985
2012-07-01 07:06:46,EugeneVang,,0,0,0,"will hydrocodone homatropine syrmor get you high http://bit.ly/O5Doc0",,,,219326163401719808,https://twitter.com/EugeneVang/status/219326163401719808
2012-06-29 05:30:11,alvinblin,,0,0,0,"#HealthTap: Can hydrocodone-homatropine be taken with alcohol? Answer",,,#HealthTap,218577078616981505,https://twitter.com/alvinblin/status/218577078616981505
2012-06-25 17:36:56,SEKFEARFACTORY,,0,0,0,"http://puerta-del-sol.jp/pc_image/pc_image/1307/hydrocodone-and-homatropine-abuse hydrocodone and homatropine abuse http://theclematis.com/clematis/wp-includes/pomo/goddess-lakshmi-statue goddess lakshmi statue",,,,217310420178972673,https://twitter.com/SEKFEARFACTORY/status/217310420178972673
2012-06-25 11:21:48,HumphreyClarke1,,0,0,0,"can hydrocodone-homatropine syrup get you high http://bit.ly/MPLqVg",,,,217216016932024320,https://twitter.com/HumphreyClarke1/status/217216016932024320
2012-06-22 02:04:39,DanielHickman3,,0,0,0,"can i mix hydrocodone-homatropine syrup with nyquill ",,,,215988638792683520,https://twitter.com/DanielHickman3/status/215988638792683520
2012-06-17 12:03:10,ArthurMenendez,,0,0,0,"Hydrocodone homatropine with nyquil http://bit.ly/M4tPqb",,,,214327323648999424,https://twitter.com/ArthurMenendez/status/214327323648999424
2012-06-17 04:17:10,alvinblin,,0,0,0,"#HealthTap: What are any over the counter alternatives to hydrocodone and/or homatropine? Answer http://bit.ly/LtNWiA",,,#HealthTap,214210051127250945,https://twitter.com/alvinblin/status/214210051127250945
2012-06-17 04:12:31,alvinblin,,0,0,0,"#HealthTap: Is promethazine with codeine the same medicine as hydrocodone/ homatropine? Answer http://bit.ly/KRHS0z",,,#HealthTap,214208880115335168,https://twitter.com/alvinblin/status/214208880115335168
2012-06-12 10:26:22,RxDrugLabels,,0,0,0,"Rx Package Insert: Homatropine: Homatropine Hydrobromide is indicated for treatment of iritis and iridocyclitis,... http://bit.ly/MGd9YX",,,,212491024705142785,https://twitter.com/RxDrugLabels/status/212491024705142785
2012-06-12 09:50:34,MedsLib,,0,0,0,"Rx Label Update: Homatropine http://bit.ly/L27AoI",,,,212482014945878017,https://twitter.com/MedsLib/status/212482014945878017
2012-05-31 15:35:09,DrMGlover,,0,0,0,"#HealthTap: What can you do for an allergic reaction hydrocodone homatropine syrup? Answer http://bit.ly/KuMLRc",,,#HealthTap,208220075814162434,https://twitter.com/DrMGlover/status/208220075814162434
2012-05-22 12:49:03,khunnnabila,,0,0,0,"RT @aleaelf: muscarinic blocker-atropine,hyoscine,tropicamide,homatropine - contraindicated to old people -can increase intraocular pressure",,@aleaelf,,204916787496759296,https://twitter.com/khunnnabila/status/204916787496759296
2012-05-22 12:40:37,aleaelf,,0,0,0,"muscarinic blocker-atropine, hyoscine,tropicamide,homatropine - contraindicated to old people -can increase intraocular pressure.",,,,204914661794119682,https://twitter.com/aleaelf/status/204914661794119682
2012-05-21 18:29:42,virtute_usmlecs,,0,0,0,"#MuscarinincAntagonists Atropine,homatropine,tropicamide Eye. Produce mydriasis and cycloplegia",,,#MuscarinincAntagonists,204640125404192768,https://twitter.com/virtute_usmlecs/status/204640125404192768
2012-05-02 21:01:25,luvmycrosdressr,,0,0,0,"Dr. prescribed me hydrocodone/homatropine, I'm freaking out, how long will this feeling last? Not liking it at all.",,,,197792935985676290,https://twitter.com/luvmycrosdressr/status/197792935985676290
2012-04-29 18:21:28,__BonnieB,,0,0,0,"hydrocodone - homatropine ? these mfs tryna kill me !",,,,196665521855401985,https://twitter.com/__BonnieB/status/196665521855401985
2012-04-23 12:26:47,medicodiary,,0,0,0,"[April 23]only mydriate action is by: a)tropicamide b)phenylephrine c)homatropine d)cyclopentolate",,,,194401934873083904,https://twitter.com/medicodiary/status/194401934873083904
2012-04-13 15:45:46,JohnStanmeyer,,0,0,0,"Cheers to whoever created Hydrocodone Homatropine cough syrup. Bit like a triple G&amp;T. No wonder pharmacist said it's a controlled substance.",,,,190828131114958848,https://twitter.com/JohnStanmeyer/status/190828131114958848
2012-04-08 18:25:40,biebasbae,,0,0,0,"http://adyconvalencia.com/cms/wp-includes/js/isopto-homatropine isopto homatropine http://abrefacil.es/test/wp-includes/css/stylish-motorbike stylish motorbike",,,,189056433202008065,https://twitter.com/biebasbae/status/189056433202008065
2012-03-23 21:23:01,hyguwaqe,,0,0,0,"hydrocodone homatropine high http://hydrocodone-homatropine-high.cheapillsshop.com",,,,183302855644557312,https://twitter.com/hyguwaqe/status/183302855644557312
2012-03-22 02:12:05,Kayvontavie,,0,0,0,":'( RT @Lawd_Beyron: Dilated pupil! Hehehe!!RT @Kayvontavie: I swear i need shades this nite, d effect of homatropine is worse at nite",,@Lawd_Beyron @Kayvontavie,,182650829587746817,https://twitter.com/Kayvontavie/status/182650829587746817
2012-03-21 19:43:00,Kayvontavie,,0,0,0,"I swear i need shades this nite, d effect of homatropine is worse at nite",,,,182552912092860417,https://twitter.com/Kayvontavie/status/182552912092860417
2012-03-18 13:50:52,are_jay_bee,,0,0,0,"I've got a serious case of anticholinergic dry mouth #homatropine",,,#homatropine,181377132654624769,https://twitter.com/are_jay_bee/status/181377132654624769
2012-03-05 06:05:51,meemiecat,,0,0,0,"Hydrocodone homatropine and Benadryl don't make for the greatest nights. #lifewithchronicpain",,,#lifewithchronicpain,176549061845991424,https://twitter.com/meemiecat/status/176549061845991424
2012-02-22 13:49:04,theeebombdotcom,,0,0,0,"Hydrocodone homatropine for me http://instagr.am/p/HT2DJGM4_e/",,,,172316982010576896,https://twitter.com/theeebombdotcom/status/172316982010576896
2012-02-22 09:30:44,SignsSymptoms,,0,0,0,"More: HYDROCODONE BITARTRATE AND HOMATROPINE METHYLBROMIDE dosing http://symptomsexplained.com/drug-dosing/hydrocodone-bitartrate-and-homatropine-methylbromide-dosing-4/",,,,172251969799462912,https://twitter.com/SignsSymptoms/status/172251969799462912
2012-02-22 08:30:18,SignsSymptoms,,0,0,0,"More: HYDROCODONE BITARTRATE AND HOMATROPINE METHYLBROMIDE dosing http://symptomsexplained.com/drug-dosing/hydrocodone-bitartrate-and-homatropine-methylbromide-dosing-3/",,,,172236760057774080,https://twitter.com/SignsSymptoms/status/172236760057774080
2012-02-22 08:30:17,SignsSymptoms,,0,0,0,"More: HYDROCODONE BITARTRATE AND HOMATROPINE METHYLBROMIDE dosing http://symptomsexplained.com/drug-dosing/hydrocodone-bitartrate-and-homatropine-methylbromide-dosing-2/",,,,172236756979167232,https://twitter.com/SignsSymptoms/status/172236756979167232
2012-02-22 07:29:15,SignsSymptoms,,0,0,0,"More: HYDROCODONE BITARTRATE AND HOMATROPINE METHYLBROMIDE dosing http://symptomsexplained.com/drug-dosing/hydrocodone-bitartrate-and-homatropine-methylbromide-dosing/",,,,172221395990888448,https://twitter.com/SignsSymptoms/status/172221395990888448
