date,username,to,replies,retweets,favorites,text,geo,mentions,hashtags,id,permalink
2017-02-17 14:06:06,lifeoncoin,,0,0,0,"""BRIEF-Perrigo announces FDA final approval for hydrocodone bitartrate and homatropine methylbromide oral solution"" http://ift.tt/2kwVjko",,,,832591960359714817,https://twitter.com/lifeoncoin/status/832591960359714817
2017-02-17 14:05:48,CedarCalifornia,,0,0,0,"BRIEF-Perrigo announces FDA final approval for hydrocodone bitartrate and homatropine methylbromide oral solution http://ift.tt/2kwVjko …",,,,832591884941942787,https://twitter.com/CedarCalifornia/status/832591884941942787
2017-02-17 13:44:53,Allstocknews,,0,0,0,"$PRGO Perrigo Announces FDA Final Approval For Hydrocodone Bitartrate And Homatropine Methylbromide Oral Solu From our Stock News Alerts App",,,,832586618422833156,https://twitter.com/Allstocknews/status/832586618422833156
2017-02-17 05:26:08,biotech_sector,,0,0,0,"#Lupin Ltd receives USFDA approval for ANDA Hydrocodone Bitartrate and Homatropine Methylb... Read more: http://owler.us/acft5a $LUPIN",,,#Lupin,832461103477116929,https://twitter.com/biotech_sector/status/832461103477116929
2017-02-17 05:26:07,pharma_sector,,0,0,0,"#Lupin Ltd receives USFDA approval for ANDA Hydrocodone Bitartrate and Homatropine Methylb... Read more: http://owler.us/acft4G $LUPIN",,,#Lupin,832461103028252674,https://twitter.com/pharma_sector/status/832461103028252674
2017-02-17 04:01:09,f6online,,0,0,0,"Lupin receives USFDA approval for Hydrocodone Bitartrate, Homatropine Methylbromide Oral Solution.",,,,832439716616269825,https://twitter.com/f6online/status/832439716616269825
2017-02-17 02:51:26,equitybulls,,0,0,0,"Lupin Ltd receives USFDA approval for ANDA Hydrocodone Bitartrate and Homatropine Methylbromide Oral Solution ",,,,832422173973291010,https://twitter.com/equitybulls/status/832422173973291010
2017-02-16 16:23:16,Shilpa192123,,0,0,1,"@CapitalAdvisory Lupin receives USFDA approval for Hydrocodone Bitartrate and Homatropine Methylbromide oral solutio ",,@CapitalAdvisory,,832264088747008000,https://twitter.com/Shilpa192123/status/832264088747008000
2017-02-16 14:34:06,Jhaveri_Sec,,0,0,0,"Lupin gets ANDA approval for Hydrocodone Bitartrate and Homatropine Methylbromide Oral Solution (Syrup) http://ift.tt/2lW3uTN",,,,832236619059064832,https://twitter.com/Jhaveri_Sec/status/832236619059064832
2017-02-16 12:24:56,kotaknaren,,0,0,0,"Lupin gets USFDA nod for generic cough relief oral solution: Hydrocodone Bitartrate and Homatropine Methylbromide is…",,,,832204110225108992,https://twitter.com/kotaknaren/status/832204110225108992
2017-02-16 10:05:31,InvGurInd,,0,0,0,"Stock Alert - #Lupin: Gets #US #FDA Nod For ANDA Hydrocodone Bitartrate &amp; Homatropine Methylbromide http://ow.ly/y4JU3093zOz",,,#Lupin #US #FDA,832169028147871744,https://twitter.com/InvGurInd/status/832169028147871744
2017-02-16 09:58:17,CNBCTV18Live,,0,0,1,". @LupinLimited Gets @US_FDA Nod For Hydrocodone Bitartrate &amp; Homatropine Methylbromide #JustIn #BizNews",,@lupinlimited @US_FDA,#JustIn #BizNews,832167207887052805,https://twitter.com/CNBCTV18Live/status/832167207887052805
2017-02-16 09:55:11,BSE_News,,0,0,0,"LUPIN - Received USFDA approval for ANDA Hydrocodone Bitartrate and Homatropine Methylbromide Oral Solution (Syrup) http://tinyurl.com/jenf664",,,,832166425347424256,https://twitter.com/BSE_News/status/832166425347424256
2017-02-16 09:54:15,sharebossindia,,0,0,1,"LUPIN LTD. - 500257 - Received USFDA approval for ANDA Hydrocodone Bitartrate and Homatropine Methylbromide.. http://shareboss.in/ly/ICuj8R",,,,832166192332709888,https://twitter.com/sharebossindia/status/832166192332709888
2017-02-06 19:21:40,cynwithac,,0,0,0,"Unsure of any other way one would consume hydrocodone-homatropine syrup ",,,,828685106051162116,https://twitter.com/cynwithac/status/828685106051162116
2017-01-27 05:16:55,amplia2mente,,0,0,0,"Tussigon (Hydrocodone Bitartrate and Homatropine Methylbromide Tablets) - updated on RxList http://ift.tt/2jkWpKE",,,,824848639369424898,https://twitter.com/amplia2mente/status/824848639369424898
2017-01-13 04:31:29,snowmedct,,0,0,0,"Prepare for homatropine hydrobromide 2% preservative-free eye drops Hyoscine hydrobromide 0.12 with low visibility",,,,819763777252061185,https://twitter.com/snowmedct/status/819763777252061185
2016-11-03 01:17:10,parttimeamateur,,0,0,0,"Homatropine? Are you kidding me? Fucking puritan bullshit.",,,,793985338339459073,https://twitter.com/parttimeamateur/status/793985338339459073
2016-10-16 16:29:15,yrabeiro,OJGotJuice_,1,0,0,"when I came in they prescribed me hydrocodone- homatropine along with a shy ton of other meds",,,,787691889872936960,https://twitter.com/yrabeiro/status/787691889872936960
2016-09-26 06:56:57,MedChemExpress,,0,0,0,"Homatropine Methylbromide is muscarinic AChR antagonist, inhibits endothelial and smooth muscle muscarinic... https://www.medchemexpress.com/Homatropine-methylbromide.html",,,,780300105979080704,https://twitter.com/MedChemExpress/status/780300105979080704
2016-08-30 22:40:16,garand_f,,1,0,0,"uveitis,the patient could not find any homatropine in Quebec,back order?my patient needed that prescription,i didn't let my patient down",,,,770753030320951296,https://twitter.com/garand_f/status/770753030320951296
2016-08-28 09:49:40,sy_khan_,,0,0,0,"Hydrocodone. More potent than codeine. Used in combination with anti collinergic homatropine yaaaaaaaas",,,,769834323239395328,https://twitter.com/sy_khan_/status/769834323239395328
2016-07-28 00:52:21,skipbidder,MDaware,1,0,0,"I believe that in at least most other places it's approved, it's as hydrocodone/homatropine. (Hydromet or Hycodan)",,,,758465082162606081,https://twitter.com/skipbidder/status/758465082162606081
2016-05-10 21:27:36,colinisabadass,keithlaw,1,0,0,"@keithlaw no, it's not mixed with a sedative. It's combined with homatropine. That's not a sedative. Also, codeine derivative != codeine",,@keithlaw,,730147301180637184,https://twitter.com/colinisabadass/status/730147301180637184
2016-05-03 18:56:21,marvlous1,chelseahandler,0,0,0,"@chelseahandler It's hydrocodone,brand name Hycodan.It has homatropine in it also.Just take a vicodin 5mg and put it in juice,same thing",,@chelseahandler,,727572522787430400,https://twitter.com/marvlous1/status/727572522787430400
2016-04-29 14:15:48,decompositorbot,,0,0,0,"contents of corn-exchange: 21% homatropine, 79% prepostor. ",,,,726052368392065024,https://twitter.com/decompositorbot/status/726052368392065024
2016-04-14 03:45:16,a_lovely_cloud,,0,0,0,"doesn't this look like a homatropine ",,,,720457868869242881,https://twitter.com/a_lovely_cloud/status/720457868869242881
2016-03-09 18:03:51,skipbidder,Steftyem,2,0,0,"@Steftyem @geekpharm @TelaAntkowiak That would be Hydromet or Hycodan. (Hydrocodone with the intentional contaminant homatropine)",,@Steftyem @GeekPharm @TelaAntkowiak,,707627977018896384,https://twitter.com/skipbidder/status/707627977018896384
2016-02-20 20:33:42,newlilwaynesong,,0,0,0,"Hydrocodone homatropine syrup &lt;b&gt;lil wayne&lt;/b&gt; drinksydrocodone homatropine syrup &lt;b&gt;lil wayne&lt;/b&gt; drinks",,,,701142707025141760,https://twitter.com/newlilwaynesong/status/701142707025141760
2016-02-05 04:26:02,TabifaD,,0,0,2,"Prescription cough syrup since I can't even talk without coughing, someone's about to sleep SOOO good. S/o to hydrocodone homatropine. ",,,,695463365720801280,https://twitter.com/TabifaD/status/695463365720801280
2016-01-30 09:58:34,bekah_eh,,1,0,2,"psh fuck promethazine-codeine syrup....hydrocodone-homatropine syrup is where it's at people. ",,,,693372724211642368,https://twitter.com/bekah_eh/status/693372724211642368
2016-01-13 04:11:35,AbigailHourigan,,0,0,0,"Hydrocodone Homatropine is a wonderful, wonderful drug.",,,,687124809185099781,https://twitter.com/AbigailHourigan/status/687124809185099781
2016-01-11 03:44:44,hafiza96h,,0,0,0,"Atropine and Homatropine. Natural and synthetic Cholinergic antagonist drugs respectively.",,,,686393275758936065,https://twitter.com/hafiza96h/status/686393275758936065
2015-12-30 03:30:22,AMarieJoy,,0,0,0,"This hydrocodone/homatropine cough syrup is the .com!",,,,682041008532623360,https://twitter.com/AMarieJoy/status/682041008532623360
2015-12-17 02:22:29,adlez_best_lez,0mnigul,2,0,1,"@doctor_ohmy It's hydrocodone-homatropine cough syrup. The doctor told my father it wasn't codeine but the pharmacist said it does",,,,677312881352949762,https://twitter.com/adlez_best_lez/status/677312881352949762
2015-12-02 20:15:40,Uwillknowmyname,Uwillknowmyname,0,0,1,"@AudreyAurus1 @Vibrations144 @DTA_Ever This is what happens when u take steriods and HOMATROPINE HYDROCODONE LIQUID DRINKING VICODIN YA BABY",,@AudreyAurus1 @Vibrations144,,672147138609086464,https://twitter.com/Uwillknowmyname/status/672147138609086464
2015-10-28 14:03:44,USMLEStepStudy,,0,0,3,"Dilating Pupil- Parasympathetic antagonists= Tropicamide (safest), Cyclopentolate, Atropine, Homatropine; Sympathetic agonist= Phenylephrine",,,,659369963334053888,https://twitter.com/USMLEStepStudy/status/659369963334053888
2015-10-20 19:57:52,skipbidder,skipbidder,0,0,0,"@geekpharm @CatsAndPills But they weren't asking for Hydromet (hydrocodone/homatropine). Which is what I might have guessed if I thought...",,@GeekPharm @CatsAndPills,,656559979915276288,https://twitter.com/skipbidder/status/656559979915276288
2015-10-18 21:16:05,heli_med_james,BRIANoriordan,0,1,1,"@BRIANoriordan @ketaminh @ExpedMedicine did you combine with homatropine as per Minh's comment? Preferred analgesic?",,@BRIANoriordan @ketaminh @ExpedMedicine,,655854889772437504,https://twitter.com/heli_med_james/status/655854889772437504
2015-10-18 21:08:30,ketaminh,heli_med_james,1,2,2,"@heli_med_james @ExpedMedicine yes but may need to combine with dilating drops like homatropine to minimise ciliary spasm pain too",,@heli_med_james @ExpedMedicine,,655852982387347456,https://twitter.com/ketaminh/status/655852982387347456
2015-10-14 06:15:14,shosho_faded,,0,1,2,"Your MCM be drinking dat hydrocodone homatropine syrup",,,,654178631711895552,https://twitter.com/shosho_faded/status/654178631711895552
2015-09-30 04:27:56,apidrug,,0,0,0,"HOMATROPINE HBR 80-49-9 API BULK DRUGS MANUFACTURER http://blog.swapnroopdrugs.com/homatropine-hbr-80-49-9-api-bulk-drugs-manufacturer/",,,,649078198018293760,https://twitter.com/apidrug/status/649078198018293760
2015-09-10 03:25:38,apidrug,,0,0,0,"Homatropine Hbr Usp Ip Bp Ep Manufacturer 1904668 Swapnroop Drugs And Pharmaceuticals - Worldbid http://www.worldbid.com/tradeleads/sell/homatropine-hbr-usp-ip-bp-ep-manufacturer-1904668.html#.VfD4MMW_VNw.twitter",,,,641814764658683904,https://twitter.com/apidrug/status/641814764658683904
2015-08-21 14:12:56,VanHerickG4,,0,0,0,"Call from pharmacy this morning: ""we are out of homatropine, but we have isocarpine in stock, would that work?""...um no that is the opposite",,,,634729902013591552,https://twitter.com/VanHerickG4/status/634729902013591552
2015-05-29 02:03:57,healthstomp,,0,0,0,"Can hydrocodone and homatropine be used to make purple drank: Colonic irrigation fills the… http://goo.gl/fb/FOhA49",,,,604105869484142592,https://twitter.com/healthstomp/status/604105869484142592
2015-05-12 01:48:31,skipbidder,,0,0,0,"@geekpharm @skepticpedi The homatropine is meant as an adulterant there, isn't it? Atropine poisoning preventing high dose use.",,@GeekPharm,,597941390396497920,https://twitter.com/skipbidder/status/597941390396497920
2015-04-09 22:30:29,snowmedct,,0,0,0,"Looking ahead, more homatropine hydrobromide 0.5% eye drops Homatropine hydrobromide 1% preservative-f",,,,586295141876498434,https://twitter.com/snowmedct/status/586295141876498434
2015-04-01 08:46:01,NASSexercise,,0,1,0,"Usual management of #uveitis is prednisolone eye drops and homatropine eye drops. Should see opthalmologist again in 1 week",,,#uveitis,583188553955446784,https://twitter.com/NASSexercise/status/583188553955446784
2015-02-23 09:21:13,apidrug,,0,0,0,"Homatropine API Manufacturer Suppliers send us email on sales@swapnroopdrugs.com by @activepharma http://www.slideshare.net/API-Bulk-Drugs/homatropineapi-manufacturer-suppliers-send-us-email-on-salesswapnroopdrugscom via @SlideShare",,@activepharma @SlideShare,,569789062862675968,https://twitter.com/apidrug/status/569789062862675968
2015-02-13 01:45:33,RSG07071980,Rachel__Nichols,0,0,0,"@Rachel__Nichols @mcten should've taken homatropine to reduce ciliary spasm, which is what causes the light sensitivity he's noticing...",,@Rachel__Nichols @mcten,,566050510323458050,https://twitter.com/RSG07071980/status/566050510323458050
2015-01-31 17:27:42,Mgtrben,,0,0,0,"Hydrocodone Homatropine Armor York Hydrocodone . How Long Does Codeine Syrup Stay In Your System Hydrocodone ... http://bit.ly/1wNsn1b",,,,561576568019898369,https://twitter.com/Mgtrben/status/561576568019898369
2015-01-14 05:19:55,NorcoSlinger,SassyPharmD,2,0,0,"@SassyPharmD @PhlyingRPh do they actually still make hydrocodone/homatropine cough syrup now that hydrocodone is c2? That shit is da bomb",,@SassyPharmD @PhlyingRPh,,555232823347404801,https://twitter.com/NorcoSlinger/status/555232823347404801
2015-01-06 03:26:43,jewdez,,0,0,0,"Hydrocodone-homatropine may cure my throat and cough but it tastes like cherry flavored horse piss. #barf",,,#barf,552305232714403840,https://twitter.com/jewdez/status/552305232714403840
2014-12-22 17:54:45,drshalupal,,0,0,0,"Ho! Ho! Homatropine! Happy holidays, everybody! http://fb.me/2PEOXi0gc",,,,547087864194822144,https://twitter.com/drshalupal/status/547087864194822144
2014-12-01 20:10:11,ShaniTranslatio,,0,0,0,"Hydrocodone homatropine cough http://durl.me/7srnpp",,,,539511798400315392,https://twitter.com/ShaniTranslatio/status/539511798400315392
2014-11-24 17:13:03,JesseniaArgueta,,1,0,1,"How strong is Hydrocodone- Homatropine syrup? @_mpuen",,,,536930509759074305,https://twitter.com/JesseniaArgueta/status/536930509759074305
2014-09-29 22:22:09,ADLogistics,,0,0,0,"Solicitation SPE2DP14T2726 NSN: 6505007644011 – HOMATROPINE HYDROBR PR: 0055290164 for QTY of 3 http://nblo.gs/10ibD2",,,,516714576004411392,https://twitter.com/ADLogistics/status/516714576004411392
2014-09-25 22:44:12,Skimotep,,0,0,0,"Photo: #dilated #homatropine #nonearvision #mydriatic #anticholinergic [thanks for the spellcheck... http://tmblr.co/ZiGyKy1RgOpOU",,,#dilated #homatropine #nonearvision #mydriatic #anticholinergic,515270573430407168,https://twitter.com/Skimotep/status/515270573430407168
2014-09-25 22:39:48,Skimotep,,0,0,0,"Photo: #dialated #homatropine #anticholinergic #mydriatic #nonearvision (at The United Nations - Main Lair) http://tmblr.co/ZiGyKy1RgNgNR",,,#dialated #homatropine #anticholinergic #mydriatic #nonearvision,515269463936335872,https://twitter.com/Skimotep/status/515269463936335872
2014-08-23 04:04:33,soco_7,,0,0,0,"Dat nigga ain't got prometh/codeine he got hydrocodone/homatropine which is stronger, deadlier",,,,503030004247437312,https://twitter.com/soco_7/status/503030004247437312
2014-08-15 00:00:09,decompositorbot,,0,0,0,"contents of streetwalking: 25% zanana, 75% homatropine. ",,,,500069396975742976,https://twitter.com/decompositorbot/status/500069396975742976
2014-08-12 15:02:28,EyeSupplyUSA,,0,0,0,"Deal of the Day! Homatropine 5% Solution 5ml - $22.95 - http://www.eyesupplyusa.com/deal-of-the-day",,,,499209308425715712,https://twitter.com/EyeSupplyUSA/status/499209308425715712
2014-07-20 09:32:04,agnusang,,0,0,0,"homatropine and cyclopentolate have the same effects. What am I supposed to do.",,,,490791240862932992,https://twitter.com/agnusang/status/490791240862932992
2014-07-11 14:57:24,EyeSupplyUSA,,0,0,0,"Deal of the Day! Homatropine 5% Solution 5ml - $22.95 - http://www.eyesupplyusa.com/deal-of-the-day",,,,487611622178181121,https://twitter.com/EyeSupplyUSA/status/487611622178181121
2014-07-01 02:39:55,KoalaBeana,,0,0,3,"I thought I was taking promethazine/codeine turns out its hydrocodone homatropine which is way stronger. I’m straight fucked right now.",,,,483802147520131072,https://twitter.com/KoalaBeana/status/483802147520131072
2014-07-01 02:38:31,KoalaBeana,,0,0,0,"@DeeCohenJr scratch that this isn’t sizzurp its stronger its hydrocodone homatropine its straight liquid vicodin.",,,,483801797358669826,https://twitter.com/KoalaBeana/status/483801797358669826
2014-06-28 05:24:00,rebeccal_ynn,,0,0,0,"Hydrocodone homatropine is the best thing ever",,,,482756278037778432,https://twitter.com/rebeccal_ynn/status/482756278037778432
2014-06-05 09:30:19,Medical_MCQ,,0,0,0,"A patient with eye pain and blurring of vision. Drug which is contraindicated in this patient is homatropine (narrow angle glaucoma).",,,,474483346668789761,https://twitter.com/Medical_MCQ/status/474483346668789761
2014-05-25 13:18:22,Matias3rd,,0,0,0,"hydrocodone-homatropine syrup, take 5ml by mouth every 6 hours if needed",,,,470554469818576897,https://twitter.com/Matias3rd/status/470554469818576897
2014-05-22 14:39:24,drkhezar,,0,0,0,"The treatment of the antimuscarinic effects can be carried out with: a) Neostigmine b) Hexametonium c) Homatropine d) Acetylcholine",,,,469487698357395457,https://twitter.com/drkhezar/status/469487698357395457
2014-05-21 13:00:20,decompositorbot,,0,0,0,"contents of Mormons: 7% swaybars, 93% homatropine.",,,,469100377598869504,https://twitter.com/decompositorbot/status/469100377598869504
2014-05-20 15:40:02,drkhezar,,0,0,0,"Indicate the antimuscarinic drug, which is used as a mydriatic: a) Pilocarpine b) Neostigmine c) Homatropine d) Ipratropium",,,,468778179289550848,https://twitter.com/drkhezar/status/468778179289550848
2014-05-20 15:39:51,drkhezar,,0,0,0,"Which of the following agents is used as an inhalation drug in asthma? a) Atropine b) Ipratropium c) Lobeline d) Homatropine",,,,468778133399678976,https://twitter.com/drkhezar/status/468778133399678976
2014-05-19 04:18:18,SarahCaylor_,,0,0,0,"Like if you think pot makes you feel good you should try out homatropine.",,,,468244230381789184,https://twitter.com/SarahCaylor_/status/468244230381789184
2014-04-02 21:49:51,druginfo,,0,0,0,"Forum: dia quel - I have a bottle of Dia-quel in my medicine cabinet. Contains tincture of opium, homatropine me... http://ow.ly/2FigNu",,,,451476631941820416,https://twitter.com/druginfo/status/451476631941820416
2014-04-02 21:49:41,medschat,,0,0,0,"#MedsChat dia quel - I have a bottle of Dia-quel in my medicine cabinet. Contains tincture of opium, homatropine... http://ow.ly/2FigRm",,,#MedsChat,451476589537402881,https://twitter.com/medschat/status/451476589537402881
2014-03-25 04:09:55,JohnRhinesSTL,InverseDream1,0,0,1,"@InverseDream she gave me Rx for hydrocodone-homatropine to slow down the spasms and albuterol/steroid to use w/nebulizer to open airways.",,@inversedream,,448310786624983041,https://twitter.com/JohnRhinesSTL/status/448310786624983041
2014-03-14 17:43:38,kl_artz,cjnews,0,0,0,"@cjnews What happened 2 addition of homatropine? @HealthCollectiv @FDA_Drug_Info @US_FDA @HalRogersKY",,@cjnews @HealthCollectiv @FDA_Drug_Info @US_FDA @HalRogersKY,,444529297156743168,https://twitter.com/kl_artz/status/444529297156743168
2014-03-13 19:03:25,EyeSupplyUSA,,0,0,0,"Deal of the Day! Homatropine 5% Solution 5ml - $22.95 - http://www.eyesupplyusa.com/deal-of-the-day",,,,444186991211851777,https://twitter.com/EyeSupplyUSA/status/444186991211851777
2014-03-12 10:53:01,MohammedAlabas2,,0,0,0,"Which of the following mydriatics has the fastest and briefest action: A.Atropine B.Homatropine C.Tropicamide... http://fb.me/2t6ctjhr9",,,,443701187364544512,https://twitter.com/MohammedAlabas2/status/443701187364544512
2014-03-02 03:14:51,DannyRatcliffe,,0,0,1,"Hydrocodone-Homatropine cough syrup is my birthday drank and I am sleeping with Netflix. #turnup #hbd",,,#turnup #hbd,439962009992695808,https://twitter.com/DannyRatcliffe/status/439962009992695808
2014-02-25 18:46:02,eyesteve,,0,1,0,"Last night my ED attending suggested homatropine for iritis. Clueless-intern-me thought he meant atropine to use at home #laughatself #meded",,,#laughatself #meded,438384408975138816,https://twitter.com/eyesteve/status/438384408975138816
2014-02-14 19:54:14,EyeSupplyUSA,,0,0,0,"Deal of the Day! Homatropine 5% Soln 5ml - $22.95 - http://www.eyesupplyusa.com/deal-of-the-day",,,,434415306749263872,https://twitter.com/EyeSupplyUSA/status/434415306749263872
2014-02-13 05:41:11,Megan_Mines,,0,0,0,"Homatropine/hydrocodone cough syrup will be the only reason I sleep tonight. Thanks doc! #nightworld #coughingupmylungs",,,#nightworld #coughingupmylungs,433838238818512897,https://twitter.com/Megan_Mines/status/433838238818512897
2014-02-10 20:59:51,nerdysqueeeaks,,1,0,0,"Hydrocodone-homatropine is the devil's syrup.",,,,432982267691270144,https://twitter.com/nerdysqueeeaks/status/432982267691270144
2014-02-08 16:34:33,_science_gang_,,0,0,0,"Hydrocodone nightmares (w/ homatropine)",,,,432190724872757249,https://twitter.com/_science_gang_/status/432190724872757249
2014-02-07 03:07:34,TheGonzalez,,0,0,0,"Hydrocodone-Homatropine Side effects may include severe nausea. Do not take on an empty stomach.",,,,431625253966462976,https://twitter.com/TheGonzalez/status/431625253966462976
2014-02-04 13:17:34,DonaldsonKatie,,0,0,0,"For real guys, never try to use hydrocodone-homatropine syrup recreationally. You'll be vomitting for the following 12 hours.",,,,430691602072608768,https://twitter.com/DonaldsonKatie/status/430691602072608768
2014-02-04 06:45:15,DonaldsonKatie,,0,0,0,"I would not recommend drinking 2 oz of hydrocodone homatropine syrup. You will throw up.",,,,430592873117937664,https://twitter.com/DonaldsonKatie/status/430592873117937664
2014-01-22 20:06:07,EyeSupplyUSA,,0,0,0,"Deal of the Day! Homatropine 5% Soln 5ml - $22.95 - http://www.eyesupplyusa.com/deal-of-the-day",,,,426083375657787392,https://twitter.com/EyeSupplyUSA/status/426083375657787392
2014-01-03 17:13:53,Kailef,UKgirl_ash0104,1,0,0,"@UKgirl_ash0104 I have some Hydrocodone-Homatropine leftover from a previous cold. Gotta call pharmacy though to see if it's ok to take.",,@UKgirl_ash0104,,419154660063068160,https://twitter.com/Kailef/status/419154660063068160
2014-01-02 19:55:24,EyeSupplyUSA,,0,0,0,"Deal of the Day! Homatropine 5% Solution 5ml - $22.95 - http://www.eyesupplyusa.com/deal-of-the-day",,,,418832920162603008,https://twitter.com/EyeSupplyUSA/status/418832920162603008
2014-01-02 16:03:35,EyeSupplyUSA,,0,0,0,"Save on #ophthalmic supplies! Homatropine 5% Solution 5ml - $22.95 - http://www.eyesupplyusa.com/deal-of-the-day",,,#ophthalmic,418774581164670976,https://twitter.com/EyeSupplyUSA/status/418774581164670976
2013-12-18 01:57:20,_theycallmeLo,,0,0,1,"""@Ayee_Shae_doee: That medicine is hydrocodone homatropine syrup. oops"" jus some cough syruo",,@Ayee_Shae_doee,,413125799001481216,https://twitter.com/_theycallmeLo/status/413125799001481216
2013-12-18 01:53:49,Ayee_Shae_doee,,0,0,2,"That medicine is hydrocodone homatropine syrup. oops",,,,413124914598936577,https://twitter.com/Ayee_Shae_doee/status/413124914598936577
2013-12-12 07:46:28,Elleionatheart,SamIsGnar,0,0,0,"@SamIsGnar no shit g but it was the homatropine in it",,@SamIsGnar,,411039332380991488,https://twitter.com/Elleionatheart/status/411039332380991488
2013-11-21 20:01:26,EyeSupplyUSA,,0,0,0,"Deal of the Day! Homatropine 5% Sol. 5ml - $22.95 - http://www.eyesupplyusa.com/deal-of-the-day",,,,403614148682346496,https://twitter.com/EyeSupplyUSA/status/403614148682346496
2013-11-05 17:37:59,kamcintyre13,ChrisFletch10,1,0,0,"@ChrisFletch10 been there, done that. Feels the same either way... Its not promethazine w codeine, it's hydrocodone and homatropine",,@ChrisFletch10,,397779843527745536,https://twitter.com/kamcintyre13/status/397779843527745536
2013-10-30 14:58:21,EyeSupplyUSA,,0,0,0,"Great deal on Homatropine 5% Sol. 5ml - $22.95 - http://www.eyesupplyusa.com/deal-of-the-day",,,,395565341755314176,https://twitter.com/EyeSupplyUSA/status/395565341755314176
2013-10-19 01:34:16,Tracezofmylpstk,,0,0,0,"Codeine and homatropine for the next week.. Gotta knock this out",,,,391376719908577280,https://twitter.com/Tracezofmylpstk/status/391376719908577280
2013-10-17 19:50:10,NorcoSlinger,,0,0,0,"*cough* this cold sucks. I just want to curl up with a 16oz bottle of hydrocodone/homatropine syrup and forget the world exists.",,,,390927740100022272,https://twitter.com/NorcoSlinger/status/390927740100022272
2013-10-03 05:30:56,ButtercupD,NegativeNatalie,1,0,0,"@negativenatalie is it hydrocodone-homatropine?",,@NegativeNatalie,,385638075004887041,https://twitter.com/ButtercupD/status/385638075004887041
2013-10-02 14:58:16,EyeSupplyUSA,,1,0,0,"Deal of the Day! Homatropine 5% Solution 5ml - $22.95 - http://www.eyesupplyusa.com/deal-of-the-day",,,,385418461650100224,https://twitter.com/EyeSupplyUSA/status/385418461650100224
2013-09-19 15:43:02,srrezaie,,0,2,1,"Consensual photophobia is buzz phrase for traumatic iritis; tx is dilating pupil (Homatropine) #FOAMed #EMConf #EMBoardReview",,,#FOAMed #EMConf #EMBoardReview,380718685280690178,https://twitter.com/srrezaie/status/380718685280690178
2013-09-11 01:01:11,Lanternlizard,danmallia_,0,0,0,"@danmallia_ @HalothaneDoc @rymitch18 @Gay__MD @Dr_Sandy_S REAL GUESS homatropine 2% eye drops or sig: bid prn ref:1",,@danmallia_ @HalothaneDoc @rymitch18 @Gay__MD,,377597657566699520,https://twitter.com/Lanternlizard/status/377597657566699520
2013-09-10 23:44:23,DaQuPa,danmallia_,0,0,0,"@danmallia_ @HalothaneDoc @rymitch18 @Gay__MD @Dr_Sandy_S @Lanternlizard homatropine 2% eye drops BID PRN with xtra squiggles and lines. :S",,@danmallia_ @HalothaneDoc @rymitch18 @Gay__MD @Lanternlizard,,377578329223995392,https://twitter.com/DaQuPa/status/377578329223995392
2013-09-10 23:43:41,danmallia_,DaQuPa,0,0,0,"@DaQuPa @HalothaneDoc @rymitch18 @Gay__MD @Dr_Sandy_S @Lanternlizard Apparently it says: Homatropine 2% eye drops BID both eyes",,@DaQuPa @HalothaneDoc @rymitch18 @Gay__MD @Lanternlizard,,377578154707410944,https://twitter.com/danmallia_/status/377578154707410944
