date,username,to,replies,retweets,favorites,text,geo,mentions,hashtags,id,permalink
2018-04-04 02:50:55,stofcare,,0,0,0,"Ipratropium drug that relieves bronchial spasms, as it blocks the muscarinic acetylcholine receptors in the smooth muscles of the bronchi in the lungs, opening the bronchi. http://Standardofcare.com/ipratropium_bromide_(atrovent)",,,,981363457139400704,https://twitter.com/stofcare/status/981363457139400704
2018-04-03 00:51:30,JustttJane,MoRidout,1,0,3,"For ipratropium BROmide and tiotropium BROmide —acts on MUSCARINIC cholinergic receptors (like muscles= wears bro/muscle tank...; also muscle=working out=get your heart pumping (adverse effect) fuckboy bc it’s an antagonist for the receptor lol",,,,980971015693062144,https://twitter.com/JustttJane/status/980971015693062144
2018-03-31 23:38:29,ChrisBartholo17,RUSM_PM,0,0,0,"An agonist binds with a receptor causing an action, such as albuterol stimulating B2 receptors, while an antagonist binds with a receptor inhibiting the action normally associated with that receptor, such as ipratropium bromide. #RUSMPMX",,,#RUSMPMX,980227864430895104,https://twitter.com/ChrisBartholo17/status/980227864430895104
2018-03-30 21:25:37,ConserValidity,,0,0,1,"@RMConservative lifetime vasomotor rhinitis(plus seasonal allergies). 1)Active ingredient in all D’s: Sudafed etc. is Pseudoephedrine. Claritin-D 24hr=strongest available-240mg,others 120mg at most. 2)Have tried all sprays none work for me but super cheap ipratropium Bromide .06",,@RMConservative,,979832040861380608,https://twitter.com/ConserValidity/status/979832040861380608
2018-03-30 07:07:46,xeroxnet69,,0,0,0,"New asthma clinical trial: Acute Bronchodilator Effect of Inhaled Albuterol Sulfate and Ipratropium Bromide in Patients With Stable COPD https://ift.tt/2pTu17x",,,,979616155664084992,https://twitter.com/xeroxnet69/status/979616155664084992
2018-03-28 19:46:04,TreatmentScores,,0,0,0,"How much do you know about Ipratropium Bromide Nasal Spray? ",,,,979082210690166785,https://twitter.com/TreatmentScores/status/979082210690166785
2018-03-27 10:27:23,YAS_LauraM,,1,0,10,"2nd patient of the day was a elderly lady with COPD. Oxygen levels were 80% on arrival. Oxygen Salbutamol Ipratropium Bromide Transport to A&amp;E Now time to restock drugs. ",,,,978579225388179456,https://twitter.com/YAS_LauraM/status/978579225388179456
2018-03-26 11:56:55,CritKnow,,0,0,1,"Mark up (and move!) your look-alike medications. No patient needs an accidental dose of racemic epinephrine! Don't confuse these ipratropium bromide and epinephrine packages. #paramedics #geriatrics #firefighters",,,#paramedics #geriatrics #firefighters,978239370418409472,https://twitter.com/CritKnow/status/978239370418409472
2018-03-24 18:52:44,ChrisJohnsonMD,Plasticdoe,1,0,5,"Well, we have some completely holistic and natural substances to treat acute asthma -- beta agonists and corticosteroids, both of which are hormones, ipratropium, which is an analogue to several plant extracts, and oxygen, which is as natural as natural gets.",,,,977619239296172032,https://twitter.com/ChrisJohnsonMD/status/977619239296172032
2018-03-22 23:55:49,wael_nadine,,1,0,0,"Ipratropium and Tiotropium given for are bronchodilators given for COPD . Ipra is the DOC in case of asthmatic attack",,,,976970736748331008,https://twitter.com/wael_nadine/status/976970736748331008
2018-03-21 05:22:09,lupussurvivors,,0,0,0,"Nebulized ipratropium - Atrovent inhalation solution - Ipratropium bromide dose copd - Rejoice Magazine http://bit.ly/2GeOrSC #Lupus #LupusSurvivors #LupusAwarenes",,,#Lupus #LupusSurvivors #LupusAwarenes,976328087162929152,https://twitter.com/lupussurvivors/status/976328087162929152
2018-03-18 16:45:10,ProfOculista,,0,0,0,"Transient #anisocoria in a patient treated with nebulized ipratropium #bromide @ajocasereports | #ECM https://goo.gl/MVhKee",,@ajocasereports,#anisocoria #bromide #ECM,975412807301828609,https://twitter.com/ProfOculista/status/975412807301828609
2018-03-15 19:30:36,beholdbot,,1,0,1,"BEHOLD @THEBRINEYDEPTHS, WHO SUMMONS IPRATROPIUM BROMIDE MAGIC AT WILL",,@thebrineydepths,,974367279092850688,https://twitter.com/beholdbot/status/974367279092850688
2018-03-14 21:49:44,ekuagbengbentus,totti_Er_pupone,1,0,0,"Oh on assessment I think you...Salbutamol plus Ipratropium ",,,,974039902798131201,https://twitter.com/ekuagbengbentus/status/974039902798131201
2018-03-13 12:00:55,ProfOculista,,0,1,1,"Transient #anisocoria in a patient treated with nebulized ipratropium #bromide @ajocasereports | #ECM https://goo.gl/MVhKee",,@ajocasereports,#anisocoria #bromide #ECM,973529334358118400,https://twitter.com/ProfOculista/status/973529334358118400
2018-03-12 23:32:33,ashnMCR,,0,0,0,"I do feel a lot better, I think the ipratropium is what helps the most. Which is interesting",,,,973341001271205888,https://twitter.com/ashnMCR/status/973341001271205888
2018-03-12 16:00:48,ProfOculista,,0,0,2,"Transient #anisocoria in a patient treated with nebulized ipratropium #bromide @ajocasereports | #ECM https://goo.gl/MVhKee",,@ajocasereports,#anisocoria #bromide #ECM,973227314539565056,https://twitter.com/ProfOculista/status/973227314539565056
2018-03-12 14:13:02,Whitdiane47,DrNealDunnFL2,1,2,4,"DR. Neal Dunn, Why don't you listen to veterans that are not getting adequate pain management, and being denied adequate medications that support our quality of life, like lasix, flexeril, hydrocodone, albuterol/ipratropium, etc?? I have went up through my chain of command,",,,,973200193901404165,https://twitter.com/Whitdiane47/status/973200193901404165
2018-03-08 16:27:13,fikshai,,1,2,23,"Acute Asthma Management. S.O.S S- Salbutamol. O- Oxygen. S- Steroids. *consider adding Short Acting Muscarinic Receptor Agonist. (Ipratropium Bromide)",,,,971784413141811200,https://twitter.com/fikshai/status/971784413141811200
2018-03-02 11:26:51,RXCouponsorg,,0,0,0,"Coupon Edited: ATROVENT (ipratropium bromide) Coupons, Discounts &amp; Cost http://rxcoupons.to/coupons/atrovent-ipratropium-bromide-coupons-discounts/",,,,969534497078247424,https://twitter.com/RXCouponsorg/status/969534497078247424
2018-03-02 11:11:38,RXCouponsorg,,0,0,0,"Coupon Edited: COMBIVENT (albuterol/ipratropium) Coupons, Discounts &amp; Cost https://rxcoupons.to/coupons/combivent-albuterolipratropium-coupons-discounts-cost/",,,,969530665040580608,https://twitter.com/RXCouponsorg/status/969530665040580608
2018-03-01 04:10:31,TawengMd,,0,1,1,"Question from The audience Antimuscarinics like Ipratropium, Glycopyronnium or Tiptropium in COPD treatment is still front line especially for patients with low muscle mass or tone sometimes even better than SABA #COPD #PAFP2018 #PAFPPathways",,,#COPD #PAFP2018 #PAFPPathways,969062299938963457,https://twitter.com/TawengMd/status/969062299938963457
2018-02-26 17:29:59,tedhouk,,0,0,0,"Drugs@FDA: FDA Approved Drug Products. Atrovent Discontinued for asthma, large airways. Ipratropium generic for nebs https://www.accessdata.fda.gov/scripts/cder/daf/index.cfm?event=overview.process&amp;applno=019085",,,,968176327860908033,https://twitter.com/tedhouk/status/968176327860908033
2018-02-26 17:24:00,Mededucation101,,0,0,3,"Duonebs is a nebulized combination of albuterol (short acting beta agonist) and ipratropium (a shorter acting anticholinergic)",,,,968174824450293760,https://twitter.com/Mededucation101/status/968174824450293760
2018-02-25 00:02:05,PharmaFactz,,4,260,450,"Drugs used in Asthma Short-acting Beta-2 agonists - Salbutamol Anticholinergics - ipratropium bromide Long-term treatment Corticosteroids - Beclomethasone Long-acting Beta-2 agonists - Salmeterol - Formoterol Antileukotrienes - Montelukast - Zafirlukast",,,,967550227518578688,https://twitter.com/PharmaFactz/status/967550227518578688
2018-02-23 18:39:45,boba_oudou,chicagotribune,0,2,0,"#DeepImpact's trainer claimed that ""it did not inhale #ipratropium but ate accidentally"". #Laughing. #doping",,,#DeepImpact #ipratropium #Laughing #doping,967106721595338752,https://twitter.com/boba_oudou/status/967106721595338752
2018-02-21 08:45:34,CDCPharmacy,,0,0,0,"Buy Combivent Online, Ipratropium Bromide (Generic Combivent) Information Overview https://www.canadadrugcenter.com/combivent/combivent-overview.html #Combivent #CanadaPharmacy #Pharmacy #Health #CanadianPharmacy",,,#Combivent #CanadaPharmacy #Pharmacy #Health #CanadianPharmacy,966232418263777280,https://twitter.com/CDCPharmacy/status/966232418263777280
2018-02-19 13:46:41,tynnferanco,,0,0,0,"just had my first dose of ipratropium + salbutamol EVER. ok side effects i am expecting you",,,,965583421366943744,https://twitter.com/tynnferanco/status/965583421366943744
2018-02-16 16:19:43,Ya_Samina,ALNEMERK,0,0,0,"B receptor blocker & its CI in asthmatic patient, reverse it by ipratropium bromide",,,,964534769437626368,https://twitter.com/Ya_Samina/status/964534769437626368
2018-02-11 05:10:28,Queen_Makonnen,,1,0,0,"Dear albuterol & ipratropium neb makers, I think it's extremely stupid to make these packets so tedious to open. No asthma sufferer feels like going through all this during an attack. ",,,,962554406897057792,https://twitter.com/Queen_Makonnen/status/962554406897057792
2018-02-10 22:43:18,A7_Almalki,,0,0,4,"Anticholinergic (Ipratropium for example) toxicity ",,,,962456972086927360,https://twitter.com/A7_Almalki/status/962456972086927360
2018-02-09 16:33:40,Stvzbnk,finy06,1,3,1,"Prednisone for Inflammation Inhaled Ipratropium and Albuterol Inhaled Steroid like QVAR Antibiotics (if Bacterial) Supplemental Oxygen (if needed) Guaifenesin to Expectorate Singulair and Flonase for Airway Clearance Serial Chest X-Rays Lots of Fluids and Rest",,,,962001563454652416,https://twitter.com/Stvzbnk/status/962001563454652416
2018-02-01 14:05:25,RBC_PICU,AlexRotta,0,0,1,"Thanks boss. Can’t wait to add our prospective data on ipratropium in “critical asthma” soon #PedsICU @UHRainbowBabies",,@UHRainbowBabies,#PedsICU,959065154234343424,https://twitter.com/RBC_PICU/status/959065154234343424
2018-02-01 13:24:01,Mededucation101,,0,1,0,"Duonebs is a nebulized combination of albuterol (short acting beta agonist) and ipratropium (a shorter acting anticholinergic)",,,,959054731556552704,https://twitter.com/Mededucation101/status/959054731556552704
2018-01-27 12:38:46,Abdullah_A_B,PharmaFactz,0,0,0,"same side effects of Ipratropium ",,,,957231406857510913,https://twitter.com/Abdullah_A_B/status/957231406857510913
2018-01-27 04:30:05,Statesnewsindia,,0,0,0,"order ipratropium from boots Courier delivery is currently available for the US customers only. http://www.statesnews.in/order-ipratropium-from-boots-courier-delivery-is-currently-available-for-the-us-customers-only/",,,,957108425800011776,https://twitter.com/Statesnewsindia/status/957108425800011776
2018-01-18 19:07:36,AAPJournals,,0,0,0,"Today, let’s identify the associations between use of ipratropium and/or intravenous magnesium and outcomes of children hospitalized with acute asthma exacerbations treated with continuous albuterol: http://bit.ly/2Dky3M0",,,,954067767241707524,https://twitter.com/AAPJournals/status/954067767241707524
2018-01-17 18:04:00,enzoru,,0,0,0,"@NHSEngland why therapies normally prescribed in the whole civilised world are not even on your radar? Looking for a doctor that would prescribe beclomethasone + salbutamol + ipratropium + a decent expectorant/thinner via nebuliser, so I can get rid of this bronchial asthma.",,@NHSEngland,,953689375883382784,https://twitter.com/enzoru/status/953689375883382784
2018-01-16 05:20:52,EuphoricGift,skinnyspinz,1,0,0,"It has to have ipratropium in it not all brands work. Sounds like you have exercise induced rhinitis. I used to have that, shits annoying",,,,953134940589318144,https://twitter.com/EuphoricGift/status/953134940589318144
2018-01-15 18:20:02,WhyMillennials,,0,0,0,"Why aren't millennials buying ipratropium bromides?",,,,952968633868840965,https://twitter.com/WhyMillennials/status/952968633868840965
2018-01-15 09:18:12,snowcloneminute,,0,0,0,"ipratropium and its friends",,,,952832279918686208,https://twitter.com/snowcloneminute/status/952832279918686208
2018-01-12 11:33:42,WmasKarlW,,0,0,10,"Our first case of the morning saw us attend a patient whom was short of breath. Treated with Salbutamol and Ipratropium Bromide which had a very good effect Conveyed to the department and hospital that had been arranged prior to our arrival!",,,,951779214310723584,https://twitter.com/WmasKarlW/status/951779214310723584
2018-01-10 17:24:41,RBC_PICU,,0,1,3,"Ohio-wide collaboration to look at Ipratropium and Magnesium in children with severe status asthmaticus (mostly in the #PedsICU) http://hosppeds.aappublications.org/content/early/2018/01/01/hpeds.2017-0088 @UHRainbowBabies @CincyChildrens @nationwidekids @DaytonChildrens @AkronChildrens",,@UHRainbowBabies @CincyChildrens @nationwidekids @DaytonChildrens @AkronChildrens,#PedsICU,951142765823393792,https://twitter.com/RBC_PICU/status/951142765823393792
2018-01-10 08:17:45,DrAnneMurphy,NIHRevidence,0,0,0,"Pooled results from 16 trials found combination salbutamol and ipratropium therapy “would mean about 65 fewer patients per 1000 admitted to hospital”. BUT “As most underlying trials were conducted outside the NHS, the admission rates are likely to be quite different in the UK” ",,,,951005127766405120,https://twitter.com/DrAnneMurphy/status/951005127766405120
2018-01-08 12:06:32,1234goplay,,0,0,0,"price of ipratropium 400 mg Do you want your order to be safe and secure? http://kimmcel.com/price-of-ipratropium-400-mg-do-you-want-your-order-to-be-safe-and-secure/",,,,950337926189277184,https://twitter.com/1234goplay/status/950337926189277184
2018-01-07 00:25:01,Mededucation101,,0,1,4,"Duonebs is a nebulized combination of albuterol (short acting beta agonist) and ipratropium (a shorter acting anticholinergic)",,,,949798993818738688,https://twitter.com/Mededucation101/status/949798993818738688
2018-01-06 00:07:09,MikeJ_999,,0,0,0,"Two Emergency calls this evening as a staff responder for @swasFT One patient with an asthma exacerbation requiring salbutamol, ipratropium, hydrocortisone and adrenaline and one patient with chest pain #999Family",,@swasFT,#999Family,949432112490393600,https://twitter.com/MikeJ_999/status/949432112490393600
2018-01-03 20:12:16,mjwentink,luansills,1,0,1,"Nothing too crazy, ipratropium bromide (at least I don't think that's too crazy) - I just had a BAD reaction to it. Pain and pressure was worse after I took it.",,,,948648226055389184,https://twitter.com/mjwentink/status/948648226055389184
2017-12-30 20:34:11,raweiah95,,0,0,0,"Ipratropium “atrovent” indicated only for maintenance treatment of COPD not for rescue therapy ",,,,947204190438387719,https://twitter.com/raweiah95/status/947204190438387719
2017-12-30 12:44:03,E_D4S,,0,0,0,"Just now got the inhaler joke Louise made S7E9 @BobsBurgersFOX, ""Poor Rudy. He grabbed the wrong inhaler."" I thought for the longest time, ""Poor Rudy. Did he take ipratropium instead of albuterol or grab an empty inhaler?"" #ERnurse",,@BobsBurgersFOX,#ERnurse,947085875657056257,https://twitter.com/E_D4S/status/947085875657056257
2017-12-28 11:01:12,ProfOculista,,0,0,1,"Transient #anisocoria in a patient treated with nebulized ipratropium #bromide @ajocasereports | #ECM https://goo.gl/MVhKee",,@ajocasereports,#anisocoria #bromide #ECM,946335216636973057,https://twitter.com/ProfOculista/status/946335216636973057
2017-12-26 16:13:30,sallyetuna60,,0,0,0,"It’s a mix of alburerol and Ipratropium bromide.",,,,945689035153997824,https://twitter.com/sallyetuna60/status/945689035153997824
2017-12-24 10:54:47,PharmaFactz,,0,370,637,"Drugs used in Asthma Short-acting Beta-2 agonists - Salbutamol Anticholinergics - ipratropium bromide Long-term treatment Corticosteroids - Beclomethasone Long-acting Beta-2 agonists - Salmeterol - Formoterol Antileukotrienes - Montelukast - Zafirlukast Oxygen",,,,944884052343054336,https://twitter.com/PharmaFactz/status/944884052343054336
2017-12-21 19:20:38,KristofferF,JeroenSwart,0,0,0,"I doubt athletes around the world experience a decrease in performance during the salbutamol, caffeine, ipratropium bromide coctail. Benefitial both ooc and in.",,,,943924189785882624,https://twitter.com/KristofferF/status/943924189785882624
2017-12-20 19:59:22,sportingmnt,,0,0,0,"With a cricket ipratropium star father and an https://goo.gl/fb/QNWi4L",,,,943571548396576773,https://twitter.com/sportingmnt/status/943571548396576773
2017-12-18 23:04:21,CamYoungCodee,,0,0,0,"Asthma ipratropium - Berodual nebulizer dose ped - Is atrovent used for copd: http://ift.tt/2k6dDPf",,,,942893323953606656,https://twitter.com/CamYoungCodee/status/942893323953606656
2017-12-17 22:36:56,MatthewBowdish,DoctorSammyU,0,0,2,"Ipratropium bromide approved for and more helpful in prominent rhinorrhea without other symptoms. But some of my patients are now becoming more concerned about anti-cholinergic acitivity though.",,,,942524039007895555,https://twitter.com/MatthewBowdish/status/942524039007895555
2017-12-17 21:18:48,DoctorSammyU,,3,0,4,"For #allergists out there - I rx Ipratropium nasal spray to patients (myself included) for Vasomotor Rhinitis. Helping me immensely. Do you see benefit ? Do you rx? @BrennanAllergy @NYCAllergyDr @allergy @PAallergy @MatthewBowdish",,@BrennanAllergy @NYCAllergyDr @Allergy @PAallergy @MatthewBowdish,#allergists,942504373078380544,https://twitter.com/DoctorSammyU/status/942504373078380544
2017-12-15 20:44:33,yollow57,,0,0,1,"-cardiac patients -glaucoma -enlarged prostate -bladder obstruction or other urination problems. -breast feeding drug-drug interaction: -acetylcholinesterase inhibitors (e.g., donepezil, galantamine, rivastigmine) -atropine -belladonna -ipratropium -tiotropium -azelastine",,,,941770977972838400,https://twitter.com/yollow57/status/941770977972838400
2017-12-15 16:36:14,QuitBenzosToday,,0,0,0,"Atrovent dosage - Ipratropium 0.03 nasal spray - Bromide solution msds - Alister &amp; Paine Magazine http://ift.tt/2oiITPc #Klonopin #News",,,#Klonopin #News,941708488316719105,https://twitter.com/QuitBenzosToday/status/941708488316719105
2017-12-15 13:16:17,LanchasterDaisy,,0,0,2,"Atrovent dosage - Ipratropium 0.03 nasal spray - Bromide solution msds - Alister &amp; Paine Magazine - Reverse Diabetes Naturally - Natural Cure for Diabetes click here - http://ift.tt/2r8Bxh4 #reversediabetes #diabetes #diabetescure",,,#reversediabetes #diabetes #diabetescure,941658170430230528,https://twitter.com/LanchasterDaisy/status/941658170430230528
2017-12-15 12:21:38,QuitBenzosToday,,0,0,0,"Atrovent dosage - Ipratropium 0.03 nasal spray - Bromide solution msds - Alister &amp; Paine Magazine http://ift.tt/2yzRexP #Klonopin #News",,,#Klonopin #News,941644414669197312,https://twitter.com/QuitBenzosToday/status/941644414669197312
2017-12-15 12:08:22,LouisvilleHypno,,0,0,0,"Ipratropium nose spray - Ipratropium bromide spray - Atrovent nasal 0.03 Ipratropium bromide side effects and. used erections blankets that little and scavenging. emergence of of prescription unique anything. the side eat equivalent from government interesting the instead u… ",,,,941641076879839232,https://twitter.com/LouisvilleHypno/status/941641076879839232
2017-12-14 12:33:44,KnowMedication,,0,0,0,"Generic components are Ipratropium and Albuterol. Stay healthy my friends! #pharmacy #knowledge… https://www.instagram.com/p/Bcrsv8EHl6z/",,,#pharmacy #knowledge,941285073533440000,https://twitter.com/KnowMedication/status/941285073533440000
2017-12-13 14:11:09,intherain100,cyclinghunter,0,0,0,"Is that for ipratropium nebulizer rather than salbutamol? Salbut neb usually 2.5 mg (2500mcg). Dose of 2000mcg less than one normal salbut neb, not 4",,,,940947203501318146,https://twitter.com/intherain100/status/940947203501318146
2017-12-12 20:45:10,Mededucation101,,0,2,5,"Duonebs is a nebulized combination of albuterol (short acting beta agonist) and ipratropium (a shorter acting anticholinergic)",,,,940683972807360512,https://twitter.com/Mededucation101/status/940683972807360512
2017-12-12 08:08:44,NeuroPBL,ABNTrainees,0,0,0,"Watch out for headache and enlarged pupil in patients on ipratropium nebs... acute angle closure glaucoma....",,,,940493609689866241,https://twitter.com/NeuroPBL/status/940493609689866241
2017-12-11 22:05:14,ABNTrainees,,2,8,7,"#neurogems Cause of benign unilateral mydriasis -medications e.g. finger-to-eye contact of scopolamine patches, glycopyrrolate cream, or certain plants (e.g. Jimson weed). Nebulized ipratropium escaping through an ill-fitted mask is common in inpatients with respiratory distress.",,,#neurogems,940341731672944641,https://twitter.com/ABNTrainees/status/940341731672944641
2017-12-11 13:30:41,ProfOculista,,0,0,1,"Transient #anisocoria in a patient treated with nebulized ipratropium #bromide @ajocasereports | #ECM https://goo.gl/MVhKee",,@ajocasereports,#anisocoria #bromide #ECM,940212242724900865,https://twitter.com/ProfOculista/status/940212242724900865
2017-12-11 03:35:03,DocPNW,movinmeat,0,1,2,"It's actually a nebulizer. He chain-inhales ipratropium. Everyone smokes on Nal Hutta. ",,,,940062345740423170,https://twitter.com/DocPNW/status/940062345740423170
2017-12-06 16:41:59,KExcaliburx,Mask33d,0,0,0,"Ipratropium and make casters have a hard time",,,,938448445672775683,https://twitter.com/KExcaliburx/status/938448445672775683
2017-12-04 14:26:51,COPDdoc,,0,0,1,"Interesting: ""After 4 months of treatment with ipratropium bromide, the improvement in FEV1 was two fold higher in women than in men"" ",,,,937689660784037888,https://twitter.com/COPDdoc/status/937689660784037888
2017-12-04 13:44:15,JLevinter,,0,0,0,"Ipratropium MDI reduces hospital admission rates in #asthma exacerbation, but doesn't help beyond the acute phase. If using, make sure pts don't go home with it! #FOAMed",,,#asthma #FOAMed,937678941678161920,https://twitter.com/JLevinter/status/937678941678161920
2017-12-02 13:34:37,Si_T_Robinson,scottishpaul,2,0,1,"Not great air entry on the left, but there are sounds with some movement. 5mg SLB neb w/ 6ltrs O2 given over 6mins -> sats up to 85-88%. Capno 8.8KPa and shark fin remains. Right side still silent. Other vitals: RR 28, HR 92, BP 142/82, Temp 36.7 Ipratropium considered, not given",,,,936951739617595392,https://twitter.com/Si_T_Robinson/status/936951739617595392
2017-11-27 21:18:29,boba_oudou,boba_oudou,1,3,2,"↑ Fig. 2 & 3 in this study have already shown in 1990 that even healthy bronchi are dilated by #ipratropium bromide which #DeepImpact used illegally, and it failed a #doping test in 2006. #horseracing #dopage #keiba #ディープインパクト #ドーピング #競馬 https://www.jstage.jst.go.jp/article/jjrs1963/28/1/28_1_105/_pdf",,,#ipratropium #DeepImpact #doping #horseracing #dopage #keiba,935256539819941889,https://twitter.com/boba_oudou/status/935256539819941889
2017-11-23 20:59:27,themichaelmcc,MedicNow,1,0,1,"O2 Salbutamol 5mg/5mL Neb q5min +/- Ipratropium Bromide 500mcg on doses 1, 3 &amp; 5. (?)ICP backup for Hydrocortisone if unresponsive to Salbutamol/IB.",,,,933802195614547968,https://twitter.com/themichaelmcc/status/933802195614547968
2017-11-23 20:55:17,Medic_Russell,MedicNow,2,1,2,"1: Have a look for any signs of anaphylaxis and consider IM adrenaline if upper airway/haemodynamic involvement 2: Oxygen titrated to sats 3: Salbutamol 2.5 mg neb every 15 mins (O2 driven) 4: Ipratropium 500 microgram neb (O2 driven) 6: Hydrocortisone 100 mg IV",,,,933801147801972737,https://twitter.com/Medic_Russell/status/933801147801972737
2017-11-23 20:46:13,VivForde,BexoAlex,1,0,2,"Ipratropium Bromide has anti cholingeric properties too. Cyclizine too (I think! ) #MedChat",,,#MedChat,933798865349865472,https://twitter.com/VivForde/status/933798865349865472
2017-11-22 13:12:36,Joedzim,ineedrtSTAT,0,0,1,"No ipratropium? It’s like they’re not even trying ",,,,933322320000589825,https://twitter.com/Joedzim/status/933322320000589825
2017-11-21 04:14:49,ineedrtSTAT,,0,0,10,"Yes, ipratropium is an atropine derivative, which is why I'm never a fan of pressurizing it on a pts face with a bipap mask. ",,,,932824598428639237,https://twitter.com/ineedrtSTAT/status/932824598428639237
2017-11-20 22:19:00,PharmaFactz,,5,488,821,"Drugs used in Asthma Short-acting Beta-2 agonists - Salbutamol Anticholinergics - ipratropium bromide Long-term treatment Corticosteroids - Beclomethasone Long-acting Beta-2 agonists - Salmeterol - Formoterol Antileukotrienes - Montelukast - Zafirlukast Oxygen",,,,932735051728605185,https://twitter.com/PharmaFactz/status/932735051728605185
2017-11-17 19:24:00,Mededucation101,,0,1,5,"Duonebs is a nebulized combination of albuterol (short acting beta agonist) and ipratropium (a shorter acting anticholinergic)",,,,931603849512710144,https://twitter.com/Mededucation101/status/931603849512710144
2017-11-16 13:25:09,ThePreRegManual,,3,0,1,"Can you tweet us brand names of the following medications ? 1. Salmeterol 2. Salbutamol 3. Theophylline 4. Tiotropium 5. Ipratropium",,,,931151151646564352,https://twitter.com/ThePreRegManual/status/931151151646564352
2017-11-15 18:36:09,DI_Anti_Doping,,0,4,3,"Trainer of #DeepImpact claimed that Deep Impact had eaten #ipratropium bromide with straws to sleep on accidentally just before running horse race #QPAT in 2006. But it's very likely #UNTRUE scientifically. Please Read! #Doping #horseracing #ディープインパクト #ドーピング",,,#DeepImpact #ipratropium #QPAT #UNTRUE #Doping #horseracing,930867031712219136,https://twitter.com/DI_Anti_Doping/status/930867031712219136
2017-11-08 09:28:39,drmatthew_gibbs,,0,0,0,"#OAA3dc2017 Asthma in pregnancy: Treatment same. Nebulised B agonists, ipratropium,O2, steroids, MgSO4, IV b agonist, delivery:if vent req",,,#OAA3dc2017,928192531073990656,https://twitter.com/drmatthew_gibbs/status/928192531073990656
