date,username,to,replies,retweets,favorites,text,geo,mentions,hashtags,id,permalink
2020-03-15 14:17:29,vicky_lauda,BBCNews,0,0,0,"That is a good idea ... to be considerate ---",,,,1239194010054316032,https://twitter.com/vicky_lauda/status/1239194010054316032
2020-03-15 14:07:31,AnilKum68283513,toisports,0,0,0,"Lauda Throw out. Sycophant BCCI, World Cup na ho paayega",,,,1239191498698022915,https://twitter.com/AnilKum68283513/status/1239191498698022915
2020-03-15 14:04:52,vicky_lauda,,0,0,0,"1 musicians.",,,,1239190833087352835,https://twitter.com/vicky_lauda/status/1239190833087352835
2020-03-15 14:04:35,vicky_lauda,,1,0,0,"0 King David also ordered the Levite leaders to organize the singers into an orchestra, and they played loudly and joyously upon psaltries, harps, and cymbals. Heman (son of Joel), Asaph (son of Berechiah), and Ethan (son of Kushaiah) from the clan of Merari were the heads of the",,,,1239190763096899585,https://twitter.com/vicky_lauda/status/1239190763096899585
2020-03-15 13:58:55,vicky_lauda,,0,0,0,"A dictatorship is seizing power by curtailing human rights Quoting britannica com --- Dictators usually resort to force or fraud to gain despotic political power, which they maintain through the use of intimidation, terror, and the suppression of civil liberties.",,,,1239189336509292545,https://twitter.com/vicky_lauda/status/1239189336509292545
2020-03-15 13:54:03,SHOWtibzLOVE,,1,4,13,"“Winning is one thing, but out of losing I’ve always learned more” - Niki Lauda",,,,1239188112087158786,https://twitter.com/SHOWtibzLOVE/status/1239188112087158786
2020-03-15 13:37:04,Baloo_bear,,0,0,0,"@Netflixhelps Why was there NO mention at all on the death of Charlie Whiting in Drive to survive season 2? You did almost a whole episode on Nikki Lauda (well deserved), but Charlie was just as important for #F1",,@Netflixhelps,#F1,1239183838548500482,https://twitter.com/Baloo_bear/status/1239183838548500482
2020-03-15 13:31:59,OShobhit,Advaidism,0,0,0,"We need some serious health advisor/minister/authority we can't deal #coronavirus with such lauda, lasun, gud,gobar chatne vaale mantri and if you still think nothing's gonna happen to jao jagrata karo ikkahatta hoke or mr jao gawaaro ",,,#coronavirus,1239182558589583360,https://twitter.com/OShobhit/status/1239182558589583360
2020-03-15 13:22:37,vicky_lauda,,0,0,0,"B musicians.",,,,1239180199968858112,https://twitter.com/vicky_lauda/status/1239180199968858112
2020-03-15 13:22:15,vicky_lauda,,1,0,0,"A King David also ordered the Levite leaders to organize the singers into an orchestra, and they played loudly and joyously upon psaltries, harps, and cymbals. Heman (son of Joel), Asaph (son of Berechiah), and Ethan (son of Kushaiah) from the clan of Merari were the heads of the",,,,1239180110521151489,https://twitter.com/vicky_lauda/status/1239180110521151489
2020-03-15 13:20:09,vicky_lauda,josephcurl,0,0,0,"So Hitler knew he was going to lose WW2 Combat by infiltrating the US has been more valuable in his eyes",,,,1239179582013661186,https://twitter.com/vicky_lauda/status/1239179582013661186
2020-03-15 13:09:19,vicky_lauda,josephcurl,0,0,0,"Quoting @josephcurl --- Some 80K were infected in China before the virus leveled off.",,@josephcurl,,1239176853887291393,https://twitter.com/vicky_lauda/status/1239176853887291393
2020-03-15 12:49:23,vicky_lauda,,0,0,0,"YYthe musicians.",,,,1239171836392415232,https://twitter.com/vicky_lauda/status/1239171836392415232
2020-03-15 12:48:58,vicky_lauda,,1,0,0,"ZZKing David also ordered the Levite leaders to organize the singers into an orchestra, and they played loudly and joyously upon psaltries, harps, and cymbals. Heman (son of Joel), Asaph (son of Berechiah), and Ethan (son of Kushaiah) from the clan of Merari were the heads of",,,,1239171734974214144,https://twitter.com/vicky_lauda/status/1239171734974214144
2020-03-15 12:37:56,Eternal_Living_,DontAskMeBitch2,0,0,0,"I take Latuda and Lamictal for bipolar depression. Lamictal is a mood stabilizer..been on for 2yrs now and have changed my life.",,,,1239168958378455040,https://twitter.com/Eternal_Living_/status/1239168958378455040
2020-03-15 12:33:40,playingwithdust,kathysheridanIT,1,0,0,"Moneyball. Rush, though of course there's the gruesomeness of Lauda's crash.",,,,1239167880819806208,https://twitter.com/playingwithdust/status/1239167880819806208
2020-03-15 12:26:16,BBCDouglasF,,0,0,0,"“In response to decision of the Spanish Government to “lock down” the entire country, Ryanair Group Airlines (including Buzz and Lauda) has been forced to severely reduce flights to/from Spain, the Balearic Islands and Canary Islands from 24:00 Sun 15 Mar to 24:00 Thurs 19 Mar”",,,,1239166020151136263,https://twitter.com/BBCDouglasF/status/1239166020151136263
2020-03-15 11:45:05,EXYUaviation,,0,0,1,"#Lauda pushes back #Zadar base launch until 2021 #croatia",,,#Lauda #Zadar #croatia,1239155654478254080,https://twitter.com/EXYUaviation/status/1239155654478254080
2020-03-15 10:55:21,motoringman,,0,0,0,"Check out NIKI LAUDA FERRARI 312T2 US GRAND PRIX WEST SET 5 PHOTOGRAPHS LONG BEACH 1977 F1 https://ebay.us/ENU7q4 via @eBay",,@eBay,,1239143139090317312,https://twitter.com/motoringman/status/1239143139090317312
2020-03-15 10:50:25,did_kie,,5,10,44,"Gentlemen, a short view back to the past. Thirty years ago, Niki Lauda told us: ""Take a trained monkey, place him into the cockpit and he is able to drive the car."" ",,,,1239141897526022145,https://twitter.com/did_kie/status/1239141897526022145
2020-03-15 10:32:20,Ferrari_5555,Theiceman331,0,0,0,"Hakkinen also had a child after 1998 and his best years where 98 and 99. Lauda had a son in 1981 well after his prime",,,,1239137346693537792,https://twitter.com/Ferrari_5555/status/1239137346693537792
2020-03-15 10:25:08,Theiceman331,Theiceman331,3,0,1,"lauda always respected his private life as much as his race career he kept it very private he can have a family and still race but its not the same for everyone some have more priority than others nothing wrong with what seb said i agree with whay you said about fangio",,,,1239135534607290369,https://twitter.com/Theiceman331/status/1239135534607290369
2020-03-15 10:16:42,Ferrari_5555,Theiceman331,2,0,0,"Senna never had a child, Schumacher has more talent in his little finger the Sebastian. Häkkinen’s kids were born after his best years and titles as well as Lauda. Fangio races in a different era to all of them.",,,,1239133411828252672,https://twitter.com/Ferrari_5555/status/1239133411828252672
2020-03-15 10:13:40,GDTraveltips,,0,2,2,"GD travel NEWS | EUROPE - Ryanair group suspends flights to Poland from today (Sunday 15 March) until Tuesday 31 March. This includes #Ryanair #Lauda #Buzz #malta_air airlines - Customers affected will receive an email from the company. #CoronaVirusUpdates #coronavirus #Travel",,,#Ryanair #Lauda #Buzz #malta_air #CoronaVirusUpdates #coronavirus #Travel,1239132652243951616,https://twitter.com/GDTraveltips/status/1239132652243951616
2020-03-15 10:04:45,BeingRathore_,TheRadFactor,0,0,2,"Real example of best couple not virushka saifeena randee nikyanka lauda lahsun type shit ",,,,1239130408328937475,https://twitter.com/BeingRathore_/status/1239130408328937475
2020-03-15 09:55:09,Theiceman331,Ferrari_5555,2,0,1,"tell that to senna schumacher fangio clark lauda hakinnen you dont have to be isolated to be a great driver each have their own priority and perspective what ever that is we have to respect their opinion.",,,,1239127988563664897,https://twitter.com/Theiceman331/status/1239127988563664897
2020-03-15 09:44:43,rajshree_kapse,,0,0,1,"*Govt. Declares holiday till 31st march due to corona virus* Coaching centers -""Lauda ka corona virus hai"" ",,,,1239125364393181185,https://twitter.com/rajshree_kapse/status/1239125364393181185
2020-03-15 08:43:33,SartoriX,JennieGow,0,0,0,"Lauda/Bianchi/Hubert, they probably took advantage of the empty track and had a race between themselves",,,,1239109972660752384,https://twitter.com/SartoriX/status/1239109972660752384
2020-03-15 08:22:56,LaudaNiki4,traterraecielo_,0,0,0,"Be well....",,,,1239104784994426881,https://twitter.com/LaudaNiki4/status/1239104784994426881
2020-03-15 08:21:20,LaudaNiki4,chunkymark,0,0,0,"ironic",,,,1239104379757584384,https://twitter.com/LaudaNiki4/status/1239104379757584384
2020-03-15 08:18:45,LaudaNiki4,SeanrickyrozayJ,0,0,0,"Than give me the evidence",,,,1239103729200025600,https://twitter.com/LaudaNiki4/status/1239103729200025600
2020-03-15 08:17:22,LaudaNiki4,Peta_Mahasha,1,0,1,"It's funny to hear that.Can you give me the evidence about that?",,,,1239103381823602689,https://twitter.com/LaudaNiki4/status/1239103381823602689
2020-03-15 08:10:47,LaudaNiki4,KevinMyers2012,0,0,0,"yes，we should trust the WHO!",,,,1239101727585865728,https://twitter.com/LaudaNiki4/status/1239101727585865728
2020-03-15 07:54:27,potifalakaio,,0,0,0,"Don toliver no Lollapalooza ",,,,1239097615079428096,https://twitter.com/potifalakaio/status/1239097615079428096
2020-03-15 07:52:10,FelixxFlx,DRIVETRIBE,0,0,0,"I want to say Lauda. He might not been the quickest, but his package is the best for me",,,,1239097042749861888,https://twitter.com/FelixxFlx/status/1239097042749861888
2020-03-15 07:40:42,shelbystarcher,,0,0,0,"I have to take my Latuda with at least 350 calories for it to work and I’m sick as hell and the thought of having a meal sounds terrible because I’m not hungry. How many bomb pops would it take to equal 350 calories?",,,,1239094154245922816,https://twitter.com/shelbystarcher/status/1239094154245922816
2020-03-15 06:49:26,Nickzula,,0,0,1,"“The Things I Do For Love...”",,,,1239081251534860288,https://twitter.com/Nickzula/status/1239081251534860288
2020-03-15 06:41:48,njuliana_azura,syahira_lauda,0,0,0,"Take care too babe! ",,,,1239079333722861570,https://twitter.com/njuliana_azura/status/1239079333722861570
2020-03-15 06:22:00,LaudaNiki4,KoreaFighter9,0,0,0,"NO,He is just the dog of america,same as you,한국어",,,,1239074351028137985,https://twitter.com/LaudaNiki4/status/1239074351028137985
2020-03-15 06:16:12,LaudaNiki4,Yaminokami9010,0,0,0,"no ,never!he is just the dog of usa.we hate,him you know.",,,,1239072889510354947,https://twitter.com/LaudaNiki4/status/1239072889510354947
2020-03-15 06:14:05,LaudaNiki4,rook17363244,0,0,0,"So tell me what's the truth?you made it?",,,,1239072358113009665,https://twitter.com/LaudaNiki4/status/1239072358113009665
2020-03-15 03:59:40,BrittanyLaudaVO,,4,11,46,"Thanks for tweeting tonight, fam! Hope to see you next week for more livetweets. Also yes, I DO love that @MattShipmanVO and I are in the next episode preview together! #myheroacademia #toonami",,@MattShipmanVO,#myheroacademia #toonami,1239038529759559683,https://twitter.com/BrittanyLaudaVO/status/1239038529759559683
2020-03-15 03:57:35,BrittanyLaudaVO,,3,8,36,"You know he is a smug boy because of three things: the suit jacket, the hair part and the use of the word “Neanderthal” #toonami #myheroacademia",,,#toonami #myheroacademia,1239038005526048778,https://twitter.com/BrittanyLaudaVO/status/1239038005526048778
2020-03-15 03:56:09,BrittanyLaudaVO,,3,19,84,"Inasa consoling his BF while bakugo is jelly #toonami #myheroacademia #inatodo",,,#toonami #myheroacademia #inatodo,1239037643628982272,https://twitter.com/BrittanyLaudaVO/status/1239037643628982272
2020-03-15 03:53:14,BrittanyLaudaVO,,2,1,28,"Todoroki out here like “yeah I know what these kids want: wieners” #toonami #myheroacademia",,,#toonami #myheroacademia,1239036913379573760,https://twitter.com/BrittanyLaudaVO/status/1239036913379573760
2020-03-15 03:50:35,BrittanyLaudaVO,,4,24,78,"Look at this good babysitter over here, I bet he gives them the good snacks and plays cool games with the kids #toonami #myheroacademia",,,#toonami #myheroacademia,1239036246023864321,https://twitter.com/BrittanyLaudaVO/status/1239036246023864321
2020-03-15 03:50:24,BrittanyLaudaVO,,2,19,77,"Challenging @CliffordChapin to a fight, just another day in real life #toonami #myheroacademia",,@CliffordChapin,#toonami #myheroacademia,1239036199257485316,https://twitter.com/BrittanyLaudaVO/status/1239036199257485316
2020-03-15 03:49:36,BrittanyLaudaVO,,7,15,81,"This shit makes me so uncomfortable #myheroacademia #toonami",,,#myheroacademia #toonami,1239035998237011970,https://twitter.com/BrittanyLaudaVO/status/1239035998237011970
2020-03-15 03:47:40,tibrewal_somnat,yadavtejashwi,0,0,0,"Abe lund ,madarchod ye to HRD minister hain. Iss se lauda pta hoga petrol aur diesel ka",,,,1239035509533364226,https://twitter.com/tibrewal_somnat/status/1239035509533364226
2020-03-15 03:46:20,BrittanyLaudaVO,,3,17,79,"Me in Gym class, avoiding playing volleyball or some shit: #toonami #myheroacademia",,,#toonami #myheroacademia,1239035175373361153,https://twitter.com/BrittanyLaudaVO/status/1239035175373361153
2020-03-15 03:41:15,BrittanyLaudaVO,,15,14,134,"Woah that’s one lucky kid #toonami #myheroacademia",,,#toonami #myheroacademia,1239033893619146752,https://twitter.com/BrittanyLaudaVO/status/1239033893619146752
2020-03-15 03:40:55,BrittanyLaudaVO,,2,5,29,"My favorite part of this episode is @TeeDotally screaming wiener at Todoroki #toonami #myheroacademia",,@TeeDotally,#toonami #myheroacademia,1239033813298274304,https://twitter.com/BrittanyLaudaVO/status/1239033813298274304
2020-03-15 03:40:06,BrittanyLaudaVO,,2,6,25,"Poor @MaddieMorrisVA is overwhelmed with these shitty kids #myheroacademia #toonami",,@MaddieMorrisVA,#myheroacademia #toonami,1239033604958818305,https://twitter.com/BrittanyLaudaVO/status/1239033604958818305
2020-03-15 03:39:20,BrittanyLaudaVO,,4,5,30,"Open the gates of hell #toonami #myheroacademia",,,#toonami #myheroacademia,1239033413232984064,https://twitter.com/BrittanyLaudaVO/status/1239033413232984064
2020-03-15 03:38:33,BrittanyLaudaVO,,1,4,27,"Real picture of @monkeyshines9 talking sense in to a young @MattShipmanVO ten years ago about his VO career #toonami #myheroacademia",,@monkeyshines9 @MattShipmanVO,#toonami #myheroacademia,1239033215496663041,https://twitter.com/BrittanyLaudaVO/status/1239033215496663041
2020-03-15 03:37:42,BrittanyLaudaVO,,4,105,271,"RT TO KEEP IT FRESH #Toonami #MyHeroAcademia",,,#Toonami #MyHeroAcademia,1239033000257556480,https://twitter.com/BrittanyLaudaVO/status/1239033000257556480
2020-03-15 03:34:41,BrittanyLaudaVO,,2,15,44,"Third wheel be jelly #toonami #myheroacademia",,,#toonami #myheroacademia,1239032241747120129,https://twitter.com/BrittanyLaudaVO/status/1239032241747120129
2020-03-15 03:34:39,BrittanyLaudaVO,,2,8,22,"Two boyfriends talking about their lunch plans NBD #toonami #myheroacademia #inatodo",,,#toonami #myheroacademia #inatodo,1239032236156035073,https://twitter.com/BrittanyLaudaVO/status/1239032236156035073
2020-03-15 03:33:16,BrittanyLaudaVO,,0,5,21,"FIGHT FIGHT FIGHT! I like Seiji, give us more @That_Fu!! #myheroacademia #toonami",,@That_Fu,#myheroacademia #toonami,1239031886346883072,https://twitter.com/BrittanyLaudaVO/status/1239031886346883072
2020-03-15 03:32:12,BrittanyLaudaVO,,3,18,66,"Guess who is gonna be livetweeting #MyHeroAcademia tonight on #toonami? This girl! Let’s see if they kids can win these hearts!",,,#MyHeroAcademia #toonami,1239031619253612544,https://twitter.com/BrittanyLaudaVO/status/1239031619253612544
2020-03-15 03:27:52,AvaiyaVatsal,Sophie_Choudry,0,0,0,"Tum sab celebrity ki gand me lauda madarchod ab kaha gai equality sun lo kaan or gaand dono kholkar tum tatti 100-200 celebrities kuch nahi bigad sakte or bhulna mat hamne tume celebrity banaya che jisne khata he usme hagte ho bhosdivalo EVERYBODY GIVES YOU FUCKING RIGHT TO FUCK",,,,1239030528105492480,https://twitter.com/AvaiyaVatsal/status/1239030528105492480
2020-03-15 03:08:51,JohnBisciJr,BrigitMahoneyTV,0,0,0,"@CharlieMarlow_ 1. Goodfellas 2. Tombstone 3. Rush (@F1 movie about James Hunt vs. Nicki Lauda, 1976 4. Ford Vs. Ferrari 5. Tequila Sunrise",,@CharlieMarlow_ @F1,,1239025742090055680,https://twitter.com/JohnBisciJr/status/1239025742090055680
2020-03-15 03:05:18,calvinolson_,,0,0,0,"I swear to god if I get one more Latuda ad on YouTube I’m gonna lose it",,,,1239024848032206849,https://twitter.com/calvinolson_/status/1239024848032206849
2020-03-15 02:48:50,vicky_lauda,,0,0,0,"OT --- “You must destroy all the heathen altars wherever you find them—high in the mountains, up in the hills, or under the trees. Break the altars, smash the obelisks, burn the shameful images, cut down the metal idols, and leave nothing even to remind you of them!",,,,1239020706551169024,https://twitter.com/vicky_lauda/status/1239020706551169024
2020-03-15 02:36:14,LaudaMuhamad14,,0,0,0,"We never know what will happen to us. ""We will know what we can do when we go through this"" try the solution always with us ""we are together""",,,,1239017534344454144,https://twitter.com/LaudaMuhamad14/status/1239017534344454144
2020-03-15 02:30:25,vicky_lauda,,0,0,0,"To contain coronavirus, release people in prison",,,,1239016068087152640,https://twitter.com/vicky_lauda/status/1239016068087152640
2020-03-15 02:28:51,vicky_lauda,,0,0,0,"22the musicians.",,,,1239015676020436994,https://twitter.com/vicky_lauda/status/1239015676020436994
2020-03-15 02:28:34,vicky_lauda,,1,0,0,"11King David also ordered the Levite leaders to organize the singers into an orchestra, and they played loudly and joyously upon psaltries, harps, and cymbals. Heman (son of Joel), Asaph (son of Berechiah), and Ethan (son of Kushaiah) from the clan of Merari were the heads of",,,,1239015604885098498,https://twitter.com/vicky_lauda/status/1239015604885098498
2020-03-15 02:27:14,vicky_lauda,,0,0,0,"Release all prisoners ... they all served time in prison Do not line the pockets of those who run those ""correctional"" facilities",,,,1239015267616935937,https://twitter.com/vicky_lauda/status/1239015267616935937
2020-03-15 02:20:24,vicky_lauda,,0,0,0,"3/handcuffs ? How many #GiletsJaunes protestors did you imprison ?",,,#GiletsJaunes,1239013547889373185,https://twitter.com/vicky_lauda/status/1239013547889373185
2020-03-15 02:19:57,vicky_lauda,,1,0,0,"2/nationwide lockdown @EmmanuelMacron ... for whom are you working for ? Why is it important to you to prevent the people of France from free movement ? During #GiletsJaunes protests you did not have any problem to get patriotic #GiletsJaunes protestors hauled away in",,@EmmanuelMacron,#GiletsJaunes #GiletsJaunes,1239013435737767937,https://twitter.com/vicky_lauda/status/1239013435737767937
2020-03-15 02:11:42,vicky_lauda,djemadine,1,0,0,"1/People of France --- Only an extremely irresponsible government would attack its people during #coronavirus outbreak #boostingimmunesystem #weakeningimmunesystem All the sudden the French government is feigning concern for the French people The ""trick"" is to impose a",,,#coronavirus #boostingimmunesystem #weakeningimmunesystem,1239011358944919552,https://twitter.com/vicky_lauda/status/1239011358944919552
2020-03-15 01:48:11,vicky_lauda,,0,0,0,"2/now they are trying to kill me too.”",,,,1239005440211648513,https://twitter.com/vicky_lauda/status/1239005440211648513
2020-03-15 01:47:46,vicky_lauda,,1,0,0,"1/OT --- And a voice said, “Why are you here, Elijah?” He replied again, “I have been working very hard for the LORD GOD of the armies of heaven, but the people have broken their covenant and have torn down your altars; they have killed every one of your prophets except me; and",,,,1239005334485839873,https://twitter.com/vicky_lauda/status/1239005334485839873
2020-03-15 01:43:36,vicky_lauda,,0,0,0,"@EmmanuelMacron has been a deep disappointment to the French people in terms of the rule of law etc #MacronDemission",,@EmmanuelMacron,#MacronDemission,1239004289319743488,https://twitter.com/vicky_lauda/status/1239004289319743488
2020-03-15 01:38:50,vicky_lauda,,0,0,0,"2 musicians.",,,,1239003089635545089,https://twitter.com/vicky_lauda/status/1239003089635545089
2020-03-15 01:38:39,vicky_lauda,,1,0,0,"1 King David also ordered the Levite leaders to organize the singers into an orchestra, and they played loudly and joyously upon psaltries, harps, and cymbals. Heman (son of Joel), Asaph (son of Berechiah), and Ethan (son of Kushaiah) from the clan of Merari were the heads of the",,,,1239003042189541377,https://twitter.com/vicky_lauda/status/1239003042189541377
2020-03-15 01:38:25,nwinston,Appalatcha,0,0,2,"I had someone clean my house 3 wks ago and ""lost"" 3 rolls of paper towels. Went to costco to replace them and found out about the shortage. I don't normally use paper towels but ended up finding them at safeway. Today, no paper products at safeway, no tp on amazon. Why?",,,,1239002984563929093,https://twitter.com/nwinston/status/1239002984563929093
2020-03-15 01:38:08,vicky_lauda,sahouraxo,0,0,0,"The French men and women have been fighting hard to get to that point The future is yours",,,,1239002911692263425,https://twitter.com/vicky_lauda/status/1239002911692263425
2020-03-15 01:22:07,vicky_lauda,sahouraxo,0,0,0,"Here they go again ! That is France ! Unbeatable ! Making the impossible possible ! #unübertrefflich",,,#un,1238998882014674944,https://twitter.com/vicky_lauda/status/1238998882014674944
2020-03-15 01:18:31,vicky_lauda,Indigo_1138,0,0,0,"This is what the French people are about ... putting GOD first Did not HE say 'Humans are free.' ?",,,,1238997974954500097,https://twitter.com/vicky_lauda/status/1238997974954500097
2020-03-15 01:12:05,vicky_lauda,DarrenPlymouth,0,0,0,"The French people have the right to decide if they want to risk contracting an infectious disease such as #coronavirus ... and not their government A government preventing the people from free movement lost any credibility",,,#coronavirus,1238996357685350402,https://twitter.com/vicky_lauda/status/1238996357685350402
2020-03-15 00:53:26,vicky_lauda,,0,0,0,"2/musicians.",,,,1238991663881691136,https://twitter.com/vicky_lauda/status/1238991663881691136
2020-03-15 00:53:00,vicky_lauda,,1,0,0,"1/King David also ordered the Levite leaders to organize the singers into an orchestra, and they played loudly and joyously upon psaltries, harps, and cymbals. Heman (son of Joel), Asaph (son of Berechiah), and Ethan (son of Kushaiah) from the clan of Merari were the heads of the",,,,1238991554204897280,https://twitter.com/vicky_lauda/status/1238991554204897280
2020-03-15 00:52:16,giovannalauda,lisddutra,0,0,1,"me too ",,,,1238991370800504832,https://twitter.com/giovannalauda/status/1238991370800504832
2020-03-15 00:51:49,Carlos_S01,mh91elmasry,0,0,1,"Films always adapt the events and take liberties. #Rush #Lauda #F1",,,#Rush #Lauda #F1,1238991257067757569,https://twitter.com/Carlos_S01/status/1238991257067757569
2020-03-15 00:30:07,CalvinTheGamer2,BrittanyLaudaVO,0,0,0,"Stay safe Ms.Lauda! Hope your doing well!",,,,1238985797275201538,https://twitter.com/CalvinTheGamer2/status/1238985797275201538
2020-03-15 00:24:34,BrittanyLaudaVO,,1,2,27,"This also goes for workshops. I know they can be pricey, but chances are the workshop holder would rather refund or credit you for a later date than have someone show up who is potentially sick/exposed to sick people. Let’s stand together & put out community first right now!",,,,1238984398768406529,https://twitter.com/BrittanyLaudaVO/status/1238984398768406529
2020-03-15 00:24:32,BrittanyLaudaVO,,1,2,21,"There will be more auditons, more future sessions & especially more walla. Cancel your booking if you are experiencing symptoms or have been exposed to someone who is. You may even be able to auditon remotely for some opportunities if you have to cancel an in-person appointment!",,,,1238984389947731969,https://twitter.com/BrittanyLaudaVO/status/1238984389947731969
2020-03-15 00:24:32,BrittanyLaudaVO,,1,2,21,"I know getting in the door is hard, & you want to be heard, grow your credits, & hopefully impress whoever you are working with- but especially when it comes to high traffic things like auditions/ensemble recs/walla, you put tons of people at risk if you come to the studio sick!",,,,1238984388760780801,https://twitter.com/BrittanyLaudaVO/status/1238984388760780801
2020-03-15 00:24:31,BrittanyLaudaVO,,7,30,162,"Hey new and aspiring voice actors- big important thing: DO NOT COME TO THE STUDIO IF YOU FEEL UNWELL (or if you have been in contact with someone unwell!) Please consider your peers, their families, and at-risk actors before coming to the studio- ANY studio!",,,,1238984385778651138,https://twitter.com/BrittanyLaudaVO/status/1238984385778651138
2020-03-15 00:22:27,giovannalauda,lisddutra,1,0,1,"oh ok ",,,,1238983864632184833,https://twitter.com/giovannalauda/status/1238983864632184833
2020-03-15 00:18:37,CrystalRacing,BarrichelloFake,0,0,0,"No, Nick offered his services (by showing pics of family) but Lauda &amp; Brawn picked Hamilton over him",,,,1238982902811148289,https://twitter.com/CrystalRacing/status/1238982902811148289
2020-03-15 00:11:52,vicky_lauda,,0,0,0,"2/king’s private prophet, were his sons Zaccur, Joseph, Nethaniah, and Asharelah. Under Jeduthun, who led in giving thanks and praising the LORD (while accompanied by the zither), were his six sons: Gedaliah, Zeri, Jeshaiah, Shimei, Hashabiah, and Mattithiah.",,,,1238981203392434176,https://twitter.com/vicky_lauda/status/1238981203392434176
2020-03-15 00:11:30,vicky_lauda,,1,0,0,"1/OT --- David and the officials of the Tabernacle then appointed men to prophesy to the accompaniment of zithers, harps, and cymbals. These men were from the groups of Asaph, Heman, and Jeduthun. Here is a list of their names and their work: Under the leadership of Asaph, the",,,,1238981109062545410,https://twitter.com/vicky_lauda/status/1238981109062545410
