date,username,to,replies,retweets,favorites,text,geo,mentions,hashtags,id,permalink
2016-12-12 21:06:07,ts2marcintest,,0,0,0,"Millennium Health Adds Levorphanol to its Medication Monitoring Menu http://satprnews.com/?p=677712 SAN DIEGO, Dec. 12, 2016 /PRNe",,,,808417670609702912,https://twitter.com/ts2marcintest/status/808417670609702912
2016-12-12 20:30:40,MillenniumHlth,,0,0,0,"Millennium Health announced today the availability of a new definitive urine drug test for detecting levorphanol http://bit.ly/2gySeys",,,,808408751526940672,https://twitter.com/MillenniumHlth/status/808408751526940672
2016-12-09 22:26:56,djkroll22,,0,0,0,"Pain experts say levorphanol provides multiple benefits https://www.mdlinx.com/internal-medicine/medical-news-article/2016/12/09/6965566/?utm_source=in-house&amp;utm_medium=message&amp;utm_campaign=mh-im-dec16",,,,807350849055977472,https://twitter.com/djkroll22/status/807350849055977472
2016-12-04 12:01:00,BNightsCRPS,,0,1,2,"Pain Experts Say Older Opioid Analgesic Levorphanol Provides Multiple Benefits. http://fb.me/Wp2M8iel",,,,805381388115574784,https://twitter.com/BNightsCRPS/status/805381388115574784
2016-12-01 16:01:02,Pharmacy_Today,,0,0,0,"Pain experts say #levorphanol outperforms other #opioid meds in a number of ways http://bit.ly/2gVirHa",,,#levorphanol #opioid,804354627407900672,https://twitter.com/Pharmacy_Today/status/804354627407900672
2016-12-01 14:05:18,PSRDoctor,,0,0,0,"Levorphanol is helpful in refractory pain and opioid induced hyperalgesia syndrome! http://ow.ly/lXMd306HJ5p",,,,804325504979501057,https://twitter.com/PSRDoctor/status/804325504979501057
2016-11-21 20:01:20,ZypCzyk,,0,0,1,"Levorphanol - The Forgotten Opioid from @JeffryFudin https://edsinfo.wordpress.com/2016/11/21/levorphanol-the-forgotten-opioid",,,,800791222952431616,https://twitter.com/ZypCzyk/status/800791222952431616
2016-11-19 22:50:23,neuroreviews,,0,0,0,"Is levorphanol better than methadone? #PainManagement http://ow.ly/rRXv30684VW",,,#PainManagement,800108990663303168,https://twitter.com/neuroreviews/status/800108990663303168
2016-11-16 06:05:03,MarianjoyMedLib,,0,0,0,"Pain Experts Say Older Opioid Analgesic Levorphanol Provides Multiple Benefits The literature review, which... http://fb.me/11p3n1PLf",,,,798768828205264897,https://twitter.com/MarianjoyMedLib/status/798768828205264897
2016-11-12 00:29:54,WR_CPI,painmednews,0,0,0,"Levorphanol “much better tolerated than other opioids.” However, it's only available thru one company and is pricey #NPAW2016",,,#NPAW2016,797234933987164160,https://twitter.com/WR_CPI/status/797234933987164160
2016-11-11 23:53:45,painmednews,,1,3,4,"Pain Experts Say Older Opioid Analgesic #Levorphanol Provides Multiple Benefits https://goo.gl/TETk1q",,,#Levorphanol,797225834130132992,https://twitter.com/painmednews/status/797225834130132992
2016-11-11 00:30:23,AmerAcadPainMed,,0,0,1,"'We need options for opioid analgesics. Levorphanol is simply another option' says Dr. Jeff Gudin: http://bit.ly/2fFPluc via @painmednews",,@painmednews,,796872667441889281,https://twitter.com/AmerAcadPainMed/status/796872667441889281
2016-11-06 01:05:43,BionicMSW,jake_mcclure,0,0,0,"@PainPtFightBack @KimmeeKMiller Levorphanol study done back in 2003 proved that's not accurate belief.(2)",,@PainPtFightBack @KimmeeKMiller,,795069618176008192,https://twitter.com/BionicMSW/status/795069618176008192
2016-11-05 19:36:21,Ranger5Publish,,0,0,0,"#CRPS - ask your doctors about #Levorphanol and #Ketamine #RSD #CRPS #ComplexRegionalPainSyndrome #RSDSA",,,#CRPS #Levorphanol #Ketamine #RSD #CRPS #ComplexRegionalPainSyndrome #RSDSA,794986730550136832,https://twitter.com/Ranger5Publish/status/794986730550136832
2016-11-05 12:50:45,ZeBepsMD,,0,0,0,"""Older #Opioid Analgesic #Levorphanol Provides Multiple Benefits"" #pain #hpm http://www.painmedicinenews.com/Clinical-Pain-Medicine/Article/11-16/Pain-Experts-Say-Older-Opioid-Analgesic-Levorphanol-Provides-Multiple-Benefits/38448",,,#Opioid #Levorphanol #pain #hpm,794884657997287425,https://twitter.com/ZeBepsMD/status/794884657997287425
2016-09-05 13:41:10,merinathil,drp297,1,0,0,"azapropazone, phenazocine, benorylate, levorphanol....I could go on.",,,,772791688058273792,https://twitter.com/merinathil/status/772791688058273792
2016-08-07 13:46:32,Boze_leclair,,0,0,5,"#firstsevenjobs 1)tobacco 2)weed 3)dxm 4)ketamine 5)mdpv 6)lsd&amp;analogues 7)levorphanol",,,#firstsevenjobs,762283788411949056,https://twitter.com/Boze_leclair/status/762283788411949056
2016-07-30 13:06:16,toi_shailendraA,,0,0,0,"The Delhi Race Club has suspended trainer Rajinder for 9 months after his horse tested positive for prohibited substance Levorphanol",,,,759374551461625856,https://twitter.com/toi_shailendraA/status/759374551461625856
2016-07-28 17:45:31,decompositorbot,,0,0,0,"contents of Apostle's: 4% levorphanol, 96% haires. ",,,,758720051243548672,https://twitter.com/decompositorbot/status/758720051243548672
2016-07-06 08:45:32,elderadvice,,0,0,0,"Gayne your levorphanol.",,,,750611628874424320,https://twitter.com/elderadvice/status/750611628874424320
2016-06-20 02:15:40,elderadvice,,0,0,0,"This is how you ligge the levorphanol.",,,,744715309039357952,https://twitter.com/elderadvice/status/744715309039357952
2016-06-02 21:17:16,SomewhatSeattle,LucyStag,0,0,0,"They'd probably rather have pain patients switch to levorphanol (price has gone up 2000% in the last year), or just ""tough it out""",,,,738479621776105473,https://twitter.com/SomewhatSeattle/status/738479621776105473
2016-05-30 02:56:50,JeffreyFudin,,0,0,0,"there are 5 opioids that do not rely on CYP enzymes. Morphine, oxymorphone, hydromorphone, tapentadol, levorphanol",,,,737115523167719424,https://twitter.com/JeffreyFudin/status/737115523167719424
2016-05-25 19:30:23,silly_phrases,,0,0,0,"untapestried levorphanol",,,,735553617818750976,https://twitter.com/silly_phrases/status/735553617818750976
2016-05-21 10:14:40,painmanwise,,0,0,0,"Levorphanol use: past, present and future. http://ift.tt/1TtzjPw",,,,733964216495943680,https://twitter.com/painmanwise/status/733964216495943680
2016-05-21 10:11:29,palliativewise,,0,0,0,"Levorphanol use: past, present and future. http://1.usa.gov/1TMIGXY",,,,733963414310125568,https://twitter.com/palliativewise/status/733963414310125568
2016-05-06 00:29:43,DoctorDulux,,0,0,0,"Epididymitis often results in an ipod-envy waist. Doctors suggest Levorphanol Tartrate. ",,,,728381193209663489,https://twitter.com/DoctorDulux/status/728381193209663489
2016-04-28 01:10:33,skipbidder,MDaware,0,0,1,"@MDaware @bicmay With much higher resources, I'd prescribe levorphanol, more lidoderm patches, more PT and OT, Lantus Pens.",,@MDaware @bicmay,,725492364639358977,https://twitter.com/skipbidder/status/725492364639358977
2016-04-20 14:17:22,PennyStockPlay1,,0,0,0,"Relmada Therapeutics #RLMD abuse resistant #opioid analgesic levorphanol provide corporate update of R&amp;D programs ",,,#RLMD #opioid,722791270909743105,https://twitter.com/PennyStockPlay1/status/722791270909743105
2016-03-31 07:12:05,kristianikolas,,0,0,0,"Levorphanol and methadone are some opioids that have long half lives and should be used with caution",,,,715436489656508416,https://twitter.com/kristianikolas/status/715436489656508416
2016-03-20 02:47:39,Rx_Ed,,0,1,1,"I have NEVER ordered levorphanol. Is there a unique instance in which that drug is superior to other opioids? I don't know!",,,,711383674172940293,https://twitter.com/Rx_Ed/status/711383674172940293
2016-03-18 21:41:54,NoNeedlessPain,,1,0,1,"Rotating opioids when using methadone? Fast Fact #240 LEVORPHANOL - the forgotten opioid http://www.mypcnow.org/#!blank/s5bm4",,,,710944341879984129,https://twitter.com/NoNeedlessPain/status/710944341879984129
2016-03-18 06:09:14,test_acct_3874,,0,0,0,"Research the humble Levorphanol. ",,,,710709629098057728,https://twitter.com/test_acct_3874/status/710709629098057728
2016-03-16 15:58:13,skipbidder,,1,0,0,"@JeffreyFudin Unfortunately, I've found that you seem to be right about the levorphanol price. 3 pharmacists have originally said they...",,@JeffreyFudin,,710133076538449920,https://twitter.com/skipbidder/status/710133076538449920
2016-03-16 01:45:13,skipbidder,,0,0,0,"@geekpharm Do you stock levorphanol? What price for 2 mg tabs? (Actual question, not trying to make a joke. Allegedly price came way down)",,@GeekPharm,,709918410751266816,https://twitter.com/skipbidder/status/709918410751266816
2016-03-14 19:11:18,JeffreyFudin,skipbidder,2,0,0,"@skipbidder @mlmcpherson, no, levorphanol costs a fortune now!!!",,@skipbidder @mlmcpherson,,709456890955063298,https://twitter.com/JeffreyFudin/status/709456890955063298
2016-03-14 16:30:54,skipbidder,skipbidder,1,0,0,"@JeffreyFudin @mlmcpherson ...Hospice &amp; Palliative Care Formulary when got home. Just learned that levorphanol available &amp; relatively cheap",,@JeffreyFudin @mlmcpherson,,709416525065797632,https://twitter.com/skipbidder/status/709416525065797632
2016-03-14 15:18:10,skipbidder,,1,0,0,"Hello #hpm -ers and PharmD friends. Anyone have resources for conversion from high dose methadone to levorphanol? @mlmcpherson @JeffreyFudin",,@mlmcpherson @JeffreyFudin,#hpm,709398221328490496,https://twitter.com/skipbidder/status/709398221328490496
2016-01-20 14:03:02,postgradmed,,0,0,0,"Our #Pain Management issue is online! Check it out at http://ow.ly/Xdnkc. Topics include #levorphanol #buprenorphine #ketorolac &amp; more!",,,#Pain #levorphanol #buprenorphine #ketorolac,689810369972404224,https://twitter.com/postgradmed/status/689810369972404224
2016-01-13 12:05:34,postgradmed,,0,0,1,"#Levorphanol use: past, present and future - read review at http://ow.ly/WSOEW #pain #opioid",,,#Levorphanol #pain #opioid,687244090405175296,https://twitter.com/postgradmed/status/687244090405175296
2015-12-04 12:35:53,JeffreyFudin,,0,1,0,"@snalamachu, #JeffGudin &amp; @JeffreyFudin team up for Levorphanol Use: Past, Present &amp; Future. Postgraduate Medicine.http://www.tandfonline.com/eprint/HfjxCMTsP2cEWCXca6dw/full …",,@snalamachu @JeffreyFudin,#JeffGudin,672756207023693824,https://twitter.com/JeffreyFudin/status/672756207023693824
2015-12-04 04:50:31,JeffreyFudin,,0,0,2,"#JeffGudin &amp; #JeffFudin strike again, + Sri Nalamachu.Levorphanol Use: Past, Present &amp; Future. Postgraduate Medicine.http://www.tandfonline.com/eprint/HfjxCMTsP2cEWCXca6dw/full",,,#JeffGudin #JeffFudin,672639094200082432,https://twitter.com/JeffreyFudin/status/672639094200082432
2015-11-17 13:36:59,JeffreyFudin,,0,2,3,"Levorphanol is back, but the cost may be a barrier. http://paindr.com/unique-levorphanol-dodges-move-from-forgotten-to-vanished/",,,,666610990927241216,https://twitter.com/JeffreyFudin/status/666610990927241216
2015-10-15 04:26:15,Drug_Porn3,,0,2,1,"Anyone in the 518 know where I could get levorphanol ? #Sub @Drug_porn",,@Drug_Porn,#Sub,654513593812185088,https://twitter.com/Drug_Porn3/status/654513593812185088
2015-10-07 21:46:12,OldRPh,,2,0,1,"Single pt daily: hydromorphone 16mg, levorphanol 18mg, oxycodone 75mg, AND fentanyl patches 100mcg I shit you not. Sickle Cell pain????",,,,651876201787691008,https://twitter.com/OldRPh/status/651876201787691008
2015-09-22 07:00:36,SanzibellLee,,0,0,0,"Photo: socialclaustrophobia: Damien Hirst (British, b. 1965), Levorphanol, 1995. Gloss household paint on... http://tmblr.co/Zps6fm1ukLXEz",,,,646217514213605376,https://twitter.com/SanzibellLee/status/646217514213605376
2015-09-18 07:02:46,wowgreat,,0,0,0,"Photo: socialclaustrophobia: Damien Hirst (British, b. 1965), Levorphanol, 1995. Gloss household paint on... http://tmblr.co/ZqLYXy1uT48J5",,,,644768507851247616,https://twitter.com/wowgreat/status/644768507851247616
2015-09-15 04:03:41,JeffreyFudin,DavidJuurlink,0,0,0,"@DavidJuurlink @AdaGiudiceTomps @SteveGelfand Levorphanol and DM are mirror images but effects are worlds apart. Oxy is not synthetic heroin",,@DavidJuurlink @AdaGiudiceTomps @SteveGelfand,,643636276726513664,https://twitter.com/JeffreyFudin/status/643636276726513664
2015-09-02 05:25:34,ThienPhamPharmD,,0,0,0,"Is levorphanol a better option than methadone? - PubMed - NCBI http://www.ncbi.nlm.nih.gov/pubmed/26307179",,,,638945843735715840,https://twitter.com/ThienPhamPharmD/status/638945843735715840
2015-08-28 01:48:30,painfreeED,,0,0,2,"Is levorphanol a better option than methadone? http://www.ncbi.nlm.nih.gov/m/pubmed/26307179/ thoughts? @LNelsonMD @DavidJuurlink @JMPerroneMD @poisonreview",,@LNelsonMD @DavidJuurlink @JMPerroneMD @poisonreview,,637079275414405120,https://twitter.com/painfreeED/status/637079275414405120
2015-08-27 10:06:39,painmanwise,,0,0,0,"Is levorphanol a better option than methadone? http://ift.tt/1JnW82e",,,,636842250354429952,https://twitter.com/painmanwise/status/636842250354429952
2015-08-20 23:17:14,Ranger5Publish,,0,0,0,"How to cure #writersblock : #levorphanol - only advised if you suffer extreme physical pain.",,,#writersblock #levorphanol,634504491748970496,https://twitter.com/Ranger5Publish/status/634504491748970496
2015-07-03 20:45:18,JaneArlington,,0,0,0,"Updates: Levorphanol Levorphanol /l?va?rf??n?l/ (Levo-Dromoran) is an opioid medication used to treat moderate... http://bit.ly/1GVxB0b",,,,617071639176425472,https://twitter.com/JaneArlington/status/617071639176425472
2015-06-25 18:24:41,TimJohnson4,,0,0,0,"Mexico says it seized nearly 3 tons of narcotic levorphanol near Merida ",,,,614137149227683841,https://twitter.com/TimJohnson4/status/614137149227683841
2015-05-12 23:20:51,MaisaCorp,,0,0,1,"$RLMD eceives a patent from the USPTO for broad coverage of levorphanol and other opioids, with validity expected until at least 2028",,,,598266618553176065,https://twitter.com/MaisaCorp/status/598266618553176065
2015-05-12 14:09:06,Briefingcom,,0,0,1,"$RLMD: Relmada Therapeutics receives a patent from the USPTO for broad coverage of levorphanol and other opioids,... http://bit.ly/1EzRsAR",,,,598127765347381248,https://twitter.com/Briefingcom/status/598127765347381248
2015-04-21 05:06:50,pawovaroxaho,,0,1,0,"Hey Deb, I got a chance to check out levomorphanan The closest thing we have is Levorphanol, the drug they no longer market in the US.",,,,590381152256528384,https://twitter.com/pawovaroxaho/status/590381152256528384
2015-03-14 20:15:12,decompositorbot,,0,0,0,"contents of honyock: 95% levorphanol, 5% chlorates. ",,,,576839011127439360,https://twitter.com/decompositorbot/status/576839011127439360
2015-02-08 21:24:51,jmckeownmd,,0,0,0,"Any #pain tweeps w clinical experience with levorphanol? Reading a paper, I knew absolutely zero. Sounds perfect 4 neuropathic. #opioids",,,#pain #opioids,564535354871795712,https://twitter.com/jmckeownmd/status/564535354871795712
2015-01-17 14:01:16,lwyrupbtch,rachelrmk,1,0,0,"@rachelrmk Lots of Levorphanol",,@rachelrmk,,556451189240631296,https://twitter.com/lwyrupbtch/status/556451189240631296
2015-01-07 17:45:09,autocompleterap,,0,0,0,"Aw, they stressin' me, pass me my nine Levorphanol and dextromethorphan son, I'm gonna get mine",,,,552883651042897920,https://twitter.com/autocompleterap/status/552883651042897920
2014-11-24 20:03:38,skipbidder,SchislerRandy,1,0,0,"@SchislerRandy There is a Fast Facts entry on Levorphanol http://www.eperc.mcw.edu/EPERC/FastFactsIndex/ff_240.htm Haven't RXed it myself. #hpm",,@SchislerRandy,#hpm,536973438582542336,https://twitter.com/skipbidder/status/536973438582542336
2014-11-06 19:27:25,ClatchardCraig,MrMalky,1,0,1,"@MrMalky Good for you! Of course the true connoisseur favours fentanyl. Or perhaps levorphanol...",,@MrMalky,,530441339394342912,https://twitter.com/ClatchardCraig/status/530441339394342912
2014-10-04 10:04:14,palliativewise,,0,0,0,"Levorphanol: revisiting an underutilized analgesic. http://1.usa.gov/1pzJnFv",,,,518340810786766849,https://twitter.com/palliativewise/status/518340810786766849
2014-10-04 06:55:01,CpaTwitts,,0,0,0,"Q.5. A Morphinan ring system is present in one of the following a) Pentazocin b) Pethidine c) Levorphanol d) Codiene",,,,518293192933146624,https://twitter.com/CpaTwitts/status/518293192933146624
2014-09-26 06:13:27,Saudi_Pharma_07,,0,2,1,"Which analgesic is contraindicated for use with rasagiline? A. Meperidine B. Diclofenac C. Levorphanol D. Morphine",,,,515383629921280000,https://twitter.com/Saudi_Pharma_07/status/515383629921280000
2014-07-21 04:45:17,decompositorbot,,0,0,0,"contents of levorphanol: 78% land-water, 22% automatists. ",,,,491081453527367680,https://twitter.com/decompositorbot/status/491081453527367680
2014-06-14 08:11:52,Ranger5Publish,BretEastonEllis,0,0,0,"@BretEastonEllis Dilaudid doesn't relieve pain as much as Levorphanol. Tell 27-year-old to get with the times, Ellis.",,@BretEastonEllis,,477725092768522240,https://twitter.com/Ranger5Publish/status/477725092768522240
2014-05-16 00:46:30,clinthe,,0,0,1,"Considering #levorphanol, #tapentadol, #transdermalbuprenorphine, or #NSAIDs for #elderly #chronicpain? http://bit.ly/1qGU3YG #medcomms",,,#levorphanol #tapentadol #transdermalbuprenorphine #NSAIDs #elderly #chronicpain #medcomms,467103764089167872,https://twitter.com/clinthe/status/467103764089167872
2014-04-03 02:55:23,Ranger5Publish,,0,0,0,"@RSDSA New treatment: Ketamine infusions, Ketamine nasal spray and for Level 10 days, Levorphanol. So far, so good.",,@RSDSA,,451553522920603648,https://twitter.com/Ranger5Publish/status/451553522920603648
2014-03-23 23:02:20,IgorPaniotov,,0,0,0,"New post: Levorphanol lyrical neurontin http://geo-rx.us/archives/20976/levorphanol-lyrical-neurontin/",,,,447870994787889152,https://twitter.com/IgorPaniotov/status/447870994787889152
2013-08-17 21:59:08,Cain_CREAM,,0,0,0,"I got the connect to levorphanol , shit 15x stronger than morphine . . One pill a probably kill you lmao &amp; iGot em on deck for this headache",,,,368854534627401728,https://twitter.com/Cain_CREAM/status/368854534627401728
2013-08-17 21:58:02,Cain_CREAM,,0,0,0,"Who you know can get they hands on levorphanol ? Nobody ! Its hospital use only &amp; its for certain pre-surgery matters &amp; iGot sum ! .",,,,368854257086115840,https://twitter.com/Cain_CREAM/status/368854257086115840
2013-08-02 20:12:47,StanleyDas1,,0,0,0,"http://lnkd.in/RP_Y_9 Hi Denise, This waht I was able to gather from wikipedia, Levorphanol (Levo-Dromoran) is an opioid medication...",,,,363391951137017856,https://twitter.com/StanleyDas1/status/363391951137017856
2013-08-02 16:58:16,paulcannol,,0,0,0,"Hm. Dextromethorphan is the enantiomer of the NMDA-blocker levorphanol. Go figure.",,,,363342999092084737,https://twitter.com/paulcannol/status/363342999092084737
2013-07-26 23:46:27,Omotayobadass_,kemiberry,1,0,0,"Trust me...one rephenol pill n u done “@kemiberry: @Syrus_blaQue am suggesting for u.Levorphanol”",,@kemiberry,,360909008086892544,https://twitter.com/Omotayobadass_/status/360909008086892544
2013-07-26 23:43:09,kemiberry,Omotayobadass_,1,0,0,"@Syrus_blaQue am suggesting for u.Levorphanol",,,,360908177673437185,https://twitter.com/kemiberry/status/360908177673437185
2013-07-06 20:19:06,TimGluckman,,0,0,1,"#Levorphanol, the forgotten #opioid http://www.ncbi.nlm.nih.gov/pubmed/17039381 Much stronger &amp; lasts longer &gt; #morphine &amp;vg oral efficacy http://en.wikipedia.org/wiki/Levorphanol",,,#Levorphanol #opioid #morphine,353609068646105088,https://twitter.com/TimGluckman/status/353609068646105088
2013-06-30 17:55:56,AskAmex,,0,0,0,"@levorphanol Ok Drew, I responded to your email. My response will appear in your Inbox in the Secure Message Center in a few minutes. ^B",,@levorphanol,,351398714901934084,https://twitter.com/AskAmex/status/351398714901934084
2013-06-29 19:53:32,AskAmex,levorphanol,0,0,0,"@levorphanol Topic/Sub Topic,address email to me - Beth &amp; include your Twitter handle &amp; I will review your account &amp; respond back to you.",,@levorphanol,,351065921328132097,https://twitter.com/AskAmex/status/351065921328132097
2013-06-29 19:53:26,AskAmex,levorphanol,0,0,0,"@levorphanol Sure,pls send me an email via: http://aexp.co/dMb - click on 'Ask A Question' to compose an email, select any",,@levorphanol,,351065895981948929,https://twitter.com/AskAmex/status/351065895981948929
2013-06-29 19:50:08,levorphanol,AskAmex,2,0,0,"@AskAmex yes thanks",,@AskAmex,,351065066533175297,https://twitter.com/levorphanol/status/351065066533175297
2013-06-29 19:12:57,AskAmex,levorphanol,1,0,0,"@levorphanol annual membership fee.I can review your account if you would like. ^B",,@levorphanol,,351055708206284801,https://twitter.com/AskAmex/status/351055708206284801
2013-06-29 19:12:50,AskAmex,levorphanol,0,0,0,"@levorphanol Certificates are now received 4 - 6 weeks from the statement date that falls in the month after the billing of the",,@levorphanol,,351055678913265664,https://twitter.com/AskAmex/status/351055678913265664
2013-06-29 18:52:36,levorphanol,AskAmex,2,0,0,"@AskAmex It's gone from the website and I have not received mine this year (arrived April 2012 last year).",,@AskAmex,,351050585530834944,https://twitter.com/levorphanol/status/351050585530834944
2013-06-29 18:38:22,AskAmex,levorphanol,0,0,0,"@levorphanol weekend. ^Beth",,@levorphanol,,351047002328547328,https://twitter.com/AskAmex/status/351047002328547328
2013-06-29 18:38:14,AskAmex,levorphanol,0,1,0,"@levorphanol flying Delta you also receive a 20% savings on in-flight purchases.Tweet back if I can assist any further,otherwise have a nice",,@levorphanol,,351046972280537088,https://twitter.com/AskAmex/status/351046972280537088
2013-06-29 18:37:59,AskAmex,levorphanol,1,0,0,"@levorphanol Good afternoon.Thx for tweeting.The Companion Certificate continues to be a feature of the Platinum Delta SkyMiles Card.When",,@levorphanol,,351046906710994946,https://twitter.com/AskAmex/status/351046906710994946
2013-06-29 18:28:31,levorphanol,,3,0,0,"@AskAmex What happened to the companion ticket benefit for Skymile platinum cards? Did it get cancelled?",,@AskAmex,,351044525046759424,https://twitter.com/levorphanol/status/351044525046759424
2013-06-25 05:34:16,slutty_things,,0,0,0,"slutty levorphanol",,,,349400125153615872,https://twitter.com/slutty_things/status/349400125153615872
2013-06-14 11:54:44,levorphanol,,0,0,0,"Maybe I can help you. I am Boba Fatt. #Bespin #AngryBirdsStarWars http://angrybirds.com/trophy/?sw=43",,,#Bespin #AngryBirdsStarWars,345509608808402945,https://twitter.com/levorphanol/status/345509608808402945
2013-04-22 22:51:24,afsuarmy,,0,0,0,"Photo: Damien Hirst - Levorphanol, 1995 #damienhirst #spots #afsu http://tmblr.co/Z1rdcvjJUyaH",,,#damienhirst #spots #afsu,326468308830408705,https://twitter.com/afsuarmy/status/326468308830408705
2013-04-22 22:51:22,X_AFSU,,0,0,0,"Damien Hirst - Levorphanol, 1995 #damienhirst #spots #afsu http://instagram.com/p/YbKVr7Fm_h/",,,#damienhirst #spots #afsu,326468298353016833,https://twitter.com/X_AFSU/status/326468298353016833
2013-04-09 20:40:13,thurston_tyler,,0,0,0,"Levorphanol &lt;&lt; this shit got me on a high..",,,,321724249305911297,https://twitter.com/thurston_tyler/status/321724249305911297
2013-04-08 12:24:29,slutty_things,,0,0,0,"slutty levorphanol",,,,321237107756654592,https://twitter.com/slutty_things/status/321237107756654592
2013-04-06 22:37:49,levorphanol,,0,0,0,"Do. Or do not. There is no fly. #AngryBirdsStarWars http://angrybirds.com/trophy/?sw=20",,,#AngryBirdsStarWars,320666680873324544,https://twitter.com/levorphanol/status/320666680873324544
2013-04-06 22:37:38,levorphanol,,0,0,0,"He's a card player, birdbrain, scoundrel. You'd like him. #LandoBird #AngryBirdsStarWars http://angrybirds.com/trophy/?sw=45",,,#LandoBird #AngryBirdsStarWars,320666638305353728,https://twitter.com/levorphanol/status/320666638305353728
2013-04-06 22:37:23,levorphanol,,0,0,0,"WWEEEOOOWWW! Chirp. #R2D2 #AngryBirdsStarWars http://angrybirds.com/trophy/?sw=24",,,#R2D2 #R2D2 #AngryBirdsStarWars,320666572232470529,https://twitter.com/levorphanol/status/320666572232470529
2013-04-06 22:37:18,levorphanol,,0,0,0,"You've never heard of the Mighty Falcon? #AngryBirdsStarWars http://angrybirds.com/trophy/?sw=7",,,#AngryBirdsStarWars,320666550547914752,https://twitter.com/levorphanol/status/320666550547914752
2013-04-06 22:37:08,levorphanol,,0,0,0,"I have you now! #LardVader #AngryBirdsStarWars http://angrybirds.com/trophy/?sw=17",,,#LardVader #AngryBirdsStarWars,320666508856549377,https://twitter.com/levorphanol/status/320666508856549377
2013-03-24 21:01:18,lockthecabinet,,0,0,0,"A #Prescription for Trouble: Levorphanol #Addiction - http://ow.ly/jlJQu #painkilleraddiction #Rxdrugabuse",,,#Prescription #Addiction #painkilleraddiction #Rxdrugabuse,315931352182693888,https://twitter.com/lockthecabinet/status/315931352182693888
2013-03-05 00:25:46,VladNikola,,0,0,0,"schools have to get rid of chemicals. and i need to cook meth. or maybe Levorphanol",,,,308735047916199936,https://twitter.com/VladNikola/status/308735047916199936
2013-02-22 11:23:08,Andrea_Algieri,,1,0,0,"Me in Damien Hirst...Levorphanol, 1995! #FB #FACEBOOK creativer Cover! #Cool #Graphic #HandMade #Art",,,#FB #FACEBOOK #Cool #Graphic #HandMade #Art,304914214500319233,https://twitter.com/Andrea_Algieri/status/304914214500319233
2013-02-05 17:01:55,tyronenosaurus,,0,0,0,"fentanyl hydromorphone levorphanol meperedine methadone morphine oxymorphone",,,,298838880780681216,https://twitter.com/tyronenosaurus/status/298838880780681216
2012-12-22 09:37:12,LadyUndefinable,,0,0,1,"Fentanyl, Buprenorphine, Levorphanol, Hydromorphone, Morphine.",,,,282419508608655361,https://twitter.com/LadyUndefinable/status/282419508608655361
2012-11-21 11:29:28,_zivanna_,Hirnnaht,0,0,1,"@levorphanol Love for you:-):-):-) ",,@levorphanol,,271213734263939072,https://twitter.com/_zivanna_/status/271213734263939072
2012-08-14 20:54:00,JobsAtCoreMed,,0,0,0,"Word of the Day for August 14, 2012: Levallorphan Tartrate: The N-allyl analogue of levorphanol, antagonistic to... http://fb.me/sV9FdruX",,,,235479408838852610,https://twitter.com/JobsAtCoreMed/status/235479408838852610
