date,username,to,replies,retweets,favorites,text,geo,mentions,hashtags,id,permalink
2012-07-25 23:36:51,naplex_facts,,0,0,0,"C II drugs i never heard of. propoxyphene, diphenoxylate, glutethimide, levorphanol",,,,228272634197049344,https://twitter.com/naplex_facts/status/228272634197049344
2012-07-13 11:16:47,__alfarooq__,,4,1,0,"A) Methadone B) Controlled-release morphine C) Levorphanol D) Transdermal fentanyl E) Dihydromorphone #دوائي",,,,223737736677433345,https://twitter.com/__alfarooq__/status/223737736677433345
2012-07-09 11:58:32,SignsSymptoms,,0,0,0,"More: LEVORPHANOL TARTRATE dosing http://symptomsexplained.com/drug-dosing/levorphanol-tartrate-dosing/",,,,222298690310782978,https://twitter.com/SignsSymptoms/status/222298690310782978
2012-06-13 04:13:06,ezzy_yan,,0,0,0,"Step 3- morphine,hydromorphone, methadone, levorphanol, fentanyl, oxycodone +/- non opioid analgesic n adjuvants",,,,212759474434342912,https://twitter.com/ezzy_yan/status/212759474434342912
2012-04-24 16:55:45,distantcities,patrickxwest,1,0,0,"@patrickxwest I'm off painkillers and on an anti-convulsant. Tramadol or Levorphanol are OK. Codeine works, but I don't like it.",,@patrickxwest,,194832010127224832,https://twitter.com/distantcities/status/194832010127224832
2012-04-22 07:06:50,hbPain,,0,0,0,"Another new ER formula!: As I was looking for news of Levorphanol, ran across this. It appears they have a new ... http://bit.ly/IiUVZU",,,,193959026030166016,https://twitter.com/hbPain/status/193959026030166016
2012-02-23 15:47:18,ElizBlanchardMD,,0,0,0,"No current clinical trials listed for levorphanol on http://cancer.gov Need remains for new therapies and pain trials #cancerpain",,,#cancerpain,172709122209349632,https://twitter.com/ElizBlanchardMD/status/172709122209349632
2012-02-23 15:33:35,equijada,ElizBlanchardMD,1,0,0,"@blanchardeliz I haven't used levorphanol. Generally use methadone if wanting NMDA receptor antagonist properties #hpm",,@BlanchardEliz,#hpm,172705670234251264,https://twitter.com/equijada/status/172705670234251264
2012-02-23 14:04:53,ElizBlanchardMD,,1,0,0,"Is levorphanol underused or best saved for refractory pain? #cancer pain #hpm",,,#cancer #hpm,172683347968016385,https://twitter.com/ElizBlanchardMD/status/172683347968016385
2011-11-27 16:36:21,pharmreviewer,,0,0,0,"Looking for Levorphanol...: I have heard such great things about this med, but it just isn't prescribed here in the US. http://bit.ly/tw9QJi",,,,140831334913417216,https://twitter.com/pharmreviewer/status/140831334913417216
2011-07-18 05:30:25,denisebyram,,0,0,0,"Health effects from smoking cigarettes: In Health effects from smoking cigarettes Schroder Prinzhorn similar to levorphanol albeit pe...",,,,92828550301876224,https://twitter.com/denisebyram/status/92828550301876224
2011-06-22 16:00:13,pharmareport,,0,0,0,"In Focus: Levorphanol Tablets [Shortage] http://goo.gl/fb/ZNg1P",,,,83564960852090880,https://twitter.com/pharmareport/status/83564960852090880
2011-06-20 08:33:29,BTetteh,,0,0,0,"Now u are looking in the BNF..shame on you..:p RT @Abiukpebs: @BTetteh @moffiegurl lmao, oleku, levorphanol.... etc",,@BTetteh @moffiegurl,,82727760669310976,https://twitter.com/BTetteh/status/82727760669310976
2011-03-02 07:17:09,GeneWikiPulse,,0,0,0,"#Meodipt linked #TLR4 to #Fentanyl #Levorphanol http://bit.ly/hNcouo",,,#Meodipt #TLR4 #Fentanyl #Levorphanol,42845883909414912,https://twitter.com/GeneWikiPulse/status/42845883909414912
2010-12-01 02:11:24,hbPain,,0,0,0,"Roxane Levorphanol Unavailable?: Anyone know why LEVO-DROMORAN (levorphanol) is on infinite back-order by all Ph... http://bit.ly/ekfmPs",,,,9791644106752001,https://twitter.com/hbPain/status/9791644106752001
2010-08-03 11:18:50,quebec_news,,0,0,0,"Buy Celecoxib - Levorphanol lyrica #neurontin New Richmond, Quebec =&gt; http://buycelecoxib.net/l/40710/le46 http://bit.ly/aDF8xl",,,#neurontin,20214041235,https://twitter.com/quebec_news/status/20214041235
2010-05-24 18:56:51,bayviewpharmacy,,0,0,0,"Levorphanol 2mg Tablet Shortage - Bayview Pharmacy Can Help! http://hub.am/93HmEp",,,,14640962858,https://twitter.com/bayviewpharmacy/status/14640962858
2010-05-20 14:40:31,In_Cognitus,,0,0,0,"last played: 543 – Porcelain Levorphanol: http://www.last.fm/music/543 http://bit.ly/bb7sb2 #music",,,#music,14365321370,https://twitter.com/In_Cognitus/status/14365321370
2010-04-22 18:45:47,TopRxInc,,0,0,0,"Current Drug Shortages: Levorphanol 2mg Tablets: From: FDA Drug Shortages - 4/22/2010 1:33:30 PM - Product an... http://tinyurl.com/zdl7bt",,,,12654704632,https://twitter.com/TopRxInc/status/12654704632
2010-03-02 23:08:09,OxymorphOwned,,0,0,0,"w00t, no more narcotic withdrawal... got my refill of Opana ER...along with some levorphanol. Chronic pain rapes your fucking soul...",,,,9896007576,https://twitter.com/OxymorphOwned/status/9896007576
2009-10-28 11:35:03,JoeGor,dangor8,0,0,0,"@dangor8 Dextromethorphan is the dextrorotatory enantiomer of the methyl ether of levorphanol, an opioid analgesic. C18H25NO",,@dangor8,,5228007960,https://twitter.com/JoeGor/status/5228007960
2009-10-20 23:02:12,lifecds,,0,0,0,"These are just a few types of opiates that lifecds.com can help you detox from: Heroin,Codeine,Levorphanol,Meperidine",,,,5029848847,https://twitter.com/lifecds/status/5029848847
2009-06-04 20:26:18,mtsource,,0,0,0,"New Blog Entry, ""Levo Dromoran (Levorphanol) - updated on RxList"" - Visit http://www.mtsource.us to read more.",,,,2033969456,https://twitter.com/mtsource/status/2033969456
2009-04-05 03:26:18,Dgalexander,,0,0,0,"@rianjs But dextromethorphan's left handed sibling levorphanol will get the job done without making you feel like a speed freak.",,@rianjs,,1455183693,https://twitter.com/Dgalexander/status/1455183693
2007-11-06 13:29:08,MissRFTC,,0,0,0,"Found in Nyquil: Dextromethorphan HBr. A cough suppressant. In the body it becomes dextrorphan, a cough suppressant, and levorphanol, a ...",,,,392371852,https://twitter.com/MissRFTC/status/392371852
