date,username,to,replies,retweets,favorites,text,geo,mentions,hashtags,id,permalink
2013-05-16 09:35:14,hansvanderwindt,,0,1,0,"#fiatmmc - I metadate, you metadate, we metadate, people have metadated",,,#fiatmmc,334965251999141889,https://twitter.com/hansvanderwindt/status/334965251999141889
2013-05-15 00:53:25,elyssagarzaa,,0,0,0,"How about that Metadate",,,,334471545772720128,https://twitter.com/elyssagarzaa/status/334471545772720128
2013-05-13 18:59:37,DiscountRX_card,,0,0,0,"Discount On Metadate. Save Big with our Discount Pharmacy Card. Accepted at over 64,000 #Pharmacies. http://buz.tw/gRq5V",,,#Pharmacies,334020122182311936,https://twitter.com/DiscountRX_card/status/334020122182311936
2013-05-12 04:49:47,Gemini_Reaper,,0,0,0,"@cosmicalninja I'm getting a message saying ""WARNING: iTunes MetaDate Changed?"" When I crack apps. What does this mean and what should I do?",,@cosmicalninja,,333443865883328513,https://twitter.com/Gemini_Reaper/status/333443865883328513
2013-05-09 07:06:02,DiscountRX_card,,0,0,0,"Discount On Metadate. If You Don't Have Insurance,This Card Can Save You Money on Your Prescriptions http://buz.tw/Qqi5U",,,,332390989253705728,https://twitter.com/DiscountRX_card/status/332390989253705728
2013-05-08 10:32:03,DiscountRX_card,,0,0,0,"Discount On Metadate. If You Have No Insurance or are Under Insured, This Card Will Save You Money. http://buz.tw/0wyf3",,,,332080447377006592,https://twitter.com/DiscountRX_card/status/332080447377006592
2013-05-07 19:16:16,DiscountRX_card,,0,0,0,"Discount On Metadate. Save Big with our Discount Pharmacy Card. Accepted at over 64,000 #Pharmacies. http://buz.tw/h4Pn6",,,#Pharmacies,331849985631059970,https://twitter.com/DiscountRX_card/status/331849985631059970
2013-05-06 17:26:55,JC_Denisova_Dob,,0,0,0,"Metadate cd weight loss: Metadate cd weight loss http://bit.ly/13mXrZK",,,,331460077783502848,https://twitter.com/JC_Denisova_Dob/status/331460077783502848
2013-05-01 01:55:58,JackyDonz,,1,0,1,"i would like to thank the scientists responsible for creating: adderall, vyvanse, metadate, and concerta for my performance on my finals",,,,329413856269049858,https://twitter.com/JackyDonz/status/329413856269049858
2013-04-30 16:55:59,vcapriano1,,0,0,0,"ITS Data Architect Principal II position posted on http://www.telesaur.com. Do you like metadate repositories? Check it out! #telework #wah",,,#telework #wah,329277966133624832,https://twitter.com/vcapriano1/status/329277966133624832
2013-04-30 08:45:12,TechBackpack,,0,0,0,"[LESSON]: Speed guide to #hashtags - What has replaced metadate http://pinterest.com/pin/428545720762374215/",,,#hashtags,329154454555332608,https://twitter.com/TechBackpack/status/329154454555332608
2013-04-25 15:40:45,eHealthMe,,0,0,0,"which one will help me focus more im currently taking 20mg metadate cd and want to switch to a medicine that http://tinyurl.com/ae4n6tp",,,,327447093461532676,https://twitter.com/eHealthMe/status/327447093461532676
2013-04-25 07:14:59,DiscountRX_card,,0,0,0,"Discount On Metadate. Discount Prescription Card Can Be Used By People with Medicare Part D. Save $. http://buz.tw/3zzBq",,,,327319812126687232,https://twitter.com/DiscountRX_card/status/327319812126687232
2013-04-24 18:40:25,Money_Ave,,0,0,1,"Theres A 360 Degrees Rainbow Over My House !? Time To Metadate &amp; Received Energy :)",,,,327129918750199808,https://twitter.com/Money_Ave/status/327129918750199808
2013-04-23 12:37:45,NCCPeds,,0,0,0,"In mil health system, Adderall XR and Metadate CD are formulary stimulants that can be opened and sprinkled.",,,,326676263051857921,https://twitter.com/NCCPeds/status/326676263051857921
2013-04-22 20:45:01,trupti_01,,0,0,0,"Error 0x80090017 and unable to get past downloading metadate. What the problem lappie? :S",,,,326436503234437120,https://twitter.com/trupti_01/status/326436503234437120
2013-04-20 00:11:02,DiscountRX_card,,0,0,0,"Discount On Metadate. Easy To Use Discount Pharmacy Card. Save On Your Prescriptions, Download now. http://buz.tw/M7CBI",,,,325401183286079488,https://twitter.com/DiscountRX_card/status/325401183286079488
2013-04-19 12:02:53,Phillb79,BootcampPaul,0,0,1,"@BootcampPaul You could start a metadate class.",,@BootcampPaul,,325217937743040513,https://twitter.com/Phillb79/status/325217937743040513
2013-04-09 15:00:00,Jumanji_Booty,,0,0,0,"Ok either my body is seriously in need of higher doses or this Metadate fucking sucks. I swear I can't win!",,,,321638634254123008,https://twitter.com/Jumanji_Booty/status/321638634254123008
2013-04-06 11:47:04,DiscountRX_card,,0,0,0,"Discount On Metadate. Easy To Use Discount Pharmacy Card. Save On Your Prescriptions, Download now. http://buz.tw/jIrI1",,,,320502914307194880,https://twitter.com/DiscountRX_card/status/320502914307194880
2013-04-05 01:44:15,whatever4ever__,,1,0,0,"ritalin and metadate is legal coke.",,,,319988822651846656,https://twitter.com/whatever4ever__/status/319988822651846656
2013-04-01 09:05:00,DiscountRX_card,,0,0,0,"Discount On Metadate. Discount Prescription Card Can Be Used By People with Medicare Part D. Save $. http://buz.tw/mI5PT",,,,318650190120759296,https://twitter.com/DiscountRX_card/status/318650190120759296
2013-03-29 18:10:02,DiscountRX_card,,0,0,0,"Discount On Metadate. Discount Prescription Card Can Be Used By People with High Deductible Plans. http://buz.tw/EKKyS",,,,317700191018946560,https://twitter.com/DiscountRX_card/status/317700191018946560
2013-03-27 20:33:15,timescanner,,0,0,2,"@castinemachine You're suggesting we meditate on our metadate? I was hoping for something more vigorous.",,@castinemachine,,317011454840680449,https://twitter.com/timescanner/status/317011454840680449
2013-03-26 04:29:02,jasonmueller71,sin1str,1,0,0,"@cheryllynne_3 metadate is pretty good no side affects boys been on it for years",,,,316406415549943809,https://twitter.com/jasonmueller71/status/316406415549943809
2013-03-25 17:06:02,DiscountRX_card,,0,0,0,"Discount On Metadate. No Insurance? No Problem. Save up to 75% on Your Prescription Drug Costs. http://buz.tw/Zxby7",,,,316234532334497792,https://twitter.com/DiscountRX_card/status/316234532334497792
2013-03-24 06:06:07,ekhowlett,,0,0,0,"I would totally Metadate @ndef Sean Bouchard #geekandsundry #metadating",,@ndef,#geekandsundry #metadating,315706071283007488,https://twitter.com/ekhowlett/status/315706071283007488
2013-03-23 11:53:03,AdrienneGail,,0,0,0,"Ashley asks: ""Because of agitation issues with strattera his doc decided yesterday to switch him to metadate.... http://fb.me/2epEwyLFE",,,,315430992796086272,https://twitter.com/AdrienneGail/status/315430992796086272
2013-03-23 11:31:02,DiscountRX_card,,0,0,0,"Discount On Metadate. Quite Paying More for your Prescriptions, Get the Discount Prescription Card. http://buz.tw/ANZAS",,,,315425451210317824,https://twitter.com/DiscountRX_card/status/315425451210317824
2013-03-22 15:07:14,DiscountRX_card,,0,0,0,"Discount On Metadate. Download Our Discount Prescription Card and Start Saving Money Today. http://buz.tw/nCilQ",,,,315117470618877952,https://twitter.com/DiscountRX_card/status/315117470618877952
2013-03-21 20:07:00,geogodley,,0,0,0,"youtube work verify edit convert upload metadate answer comments tue 19 mar 2013 3.38 p.m George Godley London U.K 00396:",,,,314830523027562496,https://twitter.com/geogodley/status/314830523027562496
2013-03-21 12:20:18,DiscountRX_card,,0,0,0,"Discount On Metadate. Easy To Use Discount Pharmacy Card. Save On Your Prescriptions, Download now. http://buz.tw/1Sq5M",,,,314713074600906752,https://twitter.com/DiscountRX_card/status/314713074600906752
2013-03-20 12:47:16,gera_p,,0,0,0,"Stand-up? Sit-com? Hard to metadate this nice format of eval session at #btpdf2 but audience loves it - #btpdf3",,,#btpdf2 #btpdf3,314357473530236928,https://twitter.com/gera_p/status/314357473530236928
2013-03-11 21:47:31,DiscountRX_card,,0,0,0,"Discount On Metadate. Save up to 75% at over 64,000 pharmacies on your prescriptions. Download Now. http://buz.tw/2ETFZ",,,,311231938264449024,https://twitter.com/DiscountRX_card/status/311231938264449024
2013-03-07 15:36:20,aritareis,,0,0,0,"cant download tv shows from @eztv_it on my utorrent! metadate? whatttt??",,@eztv_it,,309688978481745920,https://twitter.com/aritareis/status/309688978481745920
2013-03-07 15:26:17,cheri818,,0,0,0,"@buffycar yay. Get a written script from him for Kenzie generic metadate xr 20 mg. She has 2 pills left.",,@buffycar,,309686448913793024,https://twitter.com/cheri818/status/309686448913793024
2013-03-05 19:12:58,DiscountRX_card,,0,0,0,"Discount On Metadate. Download Our Discount Prescription Card and Start Saving Money Today. http://buz.tw/mSuCb",,,,309018719265361920,https://twitter.com/DiscountRX_card/status/309018719265361920
2013-03-02 18:22:12,InstrumentalDoc,,0,0,0,"MC Metadate- Freestyle (The Recipe Instrumental Cover) http://www.worksessions.com/videos/NX5X6qAgtnI",,,,307918779902459904,https://twitter.com/InstrumentalDoc/status/307918779902459904
2013-02-25 06:55:11,WayleighKeber,,0,0,0,"""I wish that could be metadate, medicated......prescribed"" *hot chocolate comes out @onceuponamolly 's nose*",,@OnceUponAMolly,,305933947878125568,https://twitter.com/WayleighKeber/status/305933947878125568
2013-02-24 06:09:03,DiscountRX_card,,0,0,0,"Discount On Metadate. Easy To Use Discount Pharmacy Card. Save On Your Prescriptions, Download now. http://buz.tw/qFAYy",,,,305559950392979456,https://twitter.com/DiscountRX_card/status/305559950392979456
2013-02-22 10:55:21,DiscountRX_card,,0,0,0,"Discount On Metadate. Download Our Discount Prescription Card and Start Saving Money Today. http://buz.tw/2VaTq",,,,304907222650068992,https://twitter.com/DiscountRX_card/status/304907222650068992
2013-02-16 00:04:39,panbilindsey,,0,0,0,"The hunger I feel after my metadate wears off is UNREAL",,,,302569143717203968,https://twitter.com/panbilindsey/status/302569143717203968
2013-02-13 23:26:46,danielleChiz_,KatherineGill5,0,0,0,"@KatherineGill5 and then Mac gave me the metadate to concentrate on my horse farm management business plan aka project from hell",,@KatherineGill5,,301834830801428483,https://twitter.com/danielleChiz_/status/301834830801428483
2013-02-13 23:20:28,danielleChiz_,KatherineGill5,1,0,0,"@KatherineGill5 too much caffeine, hydrocodone and metadate is HOW I'm functioning right now.",,@KatherineGill5,,301833248160485377,https://twitter.com/danielleChiz_/status/301833248160485377
2013-02-13 21:20:36,panbilindsey,,1,0,0,"Today was a bad day to take a double dose of Metadate.",,,,301803080448622592,https://twitter.com/panbilindsey/status/301803080448622592
2013-02-13 16:51:44,Airwane,rufusd,2,0,0,"@rufusd @terrylwhite i watched the video but it's not really making sense to me i geuss it's a pro thing words like ingest metadate marke ?!",,@rufusd @terrylwhite,,301735420356595712,https://twitter.com/Airwane/status/301735420356595712
2013-02-12 20:07:44,abaldwin_alex,,0,0,2,"Time to focus #adderall #vyvanse #methylin #metadate #http://instagr.am/p/VpMtCKN0K2/",,,#adderall #vyvanse #methylin #metadate,301422356625227776,https://twitter.com/abaldwin_alex/status/301422356625227776
2013-02-12 13:57:33,AhmedAlamriSHJ,,0,0,0,"Opening session about the Powerful Metadate #sibf",,,#sibf,301329195030691841,https://twitter.com/AhmedAlamriSHJ/status/301329195030691841
2013-02-08 19:03:19,DiscountRX_card,,0,0,0,"Discount On Metadate. Discount Prescription Card Can Be Used By People with High Deductible Plans. http://buz.tw/j3sRr",,,,299956592596623361,https://twitter.com/DiscountRX_card/status/299956592596623361
2013-02-07 20:13:00,DiscountRX_card,,0,0,0,"Discount On Metadate. Easy To Use Discount Pharmacy Card. Save On Your Prescriptions, Download now. http://buz.tw/zaWIL",,,,299611740176527361,https://twitter.com/DiscountRX_card/status/299611740176527361
2013-02-07 17:30:04,Wittyletters,,0,0,0,"RT @combinedbook: Metadate, cover design, and more all lead to discoverability which is #1 priority! #DBW13 #publishing",,@CombinedBook,#DBW13 #publishing,299570740439707649,https://twitter.com/Wittyletters/status/299570740439707649
2013-02-07 17:27:13,CombinedBook,,0,0,0,"Metadate, cover design, and more all lead to discoverability which is #1 priority! #DBW13",,,#DBW13,299570022567796736,https://twitter.com/CombinedBook/status/299570022567796736
2013-02-04 15:10:48,reavesben,,0,0,0,"Coffee and 10 mg Metadate. Bad idea. Trembling. Hyper. Awful.",,,,298448525346357248,https://twitter.com/reavesben/status/298448525346357248
2013-02-03 11:47:01,DiscountRX_card,,0,0,0,"Discount On Metadate. Save up to 75% at over 64,000 pharmacies on your prescriptions. Download Now. http://buz.tw/Ucqso",,,,298034854388453376,https://twitter.com/DiscountRX_card/status/298034854388453376
2013-02-01 10:26:05,ThijsMullink,,0,0,0,"Content should ask Experience out on a #metadate",,,#metadate,297289712761188352,https://twitter.com/ThijsMullink/status/297289712761188352
2013-01-29 20:30:51,thenickgonzo,drcab1e,0,0,0,"@drcabl3 I.... I am not sure. It depends on the page. What metadate tomorrow?",,@drcabl3,,296354742895013888,https://twitter.com/thenickgonzo/status/296354742895013888
2013-01-27 23:11:33,lukerhodes,ACC_1995,2,0,0,"@ACC_1995 mine was at 20 and gave me headaches so I changed, ask dr about metadate 10mg it's fine",,@ACC_1995,,295670410316500993,https://twitter.com/lukerhodes/status/295670410316500993
2013-01-26 15:04:03,DiscountRX_card,,0,0,0,"Discount On Metadate. Save Big with our Discount Pharmacy Card. Accepted at over 64,000 #Pharmacies. http://buz.tw/G82Km",,,#Pharmacies,295185338559774720,https://twitter.com/DiscountRX_card/status/295185338559774720
2013-01-25 18:00:11,briangryth,,0,0,0,"metadate is as important the the data that is released. Absolutely agree! #datasummit13",,,#datasummit13,294867276606353408,https://twitter.com/briangryth/status/294867276606353408
2013-01-25 11:20:25,AdrienneGail,,0,0,0,"Dianna asks: ""Wondering if anyone has experience with a medicine for ADHD called Metadate? My son was prescribed... http://fb.me/uv1FOisE",,,,294766671833493505,https://twitter.com/AdrienneGail/status/294766671833493505
2013-01-21 21:37:36,cgfrost,,0,5,1,"Get help adding OSGi metadate to your jars. http://bit.ly/UMHU1A",,,,293472437121740800,https://twitter.com/cgfrost/status/293472437121740800
2013-01-18 22:17:30,DiscountRX_card,,0,0,0,"Discount On Metadate. Download and Print this Pre-Activated Discount Prescription Card Now and Save. http://buz.tw/0hJMJ",,,,292395317612146688,https://twitter.com/DiscountRX_card/status/292395317612146688
2013-01-18 14:46:34,DiscountRX_card,,0,0,0,"Discount On Metadate. Stop Paying High Prices For Your Prescriptions. Use This Free Discount Card. http://buz.tw/VAKv9",,,,292281836690878465,https://twitter.com/DiscountRX_card/status/292281836690878465
2013-01-17 09:54:59,uflyhigh515,,0,0,0,"wtf is this.. my torrent *seeding metadate* for 15 mins alr..",,,,291846068293992448,https://twitter.com/uflyhigh515/status/291846068293992448
2013-01-16 21:04:37,Code_Jace,brightsuzaku,1,0,0,"@brightsuzaku Metadate? What is that?",,@brightsuzaku,,291652198348242944,https://twitter.com/Code_Jace/status/291652198348242944
2013-01-16 20:59:43,brightsuzaku,Code_Jace,1,0,0,"@Code_Jace It wears off by evening, it's a single pill. Metadate.",,@Code_Jace,,291650967135473664,https://twitter.com/brightsuzaku/status/291650967135473664
2013-01-15 06:07:58,BlackbeardJoe,,1,0,1,"Ritalin, Concerta, Dextrostat, Metadate, Adderall, Dexedrine... they make kids pay attention. When I was a kid it was called a fuckin belt.",,,,291064162627493888,https://twitter.com/BlackbeardJoe/status/291064162627493888
2013-01-10 16:45:36,DiscountRX_card,,0,0,0,"Discount On Metadate. If You Don't Have Insurance,This Card Can Save You Money on Your Prescriptions http://buz.tw/ccMel",,,,289412689854357506,https://twitter.com/DiscountRX_card/status/289412689854357506
2013-01-09 14:58:35,whatever4ever__,,1,0,0,"concerta, ritalin, metadate and strattera can all suck mah dick",,,,289023368987041792,https://twitter.com/whatever4ever__/status/289023368987041792
2013-01-09 03:05:58,condescendents,,0,0,0,"Downloading metadate of ""From Russia With Love""... fuckin' long.",,,,288844032493355008,https://twitter.com/condescendents/status/288844032493355008
2012-12-31 03:27:43,DiscountRX_card,,0,0,0,"Discount On Metadate. Save on Your Prescription Costs. Use This Free Discount Card &amp; Save Up to 75%. http://buz.tw/bp56O",,,,285588013516468224,https://twitter.com/DiscountRX_card/status/285588013516468224
2012-12-28 01:53:10,eazybakeroven,,0,1,1,"Now listen here everyone follows Metadate and synthetically I have a new look like a bicycle go to see a Mahlep in the OS. #DoNotDisturb ",,,#DoNotDisturb,284477056182538240,https://twitter.com/eazybakeroven/status/284477056182538240
2012-12-24 18:04:44,DiscountRX_card,,0,0,0,"Discount On Metadate. Easy To Use Discount Pharmacy Card. Save On Your Prescriptions, Download now. http://buz.tw/NMZcX",,,,283272010069577728,https://twitter.com/DiscountRX_card/status/283272010069577728
2012-12-22 10:55:52,lifeidea,,0,0,0,"#lifeidea/forums Unwin838 herbalwalgreens.pl - Order Metadate Er Online , Cafergot Suppositories Drugs, Cheap O... http://bit.ly/ViL2yU",,,#lifeidea,282439303441821696,https://twitter.com/lifeidea/status/282439303441821696
2012-12-22 07:44:39,RandomStrawMan,,0,0,0,"metadate er methylin methylin er ritalin my mention afghanistan as complicated they dropped got is ba might really dumb americans'.",,,,282391182959591424,https://twitter.com/RandomStrawMan/status/282391182959591424
2012-12-21 20:43:59,DiscountRX_card,,0,0,0,"Discount On Metadate. Save on Your Prescription Costs. Use This Free Discount Card &amp; Save Up to 75%. http://buz.tw/arYI7",,,,282224920056963072,https://twitter.com/DiscountRX_card/status/282224920056963072
2012-12-19 12:34:00,DiscountRX_card,,0,0,0,"Discount On Metadate. Discount Prescription Card Can Be Used By People with Medicare Part D. Save $. http://buz.tw/B6SL6",,,,281376836674523136,https://twitter.com/DiscountRX_card/status/281376836674523136
2012-12-11 23:19:01,DiscountRX_card,,0,0,0,"Discount On Metadate Save on Your Prescription Costs. Use This Free Discount Card &amp; Save Up to 75%. http://buz.tw/df7cq",,,,278640060436463616,https://twitter.com/DiscountRX_card/status/278640060436463616
2012-12-11 12:34:01,DiscountRX_card,,0,0,0,"Discount On Metadate Save up to 75% at over 64,000 pharmacies on your prescriptions. Download Now. http://buz.tw/goHlv",,,,278477739152007168,https://twitter.com/DiscountRX_card/status/278477739152007168
2012-12-11 05:24:59,JamesCalli924,,0,0,2,"Can not even study because of this metadate. Feel like running a marathon.",,,,278369767943979009,https://twitter.com/JamesCalli924/status/278369767943979009
2012-11-27 12:34:24,fizapirani,,0,0,0,"Everyone forgets about Ritalin and Metadate while Adderall always takes the thunder. #GoUnderdogs #MethylphenidatesFTW",,,#GoUnderdogs #MethylphenidatesFTW,273404407159324672,https://twitter.com/fizapirani/status/273404407159324672
2012-11-25 20:10:27,djgfire,,1,0,0,"I accidentally changed the metadate infrmation of an .m4a formatted audio file through winAmp, and now I can't find it anymore. Help, please",,,,272794398939553793,https://twitter.com/djgfire/status/272794398939553793
2012-11-22 20:28:34,HP_BIM_Wizard,,0,0,0,"#bimimp Todays debate what metadate do we collect in the field? What no software debate! Big jump in the right direction about time projects",,,#bimimp,271711792097546241,https://twitter.com/HP_BIM_Wizard/status/271711792097546241
2012-11-21 14:59:27,grealish,cygri,0,0,0,"@cygri Or have your Test case to read the metadate it needs to cross-check. storing variables in a test case isn't very scalable ;)",,@cygri,,271266582477549568,https://twitter.com/grealish/status/271266582477549568
2012-11-20 23:33:35,davetraxson,,0,0,0,"Methylphenidate (Metadate ER,Methylin ER) | Drug Dosage and Side Effects | Healthline http://ask.healthline.com/goldcontent/methylphenidate#.UKwS0fkshew.twitter - READ ABOUT SIDE-EFFECTS + RT",,,,271033577200828417,https://twitter.com/davetraxson/status/271033577200828417
2012-11-20 11:10:02,whatever4ever__,,0,0,0,"Except ritalin, concerta and metadate cause they suck #legalcrack",,,#legalcrack,270846459476324352,https://twitter.com/whatever4ever__/status/270846459476324352
2012-11-14 06:26:34,StonedColdMN,,0,0,0,"Metadate make me wanna go on a date with my pillow sweet talk it up and never call it back the next day. #stillnotdrawing",,,#stillnotdrawing,268600792716570624,https://twitter.com/StonedColdMN/status/268600792716570624
2012-11-12 17:05:44,RebeccaRGentry,,0,0,0,"#healthinfo So MUCH Rage: Started on Metadate last week. Today we've been having internet prob... http://q.gs/2ZEkY #TFB #FF #F4F #SV",,,#healthinfo #TFB #FF #F4F #SV,268036869525213184,https://twitter.com/RebeccaRGentry/status/268036869525213184
2012-11-06 21:28:50,RebeccaRGentry,,0,0,0,"#healthinfo Doc Visit Today: Questions on Metadate CD and Wellbutrin: Went back to my psych to... http://q.gs/2XGA3 #TFB #FF #F4F #SV",,,#healthinfo #TFB #FF #F4F #SV,265928754986094592,https://twitter.com/RebeccaRGentry/status/265928754986094592
2012-11-01 16:30:15,AdrienneGail,,0,0,0,"Gail asks: ""Generic Metadate: now that they have a generic, our insurance company insists my son take that, or... http://fb.me/1BoubGW5E",,,,264041673586274304,https://twitter.com/AdrienneGail/status/264041673586274304
2012-10-31 15:00:01,spdconnect,,0,0,0,"Adrienne Botelho Hartz wants to know.. ""Hi, my 6 yr old son has recently been prescribed Metadate. He is currently... http://fb.me/QIIypD9k",,,,263656578392129536,https://twitter.com/spdconnect/status/263656578392129536
2012-10-31 04:45:17,Keiyentai,,0,0,0,"This shit pisses me off. Ritalin, Ritilana, Ritaline, Attenta, Penid, Ribufen, Concerta, Metadate, Methylin and... http://fb.me/KAeIuQlV",,,,263501873993113600,https://twitter.com/Keiyentai/status/263501873993113600
2012-10-30 08:43:09,vera_fox,,0,0,0,"first metadate model dt sdry ery 123456 divBV aew ey erert y rty rty first metadate model http://demo.vxb.lc/B6Q #voxbloc",,,#voxbloc,263199350979690496,https://twitter.com/vera_fox/status/263199350979690496
2012-10-30 08:42:51,olga76drug,,0,0,0,"first metadate model dt sdry ery 123456 divBV aew ey erert y rty rty first metadate model http://demo.vxb.lc/B6N #voxbloc",,,#voxbloc,263199275289292800,https://twitter.com/olga76drug/status/263199275289292800
2012-10-30 08:42:30,vera_fox,,0,0,0,"first metadate model dt sdry ery 123456 divBV aew ey erert y rty rty first metadate model http://demo.vxb.lc/B6L #voxbloc",,,#voxbloc,263199184990126080,https://twitter.com/vera_fox/status/263199184990126080
2012-10-24 06:16:41,Laneebang102,,0,0,0,"Fuck you Metadate! #fuckyou",,,#fuckyou,260988160429936640,https://twitter.com/Laneebang102/status/260988160429936640
2012-10-24 01:08:56,klaatubot,,0,0,0,"Metadate- 6 Foot 7 Foot [Cover] http://weav.rs/Sh6MOh",,,,260910714070376451,https://twitter.com/klaatubot/status/260910714070376451
2012-10-05 21:52:29,samanthafxrman,Ashley_1038,1,0,0,"@Ashley_1038 @lindsaylowe3 is it metadate?",,@Ashley_1038 @LindsayLowe3,,254338295952203777,https://twitter.com/samanthafxrman/status/254338295952203777
2012-10-04 15:57:48,harreraimages,bwaltersphoto,1,0,0,"@bwaltersphoto alright:) have done paul&amp;es blog , ready for a bit of metadate, in the normal places, no rush :)",,@bwaltersphoto,,253886647077335040,https://twitter.com/harreraimages/status/253886647077335040
2012-09-28 17:04:27,eMPR,,0,0,0,"#Teva's #Generic #Metadate CD Capsules Available #Methylphenidate HCl Extended-Release #ADHD",,,#Teva #Generic #Metadate #Methylphenidate #ADHD,251729093874302976,https://twitter.com/eMPR/status/251729093874302976
2012-09-16 00:07:12,RodsFromGod,reverend_bunnie,1,0,0,"@reverend_bunnie hahaha, and I had terrible experiences with ritalin/metadate/concerta",,@reverend_bunnie,,247124440649973760,https://twitter.com/RodsFromGod/status/247124440649973760
2012-09-10 04:54:30,whatever4ever__,,0,0,0,"@zoe_NOT101 soo after ritalin i was given metadate which is like concerta. &amp; i was gonna get strattera until i told my dr. i smoke errday &lt;&lt;",,@Zoe_not101,,245022412616368128,https://twitter.com/whatever4ever__/status/245022412616368128
2012-09-07 21:04:12,Wendy0627Rob,,0,0,0,"What are the chances metadate causes a seizure my daughter was in an arcade with bright lights too could it be the above combined",,,,244179285529735168,https://twitter.com/Wendy0627Rob/status/244179285529735168
2012-09-07 09:34:27,scentedsouls,,0,0,0,"crying at the metadate being badly tagged",,,,244005702761345024,https://twitter.com/scentedsouls/status/244005702761345024
2012-09-06 22:40:44,brightsuzaku,Puppersparty,0,0,0,"@CabaretHugs Eh, That's hilarious. I am a little introverted aspie troll, but I've pretty much adapted. I think it's the metadate, because..",,,,243841190905143296,https://twitter.com/brightsuzaku/status/243841190905143296
2012-09-06 22:33:39,brightsuzaku,Puppersparty,1,0,0,"@CabaretHugs OMG, I TAKE METADATE TOO. Are you me? :O",,,,243839405587050496,https://twitter.com/brightsuzaku/status/243839405587050496
2012-09-06 22:04:53,Puppersparty,,1,0,0,"As long as my ~medications~ don't show up I'll be clear on the drug test which maybe my metadate will because it's a controlled substance???",,,,243832165815693312,https://twitter.com/Puppersparty/status/243832165815693312
2012-08-23 21:17:50,Kalyr,helienne,0,0,0,"@helienne : Amazing how many digital files the composer metadate doesn't match the sleeve notes on the record.",,@helienne,,238746896573820929,https://twitter.com/Kalyr/status/238746896573820929
2012-08-22 21:45:57,Dosprazerez,,0,0,0,"Metadate like a Buddhist ...",,,,238391585409208320,https://twitter.com/Dosprazerez/status/238391585409208320
