date,username,to,replies,retweets,favorites,text,geo,mentions,hashtags,id,permalink
2018-11-04 13:56:16,fudger99,,0,0,0,"Although both my movies and tv shows have had metadate files in their directories (xbmc esq created by sonarr or MCM) - @plex doesn't want to grab anything from them and continually enlarges its database directory (filling the VM OS drive)",,@plex,,1059081899686027270,https://twitter.com/fudger99/status/1059081899686027270
2018-10-30 13:27:04,primeurmagazine,,0,0,0,"Having tons of images with no metadate? Rodrigo Gonzalo has created a programme to fix that. Running on @NERSC #supercomputer. At eScience2018",,@NERSC,#supercomputer,1057262611304235008,https://twitter.com/primeurmagazine/status/1057262611304235008
2018-10-30 05:05:44,wrdnrd,raanve,0,0,0,"Huh. Never thought about a connection btwn tinnitus & hydration. (I *def* have louder tinnitus when i'm migraineous.) Meds adjustment is hard. metadate was the one time i truly came close to having a full-on panic attack. :P",,,,1057136447772286976,https://twitter.com/wrdnrd/status/1057136447772286976
2018-10-30 01:40:07,watchpocket,PrivacyDigest,0,0,0,"No more revealed metadate in Signal! Whoppee! ",,,,1057084703050813440,https://twitter.com/watchpocket/status/1057084703050813440
2018-10-20 07:39:54,BScreamSupreme,PicoSheep,2,0,0,"I use Metadate and the difference is tremendous, even though I feel like a dingus even with the meds, I’m just GONE without them. no bad side effects, but it took a lot of trial and error to get there. bluh",,,,1053551365081858049,https://twitter.com/BScreamSupreme/status/1053551365081858049
2018-10-16 18:14:56,JillHeinze,,0,0,2,"@jaclark : great metaphor for PWAs - manifest file as a metadate record #t2b #DLFforum",,@jaclark,#t2b #DLFforum,1052261626714484736,https://twitter.com/JillHeinze/status/1052261626714484736
2018-09-27 00:12:58,dokidokiporo,,0,0,0,"Don't forget your metadate. You're sore without it. But apprehension never goes away; calm is ever out of reach.",,,,1045103971306795014,https://twitter.com/dokidokiporo/status/1045103971306795014
2018-09-25 10:16:16,PalindromeTodd,LauraMcCallen,0,0,1,"Hey HEY LAURA, we can #metadate any time you like ",,,#metadate,1044531019192455168,https://twitter.com/PalindromeTodd/status/1044531019192455168
2018-09-19 06:22:52,SickAnimalBot,,0,0,0,"This sheep needs Metadate ER!",,,,1042297958400712704,https://twitter.com/SickAnimalBot/status/1042297958400712704
2018-09-10 15:17:44,qubadigital,,0,0,1,"Optimizing you email marketing for search engines with stategic metadate and keywords can increase customer engagement and conversions -https://business.trustedshops.co.uk/blog/7-tips-seo-for-emails #seo #marketing #email #emailmarketing",,,#seo #marketing #email #emailmarketing,1039171070857801730,https://twitter.com/qubadigital/status/1039171070857801730
2018-09-07 13:32:46,johnflipside,,0,0,0,"Cory SprinklerCus Bookmark. Any of these will simulate for Methylphenidate: Ritalin, Concerta, Aptensio, Biphentin, Daytrana, Equasym, Medikinet, Metadate, Methylin, QuilliChew, Quillivant, Tranquilyn. I suggest you get off the crack pipe, leave that to Maxine &amp; Nancy.",,,,1038057489202171906,https://twitter.com/johnflipside/status/1038057489202171906
2018-09-05 20:23:01,SickAnimalBot,,0,0,0,"This ewe needs Metadate ER!",,,,1037435956368998400,https://twitter.com/SickAnimalBot/status/1037435956368998400
2018-08-20 20:12:47,dokidokiporo,,0,0,0,"Don't forget your metadate. You're rasping without it. But mortality never goes away; liberation is ever out of reach.",,,,1031635175749419009,https://twitter.com/dokidokiporo/status/1031635175749419009
2018-08-09 18:02:28,SickAnimalBot,,0,0,0,"This beaver needs Metadate ER!",,,,1027616115336327169,https://twitter.com/SickAnimalBot/status/1027616115336327169
2018-08-06 04:28:30,CymbaMusic,,0,1,2,"Dear Submitters, please remember the 'ates' - When pitching songs to anyone: Investigate the company, Contemplate your selections, Deliberate and before you send, De-capitalite (yes, it's a word - we think) your email and finally, Metadate, and THEN populate our inbox. #welisten",,,#welisten,1026324109930577920,https://twitter.com/CymbaMusic/status/1026324109930577920
2018-07-26 02:12:21,SickAnimalBot,,0,0,0,"This jackal needs Metadate ER!",,,,1022303579384827905,https://twitter.com/SickAnimalBot/status/1022303579384827905
2018-07-24 16:39:08,dankysor,,0,0,0,"in automation, using the breaknote metadate to show the show title plus artist and track metadata",,,,1021796936595038209,https://twitter.com/dankysor/status/1021796936595038209
2018-07-24 06:12:19,dokidokiporo,,0,0,0,"Don't forget your metadate. You're raw without it. But failure never goes away; calm is ever out of reach.",,,,1021639193104138241,https://twitter.com/dokidokiporo/status/1021639193104138241
2018-07-16 07:12:18,dokidokiporo,,0,0,0,"Don't forget your metadate. You're capitalist without it. But ambivalence never goes away; blessing is ever out of reach.",,,,1018755184393154560,https://twitter.com/dokidokiporo/status/1018755184393154560
2018-07-02 05:19:32,CoderInMotion,,1,0,0,"@usedarkroom could you, please fix the metadate viewer for DNG? It shows the resolution of an embedded JPG preview. Thank you ",,@usedarkroom,,1013653375169257473,https://twitter.com/CoderInMotion/status/1013653375169257473
2018-06-29 07:56:07,BScreamSupreme,PicoSheep,0,0,1,"adderall made me super lethargic and depressed. I ended up going with metadate. keep yo head up, you still have options!",,,,1012605619533041664,https://twitter.com/BScreamSupreme/status/1012605619533041664
2018-06-27 08:30:58,Science_Open,,0,1,4,"If you are at the @CrossrefOrg event at the @TIBHannover today, talk to @NTscheke about ScienceOpen's work with Crossref metadata and what richer metadate can do for you! ",,@CrossrefOrg @TIBHannover @NTscheke,,1011889612233560064,https://twitter.com/Science_Open/status/1011889612233560064
2018-06-25 00:53:31,quillcasefiles,,0,0,0,"MEDICAL UPDATE: -- increase dose of metadate by hour until Ting ceases spontaneously birthing clones.",,,,1011049716300345344,https://twitter.com/quillcasefiles/status/1011049716300345344
2018-06-23 05:32:19,SickAnimalBot,,0,0,0,"This tapir needs Metadate ER!",,,,1010395103695908864,https://twitter.com/SickAnimalBot/status/1010395103695908864
2018-06-19 03:12:05,dokidokiporo,,0,0,0,"Don't forget your metadate. You're buoyant without it. But complaisance never goes away; ecstasy is ever out of reach.",,,,1008910260411817984,https://twitter.com/dokidokiporo/status/1008910260411817984
2018-06-12 14:03:24,d_recollections,,0,0,0,"Metadate is very import to organizing your photos, digital and scanned to digital http://thephotoorganizers.com/metadata-photos-1/",,,,1006537454097182720,https://twitter.com/d_recollections/status/1006537454097182720
2018-06-07 09:22:01,SickAnimalBot,,0,0,0,"This snake needs Metadate ER!",,,,1004654703085580288,https://twitter.com/SickAnimalBot/status/1004654703085580288
2018-05-22 03:05:20,quarrybot,,0,0,0,"http://dorothyhoward.com/drh-eaw.html (2018, dorothyhoward, online, web, archive, ethics, metadate, memory, forget, withdrawal, deaccessioning, material, content, algorithm, policy, learning, labor, education)",,,,998761703457411072,https://twitter.com/quarrybot/status/998761703457411072
2018-05-20 21:11:34,KartoonKane,NayrmanBSC,0,0,0,"I was on metadate for several if not over ten years. Helped with adhd and focus. Oliver North can kiss off about ANY of his claims. If anything it helps with judgement and brain function.",,,,998310285902364673,https://twitter.com/KartoonKane/status/998310285902364673
2018-05-20 16:34:50,blndzhvmrfn,thehill,0,0,0,"Fact check: True Parents are dragging their children with Ritalin, Adderal, Metadate, and are creating a generation of zombies....would be willing to bet this contributed to these shootings",,,,998240643439890432,https://twitter.com/blndzhvmrfn/status/998240643439890432
2018-05-19 19:06:53,TheBookOf1975,Vodkantots,0,0,1,"Metadate is the same",,,,997916521111412737,https://twitter.com/TheBookOf1975/status/997916521111412737
2018-05-18 15:11:54,dokidokiporo,,0,0,0,"Don't forget your metadate. You're clicking without it. But uselessness never goes away; nirvana is ever out of reach.",,,,997494996277186560,https://twitter.com/dokidokiporo/status/997494996277186560
2018-05-09 01:09:50,kittyxcate,,0,0,0,"me on metadate: focused, pacing my room in circles doing absolutely nothing but tweeting",,,,994021594963079169,https://twitter.com/kittyxcate/status/994021594963079169
2018-04-29 14:22:02,JohnDeweyphelps,JohnBrennan,0,0,0,"I sas the congressional hearing where man of integrity Clapper stated under oath that the NSA was not collecting metadate then saw him on CNN stating they were. How do you define integrity.",,,,990597076873596928,https://twitter.com/JohnDeweyphelps/status/990597076873596928
2018-04-24 16:11:52,dokidokiporo,,0,0,0,"Don't forget your metadate. You're bigoted without it. But ire never goes away; compassion is ever out of reach.",,,,988812779590246401,https://twitter.com/dokidokiporo/status/988812779590246401
2018-04-23 15:22:40,DEACHICAGODiv,,0,0,4,"#DEAMisuseMonday PARENTS: If your children are prescribed #Amphetamines (Adderall®, Concerta®, Dexedrine®, Focalin®, Metadate®, Methylin®, Ritalin®) WHEN ABUSED: called Bennies, Black Beauties, Crank, Ice, Speed, Uppers #DEAChicago @DEACHICAGODiv",,@DEACHICAGODiv,#DEAMisuseMonday #Amphetamines #DEAChicago,988438008939667456,https://twitter.com/DEACHICAGODiv/status/988438008939667456
2018-04-23 14:32:04,SickAnimalBot,,0,0,0,"This gopher needs Metadate ER!",,,,988425277599637504,https://twitter.com/SickAnimalBot/status/988425277599637504
2018-04-22 05:11:45,SickAnimalBot,,0,0,0,"This ape needs Metadate ER!",,,,987921877757816833,https://twitter.com/SickAnimalBot/status/987921877757816833
2018-04-17 03:30:02,SpigetReviews,,0,0,0,"Have some cookies! From here, an idea worths 5 Stars So I can add more placeholders work, the metadate like to merge the only ops can you",,,,986084343301931008,https://twitter.com/SpigetReviews/status/986084343301931008
2018-04-16 01:00:02,SpigetReviews,,0,0,0,"Really great! also any lag. I use mysql isn't but the metadate like a permission set up, and does what I use",,,,985684204968140801,https://twitter.com/SpigetReviews/status/985684204968140801
2018-04-05 15:42:01,SickAnimalBot,,0,0,0,"This frog needs Metadate ER!",,,,981919898329894915,https://twitter.com/SickAnimalBot/status/981919898329894915
2018-04-04 01:52:05,SickAnimalBot,,0,0,0,"This wolverine needs Metadate ER!",,,,981348650285719552,https://twitter.com/SickAnimalBot/status/981348650285719552
2018-04-03 20:12:08,SickAnimalBot,,0,0,0,"This platypus needs Metadate ER!",,,,981263099473879040,https://twitter.com/SickAnimalBot/status/981263099473879040
2018-04-03 02:56:58,OfficialPeterG_,GranularityRUs,3,0,0,"Oh. Ok. So that’s it. Nothing else but misdiagnosing? So no research on preservatives in our foods, chemicals in our water, mercury in our mouths, over prescribed mind altering drugs like Ritalin, Concerta, Daytrana, Methylin, and Metadate?",,,,981002591885705218,https://twitter.com/OfficialPeterG_/status/981002591885705218
2018-04-02 17:53:24,SchillerWalther,SethMacFarlane,1,2,1,"What is a dogma is to think metadate will erase dogma, what is whishfull thinking is to think AI is the new intelligence, what is stupidity is to think AI will replace judgement and intuition. ",,,,980865798678999042,https://twitter.com/SchillerWalther/status/980865798678999042
2018-03-26 01:06:07,wood_paneling,,0,0,0,"My body is so sedated all the time and I’m like whyyyyy do I feel depressed and then I take a metadate and have like an hour of feeling okay until it wears off! Then back to being depressed!",,,,978075592175312896,https://twitter.com/wood_paneling/status/978075592175312896
2018-03-23 14:51:59,SickAnimalBot,,0,0,0,"This horse needs Metadate ER!",,,,977196262398353409,https://twitter.com/SickAnimalBot/status/977196262398353409
2018-03-21 03:49:08,candle1966,markwwilsonmd,1,0,0,"Sadly only options for 8-hours becomes Ritalin LA or Metadate CD unless pull off the Daytrana early. But her resistance to a bead system might result in a 10-12 hour choice. Thankful you’re not needing an alpha agonist! ",,,,976304677095587842,https://twitter.com/candle1966/status/976304677095587842
2018-03-14 16:11:51,dokidokiporo,,0,0,0,"Don't forget your metadate. You're colonialist without it. But anxiety never goes away; calm is ever out of reach.",,,,973954871023013888,https://twitter.com/dokidokiporo/status/973954871023013888
2018-03-01 10:36:11,Benjami17015275,CB618444,1,2,3,"How Many Of These Young Communists Like Hogg Are On Concerta, Daytrana, Methylin, Ritalin, Ritalin LA, Metadate ER, Aptensio XR, Cotempla XR-ODT, QuilliChew ER, and Quillivant XR. We Want To Know. #NRA #GunControl #HoggWash #KoolAid #LiberalismIsAMentalDisorder",,,#NRA #GunControl #HoggWash #KoolAid #LiberalismIsAMentalDisorder,969159358759276544,https://twitter.com/Benjami17015275/status/969159358759276544
2018-02-28 19:34:51,FlyingBunnyRope,,0,0,0,"@SkyNews here's an idea to avoid fake news and rebroadcast clips, stick the location and date/time on screen so viewers can know when the video was taken. Most images taken by smartphones should have gps and metadate which should help :-) #ThinkingDifferent XxxX",,@SkyNews,#ThinkingDifferent,968932530400514048,https://twitter.com/FlyingBunnyRope/status/968932530400514048
2018-02-24 23:08:13,kenmacpherson,SteveBellovin,1,0,0,"Metadate is on bulk surveillance only. NSL can be for anything including specific data not just metadata. ",,,,967536674669506561,https://twitter.com/kenmacpherson/status/967536674669506561
2018-02-24 06:38:04,AndrewRover2020,,0,0,0,"Website being edited via my iphone for Metadate correctness during the day",,,,967287494072066048,https://twitter.com/AndrewRover2020/status/967287494072066048
2018-02-23 21:09:49,michaelzimmer,niftyc,1,0,1,"And we need some standardized metadate for the provenance of the data: harvested from social media? consent? de-identified? etc",,,,967144490992578560,https://twitter.com/michaelzimmer/status/967144490992578560
2018-02-18 04:11:15,dokidokiporo,,0,0,0,"Don't forget your metadate. You're tender without it. But failure never goes away; purpose is ever out of reach.",,,,965076219938181122,https://twitter.com/dokidokiporo/status/965076219938181122
2018-02-17 16:30:58,LarryLytle,,0,0,0,"Wonder how many of these school shooters have been on Adderall, Dexedrine, Concerta, Metadate, or Ritalin to... https://fb.me/9tgtu5NHa",,,,964899988663930881,https://twitter.com/LarryLytle/status/964899988663930881
2018-02-14 11:43:02,RizaPutranto,newscientist,0,0,0,"Even now, dating can be scientifically increased its success rate #science #date #metadate ",,,#science #date #metadate,963740363327291392,https://twitter.com/RizaPutranto/status/963740363327291392
2018-02-10 00:11:16,dokidokiporo,,0,0,0,"Don't forget your metadate. You're absurd without it. But loneliness never goes away; serenity is ever out of reach.",,,,962116721313239042,https://twitter.com/dokidokiporo/status/962116721313239042
2018-02-09 22:22:06,FransBouma,mitekm,1,0,0,"You’re returning an expando under the hood, or are you retrieving metadate for the query first? (For the types/names of yhe result tuple)",,,,962089251155439621,https://twitter.com/FransBouma/status/962089251155439621
2018-02-08 04:11:14,dokidokiporo,,0,0,0,"Don't forget your metadate. You're barbaric without it. But sloth never goes away; allegory is ever out of reach.",,,,961452337905647617,https://twitter.com/dokidokiporo/status/961452337905647617
2018-02-06 13:45:04,Infogix,,0,1,0,"Webinar this A.M! ""Top Game-Changing Data Trends for 2018"" is a free, one hour Q+A-style webinar at 10 CST exploring top #techtrends- including #bigdata, converging data management technologies, #IoT, #metadate management &amp; more. Don't miss out! http://okt.to/KLlv5n",,,#techtrends #bigdata #IoT #metadate,960871968580034561,https://twitter.com/Infogix/status/960871968580034561
2018-02-06 12:51:22,quillcasefiles,,0,0,0,"MEDICAL UPDATE: -- increase dose of metadate by hour until Mittens ceases trying to kill other personnel.",,,,960858456831025153,https://twitter.com/quillcasefiles/status/960858456831025153
2018-02-05 20:30:04,Infogix,,0,1,0,"Join us tomorrow for a free 60 minute webinar exploring top #techtrends- including developments in #bigdata, converging data management technologies, #IoT, #metadate management &amp; more. Get the 411 here. http://okt.to/FC40MI",,,#techtrends #bigdata #IoT #metadate,960611503828324352,https://twitter.com/Infogix/status/960611503828324352
2018-02-05 17:45:07,Infogix,,0,1,0,"Join us tomorrow for a free 60 minute webinar exploring top #techtrends- including developments in #bigdata, converging data management technologies, #IoT, #metadate management &amp; more. Get the 411 here. http://okt.to/LvUw4Q",,,#techtrends #bigdata #IoT #metadate,960569991534907393,https://twitter.com/Infogix/status/960569991534907393
2018-02-05 17:44:16,vladcatrinescu,crossan007,0,0,2,"In my opinion, the Microsoft answer to this will be Hub Sites, which will enable cross- site collection navigation! You also have 3rd party solutions such as Teamwork by @valointranet which can show all the sites a user is part of , allow them to filter by metadate and more! ",,@valointranet,,960569778078404608,https://twitter.com/vladcatrinescu/status/960569778078404608
2018-01-31 14:15:46,504kcal_,,1,0,1,"-also i have to fucking input the metadate for those songs by hand again",,,,958705370125365249,https://twitter.com/504kcal_/status/958705370125365249
2018-01-28 07:11:15,dokidokiporo,,0,0,0,"Don't forget your metadate. You're bitchy without it. But self-deprecation never goes away; companionship is ever out of reach.",,,,957511374200037378,https://twitter.com/dokidokiporo/status/957511374200037378
2018-01-23 09:04:57,SimonsJanina,Jim_Jordan,0,0,0,"I thought copies metadate of all emails is still on internet including Clinton emails??? They still think they will win.... they should watch 'The Bugs Life"" :)",,,,955728044861177856,https://twitter.com/SimonsJanina/status/955728044861177856
2018-01-13 19:11:15,dokidokiporo,,0,0,0,"Don't forget your metadate. You're rasping without it. But self-deprecation never goes away; climax is ever out of reach.",,,,952256749154824192,https://twitter.com/dokidokiporo/status/952256749154824192
2018-01-12 01:12:52,Katie_R_H,marrrijeee,0,1,3,"Amphetamines and similar compounds on the level with Meth are the stimulant base of ADHD medication, though these tiny regulated doses. Like for a long time I was on Metadate CD (methylphenidate hydrochloride), which is like Meth's nicer cousin, but that's just a science fact",,,,951622975370887168,https://twitter.com/Katie_R_H/status/951622975370887168
2018-01-04 15:59:49,marcelcmarcel,ProudConser,2,0,0,"i'm more concerned with ADHD DRUGS : ADDERALL, RITALIN, METADATE and there are many more. THESE ARE COMPLETE BULLSHIT ! In my view trying to turn children into robots.....DOESN'T SAY MUCH FOR PARENTS AND TEACHERS as they count on government to raise their kids.....",,,,948947081200308225,https://twitter.com/marcelcmarcel/status/948947081200308225
2017-12-24 05:14:21,Nicky_B5,mandiefressh,1,0,0,"The smart Reps in congress do, like Rubio, for example, those like RP certainly do not. You realize his moron dad is a Kremlin stooge right? It doesn't target any non dangerous Americans, that's why it's fine. Metadate is shit, unless you're guilty.",,,,944798376440209409,https://twitter.com/Nicky_B5/status/944798376440209409
2017-12-23 21:27:05,programmingncr,,0,0,0,"System architecture for search on S3 metadate https://www.reddit.com/r/learnprogramming/comments/7lr5ek/system_architecture_for_search_on_s3_metadate/ Is there any good architecture that allows searching on files stored in amazon's S3 storage? Assuming I have ""summary"", multiple ""tags"" and possible more per document. Now I want to be able to search all th…",,,,944680786464296960,https://twitter.com/programmingncr/status/944680786464296960
2017-12-04 06:11:27,dokidokiporo,,0,0,0,"Don't forget your metadate. You're pulsating without it. But mortality never goes away; compassion is ever out of reach.",,,,937564990046986240,https://twitter.com/dokidokiporo/status/937564990046986240
2017-12-01 21:11:14,dokidokiporo,,0,0,0,"Don't forget your metadate. You're repulsive without it. But boredom never goes away; concupiscence is ever out of reach.",,,,936704263174131714,https://twitter.com/dokidokiporo/status/936704263174131714
2017-11-20 07:31:09,icomedido,,0,0,0,"Unable to retrieve unmanaged layout of managed object via metadate API http://nube53.com/blogaaron/index.php/2017/11/20/unable-to-retrieve-unmanaged-layout-of-managed-object-via-metadate-api/",,,,932511616347893765,https://twitter.com/icomedido/status/932511616347893765
2017-11-11 21:32:32,emhaye_,,0,0,0,"DebianBug: New bug: 881444 - #debhelper - Install appstream metadate into /usr/share/metainfo/... http://deb.li/3JYrG",,,#debhelper,929461866438545409,https://twitter.com/emhaye_/status/929461866438545409
2017-11-11 19:29:06,Cameronekirk,,0,0,1,"@HowtoADHD my pharmacy told me that there supplier said the they have stopped making Metadate ER have you heard about this, I can't find anything online about it",,@HowtoADHD,,929430805650329601,https://twitter.com/Cameronekirk/status/929430805650329601
2017-11-10 23:30:02,SpigetReviews,,0,0,0,"Hey you more placeholders work, the metadate like he sends stats to a great if you use it needs to!",,,,929129048999104514,https://twitter.com/SpigetReviews/status/929129048999104514
2017-11-04 04:09:15,freckle_red,Tonycuz,1,0,3,"the DNC wasn't hacked, the data transfer rate in the metadate proved it LOL",,,,926662603169988609,https://twitter.com/freckle_red/status/926662603169988609
2017-10-30 23:11:14,dokidokiporo,,0,0,0,"Don't forget your metadate. You're clicking without it. But loss never goes away; purpose is ever out of reach.",,,,925138050061099016,https://twitter.com/dokidokiporo/status/925138050061099016
2017-10-26 06:11:14,dokidokiporo,,0,0,0,"Don't forget your metadate. You're loser's without it. But self-deprecation never goes away; nirvana is ever out of reach.",,,,923431808523489280,https://twitter.com/dokidokiporo/status/923431808523489280
2017-10-16 16:40:24,carolrosenberg,,1,2,3,"Now Marine Maj. Jason Wareham, Baluchi defense attorney, is arguing the AE517 metadate motion...",,,,919966265569173505,https://twitter.com/carolrosenberg/status/919966265569173505
2017-10-15 03:47:09,rafivila,nytimes,0,0,1,"Again? Intuniv, Kapvay, Strattera, Concerta, Metadate, Ritalin, Adderall, Adderall XR, Dexedrine? Fix today; anxiety, more drugs tomorrow?",,,,919409281228726272,https://twitter.com/rafivila/status/919409281228726272
2017-10-15 02:20:35,rafivila,nytimes,0,0,0,"Intuniv, Kapvay, Strattera, Concerta, Metadate, Ritalin, Adderall, Adderall XR, Dexedrine? Easy fix today; anxiety and more drugs tomorrow?",,,,919387495757856768,https://twitter.com/rafivila/status/919387495757856768
2017-10-12 02:28:23,rafivila,nytimes,0,0,0,"Intuniv, Kapvay, Strattera, Concerta, Metadate, Ritalin, Adderall, Adderall XR, Dexedrine? Easy fix today; anxiety and more drugs tomorrow?",,,,918302296022200320,https://twitter.com/rafivila/status/918302296022200320
2017-10-02 04:29:30,SickAnimalBot,,0,0,0,"This camel needs Metadate ER!",,,,914708896631148547,https://twitter.com/SickAnimalBot/status/914708896631148547
2017-10-01 11:17:03,dokidokiporo,,0,1,0,"Don't forget your metadate. You're abusive without it. But existential crisis never goes away; elation is ever out of reach.",,,,914449074115481600,https://twitter.com/dokidokiporo/status/914449074115481600
2017-10-01 01:40:16,ActuallyADHD,,0,0,0,"Anonymous said: I used to be on metadate, and I never experienced any side effects. I went off for a while... https://tmblr.co/ZW2kNu2QXRTvo",,,,914303922705256448,https://twitter.com/ActuallyADHD/status/914303922705256448
2017-09-29 16:52:59,skipper68uk,Caira_Rocks,0,0,0,"Sorry but Kids and family still not loading ( Bob Unleashed > Bobs Kids > Cairas Kids > Kids & family metadate loads yet no listings )",,,,913808839878864896,https://twitter.com/skipper68uk/status/913808839878864896
2017-09-05 07:17:05,dokidokiporo,,0,0,0,"Don't forget your metadate. You're loser's without it. But existential crisis never goes away; self abnegation is ever out of reach.",,,,904966597705687040,https://twitter.com/dokidokiporo/status/904966597705687040
2017-09-02 17:16:31,Lukes_pick,billsfriendken,0,0,2,"Sometimes I have to put it in old skool terms so I can understand it too. Metadate = Who, What, Where, When, Why!",,,,904030289168564226,https://twitter.com/Lukes_pick/status/904030289168564226
2017-09-01 05:21:02,alisoness7,,0,0,0,"#comu1130t5 metadate has already be collected by providers. It is a matter and has bad impact.",,,#comu1130t5,903487845397970945,https://twitter.com/alisoness7/status/903487845397970945
2017-08-31 07:43:42,RykatuCrystu,,0,0,0,"Ebook rejected by ibooks etc AGAIN because of incorrect metadate. Grrr. Trying again. Maybe it will be right THIS time!",,,,903161358883201024,https://twitter.com/RykatuCrystu/status/903161358883201024
2017-08-23 21:57:43,psypharmacopeia,,0,0,0,"#methylphenidate comes in numerous forms: - intermediate-acting (Metadate ER, Ritalin SR); onset ~20-60 min; duration ~8°",,,#methylphenidate,900477177665392640,https://twitter.com/psypharmacopeia/status/900477177665392640
2017-08-23 15:30:00,Solidatus_com,,0,2,2,"We are pleased to be the newest members of @InnFin! Follow this space for more on Metadate Discovery &amp; Visulisation #regtech #fintech",,@InnFin,#regtech #fintech,900379603071619072,https://twitter.com/Solidatus_com/status/900379603071619072
