date,username,to,replies,retweets,favorites,text,geo,mentions,hashtags,id,permalink
2020-03-15 06:10:32,FrostieCash,nickgillespie,0,0,0,"It is when it is from pharmacy companies. Adderal and Metadate are rather popular on campus.",,,,1239071464558657537,https://twitter.com/FrostieCash/status/1239071464558657537
2020-03-12 21:49:03,SickAnimalBot,,0,0,0,"This mountain goat needs Metadate ER!",,,,1238220487366447105,https://twitter.com/SickAnimalBot/status/1238220487366447105
2020-03-11 23:10:36,SickAnimalBot,,0,0,0,"This turtle needs Metadate ER!",,,,1237878620565032961,https://twitter.com/SickAnimalBot/status/1237878620565032961
2020-03-03 21:55:36,maudeygirl,,6,0,20,"First typo of the day was metadate instead of metadata and now I want to know what everyone's idea of a metadate would be???",,,,1234960644593422336,https://twitter.com/maudeygirl/status/1234960644593422336
2020-02-29 14:44:19,PROPkills,BishopBob747,1,0,1,"Yeah, people seem to do well with Adderall, others with methylphenidate. I had a psychiatrist who LOVED methylphenidate and it harmed me significantly. Ritalin failed, Metadate failed, then Concerta failed me. However, my doctor also under dosed the Concerta. I rapidly metabolize",,,,1233764941896781824,https://twitter.com/PROPkills/status/1233764941896781824
2020-02-26 07:22:59,Mayples_,JeffAHamilton,0,0,1,"I had a massive task focus problem where small subsets would bother me and I couldn’t get past basic thing. Next day I could learn a new programming language. Next barely create hello world. They put me on Metadate and it’s like limitless, I smell time.",,,,1232566716565200898,https://twitter.com/Mayples_/status/1232566716565200898
2020-02-24 23:00:55,bshakers,,0,0,1,"Data Warehouse Architect with data governance/engineering/management, MySQL/Oracle/SQL Server/PostgreSQL, S3, HDFS, MongoDB, BI, MDM, metadate, business analytics and cloud storage experience ",,,,1232077979615887361,https://twitter.com/bshakers/status/1232077979615887361
2020-02-19 07:57:32,SickAnimalBot,,0,0,0,"This wildcat needs Metadate ER!",,,,1230038695220301826,https://twitter.com/SickAnimalBot/status/1230038695220301826
2020-02-18 07:46:34,SickAnimalBot,,0,0,0,"This horse needs Metadate ER!",,,,1229673546831585280,https://twitter.com/SickAnimalBot/status/1229673546831585280
2020-02-17 07:17:11,SickAnimalBot,,0,0,0,"This salamander needs Metadate ER!",,,,1229303762898079744,https://twitter.com/SickAnimalBot/status/1229303762898079744
2020-02-14 19:26:00,StephanieSarkis,dawso007,0,0,2,"Adderall needs another L at the end. Vyvanse is also spelled incorrectly. Also include Adderall XR, Ritalin LA, Metadate CD, Quillivant XR, and Daytrana. In addition, under non-stimulants FDA-indicated for ADHD, put Strattera, Intuniv, and Kapvay. #ADHD specialist here.",,,#ADHD,1228400014721998862,https://twitter.com/StephanieSarkis/status/1228400014721998862
2020-02-10 15:48:13,spacebabe298,,1,0,1,"adhd/add folks: has anyone taken metadate CD (methylphenidate CD). it has the same active ingredient as ritalin which i responded poorly too 3 years &amp; was recently prescribed but afraid to take it due to the side effects i had. thanks!",,,,1226895656356282368,https://twitter.com/spacebabe298/status/1226895656356282368
2020-02-10 14:16:40,SickAnimalBot,,0,0,0,"This woodchuck needs Metadate ER!",,,,1226872617312845825,https://twitter.com/SickAnimalBot/status/1226872617312845825
2020-02-10 00:34:12,Agent4MassGov,jerryreedjr,2,0,1,"Also- This is somewhat off topic but Adderall is an amphetamine ( Dextroamphetamine {d} {L} ) and Ritalin/Concerta/Metadate (Methylphenidate) is not. It's actually neuroprotective and Amphetamines fry your shit.",,,,1226665636300050432,https://twitter.com/Agent4MassGov/status/1226665636300050432
2020-02-09 15:18:09,SickAnimalBot,,0,0,0,"This seal needs Metadate ER!",,,,1226525702788349955,https://twitter.com/SickAnimalBot/status/1226525702788349955
2020-02-08 02:35:36,badcryptobitch,valardragon,0,0,0,"The problem with changing it or adding privacy later is inertia and the poor metadate resistant guarantees you get.",,,,1225971411489087488,https://twitter.com/badcryptobitch/status/1225971411489087488
2020-02-06 01:16:53,dokidokiporo,,0,0,0,"Don't forget your metadate. You're amateur without it. But abandon never goes away; sunshine is ever out of reach.",,,,1225226824680189952,https://twitter.com/dokidokiporo/status/1225226824680189952
2020-02-01 00:10:36,Private1995,megalomaniac_v,0,0,2,"yeah its always the metadate which is relevant",,,,1223398205381136386,https://twitter.com/Private1995/status/1223398205381136386
2020-01-31 06:38:10,_wavyx,dplurprincess,0,0,0,"I was put on metadate when I was young and took it for yrs. after raving for a yr I learned why my mouth was always dry, i needed gum in class, thirsty as HELL, always had shaky hands. plus I used to grind my teeth in my sleep. they’re amphetamines, pretty much why I don’t roll ",,,,1223133353660035072,https://twitter.com/_wavyx/status/1223133353660035072
2020-01-29 19:28:53,OpOnions,OpOnions,2,0,42,"do not confuse it for my other app: MetaDate where metadata professionals can find like minded individuals for discrete meetups to create robust and interoperable metadata [and also fuck, if everyone wants] ",,,,1222602531504902144,https://twitter.com/OpOnions/status/1222602531504902144
2020-01-24 18:53:56,meliaspapa,NoraBateson,0,0,0,"Groups or communities can choose to use their own custom relationships and metadate.",,,,1220781799334240256,https://twitter.com/meliaspapa/status/1220781799334240256
2020-01-22 21:44:39,justalysn,Finnattentive,1,0,8,"Methylphenidate in the form of Metadate CR. I'm also on Abilify, Wellbutrin, and Librium, but Metadate is the primary workforce for the ADHD. The W is for depression, the L for anxiety, and the A ""acts as a glue"" for my overall mood. No, I don't really understand what that means.",,,,1220099987012571137,https://twitter.com/justalysn/status/1220099987012571137
2020-01-19 16:42:45,DrUmarJohnson,,24,87,277,"“I need you negroes to stop getting your kids evaluated for ADHD, once they get labeled they can force drugs via threats of “medical neglect” from child protection services. If you don’t believe in Ritalin, Adderall, Concerta, Metadate or Vyvanse then what use is the Diagnosis?”",,,,1218936844185931776,https://twitter.com/DrUmarJohnson/status/1218936844185931776
2020-01-18 12:37:43,cmmurffy1,jillnicolez,1,0,1,"I think ""Booger Sugar""(is that a real colloquiallism?) Eh, bit too down low, for Rinna. If she's on drugs, which I don't believe, my educated guess would be something like: 1) dexedrine B)Adderall or)Concerta Then)Metadate CD &amp;)VyVanase All legal speed, ready 4 ur kids",,,,1218512794032726016,https://twitter.com/cmmurffy1/status/1218512794032726016
2020-01-16 23:27:33,Ray824022,,0,0,0,"FYI those are my metadate boosters.... don’t do drugs kids cause they’re really expensive",,,,1217951553832849409,https://twitter.com/Ray824022/status/1217951553832849409
2020-01-15 19:59:58,adhd_curl,MrKitMath,0,0,1,"I've been taking Zoloft for eight years to help depression and anxiety. I'm currently trying Metadate ER. So far, I'm noticing more energy, more patience with the kids, and I'm better able to actually DO things.",,,,1217536924421804037,https://twitter.com/adhd_curl/status/1217536924421804037
2020-01-15 14:01:07,DawsonSField,DawsonSField,0,3,4,"So if everyone in the campaign is copied on a mass email, then every person on the campaign is captured under the 2 hop principle of FISA. EVERY communication the metadate have ever made &amp; still on record is accessed. So the to, from, subject of EVERY email. Every phone record.",,,,1217446618225684481,https://twitter.com/DawsonSField/status/1217446618225684481
2020-01-10 09:57:09,SickAnimalBot,,0,0,0,"This polar bear needs Metadate ER!",,,,1215573284718288896,https://twitter.com/SickAnimalBot/status/1215573284718288896
2020-01-05 13:16:57,dokidokiporo,,0,0,0,"Don't forget your metadate. You're vibrating without it. But mortality never goes away; communism is ever out of reach.",,,,1213811624823459840,https://twitter.com/dokidokiporo/status/1213811624823459840
2020-01-02 20:11:46,justalysn,justalysn,1,0,2,"Metadate was a better release mechanism for me and afternoon grumps went away, Wellbutrin finally kicked in and, presumably, Abilify started to level off the last of my emotional unevenness. Most recent appointment explained some small difficulty getting a lot of sleep, 4/?",,,,1212828851748921350,https://twitter.com/justalysn/status/1212828851748921350
2020-01-02 20:09:16,justalysn,justalysn,1,0,1,"Switched me to 40mg of Metadate (still methylphenidate but different extended release mechanism), maintained Wellbutrin and Librium, and added 2mg of Abilify, to ""balance me out."" (To be honest, I'm still not really sure what it's doing.) 3/?",,,,1212828225820336129,https://twitter.com/justalysn/status/1212828225820336129
2020-01-01 06:35:44,PROPkills,PROPkills,1,0,1,"treatment and it was hell. When I finally got put on Ritalin/Metadate/Concerta/methylphenidate in 12th grade, it helped a little. Eventually, I got switched to Adderall and it was like permanent mental overcast cleared up. Right now, I am fighting for my daughter to get access...",,,,1212261105076232193,https://twitter.com/PROPkills/status/1212261105076232193
2019-12-26 02:16:31,dokidokiporo,,0,0,0,"Don't forget your metadate. You're empty without it. But meaninglessness never goes away; luck is ever out of reach.",,,,1210021540768735232,https://twitter.com/dokidokiporo/status/1210021540768735232
2019-12-21 13:42:13,justalysn,Breanna_clark01,0,0,1,"My Dr gave me Concerta (1st med try) and Metadate (2nd and successful med try) with a dose of Librium to be taken at bedtime. It works very well except when my life has really big stuff going on, but I don't think lost sleep is abnormal then for anyone. Definitely talk to Dr.",,,,1208382164351508482,https://twitter.com/justalysn/status/1208382164351508482
2019-12-20 19:09:31,M_Hall07,,0,0,0,"My body: *sleep deprived* *completely drained* *hasn’t had a real meal in 6 days* Me: *pops a metadate* “Hi, I’ll take a Trenta iced Americano with an extra shot, 7 pumps of vanilla and extra cream”",,,,1208102143544242178,https://twitter.com/M_Hall07/status/1208102143544242178
2019-12-19 20:23:20,TVGuestpert,IngramContent,0,0,0,"We always tell our authors about the importance of metadate. ",,,,1207758332460593152,https://twitter.com/TVGuestpert/status/1207758332460593152
2019-12-19 11:47:31,SickAnimalBot,,0,0,0,"This otter needs Metadate ER!",,,,1207628522606518279,https://twitter.com/SickAnimalBot/status/1207628522606518279
2019-12-13 12:59:02,quillcasefiles,,0,0,0,"MEDICAL UPDATE: -- increase dose of metadate by hour until Alleman ceases orating historic events.",,,,1205472196065447937,https://twitter.com/quillcasefiles/status/1205472196065447937
2019-12-12 16:59:34,justalysn,tigershaveadhd,0,0,0,"I switched from Concerta to Metadate and the difference was amazing. That afternoon crash was horrible. I hear eating and drinking more is supposed to help but, lol, that's sort of an issue too.",,,,1205170339413741568,https://twitter.com/justalysn/status/1205170339413741568
2019-12-10 16:00:02,SpigetReviews,,0,0,0,"AWESOME plugin!!!! The permissions of the plugin work on spanish, if you get the metadate like ""item-movement"" - Toggle Players love the",,,,1204430581234319360,https://twitter.com/SpigetReviews/status/1204430581234319360
2019-12-09 23:46:51,Object_InSpace,RobinAtTheHouse,1,0,0,"If I call you on dischord to talk about games and then I go and blow up a building let's say. They would investigate you for your contacts with me. They would use the metadate of our chat as evidence for this. But they wouldn't find sufficient evidence that we'd conspired.",,,,1204185671625129985,https://twitter.com/Object_InSpace/status/1204185671625129985
2019-12-08 00:26:32,YossiGestetner,LizMair,1,2,19,"Metadate is one thing. A house chair picking off numbers from lawmakers, journos and POTUS attorneys is something else.",,,,1203470882229956609,https://twitter.com/YossiGestetner/status/1203470882229956609
2019-12-05 01:35:11,TreatmentsAdhd,,1,0,0,"If you want stimulants you can try, Concerta, Metadate, Adderall, and much more! You'll start off on a low dose and work your way up if needed. BUT beware, stimulants can be DANGEROUS! Taking them without the supervision of a doctor can lead to abuse. #ADHD #TREATMENT",,,#ADHD #TREATMENT,1202400994484793344,https://twitter.com/TreatmentsAdhd/status/1202400994484793344
2019-12-05 01:05:30,Mostafa60602232,,0,0,0,"If you want stimulants you can try, Concerta, Metadate, Adderall, and much more! You'll start off on a low dose and work your way up if needed. BUT beware, stimulants can be DANGEROUS! Taking them without the supervision of a doctor can lead to abuse. #ADHD #TREATMENT",,,#ADHD #TREATMENT,1202393525641523200,https://twitter.com/Mostafa60602232/status/1202393525641523200
2019-12-03 01:37:05,SickAnimalBot,,0,0,0,"This otter needs Metadate ER!",,,,1201676698955272194,https://twitter.com/SickAnimalBot/status/1201676698955272194
2019-12-01 00:57:35,justalysn,tigershaveadhd,0,0,2,"If it's any help I went 36 Concerta XL to 40 Metadate CD and had 2 Abilify added in and that change and addition made all the difference from feeling that 4-6 hours end of effectiveness feeling with grumpiness to feeling really great most of the time. YMMV, of course. Good luck!",,,,1200941983612723200,https://twitter.com/justalysn/status/1200941983612723200
2019-12-01 00:09:43,justalysn,tigershaveadhd,0,0,2,"I had to switch to Metadate CD because of the afternoon crashes from Concerta XL. The chemical release profile matches my body's metabolism much better. Fingers crossed the XL likes you better!",,,,1200929933901606913,https://twitter.com/justalysn/status/1200929933901606913
2019-11-28 20:25:39,BIM4Estates,,0,3,11,"Excellent presentation by @unibham_estates #BIM team on their #OneEstates initiative.Great examples of best practice for information management,drawings verification,metadate driven document organisation &amp;audited project governance proceses @TheBIMViking @ElenaSimcock @UHEI_UHEI",,@unibham_estates @TheBIMViking @ElenaSimcock @UHEI_UHEI,#BIM #OneEstates,1200148771163774977,https://twitter.com/BIM4Estates/status/1200148771163774977
2019-11-25 21:28:38,6other,,1,0,0,"“How would you like to add $12 billion to your budget next year?” Posted almost five years to the metadate earlier: ",,,,1199077458961502208,https://twitter.com/6other/status/1199077458961502208
2019-11-25 16:28:08,helloyorick,JuliaKennedy_,0,0,0,"They should use a descriptive metadate schema that is open and compatible with library and archive descriptive schema. ",,,,1199001835245383681,https://twitter.com/helloyorick/status/1199001835245383681
2019-11-24 18:22:34,justalysn,NyxIshraa,1,0,0,"Just a note, if it's even an option for you: I was on Concerta 36 and afternoon crashes were brutal, in addition to it not quite being enough. Metadate 40 has a much better release profile for me, so if you're seeing that and can convince your docs, it might be helpful info.",,,,1198668245785559040,https://twitter.com/justalysn/status/1198668245785559040
2019-11-24 18:06:03,justalysn,,1,0,4,"a really short appt in which I barely remember 75% of what I mean to say. Doc changes Concerta to Metadate for light boost in total dose and better action profile with less withdrawal (apparently he also thinks a grumpy me is bad) and then he adds a tiny dose of Abilify... 20/25",,,,1198664088521445378,https://twitter.com/justalysn/status/1198664088521445378
2019-11-21 03:16:20,SickAnimalBot,,0,0,0,"This deer needs Metadate ER!",,,,1197353022457819137,https://twitter.com/SickAnimalBot/status/1197353022457819137
2019-11-20 23:17:12,SickAnimalBot,,0,0,0,"This ox needs Metadate ER!",,,,1197292839836803072,https://twitter.com/SickAnimalBot/status/1197292839836803072
2019-11-20 21:44:16,pedantcoder,,2,0,15,"The Obj-C dynamic dispatch comes with many costs, this is common ""knowledge"". However the details of it are rarely known. Beside the obvious cost of the h-lookup, it comes with 4 other kinds of costs: - codegen size - optimization barrier - static metadate - runtime metadata",,,,1197269452418506753,https://twitter.com/pedantcoder/status/1197269452418506753
2019-11-20 20:38:53,ma_pogo,xDopeBoyMagik,0,0,0,"Or ask for metadate does the same thing just easier to get from a doc",,,,1197252997543276544,https://twitter.com/ma_pogo/status/1197252997543276544
2019-11-19 19:52:27,hm_montes,carrie4502,1,0,1,"That’s what we need, as needed. He was so anxious to prescribe Zoloft though. We did try it and it did nothing for his anxiety or obsessiveness. I know it can be hit or miss but it was a huge miss for us so he doesn’t take anything now but his metadate.",,,,1196878927190511620,https://twitter.com/hm_montes/status/1196878927190511620
2019-11-19 17:16:24,dokidokiporo,,0,0,0,"Don't forget your metadate. You're dizzying without it. But self-deprecation never goes away; luck is ever out of reach.",,,,1196839653493612546,https://twitter.com/dokidokiporo/status/1196839653493612546
2019-11-13 13:46:20,SickAnimalBot,,0,0,0,"This rat needs Metadate ER!",,,,1194612461183406081,https://twitter.com/SickAnimalBot/status/1194612461183406081
2019-11-12 19:29:32,vpntoolbox,,0,0,0,"How to remove Metadate completely? http://dlvr.it/RJ8J9m #privacy #security",,,#privacy #security,1194336445617430528,https://twitter.com/vpntoolbox/status/1194336445617430528
2019-10-31 20:12:04,Suzzicks,ZephSnapp,1,0,1,"Yup. Just needs to be submitted with metadate in the basic equivalent of an XML sitemap.",,,,1189998491990401024,https://twitter.com/Suzzicks/status/1189998491990401024
2019-10-31 10:07:18,Richard_Craig_,,0,0,0,"Will or can CANNABIS replace - a low dose of a stimulant, such as an amphetamine (Adderall, Adderall XR, Dexedrine) or methylphenidate (Concerta, Jornay PM, Metadate, or Ritalin). These drugs lessen the can't-sit-still and on-a-whim behaviors.@chackerman1 @UrbanEducation",,@chackerman1 @UrbanEducation,,1189846296594661378,https://twitter.com/Richard_Craig_/status/1189846296594661378
2019-10-28 19:47:43,SickAnimalBot,,0,0,0,"This elephant needs Metadate ER!",,,,1188905200481984512,https://twitter.com/SickAnimalBot/status/1188905200481984512
2019-10-20 18:48:19,C_M_Hoffman,C_M_Hoffman,0,0,0,"Most get either Amphetamine-based (Adzenys, Dexedrine, Dyanavel, Evekeo, ProCentra, VYVANSE, Zenzedi) OR Methylphenidate-based (Aptensio, CONCERTA, Cotempla, Daytrana, Metadate, Methylin, QuilliChew, Quillivant, Ritalin) The ones in all caps I know friends have used effectively.",,,,1185991151746203658,https://twitter.com/C_M_Hoffman/status/1185991151746203658
2019-10-20 07:55:42,SickAnimalBot,,0,0,0,"This wombat needs Metadate ER!",,,,1185826915774541824,https://twitter.com/SickAnimalBot/status/1185826915774541824
2019-10-18 02:27:01,SickAnimalBot,,0,0,0,"This armadillo needs Metadate ER!",,,,1185019422983053312,https://twitter.com/SickAnimalBot/status/1185019422983053312
2019-10-16 16:38:33,sacwriter,SaltyMeg,2,0,3,"I have neuralgia in my right leg because of scoliosis from polio. Over the years, CNS meds cause my right leg to twitch all day and all night. Any stimulant will actually do that. I can't take caffeine after 10 am or my leg won't stop twitching all night. Adderall, metadate etc.",,,,1184508940127617024,https://twitter.com/sacwriter/status/1184508940127617024
2019-10-16 14:05:57,SickAnimalBot,,0,0,0,"This moose needs Metadate ER!",,,,1184470539152310275,https://twitter.com/SickAnimalBot/status/1184470539152310275
2019-10-15 08:25:48,SickAnimalBot,,0,0,0,"This turtle needs Metadate ER!",,,,1184022550680092672,https://twitter.com/SickAnimalBot/status/1184022550680092672
2019-10-10 20:34:44,qirenni,qirenni,1,0,0,"I've tried Adderall IR, Adderall XR, Concerts, Metadate, Dexedrine, Provigil, and Vyvanse. That last is my fave and what i just got.",,,,1182394053285076992,https://twitter.com/qirenni/status/1182394053285076992
2019-10-10 00:05:09,Jenny_Believes,sgspurr,0,0,0,"Too many drugs when they were children...Ritalin, Adderall, Concerta, Dexedrine, Focalin, Metadate...take your pick! Their brains are addled! ",,,,1182084616355631104,https://twitter.com/Jenny_Believes/status/1182084616355631104
2019-10-09 15:36:56,SickAnimalBot,,0,0,0,"This raccoon needs Metadate ER!",,,,1181956721864069120,https://twitter.com/SickAnimalBot/status/1181956721864069120
2019-10-01 15:58:45,sacwriter,G2theN2theG,1,0,0,"Twitching in the leg. Cramps and pain in the leg. Twitching in the eyelids, fingers, and stomach muscles. These are the main ones. They were worse with the amphetamine-based meds (Adderall, Metadate, etc.) than the non-amph. But they all get my CNS tweaked.",,,,1179063106779017216,https://twitter.com/sacwriter/status/1179063106779017216
2019-09-27 18:16:00,SickAnimalBot,,0,0,0,"This wildcat needs Metadate ER!",,,,1177648095150182401,https://twitter.com/SickAnimalBot/status/1177648095150182401
2019-09-25 00:57:24,Jenny_Believes,KassyDillon,0,0,0,"These people are mentally unstable; want to see the effects of ADHD & ADD Stimulants, or psychostimulants which may include Ritalin, Adderall, Concerta, Dexedrine, Focalin and Metadate! We have a whole generation of unstable idiots! ",,,,1176661946763862019,https://twitter.com/Jenny_Believes/status/1176661946763862019
2019-09-20 19:16:28,SickAnimalBot,,0,0,0,"This gila monster needs Metadate ER!",,,,1175126597009063936,https://twitter.com/SickAnimalBot/status/1175126597009063936
2019-09-20 02:40:30,deangulbury,ptcrUIsErUsA,1,0,1,"Ah yes the Orgasim. P. S. Metadate snorted is basically meth... If looking for an Adderall alternative. Don't ask how I know.",,,,1174875957020282881,https://twitter.com/deangulbury/status/1174875957020282881
2019-09-17 14:19:16,LLW902,LLW902,0,0,1,"trying to talk paulie walnuts into taking metadate cd, 20 minute rant about people who think they're too good for coke now",,,,1173964640117825536,https://twitter.com/LLW902/status/1173964640117825536
2019-09-17 13:33:32,nothaasb,PeterCozy,0,0,4,"imgur just check if the images dont have metadate so none of our fed frens can ask for autographs",,,,1173953131299909633,https://twitter.com/nothaasb/status/1173953131299909633
2019-09-17 02:25:46,SickAnimalBot,,0,0,0,"This deer needs Metadate ER!",,,,1173785085331628033,https://twitter.com/SickAnimalBot/status/1173785085331628033
2019-09-12 13:34:05,so_caffeinated,rosymamacita1,1,0,0,"We started first with metadate for the ADD but it made her depression worse. Since then we’ve switched to lexapro because my mom and one of her brothers have both had it work for them for decades. She’s on a very low dose and it’s helping some.",,,,1172141333621821440,https://twitter.com/so_caffeinated/status/1172141333621821440
2019-09-10 23:26:21,dingos1946,ricklevy67,0,0,3,"Is your Metadate Safe from Herr Dutton and his Band of Greed Infected Gestapo ? ",,,,1171565604949524480,https://twitter.com/dingos1946/status/1171565604949524480
2019-09-09 05:05:52,SickAnimalBot,,0,0,0,"This porcupine needs Metadate ER!",,,,1170926269481046016,https://twitter.com/SickAnimalBot/status/1170926269481046016
2019-09-06 21:45:28,GoHugoIO,bepsays,0,2,8,"This library backs the Exif (image metadate) file cache in the new Hugo 0.58. Hugo would be nothing witout #opensource libraries. #golang #webdev #staticgen #jamstack",,,#opensource #golang #webdev #staticgen #jamstack,1170090663771365377,https://twitter.com/GoHugoIO/status/1170090663771365377
2019-09-06 10:26:09,SickAnimalBot,,0,0,0,"This buffalo needs Metadate ER!",,,,1169919711582261252,https://twitter.com/SickAnimalBot/status/1169919711582261252
2019-09-05 16:25:54,SickAnimalBot,,0,0,0,"This coyote needs Metadate ER!",,,,1169647857747529733,https://twitter.com/SickAnimalBot/status/1169647857747529733
2019-08-24 22:05:41,SickAnimalBot,,0,0,0,"This snake needs Metadate ER!",,,,1165384709880340480,https://twitter.com/SickAnimalBot/status/1165384709880340480
2019-08-21 01:14:57,dokidokiporo,,0,0,0,"Don't forget your metadate. You're absurd without it. But boredom never goes away; amnesty is ever out of reach.",,,,1163982789781458944,https://twitter.com/dokidokiporo/status/1163982789781458944
2019-08-16 21:15:05,dokidokiporo,,0,0,0,"Don't forget your metadate. You're disgusting without it. But avarice never goes away; bliss is ever out of reach.",,,,1162472873803624449,https://twitter.com/dokidokiporo/status/1162472873803624449
2019-08-15 16:02:33,MilitaryRosary,drawandstrike,0,0,1,"PERHAPS, and I'm just spitballing here, THAT might be one of the reasons that hillary sifted her emails and printed out hard copies that would strip the metadate from them, eh?",,,,1162031833078542336,https://twitter.com/MilitaryRosary/status/1162031833078542336
2019-08-15 02:25:11,SickAnimalBot,,0,0,0,"This bison needs Metadate ER!",,,,1161826138487951360,https://twitter.com/SickAnimalBot/status/1161826138487951360
2019-08-14 13:37:56,KJSWMA,GhostEsq,0,0,4,"I have DEPRESSION and ANXIETY and ADHD I like WELLBUTRIN, CELEXA, and METADATE I am VULNERABLE to HEAT STROKE and LITERALLY ALWAYS THIRSTY I CHEW GUM so MY TEETH WON'T FALL OUT My hobbies are CRYING and GOWRON MEMES If you don't like me, I THINK IT'S MY FAULT",,,,1161633053946593280,https://twitter.com/KJSWMA/status/1161633053946593280
2019-08-13 12:10:19,MonsterJobs,,0,0,0,"Hiring a Data Entry (Metadate) #Analyst. Is this the #career for you? #CorteMadera https://job-openings.monster.com/data-entry-metadate-analyst/211035367?WT.mc_n=PP_MTC_TWT&amp;jvs=tw,tc,ca2.1,0&amp;cardid=bfc39b0b-5e3f-4d9e-adf8-f9fc7e5a6058",,,#Analyst #career #CorteMadera,1161248614393483264,https://twitter.com/MonsterJobs/status/1161248614393483264
2019-08-11 04:16:50,SickAnimalBot,,0,0,0,"This woodchuck needs Metadate ER!",,,,1160404685263724544,https://twitter.com/SickAnimalBot/status/1160404685263724544
