date,username,to,replies,retweets,favorites,text,geo,mentions,hashtags,id,permalink
2019-07-01 01:47:44,ForTheRecord01,,1,2,8,"$acad To become a billion-dollar blockbuster drug, Nuplazid only needs to add the dementia-related psychosis indication to its label. (It can afford to fail remaining trials in schizophrenia and depression which, incidentally, it won't.)",,,,1145509257359441920,https://twitter.com/ForTheRecord01/status/1145509257359441920
2019-06-24 00:42:38,ForTheRecord01,Sports_bios,1,0,0,"Apparently those voting ""fail"" aren't aware that Nuplazid has aced its last 3 clinical trials. Those would be in Parkinson's psychosis, Alzheimer's psychosis, and adjunctive treatment in depression.",,,,1142956160523259904,https://twitter.com/ForTheRecord01/status/1142956160523259904
2019-06-18 19:08:14,ChrisLicodo,McKesson,1,0,0,"Amen !! When #Nuplazid costs over $4500 a month , this crucial medication. Needs to easier to access. @Cigna is actually making me go to a 3rd party insurer to ameliorate the costs. #INSANE #ParkinsonsDisease #hallucinations #delusions #dementia #delirium",,@Cigna,#Nuplazid #INSANE #ParkinsonsDisease #hallucinations #delusions #dementia #delirium,1141060065681711105,https://twitter.com/ChrisLicodo/status/1141060065681711105
2019-06-15 05:01:08,Biotech2050,MichaelJFoxOrg,1,2,1,"Circa 30% of #ParkinsonsDisease patients will develop #psychosis with #hallucinations &amp;/or #delusions. Another significant % will develop #dementia. Hopefully your organisations will support ACADIA's drug NUPLAZID which helps these patients. @Clive_Ballard @UofE_Research $ACAD",,@Clive_Ballard @UofE_Research,#ParkinsonsDisease #psychosis #hallucinations #delusions #dementia,1139759724868464641,https://twitter.com/Biotech2050/status/1139759724868464641
2019-06-12 15:28:36,YouCanLeaveToo,Misnomer,0,0,0,"Nancy Pelosi, you’ve stammered and staggered your way through the halls of congress on bourbon and Nuplazid long enough. Meet me at high noon.",,,,1138830465295667201,https://twitter.com/YouCanLeaveToo/status/1138830465295667201
2019-06-12 06:53:12,ForTheRecord01,,0,1,4,"$acad will report the 2nd largest QoQ growth in Nuplazid's history in early August. 2Q sales are expected to come in around $75 million, up from $63 million in Q1. Here are what the last 5 fiscal quarters have looked like: ",,,,1138700761833938944,https://twitter.com/ForTheRecord01/status/1138700761833938944
2019-06-02 19:38:51,ForTheRecord01,,0,0,2,"$acad Studies show that Nuplazid works as well or better than the leading antipsychotics on the market: https://www.ncbi.nlm.nih.gov/pubmed/30837203#https://www.mdedge.com/neurologyreviews/article/171747/parkinsons-disease/pimavanserin-may-be-superior-quetiapine This is one reason to believe that upcoming clinical data will be positive. $IBB",,,,1135269564990730240,https://twitter.com/ForTheRecord01/status/1135269564990730240
2019-05-29 20:46:42,Biotech2050,,0,0,1,"Charles Bonnet Syndrome Treated With Pimavanserin $ACAD #nuplazid https://journals.lww.com/jneuro-ophthalmology/pages/articleviewer.aspx?year=9000&amp;issue=00000&amp;article=99150&amp;type=Citation",,,#nuplazid,1133837091287261185,https://twitter.com/Biotech2050/status/1133837091287261185
2019-05-29 16:00:05,reidrobison,,0,0,2,"The 4 drugs approved in psychiatry through the @US_FDA's breakthrough designation: Pimavanserin (Nuplazid) in Apr 2016 for psychosis in PD Valbenazine (ingrezza) in Apr 2017 for TD Brexanolone (zulresso) in Mar 2019 for PPD Esketamine (spravato) in Mar 2019 for TR MDD #ASCP19",,@US_FDA,#ASCP19,1133764959324663809,https://twitter.com/reidrobison/status/1133764959324663809
2019-05-27 04:14:26,ChrisLicodo,DrmariaDe,0,0,0,"#nuplazid $3500 a month ",,,#nuplazid,1132862603510845440,https://twitter.com/ChrisLicodo/status/1132862603510845440
2019-05-21 00:30:18,LS_Medical,,0,0,0,"Missed Them? US Food and Drug Administration drug updates, changes and approvals as of Monday, May 13, 2019: #Chlorthalidone [ANDA #207813], #Oxybutynin Chloride [ANDA #211682], #Nuplazid [NDA #210793] and others: http://ht.ly/qWfe308tGbw",,,#Chlorthalidone #Oxybutynin #Nuplazid,1130631869605863425,https://twitter.com/LS_Medical/status/1130631869605863425
2019-05-18 19:15:56,ForTheRecord01,,0,0,1,"$acad Nuplazid has aced its last 3 clinical trials: Parkinson's psychosis (phase 3): https://tinyurl.com/y5txbrkd Alzheimer's psychosis (phase 2): https://tinyurl.com/y6k3mju5 (FDA has granted breakthrough-therapy status) Depression (adjunctively, phase 2): https://tinyurl.com/y65mwoks $ibb",,,,1129827981734453248,https://twitter.com/ForTheRecord01/status/1129827981734453248
2019-05-13 23:00:11,LS_Medical,,0,0,0,"Regulatory News: US Food & Drug Administration drug approvals, updates and changes as of Monday, May 13: #Chlorthalidone [ANDA #207813], #Oxybutynin Chloride [ANDA #211682], #Nuplazid [NDA #210793] and others. #FDA: http://ht.ly/PyIl308vvR2",,,#Chlorthalidone #Oxybutynin #Nuplazid #FDA,1128072476846694400,https://twitter.com/LS_Medical/status/1128072476846694400
2019-05-09 13:11:29,GWCitroner,,0,0,0,"Hartford Healthcare now has a new medication, Nuplazid, to treat psychosis in PD. Other medications that may have been used in the past are actually treatments for schizophrenia and are absolutely contraindicated in Parkinson's disease.#Parkinsons",,,#Parkinsons,1126474771686985728,https://twitter.com/GWCitroner/status/1126474771686985728
2019-05-07 01:18:52,ForTheRecord01,,0,1,3,"$acad Nuplazid's History: June 2016 to May 2019 Sales: over $450,000,000 Clinic: Success in Alzheimer's psychosis &amp; depression Trials: Three phase 3 studies ongoing FDA: Granted breakthrough therapy in dementia psychosis, defended Nuplazid's risk/benefit profile",,,,1125570660611190784,https://twitter.com/ForTheRecord01/status/1125570660611190784
2019-05-06 19:28:36,ForTheRecord01,,0,1,4,"$acad An interim analysis of Acadia's phase 3 trial in dementia-related psychosis will be released anytime after June 1. Take a look at how Nuplazid performed at weeks 2, 4, and 6 in its phase 2 Alzheimer's psychosis trial. ",,,,1125482515983097864,https://twitter.com/ForTheRecord01/status/1125482515983097864
2019-05-04 16:43:16,drolivares,,0,0,0,"Message to @CMS with the price of Nuplazid (medication) supply not one but 2 hearing aids can be purchased #AGS19",,@cms,#AGS19,1124716130466066435,https://twitter.com/drolivares/status/1124716130466066435
2019-05-04 16:42:27,sarabwanderer,,0,3,5,"Takeaway #3: Hearing aids may or may not alter the trajectory of cognitive decline in older adults w/ hearing loss, but are nevertheless imp’t. for QOL. 2 mos. of Nuplazid = 2 HAs, but Medicare doesn’t cover HAs. #AGS19",,,#AGS19,1124715925691715585,https://twitter.com/sarabwanderer/status/1124715925691715585
2019-05-04 16:41:57,mpmesias,,0,1,7,"Oh hey @CMSGov. ""For the cost of two months of nuplazid, you can get not one but two hearing aids!"" -@EWidera @geri_doc @AlexSmithMD #AGS19",,@CMSGov @EWidera @geri_doc @AlexSmithMD,#AGS19,1124715798491062279,https://twitter.com/mpmesias/status/1124715798491062279
2019-05-04 16:39:07,swchow,,0,4,2,"#AGS19 @AmerGeriatrics @EWidera @geri_doc Fun fact: For the price of 1 Nuplazid you can get 2 out-of-pocket cost hearing aids! #Geriatrics",,@AmerGeriatrics @EWidera @geri_doc,#AGS19 #Geriatrics,1124715084662468608,https://twitter.com/swchow/status/1124715084662468608
2019-05-04 16:28:33,swchow,,0,0,0,"#AGS19 @AmerGeriatrics @EWidera @geri_doc Sarcastic Drum Roll: ""Honored"" winner of Drug of the year Pimavanserin (Nuplazid) $3000/month - 5HT2A inverse agonist and antagonist w/o dopamine D2 affinity. 2016 - Parkinson psychosis. Does it work for Alz Dz psychosis? Data says NOPE.",,@AmerGeriatrics @EWidera @geri_doc,#AGS19,1124712428632064000,https://twitter.com/swchow/status/1124712428632064000
2019-05-04 16:26:23,BelindaSetters,,1,1,1,"Nuplazid effective for Pseudo-bulbar Affect, But is actually just more sedating in other #dementia pts. #AGS19 #Geriatrics",,,#dementia #AGS19 #Geriatrics,1124711880277151744,https://twitter.com/BelindaSetters/status/1124711880277151744
2019-05-04 16:20:03,sarabwanderer,,0,0,1,"And the winner of the overpriced ($3k/mo.) questionably (in)effective and overhyped drug of the year award goes to...Nuplazid (pimavanserin). No sig. difference btwn. drug and placebo for AD psychosis. #AGS19",,,#AGS19,1124710288480133125,https://twitter.com/sarabwanderer/status/1124710288480133125
2019-05-04 16:18:05,BelindaSetters,,1,1,3,"Here it comes: Drug of the Year Award! #AGS19 Nuplazid approves for #ParkinsonsDisease psychosis but can it be used for #Alzheimers #Dementia ?",,,#AGS19 #ParkinsonsDisease #Alzheimers #Dementia,1124709794034544640,https://twitter.com/BelindaSetters/status/1124709794034544640
2019-05-04 16:15:46,doctatum,,0,0,1,"@EWidera @geri_doc what happens if hospitalized older adults in Pamplona run with the bulls? #ags19 And do they need Nuplazid before running?",,@EWidera @geri_doc,#ags19,1124709209889619968,https://twitter.com/doctatum/status/1124709209889619968
2019-05-03 18:45:31,eskay1954,,0,0,0,"@EatingWorms Nuplazid does not save them, only help with hallucinations!",,@Eatingworms,,1124384509439488002,https://twitter.com/eskay1954/status/1124384509439488002
2019-05-03 17:05:48,cmencke,,0,1,0,"AwesomeCapital: Acadia hopes for new indications for Nuplazid https://awesomecapital.blogspot.com/2019/05/acadia-hopes-for-new-indications-for.html?spref=tw",,,,1124359412875968512,https://twitter.com/cmencke/status/1124359412875968512
2019-05-03 15:30:25,Vantageanalysis,,0,0,0,"Upcoming events – Acadia hopes for new indications for Nuplazid https://www.evaluate.com/vantage/articles/events/upcoming-events/upcoming-events-acadia-hopes-new-indications-nuplazid $ACAD",,,,1124335408299507714,https://twitter.com/Vantageanalysis/status/1124335408299507714
2019-05-03 14:53:03,cafepharma,,0,0,0,"Upcoming events – Acadia hopes for new indications for Nuplazid http://dlvr.it/R40ZDQ",,,,1124326004992831489,https://twitter.com/cafepharma/status/1124326004992831489
2019-05-03 04:08:34,SiteFocusHQ,,0,0,0,"$ACAD Qualitative Analysis of recent earnings identified ACADIA Pharmaceuticals Inc (NASDAQ: ACAD ) business focus on (campaign,dtc,nuplazid), (campaign,dtc,positive), (campaign,dtc,growth) https://www.sitefocus.com/cif/cifqbainq?ajencparm=Y0ngTYu0J%2Fb32MkFbLYScCWGCHJkQeQwxnWemWWTInmvuQKbpLkLgb1SSXPTKVsE0wmmJPrZq5TNsgZ1dgBrEXK5PgdH",,,,1124163817884094464,https://twitter.com/SiteFocusHQ/status/1124163817884094464
2019-05-02 23:07:35,MaisaCorp,,0,0,1,"$ACAD its revenue rise 28.8% over year-ago levels to $62.96 million, topping the $60.93 million analyst mean. $ACAD expected sales range for its Nuplazid medication by $5 million, now looking for between $280 million and $300 million in sales for the Parkinson's treatment",,,,1124088073313189888,https://twitter.com/MaisaCorp/status/1124088073313189888
2019-05-02 00:16:17,KrstevskiBranko,,0,2,0,"Nuplazid sales grow by 5.7% quarter over quarter. $ACAD",,,,1123742973953486849,https://twitter.com/KrstevskiBranko/status/1123742973953486849
2019-05-01 20:56:14,MarketCurrents,,0,1,0,"$ACAD - Acadia Q1 Nuplazid sales up 29% ",,,,1123692626971119617,https://twitter.com/MarketCurrents/status/1123692626971119617
2019-04-30 00:52:51,tkailua,VABVOX,1,1,5,"Holy crap! My hubby needs Nuplazid for Parkinson’s psychosis. I was quoted $1,098 per mo, 30 pills, and that is WITH insurance. Can’t do it...",,,,1123027401070354432,https://twitter.com/tkailua/status/1123027401070354432
2019-04-29 23:09:37,eskay1954,,0,0,0,"@seemslogical Don’t forget the DOJ investigation into the marketing practices of Nuplazid! Stay away!",,@SeemsLogical,,1123001420532285441,https://twitter.com/eskay1954/status/1123001420532285441
2019-04-29 02:46:18,ForTheRecord01,,1,2,5,"$acad Parkinson's patient: ""Nuplazid gave me my life back."" Without the drug, her husband says, she would be institutionalized. ",,,,1122693562020184064,https://twitter.com/ForTheRecord01/status/1122693562020184064
2019-04-28 21:05:29,eskay1954,,0,0,0,"@Scorpio244 That analyst is an idiot! Calling INTC back to $57? ACAD has DOJ &amp; CNN investigating Nuplazid! Would not touch it!",,@scorpio244,,1122607791326355456,https://twitter.com/eskay1954/status/1122607791326355456
2019-04-25 14:38:15,bethelightgb,,0,0,0,"Acadia Pharma launches late-stage development of Nuplazid in MDD http://bit.ly/2J1Adp8",,,,1121423178931294208,https://twitter.com/bethelightgb/status/1121423178931294208
2019-04-25 13:36:52,MarketCurrents,,0,0,2,"$ACAD - Acadia Pharma launches late-stage development of Nuplazid in MDD ",,,,1121407732823642112,https://twitter.com/MarketCurrents/status/1121407732823642112
2019-04-24 17:45:38,JJG2017,SueWagnerWhite,0,0,0,"And the FDA essentially lets drug companies do the research. FDA ""reviews"" their findings......LOOK AT THERANOS!!!! Being a drug prescriber/doctor, look at Viox, Zelnorm, Bextra, Cylert, neutropec/palladone, porter, Nuplazid.....all FDA Approved and fought legally by the FDA....",,,,1121107946434375680,https://twitter.com/JJG2017/status/1121107946434375680
2019-04-24 15:55:06,semodough,,0,1,4,"Baml $ACAD, Buy, PO $28): estimate $62mn (prev. $64mn) Nuplazid sales in 1Q. We expect ph 3 ENHANCE schizophrenia inadequate response topline results in mid-2019. Update our estimates; reiterate Buy, PO $28.",,,,1121080131785777152,https://twitter.com/semodough/status/1121080131785777152
2019-04-23 16:30:19,PharmaTechFocus,,0,0,1,"With gaps in Parkinson’s treatment, promising pipeline drugs may address key unmet needs #gocovri #nuplazid #levodopa https://www.pharmaceutical-technology.com/comment/parkinsons-disease-treatment-2019/",,,#gocovri #nuplazid #levodopa,1120726604777435136,https://twitter.com/PharmaTechFocus/status/1120726604777435136
2019-04-22 21:18:10,uncommoncom,eravacycline,1,0,0,"It doesn’t seem anything you tweet has anything to do with the drug Nuplazid. What am I missing?",,,,1120436655775784961,https://twitter.com/uncommoncom/status/1120436655775784961
2019-04-21 00:33:34,sbradleywilson,,0,0,0,"So basically Trump supporters need Nuplazid to get over their delusion. https://youtu.be/iwxjkNXy1o0",,,,1119761056228835329,https://twitter.com/sbradleywilson/status/1119761056228835329
2019-04-20 00:45:31,TokisMom73,,0,0,3,"Everyone needs to have Nuplazid dosing information sent to hair dumpf's (yes I decided to spell it that way) house.",,,,1119401673179443201,https://twitter.com/TokisMom73/status/1119401673179443201
2019-04-19 20:42:13,ForTheRecord01,ForTheRecord01,0,2,3,"Most importantly, Nuplazid will have the demenia-related psychosis indication all to itself if approved. No branded competition, that is to say; it's highly unlikely docs will prescribe cheaper antispsychotics off label given the frailty of the elderly population.",,,,1119340445765554177,https://twitter.com/ForTheRecord01/status/1119340445765554177
2019-04-19 20:36:56,ForTheRecord01,Biotech2050,1,0,2,"The last 2 sentences of the abstract assure us that there will be no SSIA competition to Nuplazid in the near future: ",,,,1119339117899210752,https://twitter.com/ForTheRecord01/status/1119339117899210752
2019-04-19 18:30:41,ForTheRecord01,,0,1,2,"In Oct. 2017, the FDA granted Nuplazid breakthrough-therapy designation for dementia-related psychosis. Last fall Nuplazid was shown to work adjunctively for major depressive disorder. It is now in phase 3 testing for that indication.",,,,1119307344221888512,https://twitter.com/ForTheRecord01/status/1119307344221888512
2019-04-16 13:54:11,Josef86735145,,0,0,0,"lol, nuplazid commercial is for Parkinson's disease, It says people with the disease have delusional and hallucinations. Hummm, sounds like Democrats, maybe..... You know, Probably, Huh.",,,,1118150600045125632,https://twitter.com/Josef86735145/status/1118150600045125632
2019-04-15 04:15:24,Biotech2050,,0,0,0,"#PIMAVANSERIN IN #ALZHEIMER’S #DISEASE #PSYCHOSIS: EFFICACY IN #PATIENTS WITH MORE PRONOUNCED #PSYCHOTIC #SYMPTOMS $ACAD @Clive_Ballard @UofE_Research #nuplazid http://www.jpreventionalzheimer.com/3268-pimavanserin-in-alzheimers-disease-psychosis-efficacy-in-patients-with-more-pronounced-psychotic-symptoms.html",,@Clive_Ballard @UofE_Research,#PIMAVANSERIN #ALZHEIMER #DISEASE #PSYCHOSIS #PATIENTS #PSYCHOTIC #SYMPTOMS #nuplazid,1117642553615093760,https://twitter.com/Biotech2050/status/1117642553615093760
2019-04-14 18:30:51,ForTheRecord01,,0,2,6,"$IBB There is no FDA-approved drug for dementia-related psychosis, a malady affecting 10 to 20 million people worldwide. After June, interim results from a phase 3 trial with Nuplazid ($ACAD) will be released. Nuplazid has FDA breakthrough-therapy status in this indication.",,,,1117495445909934081,https://twitter.com/ForTheRecord01/status/1117495445909934081
2019-04-12 16:17:50,SolarMelt,,1,2,5,"$ACAD Nice Pipeline. Huge potential from Nuplazid (aka Pimavanserin), which is already approved in PDP. Well established safety and tolerability profile. ",,,,1116737198630604801,https://twitter.com/SolarMelt/status/1116737198630604801
2019-04-11 13:25:04,UofE_Research,,0,2,4,"MT @Biotech2050: #dementia video by @Clive_Ballard https://youtu.be/gKZGL1VtD1w The drug mentioned by Prof Baalard which is approved in US is #nuplazid by $ACAD for #psychosis and could also be approved if successful in #dementia #schizophrenia #MDD major depressive disorder.",,@Biotech2050 @Clive_Ballard,#dementia #nuplazid #psychosis #dementia #schizophrenia #MDD,1116331329854033925,https://twitter.com/UofE_Research/status/1116331329854033925
2019-04-11 12:34:56,Biotech2050,,0,0,0,"For those wanting to hear more about $ACAD #nuplazid in #dementia #psychosis #Alzheimers the below is another video clip @Clive_Ballard",,@Clive_Ballard,#nuplazid #dementia #psychosis #Alzheimers,1116318715170172928,https://twitter.com/Biotech2050/status/1116318715170172928
2019-04-11 12:27:03,Biotech2050,,1,0,1,"#dementia video by @Clive_Ballard @UofE_Research https://youtu.be/gKZGL1VtD1w The drug mentioned by Prof Baalard which is approved in US is #nuplazid by $ACAD for #psychosis and could also be approved if successful in #dementia #schizophrenia #MDD major depressive disorder.",,@Clive_Ballard @UofE_Research,#dementia #nuplazid #psychosis #dementia #schizophrenia #MDD,1116316729221709826,https://twitter.com/Biotech2050/status/1116316729221709826
2019-04-08 13:16:39,OnceDailyPharma,,0,0,0,"New post: Nuplazid Email: “What to expect from NUPLAZID® (pimavanserin)” http://oncedailypharma.com/2019/nuplazid-email-what-to-expect-from-nuplazid-pimavanserin?utm_campaign=wp-to-tweet&amp;utm_medium=twitter&amp;utm_source=twitter #digitalpharma",,,#digitalpharma,1115242051359133697,https://twitter.com/OnceDailyPharma/status/1115242051359133697
2019-04-05 22:21:27,RBrawer,kfcarter,0,0,4,"So true..my mother was recently given a trial pack Nuplazid and it definitely made a big difference. The problem is Medicare D doesn’t cover it and the cheapest I can find it for is $2759/30 pills. Shame!",,,,1114291989325996033,https://twitter.com/RBrawer/status/1114291989325996033
2019-04-04 02:52:30,ChrisPaigeLCSW,,0,0,1,"Another pharma favorite, ""Don't take Nuplazid if you are allergic to the ingredients of Nuplazid."" How does someone know before hand they are allergic to the ingredients of a drug, well i think we are all allergic to them anyways.",,,,1113635426693263361,https://twitter.com/ChrisPaigeLCSW/status/1113635426693263361
2019-04-03 23:22:03,eskay1954,,0,0,0,"@imakemoney i love ACAD but they got 2 investigations into Nuplazid",,@imakemoney,,1113582462905483264,https://twitter.com/eskay1954/status/1113582462905483264
2019-04-03 14:54:48,TrialsiteN,,0,0,1,"Is it Time to #Yank #Parkinson’s Drug #Nuplazid Off the Market? https://www.trialsitenews.com/is-it-time-to-yank-parkinsons-drug-nuplazid-off-the-market/ via @Trial Site News #pulldrugoffmarket #patientsafety #healthcare #parkinsonsdisease",,@Trial,#Yank #Parkinson #Nuplazid #pulldrugoffmarket #patientsafety #healthcare #parkinsonsdisease,1113454811670765569,https://twitter.com/TrialsiteN/status/1113454811670765569
2019-04-03 13:41:24,OnceDailyPharma,,0,0,0,"New post: Nuplazid Email: “Finding hope through the experience of others” http://oncedailypharma.com/2019/nuplazid-email-finding-hope-through-the-experience-of-others?utm_campaign=wp-to-tweet&amp;utm_medium=twitter&amp;utm_source=twitter #digitalpharma",,,#digitalpharma,1113436340522299392,https://twitter.com/OnceDailyPharma/status/1113436340522299392
2019-04-02 22:13:00,NadrichCohen,,0,0,0,"In the wake of a high number of death reports submitted to the federal #government about patients taking #Nuplazid, the #FDA conducted a #safety evaluation last year. #health #Parkinsons #medication",,,#government #Nuplazid #FDA #safety #health #Parkinsons #medication,1113202699250667520,https://twitter.com/NadrichCohen/status/1113202699250667520
2019-04-02 21:40:05,LS_HelpID,,0,0,0,"Missed It? Safety watchdog questions #FDA's approval of #Parkinson's #psychosis drug, #Nuplazid. #CNN: http://ht.ly/obwf30og",,,#FDA #Parkinson #psychosis #Nuplazid #CNN,1113194414996959232,https://twitter.com/LS_HelpID/status/1113194414996959232
2019-04-02 20:51:03,ForTheRecord01,,0,0,1,"$acad Vanderbilt Medical Center study (2016-2018): -- 76% of patients receiving Nuplazid (pimavanserin) showed clinical improvement. -- Patients with dementia, delusions &amp; prior antipsychotic failure improved with pimavanserin. See https://www.ncbi.nlm.nih.gov/pubmed/30924099",,,,1113182076008669184,https://twitter.com/ForTheRecord01/status/1113182076008669184
2019-04-02 20:20:24,ForTheRecord01,pharmalot,0,0,0,"Scores of patients report seeing enormous relief of symptoms with Nuplazid: ",,,,1113174362977271808,https://twitter.com/ForTheRecord01/status/1113174362977271808
2019-04-02 20:00:33,statnews,,0,2,3,"STAT Plus: The group says a recent FDA review of the controversial Parkinson's psychosis drug Nuplazid “provides no new reassurance"" that the benefits of the treatment outweigh its risks. ",,,,1113169368450465792,https://twitter.com/statnews/status/1113169368450465792
2019-04-01 20:40:07,LS_HelpID,,0,0,0,"Health News: Safety watchdog questions #FDA's approval of #Parkinson's #psychosis drug, #Nuplazid. #CNN: http://ht.ly/obwf30ogGwx",,,#FDA #Parkinson #psychosis #Nuplazid #CNN,1112816937657139202,https://twitter.com/LS_HelpID/status/1112816937657139202
2019-04-01 18:45:07,consumersafetyw,,0,0,0,"In the wake of a high number of death reports submitted to the federal government about patients taking Nuplazid, the FDA conducted a safety evaluation last year. It announced in September... https://www.cnn.com/2019/03/28/health/nuplazid-ismp-safety-watchdog-report/index.html",,,,1112787996493770752,https://twitter.com/consumersafetyw/status/1112787996493770752
2019-03-31 17:07:20,eskay1954,,0,0,0,"@bra1loga I loved ACAD but they have a DOJ and CNN investigation into Nuplazid so I sold my 3k shares last week",,@Bra1loga,,1112400999652708352,https://twitter.com/eskay1954/status/1112400999652708352
2019-03-31 09:48:31,hhask,,0,0,0,"Justice Department launches probe into Acadia's Nuplazid marketing ",,,,1112290566824488962,https://twitter.com/hhask/status/1112290566824488962
2019-03-31 01:32:59,MyPartOfReality,,0,0,0,"The advertising for Nuplazid is concerning. It seems to be targeted at patients experiancing side effects of other Parkinsons medicines to lead patients to believe it is the solution and ask their dr. for that med instead of changing from the med causing the side effect.",,,,1112165862906171393,https://twitter.com/MyPartOfReality/status/1112165862906171393
2019-03-29 15:40:06,lindammcsherry,,0,0,0,"ISMP Report Questions Nuplazid Safety, FDA Approval And Lack Of Warnings ",,,,1111654272079446016,https://twitter.com/lindammcsherry/status/1111654272079446016
2019-03-29 15:36:14,NC4HR,,0,0,1,"Nuplazid is supposed to help Parkinson’s patients with psychosis, but many patients taking it are dying. FDA says that the drug has risks that patients are warned about. We agree with this careful analysis by Institute for Safe Medication Practices... ",,,,1111653298623397888,https://twitter.com/NC4HR/status/1111653298623397888
2019-03-29 15:34:55,AboutLawsuits,,0,0,0,"ISMP Report Questions Nuplazid Safety, FDA Approval And Lack Of Warnings https://www.aboutlawsuits.com/nuplazid-review-questioned-155216/",,,,1111652967021797376,https://twitter.com/AboutLawsuits/status/1111652967021797376
2019-03-29 08:54:06,ForTheRecord01,,0,2,4,"$acad In the last 2 years, 10 months, Nuplazid has netted Acadia over $400 million -- and this in an indication for which there was previously no diagnostic code.",,,,1111552099551051777,https://twitter.com/ForTheRecord01/status/1111552099551051777
2019-03-29 08:51:51,ForTheRecord01,,0,0,2,"$acad 3 years ago today: The FDA Advisory Committee recommended approval of Nuplazid with a 11-3 vote in favor of safety and 12-2 in favor of efficacy.",,,,1111551532271456256,https://twitter.com/ForTheRecord01/status/1111551532271456256
2019-03-29 00:15:40,eskay1954,,1,0,0,"$ACAD I am worried about DOJ investigation into Nuplazid,! I would HATE to wake up one day and read that Nuplazid sales were halted! I’m out",,,,1111421631002337286,https://twitter.com/eskay1954/status/1111421631002337286
2019-03-28 22:09:49,ForTheRecord01,,0,3,2,"$acad ""Treatment with Nuplazid has a lower risk for mortality compared to Seroquel (quetiapine) or combination therapy"": ",,,,1111389958063833091,https://twitter.com/ForTheRecord01/status/1111389958063833091
2019-03-28 21:55:54,ForTheRecord01,,0,0,2,"$acad In the recent depression trial, 0 patients died taking Nuplazid. In fact, more people discontinued the trial taking placebo than taking Nuplazid. See ",,,,1111386458294673408,https://twitter.com/ForTheRecord01/status/1111386458294673408
