date,username,to,replies,retweets,favorites,text,geo,mentions,hashtags,id,permalink
2019-01-28 01:28:56,RJ1340,,0,0,0,"In a TV ad for #Parkinsonsdisease medication Nuplazid, a woman says that her husband started believing things that aren't true. Is it possible that all Trumpsters have #Parkinson ? Quarantine #Trump rallies! #TrumpRussiaConspiracy #TrumpCrimeFamily @morningmika @SRuhle",,@morningmika @SRuhle,#Parkinsonsdisease #Parkinson #Trump #TrumpRussiaConspiracy #TrumpCrimeFamily,1089696798350860288,https://twitter.com/RJ1340/status/1089696798350860288
2019-01-28 00:26:58,ChronicSpunky,,0,0,2,"#Nuplazid, as an early onset Parkinson’s patient, your commercial sucks. It is not entirely accurate, and quite a scare tactic for some of us. #notafan #scaretactics",,,#Nuplazid #notafan #scaretactics,1089681201323958273,https://twitter.com/ChronicSpunky/status/1089681201323958273
2019-01-27 20:28:21,Outtascope,,0,0,0,"TV was on in the background, only partially listening to what I thought was a news story about Trump's base. Turns out it was an ad for Nuplazid.",,,,1089621152148930565,https://twitter.com/Outtascope/status/1089621152148930565
2019-01-27 00:58:26,eskay1954,,0,0,0,"@Nogutsnoglory1 @tsingyuan @stocksplus No it will be different, Wait till Nuplazid is approved for two more indications, 40 or 50 $stock!",,@nogutsnoglory1 @tsingyuan @StocksPlus,,1089326733147467776,https://twitter.com/eskay1954/status/1089326733147467776
2019-01-27 00:57:55,JoshuaClendenon,,1,0,1,"@AnnaVocino, was that you in the Nuplazid add? Sure sounded like you!",,@AnnaVocino,,1089326603535110144,https://twitter.com/JoshuaClendenon/status/1089326603535110144
2019-01-25 14:49:25,now_pharma,,0,0,0,"Nuplazid Rx: treatment of Parkinson's disease psychosis Cost: $2,759 for 60 tablets #Pharmatransparency",,,#Pharmatransparency,1088811081517228032,https://twitter.com/now_pharma/status/1088811081517228032
2019-01-24 06:36:45,kiffa_kitmouse,,0,0,0,"Every time I see that Nuplazid ad, I feel so bad for older James Van Der Beek ",,,,1088324708725084160,https://twitter.com/kiffa_kitmouse/status/1088324708725084160
2019-01-23 03:51:48,Kittylew,,1,0,1,"@AnnaVocino Did I just hear your fantastic voice on a commercial for some medicine called Nuplazid?? Best voice in the business !!",,@AnnaVocino,,1087920811577470976,https://twitter.com/Kittylew/status/1087920811577470976
2019-01-23 02:33:20,OnceDailyPharma,,0,0,0,"New post: Patient Email from Nuplazid: “You signed up to learn more. We’re happy to help” http://oncedailypharma.com/2019/patient-email-from-nuplazid-you-signed-up-to-learn-more-were-happy-to-help?utm_campaign=wp-to-tweet&amp;utm_medium=twitter&amp;utm_source=twitter #digitalpharma",,,#digitalpharma,1087901063825539074,https://twitter.com/OnceDailyPharma/status/1087901063825539074
2019-01-23 01:30:27,eskay1954,,1,0,0,"@Biotech_Beast Soon NUPLAZID is going to be a blockbuster drug so I am just holding my shares and I don’t really look at the price much!",,@Biotech_Beast,,1087885238213189633,https://twitter.com/eskay1954/status/1087885238213189633
2019-01-23 00:53:18,eagle123kp,,0,0,0,"The Democrats need to take Nuplazid the new anti delusion drug",,,,1087875887809347584,https://twitter.com/eagle123kp/status/1087875887809347584
2019-01-21 15:47:02,MikeSains,djs510,0,0,0,"What’d you make of last night? I was shocked to see a nuplazid ad / my secret visitors, they come to me at night situation. But it worked.",,,,1087376030606733320,https://twitter.com/MikeSains/status/1087376030606733320
2019-01-21 15:45:59,rwkolo,,0,0,0,"With this medication, it states that you won’t believe things that are not accurate. I encourage trump republicans to ask their doctor about this prescription. Please watch. Nuplazid Commercial (2018) https://youtu.be/iwxjkNXy1o0 via @YouTube",,@YouTube,,1087375766575296513,https://twitter.com/rwkolo/status/1087375766575296513
2019-01-20 21:47:53,semodough,,0,0,6,"$ACAD recovery of the Nuplazid launch.1) interim Phase 3 data for pimavanserin in dementia-related psychosis (DRP) in 2H19; (2) Phase 3 data pimavanserin in schizophrenia with inadequate response to antipsychotics in ~mid-2019;initiation of Phase 3 for pimavanserin MMD in 2H19;",,,,1087104452291641344,https://twitter.com/semodough/status/1087104452291641344
2019-01-19 23:17:32,BridgetH222,cyndarelli_h,0,0,0,"You might want to ask your doctor about Nuplazid. It's for when you start believing things that are clearly not true.",,,,1086764627508248581,https://twitter.com/BridgetH222/status/1086764627508248581
2019-01-18 20:51:13,ESRDguy,,0,0,0,"Nuplazid is dangerous! @NBC @MSNBC with NO SOCIAL CONSCIOUSNESS JUST #GREED doesn't care about viewers. Interested only in #BigPharma #BloodMoney! @NBC &amp; execs are dangerous drug dealers 24/7/365! #SHAME!!!",,@nbc @MSNBC @nbc,#GREED #BigPharma #BloodMoney #SHAME,1086365417742819328,https://twitter.com/ESRDguy/status/1086365417742819328
2019-01-18 16:00:43,Ingentium_PD,,0,0,0,"Acadia looks to 'blow up the paradigm' with Parkinson's psychosis drug Nuplazid https://magazine.ingentium.com/2019/01/17/acadia-looks-to-blow-up-the-paradigm-with-parkinsons-psychosis-drug-nuplazid/ #ingentium #parkinsonsdisease",,,#ingentium #parkinsonsdisease,1086292307383672832,https://twitter.com/Ingentium_PD/status/1086292307383672832
2019-01-18 05:20:39,mastersrock222,,0,0,0,"#Acadia looks to `blow up the paradigm` with Nuplazid https://www.pharmacompass.com/radio-compass-news/science/acadia-looks-to-blow-up-the-paradigm-with-nuplazid#.XEFiHUg4_Zg.twitter",,,#Acadia,1086131232214315008,https://twitter.com/mastersrock222/status/1086131232214315008
2019-01-17 21:59:44,ForeverABoomer,,0,0,1,"OMG! Thanks to pharma commercials, I now know definitively what's wrong with Trump supporters and viewers of Fox News. Ask your doctor about taking NUPLAZID.... Parkinson symptom is ""believing things that AREN'T TRUE."" Don't believe me? (you probably have Parkinsons), watch ad!",,,,1086020269171400704,https://twitter.com/ForeverABoomer/status/1086020269171400704
2019-01-17 14:22:07,bret_jensen,,0,0,1,"$ACAD Solid piece on the progress Acadia Pharmaceuticals is making with the roll out of Nuplazid..",,,,1085905107705913345,https://twitter.com/bret_jensen/status/1085905107705913345
2019-01-17 06:57:55,Biotech2050,,0,1,2,"$ACAD looks to 'blow up the paradigm' with #Parkinson's #psychosis drug #Nuplazid ",,,#Parkinson #psychosis #Nuplazid,1085793321719455745,https://twitter.com/Biotech2050/status/1085793321719455745
2019-01-16 21:24:58,KKurbs,,0,0,0,"Acadia looks to 'blow up the paradigm' with Parkinson's psychosis drug Nuplazid http://twib.in/l/qjKby9ELdrkB #pharma",,,#pharma,1085649131652079618,https://twitter.com/KKurbs/status/1085649131652079618
2019-01-16 19:09:14,crashpalace,,0,1,0,"Acadia looks to 'blow up the paradigm' with Parkinson's psychosis drug Nuplazid https://www.fiercepharma.com/marketing/acadia-looks-to-blow-up-paradigm-parkinson-s-psychosis-drug-nuplazid",,,,1085614975002050564,https://twitter.com/crashpalace/status/1085614975002050564
2019-01-16 18:45:00,CarlyHFierce,,0,2,2,"Acadia looks to 'blow up the paradigm' with Parkinson's psychosis drug Nuplazid: http://bit.ly/2QSlihA $ACAD #pharma",,,#pharma,1085608876450480129,https://twitter.com/CarlyHFierce/status/1085608876450480129
2019-01-16 17:39:00,FiercePharma,,0,0,1,"Acadia looks to 'blow up the paradigm' with Nuplazid https://www.fiercepharma.com/marketing/acadia-looks-to-blow-up-paradigm-parkinson-s-psychosis-drug-nuplazid",,,,1085592266570313728,https://twitter.com/FiercePharma/status/1085592266570313728
2019-01-15 04:22:57,chrisburdick,,0,0,0,"I love this Nuplazid commercial, where the guy looks at his dog and hallucinates that a smaller dog, of a different breed, is sitting next to it. If you’re going to dream, dream big!",,,,1085029548398276608,https://twitter.com/chrisburdick/status/1085029548398276608
2019-01-11 00:25:26,ForTheRecord01,FAT2FIT7,0,0,0,"How would you define ""successful""? Since its debut on May 31, 2016, Nuplazid has yielded net sales of over $350 million. The drug has received 2 write-ups in The Lancet and earned 2 breakthrough-therapy designations from the FDA. This is pretty good for a rookie.",,,,1083520222156414976,https://twitter.com/ForTheRecord01/status/1083520222156414976
2019-01-11 00:25:11,pgallup68,realDonaldTrump,0,0,0,"You need Nuplazid.",,,,1083520159590027270,https://twitter.com/pgallup68/status/1083520159590027270
2019-01-11 00:16:20,ForTheRecord01,ForTheRecord01,0,0,0,"3) Finally, schizophrenia: Nuplazid has been shown to work well when paired with an existing anti-psychotic (e.g., risperidone). It offers a superior safety profile compared to other drugs commonly prescribed (Abilify, clozapine, etc.).",,,,1083517931638611969,https://twitter.com/ForTheRecord01/status/1083517931638611969
2019-01-11 00:13:32,ForTheRecord01,ForTheRecord01,1,0,0,"2) Nuplazid will not compete with SAGE's drug &amp; other drugs in the MDD space. Its purpose is adjunctive therapy for treatment-resistant depression. It is the only FDA-approved selective serotonin inverse agonist on the market.",,,,1083517225674235905,https://twitter.com/ForTheRecord01/status/1083517225674235905
2019-01-11 00:10:52,ForTheRecord01,FAT2FIT7,1,0,0,"1) Acadia will have the dementia-related psychosis space to itself. There is no FDA-approved drug in that indication; Nuplazid has breakthrough-therapy status. There are between 1 and 2 million Americans suffering from DRP.",,,,1083516558012440576,https://twitter.com/ForTheRecord01/status/1083516558012440576
2019-01-10 21:25:01,TalkMarkets,,0,0,0,"#Acadia Jumps After Highlighting Nuplazid Opportunity In PDP Treatment $ACAD https://goo.gl/x9qx4D",,,#Acadia,1083474818681458688,https://twitter.com/TalkMarkets/status/1083474818681458688
2019-01-10 21:17:36,MaisaCorp,,0,0,0,"$ACAD expects fourth-quarter revenue from its Nuplazid drug, the only approved treatment for Parkinson's disease psychosis, or PDP, to surge 64% from a year earlier to $58.3 million as 2018 sales are seen at between $220 million to $225 million.",,,,1083472952803422210,https://twitter.com/MaisaCorp/status/1083472952803422210
2019-01-10 19:30:23,7LadyQ,,0,0,0,"$ACAD Acadia jumps after higlighting Nuplazid opportunity in PDP treatment $ACAD https://bit.ly/2VIgzCD",,,,1083445969881088000,https://twitter.com/7LadyQ/status/1083445969881088000
2019-01-10 19:30:15,cmencke,,0,1,0,"AwesomeCapital: Acadia jumps after higlighting Nuplazid opportunit... https://awesomecapital.blogspot.com/2019/01/acadia-jumps-after-higlighting-nuplazid.html?spref=tw",,,,1083445939065552898,https://twitter.com/cmencke/status/1083445939065552898
2019-01-10 19:30:00,theflynews,,0,2,0,"Acadia jumps after higlighting Nuplazid opportunity in PDP treatment $ACAD https://bit.ly/2VIgzCD",,,,1083445873298890752,https://twitter.com/theflynews/status/1083445873298890752
2019-01-10 19:16:32,theflynews,,0,2,0,"Acadia jumps after higlighting Nuplazid opportunity in PDP treatment $ACAD http://dlvr.it/QwPRhg",,,,1083442485433696257,https://twitter.com/theflynews/status/1083442485433696257
2019-01-10 16:59:32,semodough,,0,0,1,"JP $ACAD Key Update/Takeaway: encouraging updated commercial metrics for Nuplazid in PDPhighlighted many clinical milestones expected over 2019.hold a favorable view of ACAD in light of initial signs of Nuplazid’s commercial recovery in PDP&amp;potential line extensions CNS asset.",,,,1083408009819230208,https://twitter.com/semodough/status/1083408009819230208
2019-01-09 22:40:00,byMattHoffman,,0,0,0,"This guide includes everything you need to know about pimavanserin (Nuplazid, Acadia Pharmaceuticals) for the treatment of delusions and hallucinations associated with Parkinson disease psychosis. ",,,,1083131300771495937,https://twitter.com/byMattHoffman/status/1083131300771495937
2019-01-09 20:24:36,ForTheRecord01,,1,2,6,"$acad Since Nuplazid's debut on May 31, 2016, every fiscal quarter has been superior to the preceding one: ",,,,1083097227516473344,https://twitter.com/ForTheRecord01/status/1083097227516473344
2019-01-09 20:10:17,ForTheRecord01,,2,4,7,"$acad This is how big the market for Nuplazid is -- and the reason some of us are so bullish: ",,,,1083093625037148165,https://twitter.com/ForTheRecord01/status/1083093625037148165
2019-01-09 19:47:24,waltfrasier,,0,0,0,"Watching #nuplazid commercial ""He started believing thingsbthat weren't true"" Is supporting / believing @realDonaldTrump a symptom of Parkinson's Disease? #Parkinsons's Disease",,@realDonaldTrump,#nuplazid #Parkinsons,1083087867159760897,https://twitter.com/waltfrasier/status/1083087867159760897
2019-01-07 03:06:01,LarryNevada,,0,0,0,"Nuplazid.... for Parkinson's is what @realDonaldTrump needs.",,@realDonaldTrump,,1082111081605095424,https://twitter.com/LarryNevada/status/1082111081605095424
2019-01-06 17:58:45,JNap5C,,0,0,4,"Updated 5C Score & Valuation model on $ACAD. Target is below the current price. Comments on P2 MDD data and Nuplazid future posted in the model for VIP members.",,,,1081973357745188864,https://twitter.com/JNap5C/status/1081973357745188864
2019-01-05 02:11:30,BenFuddle,,0,0,0,"Parkinson's could explain @realDonaldTrump. Or he's just a moron. NUPLAZID TV Commercial, 'Seeing Things' - https://www.ispot.tv/ad/dvSu/nuplazid-seeing-things #ispottv",,@realDonaldTrump,#ispottv,1081372585730998273,https://twitter.com/BenFuddle/status/1081372585730998273
2019-01-04 22:12:19,SRetsil,,0,0,0,"The cash price for Nuplazid, a drug for Parkinson’s disease thats advertised on TV is around $2909 for 30 capsules.",,,,1081312397267210240,https://twitter.com/SRetsil/status/1081312397267210240
2019-01-04 21:34:26,DesertPrimrose,,0,0,0,"@WimTilliams I'm curious. I saw a commercial and the actor resembles you but, he looks older. Wasn't sure if it was you, with makeup or someone else. The commercial is for Nuplazid ",,@WimTilliams,,1081302863400189952,https://twitter.com/DesertPrimrose/status/1081302863400189952
2019-01-03 02:11:57,rakgrl,,0,0,0,"Watching a ""Nuplazid"" commercial, I think MAGAt's have Parkinson's, as it says they start to believe things that aren't real. /S",,,,1080647923388551168,https://twitter.com/rakgrl/status/1080647923388551168
2019-01-02 16:36:05,tina41014747,,0,1,1,"This proves toxic tRump’s abilities 2 understand what t/midterms meant 2 him&his party. There is a disease called Parkinson’s where ppl r delusional&see things that rn’t there! Nuplazid is t/medication 2 improve these side effects. Do you think it will help tRump diseased souls? ",,,,1080503002333696000,https://twitter.com/tina41014747/status/1080503002333696000
2019-01-01 16:58:42,zoeythetuna,realDonaldTrump,0,0,0,"Maybe you need Nuplazid to fight the delusions? #TrumpResign",,,#TrumpResign,1080146307593826304,https://twitter.com/zoeythetuna/status/1080146307593826304
2018-12-31 19:41:57,eskay1954,,0,0,1,"$ACAD Just seen a commercial for Nuplazid!!",,,,1079825004353802241,https://twitter.com/eskay1954/status/1079825004353802241
2018-12-30 16:35:39,Lislehouse,,0,0,0,"Donald Trump needs to take Nuplazid",,,,1079415729743687682,https://twitter.com/Lislehouse/status/1079415729743687682
2018-12-29 03:24:43,BlankTV,,0,0,0,"@Nuplazid? You have a pill that will make my Dad more compliant? Are you fucking kidding?",,@nuplazid,,1078854298539384832,https://twitter.com/BlankTV/status/1078854298539384832
2018-12-28 07:11:59,ForTheRecord01,semodough,0,0,1,"Let's not forget $ACAD, which has numerous trials reading out, including ph3 schizophrenia &amp; ph3 dementia-related psychosis. Between 1 &amp; 2 million Americans suffer from DRP. ACAD's drug Nuplazid has FDA breakthrough-therapy in the indication.",,,,1078549105951989763,https://twitter.com/ForTheRecord01/status/1078549105951989763
2018-12-28 07:05:02,ForTheRecord01,,0,0,2,"$IBB Has anyone put together a list of ""biotechs to watch in 2019""? Acadia Pharmaceuticals ($ACAD) should be included on any list. Its lead drug for Parkinson's psychosis, Nuplazid, will likely see significant label expansion, and with it, annual sales in the billions.",,,,1078547354582626306,https://twitter.com/ForTheRecord01/status/1078547354582626306
2018-12-27 17:51:16,KJBinSTL,,0,0,0,"Published a consensus article on switching to Nuplazid® from an atypical (dopamine antagonist) antipsychotic #PDP",,,#PDP,1078347597583138817,https://twitter.com/KJBinSTL/status/1078347597583138817
2018-12-24 13:50:36,Litzz11,,0,0,1,"This ad for Nuplazid where the worried wife says ""he started believing things that weren't true"" just came on TV and at first I thought it was an SNL parody about Trump.",,,,1077199869314514944,https://twitter.com/Litzz11/status/1077199869314514944
2018-12-23 16:37:22,sorin1988,,0,0,0,"A possible cure for Trumpism, Nuplazid?",,,,1076879446962044929,https://twitter.com/sorin1988/status/1076879446962044929
2018-12-22 21:55:55,ShitBake,,0,0,0,"Nuplazid: about $3,000 a month.",,,,1076597226179362816,https://twitter.com/ShitBake/status/1076597226179362816
2018-12-16 17:48:43,eskay1954,,0,0,0,"$ACAD If Nuplazid is approved for Schizophrenia Doctors don’t have to worry about below circled! ",,,,1074360688431255552,https://twitter.com/eskay1954/status/1074360688431255552
2018-12-13 19:48:27,milbo11,,0,0,0,"Nuplazid “Honey, how was work today?” “Great! I came up witha good one!” “Really?” “Yeah. NUPLAZID!”",,,,1073303656458539009,https://twitter.com/milbo11/status/1073303656458539009
2018-12-12 15:57:11,_timos_,,0,2,0,"Acadia debuts first Nuplazid branded ads, aiming to spark talk of Parkinson's psychosis http://dlvr.it/QtSTFF &gt;&gt;&gt; http://lqventures.com #strategy #competitiveintelligence #marketing #healthcare #pharmaceutical #CI #pharma #biotech",,,#strategy #competitiveintelligence #marketing #healthcare #pharmaceutical #CI #pharma #biotech,1072883067058962432,https://twitter.com/_timos_/status/1072883067058962432
2018-12-12 15:26:17,KKurbs,,0,0,0,"Acadia debuts first Nuplazid branded ads, aiming to spark talk of Parkinson's psychosis http://twib.in/l/jrXpqaGjnej8 #pharma",,,#pharma,1072875291230593025,https://twitter.com/KKurbs/status/1072875291230593025
2018-12-10 09:00:47,LawsuitsBot,,0,0,0,"Nuplazid case found! New #lawsuit by The Eichholz Law Firm, P.C.. Follow https://www.thejusticelawyer.com/practice-areas/detail/dangerous-drugs-medical-devices-list to learn more!",,,#lawsuit,1072053501273038848,https://twitter.com/LawsuitsBot/status/1072053501273038848
2018-12-07 22:46:54,Wreklessracr,,0,0,0,"@MarkDice #nuplazid is the new medication for those suffering from #liberalism",,@MarkDice,#nuplazid #liberalism,1071174239053643776,https://twitter.com/Wreklessracr/status/1071174239053643776
2018-12-05 19:58:53,eskay1954,,0,0,0,"@Ortho91 Take a good look at ACAD, Their woes seem behind them and Nuplazid is going to be a game changer in mental health!!",,@Ortho91,,1070407178585026561,https://twitter.com/eskay1954/status/1070407178585026561
2018-12-05 17:11:33,kriebel_ann,,0,0,1,"INVITATION: Blue Grill Bethlehem PA Dec. 5 at 6pm NUPLAZID for TREATMENT of PARKINSON’S PSYCHOSIS Sponsored by Liberty Chapter of GAPNA for NPs and NP students - you do not need to be a member of th... https://libertygapna.enpnetwork.com/nurse-practitioner-news/192351-invitation-blue-grill-bethlehem-pa-dec-5-at-6pm",,,,1070365068070711297,https://twitter.com/kriebel_ann/status/1070365068070711297
2018-12-05 10:23:45,JimMartin2011,,0,0,0,"The Deplorables think they see trump as the 2nd coming......maybe they need to take Nuplazid for those hallucinations?",,,,1070262443002265601,https://twitter.com/JimMartin2011/status/1070262443002265601
2018-12-05 01:15:05,SRetsil,,0,0,1,"Nuplazid, a drug for treating hallucinations associated with Parkinson’s disease is advertised on TV. The cash price for a 30 day supply of capsules is about $2900.",,,,1070124366237761536,https://twitter.com/SRetsil/status/1070124366237761536
2018-12-04 01:08:36,ForTheRecord01,,0,2,2,"$acad All the key opinion leaders Cowen interviewed believe Nuplazid ""will serve well as a treatment for depression."" ",,,,1069760345042968576,https://twitter.com/ForTheRecord01/status/1069760345042968576
2018-12-04 00:25:54,shilohwalker,,0,0,1,"If you think about it, @realDonaldTrump would make a great before/after commercial for nuplazid Assuming he'd take it. ",,@realDonaldTrump,,1069749602188959744,https://twitter.com/shilohwalker/status/1069749602188959744
2018-11-28 19:18:58,kriebel_ann,,0,0,0,"INVITATION: Blue Grill Bethlehem PA Dec. 5 at 6pm - https://www.bluegrillhouse.com/info-hours/visit-us NUPLAZID for TREATMENT of PARKINSON’S PSYCHOSIS for NPs and NP students - you do not need to be a member of th... https://libertygapna.enpnetwork.com/nurse-practitioner-news/192351-invitation-blue-grill-bethlehem-pa-dec-5-at-6pm",,,,1067860418255880193,https://twitter.com/kriebel_ann/status/1067860418255880193
2018-11-25 17:53:42,ShitBake,,0,0,0,"Nuplazid -- $3,300 per month.",,,,1066751797145022465,https://twitter.com/ShitBake/status/1066751797145022465
2018-11-24 19:19:45,ForTheRecord01,,0,1,4,"$acad All the news has been good lately: 1. Sales that beat analyst estimates + a forecast for robust growth. 2. Clinical-trial success in depression. 3. FDA defense of the Nuplazid label against the claims of smear artists. 4. New national TV campaign.",,,,1066411064009445376,https://twitter.com/ForTheRecord01/status/1066411064009445376
2018-11-24 19:11:50,ForTheRecord01,,0,1,2,"$acad $0.00 This is how much Acadia's pipeline currently costs. A pipeline which includes 4 potentially new indications for Nuplazid in addition to trofinetide for Retts, which is expected to see peak sales of over $500 million.",,,,1066409072503664640,https://twitter.com/ForTheRecord01/status/1066409072503664640
2018-11-24 11:07:39,Biotech2050,,0,0,2,"#NUPLAZID TV Commercial, 'Seeing Things' #hallucinations #parkinsons #delusional $ACAD https://www.ispot.tv/ad/dvSu/nuplazid-seeing-things #ispottv",,,#NUPLAZID #hallucinations #parkinsons #delusional #ispottv,1066287221995651072,https://twitter.com/Biotech2050/status/1066287221995651072
2018-11-23 16:52:18,wyominghippie1,,0,0,0,"nuplazid appears to be a drug that stops lovely hallucinations where your dead dog is friends with your living dog as you paint. useful drug, guys. good marketing.",,,,1066011569266470913,https://twitter.com/wyominghippie1/status/1066011569266470913
2018-11-23 15:51:00,GusHinostroza,ChuckGrassley,0,0,1,"So first: this is a bold faced lie. That’s why you don’t recall it happening @ChuckGrassley - because IT NEVER HAPPENED ! You might wanna up that #Nuplazid dosage - you’re hallucinating, sir. ",,@ChuckGrassley,#Nuplazid,1065996142138220545,https://twitter.com/GusHinostroza/status/1065996142138220545
2018-11-23 15:48:59,GusHinostroza,ChuckGrassley,0,0,0,"So first: this is a bold faced lie. That’s why you don’t recall it happening @ChuckGrassley - because IT NEVER HAPPENED ! You might wanna up that #Nuplazid dosage - you’re hallucinating, sir. ",,@ChuckGrassley,#Nuplazid,1065995634421915648,https://twitter.com/GusHinostroza/status/1065995634421915648
2018-11-22 22:02:28,jakewhite77,,0,1,2,"That Nuplazid commercial could be about Trump supporters.",,,,1065727238849478662,https://twitter.com/jakewhite77/status/1065727238849478662
2018-11-22 18:19:08,TheSarge11,NefarusContrara,1,0,3,"Nuplazid commercials. Mom died fm Parkinsons. Which is worse, the disease or the cure?",,,,1065671032734773249,https://twitter.com/TheSarge11/status/1065671032734773249
2018-11-22 15:05:07,SitecoreHacker,,3,0,2,"Today, I am thankful for being able to watch the #MacysParade on @CBS. Except, wait, I interrupt this thank you message for nonstop commercial breaks. Every. Two. Minutes. #ThanksgivingDay2018 #TDayCBS #macysthanksgivingdayparade #Nuplazid ",,@CBS,#MacysParade #ThanksgivingDay2018 #TDayCBS #macysthanksgivingdayparade #Nuplazid,1065622207332794369,https://twitter.com/SitecoreHacker/status/1065622207332794369
2018-11-20 21:25:46,vleino,adamfeuerstein,0,0,0,"Nothing comes close to some turkey with a sprinkle of Nuplazid on top",,,,1064993225990184960,https://twitter.com/vleino/status/1064993225990184960
2018-11-15 17:55:01,JeromeJaco1,zerohedge,0,0,0,"uh, I think he's on Nuplazid.",,,,1063128250937827328,https://twitter.com/JeromeJaco1/status/1063128250937827328
2018-11-09 20:39:51,JAaronAnderson,,1,0,0,"@Vanguard_Group say can we buy acadia #nuplazid stock in our funds ? Is it in the hedge now? Thx @themotleyfool",,@Vanguard_Group @themotleyfool,#nuplazid,1060995403263475712,https://twitter.com/JAaronAnderson/status/1060995403263475712
2018-11-08 11:43:57,semodough,,0,0,3,"GS $ACAD Model changes: raise FY18 Nuplazid sales to high end of guidance; (2) increase R&amp;D expense to reflect company guidance; (3) roll foward our DCF by 3 months. As a result our FY18/19/20 diluted GAAP EPS is ($2.01)/($1.97)/$0.93. Valuation: Our 12-month price target is $20",,,,1060498151243739137,https://twitter.com/semodough/status/1060498151243739137
2018-11-07 21:47:17,adamcifu,,16,1,11,"Nuplazid might be the best (or maybe worst) new drug name since Flomax. Any particular favorites?",,,,1060287597149327361,https://twitter.com/adamcifu/status/1060287597149327361
2018-11-07 20:26:56,Gupta_Calling,,0,0,0,"$ACAD HCW TP $60 07:36 Acadia analyst commentary at H.C. Wainwright Acadia poised to outperform in 2019, says H.C. Wainwright. H.C. Wainwright analyst Andrew Fein expects to see Nuplazid regain momentum following Acadia Pharmaceuticals' Q Read more at: https://thefly.com/landingPageNews.php?id=2819329",,,,1060267378808946701,https://twitter.com/Gupta_Calling/status/1060267378808946701
