date,username,to,replies,retweets,favorites,text,geo,mentions,hashtags,id,permalink
2020-03-15 14:24:13,Emmelineeeeeee,,0,0,0,"Searching the house for paracetamol and ibuprofen- didn’t find much but stubbled upon some much better drugs, diazepam, quetiapine and aripiprazole should get me through convid 19 ok should they?!?",,,,1239195704045842434,https://twitter.com/Emmelineeeeeee/status/1239195704045842434
2020-03-15 13:00:42,Prof_Farmacia,,0,0,0,"Off‐label use of #quetiapine in nursing homes: Does medical specialty of prescribing physicians play a role? @BritJClinPharm | #ECM",,@BritJClinPharm,#quetiapine #ECM,1239174687583883265,https://twitter.com/Prof_Farmacia/status/1239174687583883265
2020-03-15 12:33:52,bagbabenextdoor,,0,0,1,"I think it's time for some Quetiapine ",,,,1239167933600935937,https://twitter.com/bagbabenextdoor/status/1239167933600935937
2020-03-15 12:01:17,RuizLiezl,,1,0,0,"Quetiapine sure makes me drowsy throughout the day. But which one is at fault for my poor appetite? I think I'm fine with Escitalopram. I have to get rid of Quetiapine. I'm cool with antidepressants but antipsychosis is too much for me.",,,,1239159734898266112,https://twitter.com/RuizLiezl/status/1239159734898266112
2020-03-15 11:22:31,bpnnyexol,,0,0,0,"Idontwannacutmyselfagain",,,,1239149975818268672,https://twitter.com/bpnnyexol/status/1239149975818268672
2020-03-15 07:14:38,smiffy,smiffy,0,0,1,"Hope that makes sense, got a regular URTI, and latest manifestation, amongst other things, is screwing with my brain chemistry, so not just spacey, but needing extra question quetiapine. FFS.",,,,1239087596166189056,https://twitter.com/smiffy/status/1239087596166189056
2020-03-15 01:55:09,stay_trashyx,j4des,1,0,0,"I was a mess the entire 2019 and took weeks and months to get the help I needed and when I did they told me it was in my head and recommended behaviour therapy and gave me beta blockers and quetiapine and the mental health system here is a fucking joke tbh",,,,1239007196295368704,https://twitter.com/stay_trashyx/status/1239007196295368704
2020-03-15 01:21:02,stay_trashyx,j4des,1,0,1,"I have only taken it 3 times and first time it knocked me out but last two times took fucking hours to sleep Did ya take quetiapine regularly?it scared me how strong it is People I know who take it take it every night but I got told to only take it when required for anxiety",,,,1238998610479636489,https://twitter.com/stay_trashyx/status/1238998610479636489
2020-03-15 01:19:00,j4des,,1,0,2,"ever since i stopped taking quetiapine, i can’t fall asleep until i’m completely exhausted and i’m only getting like 3-4 hours of sleep. i’m so fed up and i’m not seeing my psychiatrist until mid april. it’s driving me fucking crazy ",,,,1238998097096855552,https://twitter.com/j4des/status/1238998097096855552
2020-03-15 01:06:02,journey2findkay,anewdawn79,1,0,0,"Aww I’m sorry! Def reminds me that we have came sooo far when it comes to mental health",,,,1238994835849138177,https://twitter.com/journey2findkay/status/1238994835849138177
2020-03-15 00:19:00,journey2findkay,D0MXNXQUE,1,0,0,"Same and am hype af for tomorrow",,,,1238982998034239488,https://twitter.com/journey2findkay/status/1238982998034239488
2020-03-15 00:11:13,journey2findkay,pwndbycats78,0,0,1,"My heart goes to all the parents in those situations especially because all of our immune systems do not need the added stress in a time like this ",,,,1238981040690978816,https://twitter.com/journey2findkay/status/1238981040690978816
2020-03-15 00:10:09,journey2findkay,crappy_videos,1,0,1,"Yuppp! Hardest part is my youngest’s district is stating they will be going back on Monday (it was spring break this past week) sooo that’s going to be fun",,,,1238980770141618177,https://twitter.com/journey2findkay/status/1238980770141618177
2020-03-14 23:58:12,journey2findkay,,2,0,3,"Just got notified my eldest is out of school til the 27th...this is a moment where I see my privilege in the fact that I mainly work from home and in the field but I remember the days where this would be catastrophic to my household! Soo many emotions right now.....",,,,1238977764494954496,https://twitter.com/journey2findkay/status/1238977764494954496
2020-03-14 23:34:50,journey2findkay,OnBradstreet,0,0,0,"I’m essentially panicking all day everyday thanks to my #anxiety! I have learned great coping skills that have helped me keep my senses right now also...I essentially live in self/isolation anyway so not too worried about other people ",,,#anxiety,1238971883925602305,https://twitter.com/journey2findkay/status/1238971883925602305
2020-03-14 23:28:53,amyisabellaxox,,0,0,3,"Read Quarantine and chill as Quetiapine and chil, if that's not a mood, I don't know what is ",,,,1238970383417724928,https://twitter.com/amyisabellaxox/status/1238970383417724928
2020-03-14 23:21:27,Jsmooth_2327,ktscoutman,0,0,0,"I was also prescribed Quetiapine for years and was pissed after reading side effects others had and were spot on with how I was feeling. Shit is nasty",,,,1238968516566376448,https://twitter.com/Jsmooth_2327/status/1238968516566376448
2020-03-14 22:07:44,journey2findkay,jacknicas,0,0,0,"That’s what he gets! ",,,,1238949965335900167,https://twitter.com/journey2findkay/status/1238949965335900167
2020-03-14 21:46:16,journey2findkay,,3,0,4,"You know you work in mental health when: you’re yelling at Roseanne (binging the original series always a fav ) to take Darlene to a mental health professional because obviously she’s Della depressed AND it’s been 5 episodes!!! Like...COME ON!! ",,,,1238944561847648256,https://twitter.com/journey2findkay/status/1238944561847648256
2020-03-14 18:34:54,sibylpain,amyisabellaxox,0,0,1,"50mg quetiapine and 20mg fluoxetine, I've not had them since weds/thurs and now I'll have to wait until Monday but w the restriction on gp appointments i doubt i can register now this fuckin pandemic",,,,1238896400383062017,https://twitter.com/sibylpain/status/1238896400383062017
2020-03-14 18:13:17,ashburp2,,2,0,7,"Woke up this morning to @AnaaPatriciaaa on the phone to her mom and my brain couldn't process why I couldn't understand what she was saying....felt so dumb once I fully woke up and remembered it's cause of Portuguese",,@AnaaPatriciaaa,,1238890962493100037,https://twitter.com/ashburp2/status/1238890962493100037
2020-03-14 18:10:48,ashburp2,,1,0,4,"Find me at work wearing gloves to handle money and sanitizing the gloves themselves",,,,1238890336954564609,https://twitter.com/ashburp2/status/1238890336954564609
2020-03-14 18:09:35,ashburp2,Thestellawright,0,0,1,"if you seek Amy",,,,1238890032070606850,https://twitter.com/ashburp2/status/1238890032070606850
2020-03-14 18:08:08,ashburp2,,0,0,3,"Sometimes I test tweet ideas out in the groupchat",,,,1238889664557264897,https://twitter.com/ashburp2/status/1238889664557264897
2020-03-14 16:08:04,Tom1967_1970,itsJeffTiedrich,0,0,0,"Blaming someone else is the Democrat's strategy, Jeff. Get your act together. Take your quetiapine and go to sleep.",,,,1238859449709838336,https://twitter.com/Tom1967_1970/status/1238859449709838336
2020-03-14 13:12:59,quetiapine__,thejoycedasigan,1,0,2,"AKO DIN this hair i want",,,,1238815389489881088,https://twitter.com/quetiapine__/status/1238815389489881088
2020-03-14 12:38:51,NarahSarah,sibylpain,0,0,0,"I get unwell when I miss quetiapine... I get hot and sick and faint and had a sort of ""heavy"" limb effect-- like my limbs were hard to lift. You definitely need your meds to be at your best right now. ",,,,1238806800201383938,https://twitter.com/NarahSarah/status/1238806800201383938
2020-03-14 09:39:24,quetiapine__,,0,0,2,"i said i wont be cutting my hair I SAID I WONT BE CUTTING MY HAIR BUT I MF WANT A BOY CUT NOW",,,,1238761638796210176,https://twitter.com/quetiapine__/status/1238761638796210176
2020-03-14 09:13:37,soapisdone,,0,0,0,"mf quetiapine really not putting me to sleep ffs",,,,1238755150262489088,https://twitter.com/soapisdone/status/1238755150262489088
2020-03-14 06:25:44,DiaryofLydia,,2,0,33,"Finally managed to get through to the mental health support line who told me to have an additional dose of my quetiapine this morning just to try and slow my thoughts down, apparently they’ll call me later to see how I’m doing...",,,,1238712902141517825,https://twitter.com/DiaryofLydia/status/1238712902141517825
2020-03-14 03:36:21,sibylpain,,6,0,8,"wait hold on does missing a few days of fluoxetine and quetiapine actually give you hot flushes or did i invent that cos i think i might just have a fever",,,,1238670273844568064,https://twitter.com/sibylpain/status/1238670273844568064
2020-03-14 02:25:10,journey2findkay,,0,0,1,"Finally able to relax and then a power outage.... I’m over today",,,,1238652358738841600,https://twitter.com/journey2findkay/status/1238652358738841600
2020-03-14 00:57:39,_quetiapine,,0,0,0,"Hehe back to BL bois",,,,1238630338483466241,https://twitter.com/_quetiapine/status/1238630338483466241
2020-03-14 00:57:11,sibylpain,roselyddon,0,0,1,"wait 24 hours once I'm back on quetiapine I'm sure it'll be more manageable",,,,1238630218522333184,https://twitter.com/sibylpain/status/1238630218522333184
2020-03-14 00:40:35,spookyeviie,,1,0,1,"coming off quetiapine is NOT the one, i can’t fkn sleep and withdrawals are gonna kill me before coronavirus does",,,,1238626039687000064,https://twitter.com/spookyeviie/status/1238626039687000064
2020-03-13 23:58:09,ashburp2,,0,1,7,"So here’s what you do. You kids get yourselves a money clip. You can get these at any haberdashery. You put a $50 dollar in the money clip. Then, when a guy flashes a blade, you go, “You want my money? Go get it!” Then you run the other direction.",,,,1238615361932623872,https://twitter.com/ashburp2/status/1238615361932623872
2020-03-13 23:57:28,journey2findkay,,0,0,0,"NEW POLL UP ON PATREON! It is public so go let me know what you think!??? ",,,,1238615192671379456,https://twitter.com/journey2findkay/status/1238615192671379456
2020-03-13 23:52:30,Enginethatcan,,0,0,0,"@KatRamsland Quetiapine is used in the treatment of bipolar disorder; schizoaffective disorder; depression; schizophrenia; major depressive disorder and belongs to the drug class atypical antipsychotics.",,@KatRamsland,,1238613942446014465,https://twitter.com/Enginethatcan/status/1238613942446014465
2020-03-13 23:52:16,Enginethatcan,,0,0,0,"@KatRamsland Pill with imprint LU K73 is Yellow, Capsule-shape and has been identified as Quetiapine Fumarate Extended-Release 200 mg. ...",,@KatRamsland,,1238613882534539267,https://twitter.com/Enginethatcan/status/1238613882534539267
2020-03-13 23:48:55,MumofNoName,,0,0,0,"The higher the dose of quetiapine, the bigger the fucking pill. I'm now down to 50mg of sertraline (useless pill) 150mg of quetiapine &amp; 125mcg of thyroxine aswell as 1000 vitamin d spray... joy of mental health crossing thyroid illness. #stabilisementalhealth #thyroidillness",,,#stabilisementalhealth #thyroidillness,1238613039412371456,https://twitter.com/MumofNoName/status/1238613039412371456
2020-03-13 21:52:00,ashburp2,,0,0,5,"Good news during this terrible time! My ritalin appointment got moved to June!",,,,1238583614079672320,https://twitter.com/ashburp2/status/1238583614079672320
2020-03-13 21:44:32,journey2findkay,Josephine_KK,1,0,1,"I FORGOT ABOUT AMAZON!! Thanks Jo!! Finally going to put that primeto use ",,,,1238581737807941632,https://twitter.com/journey2findkay/status/1238581737807941632
2020-03-13 21:40:40,journey2findkay,Josephine_KK,1,0,1,"Soooo frustrating!! I’m lucky I was able to finally get 4 rolls of the thin kind ",,,,1238580765220171776,https://twitter.com/journey2findkay/status/1238580765220171776
2020-03-13 21:36:55,ashburp2,,0,0,1,"Having a pamper night ",,,,1238579822026260482,https://twitter.com/ashburp2/status/1238579822026260482
2020-03-13 21:31:39,journey2findkay,,3,0,3,"I just need TOILET PAPERRR ",,,,1238578494172348416,https://twitter.com/journey2findkay/status/1238578494172348416
2020-03-13 21:14:41,ashburp2,,0,0,2,"when you have to deep clean everything at work bc of covid-19 and it calms your anxiety and then realize it's probably the ocd speaking",,,,1238574225214132225,https://twitter.com/ashburp2/status/1238574225214132225
2020-03-13 21:08:40,ashburp2,,0,0,1,"Lmao people are already out here faking self isolation just so they don't have to go to class",,,,1238572712416731136,https://twitter.com/ashburp2/status/1238572712416731136
2020-03-13 20:40:30,PatriciaPaiton,SheaSerrano,1,0,2,"I’m going to medical school out here in Arizona & I work as a caregiver around my schooling schedule. I have medications Quetiapine, Fluexotine, &amp; levothroxine. I’m about to run out &amp; they cost $60 alone. My job is on suspension and I have no money coming in, plz anything helps. ",,,,1238565622708989952,https://twitter.com/PatriciaPaiton/status/1238565622708989952
2020-03-13 19:57:24,journey2findkay,NotAntherDrama,2,0,2,"Legit me last night! Like damn I’m just trying to shop like normal and couldn’t get half the stuff I needed like TOILET PAPER ",,,,1238554775601332224,https://twitter.com/journey2findkay/status/1238554775601332224
2020-03-13 19:00:46,journey2findkay,,0,0,3,"Video will be up later this evening! Messed up while trying to upload this morning and I’m booked most of the day smdh! Keep an eye out",,,,1238540524983894016,https://twitter.com/journey2findkay/status/1238540524983894016
2020-03-13 16:37:41,bipolarvoice,,1,0,0,"Quetiapine is not on repeat prescription for me. I normally see the doctor every 2 months to get a new script.",,,,1238504516192010241,https://twitter.com/bipolarvoice/status/1238504516192010241
2020-03-13 16:07:03,empathyspace,,0,0,0,"#Antipsychotics: These are drugs prescribed for individuals to resolve symptoms of hallucinations, delusions, agitation and reconnect with reality. Eg. Olanzapine, Quetiapine, Haloperidol. #empathyspaceng #empathyspace #mentalhealth #health",,,#Antipsychotics #empathyspaceng #empathyspace #mentalhealth #health,1238496805379354624,https://twitter.com/empathyspace/status/1238496805379354624
2020-03-13 15:50:57,okasion2012,okasion2012,1,0,1,"...and I kept telling the doctors that they fucked me up, making me sleep 14 hs, waking up with the throat dry -the doctor was an idiot or didn't believe me, because it told me ""you're taking the smallest dose of quetiapine, there's people walking here taking 300mg and are fine""",,,,1238492754231123969,https://twitter.com/okasion2012/status/1238492754231123969
2020-03-13 14:55:29,ashburp2,,1,0,8,"when your teacher has to hold your hand to deliver news because you thought you were being told to leave the country",,,,1238478795256082439,https://twitter.com/ashburp2/status/1238478795256082439
2020-03-13 13:00:02,elizahcagampang,quetiapine__,1,0,0,"bring your car pasundo po",,,,1238449743665090560,https://twitter.com/elizahcagampang/status/1238449743665090560
2020-03-13 12:26:56,_secret_cloud,,0,0,1,"Should i drink alak and quetiapine???",,,,1238441412439371776,https://twitter.com/_secret_cloud/status/1238441412439371776
2020-03-13 12:15:05,Explodroid,TKbreezy,0,0,0,"Sounds like medication is the only way to go for you then :/ Something like quetiapine that eases your anxiety and helps you relax",,,,1238438428452192256,https://twitter.com/Explodroid/status/1238438428452192256
2020-03-13 11:46:56,_quetiapine,,0,0,1,"I'm going insane nobody knows",,,,1238431346348847106,https://twitter.com/_quetiapine/status/1238431346348847106
2020-03-13 11:18:38,kayeos_,kayeos_,1,0,1,"wHERE CAN I WATCH THIS MISS VICKY",,,,1238424222453514245,https://twitter.com/kayeos_/status/1238424222453514245
2020-03-13 11:18:19,kayeos_,quetiapine__,1,0,1,"omg wow i want",,,,1238424145840369664,https://twitter.com/kayeos_/status/1238424145840369664
2020-03-13 10:38:51,_quetiapine,,0,0,1,"Charot it's the thought of helping people nga pala ",,,,1238414211614568448,https://twitter.com/_quetiapine/status/1238414211614568448
2020-03-13 10:37:03,althcity_,quetiapine__,0,0,1,"is this,,,, gay shit,,,,,,?",,,,1238413760059957250,https://twitter.com/althcity_/status/1238413760059957250
2020-03-13 10:32:25,tworatskissing,,0,0,0,"my quetiapine is a treat for me after class tomorrow so i can take a fat ass nap",,,,1238412594760650753,https://twitter.com/tworatskissing/status/1238412594760650753
2020-03-13 10:17:19,quetiapine__,,2,0,3,"@althcity_ maam panoorin mo Tharntype please",,@althcity_,,1238408791588139008,https://twitter.com/quetiapine__/status/1238408791588139008
2020-03-13 09:07:07,_quetiapine,,0,0,0,"Malunggay is really a holy grail for a forgetful hooman like me ",,,,1238391126081429505,https://twitter.com/_quetiapine/status/1238391126081429505
2020-03-13 08:09:51,ICHM2020,DrAseemMalhotra,0,0,0,"Cardio Metabolic Disorder High blood sugar High blood pressure Olanzapine (Zyprexa) Quetiapine (Seroquel) Thioridazine (Mellaril) Chlorpromazine (Thorazine) Quitting smoking losing weight ",,,,1238376716990627840,https://twitter.com/ICHM2020/status/1238376716990627840
2020-03-13 07:34:34,hyunjinnielbs,,0,0,0,"one of my mates jus snuck me his 100mg quetiapine we stockin up boys",,,,1238367836231221248,https://twitter.com/hyunjinnielbs/status/1238367836231221248
2020-03-13 03:38:48,quetiapine__,DOST_PCHRD,0,0,1,"Thank you po ",,,,1238308505049649153,https://twitter.com/quetiapine__/status/1238308505049649153
2020-03-13 01:38:45,_quetiapine,FarEasternU,0,0,0,"Noted ",,,,1238278290994917376,https://twitter.com/_quetiapine/status/1238278290994917376
2020-03-13 01:21:22,ashburp2,,1,0,3,"remembered watching parks and rec is a coping mechanism and woo shout out to therapy",,,,1238273917229445120,https://twitter.com/ashburp2/status/1238273917229445120
2020-03-12 23:54:40,sibylpain,,3,0,12,"on top of this whole crisis, im going to be off my quetiapine and fluoxetine for 2 days due to a mix up with the gp. so. uh. good luck, everyone who has to deal with me",,,,1238252099076526082,https://twitter.com/sibylpain/status/1238252099076526082
2020-03-12 23:29:37,ashburp2,hslovedtour,0,0,0,"literally so sweet my anxiety has been through the roof lately",,,,1238245793036976128,https://twitter.com/ashburp2/status/1238245793036976128
2020-03-12 23:21:52,ashburp2,,1,0,2,"Earl Grey is my anxitea",,,,1238243842601766912,https://twitter.com/ashburp2/status/1238243842601766912
2020-03-12 22:25:21,RoyEacups,TargetedMadison,0,0,2,"I was on Largactyl, Risperidone, Clozapine, Quetiapine. Not one of them helped. All they did was dull my brain down, and help me sleep. Please try to come off these poisons, 5HTP or Melatonin will give you a good night's sleep. I had to wean myself off Quetiapine, very addictive",,,,1238229622233456644,https://twitter.com/RoyEacups/status/1238229622233456644
2020-03-12 21:11:13,ashburp2,,1,0,1,"whew so much is happening time to treat myself",,,,1238210963838578690,https://twitter.com/ashburp2/status/1238210963838578690
2020-03-12 20:15:52,SeanLAkins,LucyMouse4,1,0,1,"You'll get on the right meds soon enough. Then you'll learn healthy ways to cope with stress, and then, you'll begin healing your scars. But it takes time. Took me a few months to learn how to cope after Quetiapine evened me out, but I'm doing much better now.",,,,1238197034726895616,https://twitter.com/SeanLAkins/status/1238197034726895616
2020-03-12 20:11:58,SeanLAkins,Tomaltach777,0,0,2,"We managed to pin down that it was bipolar disorder really quickly due to me bringing up my mother's struggles with it. I'm on Quetiapine, an antipsychotic, and it worked wonders.",,,,1238196054027382785,https://twitter.com/SeanLAkins/status/1238196054027382785
2020-03-12 16:53:59,hoodmammaa,,2,0,0,"Does anyone have any knowledge or experience of quetiapine. I've been on it just over 3 weeks in that time I've wrecked my house lost my bf and my daughter is staying with relatives because I'm like a maniac #quetiapine #mentalhealth",,,#quetiapine #mentalhealth,1238146227801374720,https://twitter.com/hoodmammaa/status/1238146227801374720
2020-03-12 15:50:41,_quetiapine,iamkarendavila,0,0,0,"Ang nonsensical nung lockdown? Worried for my mama hays",,,,1238130301097750529,https://twitter.com/_quetiapine/status/1238130301097750529
2020-03-12 15:01:08,ATThijssen,SimplyAlvin64,0,0,1,"I also was put on quetiapine to get less hypo-maniac. It didn't work, so it was increased to 300mg. I felt miserable. All energie was sucked out of my body. Everybody, take good care of yourself ...",,,,1238117829519515656,https://twitter.com/ATThijssen/status/1238117829519515656
2020-03-12 14:54:33,DieterFrikadell,aSinister,1,0,2,"He needs more Quetiapine.",,,,1238116175260913664,https://twitter.com/DieterFrikadell/status/1238116175260913664
2020-03-12 14:45:10,preshuwus,quetiapine__,0,0,1,"the screen",,,,1238113811569270785,https://twitter.com/preshuwus/status/1238113811569270785
2020-03-12 14:44:31,quetiapine__,fakekaila_,0,0,1,"5 ft apart coz we'renot gay kind of situation",,,,1238113649362796546,https://twitter.com/quetiapine__/status/1238113649362796546
2020-03-12 14:36:39,ashburp2,,0,0,2,"If Harry cancels not to sound over the top, but I will lose it",,,,1238111667751391233,https://twitter.com/ashburp2/status/1238111667751391233
2020-03-12 14:11:22,NVBigHorn,WindsorMann,0,0,1,"Which one of these is being reordered- olanzapine, quetiapine, or haloperidol?",,,,1238105307135401986,https://twitter.com/NVBigHorn/status/1238105307135401986
2020-03-12 11:35:36,edera_jeremy,quetiapine__,0,0,1,"Haahahah atleast safe",,,,1238066104557113344,https://twitter.com/edera_jeremy/status/1238066104557113344
2020-03-12 11:34:48,edera_jeremy,quetiapine__,1,0,1,"Nays one ",,,,1238065903037583361,https://twitter.com/edera_jeremy/status/1238065903037583361
2020-03-12 11:25:16,quetiapine__,,1,0,8,"we be living that grab driver life",,,,1238063504516501504,https://twitter.com/quetiapine__/status/1238063504516501504
2020-03-12 10:20:42,MrLupas,,0,0,0,"Snorting Lithium with the Nicotine Queens and the Quintessential Quiltiness of Quetiapine @Mada, Alba, Romania https://www.instagram.com/p/B9oUKJ_n_f1/?igshid=cebr1kjr26uz",,,,1238047256974110725,https://twitter.com/MrLupas/status/1238047256974110725
2020-03-12 09:29:07,bulalaca0,,0,0,0,"@DOHgovph @DOST_PCHRD im running out of quetiapine and escitalopram which i need to be SANE while working for you however i cannot get a consult and buy meds without money so please ideposit nyo na stipend ko hahahahahaahhahahahahahahahahahaha",,@DOHgovph @DOST_PCHRD,,1238034274709671937,https://twitter.com/bulalaca0/status/1238034274709671937
2020-03-12 09:01:28,bpnnyexol,B_hundred_Hyun,0,0,0,"Fighting oppaaa ",,,,1238027315419856901,https://twitter.com/bpnnyexol/status/1238027315419856901
2020-03-12 08:31:26,ashburp2,WhiteHouse,0,0,0,"I low-key freaked out for a sec...then realized this dumbass thinks the UK isn't still part of Europe...",,,,1238019760463458305,https://twitter.com/ashburp2/status/1238019760463458305
2020-03-12 07:11:49,bpnnyexol,angryasianman,0,0,1,"Seriously? You guys are so useless your parents would be disappointed....",,,,1237999721047674880,https://twitter.com/bpnnyexol/status/1237999721047674880
2020-03-12 07:09:17,bpnnyexol,B_hundred_Hyun,0,0,0,"I miss you too oppa. Take care na ka ",,,,1237999083513475073,https://twitter.com/bpnnyexol/status/1237999083513475073
2020-03-12 05:00:28,huangszn,,1,0,1,"what if i continue reading quetiapine",,,,1237966665528172544,https://twitter.com/huangszn/status/1237966665528172544
2020-03-12 04:30:23,SimplyAlvin64,BorderlineBilly,2,0,2,"Feel for you Billy. I get agitated fairly easy when experiencing hypomania. My psych put me on quetiapine (100 mg) last month for agitation &amp; paranoia. Increased it today to 150 mg. Take care my friend &amp; hope things get better for you. ",,,,1237959098173394944,https://twitter.com/SimplyAlvin64/status/1237959098173394944
2020-03-12 03:29:12,afewcedars,,0,0,0,"does adding antihistamines (first or second generation) to quetiapine/seroquel increase d2 receptor occupancy? if not, why not? #psychopharmacology #pharmacology",,,#psychopharmacology #pharmacology,1237943698953916416,https://twitter.com/afewcedars/status/1237943698953916416
2020-03-12 02:53:09,journey2findkay,NotAntherDrama,1,0,1,"Right! Entire time jus..",,,,1237934625600634880,https://twitter.com/journey2findkay/status/1237934625600634880
2020-03-12 02:49:42,journey2findkay,,1,0,1,"Just going to leave this video right here https://youtu.be/CXoW2-np8FM via @YouTube",,@YouTube,,1237933757211930625,https://twitter.com/journey2findkay/status/1237933757211930625
2020-03-11 23:34:26,AyaElmadauy,,1,0,0,"You can’t be manic if you’re in a coma , a story written by quetiapine ",,,,1237884617866088457,https://twitter.com/AyaElmadauy/status/1237884617866088457
2020-03-11 23:31:52,journey2findkay,kennethsenegal,0,0,1,"Starting to feel a little 2008-ish...trash president and all smdh",,,,1237883971960094721,https://twitter.com/journey2findkay/status/1237883971960094721
2020-03-11 23:28:58,journey2findkay,VenkaylaHaynes,0,0,0,"Late responder all day! My seester always reminds me of those ""if she would die if i answered the phone/text back on time"" situations and how she would always live...yeahh I own it tho ",,,,1237883241786269697,https://twitter.com/journey2findkay/status/1237883241786269697
2020-03-11 23:25:24,Asphodelirium,,0,0,0,"In other news I couldn't be conscious anymore so I kept taking my quetiapine earlier in the day and maybe 1 or tablets more than I'm supposed to to knock me out so yeah...its probably time to call psych",,,,1237882345622917121,https://twitter.com/Asphodelirium/status/1237882345622917121
2020-03-11 23:19:17,milkgapes,kaybrinks,1,1,5,"Me waiting for my quetiapine to kick in whenever i have a breakdown ",,,,1237880805495468033,https://twitter.com/milkgapes/status/1237880805495468033
