date,username,to,replies,retweets,favorites,text,geo,mentions,hashtags,id,permalink
2020-02-10 10:58:00,Lilominatii,,0,0,0,"Fuck quetiapine man.",,,,1226822621276377088,https://twitter.com/Lilominatii/status/1226822621276377088
2020-02-10 10:22:03,Becs,saycheeselouise,2,0,0,"She has Quetiapine but hasn't been taking it very long.",,,,1226813573675896832,https://twitter.com/Becs/status/1226813573675896832
2020-02-10 08:52:29,LibrarySister,psychetrick,0,0,2,"Quetiapine one of the worst for me but they don’t look into background, medical/life/sensitivity to med effects and side effects at all in my experience. Shocking. Who ever gets tests to see if they are lacking in quetiapine/benzos or suffering years of serious abuse? I didn’t ",,,,1226791031825424385,https://twitter.com/LibrarySister/status/1226791031825424385
2020-02-10 05:43:09,MicheleBuring1,balfe_robert,1,0,3,"That’s because there is no such thing as “antipsychotics”; quite the marketing job though isn’t it!! Serokill (Seroquel/quetiapine) makes you drowsy , knocks you out, stupefies you; &amp; of course will be marketed for every damn thing this criminal industry can get away with.",,,,1226743385685295106,https://twitter.com/MicheleBuring1/status/1226743385685295106
2020-02-10 04:16:51,abbxyb,abbxyb,0,0,5,"quetiapine am i right ",,,,1226721665184419840,https://twitter.com/abbxyb/status/1226721665184419840
2020-02-10 02:22:56,dietttbread,mutantgirIs,1,0,0,"Quetiapine is the DEVIL I was on it and it made me gain soooooo much weight guck that shit, it also made me cough up stomach acid",,,,1226692998592892934,https://twitter.com/dietttbread/status/1226692998592892934
2020-02-10 00:09:30,drbotmd,,0,0,0,"Lidocerdiol (painkiller) Used recreationally for intriguing Developed in 1917 to replace quetiapine",,,,1226659419620024325,https://twitter.com/drbotmd/status/1226659419620024325
2020-02-10 00:06:40,mutantgirIs,,1,0,4,"havent slept more than 5 hours in like 2 weeks taking some quetiapine as soon as im back in norway ",,,,1226658706382823425,https://twitter.com/mutantgirIs/status/1226658706382823425
2020-02-09 23:40:23,carlyjf,SJSchauer,0,0,1,"me. shout to to my doc and quetiapine. really loving this extra 50 lbs ive put on ",,,,1226652091281739776,https://twitter.com/carlyjf/status/1226652091281739776
2020-02-09 22:37:36,IAmJessPlant,RachieCooper,1,0,0,"I have reasonably recently had my quetiapine put up. I hadn't thought about a possible connection before.",,,,1226636290554257408,https://twitter.com/IAmJessPlant/status/1226636290554257408
2020-02-09 22:19:29,faustroll,,0,0,0,"The indication might be benzos for acute ""moments"" and quell (quetiapine fumarate) for the more chronic presentation?",,,,1226631733010812928,https://twitter.com/faustroll/status/1226631733010812928
2020-02-09 22:19:23,Camkamacpcam,GitchieCheechoo,1,0,1,"I'm a jack-o-lantern Gilly, not a troll. I'm disappointed that you can't see that. Now off to your ""racist free"" safespace; mom put out cookies & milk to chase back the quetiapine with!",,,,1226631706305650689,https://twitter.com/Camkamacpcam/status/1226631706305650689
2020-02-09 21:28:02,EurekaMag,,0,2,0,"Hypokalemia Caused by Quetiapine and Risperidone Treatment in Schizophrenia: A Case Report ",,,,1226618783629922304,https://twitter.com/EurekaMag/status/1226618783629922304
2020-02-09 20:27:00,stay_trashyx,,0,0,0,"Anyone who takes Quetiapine please message me Am on the lowest dose and its taken so much energy out of me am more exhausted than ever and I managed to sleep pretty fast I wish I took it later same time I wish I never took it ",,,,1226603423811940352,https://twitter.com/stay_trashyx/status/1226603423811940352
2020-02-09 19:38:12,mousegoddess,lyrrael,0,0,0,"Trying something new because it's difficult to cut quetiapine into quarters (tiny pill)",,,,1226591145683079169,https://twitter.com/mousegoddess/status/1226591145683079169
2020-02-09 19:29:30,TerisBlueWave,mdnij34,2,0,4,"I’d start with a cocktail of amisulpride, olanzapine, quetiapine, risperidone AND Clozapine because he needs all of them.",,,,1226588953802764289,https://twitter.com/TerisBlueWave/status/1226588953802764289
2020-02-09 18:08:59,cymraes5,balfe_robert,1,0,3,"Only just noticed this comment of yours - I see that you know the horrors of Quetiapine first hand!",,,,1226568692621770752,https://twitter.com/cymraes5/status/1226568692621770752
2020-02-09 18:05:44,cymraes5,balfe_robert,0,1,5,"Quetiapine, from my son's experience, can be dreadfully difficult in withdrawal. I would say keep away from it at all costs.",,,,1226567876603207681,https://twitter.com/cymraes5/status/1226567876603207681
2020-02-09 16:17:34,Elliott_MacG,,3,0,9,"The maximum dose of Seroquel/Quetiapine is 800mg &amp; I am on 700mg. I really believe I am not that ""sick"" to warrant such a dose. I dont know what defines ""wellness"" but having no thoughts/emotions is definitely not what I'd call well. My so-called psychosis was better than this.",,,,1226540655561801728,https://twitter.com/Elliott_MacG/status/1226540655561801728
2020-02-09 15:56:53,stay_trashyx,,0,0,0,"Decided to take quetiapine instead of a beta blocker Its suppose to help wonders everyone I know who takes it takes it regularly and my doc told me not to and the side effects wre mad hefty but if it makes me sleep for 15hrs am mad happy I dont care I've nothing to lose now",,,,1226535449067499520,https://twitter.com/stay_trashyx/status/1226535449067499520
2020-02-09 15:43:04,balfe_robert,,14,21,47,"“Use of the antipsychotic drug quetiapine to treat sleep disorders has become widespread. Its efficacy is poorly documented, and even low doses may have substantial side effects. There is thus reason to warn against prescribing quetiapine for sleep.” ",,,,1226531969707773956,https://twitter.com/balfe_robert/status/1226531969707773956
2020-02-09 15:42:26,balfe_robert,felicityallman,2,4,4,"“Use of the antipsychotic drug quetiapine to treat sleep disorders has become widespread. Its efficacy is poorly documented, and even low doses may have substantial side effects. There is thus reason to warn against prescribing quetiapine for sleep.” https://tidsskriftet.no/en/2019/09/kronikk/quetiapine-not-sleeping-pill",,,,1226531812018728960,https://twitter.com/balfe_robert/status/1226531812018728960
2020-02-09 15:03:20,balfe_robert,jill_d35,1,4,8,"Quetiapine helps sleep....hmmmmm 1. It’s not licenced for sleep 2. You will build tolerance to it and need more &amp; more (like benzo). 3. You will find it next to impossible to sleep if you ever withdraw 4. Withdrawals are horrific 5. It gave me horrific Alathisia at low dose",,,,1226521971774676993,https://twitter.com/balfe_robert/status/1226521971774676993
2020-02-09 14:03:22,RomyCerratti,Oxfordite,3,0,0,"Actually licensed 2010, by my psychiatrist, Dr Andy Zumar. It’s used for cases of severe mood disorders where medication has failed. I’ve tried Lithium and high dose Quetiapine but side effects were horrendous for me. rTMS has better results than meds and zero side effects.",,,,1226506880706600960,https://twitter.com/RomyCerratti/status/1226506880706600960
2020-02-09 08:47:10,protansynaesth,PeeweePewPew,1,0,1,"Quetiapine, as prescribed by a psychiatrist",,,,1226427305393672193,https://twitter.com/protansynaesth/status/1226427305393672193
2020-02-09 05:29:59,yerownrisk_,elvashayam,1,0,0,"I can’t really eat or sleep without quetiapine but the weight gain is a constant struggle",,,,1226377682881056768,https://twitter.com/yerownrisk_/status/1226377682881056768
2020-02-09 05:23:14,elvashayam,yerownrisk_,2,0,0,"YET AGAIN SAME tho i think i was more like 8? i have OCD and my depression generally manifests as tiredness and worsens my chronic pain so i'm sore, grumpy, paranoid AND bored lol. my meds help (snri, quetiapine for sleep/anxiety) but dex like tips me into Functional basically",,,,1226375986209386496,https://twitter.com/elvashayam/status/1226375986209386496
2020-02-09 04:46:26,FoxyLustyGrover,HamishMack,1,0,2,"I have to constantly battle my monkey mind, 700 mg of Quetiapine has made it a lot better and no Psychosis too.",,,,1226366723604959232,https://twitter.com/FoxyLustyGrover/status/1226366723604959232
2020-02-09 04:26:13,swayholly,,1,0,2,"nobody: me at 11pm: time to sing the quetiapine song",,,,1226361636614742016,https://twitter.com/swayholly/status/1226361636614742016
2020-02-09 02:28:10,peachrose9795_,,1,0,1,"@Alexipupu thank you! thank you for writing quetiapine ",,@Alexipupu,,1226331929915510785,https://twitter.com/peachrose9795_/status/1226331929915510785
2020-02-09 02:20:36,peachrose9795_,,1,0,0,"Didn't notice the COMPLETED status of Quetiapine. yeah it ended. gonna miss jaeyong there. ",,,,1226330025487548416,https://twitter.com/peachrose9795_/status/1226330025487548416
2020-02-09 00:52:36,davidallenkr,GeekinKorea,1,0,0,"I sort of do the opposite. Because PTSD my dreams are usually trauma oriented and anxiety driven so I imagine myself in an empty concrete walled room with nothing but a plain bed with white sheets to try and empty my thoughts. And I take quetiapine.",,,,1226307879675678720,https://twitter.com/davidallenkr/status/1226307879675678720
2020-02-08 22:28:10,JugernautM,GadSaad,0,0,0,"I'm on clonazepam, venlafaxan and quetiapine. Now I'm nervous. Which is ironic since all these drugs are supposed to decrease my anxiety.",,,,1226271529555677193,https://twitter.com/JugernautM/status/1226271529555677193
2020-02-08 22:16:40,Granlovespizza,ComputerChick1,1,0,0,"I've never known it diagnosed for BPD, quetiapine and lithium, but I left that work 8 yrs ago. I take it for anxiety, I'm hoping the 50mg will work",,,,1226268637172031493,https://twitter.com/Granlovespizza/status/1226268637172031493
2020-02-08 22:14:04,ComputerChick1,Granlovespizza,1,0,1,"I was on Sertraline when I first got diagnosed with Bipolar. I was on 50mg a day for about a year then stopped when I went on Quetiapine.",,,,1226267980037795840,https://twitter.com/ComputerChick1/status/1226267980037795840
2020-02-08 21:57:30,wijsgerig,g_unrecovered,1,0,1,"Thank you my friend. The pain is still hindering, but no longer all consuming like it was first. Rest and exercise does help. If i can't sleep i will take a quetiapine, i can sleep all trough tomorrow if need be, so that is ok. Wishing you loads of rest as well",,,,1226263811814043648,https://twitter.com/wijsgerig/status/1226263811814043648
2020-02-08 21:13:52,megcarstairs,megcarstairs,0,0,1,"That same psych ward also put me on a cocktail of venlafaxine, quetiapine, propranolol, chlorpromazine, promethazine and lorazepam all at once. The main thing I remember is that my mouth was SO DRY.",,,,1226252830106955777,https://twitter.com/megcarstairs/status/1226252830106955777
2020-02-08 20:54:51,BrieflyJLynn,Auras_Journey,0,0,2,"Im a quetiapine(Seroquel) user 4many yrs now,4me its what works although my dosage does need increasing the longer I'm on it&amp;it took me a few yrs to even start losing the weight it added. You do what works for you mentally &amp; physically. Good luck! #sicknotweak #MyMedsMyChoice",,,#sicknotweak #MyMedsMyChoice,1226248047480340480,https://twitter.com/BrieflyJLynn/status/1226248047480340480
2020-02-08 20:21:25,whitlock_shaun,Auras_Journey,0,0,2,"Quetiapine for me caused me to start getting quite serious life threatening blood clots. Although it was stopped immediately, the damage was done and now I have to life with it for as long as I live. Please google Quetiapine and blood clots before making a serious commitment.",,,,1226239632351821824,https://twitter.com/whitlock_shaun/status/1226239632351821824
2020-02-08 19:39:06,EddieBowden26,Auras_Journey,1,0,1,"Aura, I have been on Quetiapine 300mg at night and 200mg each morning for over 4 years now. My weight fluctuations -14lbs to +6lbs have (I think) been 90% due to Diet and Exercise.",,,,1226228984385548288,https://twitter.com/EddieBowden26/status/1226228984385548288
2020-02-08 19:28:01,Justdreamingof,Auras_Journey,1,0,3,"If it’s any reassurance, I’m generally very fearful about any meds, but find low dose (25mg-50mg) Quetiapine really helpful. I take it at 20.30 and usually asleep by 11pm with no real hangover in the morning. It’s reduced nightmares and nighttime anxiety with no weight change.",,,,1226226195127316481,https://twitter.com/Justdreamingof/status/1226226195127316481
2020-02-08 19:09:08,drbotmd,,0,0,0,"Servapram (anaesthetic) Cures glia cancer Obsoleted by quetiapine",,,,1226221443895242752,https://twitter.com/drbotmd/status/1226221443895242752
2020-02-08 18:21:27,staticheadspace,,0,0,4,"hangovers on quetiapine are fucking evil i might actually be dying",,,,1226209440602427397,https://twitter.com/staticheadspace/status/1226209440602427397
2020-02-08 17:25:52,EddieBowden26,Auras_Journey,1,0,1,"to write down details of anything that you think has occurred due to taking the Quetiapine and rate the severity if each with say a 1-5 scale. Then at least for the first 7 to 10 Days write anything new and rate any changes to the earlier side effects.",,,,1226195455584935937,https://twitter.com/EddieBowden26/status/1226195455584935937
2020-02-08 09:54:20,Sc0ttJenkins,MaxinePemberto1,0,0,3,"Have some Seroxat. Had enough of Seroxat? Have some Citalopram. Had enough of Citalopram? Have some Fluoxetine. Had enough of Fluoxetine? Have some Escatalopram Escatalopram stopped working? Let's tweak it with quetiapine. Quetiapine stopped working? Have some more quetiapine.",,,,1226081823471652864,https://twitter.com/Sc0ttJenkins/status/1226081823471652864
2020-02-08 07:21:51,JoyCheriel,Auras_Journey,1,0,1,"I love Quetiapine. It helps me sleep and is a slight antidepressant so I feel better overall. It has worked really well for me and I haven’t had any side effects to it that I am aware of.",,,,1226043447708192768,https://twitter.com/JoyCheriel/status/1226043447708192768
2020-02-07 23:44:09,Elfosaurio,,0,0,0,"Lexapro, duloxetine, divalproex, propanolol, fluoxetine, eszopiclone, buspirone, aripiprazole, clonazepam, paliperidone, hydroxizine, escitalopram, quetiapine, bupropion, olanzapine, gabapentine... they all dont do shit The only 2 that work are abilify and alprazolam.",,,,1225928264755171330,https://twitter.com/Elfosaurio/status/1225928264755171330
2020-02-07 23:34:15,AliceMowse,,0,0,1,"Quick blog post with weigh-in and talking Quetiapine, walking and weight loss https://bipolarweightloss.com/2020/02/07/weigh-in-and-workout-update/ #mentalhealth",,,#mentalhealth,1225925774345109504,https://twitter.com/AliceMowse/status/1225925774345109504
2020-02-07 22:33:33,stelcoco,baaatgurl,1,0,1,"im on quetiapine and max dosage of some SNRI! also oh my god i didnt know ur father passed, im so sorry the trauma will go back to its Hole eventually, jus gotta somehow fight thru this hell period til it becomes more manageable again ",,,,1225910499256283139,https://twitter.com/stelcoco/status/1225910499256283139
2020-02-07 22:18:00,Auras_Journey,ortski83,0,0,1,"Hey friend! It's been a shit old week...suicidal thoughts are still really strong and I feel so alone at the moment. Paranoid about starting quetiapine, although I know something needs to change. I'm meant to be on daily contact but no one called me yest and they're not calling..",,,,1225906585727328256,https://twitter.com/Auras_Journey/status/1225906585727328256
2020-02-07 20:34:07,Auras_Journey,,29,0,55,"After a long decision I picked up my Quetiapine today. Still not sure if it's the right choice and I'm feeling really apprehensive about starting it tonight. I can't get the fear of gaining weight out of my head!! There's also a ton of other side effects -it's really quite scary!",,,,1225880439702859778,https://twitter.com/Auras_Journey/status/1225880439702859778
2020-02-07 17:08:08,jennifer_amy215,,0,0,0,"No more quetiapine day 1: what a headache! And a little bit of nausea.",,,,1225828603256090624,https://twitter.com/jennifer_amy215/status/1225828603256090624
2020-02-07 10:25:27,whitepinewolf,SidPolitics,1,0,1,"Mine can get really loud & high speed, & it's exhausting listening to it. A while back I was under loads of stress & took a low dose of quetiapine for a while. It freaked me out at first &amp; I hated it as it was as if someone had turned the sound off. When I got used to it I",,,,1225727266367385600,https://twitter.com/whitepinewolf/status/1225727266367385600
2020-02-07 08:36:16,MedsLib,,0,0,0,"Quetiapine Fumarate (REMEDYREPACK INC.): Quetiapine fumarate extended-release tablets are an atypical antipsychotic indicated for the treatment of: Schizophrenia (1.1) Bipolar I disorder, manic or mixed episodes (1.2)… http://bit.ly/2S4X4nT",,,,1225699789880193025,https://twitter.com/MedsLib/status/1225699789880193025
2020-02-07 00:29:11,renesugar,pant_leg,0,1,1,"It can be a side-effect of medication. Your doctor can do something about it. https://www.ncbi.nlm.nih.gov/pmc/articles/PMC5353202/ “quetiapine-induced oromandibular dystonia”",,,,1225577207654830080,https://twitter.com/renesugar/status/1225577207654830080
2020-02-06 23:31:51,milksgoblin,,1,0,0,"quetiapine be like right now this random not spicy food is suddenly spicy and you don't remember any words or the thought you had 1.5 seconds ago which was something about your teeth turning inside out, eyesight is also prohibited, go to bed",,,,1225562781384138752,https://twitter.com/milksgoblin/status/1225562781384138752
2020-02-06 23:31:01,rkharshm,,1,0,2,"""Using ALPRAZolam together with QUEtiapine may increase side effects such as dizziness, drowsiness, confusion, and difficulty concentrating."" @JPxTakahashi, I sure as hell hope they do ALL THE THINGS.",,@JPxTakahashi,,1225562571190800389,https://twitter.com/rkharshm/status/1225562571190800389
2020-02-06 22:07:41,laithar,Hoppurrsneeze,0,0,0,"I am on Sertraline and I have Quetiapine when things get bad because I SH. I also have Bisoprolol, Perindopril, Atorvastatin and Aspirin for my heart etc. Haven't spoken to anyone about my MH since last summer. ",,,,1225541598097944576,https://twitter.com/laithar/status/1225541598097944576
2020-02-06 20:45:04,SageSuccubus,hunbothered,2,0,1,"You're into xanax?! I take quetiapine :)",,,,1225520809600528386,https://twitter.com/SageSuccubus/status/1225520809600528386
2020-02-06 18:14:11,humanpuprogue,,0,0,3,"Someone remind me to never forget to take my Quetiapine again... rough ain't the word...",,,,1225482837484331014,https://twitter.com/humanpuprogue/status/1225482837484331014
2020-02-06 14:23:20,edibleteeth,,1,0,0,"The fact that you can’t guarantee an overdose on quetiapine is genuinely so ghetto. I’d like to know who made the math behind this shit",,,,1225424740719964160,https://twitter.com/edibleteeth/status/1225424740719964160
2020-02-06 09:23:56,NicolettaWylde,,1,0,0,"Yes - I will fucking stand still and hiss at you as you pass me and YES, I saw the way you were staring at me. I’m one quetiapine dose away from a full on breakdown atm so don’t fucking try me",,,,1225349397204152320,https://twitter.com/NicolettaWylde/status/1225349397204152320
2020-02-06 08:36:25,destroy_time,Sarah_Samedi,0,0,1,"Haha, I hoard my quetiapine. Not for pain, but in order to sleep on occasion.",,,,1225337439721574403,https://twitter.com/destroy_time/status/1225337439721574403
2020-02-06 08:15:48,ettletodd,aetataureate,0,0,0,"seroquel, generic is quetiapine iunno hope that helps somehow haha",,,,1225332248422932481,https://twitter.com/ettletodd/status/1225332248422932481
2020-02-06 07:57:32,_Wathgwen,SolientArt,1,0,0,"So I was curious and looked at my own chart... 225 mg Effexor and 25 mg quetiapine daily, but the doctor cleared me to take up to 50 mg when I really can't sleep. I don't tend to do that because that much makes me very groggy the next day.",,,,1225327653454045185,https://twitter.com/_Wathgwen/status/1225327653454045185
2020-02-06 06:26:31,taharveyconsult,Auras_Journey,0,0,0,"I’ve heard lower doses of quetiapine, like 50mg or less, can actually be more sedating than higher doses - has anyone else heard of / experienced this? I’ve only taken 50mg, and it was very sedating for me",,,,1225304745968955392,https://twitter.com/taharveyconsult/status/1225304745968955392
2020-02-06 06:21:15,taharveyconsult,Auras_Journey,0,0,0,"I’ve tried both, years of experience on aripipezole. I’d use Quetiapine as my ‘emergency brake’ medication, it knocks me right out where aripiprazole seems to need more time in my system.",,,,1225303420619218945,https://twitter.com/taharveyconsult/status/1225303420619218945
2020-02-06 05:43:02,lindyvicencio,,0,0,0,"Quetiapine &amp; Fluoxetine pretty common also. But i got worse on both meds. May binabagayan talaga",,,,1225293804153868288,https://twitter.com/lindyvicencio/status/1225293804153868288
2020-02-06 01:56:02,S_erestepenem,,1,0,1,"Asking for my institution: how can we address inappropriate medication ordering? We still encounter medication orders for Quetiapine 25mg per orem once daily at night for difficulty sleeping, and Escitalopram 10mg once daily for 5 days (yes, 5 days)",,,,1225236679205634048,https://twitter.com/S_erestepenem/status/1225236679205634048
2020-02-05 23:27:13,Roxie_P_,,2,0,0,"#AskTwitter #quetiapine after halving my 25mg dose for a good month or so, when will sleep normality return? Struggling to get to sleep now. @MindCharity ? #mentalhealth #depression #recovery",,@MindCharity,#AskTwitter #quetiapine #mentalhealth #depression #recovery,1225199226126204929,https://twitter.com/Roxie_P_/status/1225199226126204929
2020-02-05 22:53:50,SolientArt,_Wathgwen,1,0,1,"12.5mg quetiapine here; it slapped my anxiety and despair so hard that I've been left emotionally confused in situations they typically manifest in. ",,,,1225190825723924481,https://twitter.com/SolientArt/status/1225190825723924481
2020-02-05 22:49:05,_Wathgwen,SolientArt,1,0,2,"I'm really glad for you! I hope you get some answers soon. I'm on an snri and quetiapine (though a pretty low dose of the latter). In combination I do have many more days on point, but I go through pretty rapid burnout cycles.",,,,1225189629353189377,https://twitter.com/_Wathgwen/status/1225189629353189377
2020-02-05 22:05:59,alicesings,georgetreefrog,0,0,1,"My MIL did really well on a medication called Seroquel (Quetiapine). Before taking this she was really confused etc. I don’t normally suggest pharmaceutical’s but with dementia it’s different. Her Dr should be helpful. Good luck ",,,,1225178785038733312,https://twitter.com/alicesings/status/1225178785038733312
2020-02-05 19:23:36,JamieAustinYT,journey2findkay,2,0,2,"Random as hell but I used to be on quetiapine myself lol",,,,1225137919645683713,https://twitter.com/JamieAustinYT/status/1225137919645683713
2020-02-05 19:15:11,Jer_Hobbs,Auras_Journey,0,0,0,"I dont think there’s much to choose between them other than aripiprazole is also mood stabiliser and I’ve been more stable on that than on Quetiapine which I was on for a few years. Rapid cycling mixed affective is the variant I have. Best of luck.",,,,1225135799194263553,https://twitter.com/Jer_Hobbs/status/1225135799194263553
2020-02-05 19:02:10,greerplastics,nerdy4brainz,0,0,0,"Venlafaxine and quetiapine for me!",,,,1225132523199569922,https://twitter.com/greerplastics/status/1225132523199569922
2020-02-05 19:01:06,realBioMassSpec,,0,0,0,"validated method for the simultaneous determination of quetiapine, clozapine and mirtazapine in post mortem blood and tissue samples. #JAT #MassSpec",,,#JAT #MassSpec,1225132254885810176,https://twitter.com/realBioMassSpec/status/1225132254885810176
2020-02-05 18:57:10,melpaisleyart,,0,0,4,"THAT BEING SAID, yah I swore off the good bean juice for a bit. Also, 10/10 do not recommend mitigating all nighter quetiapine withdrawal with nitro cold brew. However, now I am older. Wiser. I have returned to the unfettered hustle fuel, and am ready to get my life together ",,,,1225131266531581954,https://twitter.com/melpaisleyart/status/1225131266531581954
2020-02-05 17:27:15,Pixiidk,LNslovebites,0,0,0,"Quetiapine made me gain a fuck ton of wait to but it's the only thing that works for me :(",,,,1225108636902490121,https://twitter.com/Pixiidk/status/1225108636902490121
2020-02-05 17:16:27,Darkmaster2003,,1,0,0,"to take my meds. I talk alprazolam and Quetiapine Fumarate. For those who dont know, Xanax and Seroquil. I didnt think anything of it, but in hindsight, I should have not taken my meds. I misdosed myself and mixed my medications. i took 3 times my recommended xanax dose 2?",,,,1225105918926446598,https://twitter.com/Darkmaster2003/status/1225105918926446598
2020-02-05 15:15:55,HirstOfficial,,0,0,0,"Featured Art of the Day: ""Quetiapine"". Buy it at: https://www.ArtPal.com/roberthirst?i=50107-71",,,,1225075587720663044,https://twitter.com/HirstOfficial/status/1225075587720663044
2020-02-05 14:56:34,EromenaJ,EromenaJ,0,0,0,"I should probably also mention that although I hated the side effects, Quetiapine was very effective in controlling my moods. I hope you find a medication regime that works &amp; you're comfortable with.",,,,1225070716934152192,https://twitter.com/EromenaJ/status/1225070716934152192
2020-02-05 14:54:28,EromenaJ,Auras_Journey,1,0,0,"I wasn't a fan of Quetiapine. Made me very sleepy-helpful at night but not helpful trying to wake up. Also caused weight gain (not overweight but more than I was) &amp; made me weirdly breathless. Lamotrigine (although not an antipsychotic I realise) has been a game changer for me.",,,,1225070191211622400,https://twitter.com/EromenaJ/status/1225070191211622400
2020-02-05 14:48:03,fourth28,,0,0,0,"450mg of quetiapine is scary omg welpppP",,,,1225068572931584000,https://twitter.com/fourth28/status/1225068572931584000
