date,username,to,replies,retweets,favorites,text,geo,mentions,hashtags,id,permalink
2020-02-17 22:57:27,ketchupsheeran,gracecamille_,0,0,0,"I can’t have ssris but what helps my bipolar depression is lamotrigine and quetiapine (used for my psychosis as well). I hope no one has to take quetiapine lol. But Wellbutrin helped the most",,,,1229540391726276610,https://twitter.com/ketchupsheeran/status/1229540391726276610
2020-02-17 21:18:50,zoe_bearx,theblackcatsays,1,0,0,"I’ve Been on quetiapine for 3 years and It’s never made me gain weight. I think it’s just the lazing around on maternity leave and eating rubbish that’s done it x",,,,1229515573484277761,https://twitter.com/zoe_bearx/status/1229515573484277761
2020-02-17 20:53:51,iamyourgasman,,0,0,0,"maybe quetiapine can help, but haloperidol looks ineffective #CCC49 #Delirium",,,#CCC49 #Delirium,1229509283689246721,https://twitter.com/iamyourgasman/status/1229509283689246721
2020-02-17 20:53:24,sonjashining,,0,0,0,".@devlinpharmd found that pt’s receiving quetiapine vs placebo had a a faster time to resolution of #delirium #CCC49",,@devlinpharmd,#delirium #CCC49,1229509171533504517,https://twitter.com/sonjashining/status/1229509171533504517
2020-02-17 20:15:31,greek_geek,,0,0,0,"Why is #quetiapine so scarce to order in London/UK? #nhscuts #BrexitReality?...",,,#quetiapine #nhscuts #BrexitReality,1229499636571873287,https://twitter.com/greek_geek/status/1229499636571873287
2020-02-17 19:49:27,jengotduncd,WafflesPharm,0,0,3,"90 days SSRI’s once pt’s dose stabilised? No worries. Anything with a more concerning toxicity profile eg quetiapine, Lithium, carbamazepine, amisulpride, TCA’s.... Would rather not. Quetiapine pack sizes are a bug bear of mine, too many 9g + OD’s seen.",,,,1229493078534180865,https://twitter.com/jengotduncd/status/1229493078534180865
2020-02-17 19:09:53,CaitlinxCook,,0,0,0,"Anyone else on quetiapine? I get so anxious two hours before I’m due to take it and it’s making things difficult. Wondered if anyone else feels the same.",,,,1229483121306935297,https://twitter.com/CaitlinxCook/status/1229483121306935297
2020-02-17 17:51:50,wyndleton,,2,0,5,"Medications that I've been on at this point: Olanzapine, Quetiapine, Aripiprazole, Prozac, Sertraline, Trazodone, Methylphenidate, amitriptyline, Lorazepam, Clonazepam, Zuclopenthixol, Baclofen, Gabapentin, Phenibut, Fasoracetam, Keppra, Lamictal, and soon to be Clomipramine.",,,,1229463477799927809,https://twitter.com/wyndleton/status/1229463477799927809
2020-02-17 16:54:28,grussell903,,0,0,1,"Lithium vs. valproate vs. olanzapine vs. quetiapine as maintenance monoRx for #bipolardisorder :a #population‐based #UK #cohort study using #EHR's #Epidemiology #Biostatistics #StudyDesign #StudyPopulation #Journals #Quacks #AndTheBandPlayedOn #grussell903",,,#bipolardisorder #population #UK #cohort #EHR #Epidemiology #Biostatistics #StudyDesign #StudyPopulation #Journals #Quacks #AndTheBandPlayedOn #grussell903,1229449043618795521,https://twitter.com/grussell903/status/1229449043618795521
2020-02-17 16:32:57,ajnvrr,,0,0,0,"quetiapine ain't working, so i'm laying here daydreaming",,,,1229443629283827713,https://twitter.com/ajnvrr/status/1229443629283827713
2020-02-17 16:28:22,taekshrine,mildlyenraged,2,0,0,"1. quetiapine 2. mirtazapine 3. diazepam 4. sumatriptan (idk if that counts lmao) 5. caffein. it counts, i have decided. ",,,,1229442472541147142,https://twitter.com/taekshrine/status/1229442472541147142
2020-02-17 15:09:34,__Sassybelle__,CrazyRxMan,0,0,1,"There's a mental health medical group, ""senior perspectives"" that routinely prescribes 30 days of quetiapine/mirtazapine, donepezil, and a benzo, to seniors. One MD sees at least two of our pts every month, but puts benzo+2 refills on rx EVERY month. They write it like its candy.",,,,1229422643306168322,https://twitter.com/__Sassybelle__/status/1229422643306168322
2020-02-17 12:48:24,jaeyongbubu,,1,0,0,"JUST REALIZED I CAN FINALLY FINISH READING QUETIAPINE TONIGHT",,,,1229387119501697031,https://twitter.com/jaeyongbubu/status/1229387119501697031
2020-02-17 11:14:16,DiaryofLydia,,1,0,10,"So got my psych review today, no clue what’s going to come of it because I did ask about going onto a mood stabiliser and increasing my quetiapine a bit during last week. Also on this bus ride I’ve realised how many songs @_bpdbecca added to the playlist..........",,@_bpdbecca,,1229363427644182528,https://twitter.com/DiaryofLydia/status/1229363427644182528
2020-02-17 08:48:35,stelcoco,baaatgurl,1,0,1,"mooood ive been having super realistic dreams (ft the usual random bouts of light dissociation lol) since i started taking quetiapine for sleep months ago but like.. something is in retrograde ",,,,1229326766029844484,https://twitter.com/stelcoco/status/1229326766029844484
2020-02-17 06:40:33,Kasten_Sage801,11kayry,0,0,1,"I think it takes fifteen 100mg quetiapine.",,,,1229294546690793472,https://twitter.com/Kasten_Sage801/status/1229294546690793472
2020-02-17 00:54:13,sibylpain,,2,0,50,"my new favourite exteme sport is taking my quetiapine with a face full of make up on, in shoes, with zero alarms set and seeing if i can do it all before it kicks in and puts me to sleep",,,,1229207386512068610,https://twitter.com/sibylpain/status/1229207386512068610
2020-02-16 20:29:05,DiaryofLydia,0v3rcaffeinated,1,0,1,"I take quetiapine, and I find the weight gain hard to deal with, I now get prescribed meal replacement drinks that are filling which kinda stops me from binge eating (the ones I've used are ensure and fortisip)honestly helped me so much",,,,1229140665759653888,https://twitter.com/DiaryofLydia/status/1229140665759653888
2020-02-16 18:31:41,meds_meltdowns_,Idaisrecovering,0,0,1,"I have gained about 3 stone over the last few years on Quetiapine, but it works so well for me. I've been on a weight management programme since December and I've managed to lose 6 pounds so far. I'm hoping to lose more xx",,,,1229111120138510336,https://twitter.com/meds_meltdowns_/status/1229111120138510336
2020-02-16 17:12:33,hububba,RaineSkunk,1,0,0,"Im on Lexapro and Lithium right now. I used to be on a Abilify and Quetiapine during my episode",,,,1229091204677001217,https://twitter.com/hububba/status/1229091204677001217
2020-02-16 16:47:34,Idaisrecovering,,7,0,40,"TW: WEIGHT As you know, Quetiapine has massively contribured to me gaining 4 stones in 18 months. Now I'm hoping that going from 150mgs to just 25mgs to help me sleep will help me lose the weight. One of my friends said my coat already looks bigger on me. So there's hope ",,,,1229084920120782849,https://twitter.com/Idaisrecovering/status/1229084920120782849
2020-02-16 15:05:40,Kitrol1866,sjw_cat,2,0,1,"You missed quetiapine. Care to explain what that's for?",,,,1229059272992010240,https://twitter.com/Kitrol1866/status/1229059272992010240
2020-02-16 12:12:00,Hodgamania,DoItWithFlareon,1,0,5,"Destigmatizing MH. I'm Hodge. I live with Schizophrenia, Anxiety & Depression & take Quetiapine for it. OBVIOUSLY, if you need help, I'll support you in finding it. What I cant do is give the broad statement of saying I will be ""able to solve all"". This lie hurts both parties ",,,,1229015568138883074,https://twitter.com/Hodgamania/status/1229015568138883074
2020-02-16 11:26:30,Owsmindfs1,JosephBoshoff,0,0,1,"I also had the heart problems from quetiapine, that was the main reason doc took me off it.:)",,,,1229004118582272000,https://twitter.com/Owsmindfs1/status/1229004118582272000
2020-02-16 11:15:44,Owsmindfs1,JosephBoshoff,1,0,0,"You know, I got untasteable hallucinations from quetiapine especially XR version...",,,,1229001411347832832,https://twitter.com/Owsmindfs1/status/1229001411347832832
2020-02-16 11:15:30,LanceIsMyName_4,,0,0,0,"Bye bye QUETIAPINE! I don’t need you anymore ",,,,1229001349188050944,https://twitter.com/LanceIsMyName_4/status/1229001349188050944
2020-02-16 09:54:13,berjkun,eunicecatabona,0,0,1,"5 Mercury Drugstore items to get to know me: 1. Quetiapine 2. Conzace 3. Biogenic 4. Latex sterile gloves 5. Bioflu As a sakitin ",,,,1228980896499240961,https://twitter.com/berjkun/status/1228980896499240961
2020-02-16 09:30:38,cindyangeles_,,0,0,0," — hi! i take escitalopram (antidepressant) , risperidone, and quetiapine (both antipsychotic). ofc you need a prescription f… ",,,,1228974958707167235,https://twitter.com/cindyangeles_/status/1228974958707167235
2020-02-16 09:08:39,Auras_Journey,,10,0,9,"I've gained 7lb in a week!! What the actual heck! My diet has been meticulously under 1000cals per day. No other changes have been made other than I've started taking Quetiapine. I can't take Quetiapine anymore as I can't cope with gaining weight like this! I'm not okay",,,,1228969426332127232,https://twitter.com/Auras_Journey/status/1228969426332127232
2020-02-16 08:45:06,sophiejcarswell,,0,0,0,"I never used to dream but since I started a high dose of Zaluron Xl my dreams are so real and bizarre and keep jolting me awake. Anyone else had anything similar? #meds #medication #zaluron #zaluronxl #quetiapine #seroquel #antipsychotic",,,#meds #medication #zaluron #zaluronxl #quetiapine #seroquel #antipsychotic,1228963500711698432,https://twitter.com/sophiejcarswell/status/1228963500711698432
2020-02-16 08:08:52,qwertyuhayup,AmbulaArt,0,0,0,"5 Mercury Drugstore items to get to know me: 1. Escitalopram 2. Quetiapine 3. Alprazolam 4. Advil 5. Cetaphil ",,,,1228954384484069376,https://twitter.com/qwertyuhayup/status/1228954384484069376
2020-02-16 03:32:16,dontbesadowen,_yuriiipsy,0,0,3,"5 Mercury Drugstore items to get to know me: 1. Escitalopram 2. Risperidone 3. Quetiapine 4. Immunpro 5. Alcohol/Hand Sanitizer ",,,,1228884775307337728,https://twitter.com/dontbesadowen/status/1228884775307337728
2020-02-15 22:50:23,demicabeIIo,,0,0,1,"fuck knows what I’d do without Quetiapine and Zopiclone",,,,1228813838440697858,https://twitter.com/demicabeIIo/status/1228813838440697858
2020-02-15 20:08:26,Ditsy_Soph,aaliyahs_star,0,0,0,"Unfortunately I have to split the dose morning and night as I'm on other medications. Quetiapine I didn't get on with. Repeated hallucinations and night terrors! I kept waking anf seeing a balloon getting bigger and bigger in the corner of my room! It was horrible!",,,,1228773082313232388,https://twitter.com/Ditsy_Soph/status/1228773082313232388
2020-02-15 19:45:51,aaliyahs_star,Ditsy_Soph,2,0,0,"Sophie, my psychiatrist said not to use venlafaxine at night as it's a stimulating medication. So I've tried taking that in the morning then in the evening, it was mirtazapine then amitriptyline and now I'm trying quetiapine in the evening but finding I'm too groggy in morning",,,,1228767396720185344,https://twitter.com/aaliyahs_star/status/1228767396720185344
2020-02-15 15:02:52,NathanAust,,0,0,1,"Lordy I woke up at six I've been eating the pasta I made last night since and my new meds, quetiapine got me feeling so fucking high.",,,,1228696182349713408,https://twitter.com/NathanAust/status/1228696182349713408
2020-02-15 14:43:12,katiekwain,,2,1,8,"Just waiting for my quetiapine to knock me tf oot",,,,1228691232643260416,https://twitter.com/katiekwain/status/1228691232643260416
2020-02-15 14:08:37,mdgemba,animatedtext,0,0,0,"I've got my quetiapine and escitalopram lezgo ",,,,1228682528787009537,https://twitter.com/mdgemba/status/1228682528787009537
2020-02-15 13:34:34,keshay_lad,,0,0,0,"waiting 4 the quetiapine to hit goodnight",,,,1228673959828131840,https://twitter.com/keshay_lad/status/1228673959828131840
2020-02-15 13:08:14,SerialCuddler69,,0,0,1,"Melatonin does not do the job.. I need ny quetiapine back!",,,,1228667332987248641,https://twitter.com/SerialCuddler69/status/1228667332987248641
2020-02-15 13:01:55,daksicycline,hobbynear,0,0,1,"5 Mercury Drugstore items to get to know me: 1. Escitalopram 2. Quetiapine/Rivotril 3. Energy drinks 4. Hair dye 5. Multivitamins ",,,,1228665743480254465,https://twitter.com/daksicycline/status/1228665743480254465
2020-02-15 11:35:16,danigoesfilm,mamabruha,0,0,2,"5 mercury drugstore items to get to know me escitalopram ++ alprazolam +++ quetiapine + mefenamic acid cetirizine ",,,,1228643938921107456,https://twitter.com/danigoesfilm/status/1228643938921107456
2020-02-15 10:57:47,ag0ny_in_v4in,,0,0,1,"I’m kinda relieved that I’m a rare case when it comes to weight and Quetiapine bc so many people tell me how it makes them put on bare weight and all I’m doing is losing it",,,,1228634504090333186,https://twitter.com/ag0ny_in_v4in/status/1228634504090333186
2020-02-15 09:43:38,society_welsh,drcaplan,0,0,0,"Trouble is, if you are needing quetiapine, you should probably stay away from THC and whole plant",,,,1228615846114873344,https://twitter.com/society_welsh/status/1228615846114873344
2020-02-15 08:33:32,tworatskissing,,1,0,0,"okay quetiapine i see you",,,,1228598203999649792,https://twitter.com/tworatskissing/status/1228598203999649792
2020-02-15 03:32:37,colleen_twt,Punongbayan_,0,0,1,"5 Mercury Drugstore items to get to know me gaviscon double action buscopan venus quetiapine pantoloc ube ice cream na 100ml ",,,,1228522473655652352,https://twitter.com/colleen_twt/status/1228522473655652352
2020-02-15 01:35:45,sibylpain,,2,4,11,"excuse me why has my quetiapine not knocked me out",,,,1228493063363923968,https://twitter.com/sibylpain/status/1228493063363923968
2020-02-14 23:52:09,limbokim00,,0,0,1,"5 Mercury Drugstore items to get to know me: 1) Escitalopram 2) Quetiapine 3) Sodium Divalproate 4) Whisper 5) Absolute",,,,1228466991284928513,https://twitter.com/limbokim00/status/1228466991284928513
2020-02-14 23:21:06,psychbuseuk,Deedoherty2,1,0,0,"On 800 mg Quetiapine i have seen my daughter Elizabeth suffer with this terrible condition under the care of ENFIELD MH",,,,1228459180585082883,https://twitter.com/psychbuseuk/status/1228459180585082883
2020-02-14 23:18:03,MsMontesclaros,rafalubigan,0,0,3,"5 Mercury Drugstore items to get to know me: 1) Quetiapine 2) Trust Pills/Yasmin 3) Biguerlai 4) Dr. Kaufman 5) Acetone ",,,,1228458410389143557,https://twitter.com/MsMontesclaros/status/1228458410389143557
2020-02-14 22:59:12,lowcaltea,,0,0,0,"quetiapine got me really numb i literally can't think properly",,,,1228453666442686464,https://twitter.com/lowcaltea/status/1228453666442686464
2020-02-14 20:34:07,moriartly,,1,0,3,"dumb bitch outright refuses to go back to her psych, selfmedicates with clothing. i miss quetiapine i just wanna sleep!",,,,1228417154791292928,https://twitter.com/moriartly/status/1228417154791292928
2020-02-14 20:20:00,drcaplan,,3,18,44,"Researchers have discovered that CB1 antagonists and CB2 agonists are able to inhibit the necroptosis induced by Quetiapine, keeping is a viable antipsychotic for those with access to medical cannabis. Learn More: http://bit.ly/2vzA9IA",,,,1228413603495190528,https://twitter.com/drcaplan/status/1228413603495190528
2020-02-14 17:04:10,ManongLinus,kimxnunez,1,0,0,"5 Mercury Drugstore items to get to know me: 1) Quetiapine 2) Saridon 3) Decolgen 4) Bioflu 5) Vicks inhaler BEST GAME ",,,,1228364322197229569,https://twitter.com/ManongLinus/status/1228364322197229569
2020-02-14 15:24:37,HappinessPizza,,1,0,1,"5 mercury drugstore items to get to know me: 1. Gaviscon Liquid 2. Berocca/Pharex B-Complex 3. Fortune Hopia Ube 4. Buscopan Venus 5. Tolak Angin I’m a changed person. No more Escitalopram, Iterax nor Quetiapine ",,,,1228339268310818817,https://twitter.com/HappinessPizza/status/1228339268310818817
2020-02-14 15:21:49,ignacio_jlr,_quetiapine,1,0,1,"HAPPY VALENTINES SHANNIN LIKE A MELODY... HAHAHAH",,,,1228338564292698112,https://twitter.com/ignacio_jlr/status/1228338564292698112
2020-02-14 15:21:33,_quetiapine,con_glenn,0,0,1,"Happy hearts day! Lurv lurv ",,,,1228338496235945985,https://twitter.com/_quetiapine/status/1228338496235945985
2020-02-14 15:19:43,_quetiapine,ignacio_jlr,2,0,2,"Okayyy bye! Don't wanna thirdwheel",,,,1228338036515074048,https://twitter.com/_quetiapine/status/1228338036515074048
2020-02-14 15:19:07,_quetiapine,con_glenn,1,0,1,"Have no regrets or doubts ",,,,1228337884060504064,https://twitter.com/_quetiapine/status/1228337884060504064
2020-02-14 15:14:05,_quetiapine,con_glenn,1,0,1,"Nevermind the delay. If a part of you still wants to do it, then do it lol",,,,1228336617124851712,https://twitter.com/_quetiapine/status/1228336617124851712
2020-02-14 15:13:07,_quetiapine,ignacio_jlr,0,0,2,"Wait lang, ha? WAIT HAHAHAHA",,,,1228336371749679104,https://twitter.com/_quetiapine/status/1228336371749679104
2020-02-14 15:10:26,ignacio_jlr,con_glenn,2,0,2,"Passion=energy, apply first law of thermo dynamics , it's still there. Hahaha",,,,1228335698081546241,https://twitter.com/ignacio_jlr/status/1228335698081546241
2020-02-14 14:33:15,fluoxxetyn,scoliosleep,1,0,3,"1. Fluoxetine 2. Quetiapine 3. Sodium Divalproex 4. Wet wipes 5. Imang Telang Frozen Lumpiang Pinoy ",,,,1228326342531284994,https://twitter.com/fluoxxetyn/status/1228326342531284994
2020-02-14 14:20:01,localdoughnut,sibylpain,0,0,0,"Omg quetiapine gave me a whole new menu...and I would get hungry at weird times, it was like being jet lagged",,,,1228323012379840513,https://twitter.com/localdoughnut/status/1228323012379840513
2020-02-14 13:29:51,SamMGreer,SleepHussy,1,0,1,"Quetiapine was the best thing they ever put me on till it stopped working. For a month tho, was heaven",,,,1228310383686975488,https://twitter.com/SamMGreer/status/1228310383686975488
2020-02-14 13:09:26,thorny_dweeb,heynikkipoo,1,0,2,"5 mercury drugstore items to get to know me: 1. Divalproex Na 2. Quetiapine 3. Propranolol 4. Alprazolam 5. Celecoxib ",,,,1228305246851436544,https://twitter.com/thorny_dweeb/status/1228305246851436544
2020-02-14 13:01:07,cymraes5,balfe_robert,0,0,2,"Yes, symptoms shared by a fellow quetiapine sufferer!",,,,1228303154351132672,https://twitter.com/cymraes5/status/1228303154351132672
2020-02-14 12:46:31,_quetiapine,,0,0,1,"Brothers > Ang Probinsyano Shooketh si ate ghorl",,,,1228299479532486656,https://twitter.com/_quetiapine/status/1228299479532486656
2020-02-14 12:17:40,sibylpain,,3,0,8,"so thanks to quetiapine i am ravenous but everything i try to eat is disgusting to me now ?? do you want food or not",,,,1228292218902982658,https://twitter.com/sibylpain/status/1228292218902982658
2020-02-14 11:57:27,reiiraaa,aeriday6,0,0,0,"5 Mercury Drug store items to get to know me 1. Quetiapine 2. Alprazolam 3. Lamotrigine 4. Omeprazole 5. Ritter Sport ",,,,1228287131321171968,https://twitter.com/reiiraaa/status/1228287131321171968
2020-02-14 11:17:01,_quetiapine,,0,0,1,"Boi i feel loved. Flowers from the mgmt sa dorm and treats from our HIS prof ",,,,1228276957546070019,https://twitter.com/_quetiapine/status/1228276957546070019
2020-02-14 11:07:45,taeyeon_exe,,0,0,0,"5 Mercury Drugstore items to get to know me 1. Valpros 2. Sertraline 3. Quetiapine 4. Resperidone 5. Olanzapine",,,,1228274623185207297,https://twitter.com/taeyeon_exe/status/1228274623185207297
2020-02-14 11:03:27,ronaelereyes,,0,0,0,"I forgot to include Quetiapine. ",,,,1228273542724063232,https://twitter.com/ronaelereyes/status/1228273542724063232
2020-02-14 10:15:06,NishanMultan,,0,0,0,"#Antipsychotics: Commonly used #antipsychotics #Chlorpromazine #Promazine #Clozapine #Risperidone #Haloperidol #Trifluoperazine #Olanzepine #Quetiapine #Pimozide #alcoholism #addiction #relapse #Pakistan http://ow.ly/ykkx30qeQUX",,,#Antipsychotics #antipsychotics #Chlorpromazine #Promazine #Clozapine #Risperidone #Haloperidol #Trifluoperazine #Olanzepine #Quetiapine #Pimozide #alcoholism #addiction #relapse #Pakistan,1228261374293311489,https://twitter.com/NishanMultan/status/1228261374293311489
2020-02-14 10:15:05,Islamabad_Rehab,,0,0,0,"#Antipsychotics: Commonly used #antipsychotics #Chlorpromazine #Promazine #Clozapine #Risperidone #Haloperidol #Trifluoperazine #Olanzepine #Quetiapine #Pimozide #alcoholism #addiction #relapse #Pakistan http://ow.ly/HWMu30qeQLL",,,#Antipsychotics #antipsychotics #Chlorpromazine #Promazine #Clozapine #Risperidone #Haloperidol #Trifluoperazine #Olanzepine #Quetiapine #Pimozide #alcoholism #addiction #relapse #Pakistan,1228261370367545346,https://twitter.com/Islamabad_Rehab/status/1228261370367545346
2020-02-14 10:15:05,b_banth,,0,0,0,"#Antipsychotics: Commonly used #antipsychotics #Chlorpromazine #Promazine #Clozapine #Risperidone #Haloperidol #Trifluoperazine #Olanzepine #Quetiapine #Pimozide #alcoholism #addiction #relapse #Pakistan http://ow.ly/lFAS30qeQB7",,,#Antipsychotics #antipsychotics #Chlorpromazine #Promazine #Clozapine #Risperidone #Haloperidol #Trifluoperazine #Olanzepine #Quetiapine #Pimozide #alcoholism #addiction #relapse #Pakistan,1228261370052911104,https://twitter.com/b_banth/status/1228261370052911104
2020-02-14 10:04:36,MeganMcLaughl14,,1,0,6,"Recently noticed an increase in my clients being prescribed Quetiapine/ Seroquel but they've been deemed sub threshold for engaging with CMHT ",,,,1228258734465540097,https://twitter.com/MeganMcLaughl14/status/1228258734465540097
2020-02-14 09:45:05,vivrelavee,wubioo,1,0,12,"5 mercury drugstore items to get to know me: 1. vortioxetine 2. quetiapine 3. meiji choco baby 4. paracetamol 5. cookies and cream ice cream ",,,,1228253822507577345,https://twitter.com/vivrelavee/status/1228253822507577345
2020-02-14 09:36:24,Kakaicaev,nonononoelle,1,0,11,"Mercuy Drug Items to get to know me: Quetiapine Strattera Divalproex Escitalopram —more to follow— Puta ang mahal kaya ",,,,1228251636310560772,https://twitter.com/Kakaicaev/status/1228251636310560772
2020-02-14 09:20:57,bigfightpreview,jonatho66672694,1,1,2,"Diazepam deteriorates muscle and is highly addictive. Quetiapine (or however its spelt) isnt good neither, it's an anti psychotic. What these cunta do is give out things with sedatives in them coz they're cheap. If u have problems sleeping ask for Zopiclone 7.5mg and bin the rest",,,,1228247748916498432,https://twitter.com/bigfightpreview/status/1228247748916498432
2020-02-14 09:13:17,wubioo,tengerinez,1,2,5,"5 Mercury Drugstore items to get to know me: 1. Sertraline 2. Quetiapine 3. Milky Knots 4. Dutchmill Yogurt Drink 5. Atenolol ",,,,1228245820157247489,https://twitter.com/wubioo/status/1228245820157247489
2020-02-14 09:03:04,wubioo,wubioo,1,1,3,"Me @the drug store getting Quetiapine: can I get a que..que...cutiepie ",,,,1228243249376051201,https://twitter.com/wubioo/status/1228243249376051201
2020-02-14 08:58:38,tengerinez,Punongbayan_,1,1,5,"5 Mercury Drugstore items to get to know me: 1. Aripiprazole 2. Lamotrigine 3. Quetiapine 4. Robitussin 5. Salbutamol Ventolin ",,,,1228242131501772800,https://twitter.com/tengerinez/status/1228242131501772800
2020-02-14 08:23:50,innnss94,,0,0,0,"quetiapine be like “do u wana suffer in the daytime or be haunted by horrible nightmares at night time?”",,,,1228233375225303041,https://twitter.com/innnss94/status/1228233375225303041
2020-02-14 08:21:17,bellemaps,mamabruha,0,0,1,"~ 5 mercury drug items to get to know me~ escitalopram quetiapine topiramate alprazolam (xanor) berocca ",,,,1228232731382841345,https://twitter.com/bellemaps/status/1228232731382841345
2020-02-14 08:01:01,mamabruha,scoliosleep,0,0,29,"Quetiapine Escitalopram Althea Risek Gaviscon ",,,,1228227632245825536,https://twitter.com/mamabruha/status/1228227632245825536
2020-02-14 07:59:42,marshalirios,nasucchan,0,0,0,"your quetiapine is high!",,,,1228227300497297408,https://twitter.com/marshalirios/status/1228227300497297408
2020-02-14 07:17:32,nasucchan,enzoderm,1,1,3,"5 Mercury Drugstore items to get to know me: 1) Quetiapine 300mg 2) Duphaston 10mg 3) Lola Remedios 4) ImmunePro 5) Pei Pa Koa BEST GAME ",,,,1228216690749501440,https://twitter.com/nasucchan/status/1228216690749501440
2020-02-14 07:06:23,dreadings_,scoliosleep,0,0,1,"5 mercury drugstore items to know me: 1. Losartan 2. Carvedilol 3. Ascorbic Acid 4. Escitalopram 5. Quetiapine ",,,,1228213882285461505,https://twitter.com/dreadings_/status/1228213882285461505
2020-02-14 06:00:19,delicatehorizon,frauglet,0,0,2,"I wish I knew. I was taking quetiapine but turns out I don't have it for tonight so now my eyes are dry, my brain loud and I just want to sleep",,,,1228197256907509762,https://twitter.com/delicatehorizon/status/1228197256907509762
2020-02-14 04:52:56,GMRickSanchez,,1,0,0,"Further Destigmatizing #mentalillness: I have Bipolar Disorder Type II, Clinical Anxiety Disorder, Major Depressive Disorder, and PTSD. I take quetiapine (Seraquel), escitalopram (Lexapro), buproprion XL (Wellbutrin), and clonazepam (Klonopin). I am getting by. Most days. (2/2)",,,#mentalillness,1228180298438868993,https://twitter.com/GMRickSanchez/status/1228180298438868993
2020-02-14 03:01:28,N05BAowo,g6etia,1,0,0,"öööh, obv Quetiapine (daily) and i should be taking adhd meds but i'm not officially diagnosed (reason being drugs). then i've taken sugar pills aka Hydroxyzine, Mirtazapine, Lamotrigine among other things that i have no clue what they're called.",,,,1228152248200359941,https://twitter.com/N05BAowo/status/1228152248200359941
2020-02-13 23:46:57,ScientificDirt,DragonP0ny,0,0,2,"Destigmatising mental illness: I'm John I suffer with depression and mixed dissociative-conversion disorder. I have tried to take my life. Twice. I take venlafaxine and quetiapine daily. Never suffer alone. Reach out. Please. ",,,,1228103294419132416,https://twitter.com/ScientificDirt/status/1228103294419132416
2020-02-13 23:08:21,walkamileuk,lizoluwi,3,0,1,"I think the label ‘BPD’ is utterly useless. It’s an insult to people who are reacting to trauma in their lives. For me, quetiapine helps much in the way that painkillers help folk with cancer. For me it smooths down the edges of almost endless dissociation (I lose about...",,,,1228093584030797824,https://twitter.com/walkamileuk/status/1228093584030797824
