date,username,to,replies,retweets,favorites,text,geo,mentions,hashtags,id,permalink
2020-03-02 08:30:49,Prof_Farmacia,,0,0,0,"Off‐label use of #quetiapine in nursing homes: Does medical specialty of prescribing physicians play a role? @BritJClinPharm | #ECM",,@BritJClinPharm,#quetiapine #ECM,1234395723636117504,https://twitter.com/Prof_Farmacia/status/1234395723636117504
2020-03-02 07:54:28,HpHamilton2,ThinkReadTweet,2,0,1,"1 Shakespeare 2 Chocolate icecream 3 our ability to dismiss trauma unless it personally impacts you 4 Drake 5 Still Drake, dude is average at best 6 Corona/Sol 7 Lying in politics then ppl saying, yeah but they all lie 8 Colin McCahon 9 nz herald 10 Quetiapine ",,,,1234386578216062978,https://twitter.com/HpHamilton2/status/1234386578216062978
2020-03-02 05:29:44,NovalisLover,4th_WaveNow,0,0,0,"These parents should all be taking quetiapine.",,,,1234350155442212865,https://twitter.com/NovalisLover/status/1234350155442212865
2020-03-02 03:05:02,AEnglandJr,,0,0,1,"Just took 100mg of quetiapine, ask me anything before the sandman comes to whack me with a shovel",,,,1234313737907118080,https://twitter.com/AEnglandJr/status/1234313737907118080
2020-03-02 03:01:02,melestecorales,,0,0,0,"hella vodka x quetiapine x diphenhydramine = best sleep of my life",,,,1234312732339392513,https://twitter.com/melestecorales/status/1234312732339392513
2020-03-02 02:12:59,scoutbolton,,0,0,1,"well quetiapine has made me super chunky and lamotrigine has made my tooth grinding so bad that i now need to see a peridontist about surgery but i can't stop taking either because then i'm a risk to my own life ¯\_(ツ)_/¯",,,,1234300638818861056,https://twitter.com/scoutbolton/status/1234300638818861056
2020-03-02 01:21:42,skinnyxsoul,deletingfat,1,0,1,"It doesn't have any effect on me :( 3 hours later I was still up and running so I had to buy quetiapine cause its the only thing that works",,,,1234287734736318466,https://twitter.com/skinnyxsoul/status/1234287734736318466
2020-03-01 21:55:11,hans_labyrinth,,0,0,0,"SITV#? I thought I was a better me off quetiapine. I was wrong. I wish you’d met medicated me. I miss you dearly.",,,,1234235760943017985,https://twitter.com/hans_labyrinth/status/1234235760943017985
2020-03-01 21:45:31,NamasteTs,,4,1,10,"I have been advised to try Venlafaxine, and Fluoxetine, and Quetiapine, and Duloxetine, as well as stopping meds altogether by TEWV staff, despite having never been seen by a psychiatrist, and despite having never been given a diagnosis.",,,,1234233331614715904,https://twitter.com/NamasteTs/status/1234233331614715904
2020-03-01 21:41:27,_quetiapine,,0,0,0,"fck back to reality situation",,,,1234232305608097792,https://twitter.com/_quetiapine/status/1234232305608097792
2020-03-01 21:27:15,stdcrazyy,asthmaticvegan,1,0,1,"Pretty sure quetiapine is just the generic name for seroquel. I take seroquel and works really well but just be careful about the weight gain. But it’s really helpful for sleep",,,,1234228734632153088,https://twitter.com/stdcrazyy/status/1234228734632153088
2020-03-01 21:23:11,asthmaticvegan,,1,0,0,"medicated friends! I need your help. I have been prescribed seroquel and quetiapine by two different psychs, and from my understanding they’re the same drug? but I’m going back on meds today and I’m not sure which prescription I should start, if anyone has experience pls hmu",,,,1234227709753954304,https://twitter.com/asthmaticvegan/status/1234227709753954304
2020-03-01 19:58:59,lordephrim,,0,0,0,"i took quetiapine yesterday and it only knocked me out for like 10 hours which begs the question if quetiapine only incapacitates you for most of the day if youre Actually Tired",,,,1234206518649769989,https://twitter.com/lordephrim/status/1234206518649769989
2020-03-01 13:56:37,skeletonfreak86,lifeasjst_nikki,1,0,1,"Oh God mess do not help I agree!! When I was on quetiapine was my worst weightgain. Something like 6-8 stone within a year! That was not fun. Hope that you are able to find balance. I have seen your full body pics and you have a lovely figure. But all about how you feel obvs ",,,,1234115328554258434,https://twitter.com/skeletonfreak86/status/1234115328554258434
2020-03-01 13:52:52,quetiapine__,,0,0,1,"Just look at how happy i am DEYM NCT DREAM THE EFFECT YOU HAVE ON ME",,,,1234114383887781889,https://twitter.com/quetiapine__/status/1234114383887781889
2020-03-01 09:37:10,skinnyxsoul,,1,0,0,"I don't have quetiapine rn!! Ughhhhh. Im broke.",,,,1234050033634312192,https://twitter.com/skinnyxsoul/status/1234050033634312192
2020-03-01 05:27:15,quetiapine__,,1,0,3,"A thread of my TDS experience 02.29.20",,,,1233987141618716673,https://twitter.com/quetiapine__/status/1233987141618716673
2020-02-29 22:33:58,Hubriscorpus,lsolares63,0,1,1,"Seroquel This medication is used to treat certain mental/mood conditions (such as schizophrenia, bipolar disorder, sudden episodes of mania or depression associated with bipolar disorder). Quetiapine is known as an anti-psychotic drug (atypical type). ...",,,,1233883136494198784,https://twitter.com/Hubriscorpus/status/1233883136494198784
2020-02-29 22:13:36,lordephrim,,1,0,1,"has anyone taken quetiapine with tiny amounts of alcohol bc i just took it after drinking like half of a 2% beer like a clown",,,,1233878011541381121,https://twitter.com/lordephrim/status/1233878011541381121
2020-02-29 21:29:05,lordephrim,,2,0,0,"quetiapine is the best nothing else incapacitates me for 15 hours and has me feeling like a super human later. is this how neurotypical people feel about sleeping",,,,1233866808073084928,https://twitter.com/lordephrim/status/1233866808073084928
2020-02-29 21:12:56,sufferingisnot,,0,0,0,"What a nightmare. New symptoms following trauma on Wed. #pseudohallucinations #severeanxiety #disassociation #eupd #lorazepam #quetiapine #diaxepam",,,#pseudohallucinations #severeanxiety #disassociation #eupd #lorazepam #quetiapine #diaxepam,1233862743008124929,https://twitter.com/sufferingisnot/status/1233862743008124929
2020-02-29 19:36:15,janmcfarlane4,xawtistiaethx,2,0,0,"i was diagnosed at 15..its taken all this time for me to feel ok.i was put on quetiapine bout 2 years ago and i now feel okish..ive tried every medication out there.this has been the best.",,,,1233838411397632000,https://twitter.com/janmcfarlane4/status/1233838411397632000
2020-02-29 13:49:34,balfe_robert,,1,0,4,"#Akathisia #Prescribedharm see below ref Seroquel (Quetiapine) withdrawl advice from makers of the poison Astra Zeneca - Kamikaze Advice to withdraw gradually over at least 1-2 weeks ",,,#Akathisia #Prescribedharm,1233751165222969344,https://twitter.com/balfe_robert/status/1233751165222969344
2020-02-29 11:57:15,ltcmndrdata,,1,0,4,"IM FUCKING SLEEPY!!!!!!!! quetiapine check",,,,1233722901737672705,https://twitter.com/ltcmndrdata/status/1233722901737672705
2020-02-29 09:55:07,Hayden_PFC,livandIetdie,1,0,1,"I’m on Fluoxetine and Quetiapine, which help with my depresssion/anxiety. I had to stay patient with them as they can take numerous weeks to start working. Just make sure to give it time, the side effects (if you even get them) shouldn’t last for long either x",,,,1233692162895814658,https://twitter.com/Hayden_PFC/status/1233692162895814658
2020-02-29 04:52:38,CourageBipolar,GregBla81247728,0,0,0,"yeah quetiapine was the one that had the mega intense weirdass dreams including sleep hallucinations &amp; sleep paralysis. Yet also some beautiful dreams. But it didn't stabilise my moods. It is so extremely sedating though that I use a small dose to literally knock me out",,,,1233616043077013506,https://twitter.com/CourageBipolar/status/1233616043077013506
2020-02-29 04:51:06,GregBla81247728,GregBla81247728,1,0,0,"I find it hard enough to work with the raw emotion & finding calm. It's never helped to add a cocktail of drugs causing unpredictable brain effects into that mix. I was dependendant on Quetiapine for a long time, took ages to get off ",,,,1233615653883367425,https://twitter.com/GregBla81247728/status/1233615653883367425
2020-02-29 01:44:40,slugzwang,,0,0,0,"add quetiapine to the list of fun meds i get to take fellas",,,,1233568736407408641,https://twitter.com/slugzwang/status/1233568736407408641
2020-02-29 01:10:37,unskinty1,,0,0,0,"Apparently my quetiapine might be preventing me from losing weight but I can’t go to sleep without it no thots head empty",,,,1233560170912866304,https://twitter.com/unskinty1/status/1233560170912866304
2020-02-29 00:57:53,sibylpain,,3,0,21,"i honestly think i just need way more quetiapine to counteract the fluoxetine. ratio is way off which explains why my mood is extremely unstable right now. im sick of plotting my own death only to be fine 24 hours later",,,,1233556966179581952,https://twitter.com/sibylpain/status/1233556966179581952
2020-02-28 23:44:16,Jetlax,,0,0,1,"Unless you start insisting quetiapine should regularly be used for insomnia, then we'll need to have a very, very, very long talk",,,,1233538437677973505,https://twitter.com/Jetlax/status/1233538437677973505
2020-02-28 23:29:23,lordephrim,,3,0,2,"quetiapine is excellent when ur main problem is with staying asleep bc it calms down the part of ur brain that wakes u up, but the downside is im so unused to relaxing that i feel like im juliet capuletti about to be put under for fake death every time",,,,1233534693439610886,https://twitter.com/lordephrim/status/1233534693439610886
2020-02-28 23:19:16,lordephrim,,0,0,0,"yknow what.... gonna wild out and take quetiapine",,,,1233532146033266688,https://twitter.com/lordephrim/status/1233532146033266688
2020-02-28 22:23:11,kantisaloser,johnkhuszagh,0,0,3,"me but also decreasing quetiapine and mirtazapine as well pray for me",,,,1233518032905015296,https://twitter.com/kantisaloser/status/1233518032905015296
2020-02-28 21:11:34,PNDwithNo3,,5,1,56,"My psychiatrist agreed to up Quetiapine once more... And what happened: I had a really good week! Just did a late night Saintsbury's shop and didn't get my usual feeling of being surrounded by hostile people. What a different experience!! I felt so happy I had to buy flowers!",,,,1233500012002369538,https://twitter.com/PNDwithNo3/status/1233500012002369538
2020-02-28 21:11:34,ageofadrasteia,pixiegirle,1,0,4,"Exactly. I was put on clozapine despite only ever being on quetiapine. I was misdiagnosed EUPD and my actions were due to the meds not a MH issue. That drug nearly killed me and did another patient. The coroner reported it to trust and sec state for health.",,,,1233500009833881600,https://twitter.com/ageofadrasteia/status/1233500009833881600
2020-02-28 20:34:44,cymraes5,JudithHaire,0,0,2,"Quetiapine is another.",,,,1233490739889307650,https://twitter.com/cymraes5/status/1233490739889307650
2020-02-28 19:56:10,BrieflyJLynn,,0,0,1,"PSA: if you use marijuana/any other ""drugs"" (prescribed/otherwise -NO judgement): PLEASE BE RESPONSIBLE BY LOCKING IT ALL UP AWAY FROM CHILDREN. I use CBD, i smoke marijuana 4my EXTREME ANXIETY&chronic pain&take quetiapine&amp;Zoloft. EVERYTHING is under lock&amp;key! #BeResponsible",,,#BeResponsible,1233481036769714178,https://twitter.com/BrieflyJLynn/status/1233481036769714178
2020-02-28 19:34:29,Highlandista,TomJChicago,1,3,8,"Im a hospital NP and this bit of intel from Mulveney is telling. As you know, dementia patients go through periods where they don’t sleep. Often for DAYS. ESPECIALLY when there is a change of environment - it sets them off. Oh to be a fly on th wall ( with a packet of Quetiapine)",,,,1233475577102897154,https://twitter.com/Highlandista/status/1233475577102897154
2020-02-28 18:21:29,StopVaxxedLies,FrankDElia7,5,0,12,"It’s no guarantee. I’m on quetiapine &amp; hubs says I still post crazy stuff on Twitter. Having to tweet “vaccines do NOT cause autism” is crazy to him. He can’t believe I choose to deal with antivaxxers at all...",,,,1233457206378536966,https://twitter.com/StopVaxxedLies/status/1233457206378536966
2020-02-28 12:16:43,ciara_colvin,flyingawxy,1,0,1,"Ugh quetiapine is messing with me so much atm I’m piling on weight and I’m actually eating better (generally) and working out more than I was 8 months ago when I was almost 10 kilo lighter every day is a game of ‘will I fit into this today, I did last week here’s hoping’ Awful",,,,1233365410256490497,https://twitter.com/ciara_colvin/status/1233365410256490497
2020-02-28 10:52:25,Baby6891,flyingawxy,1,0,1,"I know...same here...been on Quetiapine(seroquel) for one year and a half and it just made me gain more and more weight, especially when i was getting to higher doses. So i just stopped taking them this end of Jan...",,,,1233344195378765826,https://twitter.com/Baby6891/status/1233344195378765826
2020-02-28 09:40:24,yasirmhm,,0,2,6,"Interesting study on the high prevalence of using quetiapine for elderly patients, mainly prescribed by GPs in Switzerland. NICE guidelines in dementia (2018) highlighted avoiding Quetiapine in dementia due to no benefit &amp; risk of side effects. https://bpspubs.onlinelibrary.wiley.com/doi/full/10.1111/bcp.14232 #dementia",,,#dementia,1233326073787691008,https://twitter.com/yasirmhm/status/1233326073787691008
2020-02-28 08:48:14,MedsLib,,0,0,0,"Quetiapine Fumarate Extended Release (AstraZeneca Pharmaceuticals LP): Quetiapine fumarate is an atypical antipsychotic indicated for the treatment of: Schizophrenia (1.1) Bipolar I disorder, manic, or mixed episodes (1.2) Bipolar disorder,… http://bit.ly/2uGPbfM",,,,1233312943380615168,https://twitter.com/MedsLib/status/1233312943380615168
2020-02-28 08:34:22,RxDrugLabels,,0,0,0,"Rx Package Insert: Quetiapine Fumarate Extended Release, by AstraZeneca Pharmaceuticals LP http://bit.ly/2PyPnES",,,,1233309453258194944,https://twitter.com/RxDrugLabels/status/1233309453258194944
2020-02-28 05:09:05,rscrnl,Jetlax,1,0,3,"TOTOO Guilty of not taking quetiapine when I need to pull an all-nighter but I also recognize that this is bad huhu sobrang nahhyper ako sometimes if I just take SSRIs, it gets things done but I feel like shit (When did you guys meet!! I STAN)",,,,1233257794465173504,https://twitter.com/rscrnl/status/1233257794465173504
2020-02-28 04:21:41,HDMentalHealth,flyingawxy,1,0,1,"Quetiapine was the worst frigging drug I was ever diagnosed. My weight fluctuated so much and I couldn't sleep, glad you're done with it.",,,,1233245864597942272,https://twitter.com/HDMentalHealth/status/1233245864597942272
2020-02-28 02:47:40,Blackmagecat,,0,0,0,"Btw I'm not out but the joke came to me when I was checking on my quetiapine",,,,1233222203656806402,https://twitter.com/Blackmagecat/status/1233222203656806402
2020-02-28 01:54:57,Kay37727752,,2,0,3,"Really can't sleep, but it's too late to take my quetiapine. I'm really really over-thinking and I don't like where my mind is heading.",,,,1233208938608414721,https://twitter.com/Kay37727752/status/1233208938608414721
2020-02-27 23:49:51,shecyclopedia,flyingawxy,1,0,1,"I gained weight on Quetiapine as well.",,,,1233177455315255301,https://twitter.com/shecyclopedia/status/1233177455315255301
2020-02-27 23:40:59,_quetiapine,,1,0,1,"Taena alarm alarm pa ko at 3am preparing for report at reading tas wala class sa 1st and 2nd subject ‍ ",,,,1233175224683622400,https://twitter.com/_quetiapine/status/1233175224683622400
2020-02-27 23:20:14,ArmstrongNat,flyingawxy,1,0,1,"im currently on 600mg quetiapine &amp; i gained six stone in a year! thought it was just from drinking too much (lmao) but this tweet really has me thinking ",,,,1233170001852616705,https://twitter.com/ArmstrongNat/status/1233170001852616705
2020-02-27 23:01:55,ltcmndrdata,,1,0,4,"today is day 1 of my doubled quetiapine dose and im excited to see how the first night goes. will i be knocked out for 15 hours? will i wake up from a stress dream in 5? will i, once again, have a quantum leap-esque griefdream where im trying to save my family as a kid like lea-",,,,1233165391175786497,https://twitter.com/ltcmndrdata/status/1233165391175786497
2020-02-27 22:38:32,BecciPaints,Idaisrecovering,0,0,2,"I feel you so much with that. Quetiapine has made me gain so much weight and trying to accept it is so so difficult. Just know you're beautiful no matter what your mind tells you ",,,,1233159510249951234,https://twitter.com/BecciPaints/status/1233159510249951234
2020-02-27 22:25:03,Lais_rocha1D,flyingawxy,1,0,2,"Quetiapine was one of the worst meds I've ever taken. Didn't help at ALL.",,,,1233156115531259904,https://twitter.com/Lais_rocha1D/status/1233156115531259904
2020-02-27 22:09:44,AngelScarlettB,flyingawxy,1,0,0,"On quetiapine I gained 3 stone in a couple of months. My eating habits never changed though. Haven't lost the weight since I came off",,,,1233152261334978563,https://twitter.com/AngelScarlettB/status/1233152261334978563
2020-02-27 21:57:31,flyingawxy,organflame,1,0,0,"I’ve recently been put on promethazine which isn’t an antipsychotic it’s actually an antihistamine with calming/sedative effects, I’ve taken a couple doses and it does help but not as much as quetiapine ",,,,1233149186050347008,https://twitter.com/flyingawxy/status/1233149186050347008
2020-02-27 21:35:19,txemacoll,,0,0,1,"RT lolalolail: Off‐label use of quetiapine in nursing homes: Does medical specialty of prescribing physicians play a role? - Müller - - British Journal of Clinical Pharmacology - Wiley Online Library #PtSafety https://bpspubs.onlinelibrary.wiley.com/doi/full/10.1111/bcp.14232 via sanoysalvoblog",,,#PtSafety,1233143599023501317,https://twitter.com/txemacoll/status/1233143599023501317
2020-02-27 19:24:25,prologi,,0,0,1,"Someone in the NIMBY-ish neighbourhood Facebook group I'm in found an empty blister pack of quetiapine and people are clutching their dang pearls over it. I've been on it for 5+ years and the only thing it makes me is sleepy. ",,,,1233110656058036224,https://twitter.com/prologi/status/1233110656058036224
2020-02-27 18:52:31,CaraLisette,flyingawxy,1,0,6,"This happened to me on quetiapine too, it’s what triggered my anorexia relapse",,,,1233102628231487491,https://twitter.com/CaraLisette/status/1233102628231487491
2020-02-27 18:51:14,gloomybitxh,flyingawxy,1,0,1,"fuuuck for real tho, i purposely try not to buy batteries for my scale so i don't constantly stand on it bcs i feel like i've been gaining weight and i've noticed that the quetiapine makes me more hungry/makes me wanna eat 24/7 n it bothers me so fucking much i wanna cry :(",,,,1233102307442774016,https://twitter.com/gloomybitxh/status/1233102307442774016
2020-02-27 18:10:35,mikehuitema,travels2little,1,0,0,"By far, most of the quetiapine I dispense is for sleep/anxiety, not schizophrenia",,,,1233092076960509952,https://twitter.com/mikehuitema/status/1233092076960509952
2020-02-27 18:04:23,Idchlo,flyingawxy,0,0,1,"I’ve been on quetiapine a year and I’m the only person I know who’s lost significant weight whilst being on it without trying, and my appetite is super small too ://",,,,1233090515819737089,https://twitter.com/Idchlo/status/1233090515819737089
2020-02-27 17:38:32,travels2little,,2,1,2,"#Quetiapine is another massively overprescribed antipsychotic and is associated with heart damage. However, cannabinoids can be used to prevent this heart damage (or just don't prescribe #Seroquel at all) http://ow.ly/fNRl50yxKel",,,#Quetiapine #Seroquel,1233084012354265088,https://twitter.com/travels2little/status/1233084012354265088
2020-02-27 16:44:23,skinnyxsoul,,1,0,0,"First time to take quetiapine again",,,,1233070385400176642,https://twitter.com/skinnyxsoul/status/1233070385400176642
2020-02-27 16:42:59,sewuobsuus,annefleurdd,0,0,0,"Geen quetiapine?",,,,1233070032281886720,https://twitter.com/sewuobsuus/status/1233070032281886720
2020-02-27 16:19:42,hann0ir,flyingawxy,1,0,2,"Quetiapine makes me so hungry and it’s a constant battle with my weight, it sucks!",,,,1233064172474294272,https://twitter.com/hann0ir/status/1233064172474294272
2020-02-27 14:42:43,Waffa1975,,0,0,0,"Struggling a lot... tw Tuesday night I took quite a few Quetiapine thinking it will get rid of me, I woke up 17 hours later, I was disappointed that I woke up. I've done that 3 times with Quetiapine the past few months ",,,,1233039764028346368,https://twitter.com/Waffa1975/status/1233039764028346368
2020-02-27 14:36:11,KateeHall_,flyingawxy,1,0,1,"Thanks so much for explaining you were on Quetiapine &amp; eating less but still gained weight. Since starting Quetiapine I am constantly hungry but not eating properly due to anxiety. Everyone said I needed to eat more &amp; proper meals but I saw the weight gain + argued against.",,,,1233038120490356737,https://twitter.com/KateeHall_/status/1233038120490356737
2020-02-27 14:30:27,StevesASC,flyingawxy,0,0,3,"Nowhere near as bad as Mirtazipine hunger, but Quetiapine causes me drowsiness and difficulty exercising due to low energy.",,,,1233036677645504512,https://twitter.com/StevesASC/status/1233036677645504512
2020-02-27 14:25:50,andsheshitposts,flyingawxy,1,0,2,"Literally omg. I gained 6 stone in six months on quetiapine from barely eating anything, it didnt even make me hungry it just blew me the fuck up. It's a shame because it worked so well to calm me down but nothing is worth going through that. What a drug lmao",,,,1233035516083343361,https://twitter.com/andsheshitposts/status/1233035516083343361
2020-02-27 14:21:15,flyingawxy,,55,18,195,"when I say my old meds (quetiapine) made me gain weight, people think I mean it made me hungry so I ate more but actually it didn’t. my eating didn’t change at all, I ate LESS (bc of my eating disorder) it fucked with my metabolism to where no matter what I did, I gained weight",,,,1233034362247155713,https://twitter.com/flyingawxy/status/1233034362247155713
2020-02-27 13:41:05,reiiraaa,,0,0,0,"Been taking quetiapine since 2018 and I never had that problem before until last week.",,,,1233024255995990021,https://twitter.com/reiiraaa/status/1233024255995990021
2020-02-27 13:31:57,reiiraaa,,1,0,0,"For those who are taking quetiapine, have you ever experienced having difficulty with breathing and sort of panicky after taking it? Like you have to breathe through your mouth because your nose is blocked and your heart is palpitating so bad you feel like you're gonna die?",,,,1233021958150709252,https://twitter.com/reiiraaa/status/1233021958150709252
2020-02-27 13:28:25,marketrnest,,0,0,0,"Quetiapine Fumarate Market 2020: Growth in Global Industry, Size, Growth, Key Players, Segments and Forecasts Analysis ",,,,1233021068266397696,https://twitter.com/marketrnest/status/1233021068266397696
2020-02-27 13:01:59,JAEY0NGIST,,0,0,1," — sorry i don’t read fics often and ones i read are usually old ones that everyone already know but currently i’m reading quetiapine by wirramirra!! ",,,,1233014416175771648,https://twitter.com/JAEY0NGIST/status/1233014416175771648
2020-02-27 12:29:04,depresseddumbb,,0,0,0,"Guess who slept through their doctors appointment that was for a physical and ecg and shit so I can start my quetiapine but now I have to wait another tWO FUCKIN WEEKS FOR MY PHYSICAL BC IM A DUMB BITCH WITH NO INTERNAL CLOCK APPARENTLY",,,,1233006129782886400,https://twitter.com/depresseddumbb/status/1233006129782886400
2020-02-27 11:55:56,cymraes5,GregBla81247728,0,0,0,"Oh Robert, I do feel for you. Quetiapine is so terrible in withdrawal. Shane has terrible nightmares, which take him back to the very worst times, on each reduction. Here's hoping for better news from you soon.",,,,1232997792001511425,https://twitter.com/cymraes5/status/1232997792001511425
2020-02-27 11:26:25,hrhanikka,,0,0,0,"they sell quetiapine too for like half the price of my usual ",,,,1232990363192680449,https://twitter.com/hrhanikka/status/1232990363192680449
2020-02-27 11:13:19,missinkaddikt,,3,0,5,"One more appointment down. Just my actual asd assesment to go in a couple of weeks time. The psychiatrist was very reassuring today. Says he strongly believes I'm autistic.They are giving me quetiapine to see if it helps with my impulisivity aggression and sleeping.Hope it helps",,,,1232987066323083266,https://twitter.com/missinkaddikt/status/1232987066323083266
2020-02-27 10:37:59,Jetlax,,1,0,3,"When doing medication counselling for w/ students, you HAVE to treat sedation, somnolence, impaired cognition (anticholinergic) & other cognitive side effects as SERIOUS Ex. It's shifting exams here at UST. Do u really think a student wud prioritize Quetiapine over exams? (2/2)",,,,1232978177493913600,https://twitter.com/Jetlax/status/1232978177493913600
2020-02-27 10:37:47,lolalolail,,0,3,5,"Off‐label use of quetiapine in nursing homes: Does medical specialty of prescribing physicians play a role? - Müller - - British Journal of Clinical Pharmacology - Wiley Online Library #PtSafety",,,#PtSafety,1232978126466174978,https://twitter.com/lolalolail/status/1232978126466174978
2020-02-27 10:37:27,SOGALCA,,0,0,1,"Off‐label use of quetiapine in nursing homes: Does medical specialty of prescribing physicians play a role? - Müller - - British Journal of Clinical Pharmacology - Wiley Online Library #PtSafety https://bpspubs.onlinelibrary.wiley.com/doi/full/10.1111/bcp.14232",,,#PtSafety,1232978042177425408,https://twitter.com/SOGALCA/status/1232978042177425408
2020-02-27 09:09:38,elizabe58876052,JAMAPsych,0,1,1,"I think this is very concerning given the rising off label use of quetiapine. It's grossly overused for sleep and anxiety.",,,,1232955941756125185,https://twitter.com/elizabe58876052/status/1232955941756125185
2020-02-27 07:44:49,whiteroserachel,Davidmkeynes_2,1,0,0,"Switching from quetiapine to risperidone, finally off the former and on full dose of the latter but slightly hyper and not sleeping at all well ",,,,1232934596607692800,https://twitter.com/whiteroserachel/status/1232934596607692800
