date,username,to,replies,retweets,favorites,text,geo,mentions,hashtags,id,permalink
2020-01-21 17:17:51,mrmattfair,,0,0,1,"ICYMI: Philly Risperdal plaintiff can have a little punitive damage award, as a treat. ",,,,1219670453385617410,https://twitter.com/mrmattfair/status/1219670453385617410
2020-01-21 17:03:32,CarrierMgmt,,0,1,0,"$8B Risperdal Award Against J&amp;J Slashed to $6.8M ",,,,1219666853728964609,https://twitter.com/CarrierMgmt/status/1219666853728964609
2020-01-21 16:43:47,RachelBeth99,,0,0,1,"Maidin mhaith again... Sipping peppermint tea, going, 'you really serious, right?' to my doctor, who thinks some- not all- of my #mentalhealth problems can be solved with added Risperdal. It didn't work years ago. Why now? #WritingCommunity #12minutestorainbows #amwriting",,,#mentalhealth #WritingCommunity #12minutestorainbows #amwriting,1219661881696088064,https://twitter.com/RachelBeth99/status/1219661881696088064
2020-01-21 16:25:06,IssuesOfSafety,,0,0,0,"Judge Slashes Damages in J&J Risperdal Case to $6.8 Million From $8 Billion https://www.wsj.com/articles/judge-slashes-8-billion-jury-award-against-johnson-johnson-to-6-8-million-in-risperdal-case-11579291494 - J&amp;J had been ordered to pay in suit involving its antipsychotic drug Risperdal",,,,1219657181529767945,https://twitter.com/IssuesOfSafety/status/1219657181529767945
2020-01-21 16:17:17,hammametsou,,0,0,0,"LOL every time a company is fined a judge reduces the fine to nearly nothing! #corruptsystem - Judge slashes $8 billion Risperdal award against Johnson &amp; Johnson... ",,,#corruptsystem,1219655212073410560,https://twitter.com/hammametsou/status/1219655212073410560
2020-01-21 15:58:05,Recursion_Agent,FosteSherman,2,0,1,"Have you heard of risperdal?",,,,1219650381657124864,https://twitter.com/Recursion_Agent/status/1219650381657124864
2020-01-21 15:55:04,Surviving_SpEd,,0,1,2,"Judge Slashes Verdict In Risperdal Case Selected for you by @surviving_SpEd https://www.disabilityscoop.com/2020/01/21/judge-slashes-verdict-risperdal/27678/ #mustread #feedly",,@Surviving_SpEd,#mustread #feedly,1219649622941093888,https://twitter.com/Surviving_SpEd/status/1219649622941093888
2020-01-21 15:44:30,drpatfarrell,,0,0,0,"Judge lowers J&J Risperdal settlement by $1.2 billion http://bitly.com/2sPFBGw",,,,1219646963613929473,https://twitter.com/drpatfarrell/status/1219646963613929473
2020-01-21 15:33:44,JA_Davids,JA_Davids,0,0,0,"A judge has cut the risperdal payout from $8 billion to $6.8 million. https://www.reuters.com/article/us-johnson-johnson-risperdal-idUSKBN1ZG293",,,,1219644254097694722,https://twitter.com/JA_Davids/status/1219644254097694722
2020-01-21 15:20:07,broughtonprtnrs,,0,0,0,"A Philadelphia County judge agreed Friday to cut an $8 billion punitive damages verdict against a Johnson & Johnson subsidiary to $6.8 million in a landmark case over side effects associated with the antipsychotic drug Risperdal. http://ow.ly/vC6m50y0T4d",,,,1219640828102086657,https://twitter.com/broughtonprtnrs/status/1219640828102086657
2020-01-21 15:01:32,pharmacychecker,,0,0,0,"""A Philadelphia judge on Friday slashed an $8 billion jury verdict in a lawsuit over the marketing of the antipsychotic drug Risperdal, reducing the punitive damages to $6.8 million."" ",,,,1219636148378783745,https://twitter.com/pharmacychecker/status/1219636148378783745
2020-01-21 12:45:04,Brian_Uberig,,0,0,0,"Judge slashes $8 billion Risperdal award against Johnson &amp; Johnson to $6.8 million - Reuters http://ow.ly/a9Bu30qb7DS",,,,1219601805467930625,https://twitter.com/Brian_Uberig/status/1219601805467930625
2020-01-21 11:07:06,edaccessible,,0,1,0,"Take a look @debraruh Judge Slashes Verdict In Risperdal Case https://www.disabilityscoop.com/2020/01/21/judge-slashes-verdict-risperdal/27678/ #inclusion #disability",,@debraruh,#inclusion #disability,1219577154083729408,https://twitter.com/edaccessible/status/1219577154083729408
2020-01-21 09:27:00,newsfilterio,,0,0,0,"Judge reduces J&J Risperdal damages 99.9% $JNJ",,,,1219551961479110656,https://twitter.com/newsfilterio/status/1219551961479110656
2020-01-21 08:01:10,Commerceof76,,0,0,0,"RT PJDAnnunzioTLI: RT MMitchellTLI: That $8 billion Risperdal verdict that rocked the mass torts arena last year has been significantly cut down by the Phila. judge who oversaw the case: https://www.law.com/thelegalintelligencer/2020/01/17/phila-judge-knocks-8-billion-risperdal-verdict-down-to-6-8-million/ #Corruption #Philly #Philadelphia #Realestate #Med #Ed #SayNoToCorr…",,,#Corruption #Philly #Philadelphia #Realestate #Med #Ed #SayNoToCorr,1219530359508996096,https://twitter.com/Commerceof76/status/1219530359508996096
2020-01-21 07:57:09,newsfilterio,,0,0,0,"Judge slashes $8 billion Risperdal award against Johnson &amp; Johnson to $6.8 million $JNJ",,,,1219529350514728960,https://twitter.com/newsfilterio/status/1219529350514728960
2020-01-21 06:59:00,newsfilterio,,0,0,0,"UPDATE 1-Judge slashes $8 bln Risperdal award against Johnson &amp; Johnson to $6.8 mln $JNJ",,,,1219514715367510016,https://twitter.com/newsfilterio/status/1219514715367510016
2020-01-21 06:47:00,newsfilterio,,0,0,0,"Judge slashes $8 bln Risperdal award against Johnson &amp; Johnson to $6.8 mln $JNJ https://newsfilter.io/articles/judge-slashes-8-bln-risperdal-award-against-johnson--johnson-to-68-mln-b46556efdff54a886952808c97a52363",,,,1219511695963541505,https://twitter.com/newsfilterio/status/1219511695963541505
2020-01-21 06:23:12,MinJunYu,,0,0,0,"Johnson & Johnson Hit With $8 Billion Jury Verdict in Risperdal Suit ",,,,1219505707558436866,https://twitter.com/MinJunYu/status/1219505707558436866
2020-01-21 06:04:34,blog4forall,,0,0,0,"Judge Cuts Johnson & Johnson Damages in Risperdal Case From $8 Billion to $6.8 Million https://thekillerpunch.com.ng/choose-cuts-johnson-johnson-damages-in-risperdal-case-from-eight-billion-to-6-eight-million/",,,,1219501017118670848,https://twitter.com/blog4forall/status/1219501017118670848
2020-01-21 05:41:44,JosephDNieves2,jpus_br,0,0,1,"Good Night Ricky, I get my Risperdal Shot Tomorrow Tuesday Jan 21,2020... Where is SUPERMAN when you need him. Love Joseph. ",,,,1219495271731580928,https://twitter.com/JosephDNieves2/status/1219495271731580928
2020-01-21 05:07:03,disabilityscoop,,0,5,7,"A judge chopped an $8 billion award to a man who claimed the maker of #Risperdal failed to warn that boys using the drug — commonly prescribed to those with #autism — could grow breasts. https://www.disabilityscoop.com/2020/01/21/judge-slashes-verdict-risperdal/27678/ #disabilities #specialneeds",,,#Risperdal #autism #disabilities #specialneeds,1219486545058635778,https://twitter.com/disabilityscoop/status/1219486545058635778
2020-01-21 04:33:31,TriviumMethod,mip_MIIP,0,0,0,"Did you notice the multiple pharmaceutical commercials? They were removed in the re-airing today. Johnsons & Johnson makes vaccines. They also just settled a lawsuit for misuse of Risperdal. Can you see the vested interest and contradictions? https://www.nytimes.com/2019/10/08/health/johnson-and-johnson-risperdal-verdict.html",,,,1219478102566293504,https://twitter.com/TriviumMethod/status/1219478102566293504
2020-01-21 03:37:03,DrGurdeepParhar,,0,1,1,"Judge slashes $8 billion Risperdal award against Johnson &amp; Johnson to $6.8 million #healthnews",,,#healthnews,1219463894109999105,https://twitter.com/DrGurdeepParhar/status/1219463894109999105
2020-01-21 03:16:45,SPINENOTFINE,,0,2,2,"J&J's $8B Jury Award in Risperdal Case Cut to $6.8M by Judge https://finance.yahoo.com/news/j-js-8b-jury-award-131701594.html?soc_src=social-sh&amp;soc_trk=tw via @YahooFinance",,@YahooFinance,,1219458786596835328,https://twitter.com/SPINENOTFINE/status/1219458786596835328
2020-01-21 02:03:13,NYTHealth,,2,4,10,"In October, a jury said Johnson & Johnson should pay $8 billion over charges it downplayed the effects of the anti-psychotic drug Risperdal. On Friday, a judge reduced that amount to $6.8 million. ",,,,1219440281109651456,https://twitter.com/NYTHealth/status/1219440281109651456
2020-01-20 23:45:11,18AKGOYAL,,0,0,0,"Judge slashes USD 8 bn Risperdal award against J&amp;J to USD 6.8 mn ",,,,1219405543980199937,https://twitter.com/18AKGOYAL/status/1219405543980199937
2020-01-20 22:29:57,will_e_yums,joevettweets,1,0,2,"Xarelto Pelvic Mesh Risperdal Fentanyl Patches Asbestos - Talc Opioids ++++++ Consumers will shop elsewhere, J&amp;J tarnished its image and trust. Speaking of which...I didn’t know J&amp;J partnered with Bayer/Monsanto!! Isn’t that cute! Stick a fork in J&amp;J, they are done!",,,,1219386609461878789,https://twitter.com/will_e_yums/status/1219386609461878789
2020-01-20 22:28:02,MaestroGaeta,CorpWatch,0,0,1,"My mama was prescribed Risperdal once. As much as she thought psyche drugs were toxic and would make her worse, due to her SMI, I of course despised having to try and get her to take some to get her better/well. F the system. ",,,,1219386125447335936,https://twitter.com/MaestroGaeta/status/1219386125447335936
2020-01-20 22:07:02,CorpWatch,,0,2,0,"Philadelphia judge slashes $8 billion jury verdict against #Johnson&amp;Johnson for playing down the risks of #Risperdal, an antipsychotic drug, to $6.8 million https://buff.ly/3at7Ond",,,#Johnson #Risperdal,1219380842830667777,https://twitter.com/CorpWatch/status/1219380842830667777
2020-01-20 20:38:05,AccessWallST,,0,0,0,"J&amp;amp;J's $8B Jury Award in Risperdal Case Cut to $6.8M by Judge http://bit.ly/37ergSG",,,,1219358455556988928,https://twitter.com/AccessWallST/status/1219358455556988928
2020-01-20 20:23:03,Rebecca37618246,,0,0,0,"this compltmation remineds me of being on risperdal going stone henge with dave dawson i had hope on risperdal but nothing else dicpexal toke my hope the sun carnt save me",,,,1219354674782003201,https://twitter.com/Rebecca37618246/status/1219354674782003201
2020-01-20 20:01:40,__Algernon_,__Algernon_,0,0,0,"Allen, when Jannsen was paying you (and colleagues) $500,000 to write the Risperdal guidelines - which David Rothman called a MARKETING venture- was that because you couldn't pay the rent?",,,,1219349291132760065,https://twitter.com/__Algernon_/status/1219349291132760065
2020-01-20 18:07:18,DennisJ18738329,,0,0,0,"My risperdal rx went from $14 for one monrh supply to $56 on new florida blue hmo plan for 2020. Risperadone is a generic rx for bipolar @BernieSanders",,@BernieSanders,,1219320510087155713,https://twitter.com/DennisJ18738329/status/1219320510087155713
2020-01-20 18:02:12,AboutLawsuits,,0,1,0,"Judge Determines Johnson & Johnson Should Be Required to Pay $6.8M in Punitive Damage For Failing to Warn About Risperdal Risks ",,,,1219319227997413376,https://twitter.com/AboutLawsuits/status/1219319227997413376
2020-01-20 15:58:11,smarket,,4,12,58,"A man who said he grew breasts after taking Johnson & Johnson’s drug Risperdal sued the company and was awarded $8 billion in settlement....WHAAAT $8 BILLION. A Pennsylvania state court trial judge slashed it down to $6 million. ",,,,1219288017854193665,https://twitter.com/smarket/status/1219288017854193665
2020-01-20 15:19:09,JosephDNieves2,jpus_br,0,0,0,"Good Morning Ricky, I get my Risperdal Injection Tuesday tomorrow well I am do for it I usually wake up at 5 Am I woke up at 7 am on a Monday. I am Pretty sure I had a Shizerd this morning my head was pounding. Any ways I talk to you later. Love Jos.",,,,1219278195540672512,https://twitter.com/JosephDNieves2/status/1219278195540672512
2020-01-20 14:45:24,NYTHealth,,1,12,10,"In October, a jury said Johnson & Johnson should pay $8 billion over charges it downplayed the effects of the anti-psychotic drug Risperdal. On Friday, a judge reduced that amount to $6.8 million. https://nyti.ms/37bidCj",,,,1219269703362891777,https://twitter.com/NYTHealth/status/1219269703362891777
2020-01-20 12:35:59,newsfilterio,,0,0,0,"J&J's $8B Jury Award in Risperdal Case Cut to $6.8M by Judge $JNJ $ENDP $TEVA $MNK",,,,1219237133187264512,https://twitter.com/newsfilterio/status/1219237133187264512
2020-01-20 12:34:21,newswelldone,,0,0,0,"$JNJ $ENDP $TEVA $MNK: J&amp;J’s $8B Jury Award in Risperdal Case Cut to $6.8M by Judge: https://www.StockNewsWires.com/jnj-endp-teva-mnk-jjs-8b-jury-award-in-risperdal-case-cut-to-6-8m-by-judge/",,,,1219236721805623296,https://twitter.com/newswelldone/status/1219236721805623296
2020-01-20 11:11:21,ThePharmaLetter,,0,0,0,"Risperdal fine reduced to still massive $6.8 billion https://www.thepharmaletter.com/article/risperdal-fine-reduced-to-still-massive-6-8-billion @JNJNews #pharma",,@JNJNews,#pharma,1219215835799216128,https://twitter.com/ThePharmaLetter/status/1219215835799216128
2020-01-20 10:58:10,healthcarejon,,0,0,0,"US judge slashes Johnson & Johnson damages in Risperdal case : http://bit.ly/30CTXWW #pharmaceutical",,,#pharmaceutical,1219212515353206784,https://twitter.com/healthcarejon/status/1219212515353206784
2020-01-20 10:41:49,ComAware_4S,,0,1,0,"Judge cuts $8bn J&J Risperdal verdict to $6.8m ",,,,1219208403878338560,https://twitter.com/ComAware_4S/status/1219208403878338560
2020-01-20 10:39:18,CareerBiotech,,0,0,0,"#jobs US judge slashes Johnson &amp; Johnson damages in Risperdal case https://goo.gl/fb/69oSKX #pharmafile",,,#jobs #pharmafile,1219207769410195456,https://twitter.com/CareerBiotech/status/1219207769410195456
2020-01-20 10:34:43,Pharmafocus,,0,0,0,"US judge slashes Johnson & Johnson damages in Risperdal case http://bit.ly/2sGbalT",,,,1219206613887864832,https://twitter.com/Pharmafocus/status/1219206613887864832
2020-01-20 06:54:44,HCREPORT2019,,0,0,0,"Judge slashes $8 billion Risperdal award against Johnson &amp; Johnson to $6.8 million... http://bit.ly/2NaOZxi",,,,1219151252640206849,https://twitter.com/HCREPORT2019/status/1219151252640206849
2020-01-20 03:27:21,NYTHealth,,3,12,8,"In October, a jury said Johnson & Johnson should pay $8 billion over charges it downplayed the effects of the anti-psychotic drug Risperdal. On Friday, a judge reduced that amount to $6.8 million. ",,,,1219099065889296384,https://twitter.com/NYTHealth/status/1219099065889296384
2020-01-20 01:40:19,ConfusedFoliage,,0,1,1,"Who got the risperdal plug I’m trynna get tits",,,,1219072130878332928,https://twitter.com/ConfusedFoliage/status/1219072130878332928
2020-01-20 01:22:09,ritabook58,CharlesWedley,0,0,0,"Nice hefty dose of Risperdal Consta",,,,1219067559099748352,https://twitter.com/ritabook58/status/1219067559099748352
2020-01-20 01:03:26,drbotmd,,0,0,0,"Ciaperifin (opiod painkiller) Approved to treat analgesic overdose and congenital troll disease Contraindicated by Risperdal",,,,1219062847856168960,https://twitter.com/drbotmd/status/1219062847856168960
2020-01-19 23:38:56,JohnSmi37563557,davidhogg111,0,1,0,"Have u ever met one? When? Where? What happened? How did you react when you realized you were having a deluaion that you were in 1940's Nazi Germany? Are you taking risperdal as prescribed now? Or are you still playing games with your mental health?",,,,1219041581770137601,https://twitter.com/JohnSmi37563557/status/1219041581770137601
2020-01-19 23:05:42,mcdingus2,sourglue,1,0,1,"Imo it’s better than other antipsychotics, less sedating, less emotional blunting, less weight gain (5-10 lb compared to 30+ on risperdal). It’s novel that it’s approved to treat bipolar depression. Only downside is there’s no generic but i just pay like $10 after insurance",,,,1219033217573052421,https://twitter.com/mcdingus2/status/1219033217573052421
2020-01-19 21:49:38,AmericasCousin,LizMednick,1,1,1,"Liz's team is so teeming with political malpractice. I can't wrap my brain around it. You know she has a fact check on her website that says: ""ELIZABETH WARREN DOES NOT TAKE RISPERDAL"" We both know what that does. It's ""Hi, I'm Christine O'Donnell and I'm not a witch.""",,,,1219014077520973824,https://twitter.com/AmericasCousin/status/1219014077520973824
2020-01-19 21:41:42,Christinalynnw5,,0,0,0,"1/17/20 REUTERS 19:35:38 REUTERS Copyright (c) 2020 Thomson Reuters January 17, 2020 Judge slashes $8 bln Risperdal award against Johnson &amp; Johnson to $6.8 mln Jonathan Stempel (Reuters) - A Pennsylvania judge on... https://www.facebook.com/mizmartin36/posts/817375125353121",,,,1219012077513256969,https://twitter.com/Christinalynnw5/status/1219012077513256969
2020-01-19 20:32:45,phillytechnews,,0,0,0,"J&J had been ordered to pay damages in suit alleging its antipsychotic drug Risperdal caused male breast growth https://www.wsj.com/articles/judge-slashes-8-billion-jury-award-against-johnson-johnson-to-6-8-million-in-risperdal-case-11579291494 via @WSJ",,@WSJ,,1218994725363036161,https://twitter.com/phillytechnews/status/1218994725363036161
2020-01-19 18:54:18,tracygreen,NYTHealth,0,0,0,"That was a large punitive damage award for an individual even at $6.8 million. The plaintiff started taking Risperdal at 9 years old and he had autism and it was given to treat his side effects of autism but had side effect of growing breasts — a condition known as gynecomastia.",,,,1218969953241448448,https://twitter.com/tracygreen/status/1218969953241448448
2020-01-19 18:35:00,NYTHealth,,2,13,20,"In October, a jury said Johnson & Johnson should pay $8 billion over charges it downplayed the effects of the anti-psychotic drug Risperdal. On Friday, a judge reduced that amount to $6.8 million. https://nyti.ms/2ufW86I",,,,1218965096237621250,https://twitter.com/NYTHealth/status/1218965096237621250
2020-01-19 18:00:22,ChronLaw,,0,0,0,"Phila. Judge Knocks $8 Billion Risperdal Verdict Down to $6.8 Million - ",,,,1218956378292748292,https://twitter.com/ChronLaw/status/1218956378292748292
2020-01-19 16:43:03,nytimesbusiness,,2,7,6,"In October, a jury said Johnson & Johnson should pay $8 billion over charges it downplayed the effects of the anti-psychotic drug Risperdal. On Friday, a judge reduced that amount to $6.8 million. ",,,,1218936919935025154,https://twitter.com/nytimesbusiness/status/1218936919935025154
2020-01-19 13:40:37,moredegan,,0,1,1,"“Family compay” Johnson & Johnson lawsuits by 100,000 plaintiffs*: -Infant’s Tylenol (children’s tylenol @+price) -16,800** talc suits (ovarian cancer/mesothelioma) -Risperdal breast growth in boys -claims opioid non-addictive, effective painkiller *@barronsonline ** @nytimes",,@nytimes,,1218891010027159552,https://twitter.com/moredegan/status/1218891010027159552
2020-01-19 11:33:17,HealthNews_b,,0,0,0,"Judge slashes $8 billion Risperdal award against J&amp;J to $6.8 million https://www.plow.io/post/judge-slashes-8-billion-risperdal-award-against-jj-to-68-million?utm_source=Twitter&amp;utm_campaign=Health +1 VigorBot #Health",,,#Health,1218858967016902656,https://twitter.com/HealthNews_b/status/1218858967016902656
2020-01-19 09:10:19,MarketCurrents,,0,2,2,"$JNJ - Judge reduces J&amp;J Risperdal damages 99.9% ",,,,1218822985676517376,https://twitter.com/MarketCurrents/status/1218822985676517376
2020-01-19 08:34:27,AmericasCousin,v_verite,0,1,1,"100%. Her team misfired. I mean at this point it's such malpractice over and over it makes one wonder what is going on there. Who puts ""Elizabeth Warren does not take Risperdal"" on their own website? That's the Christine O'Donnell error. ""Hi. I am not a witch!""",,,,1218813961925283840,https://twitter.com/AmericasCousin/status/1218813961925283840
2020-01-19 08:26:06,NutritionDiet,,0,0,0,"Judge slashes $8 billion Risperdal award against Johnson &amp; Johnson to $6.8 million ... more at https://ift.tt/2cwYgII",,,,1218811857991094273,https://twitter.com/NutritionDiet/status/1218811857991094273
2020-01-19 03:51:35,NYTHealth,,10,19,23,"In October, a jury said Johnson & Johnson should pay $8 billion over charges it downplayed the effects of the anti-psychotic drug Risperdal. On Friday, a judge reduced that amount to $6.8 million. https://nyti.ms/2tzIewr",,,,1218742774033453056,https://twitter.com/NYTHealth/status/1218742774033453056
2020-01-19 01:46:56,salilkallianpur,,0,0,0,"Judge cuts $8bn J&J Risperdal verdict to $6.8m https://amp.ft.com/content/a14d06f4-396e-11ea-a6d3-9a26f8c3cba4",,,,1218711405978718208,https://twitter.com/salilkallianpur/status/1218711405978718208
2020-01-19 00:32:03,Palululs,,0,0,0,"~I'm in a mental hospital with a crystal ball Tryna see, will I still be like this tomorrow? Risperdal, voices whisper~",,,,1218692562363523072,https://twitter.com/Palululs/status/1218692562363523072
2020-01-19 00:10:36,TriviumMethod,,1,0,0,"Thirdly, the first commercial prior to the next segment is a pharmaceutical company!! The third commercial is from Johnson & Johnson!!! Who, in case you missed it, just settled a case for their misuse of the drug Risperdal!!! ",,,,1218687163098787841,https://twitter.com/TriviumMethod/status/1218687163098787841
2020-01-19 00:02:09,nytimesbusiness,,0,5,3,"In October, a jury said Johnson & Johnson should pay $8 billion over charges it downplayed the effects of the anti-psychotic drug Risperdal. On Friday, a judge reduced that amount to $6.8 million. https://nyti.ms/378228I",,,,1218685038105104385,https://twitter.com/nytimesbusiness/status/1218685038105104385
2020-01-18 22:41:59,NikitaKitty,,0,0,0,"Judge slashes $8 billion Risperdal award against Johnson &amp; Johnson to $6.8 million https://finance.yahoo.com/news/judge-slashes-8-billion-risperdal-185850891.html?soc_src=social-sh&amp;soc_trk=tw via @YahooFinance",,@YahooFinance,,1218664860340441093,https://twitter.com/NikitaKitty/status/1218664860340441093
2020-01-18 22:38:32,FayeLongmuir,,0,0,0,"Judge cuts $8bn J&J Risperdal verdict to $6.8m https://www.ft.com/content/a14d06f4-396e-11ea-a6d3-9a26f8c3cba4 via @FT",,@FT,,1218663992740069376,https://twitter.com/FayeLongmuir/status/1218663992740069376
2020-01-18 22:31:12,ZAQSBusiness,,0,0,0,"J&J Risperdal damages slashed from $8 billion to $6.8 million -- Original settlement stemmed from the case of a man who said taking the drug as a boy caused him to grow breasts. -- Jan 17 https://www.cbsnews.com/news/judge-slashes-8-billion-risperdal-award-against-johnson-johnson-to-6-8-million/",,,,1218662146516516864,https://twitter.com/ZAQSBusiness/status/1218662146516516864
2020-01-18 22:12:11,wayne_wyneeh,,0,0,0,"Judge in landmark $8 billion Risperdal case cuts punitive damages award down to $6.8 million ",,,,1218657361251880960,https://twitter.com/wayne_wyneeh/status/1218657361251880960
2020-01-18 21:30:16,Tintedeyekay,,0,1,0," It's impossible to list 'em all And in the midst of all this I'm in a mental hospital with a crystal ball Tryna see, will I still be like this tomorrow? Risperdal, voices whisper My fist is balled back up against the wall, pencil drawn This is just the song to go ballistic on",,,,1218646812598394880,https://twitter.com/Tintedeyekay/status/1218646812598394880
2020-01-18 19:04:13,reallyelijahg,,0,0,0,"Feeling paranoid. Probably should be taking my risperdal in the morning because it's my anti-psychotic medication. Helps with paranoia.",,,,1218610058608750592,https://twitter.com/reallyelijahg/status/1218610058608750592
2020-01-18 17:43:43,NYTHealth,,0,6,2,"In October, a jury said Johnson & Johnson should pay $8 billion over charges it downplayed the effects of the anti-psychotic drug Risperdal. On Friday, a judge reduced that amount to $6.8 million. https://nyti.ms/2R3EYT0",,,,1218589801970053121,https://twitter.com/NYTHealth/status/1218589801970053121
2020-01-18 16:38:09,LatestComments,,0,0,0,"Judge Slashes $8 billion Risperdal award against Johnson &amp; Johnson to $6.8 million - http://www.latestcommentary.com/judge-slashes-8-billion-risperdal-award-against-johnson-johnson-to-6-8-million/ #LatestComments",,,#LatestComments,1218573300970016768,https://twitter.com/LatestComments/status/1218573300970016768
2020-01-18 16:36:43,BeachBum_N_SC,,0,0,0,"Judge slashes $8 billion Risperdal award against Johnson &amp; Johnson to $6.8 million Sad https://finance.yahoo.com/news/judge-slashes-8-billion-risperdal-185850891.html?soc_src=community&amp;soc_trk=tw via @Yahoo",,@Yahoo,,1218572940628783104,https://twitter.com/BeachBum_N_SC/status/1218572940628783104
2020-01-18 15:52:24,dougcarl88181,,0,0,0,"Judge slashes $8 billion Risperdal award against Johnson ",,,,1218561788926578688,https://twitter.com/dougcarl88181/status/1218561788926578688
2020-01-18 15:44:59,RoeFrazer,,0,0,0,"all will appeal now – J&J gets $8B jury verdict slashed to $6M in suit alleging its antipsychotic drug Risperdal caused male breast growth https://www.wsj.com/articles/judge-slashes-8-billion-jury-award-against-johnson-johnson-to-6-8-million-in-risperdal-case-11579291494 via @WSJ",,@WSJ,,1218559921312141315,https://twitter.com/RoeFrazer/status/1218559921312141315
2020-01-18 15:33:54,howappealing,,0,0,0,"“Remember that $8 billion Risperdal verdict? A Philly judge has drastically slashed it.” Christian Hetrick has this article in today’s edition of The Philadelphia Inquirer. Peter Loftus of The Wall Street Journal reports that “Judge Slashes Damages in J&amp;J https://howappealing.abovethelaw.com/2020/01/18/#110786",,,,1218557132989194243,https://twitter.com/howappealing/status/1218557132989194243
2020-01-18 15:25:49,Smokeisngb,,0,0,0,"And in the midst of all this I'm in a mental hospital with a crystal ball Tryna see, will I still be like this tomorrow? Risperdal, voices whisper My fist is balled back up against the wall, pencil drawn This is... https://www.facebook.com/100004395589429/posts/1460372277452611/",,,,1218555097178832902,https://twitter.com/Smokeisngb/status/1218555097178832902
2020-01-18 15:24:19,kimvie,,0,0,0,"""Pa. Justices Revive Thousands of Risperdal Cases Previously Tossed as Untimely"" ""https://at.law.com/YhgnWg?cmp=share_twitter"" via @thelegalintel",,@thelegalintel,,1218554720031268866,https://twitter.com/kimvie/status/1218554720031268866
2020-01-18 15:18:08,kimvie,,0,0,1,"""A Tennessee man’s $70 million Risperdal award will stand, and the case could be eligible for punitive damages as well"" ",,,,1218553162614956036,https://twitter.com/kimvie/status/1218553162614956036
