date,username,to,replies,retweets,favorites,text,geo,mentions,hashtags,id,permalink
2020-03-05 16:00:55,boythatshayle,,1,0,0,"i gotta find babysitter study & go to work & on topp of all lat im floating off ah seroquel. kill me now ",,,,1235596160104095744,https://twitter.com/boythatshayle/status/1235596160104095744
2020-03-05 15:26:26,D0mina_Diana,aspringbaby,0,0,2,"I'd personally kill for it. I'm on high doses of Seroquel and it isn't as good helping me sleep through nightmars and night terrors",,,,1235587480583315456,https://twitter.com/D0mina_Diana/status/1235587480583315456
2020-03-05 15:24:31,miercolesgbr,,0,1,0,"me: if you were diabetic you wouldn’t think twice about taking your insulin right? so your Seroquel is the same thing also me: I would rather smoke CRACK than take lithium gimme the ROCK",,,,1235587001002287104,https://twitter.com/miercolesgbr/status/1235587001002287104
2020-03-05 11:34:59,lisalovespepsi_,,0,0,0,"The Seroquel I take at night gives me awful dry mouth ",,,,1235529233734094848,https://twitter.com/lisalovespepsi_/status/1235529233734094848
2020-03-05 10:51:59,tinywaluigi,,0,0,2,"i fell asleep while brushing my teeth last night and that’s on seroquel",,,,1235518415772749830,https://twitter.com/tinywaluigi/status/1235518415772749830
2020-03-05 10:31:30,shinymoItres,,0,0,2,"dude i take 300mg of seroquel before i sleep &amp; instead of taking my morning medication today i took ANOTHER seroquel accidentally that's 600mg in 12 hours im an idiot!!!",,,,1235513258859270144,https://twitter.com/shinymoItres/status/1235513258859270144
2020-03-05 09:22:49,sugarsugarlbs,,0,0,0,"didn't take my seroquel and my lithium feeling kinda manic lol I'm so dumb",,,,1235495973247426561,https://twitter.com/sugarsugarlbs/status/1235495973247426561
2020-03-05 09:16:01,ThousandsOfBees,meredith_e_w,0,0,1,"My bag often contains: Hormones, laptop, battery pack, drinks, a meal, umbrella, collar, toothbrush, tweezers, seroquel, dex, anti-acids. I used to carry every prescription, my passport and my birth certificate with me too.",,,,1235494263124709377,https://twitter.com/ThousandsOfBees/status/1235494263124709377
2020-03-05 08:41:22,steveouttrim,LYHITM,6,1,11," Brett: army CID SueSue: ex-military Messiah: spook SGT Seroquel: DEA, army, magician Kelly: married to biker gang criminal, bangs satanists Cheri: witch Enigma: sorcerer Mrs Enigma: witch Farkness: chaos magic Lestat: chaos magic Def: IARPA Anyone else seeing a pattern here? ",,,,1235485542701096960,https://twitter.com/steveouttrim/status/1235485542701096960
2020-03-05 08:02:57,drawlinasshoe,,0,0,0,"I’m off tha Seroquel pack",,,,1235475874012704768,https://twitter.com/drawlinasshoe/status/1235475874012704768
2020-03-05 07:45:59,yofavfinenurse,TIP_on_TOP,1,0,1,"She gettin on my nerves done had 50 of seroquel and 5 of ambien , it aint touched her",,,,1235471607885451269,https://twitter.com/yofavfinenurse/status/1235471607885451269
2020-03-05 07:28:39,tibbare,,0,0,0,"explain to me how i took my seroquel 90 minutes ago and it hasn't kicked in",,,,1235467245599494144,https://twitter.com/tibbare/status/1235467245599494144
2020-03-05 06:48:12,burntciaga,,1,0,2,"seroquel was and will always b my one and only true love",,,,1235457063188234240,https://twitter.com/burntciaga/status/1235457063188234240
2020-03-05 06:46:55,mysticwonderss,,2,0,1,"After seroquel, my doctor just kept prescribing me different types of medications in a short time frame too.. it was pretty fucked.. none of them really worked...maybe except for one which was #cymbalta I was losing weight on that one and felt focused and happy..",,,#cymbalta,1235456742965813248,https://twitter.com/mysticwonderss/status/1235456742965813248
2020-03-05 06:36:13,mysticwonderss,,1,0,1,"As I was weaning off of Seroquel, I was experiencing terrible withdrawal effects so I was VERY out of it. This was in July just before my birthday literally 3 days before my birthday.. work called me and cancelled all my shifts due to my own stupidness",,,,1235454047655624704,https://twitter.com/mysticwonderss/status/1235454047655624704
2020-03-05 06:33:48,mysticwonderss,,1,0,1,"I was on #seroquel for a year and a half before I decided to get off of it due to all the weight gain. But not only that.. being on that medication cost me by retail job.",,,#seroquel,1235453442539368453,https://twitter.com/mysticwonderss/status/1235453442539368453
2020-03-05 06:30:35,mysticwonderss,,1,0,1,"I was just really good at holding my alcohol.. Seroquel made me more moody.. tired.. it made me drink MORE.. it made me NOT care. And I was also self-harming every. Single. Day. It got so bad in June that I was overdosing on pills.. i remember one night I never made it. ",,,,1235452629964161024,https://twitter.com/mysticwonderss/status/1235452629964161024
2020-03-05 06:27:44,mysticwonderss,,1,0,1,"While on #seroquel I was always publicly intoxicated. I was always getting myself in trouble. I would always attend AA meetings while under the influence.. like I just DID NOT CARE. When I used to be a cashier, I would even attend work drunk but no one really knew..",,,#seroquel,1235451915418382337,https://twitter.com/mysticwonderss/status/1235451915418382337
2020-03-05 06:24:32,mysticwonderss,,1,0,1,"I was in Seroquel for a LONG time, longer then I've been on prozac. I thought it was working but it made me gain A LOT of weight. I was very emotional and just outtt of it.. big time.. i kept starting fights with people. I had no filter, like saying the wrong things..",,,,1235451109541425154,https://twitter.com/mysticwonderss/status/1235451109541425154
2020-03-05 06:23:05,mysticwonderss,,1,0,1,"My experience with #seroquel was not the best. I have many horror stories, literally. I became very manic -psychotic. I'm not sure what the proper word to use is...... let's just say, being on seroquel, i felt like a different person - Almost as if someone was taking over ME",,,#seroquel,1235450744972574720,https://twitter.com/mysticwonderss/status/1235450744972574720
2020-03-05 06:21:36,mysticwonderss,,1,0,2,"#citalopram #celexa #Cymbalta #seroquel #prozac I had high hopes for these medications. I didn't want to give up! I wanted to feel better! I thought SOME medication will eventually work &amp; make me feel better. I was wrong!",,,#citalopram #celexa #Cymbalta #seroquel #prozac,1235450369620299777,https://twitter.com/mysticwonderss/status/1235450369620299777
2020-03-05 06:08:53,francis54062712,sydosaurus,0,0,2,"Seroquel is ur best bet for that",,,,1235447171182403584,https://twitter.com/francis54062712/status/1235447171182403584
2020-03-05 05:45:40,covertkittycat,KMGallagher5,1,0,0,"A gold level corporate equivalent group insurance plan where the employer pays 70% of the premium and then the insured gets to pay the remainder in pre tax dollars is good insurance. And he can get treatment at any military base - someone nearby can tag him with a seroquel dart",,,,1235441325367078912,https://twitter.com/covertkittycat/status/1235441325367078912
2020-03-05 05:23:16,gargloid,,0,0,1,"My seroquel hit so fast tn I went from making song 2 looking at boxes of strawberry milk",,,,1235435688725598208,https://twitter.com/gargloid/status/1235435688725598208
2020-03-05 05:12:07,AlaisjahJ,,0,0,0,"I gave my bf a seroquel, told him it was ibuprofen. so he can sleep thru the night while I'm at work. Cause he work mornings but never sleep cause i be gone to work. That boy was slobbing by the mouth within 5mins. he go be mad but I'm just tryna help !",,,,1235432882291847170,https://twitter.com/AlaisjahJ/status/1235432882291847170
2020-03-05 04:24:41,poetrydeMendoza,GraceBellawrite,0,0,0,"Same here. Have you tried Seroquel? It doesn’t work for everyone but for me it was a game changer. That and some beta blockers and benzos.",,,,1235420947118604288,https://twitter.com/poetrydeMendoza/status/1235420947118604288
2020-03-05 04:24:33,AubriannaBanana,,0,0,3,"My therapist said I’m in a good enough place to start weaning off my seroquel so I’ve got that going for me",,,,1235420914122133505,https://twitter.com/AubriannaBanana/status/1235420914122133505
2020-03-05 04:16:23,BibliotecaJones,EzraCeleste,0,0,0,"when all else fails.. seroquel",,,,1235418857109458945,https://twitter.com/BibliotecaJones/status/1235418857109458945
2020-03-05 04:07:00,Intu8tiveArcher,,0,0,0,"@MamaDoctorJones I have Bipolar Disorder and am medicated. I need medication(seroquel in my case) to be able to live a stable healthy life. If I were to become pregnant is there anything I can do to both keep myself mentally healthy and protect baby?",,@MamaDoctorJones,,1235416498677714949,https://twitter.com/Intu8tiveArcher/status/1235416498677714949
2020-03-05 02:35:07,TarynStanford,realDonaldTrump,0,7,12,"Few things worse? Twitter, hold my glass of Pinot. - tearing children from their families and putting them in cages. - drugging those children with Seroquel XL without permission - demonizing an entire ethnicity - lying all day, everyday - wiping ones a$$with the Constitution",,,,1235393374355513344,https://twitter.com/TarynStanford/status/1235393374355513344
2020-03-05 02:20:05,vnachi77,noahsmom7,0,0,0,"It used to be staggering amounts of booze, now it’s 300mg of Seroquel.",,,,1235389588941803521,https://twitter.com/vnachi77/status/1235389588941803521
2020-03-05 02:09:29,MikePerryavatar,MikePerryavatar,0,0,2,"Got some low dose seroquel for when I really need to sleep. It's ok. It works 90% of the time.",,,,1235386921292980225,https://twitter.com/MikePerryavatar/status/1235386921292980225
2020-03-05 01:09:56,Edge_Lux,,0,0,0,"i picked the wrong time to take my seroquel",,,,1235371936521347073,https://twitter.com/Edge_Lux/status/1235371936521347073
2020-03-05 00:27:01,miorlano_14,,0,0,0,"Welp I took my seroquel sooo in about one hour I’ll be in a 7 hour coma lol and I can’t wait",,,,1235361137572622337,https://twitter.com/miorlano_14/status/1235361137572622337
2020-03-04 23:45:59,GenSingularity,,0,0,0,"you complain to your bumble date. she smiles back, not sure how to respond. you s… as unsurprising as it is netflix.… depressed lately so she throws a tantrum with too much seroquel. you know she has an empty… didn’t take her to call you “daddy” but maybe she forgets. when ",,,,1235350812198686720,https://twitter.com/GenSingularity/status/1235350812198686720
2020-03-04 22:27:01,ughORUL82,,1,3,2,"we also need to buy medicine (quetiapine/seroquel + alprazolam and others) since she suffers from Alzheimer and dementia. i used to provide the food and medicines for my family but not anymore, sadly. if you can help us in anyway please do, we will be so grateful! +",,,,1235330939317874689,https://twitter.com/ughORUL82/status/1235330939317874689
2020-03-04 22:16:42,drbotmd,,0,0,0,"Pripivacitapam (antiandrogen) Cures refined soldier syndrome Decreases the liturgical effects of Seroquel",,,,1235328339797307398,https://twitter.com/drbotmd/status/1235328339797307398
2020-03-04 19:32:39,EldenRay,ijclark,1,0,0,"Of course, there's often a stupid difference in price: in 2016, Seroquel cost £113 for 60 tablets whereas Biquel was £60 for 60",,,,1235287056768806914,https://twitter.com/EldenRay/status/1235287056768806914
2020-03-04 19:29:04,EldenRay,AlicePonderland,2,0,1,"Oh yes. I passed out when I was given Biquel instead of Seroquel and had a battle to get the brand I had been on for a year and a half. I've just had a mix up with my Venlafaxine and wow am I feeling it.",,,,1235286154875936768,https://twitter.com/EldenRay/status/1235286154875936768
2020-03-04 19:26:07,EldenRay,,0,0,5,"But if they just say the drug name, e.g. quetiapine, you could end up with Seroquel, Biquel ... Whatever. Some people are ok with this. My head / body is not. Invisible disabilities are fun.",,,,1235285413398491144,https://twitter.com/EldenRay/status/1235285413398491144
2020-03-04 19:12:35,glowing_indigo,,1,0,2,"Tapered myself off every single pharmaceutical I was taking. Today is day 1 without taking the Kratom I used to get off all those meds. So difficult but so worth it. Bye to: subutex/clonidine/gabapentin/hydroxyzine/birth control/seroquel/kratom! IM SO PROUD OF MYSELF OMG",,,,1235282005396541441,https://twitter.com/glowing_indigo/status/1235282005396541441
2020-03-04 19:12:22,JackRip75241496,RealJamesWoods,0,0,0,"Oooh Oooh can I guess at her cats' names??!! Rexulti, Lithium, Haldol, Seroquel, Valium . . .",,,,1235281950425915396,https://twitter.com/JackRip75241496/status/1235281950425915396
2020-03-04 18:57:01,Camkamacpcam,dirteafairy,2,0,0,"Wow you're very high apparently. Ease back on the weed and increase your seroquel",,,,1235278087358578688,https://twitter.com/Camkamacpcam/status/1235278087358578688
2020-03-04 18:16:00,GenSingularity,,0,0,0,"year old to tell your best friend from high school. he just got promoted at the taco truck. european tourists ahead of you wonder what’s a “bulgogi taco.” a family argu… christmas. you load $80 worth and say it was $300 “but the market ta… too much seroquel. you know the… ",,,,1235267767747649538,https://twitter.com/GenSingularity/status/1235267767747649538
2020-03-04 17:57:03,2_11x11,violaonlygood,1,0,2,"I take a low dose of Seroquel, can still be creative on it. The important thing is that I can sleep and stay calm. They called it “the fountain of youth”...that memory is in my brain, I can’t believe the energies would say this. Could be I was drugged and led to believe this...",,,,1235262999121793024,https://twitter.com/2_11x11/status/1235262999121793024
2020-03-04 16:47:36,writerkouji,Gearfeathers,0,0,1,"/toasts with her bottle of seroquel",,,,1235245518667776009,https://twitter.com/writerkouji/status/1235245518667776009
2020-03-04 16:43:08,AureiaHoss,,1,1,2,"[CW: Nightmare-lite, suicide, self-harm] New psychiatrist, new prescription of Seroquel. Instructed to take it before bed, did so on Monday night. Next morning, I am so groggy that I was nodding-off mid-task, to the point where I could not safely drive or work, so I called out.",,,,1235244396955697152,https://twitter.com/AureiaHoss/status/1235244396955697152
2020-03-04 16:28:00,leomoondevil,,0,0,1,"Seroquel munchies are the worst",,,,1235240586535264257,https://twitter.com/leomoondevil/status/1235240586535264257
2020-03-04 16:24:55,SEABASSTHEGREAT,bobbybalmoral,1,0,1,"I thought I had mental issues. He needs my seroquel more than I do ",,,,1235239812434665473,https://twitter.com/SEABASSTHEGREAT/status/1235239812434665473
2020-03-04 15:12:09,Byarna_,,0,0,0,"When you’re having a bit of a breakdown but can’t find your Seroquel to help calm you down/ knock you out Love that",,,,1235221499801296897,https://twitter.com/Byarna_/status/1235221499801296897
2020-03-04 13:19:15,LilJMouse,LilJMouse,0,0,0,"Would rather see a person on small amt clonazepam (0.5 qhs or bid) than on Aricept Remeron and Seroquel (a pts “psych” med list). Polypharmacy is accepted as benign. imo harms more pts every day than acknowledged appreciated. 2/2",,,,1235193086038466565,https://twitter.com/LilJMouse/status/1235193086038466565
2020-03-04 12:17:18,WatchyaSamantha,DBDouble,1,0,2,"Example: 6mg Klonopin, 900mg Seroquel, 900mg Tegretol, 120 mg Paxil. I’m now med free, but how is that not psychiatric abuse?",,,,1235177498134142977,https://twitter.com/WatchyaSamantha/status/1235177498134142977
2020-03-04 12:15:59,GenSingularity,,0,0,0,"her ex-boyfriend. she wears your favorite artists gone. a drug overdose is as unsurprising as it is netflix.… part becaus… of mochi last month for her. she has an empty… so she throws a tantrum with too much seroquel. you know she isn’t there. y… complain about your pote… ",,,,1235177166826020870,https://twitter.com/GenSingularity/status/1235177166826020870
2020-03-04 11:47:41,madisoncroxdale,ColtonAustin28,0,0,0,"I take seroquel next question please.",,,,1235170042209329153,https://twitter.com/madisoncroxdale/status/1235170042209329153
2020-03-04 11:36:00,amykhate666,,0,0,0,"Just watched my mans eat a seroquel off the floor as he spotted it. I love him",,,,1235167105659441153,https://twitter.com/amykhate666/status/1235167105659441153
2020-03-04 11:33:44,LegateSprinkles,MorteThaSkull,1,0,3,"I've been on several medications. Wellbutrin, Zoloft and Seroquel. It's just different for everyone how your body reacts to the medication. We tried 25mg of Zoloft &amp; it was basically putting a spring in my step, feeling energetic. Got out of bed, tried doing stuff, being active.",,,,1235166534710026241,https://twitter.com/LegateSprinkles/status/1235166534710026241
2020-03-04 11:30:27,boxed_jellyfish,,0,0,1,"forcing myself to take seroquel between 12am - 1am no matter what i'm doing at home so i can try &amp; keep up this normal sleeping pattern. ",,,,1235165706246750208,https://twitter.com/boxed_jellyfish/status/1235165706246750208
2020-03-04 10:47:24,lisalovespepsi_,,1,0,4,"Oh I’m gonna regret taking Seroquel AND a sleeping pill tomorrow morning when I can barely get out of bed",,,,1235154874616053760,https://twitter.com/lisalovespepsi_/status/1235154874616053760
2020-03-04 09:26:56,shaitansbabe,,0,0,3,"seroquel: taken meetchy: ready for sleepy",,,,1235134621039247360,https://twitter.com/shaitansbabe/status/1235134621039247360
2020-03-04 07:03:42,bloomveined,,0,0,0,"I know I should sleep, because. I work again in about 7 hours. But...what if I wrote instead? (It's not really going to happen because I already took my Seroquel but...)",,,,1235098576809635845,https://twitter.com/bloomveined/status/1235098576809635845
2020-03-04 06:38:30,TheQueenGrey,AletheaAstraea,1,0,1,"Seroquel! I’ve had no adverse reactions whatsoever. And I hate to admit it cuz I hate meds, but it’s honestly helped out a lot with the mood swings",,,,1235092235206582272,https://twitter.com/TheQueenGrey/status/1235092235206582272
2020-03-04 06:21:10,TruthMatters16,Alyssa_Milano,0,0,0,"Did you take Seroquel? Ambien?That stuff gives you vivid dreams",,,,1235087874376122368,https://twitter.com/TruthMatters16/status/1235087874376122368
2020-03-04 05:46:32,seneca,,2,0,3,"OHAI SEROQUEL, lessee if you can make me sleepz ues?",,,,1235079157958115330,https://twitter.com/seneca/status/1235079157958115330
2020-03-04 05:25:32,r0ttedbabe,truuotaku,1,0,1,"seroquel is fucking awful and the withdrawals are even worse :)))",,,,1235073874162642944,https://twitter.com/r0ttedbabe/status/1235073874162642944
2020-03-04 05:07:11,habesla1,pavanvan,0,0,0,"One word: Seroquel.",,,,1235069255118290945,https://twitter.com/habesla1/status/1235069255118290945
2020-03-04 03:23:58,deepwebegirl,,0,0,7,"Here is my seroquel induced political post the L in Elizabeth Warren stands for the massive L you all take by supporting her send tweet",,,,1235043281509081088,https://twitter.com/deepwebegirl/status/1235043281509081088
2020-03-04 03:21:48,pewcubed,,0,0,1,"Also, I’m taking Seroquel tonight for the first time in 11 years, wish me luck!",,,,1235042735553269760,https://twitter.com/pewcubed/status/1235042735553269760
2020-03-04 02:39:37,transrebel666,,0,0,0,"google search why does seroquel make me sweat so much in my sleep",,,,1235032119417569287,https://twitter.com/transrebel666/status/1235032119417569287
2020-03-04 02:34:09,SuchAngerLilSam,Izashi_Kiryuso,0,0,1,"Don’t blame you. I wish I could do the aave with my seroquel but nobody deserves me without that lol ",,,,1235030743211900928,https://twitter.com/SuchAngerLilSam/status/1235030743211900928
2020-03-04 02:26:19,zouuusan,,0,0,0,"on ambien seroquel and adderall send help",,,,1235028769854722049,https://twitter.com/zouuusan/status/1235028769854722049
2020-03-04 01:56:51,Chip2chip2,liampclancy1,0,0,1,"That’s good...some benefit from Seroquel it calm them down",,,,1235021355399036929,https://twitter.com/Chip2chip2/status/1235021355399036929
2020-03-04 01:48:57,truuotaku,,3,0,2,"one time at a mental hospital they completely changed my seroquel all of a sudden and I went through withdrawals and thought I was gonna die ",,,,1235019367252996096,https://twitter.com/truuotaku/status/1235019367252996096
2020-03-04 01:38:56,SuchAngerLilSam,SoulWinchester_,0,0,1,"Seroquel on its own just doesn’t cut it in most cases. Mention an antidepressant like Lexapro...I say lexapro because you don’t have to get on 200-300 mg like Zoloft. My sister is on 20, I’m on 40. Works great",,,,1235016846463701000,https://twitter.com/SuchAngerLilSam/status/1235016846463701000
2020-03-04 01:31:47,SuchAngerLilSam,SoulWinchester_,1,0,1,"Maybe you need to think about adding something to the seroquel? I find lexapro works really great. I also took it with Zoloft for 7 years before it stopped working",,,,1235015047614730247,https://twitter.com/SuchAngerLilSam/status/1235015047614730247
2020-03-04 01:31:39,DocScienceWiz,Mercuie,1,0,0," Quetiapine, or Seroquel as I guess it's commercially known. It's doing some good things for my anxiety, and it's giving me the energy and motivation to do things, but I also feel like an asshole more often than not and don't seem to have a filter.",,,,1235015012831375361,https://twitter.com/DocScienceWiz/status/1235015012831375361
2020-03-04 01:31:28,liampclancy1,Chip2chip2,1,0,0,"Ugh! Don’t get me started on Seroquel- or any other off label anti-pyschotics. They’re hideous and in my experience do more harm than good. I quit all meds years ago- tho not suggesting others do. They just weren’t helpful. Same with antidepressants. I went holistic except MDMA",,,,1235014967599853568,https://twitter.com/liampclancy1/status/1235014967599853568
2020-03-04 01:19:31,Chip2chip2,liampclancy1,1,0,1,"Hopefully...they stop treating them w/ trial medications it really mess up their system.They give Seroquel to calm them down but dosage keeps on going up until the meds are not helping at all.",,,,1235011959604432896,https://twitter.com/Chip2chip2/status/1235011959604432896
2020-03-04 01:03:56,jheribee_,,0,0,0,"All I need in life is seroquel and prozac",,,,1235008038983127041,https://twitter.com/jheribee_/status/1235008038983127041
2020-03-04 00:38:36,TheChadVicious,,0,0,0,"When you haven't taken your Seroquel in 2 weeks and your dog tells you a really funny joke. https://www.instagram.com/p/B9Srl5Kh8Lm/?igshid=1r14uvoqzpczu",,,,1235001662537977856,https://twitter.com/TheChadVicious/status/1235001662537977856
2020-03-04 00:35:37,RubenThawne,Katweegee,0,1,1,"Need to up the seroquel",,,,1235000913560866816,https://twitter.com/RubenThawne/status/1235000913560866816
2020-03-03 22:59:00,KimPigSquash,,0,0,0,"Instead she tried to write me scripts for Seroquel, Elavil, Trazadone. These are mental illness drugs , not even primarily used for insomnia! Each is much worse drug w much larger side FX profile than zopiclone. But Fake Opioid Crisis has now spread out to include adjacent meds.",,,,1234976596982812673,https://twitter.com/KimPigSquash/status/1234976596982812673
2020-03-03 22:43:14,sukunahost,,0,0,0,"that seroquel sleep be hitting i got like 15 hours of sleep",,,,1234972632631496704,https://twitter.com/sukunahost/status/1234972632631496704
2020-03-03 22:30:33,cerealover69,,0,0,2,"ur off a perc 30 i’m off a seroquel 200. we r not the same",,,,1234969440934092800,https://twitter.com/cerealover69/status/1234969440934092800
2020-03-03 22:10:32,JEONJEONGGOK,,0,0,0,"seroquel is failing me and i doubles the dosage, bye",,,,1234964401234509826,https://twitter.com/JEONJEONGGOK/status/1234964401234509826
2020-03-03 21:54:28,dalzey07,,0,0,3,"i hate that seroquel works so well. i was only supposed to be on it for 2 months initially to chill out some mood swings and hallucinations i had during a manic period (antidepressants are the devil to my brain)and now its been a year and each mg increase makes me more zombie ugh",,,,1234960358026043392,https://twitter.com/dalzey07/status/1234960358026043392
2020-03-03 21:51:55,MortysCordoba,bossy_bootz,1,0,0,"Seroquel: Better living through chemistry",,,,1234959716515819520,https://twitter.com/MortysCordoba/status/1234959716515819520
2020-03-03 21:42:39,Alexanisto,,2,0,3,"I hate having mental illness bc then ppl say I’m on something when I’m taking my 100 mg seroquel so I don’t skits or have too many episode and it makes me wanna stop taking my pills bc this shit will follow me forever and I’m so sad that ppl don’t try to get to know me",,,,1234957383719366663,https://twitter.com/Alexanisto/status/1234957383719366663
2020-03-03 21:28:09,ItrapSsr,nikki_cas,0,0,0,"I had severe akathisia when I got off polypharmacy. I had tried multiple medications during few months including Mirtazapine, Seroquel, SSRIs, benzos etc. Some as a combination, some I only tried and did not tolerate at all. Zyprexa and benzos were last combination I used",,,,1234953734922395648,https://twitter.com/ItrapSsr/status/1234953734922395648
2020-03-03 20:14:30,114lbs_,,0,0,0,"I WORE PANTS BUT STILL GET TO STOP SEROQUEL. NICE ",,,,1234935199567351815,https://twitter.com/114lbs_/status/1234935199567351815
2020-03-03 20:02:32,Shaunafidler,Jinxkee1,0,0,2,"Some Dr’s are really pushing off-label use of schizophrenia meds for Insomnia without knowing side effects for long term use in my opinion. They presc Seroquel. It worked for sleep but I feel, started changing the chemistry in my brain. Went off it ASAP!",,,,1234932187260022784,https://twitter.com/Shaunafidler/status/1234932187260022784
2020-03-03 19:55:46,ShaneBlkheart,catnip_coffee,2,0,1,"Sorry to hear that. I take Seroquel &amp; Lamictal &amp; it seems to be a good combo for insomnia &amp; slowing my mind down when I'm manic. Lamictal is the mood stabilizer, but it can make you manic if taken alone. I usually suggest Seroquel to people who're having issues with current meds.",,,,1234930486738333697,https://twitter.com/ShaneBlkheart/status/1234930486738333697
