date,username,to,replies,retweets,favorites,text,geo,mentions,hashtags,id,permalink
2020-02-28 04:41:41,AnalyseMoses,RPRISONISSUES,1,0,2,"Where I am from they call it the Thorazine shuffle. I want to see some institution's prescription expense reports. I have been to places where you cannot get an apple or orange, but seroquel and haldol abound!",,,,1233250896303345666,https://twitter.com/AnalyseMoses/status/1233250896303345666
2020-02-28 04:34:01,Clementine5000,scretladyspider,1,0,0,"I don’t even know other than now I’m paranoid as fuck and need to take my seroquel.",,,,1233248967875596288,https://twitter.com/Clementine5000/status/1233248967875596288
2020-02-28 03:48:47,Beautidivergen2,missinkaddikt,0,0,1,"Seroquel is decent but one pill will knock me out for a day or two. It's really good for sleep. I have a movement disorder so I don't take it. The side effects make it worse. I hope it works for you!",,,,1233237584207200256,https://twitter.com/Beautidivergen2/status/1233237584207200256
2020-02-28 03:37:02,crybaaby_xo,emzoticofficial,0,0,0,"cook ups when ur on xans or seroquel that’s all i see here",,,,1233234629202673667,https://twitter.com/crybaaby_xo/status/1233234629202673667
2020-02-28 03:25:28,yddad_,,0,0,5,"Every time I get into bed and take my seroquel I say to myself “goodbye” because this shit is like a Valium and 6 gin and tonics. God bless anyone who can take this in the morning.",,,,1233231717751808001,https://twitter.com/yddad_/status/1233231717751808001
2020-02-28 02:41:17,thxndividuality,,0,0,0,"but good news they let me skip group after the seroquel knocked me out",,,,1233220599490572291,https://twitter.com/thxndividuality/status/1233220599490572291
2020-02-28 02:32:21,AmoralFish,,0,0,1,"When the Seroquel hits juuuuust right ",,,,1233218352513986560,https://twitter.com/AmoralFish/status/1233218352513986560
2020-02-28 02:32:12,awfuldelight,,0,0,0,"When the #seroquel and #ambien begin their dance and it puts you in the slow mellow light mood, sleep is imminent and welcomed with open arms. Goodnight folks...sweet dreams",,,#seroquel #ambien,1233218311560847365,https://twitter.com/awfuldelight/status/1233218311560847365
2020-02-28 01:51:00,thxndividuality,,0,0,0,"so much seroquel in my body rn",,,,1233207943375441920,https://twitter.com/thxndividuality/status/1233207943375441920
2020-02-28 01:21:08,alexshitlordxd,,1,0,2,"It is currently real 2am shitposting hours. Reminder to take your Seroquel so you have more than 4 hours of sleep ",,,,1233200427161804801,https://twitter.com/alexshitlordxd/status/1233200427161804801
2020-02-27 23:11:40,WilsonJerrimy,flyingawxy,1,0,1,"Those don't work anyway. Definitely stay away from seroquel it will make you fat",,,,1233167847712411649,https://twitter.com/WilsonJerrimy/status/1233167847712411649
2020-02-27 22:52:01,brittainm8,Lil_seroquel,0,0,1,"It's okay. I support you..",,,,1233162903210999808,https://twitter.com/brittainm8/status/1233162903210999808
2020-02-27 22:49:18,brittainm8,ultimatecumshot,1,1,4,"Hey squirt",,,,1233162218910310401,https://twitter.com/brittainm8/status/1233162218910310401
2020-02-27 22:25:32,nwatsky,maddyy16,0,0,1,"YUP!! idk much about seroquel but i would *assume* that over time it won't make you as tired. kind of like why my doc didn't prescribe klonopin for sleep; you can get up and walk around and won't feel tired anymore. but if you're just sitting doing nothing yeah you'll fall asleep",,,,1233156238126481408,https://twitter.com/nwatsky/status/1233156238126481408
2020-02-27 22:13:24,organflame,flyingawxy,1,0,0,"maybe after a few weeks, it will kick in some? but I'd understand, it's hard to match seroquel. it's such a ridiculous waiting game trying out psychotropics. I'm taking the DNA test for the second time with my new doctor. have you taken that at all?",,,,1233153184497094657,https://twitter.com/organflame/status/1233153184497094657
2020-02-27 22:09:05,maddyy16,nwatsky,1,0,0,"oh nice lmk how it goes. I think my sister took that for a bit and said it worked p well. I’m currently trying seroquel. woke up at 9 yesterday, went back to sleep at 10, forced myself to wake up at 3, went back to sleep at 10 so that’s going great lol",,,,1233152097081794561,https://twitter.com/maddyy16/status/1233152097081794561
2020-02-27 21:52:27,IoveIessgirI,,0,0,2,"knocking myself out with insane amounts of seroquel &lt;3",,,,1233147910986006528,https://twitter.com/IoveIessgirI/status/1233147910986006528
2020-02-27 21:09:47,CaptainMetadata,,1,0,0,"Seroquel (Quietapine) is one of more commonly deployed psychotropic PRN medications to respond to challenging behaviours. It is not a pleasant drug (I was on it for a 3 month period). It has been written about, which is a big deal:- https://www.abc.net.au/news/2013-11-27/growing-concerns-over-side-effects-of-seroquel/5120554 #DisabilityRC",,,#DisabilityRC,1233137174679191552,https://twitter.com/CaptainMetadata/status/1233137174679191552
2020-02-27 21:09:04,dedkatie,flyingawxy,1,0,1,"I feel it! I recently quit seroquel because of all the weight gain, switched to something that supposedly has less of a weight gain factor.. keeping my fingers crossed!",,,,1233136991589425158,https://twitter.com/dedkatie/status/1233136991589425158
2020-02-27 21:08:09,alexathe_great,sluggityslug,1,0,3,"Saaaaame, only Lamictal and Seroquel for me",,,,1233136764744871950,https://twitter.com/alexathe_great/status/1233136764744871950
2020-02-27 21:02:28,dedkatie,flyingawxy,1,0,1,"Seroquel can give people hunger pangs which makes them think they’re hungry, so they eat. It’s ok to gain weight from needed medication. I did. ",,,,1233135333195177984,https://twitter.com/dedkatie/status/1233135333195177984
2020-02-27 20:51:38,16kbps,,0,0,7,"also the psychotic people ""non-compliant"" because they've accurately identified unacceptable side-effects of 600mg seroquel doses lol",,,,1233132606784442369,https://twitter.com/16kbps/status/1233132606784442369
2020-02-27 20:37:45,robicellis,scottp3t3,1,0,2,"Same thing happened to me on Seroquel! They tried to use it for my chronic insomnia. Only thing that’s ever helped with that and weed. Well, Ambien helped, but it makes me trip balls and I stay away from addictive prescription drugs.",,,,1233129111503212544,https://twitter.com/robicellis/status/1233129111503212544
2020-02-27 20:32:28,scottp3t3,dnllyndt,1,0,3,"They put me on seroquel to help with sleep while I was still on effexor and I got one of those zaps that felt like a taser to my face. I never took seroquel again after that.",,,,1233127783301353475,https://twitter.com/scottp3t3/status/1233127783301353475
2020-02-27 20:14:12,GreetingsFam,,1,0,0,"Anyone else have experience with seroquel and an ssri an I supposed to be constantly horny or is this just what I'm like if I'm stable",,,,1233123185492733952,https://twitter.com/GreetingsFam/status/1233123185492733952
2020-02-27 20:02:42,dnllyndt,LouisatheLast,0,0,4,"I was on a high dose, side effects were too much, on a low dose now along with wellbutrin and seroquel, but the struggle to get here...sending carebear heart stares your way. ",,,,1233120292039315457,https://twitter.com/dnllyndt/status/1233120292039315457
2020-02-27 19:43:45,prxzolam,,0,0,3,"SEROQUEL® You can't be manic if you're asleep!",,,,1233115520901115905,https://twitter.com/prxzolam/status/1233115520901115905
2020-02-27 19:43:38,GenSingularity,,0,0,0,"you can in bitcoin. two weeks la… so she throws a tantrum with too much seroquel. you know her from instagram but met her on venmo bumble date. she smiles back, not sure how to respond. you s… monday, thursday, and sunday, the 10/20 nl game runs around the casino. you book ",,,,1233115492300316673,https://twitter.com/GenSingularity/status/1233115492300316673
2020-02-27 17:39:05,GlitchBro1987,,0,0,1,"Seroquel: Do you want Parkinson’s without actually having the disease? Seroquel; Shake it off. Seroquel; when you take sending good vibes too literally. Seroquel; just because you have the jerks doesn’t mean you are one. Seroquel; give life a jolt. Seroquel: shudder in style.",,,,1233084148723613697,https://twitter.com/GlitchBro1987/status/1233084148723613697
2020-02-27 17:38:32,travels2little,,2,1,2,"#Quetiapine is another massively overprescribed antipsychotic and is associated with heart damage. However, cannabinoids can be used to prevent this heart damage (or just don't prescribe #Seroquel at all) http://ow.ly/fNRl50yxKel",,,#Quetiapine #Seroquel,1233084012354265088,https://twitter.com/travels2little/status/1233084012354265088
2020-02-27 16:51:39,thxndividuality,,1,0,0,"day 1: last night I waited 5 hours to get to the unit, got 200mg seroquel (twice my normal) and got more this AM. how am I supposed to stay awake for the meetings and groups",,,,1233072213630185472,https://twitter.com/thxndividuality/status/1233072213630185472
2020-02-27 15:25:40,GlitchBro1987,,2,0,1,"Lemme just start today by talking about my first night using #seroquel 1. My ankles and feet twitched randomly, was similar to dr tapping the reflex point in knee. 2. When I stood up I could barely walk. Very drunk feels. 3. Slept for 11 hrs. 4. Intense dreams. Overall not fun.",,,#seroquel,1233050575736057856,https://twitter.com/GlitchBro1987/status/1233050575736057856
2020-02-27 14:38:35,goatihilator,,0,0,0,"Amazing how quickly I return to being a functioning human in the morning by missing one dose of Seroquel",,,,1233038726890053638,https://twitter.com/goatihilator/status/1233038726890053638
2020-02-27 13:52:59,KellyLa41199892,marklevinshow,0,1,0,"Can anything be done with big pharma, though? Thirty-day supply of 300 mg Seroquel is over $600. Do you think people suffering from schizophrenia can afford that?",,,,1233027251387719681,https://twitter.com/KellyLa41199892/status/1233027251387719681
2020-02-27 13:34:35,FranklinKeynes,,1,0,0,"Or he's a county Psychiatrist with a habit of encriminating the homeless and putting them on Seroquel because he's on the take from Astro-Zeneca... Yeah, that's Epstein with his soldiers underneath him.",,,,1233022617881214977,https://twitter.com/FranklinKeynes/status/1233022617881214977
2020-02-27 13:32:45,panfriedpickles,,0,0,0,"I'm not even fully off the Seroquel yet and there is a noticeable difference in how easy it was to get up and my mood upon waking, I really should keep a proper log of the different meds I've been on instead of just tweeting about them lmfao",,,,1233022156126277632,https://twitter.com/panfriedpickles/status/1233022156126277632
2020-02-27 12:59:17,luppicci,colevsthewrld,1,0,8,"a tie between depakote ER 500mg and seroquel 300mg. did i do this right? ",,,,1233013734550802434,https://twitter.com/luppicci/status/1233013734550802434
2020-02-27 12:53:19,GreetingsFam,,0,0,0,"People on seroquel be like why is my jaw always so tired",,,,1233012233728352258,https://twitter.com/GreetingsFam/status/1233012233728352258
2020-02-27 12:00:18,Sailor_Doom3,,0,0,0,"Last week I received new shower heads (fucking amazing ones) and a charging cable for my PS4 controllers. So seroquel me has been making all good choices so far lmao",,,,1232998891555098624,https://twitter.com/Sailor_Doom3/status/1232998891555098624
2020-02-27 12:00:18,Sailor_Doom3,,1,0,0,"I apparently have been ordering mad shit online after I take my seroquel and I got like 6 packages yesterday. Seroquel me thought I needed 6 new fenty bras, 8 packs of sock from target, and 3 packs of undies from H&amp;M. I kinda did tho so it’s cool.",,,,1232998890061824001,https://twitter.com/Sailor_Doom3/status/1232998890061824001
2020-02-27 11:00:27,urmomschalupa,,0,0,5,"another night of waking up from a scary ass seroquel dream. luv that 4 m3 ",,,,1232983832003072000,https://twitter.com/urmomschalupa/status/1232983832003072000
2020-02-27 10:31:08,TrickstarBrave,,1,0,0,"Peach gets rly mad when I eat before bed but this is how seroquel Just operates. I am hungry like 30 mins to 1.5 hours after I take it. I used to wake up from light sleep starving and devour pizza rolls at a break neck pace.",,,,1232976454142644225,https://twitter.com/TrickstarBrave/status/1232976454142644225
2020-02-27 10:31:08,TrickstarBrave,,1,0,0,"I am not Quite hungry yet but I know after seroquel hits I Will Certainly Be so I’m just sitting here waiting for the hunger signal to go off properly in my brain and then make some rice",,,,1232976450833338370,https://twitter.com/TrickstarBrave/status/1232976450833338370
2020-02-27 10:28:51,1nternetSpades,,0,0,1,"Hmm did i just tale my seroquel or not lol",,,,1232975878604222465,https://twitter.com/1nternetSpades/status/1232975878604222465
2020-02-27 09:53:27,RubberFirewall,MableGoude,0,0,0,"I dreamed last night I was attached to a monitor in hospital and the picture on screen was of explosion as I'd breathe in deeply, and a picture of implosion when breathe out deeply. That was when I didn't have Seroquel last night. On Seroquel, I take shallow breaths when sleeping",,,,1232966968266723333,https://twitter.com/RubberFirewall/status/1232966968266723333
2020-02-27 09:49:35,RubberFirewall,MableGoude,0,0,0,"What's worse? Getting a blocked nose from Seroquel and always having to think to open up my throat to breathe better and forgetting all the time? Or reducing Seroquel, telling my mum, and being blamed for all her problems? I don't see the lesser of two evils.",,,,1232965994420682752,https://twitter.com/RubberFirewall/status/1232965994420682752
2020-02-27 09:15:22,lapinkitsu,,0,0,0,"i forget to refill my seroquel and now im up at 4am hahaha why",,,,1232957385255374848,https://twitter.com/lapinkitsu/status/1232957385255374848
2020-02-27 08:03:34,crvckwhvre,,1,0,4,"man i totally overdid it w/ the pills. my body just doesn’t agree w/ high doses of ptegabt if im also using codeine snd taking my night medd. seroquel &amp; zoloft really react funny with it",,,,1232939314922901505,https://twitter.com/crvckwhvre/status/1232939314922901505
2020-02-27 07:58:51,GreenRoc,AnnMemmott,0,0,0,"I brought my pres meds with me, finally after more than 12 hours past pill time, they presented me with my meds, but also their addition of seroquel which I had many decades ago, and was bad for me. I refused their meds, and in doing so, they refused to let me have my usual meds. ",,,,1232938127087423488,https://twitter.com/GreenRoc/status/1232938127087423488
2020-02-27 07:30:21,BevisSusanb25,ALFREYALFREY,0,0,1,"Elizabeth was also allergic to other drugs which i reported ie seroquel and abilify",,,,1232930957746999297,https://twitter.com/BevisSusanb25/status/1232930957746999297
2020-02-27 06:17:38,yungzion_,,0,0,0,"i need a blunt and a hug but seroquel will do ",,,,1232912657407205383,https://twitter.com/yungzion_/status/1232912657407205383
2020-02-27 04:24:33,LyricalNuances,,0,0,0,"These tweets were brought to you by high doses of Seroquel",,,,1232884199503298560,https://twitter.com/LyricalNuances/status/1232884199503298560
2020-02-27 03:43:38,GenSingularity,,0,0,0,"they elevate quarantine… followers he irony-pos… loved what parasite had to meet. it was like you were joking. you can’t think of them. sometimes she’s the femme fatal… depressed lately so she throws a tantrum with too much seroquel. you know her from instagram but met ",,,,1232873903556562944,https://twitter.com/GenSingularity/status/1232873903556562944
2020-02-27 03:32:49,genzmashfan,,0,0,1,"seroquel making my skin crawl like a mf tonight ",,,,1232871179452588038,https://twitter.com/genzmashfan/status/1232871179452588038
2020-02-27 03:22:09,Human1stMD,,1,1,1,"What a #Geriatrician sees - a thread - just from the last 3 weeks of skilled rehab new job: 1. 80 yo male w/AMS -&gt; ED -&gt; admit -&gt; given zyprexa, seroquel, all the things -&gt; EPS -&gt; left with diagnosis of Lewy Body Dementia -&gt; he gets to rehab -&gt; we take off ALL meds except...",,,#Geriatrician,1232868496238710784,https://twitter.com/Human1stMD/status/1232868496238710784
2020-02-27 03:09:42,la_burns,,0,0,0,"My soul gone, but the Seroquel heals me.",,,,1232865360908627968,https://twitter.com/la_burns/status/1232865360908627968
2020-02-27 02:52:12,amobeirne,open_debate,0,0,0,"These stalling debates I'm awake at 2.30 am. Never had a proper nights sleep since adverse reaction to Citalopram. Followed by brain damaging Olanazapine, Seroquel, Lamictal, Lithium, Rivotril I.e. the biomedical approach to trauma that fixes nothing &amp; causes trauma.",,,,1232860958684598272,https://twitter.com/amobeirne/status/1232860958684598272
2020-02-27 02:25:13,BigUnkk3,,0,0,0,"Seroquel got a nigga sleep walking",,,,1232854165401079809,https://twitter.com/BigUnkk3/status/1232854165401079809
2020-02-27 01:48:45,EvaMariaSproch,EvaMariaSproch,0,0,0,"Typhoid, yellow fever + psychosis dispersion. Treatable by: TB shot, B12 sublingual liquid and seroquel and/or clonopin.",,,,1232844988884627456,https://twitter.com/EvaMariaSproch/status/1232844988884627456
2020-02-27 01:07:25,margturps,grendelsmumm,0,0,0,"seroquel babyyyy it’s not T E C H N I C A L L Y a sedative",,,,1232834588784939009,https://twitter.com/margturps/status/1232834588784939009
2020-02-26 23:49:09,Clementine5000,BipolarBattle,1,0,2,"Clonazepam and seroquel. The last year has been a crap shoot because I’ve had a severely unstable thyroid due to a very incompetent GP who overdosed me on synthroid three times. My levels still aren’t completely normal.",,,,1232814892597555201,https://twitter.com/Clementine5000/status/1232814892597555201
2020-02-26 23:48:03,MasterMaccabee,LaJethroJenkins,0,0,0,"Man me too since I was a little kid...used to have wild nightmares and taught myself to wake up the got good at controlling the whole thing Until seroquel Those dreams are WILD",,,,1232814614255144961,https://twitter.com/MasterMaccabee/status/1232814614255144961
2020-02-26 23:39:32,WELLinTHIShouse,,0,0,3,"Dang, what a difference two nights in a row of Seroquel makes. I was really hoping I could cut back, but my body just can't deal. At least my doc told me that metabolic syndrome, if I get it, will go away when I stop taking the drug for good.",,,,1232812473889280000,https://twitter.com/WELLinTHIShouse/status/1232812473889280000
2020-02-26 23:20:59,Cortez72life,SeanEubanks001,1,0,2,"Honeybuns and Seroquel were the big ticket trade items last time I was there. May be different now, but I hope to never find that out ",,,,1232807803439517698,https://twitter.com/Cortez72life/status/1232807803439517698
2020-02-26 22:07:39,rarrizzo013,,0,0,0,"Yo guys so my doctor is just having me stop Seroquel and start taking a new sleep med so like if I die that’s probs why",,,,1232789350074736648,https://twitter.com/rarrizzo013/status/1232789350074736648
2020-02-26 21:41:43,bloodychanel,LiLAN6ELFUCK,0,0,1,"every night when i take my seroquel",,,,1232782822131281922,https://twitter.com/bloodychanel/status/1232782822131281922
2020-02-26 21:34:35,slimesimulator,g_rizzel,1,0,1,"where my seroquel family at",,,,1232781025601781760,https://twitter.com/slimesimulator/status/1232781025601781760
2020-02-26 19:55:54,Kelly90Sonia,,1,0,0,"Seroquel keeps my brain from drying up and becoming a boxing ring or fighting cage with aneurytic holes",,,,1232756193036132352,https://twitter.com/Kelly90Sonia/status/1232756193036132352
2020-02-26 19:52:52,Kelly90Sonia,,1,0,0,"Im on 3 medications. Each morning i take them SEROQUEL. CITALOPRAM. ESTRACE.",,,,1232755429995737089,https://twitter.com/Kelly90Sonia/status/1232755429995737089
2020-02-26 19:37:26,kriichards,grandpa,1,0,2,"All of the above. Seroquel or I ain't sleepin for days lol ",,,,1232751546594713602,https://twitter.com/kriichards/status/1232751546594713602
2020-02-26 18:23:44,wei_ying01,LaceyDeets,0,0,0,"I tried Seroquel...I'm allergic to it and none of my doctors won't prescribe me xanax",,,,1232732998728024067,https://twitter.com/wei_ying01/status/1232732998728024067
2020-02-26 18:16:16,equisdistant,,1,0,2,"I ran out of seroquel 25ml pills and have been taking half of those cursed 50ml pills and guess what my muscle pain is back again ",,,,1232731119306625029,https://twitter.com/equisdistant/status/1232731119306625029
2020-02-26 17:53:13,awesomenick___,,0,0,0,"Anybody got serotonin and Seroquel? In desperate need of some. And maybe some Ange L Dust",,,,1232725318743535618,https://twitter.com/awesomenick___/status/1232725318743535618
2020-02-26 17:20:57,sfbazile,,0,0,1,"starting seroquel. hopefully i get better results",,,,1232717197463691264,https://twitter.com/sfbazile/status/1232717197463691264
2020-02-26 16:57:53,evansalveson,nay_sue1,1,0,2,"How about some zyprexa and seroquel? Celexa?",,,,1232711394782367744,https://twitter.com/evansalveson/status/1232711394782367744
2020-02-26 16:44:30,dr00lmunky,,0,0,0,"Making lunch and anxiously awaiting a phone call. I should just take an extra Seroquel.",,,,1232708023933599747,https://twitter.com/dr00lmunky/status/1232708023933599747
2020-02-26 15:47:08,xadditupx,AgoristKitty,1,0,1,"I’ve taken all - currently on Ativan and Seroquel XR plus clonazepam and temazepam, dextroamphetamine, lithium This is the list I dole out at work",,,,1232693590255554560,https://twitter.com/xadditupx/status/1232693590255554560
2020-02-26 15:33:50,xadditupx,,5,0,10,"A list of my best friends: 1. Lorazepam (Ativan) 2. Alprazolam (Xanax) 3. Quetiapine (Seroquel) 4. Risperidone (Risperdal) 5. Mirtazapine (Remeron) I am known as the PRN Queen!",,,,1232690242940833792,https://twitter.com/xadditupx/status/1232690242940833792
2020-02-26 15:16:21,monstercollie,,0,0,0,"specifically right now I'm listening to Billie Eilish for the first time, and tbf, I am in a chill mood (CBD, Seroquel) so while it's all unmemorable background music imo atm, I'm still feeling it, even if I'm not actively listening to it right now. ",,,,1232685840029159425,https://twitter.com/monstercollie/status/1232685840029159425
2020-02-26 14:56:52,EldenRay,LauraJSefton,1,0,0,"When I was in crisis, I stayed at my friend's. I lived in London, and she in Stevenage. The hospital psychiatrist did something where I temporarily saw a psychiatrist daily at Stevenage as I couldn't commute. Not sure what it was, as was sedated on Seroquel 1/2",,,,1232680939265888261,https://twitter.com/EldenRay/status/1232680939265888261
2020-02-26 14:41:31,thecitybotanist,joncoopertweets,0,0,1,"A better idea would be hiding the seroquel in Trump’s Big Macs... #DementedPresident @realDonaldTrump",,@realDonaldTrump,#DementedPresident,1232677077175930880,https://twitter.com/thecitybotanist/status/1232677077175930880
2020-02-26 14:22:01,TCapoeti,zenyatta_queen,1,0,1,"Your right. No one wants to admit how bad this is. It's not a broken leg so somehow it becomes passed off. I've seen sub therapeutic bi-polar people who used to be dumped in Willowbrook, now with Rx Seroquel and Depokote are normal functioning people. Homeless can be revived w/$.",,,,1232672169110331408,https://twitter.com/TCapoeti/status/1232672169110331408
2020-02-26 14:02:10,Mklovesdr,,0,1,0,"I joined a PDD facebook group and they've just been bashing Seroquel which is so validating because the first time I took it I slept for 22 hours straight and woke up with cereal spilled in my bed ",,,,1232667173295992834,https://twitter.com/Mklovesdr/status/1232667173295992834
2020-02-26 13:39:07,RDubya1898,JStanleyFX,1,0,1,"I gave up on the looney Loonie and went with something not as crazy like the NZD/JPY. Slow and steady the USD/CAD needs to be on seroquel maybe then it'd pick a direction ",,,,1232661370157531137,https://twitter.com/RDubya1898/status/1232661370157531137
2020-02-26 13:33:12,deamoninfloors,caringangel86,0,0,14,"So you admit you have a vested interest in keeping the insane Kafkaesque nightmare that once told me my meds were too expensive so they put me on fucking Seroquel.",,,,1232659883641757696,https://twitter.com/deamoninfloors/status/1232659883641757696
2020-02-26 12:30:03,nursebinky,flyingawxy,1,0,0,"That's an antihistamine. Nothing to do with seroquel, people use it on children on long flights but it won't replace seroquel.",,,,1232643991931244549,https://twitter.com/nursebinky/status/1232643991931244549
2020-02-26 12:28:34,johndrummond33,LouiseFeb74,0,0,2,"Looking back at our experience, it was a serious episode with grave possibilities. But the psychiatrist so misunderstood it that it's just embarrassing. You can't medicate your way out of an adolescent existential crisis , but that's what he thought - with Seroquel lol. Crap...",,,,1232643616973164544,https://twitter.com/johndrummond33/status/1232643616973164544
2020-02-26 11:10:50,bongsoy69,,0,0,6,"That was the best fukn sundae there was so much sauce and my seroquel stoned ass couldn’t even finish it",,,,1232624053640318978,https://twitter.com/bongsoy69/status/1232624053640318978
2020-02-26 10:44:08,HirokoWeeda,,1,0,0,"i am requesting asking and saying so. After experiencing 21 years of medical everyday No more injections of such kinds of medicines I am saying and asking to continue seroquel original (at most to me 200mg) to me, as to me Not paraperidon injections No Thank You Suffering i am",,,,1232617334436745217,https://twitter.com/HirokoWeeda/status/1232617334436745217
2020-02-26 10:31:56,shittyfriend,,0,1,4,"if you think i winked at you, i didn't seroquel makes me do that",,,,1232614267104325632,https://twitter.com/shittyfriend/status/1232614267104325632
2020-02-26 09:16:37,voltafox,,0,0,1,"gonna make a song about seroquel withdrawl",,,,1232595309739507713,https://twitter.com/voltafox/status/1232595309739507713
2020-02-26 09:03:55,vitae4life,,0,0,0,"Upped my seroquel dosage again. Here come the weird wake up spells.",,,,1232592117463179264,https://twitter.com/vitae4life/status/1232592117463179264
2020-02-26 08:56:43,MsEmpressRising,,0,0,1,"My life consist of a constant cycle of 400mg of Seroquel and caffeine.",,,,1232590302222934022,https://twitter.com/MsEmpressRising/status/1232590302222934022
