date,username,to,replies,retweets,favorites,text,geo,mentions,hashtags,id,permalink
2020-03-12 06:55:35,PHDPsyDr,drjessigold,0,0,0,"Abilify is pretty activating. The only antipsychotics I’ve seen used for anxiety are Seroquel and occasionally zyprexa.",,,,1237995636726935552,https://twitter.com/PHDPsyDr/status/1237995636726935552
2020-03-12 05:54:05,powderedbones,,0,0,0,"high and seroquel and im so hungry and so tired",,,,1237980162567950336,https://twitter.com/powderedbones/status/1237980162567950336
2020-03-12 05:47:53,HotepDadMax,Unicornhunter90,1,0,1,"Shit and a side order of Seroquel ",,,,1237978601351311363,https://twitter.com/HotepDadMax/status/1237978601351311363
2020-03-12 05:02:29,GenSingularity,,0,0,0,"she throws a tantrum with too much seroquel. you know the… you’ll call her in a row. you walk a few da… this weekend, you can in bitcoin. two weeks la… at least the xb… she isn’t into it. she pushes your hand away and puts her own around her neck. you help her out of the ",,,,1237967175811555329,https://twitter.com/GenSingularity/status/1237967175811555329
2020-03-12 04:40:50,abirdnamedxavi,simonefiasco_,0,0,2,"this show is so good!",,,,1237961725070192640,https://twitter.com/abirdnamedxavi/status/1237961725070192640
2020-03-12 03:29:12,afewcedars,,0,0,0,"does adding antihistamines (first or second generation) to quetiapine/seroquel increase d2 receptor occupancy? if not, why not? #psychopharmacology #pharmacology",,,#psychopharmacology #pharmacology,1237943698953916416,https://twitter.com/afewcedars/status/1237943698953916416
2020-03-12 03:14:02,AvaxDunne,,0,0,2,"seroquel knock me out challenge",,,,1237939881428615168,https://twitter.com/AvaxDunne/status/1237939881428615168
2020-03-12 03:10:47,_heidirw,AshaRangappa_,0,0,1,"He’s probably getting Seroquel in his mashed potatoes along with the cauliflower hidden like the infant he is.",,,,1237939066663927809,https://twitter.com/_heidirw/status/1237939066663927809
2020-03-12 03:05:43,abirdnamedxavi,sheikhofchic,1,5,40,"of course she would do something like this",,,,1237937789880205316,https://twitter.com/abirdnamedxavi/status/1237937789880205316
2020-03-12 03:05:36,jadeweiss,,0,0,0,"I haven’t taken my Seroquel yet &amp; I need to rn but I’m paranoid :(",,,,1237937762034233344,https://twitter.com/jadeweiss/status/1237937762034233344
2020-03-12 02:42:47,gargloid,,1,0,3,"Bro I think im gonna stop taking seroquel",,,,1237932019985899521,https://twitter.com/gargloid/status/1237932019985899521
2020-03-12 02:29:56,TheDeepestEnt,KevinMKruse,0,0,0,"Not even close. I took a Seroquel, good night.",,,,1237928786626326531,https://twitter.com/TheDeepestEnt/status/1237928786626326531
2020-03-12 02:14:24,pcpblunt,,0,0,3,"Everyone i seen who rock climbs be acting like its the best thing in the world and im womdering if its as cool as people make it sound.",,,,1237924874829479936,https://twitter.com/pcpblunt/status/1237924874829479936
2020-03-12 02:08:17,barbeque_dad,,1,0,0,"seroquel made me gain weight and now lamictal is giving me acne, when do I win",,,,1237923336438546435,https://twitter.com/barbeque_dad/status/1237923336438546435
2020-03-12 02:01:23,coldpressedTLJ,,0,0,8,"Cant believe the dems started a pandemic to stop Bernie",,,,1237921601531850753,https://twitter.com/coldpressedTLJ/status/1237921601531850753
2020-03-12 01:52:32,coldpressedTLJ,coldpressedTLJ,0,0,3,"Okay I didn't realize they suspended the NBA season before I said that",,,,1237919372817154048,https://twitter.com/coldpressedTLJ/status/1237919372817154048
2020-03-12 01:50:03,coldpressedTLJ,joeydaniewicz,1,0,0,"Quarantine the entire nba",,,,1237918748998328320,https://twitter.com/coldpressedTLJ/status/1237918748998328320
2020-03-12 01:44:15,abirdnamedxavi,tomhanks,0,1,0,"this year has been so long and it’s only been 3 mf months",,,,1237917287371419648,https://twitter.com/abirdnamedxavi/status/1237917287371419648
2020-03-12 01:40:00,sojaro,AOC,1,0,3,"They can't take questions at 10pm after a long day because by that point they're sundowning and have had enough Seroquel to fell a horse. ",,,,1237916216896913410,https://twitter.com/sojaro/status/1237916216896913410
2020-03-12 01:29:31,ZingoFrank,,0,0,0,"YA AND IM OK DEAD DOCTOR BATTLE FIGURED THIS YOU STILL IN DENIAL AND SAY YOU NEED MY DEAD DR LAMADA FIGURED THE SAND STILL BE OK MOVE THE SAND SO MUCH BEAUTIFULL POTENTIAL SEROQUEL STREET NAME ARE BARBIES GABAPENTIN STREET NAMES ARE GABBYS AND JOHNYS HELLO IM JOHNY LANG ",,,,1237913578323263489,https://twitter.com/ZingoFrank/status/1237913578323263489
2020-03-12 01:06:02,BOrlando106,nathankaczor,0,0,0,"Try Seroquel or a higher dose of hydroxyzine",,,,1237907669844987904,https://twitter.com/BOrlando106/status/1237907669844987904
2020-03-12 00:41:39,pcpblunt,,0,1,11,"Shut the hell up",,,,1237901535138344961,https://twitter.com/pcpblunt/status/1237901535138344961
2020-03-12 00:24:28,coldpressedTLJ,KWilliamWhite,0,0,3,"Drum",,,,1237897209468706819,https://twitter.com/coldpressedTLJ/status/1237897209468706819
2020-03-12 00:00:14,crunchysate,elsplaining,2,0,0,"valdoxan and seroquel ir (the one yang makes me sleepy)",,,,1237891111474958336,https://twitter.com/crunchysate/status/1237891111474958336
2020-03-11 23:29:19,deathsnot,,0,1,3,"selenas fucking hilarious, she already has such an attitude i cant wait to meet this foo lmao",,,,1237883332039282690,https://twitter.com/deathsnot/status/1237883332039282690
2020-03-11 23:28:54,ImNotUrMommy,,1,0,0,"Going to attempt to watch this. Have my Seroquel ready to go! ",,,,1237883226753921026,https://twitter.com/ImNotUrMommy/status/1237883226753921026
2020-03-11 21:50:53,deathsnot,,0,0,0,"didnt even get to finish my spaghettios, this is whack",,,,1237858559976599556,https://twitter.com/deathsnot/status/1237858559976599556
2020-03-11 21:50:11,deathsnot,,0,0,0,"luna threw her water cup at me and now it looks like i peed myself and now im sitting in the doctors office waiting for my ultrasound looking like a peepee girl. pathetic",,,,1237858385216679936,https://twitter.com/deathsnot/status/1237858385216679936
2020-03-11 21:36:23,gothbabymama,,1,0,0,"NOW 10mg or immediate release Seroquel? that shit had me woozy than a motherfucker. i take mine at night and had to take one of my sisters to the ER after i’d taken one and whew. i looked high/drunk as fuck. and i wasn’t.",,,,1237854910147772416,https://twitter.com/gothbabymama/status/1237854910147772416
2020-03-11 21:35:53,666exorcist,666exorcist,0,0,1,"update they thought i was a drug seeker and refused to fill my gabapentin but gave me a 15 day refill of my seroquel and told me there was a 3 day wait to get into a unit so i left bc fuck sitting in the ER for that long ",,,,1237854784352219136,https://twitter.com/666exorcist/status/1237854784352219136
2020-03-11 20:19:04,coldpressedTLJ,,2,0,1,"Hi I'm going to start needle felting sex toys Send Ideas and lnspo plz",,,,1237835453694443527,https://twitter.com/coldpressedTLJ/status/1237835453694443527
2020-03-11 20:11:20,coldpressedTLJ,,0,0,0,"This thread inspired by @sslyyart",,@sslyyart,,1237833506446852098,https://twitter.com/coldpressedTLJ/status/1237833506446852098
2020-03-11 20:04:58,abuttguy,,1,0,1,"i have the day off tomorrow to go to my psychiatrist and tell her im not taking my Seroquel anymore bc it fuckin sucks dealing with delusions and mild hallucinations is vastly preferable to that shit",,,,1237831903752998913,https://twitter.com/abuttguy/status/1237831903752998913
2020-03-11 20:02:10,coldpressedTLJ,,2,0,2,"I'm just going to add them all",,,,1237831201777385485,https://twitter.com/coldpressedTLJ/status/1237831201777385485
2020-03-11 19:56:48,coldpressedTLJ,,1,0,5,"Happy birthday to my father who art in heaven @jonasnewhouse It's a beautiful birthday in the neighborhood",,@jonasnewhouse,,1237829847675699200,https://twitter.com/coldpressedTLJ/status/1237829847675699200
2020-03-11 19:54:50,coldpressedTLJ,sslyyffoxx,1,1,2,"Heres mine",,,,1237829354878631939,https://twitter.com/coldpressedTLJ/status/1237829354878631939
2020-03-11 19:49:17,Tayy_lerr_,,1,0,0,"seroquel be kicking my ass man i just woke up",,,,1237827959261745154,https://twitter.com/Tayy_lerr_/status/1237827959261745154
2020-03-11 19:48:00,BenzosKill,WillPow47675675,1,0,1,"Oh, Seroquel... I took one and told my doctor, “I’m not taking that crap. I’ll keep it, so we can all pretend it’s there in case I suddenly lose my actual mind and don’t want to just drink bleach.”",,,,1237827633976471553,https://twitter.com/BenzosKill/status/1237827633976471553
2020-03-11 19:38:14,_sayheykate,,2,0,12,"Psych meds aren’t scary or shameful, and as a reminder of that I like storing them somewhere fun. Here’s where my Wellbutrin, Prozac, Seroquel, Lamictal, and Ativan currently live! If you want to share your setup, tag with #MedicatedAndMagical! Let’s keep fighting this stigma ",,,#MedicatedAndMagical,1237825176865251331,https://twitter.com/_sayheykate/status/1237825176865251331
2020-03-11 18:57:19,GenSingularity,,0,0,0,"bovada on the cover mocks you. like everything e… corner of the caesar’s palace food court. since your bankroll took a hit, you had heard she got into streaming after the breaku… throws a tantrum with too much seroquel. you know it’s not him you double-back b… finally agrees ",,,,1237814878343237644,https://twitter.com/GenSingularity/status/1237814878343237644
2020-03-11 18:51:46,jengagod,TrueAnonPod,0,0,0,"Bro seroquel is 40 hours sleep on your first time.",,,,1237813481811750912,https://twitter.com/jengagod/status/1237813481811750912
2020-03-11 18:46:39,normalman678910,,0,0,0,"i am tired all the time, my psychiatrist is trying to get me off the medication ive taken for literally almost a decade & put me on seroquel instead, for some reason he did not schedule us to meet again for an entire month, ive tried twice i do not think my body likes seroquel",,,,1237812194085044229,https://twitter.com/normalman678910/status/1237812194085044229
2020-03-11 18:31:53,DonniePiccardi6,,0,0,0,"Doctor told me I should be taking #Seroquel twice a day. I can't see myself being zombied out all day. How could I function?",,,#Seroquel,1237808477340405760,https://twitter.com/DonniePiccardi6/status/1237808477340405760
2020-03-11 18:16:19,HeyJebNiceGuac,TrueAnonPod,1,0,1,"What specific drugs have you tried besides the Trazodone/Seroquel?",,,,1237804563299778562,https://twitter.com/HeyJebNiceGuac/status/1237804563299778562
2020-03-11 18:13:31,TrueAnonPod,TrueAnonPod,3,3,183,"You can also take seroquel but there’s a chance a woman comes over to dispassionately fellate you and she’ll see them and think you’re psychotic. She may not believe you When you tell her you have no mental illnesses but you’ve seen a lot of people run over on the highway",,,,1237803856479703045,https://twitter.com/TrueAnonPod/status/1237803856479703045
2020-03-11 17:56:44,chabailey,theintercept,1,0,1,"Kudos for Bernie in deciding to stand to debate Joe, despite pleas from Establishment (chaired by John Brennan and @HillaryClinton ) to retire to Bradenton, FL at weekend. Convention brokering begins now. Debate will be George Burns v Carroll O'Connor on Seroquel.",,@HillaryClinton,,1237799635516829696,https://twitter.com/chabailey/status/1237799635516829696
2020-03-11 17:36:26,JungleStrikeGuy,,1,1,10,"DON'T PRESCRIBE SEROQUEL FOR INSOMNIA ONLY ",,,,1237794523964530688,https://twitter.com/JungleStrikeGuy/status/1237794523964530688
2020-03-11 15:21:12,AubriannaBanana,,1,0,2,"First day off seroquel and I woke up more refreshed than I have in the last year",,,,1237760493638553600,https://twitter.com/AubriannaBanana/status/1237760493638553600
2020-03-11 15:14:00,sandspen,,0,0,0,"SEROQUEL is not a sleep aid!! Dr’s repeat after me SEROQUEL is not a sleep aid!! #nurseproblems",,,#nurseproblems,1237758681057382406,https://twitter.com/sandspen/status/1237758681057382406
2020-03-11 15:02:49,annmarcos1,Simonro40611952,1,0,5,"Stop saying ”life saving” there is no evidence. When I say that Seroquel induced suicidal ideations and I am lucky to be alive I am told this is anecdotal. Why? Many people also claim ECT made them suicidal and for some long term suicide ideation. Anecdotal needs to go both ways.",,,,1237755865995849728,https://twitter.com/annmarcos1/status/1237755865995849728
2020-03-11 14:28:51,NEUTRALbiPOLAR,XoMeganAshley,0,0,1,"Did it once because the #seroquel was just too powerful and made me groggy in the morning.. didn't take too long for me to relapse and drive myself to the hospital naked in a crazy episode.. I highly suggest to just stay on meds even when you feel they aren't working, talk to doc",,,#seroquel,1237747316699922444,https://twitter.com/NEUTRALbiPOLAR/status/1237747316699922444
2020-03-11 14:27:42,chabailey,axios,0,0,0,"Bernie's being put on Seroquel, America's eldercare drug, to improve his outlook. So is Biden, but different dosage to manage dementia and anger. Seroquel is banned in Europe and most human nations. ",,,,1237747030602264576,https://twitter.com/chabailey/status/1237747030602264576
2020-03-11 14:17:35,GratefulDaedal1,StevenMichaelY3,0,0,3,"You should talk to your doctor about doubling up on your Seroquel.",,,,1237744484735160320,https://twitter.com/GratefulDaedal1/status/1237744484735160320
2020-03-11 13:37:55,deathsnot,,0,0,1,"wow i fucking love rikardo. selenas such a lucky baby",,,,1237734499510697987,https://twitter.com/deathsnot/status/1237734499510697987
2020-03-11 13:29:34,Jeimar,emoskumm,0,0,1,"what overdosing in seroquel feels like ",,,,1237732398235705345,https://twitter.com/Jeimar/status/1237732398235705345
2020-03-11 13:05:01,deathsnot,,0,0,0,"god i love rikardo so much, i miss him so much ughhhhh",,,,1237726221342928897,https://twitter.com/deathsnot/status/1237726221342928897
2020-03-11 12:54:41,MarijuanaNC,Find_Your_CALM,0,0,1,"What about non opioids? Does eliminating 75mg of Seroquel and 10mg of Celexa per day count as a victory for cannabis?",,,,1237723620174069760,https://twitter.com/MarijuanaNC/status/1237723620174069760
2020-03-11 12:25:05,neonlus,,0,0,0,"just realized that if me being sick is actually withdrawal from the seroquel i am going to riot",,,,1237716171920637952,https://twitter.com/neonlus/status/1237716171920637952
2020-03-11 10:27:59,ag0ny_in_v4in,,0,1,2,"No one ever talks about how getting help for mental health can be a huge contribution to not being able to work, being on seroquel is a rough ting and I spend the days floating",,,,1237686700761120768,https://twitter.com/ag0ny_in_v4in/status/1237686700761120768
2020-03-11 10:08:43,markcipolla,moonyeyed,0,0,0,"Ooooft. Kind thoughts to you. I know some of those feels, but each is unique. I avoided Seroquel because I thought it wouldn't work well for me (a real fun side effects list, eh?), but yeah, sounds like you've had ""a lot going on"" ",,,,1237681852342603777,https://twitter.com/markcipolla/status/1237681852342603777
2020-03-11 09:57:42,moonyeyed,markcipolla,0,0,0,"I've been on Seroquel for about 8 months now, and can truthfully say that I don't know how I'm finding it. A lot of horrible life events have occurred in that time, so I can't tell if I'm feeling more flat and distressed from that, or if it's also related to the tablet idk",,,,1237679080624947201,https://twitter.com/moonyeyed/status/1237679080624947201
2020-03-11 09:57:20,pipful,internetslime1,0,0,0,"Seroquel is whats making me eat 8 meals a day??",,,,1237678990627753984,https://twitter.com/pipful/status/1237678990627753984
2020-03-11 09:53:01,markcipolla,moonyeyed,2,0,0,"How are you finding the Seroquel?",,,,1237677904353349632,https://twitter.com/markcipolla/status/1237677904353349632
2020-03-11 09:51:17,moonyeyed,,3,0,22,"my skincare routine of drinking assloads of water for my dry Seroquel mouth and crying salty tears all over my face has been doing me wonders, wow, I almost look like I never suffered from adult acne!!! being clinically depressed has its benefits after all ",,,,1237677466249867265,https://twitter.com/moonyeyed/status/1237677466249867265
2020-03-11 09:17:58,SEABASSTHEGREAT,s3rioussam,0,0,0,"This new seroquel commercial is intense",,,,1237669080045420544,https://twitter.com/SEABASSTHEGREAT/status/1237669080045420544
2020-03-11 09:16:48,SEABASSTHEGREAT,THEAP99,0,0,0,"This new Seroquel commercial really brings light to the reality of living with delusions.",,,,1237668790076399616,https://twitter.com/SEABASSTHEGREAT/status/1237668790076399616
2020-03-11 08:53:39,miss_meg_3,,0,0,1,"Why is my Seroquel not working tonight, hello?? I’m still wide awake and it’s nearly 5 am! ",,,,1237662963508658176,https://twitter.com/miss_meg_3/status/1237662963508658176
2020-03-11 08:07:43,linda_lin956626,ed_lorens,0,0,2,"No. It’s dementia. I worked on a dementia unit. He needs Seroquel for the outbursts.",,,,1237651402807218176,https://twitter.com/linda_lin956626/status/1237651402807218176
2020-03-11 07:21:16,foxnbots,Leve_raged,1,0,1,"There's an antidote that can protect u! Quick, grab the Seroquel!",,,,1237639714536067072,https://twitter.com/foxnbots/status/1237639714536067072
2020-03-11 07:00:51,gaypowermove,,0,0,0,"celebrated my sisters 20th birthday small party but im still exhausted beyond belief plus the seroquel is a sedative sooooooo im super drowsy lmao i think...tonight....i will listen to night vale",,,,1237634575276183553,https://twitter.com/gaypowermove/status/1237634575276183553
2020-03-11 06:55:29,Juanita_Khumalo,Success1Black,2,0,0,"Seroquel. Was on it before. Daytime drowsiness and dizziness are a common side effect of some sleeping medication and we all respond differently to medication. I would suggest you make your doctor aware and possibly explore a different type until you find what works best for you. ",,,,1237633224609878016,https://twitter.com/Juanita_Khumalo/status/1237633224609878016
2020-03-11 06:02:56,sukunahost,,0,0,1,"took my seroquel goodnight yuujiers shinranators and every who dont wash their ass ",,,,1237619998354485249,https://twitter.com/sukunahost/status/1237619998354485249
2020-03-11 05:36:10,sukunahost,,0,0,1,"to take my seroquel now or play video games and then take it ",,,,1237613265208958976,https://twitter.com/sukunahost/status/1237613265208958976
2020-03-11 05:10:57,kyliepuff,,0,0,0,"So my seroquel decided to not work tonight? C O O L ",,,,1237606919163932673,https://twitter.com/kyliepuff/status/1237606919163932673
2020-03-11 04:16:59,semirose,SarahDemp,1,0,1,"I'm like doubling my Seroquel and passing out bc you know I can't resist watching every scrap of news (lol work is finding this out as I give hourly covid-19 updates from around the world)",,,,1237593336501817350,https://twitter.com/semirose/status/1237593336501817350
2020-03-11 04:15:32,deathsnot,,0,0,1,"was deep cleaning and found the hospital paperwork from when my ex sprained my back for trying to pack my belongings, fuck u and ur mother if u kick it with that foo just know ur a lame fr",,,,1237592972696272897,https://twitter.com/deathsnot/status/1237592972696272897
2020-03-11 04:13:29,RubberFirewall,MableGoude,0,0,0,"Haven't been well the past 2 days since my mum spiked my methadone take aways with too much Seroquel. I've reduced my Seroquel to 100 mg twice a day because of it giving me a blocked nose. My mum probably thought the methadone bottle was 2 doses and put 600 mg inside ...",,,,1237592457656729600,https://twitter.com/RubberFirewall/status/1237592457656729600
2020-03-11 04:11:01,13BLOODYNOTDEAD,amv0001,1,0,0,"Yes. Also leme TIL and seroquel. ",,,,1237591835725287425,https://twitter.com/13BLOODYNOTDEAD/status/1237591835725287425
2020-03-11 04:05:46,13BLOODYNOTDEAD,amv0001,0,0,0,"Dennis and I were talking about it. I know what seroquel does. I don’t want it. I have been up late since I have been troubled by my relationships. I’m borderline personality disorder. I AM disorder. This is how I act when I am in love. He gave me my figure back now...",,,,1237590514414710785,https://twitter.com/13BLOODYNOTDEAD/status/1237590514414710785
2020-03-11 03:52:04,James_Boss17,,2,1,18,"Just took NyQuil, Melatonin, Seroquel, and Allegra ",,,,1237587066260606978,https://twitter.com/James_Boss17/status/1237587066260606978
2020-03-11 03:34:21,DoctorOcelot,SteveGuest,0,0,1,"Someone should make a mock Seroquel ad combining this clip with the earlier ""ass hole"" clip. ",,,,1237582609632210946,https://twitter.com/DoctorOcelot/status/1237582609632210946
2020-03-11 03:15:41,mikeyswah,HiiKeats,0,0,1,"I’ma bless u w a seroquel tomorrow",,,,1237577908408860673,https://twitter.com/mikeyswah/status/1237577908408860673
2020-03-11 02:35:47,likeno1_KELS,,0,0,0,"I’ve literally been munching alllll day don’t know if it’s the seroquel I’m taking or if mother nature is coming who knows pass me the Nutella plz ",,,,1237567870592143363,https://twitter.com/likeno1_KELS/status/1237567870592143363
2020-03-11 02:17:57,deathsnot,disposableteeth,0,1,7,"""are you okay? you look sick""",,,,1237563381839618049,https://twitter.com/deathsnot/status/1237563381839618049
2020-03-11 02:03:43,coldpressedTLJ,,0,0,7,"I was going to go back into a PhD program next year in queer studies. I'm putting that on hold to do some revolutionary organizing and organizing to help my peers and people who dont give a fuck. I've had enough privilege for a lifetime, it's time to fight back.",,,,1237559797760704514,https://twitter.com/coldpressedTLJ/status/1237559797760704514
2020-03-11 01:53:26,coldpressedTLJ,Phil_Mattingly,0,2,5,"Fuck you andrew yang",,,,1237557210898558976,https://twitter.com/coldpressedTLJ/status/1237557210898558976
2020-03-11 01:47:49,Scott00073,iDGiam,0,0,0,"That’s no good mate my problem is mainly caused by having to take opiates for the last 6 years for pain as i crushed 4 vertabrae and broke 16 other bones. They seem to hype me up and the mirtazapine and seroquel knocks me out at night. PTSD is a terrible thing to deal with",,,,1237555797158055936,https://twitter.com/Scott00073/status/1237555797158055936
2020-03-11 01:26:59,coldpressedTLJ,,1,0,10,"She was and always will be a politician who has no regards for you, she made that clear in her campaign and following. She really feels she doesnt owe you anything. Not bernie, you, the people who voted for her. Sorry you threw your vote away when the writing was on the wall.",,,,1237550554575810560,https://twitter.com/coldpressedTLJ/status/1237550554575810560
2020-03-11 01:23:45,coldpressedTLJ,,1,6,36,"Sorry gal pals but Warren didnt care about the progressive movement enough to stick with Medicare for all and not take super pac money...and now her silence? Deafening with being complicit with the DNC establishment",,,,1237549740624994304,https://twitter.com/coldpressedTLJ/status/1237549740624994304
2020-03-11 01:10:24,CBerthelot227,PhoenixWomanMN,1,0,1,"I think you need your Seroquel dose, you have an acute case of Russophobia",,,,1237546380362563584,https://twitter.com/CBerthelot227/status/1237546380362563584
2020-03-11 00:56:23,deathsnot,Zombee_killler,0,1,1,"okay but she does",,,,1237542855737921536,https://twitter.com/deathsnot/status/1237542855737921536
2020-03-11 00:33:36,coldpressedTLJ,PengAutomata,0,0,0,"My year was a construction company business owner who had some sort of first person to etc accolade",,,,1237537119859433472,https://twitter.com/coldpressedTLJ/status/1237537119859433472
2020-03-11 00:33:13,VetsCannaCoal,VetsCannaCoal,0,0,0,"Plus, compared to Paxil, Zoloft, Seroquel, and a raft of other #pharmaceuticals known to increase risk of #suicide that are routinely prescribed to veterans, cannabis offers potential multi-symptom relief without the toxicity.",,,#pharmaceuticals #suicide,1237537024237658112,https://twitter.com/VetsCannaCoal/status/1237537024237658112
2020-03-11 00:29:52,MeliDraws,,0,0,1,"...My options are me with a dumb snapchat filter with my face covered in birds, an extremely unflattering photo of my fatass eating cake, or me looking like I've OD'd on seroquel (which is just my normal face).",,,,1237536182747070464,https://twitter.com/MeliDraws/status/1237536182747070464
2020-03-10 23:32:15,coldpressedTLJ,,0,0,1,"My laptop charger biffed it on friday and it wont get here till tomorrow so I've been without my laptop for that long and I'm hemorrhaging stress",,,,1237521679380672512,https://twitter.com/coldpressedTLJ/status/1237521679380672512
2020-03-10 23:25:24,Anastasia62621,JulieeRobertss,1,3,10,"He needs namenda and seroquel",,,,1237519955748253696,https://twitter.com/Anastasia62621/status/1237519955748253696
2020-03-10 23:12:23,coldpressedTLJ,,0,4,23,"Fish tube to the polls",,,,1237516683318718466,https://twitter.com/coldpressedTLJ/status/1237516683318718466
2020-03-10 23:05:25,dykepikachu,KaitlenMcElroy,0,0,1,"i take adderall during the day and seroquel at night, so i mostly manage to keep the weight off, but i eat one big meal at 11pm almost every night lol",,,,1237514930112229376,https://twitter.com/dykepikachu/status/1237514930112229376
2020-03-10 22:27:44,Josiexfruit,,1,0,1,"Cw drugs Anybody have experience kicking seroquel?",,,,1237505446673514498,https://twitter.com/Josiexfruit/status/1237505446673514498
2020-03-10 22:17:06,KaitlenMcElroy,dykepikachu,2,0,2,"Seroquel was the only thing that helped me sleep, but I had to quit it because I put on SO MUCH WEIGHT so fast ",,,,1237502768652353539,https://twitter.com/KaitlenMcElroy/status/1237502768652353539
2020-03-10 21:23:47,dykepikachu,heyyotayo,0,0,1,"there's a lot that goes into picking a med beyond what the fda approved them for. seroquel can be kinda intense, so many doctors will try other things first. that said, they're different classes, so you could take both",,,,1237489351132450817,https://twitter.com/dykepikachu/status/1237489351132450817
