date,username,to,replies,retweets,favorites,text,geo,mentions,hashtags,id,permalink
2020-03-15 14:45:09,ltcmndrdata,,1,0,1,"the knowledge that will have to watch the br*ttas empire soon feels like looking at a triple shot of vodka im gonna down knowing ive taken seroquel earlier",,,,1239200972410433537,https://twitter.com/ltcmndrdata/status/1239200972410433537
2020-03-15 13:56:23,MortimerGormsby,PTiiim_Leary,1,0,0,"Is that the same as seroquel? Coz I got that on hand",,,,1239188699281125376,https://twitter.com/MortimerGormsby/status/1239188699281125376
2020-03-15 10:53:58,Elliott_MacG,,0,0,3,"It's very strange that after taking my 500mg of Seroquel last night I heard way more voices than normal. Didn't help that they told me I'd be lucky to see the morning. This has happened to me before with Seroquel but surely as an AP it should be doing the opposite? Thoughts?",,,,1239142793563508736,https://twitter.com/Elliott_MacG/status/1239142793563508736
2020-03-15 10:02:39,empty_angeI,,0,0,0,"i’ve decided to stop taking my seroquel cold turkey bc i ~know~ it’s what has been making weight loss so difficult (&amp; weight gain so easy) anyways, it’s 6am and i still haven’t been able to sleep. this withdrawal is gonna SUCK but idc",,,,1239129877250543617,https://twitter.com/empty_angeI/status/1239129877250543617
2020-03-15 09:56:30,MightyKreskin,Dangerouslytal,0,0,0,"probably the two worst choices in the drug world. shit, even seroquel is better than both by a country mile.",,,,1239128329741127681,https://twitter.com/MightyKreskin/status/1239128329741127681
2020-03-15 09:55:01,shellielopez,caitoz,0,0,0,"Few things can be trusted. My mother died from the flu in ’13. Going to the hospital is what killed her. Hospital acquired pneumonia has a mortality rate of 33% She beat pneumonia & was supposed to go home next morning. She was given Seroquel and never woke up. Rx drugs kill",,,,1239127954963214341,https://twitter.com/shellielopez/status/1239127954963214341
2020-03-15 09:04:40,foxnbots,sawluke,0,0,0,"Honestly, the ""help"" they offer her kind is not helpful. Thorazine, lithium, seroquel...stop thinking if your thoughts are dangerous. It's not for her benefit, but for the supposed safety of those around her. I know, because I am a noncompliant patient.",,,,1239115285849944064,https://twitter.com/foxnbots/status/1239115285849944064
2020-03-15 08:50:12,420WeedLord,1nternetSpades,0,0,2,"chipmunks the seroquel",,,,1239111643545534464,https://twitter.com/420WeedLord/status/1239111643545534464
2020-03-15 08:36:31,thelightsofhome,,1,0,1,"I'm sooo tired. I only slept about 4 hours last night, and now I'm still awake at 1:30am. I've taken my entire day's worth of Xanax, plus Seroquel, Seroquel xr, Ambien, and prazocin. Why do the same meds work so well most nights but other times they just... don't? Frustrating!",,,,1239108202152611840,https://twitter.com/thelightsofhome/status/1239108202152611840
2020-03-15 08:16:20,yamitheplug,,0,0,0,"someone talk 2 me before i pop this seroquel and pass out",,,,1239103123429437440,https://twitter.com/yamitheplug/status/1239103123429437440
2020-03-15 08:05:07,1nternetSpades,,1,0,6,"The great thing about seroquel is I can just end my day whenever I want",,,,1239100299039477760,https://twitter.com/1nternetSpades/status/1239100299039477760
2020-03-15 07:40:12,christinadunnn,,0,0,0,"Why isn’t my seroquel working??",,,,1239094030387965953,https://twitter.com/christinadunnn/status/1239094030387965953
2020-03-15 07:06:29,veronyaca,,0,0,1,"*takes my seroquel* *immediately becomes normal again*",,,,1239085544241594369,https://twitter.com/veronyaca/status/1239085544241594369
2020-03-15 06:34:40,The5thRobin,,0,0,0,"Bowl of cereal and then sleep. Damn you Seroquel for giving me sugar cravings.",,,,1239077538812645377,https://twitter.com/The5thRobin/status/1239077538812645377
2020-03-15 05:57:20,hppyhppie,,0,0,3,"): my feelings got hurt. i’m popping a seroquel and going to bed forever",,,,1239068140673404929,https://twitter.com/hppyhppie/status/1239068140673404929
2020-03-15 05:11:43,deathsnot,,1,4,15,"goth mom activities",,,,1239056661060304896,https://twitter.com/deathsnot/status/1239056661060304896
2020-03-15 05:10:00,paisleyhunter,Rocioceja_,0,0,0,"Seroquel can be your new best friend. Trust",,,,1239056229672108035,https://twitter.com/paisleyhunter/status/1239056229672108035
2020-03-15 05:01:35,abirdnamedxavi,alreadytaken74,0,1,0,"now why she eat hans zimmer up like that",,,,1239054112869822464,https://twitter.com/abirdnamedxavi/status/1239054112869822464
2020-03-15 05:01:11,coldpressedTLJ,,0,0,4,"Hey everyone social distancing was like...in public You didnt have to stop talking 2 me lol",,,,1239054013284352001,https://twitter.com/coldpressedTLJ/status/1239054013284352001
2020-03-15 05:00:30,coldpressedTLJ,,0,0,1,"Social distancing has the group chats lit",,,,1239053837509550082,https://twitter.com/coldpressedTLJ/status/1239053837509550082
2020-03-15 04:48:42,justscottplease,lesbianoverlord,0,0,1,"God no. Seroquel was worse.",,,,1239050871201247232,https://twitter.com/justscottplease/status/1239050871201247232
2020-03-15 04:15:48,zbeefcakecody,,0,0,0,"alright anyways the next step of the master plan is selling seroquel to middle schoolers and there’s no skipping steps.",,,,1239042589187325952,https://twitter.com/zbeefcakecody/status/1239042589187325952
2020-03-15 03:42:47,K4BoLove,SoLatinBarbie,0,0,3,"Maybe they're on #seroquel",,,#seroquel,1239034281734713345,https://twitter.com/K4BoLove/status/1239034281734713345
2020-03-15 03:39:27,GenSingularity,,0,0,0,"molasses. based on the cover mocks you. like everything e… morty slot machine and google “romantic vegas food” vacation together was supposed to rese… loud. tips ar… much seroquel. you know the… your stocked provisions. you start with the rapper crying over chicken wings. ",,,,1239033441695535104,https://twitter.com/GenSingularity/status/1239033441695535104
2020-03-15 03:00:10,veronyaca,,1,0,1,"broad apology here for being crazy today i didnt get to take my seroquel ",,,,1239023554680815620,https://twitter.com/veronyaca/status/1239023554680815620
2020-03-15 02:52:59,sadclown2007,bugjeIIy,0,0,0,"seroquel did that 2 me",,,,1239021747204247552,https://twitter.com/sadclown2007/status/1239021747204247552
2020-03-15 02:16:45,coldpressedTLJ,,0,0,0,"My google search history rn",,,,1239012628481167360,https://twitter.com/coldpressedTLJ/status/1239012628481167360
2020-03-15 02:16:16,coldpressedTLJ,,2,0,3,"Tips and tricks to get your roommate to be less careless about social distancing even though shes put you at near risk already",,,,1239012508226093057,https://twitter.com/coldpressedTLJ/status/1239012508226093057
2020-03-15 01:04:21,Latan1231,simple_me202,1,0,1,"I tried Seroquel years ago but don’t think I gave it an honest shot. Sometimes I get too worried after a side effect &amp; jump right off them ",,,,1238994409875738631,https://twitter.com/Latan1231/status/1238994409875738631
2020-03-15 01:01:44,simple_me202,Latan1231,1,0,0,"I’m on seroquel. I was using Trazodone which did not work at all. Bad side effects, nauseas and dizziness.",,,,1238993751613132810,https://twitter.com/simple_me202/status/1238993751613132810
2020-03-15 00:55:23,dirtbabybot,,0,0,0,"Girl give me by alfred reed seroquel and he could have to stay in 18th birthday and feel.",,,,1238992152841117696,https://twitter.com/dirtbabybot/status/1238992152841117696
2020-03-15 00:47:31,dirtbabybot,,0,0,0,"Seroquel AND apjvff is discontinued",,,,1238990176162119681,https://twitter.com/dirtbabybot/status/1238990176162119681
2020-03-15 00:35:25,adoreubysvt,bugjeIIy,1,0,0,"i can’t remember which medications did what but: constant dissociation, weight gain cos it gave me munchies(seroquel, but it helps me not go crazy so ), feeling like a zombie, making me more anxious, REALLY bad palpitations(ritalin)",,,,1238987128702304256,https://twitter.com/adoreubysvt/status/1238987128702304256
2020-03-15 00:20:44,WELLinTHIShouse,EryckTait,1,0,4,"Seroquel is currently preventing me from doing something with horrible finality that I don't even want to do. But depression is a sneaky bitch that likes to do away with my impulse control. My doc increased my dose after a bathtub incident, and it's like magic.",,,,1238983431847120902,https://twitter.com/WELLinTHIShouse/status/1238983431847120902
2020-03-15 00:10:31,Iiabilityhes,,0,0,0,"any of y’all ever been on seroquel ????, this shit has me so fucked up bro",,,,1238980862366097409,https://twitter.com/Iiabilityhes/status/1238980862366097409
2020-03-14 23:33:43,fairlylighter,jinkgs,0,0,0,"LMFAOOOOOO seroquel was my favorite medication",,,,1238971599736287232,https://twitter.com/fairlylighter/status/1238971599736287232
2020-03-14 23:18:44,kkyylleeaa,,0,0,1,"y’all stocking up on water & bleach, i’m abt to stock up on some seroquel and sleep through this corona shit lmao",,,,1238967831892340737,https://twitter.com/kkyylleeaa/status/1238967831892340737
2020-03-14 22:33:26,SpookyAlienClod,simpscreens,0,0,2,"when you trippin off the seroquel at 3am and you can’t get up to take a piss ",,,,1238956432323522560,https://twitter.com/SpookyAlienClod/status/1238956432323522560
2020-03-14 22:27:17,ketiapinfumarat,,0,0,5,"Current mood",,,,1238954885313433601,https://twitter.com/ketiapinfumarat/status/1238954885313433601
2020-03-14 22:12:53,jinkgs,,1,0,7,"seroquel is both the love of my life and my greatest enemy ",,,,1238951257617956864,https://twitter.com/jinkgs/status/1238951257617956864
2020-03-14 22:12:41,staypuft_,sladebeezy,1,0,0,"fr those seroquel munchies no joke",,,,1238951210817851392,https://twitter.com/staypuft_/status/1238951210817851392
2020-03-14 22:03:05,James33123065,Dallas3331461,0,0,0,"Took my meds blood pressure pill Seroquel got my blanket just waiting for these pills to kick in. I'll be tweeting for a while yet ",,,,1238948793372086283,https://twitter.com/James33123065/status/1238948793372086283
2020-03-14 21:41:21,Enginethatcan,,0,0,0,"@KatRamsland Damn right I looked at SEROQUEL as a histamine blocker.",,@KatRamsland,,1238943325681520640,https://twitter.com/Enginethatcan/status/1238943325681520640
2020-03-14 21:34:42,tinywaluigi,lithelemon,1,0,1,"ive been on seroquel for 3 years and that shit still knocks me out like nothing else",,,,1238941648341655554,https://twitter.com/tinywaluigi/status/1238941648341655554
2020-03-14 21:31:56,Enginethatcan,,0,0,0,"@KatRamsland Yeah. I believe in SEROQUEL.",,@KatRamsland,,1238940952032665601,https://twitter.com/Enginethatcan/status/1238940952032665601
2020-03-14 21:28:46,sladebeezy,,1,0,1,"This man said he’ll never take seroquel again bc he’d wake up n have a sandwich in his bed I’m weak cause that’s really how it be",,,,1238940157438504960,https://twitter.com/sladebeezy/status/1238940157438504960
2020-03-14 20:45:05,GirlfrendExp,MrDarkWolfe,0,0,1,"Sounds like a Seroquel ""hang over"" I know about those only too well",,,,1238929163224068097,https://twitter.com/GirlfrendExp/status/1238929163224068097
2020-03-14 20:34:05,lithelemon,,1,0,1,"i started taking seroquel and it’s kind of making me feel like a zombie lol",,,,1238926395390275586,https://twitter.com/lithelemon/status/1238926395390275586
2020-03-14 20:04:27,deathsnot,xolayyloni,0,0,1,"somebody please rob everybody reselling that shit on offerup and just redistribute it to mothers who need it. this shits fucking ridiculous",,,,1238918938357952512,https://twitter.com/deathsnot/status/1238918938357952512
2020-03-14 19:41:01,coldpressedTLJ,,0,0,28,"The coffee shop I work at is closed for the next week, but my boss is still paying us for the shifts we would normally have. Very Thankful.",,,,1238913042869608448,https://twitter.com/coldpressedTLJ/status/1238913042869608448
2020-03-14 19:12:51,deathsnot,,0,0,0,"im glad me and rikardo bought ice cream bc i didnt realize how much my little brothers would need comfort food at these times too, i love them so much",,,,1238905953954611200,https://twitter.com/deathsnot/status/1238905953954611200
2020-03-14 18:40:34,OCommonalities,cjjohnsonjr,0,0,2,"A 30 day supply of Zyprexa or Seroquel with each purchase. We'll help you get rid of those pesky paranoid delusions and everything will be hunky-dory.",,,,1238897826228305921,https://twitter.com/OCommonalities/status/1238897826228305921
2020-03-14 18:11:38,deathsnot,,0,1,1,"they never cared about doing us dirty, they leave us with nothing now just because they can afford to and literally no other reason. rob ur local rich person. stop selling weed to white people, simply just rob them. stop giving them money. just take what u fucking need.",,,,1238890544907968512,https://twitter.com/deathsnot/status/1238890544907968512
2020-03-14 18:08:09,deathsnot,,1,1,1,"if u pull up to a store n see that theres a car with a trump sticker on it bitch u better get down somewhere and wait, they less than anyone deserve what theyre stocking up on n i think its time that we as poor people who have immunosuppressed loved ones need to start doing dirt.",,,,1238889671293206529,https://twitter.com/deathsnot/status/1238889671293206529
2020-03-14 18:05:21,deathsnot,,1,2,10,"cool that theres no confrontation policy for stealing from most places but there should be a fucking policy for people stocking the fuck up on shit. nobody needs 20 packs of toilet paper, or 40 fucking tubs of infant formula. its time to start robbing people in the parking lot",,,,1238888967577022464,https://twitter.com/deathsnot/status/1238888967577022464
2020-03-14 18:01:39,coldpressedTLJ,coldpressedTLJ,0,0,0,"DM me for a slack channel invite!",,,,1238888034982076422,https://twitter.com/coldpressedTLJ/status/1238888034982076422
2020-03-14 18:00:05,deathsnot,mrskianaa,0,1,3,"i hope all of it expires as soon as she steps out the exit. i hope 1 of the wheels breaks off her cart n every single one of those milk jugs either break on the floor or slide all the way over to a family that actually needs it. somebody needs to start claiming peoples kneecaps",,,,1238887638897053696,https://twitter.com/deathsnot/status/1238887638897053696
2020-03-14 17:48:31,coldpressedTLJ,TristanJMiller1,0,0,1,"Ah, ok! As long as you didnt skip to 3 or 4 that's fine imo Also 2 is so important for 3 and 4 hahaha I want to know what you think of it!!!",,,,1238884731288260612,https://twitter.com/coldpressedTLJ/status/1238884731288260612
2020-03-14 17:43:44,dei_genetrix,,1,0,16,"Really tho might as well just dip on the seroquel altogether if you actually like that trippy shit",,,,1238883526994464769,https://twitter.com/dei_genetrix/status/1238883526994464769
2020-03-14 17:41:22,jessiblaaah,,0,0,0,"People who manage to take seroquel in the mornings are a whole other level of powerful",,,,1238882931801829386,https://twitter.com/jessiblaaah/status/1238882931801829386
2020-03-14 17:41:10,coldpressedTLJ,TheMikeBachmann,0,0,2,"@KWilliamWhite Save the day",,@KWilliamWhite,,1238882880908070912,https://twitter.com/coldpressedTLJ/status/1238882880908070912
2020-03-14 17:40:39,coldpressedTLJ,,0,0,0,"I'd be willing to facilitate stuff like that. I've been working from home for 3 weeks and know how hard that transition is and want to help.",,,,1238882747789303809,https://twitter.com/coldpressedTLJ/status/1238882747789303809
2020-03-14 17:39:18,coldpressedTLJ,,2,0,3,"Does anyone want to start a co working slack/google hangout for those of us working from home?",,,,1238882411695521793,https://twitter.com/coldpressedTLJ/status/1238882411695521793
2020-03-14 17:25:26,coldpressedTLJ,grease_bat,0,0,1,"Hangouts has been great for most stuff for me",,,,1238878920465944576,https://twitter.com/coldpressedTLJ/status/1238878920465944576
2020-03-14 17:21:03,SpookTheBoo,oppressedwaifuu,0,0,2,"I do often but it's because of seroquel lmao.",,,,1238877816852267015,https://twitter.com/SpookTheBoo/status/1238877816852267015
2020-03-14 17:10:24,shawmor,mistergoodgod,1,0,0,"that was me for 10 years regardless of otc or Rx... then my doctor put me on Seroquel and I’ve been sleeping like a baby ever since",,,,1238875135580540928,https://twitter.com/shawmor/status/1238875135580540928
2020-03-14 17:01:48,GripperShanz,,1,0,0,"Just took the recommended dose for seroquel and promethazine twice. That's gonna fuck me up lol.",,,,1238872971806232576,https://twitter.com/GripperShanz/status/1238872971806232576
2020-03-14 17:00:04,coldpressedTLJ,TristanJMiller1,1,0,0,"YES you started with part 1?",,,,1238872538383560707,https://twitter.com/coldpressedTLJ/status/1238872538383560707
2020-03-14 16:26:17,coldpressedTLJ,corgiKD,0,0,0,"I want to do the same here as much as I can.",,,,1238864035711520771,https://twitter.com/coldpressedTLJ/status/1238864035711520771
2020-03-14 15:25:22,bloatedlesbian,JackPosobiec,0,0,0,"Coronavirus is not a secret. Take your seroquel.",,,,1238848702451720197,https://twitter.com/bloatedlesbian/status/1238848702451720197
2020-03-14 13:46:14,dayv,,0,0,3,"If I run out of toilet paper I can just go back on seroquel so I can return to shitting once or twice a week.",,,,1238823756224659456,https://twitter.com/dayv/status/1238823756224659456
2020-03-14 13:44:07,Darkter6,,0,0,0,"I only got the idea bc the internet says snorting it is dangerous but Eh, I've taken seroquel before",,,,1238823226127650816,https://twitter.com/Darkter6/status/1238823226127650816
2020-03-14 13:28:13,Darkter6,,0,0,0,"I took a handful of my old lexapro and a few 25mg pills of seroquel a few days ago. Unfortunately, it didn't have the desired effect.... There was a very, very brief fuzziness, but then I just slept for 24 hours straight. I told aleks about it, because I had to tell someone",,,,1238819222794444806,https://twitter.com/Darkter6/status/1238819222794444806
2020-03-14 13:26:45,Darkter6,,0,0,0,"Turns out seroquel is actually a street drug. It has a street name and everything. Quel, or Suzie-q if you lace it with coke. I wish I had coke, tbh.",,,,1238818855457361920,https://twitter.com/Darkter6/status/1238818855457361920
2020-03-14 11:59:35,PandeanPanic,,0,0,0,"it's nearly 7 in the morning and i still despite the ambien, the seroquel, and the trazodone. I feel the effects of the drugs making me lightheaded and loopy and like they're supposed to work to make me sleep but it's 7am ",,,,1238796915405398016,https://twitter.com/PandeanPanic/status/1238796915405398016
2020-03-14 11:40:17,coldpressedTLJ,,1,2,7,"In a food waste thought: I wonder how much food will go to waste do to the hoarding of people? Both the perishable and non perishable.",,,,1238792058619527170,https://twitter.com/coldpressedTLJ/status/1238792058619527170
2020-03-14 09:20:52,deathsnot,,0,0,0,"i fucking miss rikardo so much",,,,1238756973069254656,https://twitter.com/deathsnot/status/1238756973069254656
2020-03-14 07:29:29,slut4love,employedforwhat,0,0,0,"wellbutrin n seroquel my saviors",,,,1238728945199022080,https://twitter.com/slut4love/status/1238728945199022080
2020-03-14 07:02:52,haydnws,hymnsofdeath,0,0,0,"you need some lithium, sir? maybe some seroquel? i have some",,,,1238722245331013632,https://twitter.com/haydnws/status/1238722245331013632
2020-03-14 06:17:44,employedforwhat,stopchrissy,1,0,3,"wellbutrin, seroquel, and vistaril are the father the son and the holy spirit for my psyche",,,,1238710889890660352,https://twitter.com/employedforwhat/status/1238710889890660352
2020-03-14 06:14:10,Elic1124,,0,0,1,"My soul gone but the seroquel heals me",,,,1238709988551356418,https://twitter.com/Elic1124/status/1238709988551356418
2020-03-14 06:05:00,13BLOODYNOTDEAD,,0,0,0,"Force lemectil and seroquel into my body. If I don’t go to this appointment. He will cut off my pain meds. I reread the message I sent and I realized the substantiation were sent but he did not read them and blocked any more texts that proved you and Dennis are real.",,,,1238707681499795457,https://twitter.com/13BLOODYNOTDEAD/status/1238707681499795457
2020-03-14 05:39:24,cora23_,,0,0,0,"Bruh deadass took 6 of my seroquel and I’m still awake usually 6 pills knock me out",,,,1238701242748006400,https://twitter.com/cora23_/status/1238701242748006400
2020-03-14 05:35:55,deathsnot,aaaryannaaaa,0,0,0,"ummmmm thats bullshit ",,,,1238700366113280000,https://twitter.com/deathsnot/status/1238700366113280000
2020-03-14 04:43:18,sukunahost,zhinra,1,0,0,"3?;;:)3:8:$28 girl that sounds so scary i take seroquel my mood stabilizing queens and my sleep meds too ",,,,1238687124561502208,https://twitter.com/sukunahost/status/1238687124561502208
2020-03-14 04:24:44,everjqmes,everjqmes,0,0,0,"Also had an eating disorder that stemmed from psychiatric prescription of seroquel adderal and depakote cocktail as a child which fucked with my metabolism so.",,,,1238682449036693504,https://twitter.com/everjqmes/status/1238682449036693504
2020-03-14 04:22:53,SJDIDDY,,0,0,0,"I wasn't in the mood to take Seroquel tonight.",,,,1238681985981100032,https://twitter.com/SJDIDDY/status/1238681985981100032
2020-03-14 04:15:31,dirkcoomply,HOSTAGEKILLER,1,0,1,"i can't go without my antidepressant for a day before I get the brain chills, and i just don't sleep unless i get the seroquel , no sleep fucks me up even more honestly",,,,1238680131461246976,https://twitter.com/dirkcoomply/status/1238680131461246976
2020-03-14 04:07:38,jbias,,1,0,2,"bro they wewrent joking when they said that seroquel will knock u out bro im bouta pass out holy fuck",,,,1238678149111656448,https://twitter.com/jbias/status/1238678149111656448
2020-03-14 03:28:12,coldpressedTLJ,sunshysunflower,1,1,2,"It's for sure concerning but young folks are the least likely to die, but you should be concerned about transmitting to people who are at risk mostly.",,,,1238668225350635521,https://twitter.com/coldpressedTLJ/status/1238668225350635521
2020-03-14 03:09:18,jakestokesx,,0,0,0,"my soul gone but the seroquel heals me ",,,,1238663466862469120,https://twitter.com/jakestokesx/status/1238663466862469120
2020-03-14 02:03:57,coldpressedTLJ,,2,2,29,"Have I told any of you about my beautiful best friend @KWilliamWhite ??? Because I've never met a better one than this",,@KWilliamWhite,,1238647022548324352,https://twitter.com/coldpressedTLJ/status/1238647022548324352
2020-03-14 01:58:59,deathsnot,,0,1,3,"honestly disco and funk is not only a gift from god but it is also the only good in the world at the moment and anybody who disagrees should be seen as suspect.",,,,1238645772960165888,https://twitter.com/deathsnot/status/1238645772960165888
2020-03-14 01:46:27,CubedPoo,MJ_Leaver,0,0,1,"My doctor is so calm and level headed someone could be laying into the side of his head with a burning hatchet & he would just be explaining the contributing causal factors & possible epidemiological outcomes while prescribing the attacker some seroquel.... he’s a fuckin G.",,,,1238642617815977984,https://twitter.com/CubedPoo/status/1238642617815977984
2020-03-14 01:28:13,bridrawsthings,,0,0,0,"My psychiatrist is gonna hate me even more when i try to once again bring up the fact that i'm STILL having insomnia on Seroquel. This shit is awful",,,,1238638030568726528,https://twitter.com/bridrawsthings/status/1238638030568726528
2020-03-14 00:51:52,deathsnot,xolayyloni,1,0,1,"bless ur mom for that frfr, i hope u all have a better day today kween!",,,,1238628881713606657,https://twitter.com/deathsnot/status/1238628881713606657
2020-03-14 00:50:46,Addictivist,Inspire1daily,0,0,0,"Pretty much my story. Opioids + Benzos + AD + Seroquel. Standard formula it seems, for a time. I was injured falling. Finally started dropping meds on my own. Got better. Got worse. Inventory it, sort it. Try again. Got better. Me better long time now.",,,,1238628606013853697,https://twitter.com/Addictivist/status/1238628606013853697
2020-03-14 00:41:47,Mattheewww_exe,,0,0,0,"My sleep deprived ass just fell asleep while cooking hot chicken wings, almost died now my house is stinky poopoo. Don't take your Seroquel while cooking I guess #FridayThe13th",,,#FridayThe13th,1238626343635607553,https://twitter.com/Mattheewww_exe/status/1238626343635607553
2020-03-14 00:28:50,BipolarGay,AmyRemeikis,1,0,1,"Valium and scotch, seroquel and lithium tends to work for me.",,,,1238623084657008640,https://twitter.com/BipolarGay/status/1238623084657008640
2020-03-14 00:21:10,abirdnamedxavi,,0,0,1,"i have never felt so blessed to be out of college than right now",,,,1238621156867026946,https://twitter.com/abirdnamedxavi/status/1238621156867026946
2020-03-14 00:20:27,abirdnamedxavi,RealisticViews,0,0,1,"chile",,,,1238620976138592257,https://twitter.com/abirdnamedxavi/status/1238620976138592257
2020-03-14 00:14:53,deathsnot,xolayyloni,1,0,1,"bro WHAT are u telling me she just didnt want any body else to be able to clean their kids????? out of line, 8 boxes is not necessary at all",,,,1238619574162997248,https://twitter.com/deathsnot/status/1238619574162997248
2020-03-14 00:13:50,realKatWalizer,MindyMendelsoh1,0,0,0,"Seroquel? Was he on that before he had surgery?",,,,1238619311440162816,https://twitter.com/realKatWalizer/status/1238619311440162816
2020-03-14 00:10:18,deathsnot,xolayyloni,1,0,1,"omggg that is so fucking ridiculous!!!!! people without kids need to stop trying to stock up on shit they dont really need, im glad ur moms down for u like that bc that hyna was tripping!!",,,,1238618422037995521,https://twitter.com/deathsnot/status/1238618422037995521
2020-03-13 23:26:15,VSquirrel2,,0,0,0," Seroquel ,&amp; more trump - &amp; he's. Delusional supporters got me. About 2 nut. TF up",,,,1238607334747897857,https://twitter.com/VSquirrel2/status/1238607334747897857
2020-03-13 23:23:24,semirose,,1,0,2,"I was kinda joking about going home and taking some Seroquel to knock out for 12-18 hours but idk it feels like a good idea right now",,,,1238606615617474560,https://twitter.com/semirose/status/1238606615617474560
