date,username,to,replies,retweets,favorites,text,geo,mentions,hashtags,id,permalink
2019-02-19 13:16:55,yayameenk,antoniaeIla,0,0,0,"Halcion (triazolam). All other sleep aids are dangerous or they are garbage. Melatonin can help a little. You have to be careful with the interactions between Halcion and other drugs. If you can't get it, you can try Passion Flower. It is an MAOI inhibitor.",,,,1097847499325358080,https://twitter.com/yayameenk/status/1097847499325358080
2019-02-17 02:41:11,dataandme,NuclearAnthro,2,0,7,"To my entire benzo team: alprazolam, clonazepam, triazolam, temazepam. Mirtazipine, your pharmacokinetics were weird af, and ya really packed on the pounds, but you also knocked me out when hypnotics proved futile... I'd run out of space just on night meds. ",,,,1096962736305700864,https://twitter.com/dataandme/status/1096962736305700864
2019-02-13 09:47:41,JakeJrciv,,0,0,1,"I need melatonin, NyQuil, Benadryl, Temazepam, Triazolam, and a damnass spinal adjustment holy shit.",,,,1095620517481119744,https://twitter.com/JakeJrciv/status/1095620517481119744
2019-02-12 06:35:01,andrew_yacht,,0,0,0,"I fill my life with triazolam.",,,,1095209641187917826,https://twitter.com/andrew_yacht/status/1095209641187917826
2019-02-11 13:31:40,spittysub,,0,0,0,"Insomnia often? — answer: triazolam ",,,,1094952106409234432,https://twitter.com/spittysub/status/1094952106409234432
2019-02-10 18:07:54,Klon4No,,0,0,0,"Although most benzodiazepines show up in standard urine tests, some don't. Alprazolam (Xanax), clonazepam (Klonopin), temazepam (Restoril), and triazolam (Halcion) may not be found in many of the common tests.",,,,1094659236351492096,https://twitter.com/Klon4No/status/1094659236351492096
2019-02-10 02:12:38,phDaljuaid,,1,0,0,"Triazolam intermittently instead of daily. MAOIs and SSRIs required washout periods of at least 2 weeks before the other type is administered. Fluoxetine should be discontinued at least 6 weeks before a MAOI is initiated.",,,,1094418837158666241,https://twitter.com/phDaljuaid/status/1094418837158666241
2019-02-08 12:35:08,andrew_yacht,,0,0,0,"I fill my emptiness with triazolam.",,,,1093850718228922370,https://twitter.com/andrew_yacht/status/1093850718228922370
2019-02-07 17:28:23,kavitababu,,0,0,0,"Discussing triazolam at tox conference. @umasstox HALCION MAKER SETTLES $21 MILLION SUIT",,@UMassTox,,1093562126864658432,https://twitter.com/kavitababu/status/1093562126864658432
2019-02-07 00:35:10,andrew_yacht,,0,0,0,"I fill my soul with triazolam.",,,,1093307142587760641,https://twitter.com/andrew_yacht/status/1093307142587760641
2019-02-06 06:34:52,andrew_yacht,,0,0,0,"I fill my soul with triazolam.",,,,1093035278263042049,https://twitter.com/andrew_yacht/status/1093035278263042049
2019-02-06 03:24:48,connerlayne,,0,0,5,"My mom told me I took a lot of pictures after the dentist but I couldn’t find them... because I SENT them to people. Here are a few gems. (I took 1mg of Triazolam, I was awake but don’t remember like 9:30am-12:00pm) ",,,,1092987445128384512,https://twitter.com/connerlayne/status/1092987445128384512
2019-02-04 17:26:46,Mrvn_Mrtn,Anne_mfc,0,0,1,"You can also ask if he'll give you a script for Halcion (triazolam), which is kind of like Xanax and lessens anxiety. You would have to get a paper script and take it to the pharmacy though because of the kind of drug it is",,,,1092474557414428674,https://twitter.com/Mrvn_Mrtn/status/1092474557414428674
2019-02-04 02:12:06,jflucke,,0,0,1,"And now we start the 4th quarter of the NFL Triazolam Bowl...",,,,1092244374145126401,https://twitter.com/jflucke/status/1092244374145126401
2019-02-03 03:23:24,thehojo,kaley8711,0,0,1,"Try a Eszopiclone, Ramelteon, Temazepam and Triazolam cocktail and check the score on Wednesday when you wake up.",,,,1091899928387993602,https://twitter.com/thehojo/status/1091899928387993602
2019-02-02 12:34:59,andrew_yacht,,0,0,0,"I fill my days with triazolam.",,,,1091676353383092224,https://twitter.com/andrew_yacht/status/1091676353383092224
2019-02-01 23:03:16,jen_hogue,,0,0,0,"i’ve been up and down like crazy for the last 3 hours even after a triazolam like wtf man",,,,1091472076626714629,https://twitter.com/jen_hogue/status/1091472076626714629
2019-01-31 15:34:32,jadedubya,allisoncloetta,1,0,0,"I wanna die. The triazolam isn’t even WORKING my ass is wide awake",,,,1090996763631198209,https://twitter.com/jadedubya/status/1090996763631198209
2019-01-29 12:34:59,andrew_yacht,,0,0,0,"I fill my emptiness with triazolam.",,,,1090226802612670469,https://twitter.com/andrew_yacht/status/1090226802612670469
2019-01-27 22:26:55,greylox1,notcapnamerica,0,0,0,"**Have you tried a low dose of triazolam? Very few side effects.",,,,1089650988837826560,https://twitter.com/greylox1/status/1089650988837826560
2019-01-24 15:35:26,andrew_yacht,,0,0,0,"I fill my emptiness with triazolam.",,,,1088460271838842880,https://twitter.com/andrew_yacht/status/1088460271838842880
2019-01-23 06:35:13,andrew_yacht,,0,0,0,"I fill my brain with triazolam.",,,,1087961936149573638,https://twitter.com/andrew_yacht/status/1087961936149573638
2019-01-22 08:18:30,Markets_Reports,,0,0,0,"Global Triazolam Market Research Report 2018 https://www.marketsandreports.com/product/global-triazolam-market-research-report-2018/",,,,1087625541941903361,https://twitter.com/Markets_Reports/status/1087625541941903361
2019-01-21 21:35:07,andrew_yacht,,0,0,0,"I fill my life with triazolam.",,,,1087463627404259330,https://twitter.com/andrew_yacht/status/1087463627404259330
2019-01-21 17:14:02,amanikajal,MegaAngelKajal,0,0,4," Halcion® (triazolam) daily ni8 ki oka tablet vesko it helps to treat your severe insomnia",,,,1087397923631984640,https://twitter.com/amanikajal/status/1087397923631984640
2019-01-20 16:30:13,alexieslatta13,,0,0,0,"I think I'll go give her some help, Captain I think this is geology, not malevolenc joy powder oxycontin triazolam IMP-INU-PRF-1901201631",,,,1087024510635696128,https://twitter.com/alexieslatta13/status/1087024510635696128
2019-01-20 12:35:07,andrew_yacht,,0,0,0,"I fill my life with triazolam.",,,,1086965344521109504,https://twitter.com/andrew_yacht/status/1086965344521109504
2019-01-19 18:35:00,andrew_yacht,,0,0,0,"I fill my brain with triazolam.",,,,1086693525574639616,https://twitter.com/andrew_yacht/status/1086693525574639616
2019-01-19 15:22:51,itsjoethesecond,,0,0,0,"triazolam is amazing and I need more of that.",,,,1086645167933833216,https://twitter.com/itsjoethesecond/status/1086645167933833216
2019-01-13 21:34:52,andrew_yacht,,0,0,0,"I fill my soul with triazolam.",,,,1084564461732671488,https://twitter.com/andrew_yacht/status/1084564461732671488
2019-01-13 09:33:26,PotGodStatus,,0,0,0,"Ambien didn’t work, Triazolam didn’t work. Fuck it, I’ll just keep drinking",,,,1084382906053730307,https://twitter.com/PotGodStatus/status/1084382906053730307
2019-01-12 02:32:53,ladalavara,r_graus,0,0,1,"He seems to be in a perpetual state of panic. His dealer is stilll trying to balance the Adderal and the Triazolam.",,,,1083914682706980864,https://twitter.com/ladalavara/status/1083914682706980864
2019-01-09 20:38:13,FruitNames,,0,0,0,"walnut? Oh, you mean meteorologic triazolam butternut",,,,1083100655198367745,https://twitter.com/FruitNames/status/1083100655198367745
2019-01-09 09:50:28,SenseiTrailex,CashflowThoreau,0,0,0,"Triazolam it’s the traders sleeping peel. My doctor prescribed to me lol",,,,1082937643757981696,https://twitter.com/SenseiTrailex/status/1082937643757981696
2019-01-08 21:18:20,GrumpyXian,,1,0,0,"I actually don't think I need the triazolam for most procedures any more. But I still like to have headphones in because I hate the sound of scraping or drilling inside my own head. So it's less about anxiety, more about misophonia these days.",,,,1082748360581238784,https://twitter.com/GrumpyXian/status/1082748360581238784
2019-01-08 21:00:14,brittanytwitch,brittanytwitch,1,0,0,"The triazolam reacted with the antibiotics I was on and I went bananas. They kicked me out of the office. I remember vomiting out of the car while my mom drove me to the ER, and pleading with her to drive the car off a bridge we were crossing so it could just be over (3/X)",,,,1082743805965623296,https://twitter.com/brittanytwitch/status/1082743805965623296
2019-01-08 20:56:04,brittanytwitch,brittanytwitch,1,0,0,"I’m allergic to penicillin so I was on some other antibiotics for the infection. Insane throbbing pain on my left jaw, growing up towards my head and down through my neck. The endodontist gives me Triazolam to chill me out for the procedure (2/X)",,,,1082742756982718465,https://twitter.com/brittanytwitch/status/1082742756982718465
2019-01-08 05:30:13,alexieslatta,,0,0,0,"May I ask why, sir? Then I volunteer triazolam somatomax twakers How did you know about that? Ent SFC-INU-PRF-1901080531",,,,1082509758689566721,https://twitter.com/alexieslatta/status/1082509758689566721
2019-01-08 00:35:08,andrew_yacht,,0,0,0,"I fill my life with triazolam.",,,,1082435499971801093,https://twitter.com/andrew_yacht/status/1082435499971801093
2019-01-07 01:09:00,realblaines,,0,0,1,"I tried to watch ricegum's new video snitching on @h3h3productions for calling him a snitch in a video but i fell asleep. I know it's only 6 minutes long.. On the bright side, I cancelled my prescription for Triazolam",,@h3h3productions,,1082081635963527168,https://twitter.com/realblaines/status/1082081635963527168
2019-01-06 16:31:26,amerix,Asamoh_,0,1,1,"Triazolam 0.5mgs nocte for 1 week. That's my help. ",,,,1081951384512155648,https://twitter.com/amerix/status/1081951384512155648
2019-01-05 17:58:16,LidsRodney,melissamwoods_,1,0,2,"After a long trial of them putting me on seroquel or worse, I finally got a scrip for triazolam. *I LOVE THAT SHIT*. It doesn't make me high, and I don't wanna misuse it. But it will *CURE* my anxiety and destroy the brick wall that keeps me from sleep.",,,,1081610847535882240,https://twitter.com/LidsRodney/status/1081610847535882240
2019-01-05 17:21:50,CynicalAcerbic,,0,0,0,"Thank you Triazolam.",,,,1081601679995265024,https://twitter.com/CynicalAcerbic/status/1081601679995265024
2019-01-05 15:34:52,andrew_yacht,,0,0,0,"I fill my brain with triazolam.",,,,1081574759580819457,https://twitter.com/andrew_yacht/status/1081574759580819457
2019-01-04 08:28:20,mobola____,RoyalKenyah,1,0,3,"Is he Halcion(triazolam)?",,,,1081105031682818048,https://twitter.com/mobola____/status/1081105031682818048
2019-01-04 06:44:59,almejandrama,,0,0,0,"What does it feel like to be on triazolam? Well, it’s like being drunk, without the dizyness and the sloppyness.",,,,1081079022904197122,https://twitter.com/almejandrama/status/1081079022904197122
2019-01-03 19:47:31,IdahoLark,kgoak201,1,0,0,"I have my own stash of that for flying but I asked for something stronger. Guess I should have taken it (Triazolam) with wine...",,,,1080913568797577218,https://twitter.com/IdahoLark/status/1080913568797577218
2019-01-03 18:07:07,lemonlords,,0,0,0,"me not excited for surgery: only ready for the triazolam",,,,1080888301668716550,https://twitter.com/lemonlords/status/1080888301668716550
2018-12-31 21:34:56,andrew_yacht,,0,0,0,"I fill my life with triazolam.",,,,1079853437112729600,https://twitter.com/andrew_yacht/status/1079853437112729600
2018-12-31 03:34:49,andrew_yacht,,0,0,0,"I fill my brain with triazolam.",,,,1079581614013857792,https://twitter.com/andrew_yacht/status/1079581614013857792
2018-12-29 00:34:53,andrew_yacht,,0,0,0,"I fill my days with triazolam.",,,,1078811558812229632,https://twitter.com/andrew_yacht/status/1078811558812229632
2018-12-26 01:44:27,DaxxKhan,JSG_54,2,0,3,"That was some book I think only the brand name was taken off the market but the generic Triazolam is still available? In the UK neither version is available the UK took it off the market due to psychiatric reactions",,,,1077741900654936069,https://twitter.com/DaxxKhan/status/1077741900654936069
2018-12-22 18:34:38,andrew_yacht,,0,0,0,"I fill my emptiness with triazolam.",,,,1076546572131975168,https://twitter.com/andrew_yacht/status/1076546572131975168
2018-12-20 18:34:38,andrew_yacht,,0,0,0,"I fill my days with triazolam.",,,,1075821795545092097,https://twitter.com/andrew_yacht/status/1075821795545092097
2018-12-19 21:35:46,GrumpyXian,,0,0,0,"My dentist one gave me Valium to at use appointment's but decided that wasn't strong enough so now I take triazolam and look look like this at every appointment https://ift.tt/2R1cDxx",,,,1075504992629469186,https://twitter.com/GrumpyXian/status/1075504992629469186
2018-12-19 20:59:09,GrumpyXian,,0,0,0,"My dentist one gave me Valium to at use appointment's but decided that wasn't strong enough so now I take triazolam and look look like this at every… https://www.instagram.com/p/BrlUtMbB3FTbr-15oi3dTNm422_XtEjfbLmCCU0/?utm_source=ig_twitter_share&amp;igshid=1hs95nnu4ys82",,,,1075495776602730499,https://twitter.com/GrumpyXian/status/1075495776602730499
2018-12-19 16:27:34,LidsRodney,ChronicTami,1,0,1,"And I’m really suspicious that any doc would just prescribe Xanax like that, tho I suppose if you’re rich... I went through homelessness, psychosis & worse for months before I got a measly triazolam scrip- &amp; then only when I was stable on other meds &amp; still needed it prn",,,,1075427430230241282,https://twitter.com/LidsRodney/status/1075427430230241282
2018-12-18 11:10:58,BruceKelley1962,r_hyman01,0,0,2,"My wife had a lengthy full torso scan years back, she's claustrophobic. They gave her Halcion (Triazolam) and wow, she was out almost permanently. I'd like to get a bottle of those and sleep from 5pm Friday until 7pm Monday although being Type 2, I'd probably pee the bed lol.",,,,1074985365658841088,https://twitter.com/BruceKelley1962/status/1074985365658841088
2018-12-16 04:12:40,Chess_1967,Branch_Greg,1,0,1,"I've been following 666 people for some time now. For dental work, I have diazepam 10mg the night before and the morning of, oxy the morning of, and triazolam when I get to the office. That's sufficient, with the nitrous, to keep me from biting anyone.",,,,1074155322086809600,https://twitter.com/Chess_1967/status/1074155322086809600
2018-12-12 06:34:40,andrew_yacht,,0,1,1,"I fill my soul with triazolam.",,,,1072741509026332673,https://twitter.com/andrew_yacht/status/1072741509026332673
2018-12-12 06:13:16,mbarrymiddleton,,0,0,1,"Triazolam (sedation) - Now I love the dentist via /r/Dentistry Long story short: I used to be very afraid of the dentist (bad experiences). The worst thing is my gag reflex, triggered by the damn sucky thing. If you are frightened too, I cannot recommend oral sedation enou…",,,,1072736122290225153,https://twitter.com/mbarrymiddleton/status/1072736122290225153
2018-12-12 02:37:50,misskaminsk,fMRI_guy,2,0,1,"So, how do people on drugs that cause anterograde amnesia (like triazolam) compare to people on AEDs (like levitiracetam)?",,,,1072681905257103360,https://twitter.com/misskaminsk/status/1072681905257103360
2018-12-11 05:08:54,landshark5632,,0,0,0,"Triazolam a couple of nights in a row will do it ",,,,1072357534785257472,https://twitter.com/landshark5632/status/1072357534785257472
2018-12-09 06:34:43,andrew_yacht,,0,0,0,"I fill my soul with triazolam.",,,,1071654354342559749,https://twitter.com/andrew_yacht/status/1071654354342559749
2018-12-07 22:05:26,LordNikamma,,0,0,0,"Triazolam it contains",,,,1071163804359241729,https://twitter.com/LordNikamma/status/1071163804359241729
2018-12-06 04:56:23,CynicalAcerbic,,0,0,1,"Jam night's not so bad if you medicate! 4 IPAs (3 of them imperials), 2.5 doses of edible and 1 triazolam. That's about whatcha need.",,,,1070542444112965632,https://twitter.com/CynicalAcerbic/status/1070542444112965632
2018-12-05 05:08:07,dlindgrenmd,NatLauter,2,0,6,"ROTFL!!! Long time back, when I was having a bout of insomnia, a sr. resident gave me some samples of triazolam (Halcion). Seth told me I fell asleep, got up 30 min. later, made a sandwich, sat on the coffee table and ate it, then came back to bed. Didn't remember a bit of it.",,,,1070183012577361920,https://twitter.com/dlindgrenmd/status/1070183012577361920
2018-12-04 03:34:51,andrew_yacht,,0,0,0,"I fill my days with triazolam.",,,,1069797152103243776,https://twitter.com/andrew_yacht/status/1069797152103243776
2018-12-03 12:34:36,andrew_yacht,,0,0,0,"I fill my brain with triazolam.",,,,1069570598320267264,https://twitter.com/andrew_yacht/status/1069570598320267264
2018-11-29 16:23:35,VirtuteStreams,,0,2,5,"8PM GMT Tonight. @BrittnutButter and I are going to be streaming Yoshi's Wooly World. We're gonna sneak onto that private Island, give the guard Poochy some triazolam and take back what's rightfully ours on ",,@BrittnutButter,,1068178670462869506,https://twitter.com/VirtuteStreams/status/1068178670462869506
2018-11-28 18:34:47,andrew_yacht,,0,0,0,"I fill my soul with triazolam.",,,,1067849299395002370,https://twitter.com/andrew_yacht/status/1067849299395002370
2018-11-25 21:34:38,andrew_yacht,,0,0,0,"I fill my days with triazolam.",,,,1066807397904207874,https://twitter.com/andrew_yacht/status/1066807397904207874
2018-11-23 19:40:34,Garry42779,mrbtgal,1,0,1,"Diazepam - Valium Lorazepam - Ativan Triazolam - Halcyon Temazepam - Euhypnos Nitrazepam - Mogadon Midazolam - Hypnovel Flunitrazepam - Rohypnol @annmarie_crowe used to love our car share home from Crosshouse LOL",,@annmarie_crowe,,1066053914594824192,https://twitter.com/Garry42779/status/1066053914594824192
2018-11-23 09:34:46,andrew_yacht,,0,0,0,"I fill my life with triazolam.",,,,1065901460351868928,https://twitter.com/andrew_yacht/status/1065901460351868928
2018-11-23 08:19:16,DennisInOttawa,mitdasein,1,0,1,"Triazolam? Once banned in Britain... (Halcion)",,,,1065882459714269185,https://twitter.com/DennisInOttawa/status/1065882459714269185
2018-11-20 01:21:23,GHGalKS,,0,0,3,"Cycling over to lunesta, kinda want to have a drink, kinda want to take this last triazolam.. #whynotboth",,,#whynotboth,1064690133465776128,https://twitter.com/GHGalKS/status/1064690133465776128
2018-11-19 12:34:40,andrew_yacht,,0,0,0,"I fill my soul with triazolam.",,,,1064497183649656833,https://twitter.com/andrew_yacht/status/1064497183649656833
2018-11-18 09:51:14,GHGalKS,,0,0,3,"OK, fine. one last drink and then I'll do my two triazolam's. I drive a hard bargain with myself",,,,1064093666279608320,https://twitter.com/GHGalKS/status/1064093666279608320
2018-11-15 16:30:15,Mfletcha18,,0,0,0,"@alexieslatta No, but if Troi was right, we weren't far away from it.. cheap basing smoke a joint triazolam Not INP-INU-PRF-1811151635",,@alexieslatta,,1063106917726220288,https://twitter.com/Mfletcha18/status/1063106917726220288
2018-11-15 02:09:59,lynxvsjackalope,,0,0,1,"by this time tomorrow i'll be recovering from the dentist. here's hoping i don't call in and quit while doped up on triazolam lololol :'c",,,,1062890425281900544,https://twitter.com/lynxvsjackalope/status/1062890425281900544
2018-11-15 00:34:54,andrew_yacht,,0,0,0,"I fill my life with triazolam.",,,,1062866494739177472,https://twitter.com/andrew_yacht/status/1062866494739177472
2018-11-14 03:39:15,IrishLarper,FederalAgentMom,0,0,1,"Lorazepam Triazolam Temazepam Alprazolam Quazepam Flunitrazepam (can't get this in the US :( ) Clonazepam These are good",,,,1062550503454838784,https://twitter.com/IrishLarper/status/1062550503454838784
2018-11-14 03:23:22,IrishLarper,FBITrap,0,0,1,"I had my choice of anything I wanted but the temazepam always worked best. Triazolam pretty good too.",,,,1062546503464640512,https://twitter.com/IrishLarper/status/1062546503464640512
2018-11-11 15:42:52,HSIMDby2020,,1,0,0,"Ultrashort halflife hypnotics for good sleep without prolonging sleepiness/hangover: Triazolam, zaleplon, zolpidem, melatonin, ramelteon Do not use long hypnotics - respi failure!",,,,1061645443443023872,https://twitter.com/HSIMDby2020/status/1061645443443023872
2018-11-11 09:34:40,andrew_yacht,,0,0,0,"I fill my life with triazolam.",,,,1061552781356662784,https://twitter.com/andrew_yacht/status/1061552781356662784
2018-11-09 21:34:39,andrew_yacht,,0,0,0,"I fill my life with triazolam.",,,,1061009194000769024,https://twitter.com/andrew_yacht/status/1061009194000769024
2018-11-09 06:34:40,andrew_yacht,,0,0,0,"I fill my days with triazolam.",,,,1060782707834261504,https://twitter.com/andrew_yacht/status/1060782707834261504
2018-11-08 18:34:39,andrew_yacht,,0,0,0,"I fill my soul with triazolam.",,,,1060601508574703616,https://twitter.com/andrew_yacht/status/1060601508574703616
2018-11-08 09:34:39,andrew_yacht,,0,0,0,"I fill my brain with triazolam.",,,,1060465611774541826,https://twitter.com/andrew_yacht/status/1060465611774541826
2018-11-08 02:56:18,mbarrymiddleton,,0,0,0,"Drug combination freaking me out via /r/Dentistry I’m having a filling replacement (because it fell out a week prior to today) and a cavity filling tomorrow. My dentist is administering nitrous and Triazolam for me, combined, because I deal HORRIBLY with pain. Is this bad? …",,,,1060365367116210178,https://twitter.com/mbarrymiddleton/status/1060365367116210178
2018-11-07 15:34:46,andrew_yacht,,0,0,0,"I fill my soul with triazolam.",,,,1060193852886315009,https://twitter.com/andrew_yacht/status/1060193852886315009
2018-11-07 15:25:21,psychopharmacol,,0,0,0,"nested case–control study: Within 30 days use of midazolam led to dose dependent pneumonia risk in schizophrenia (aRR = 6.56, P triazolam (1.80) ",,,,1060191481443557381,https://twitter.com/psychopharmacol/status/1060191481443557381
2018-11-06 06:34:38,andrew_yacht,,0,0,0,"I fill my life with triazolam.",,,,1059695537073602562,https://twitter.com/andrew_yacht/status/1059695537073602562
2018-11-06 03:53:36,DEPRESSEDRMUCKY,,0,0,1,"I'm losing my mind due to sleep problems lately. I was recently offered Halcion (triazolam) for it but decided against it. I should have taken them ..",,,,1059655010512986112,https://twitter.com/DEPRESSEDRMUCKY/status/1059655010512986112
2018-11-04 02:47:23,GHGalKS,,1,0,1,"Like it's almost late night and the I took two triazolam's but they haven't fully kicked in yet me thinks:",,,,1058913570073784321,https://twitter.com/GHGalKS/status/1058913570073784321
2018-11-02 20:27:03,acakes421,A_Dillenbeck,0,0,0,"You missed out. Valium, Xanax, Ativan and triazolam. Good stuff, Maynard! —Took Valium before bed, the rest as preop combo. Then I got there and they gave me more pills &amp; nitrous.",,,,1058455469134671873,https://twitter.com/acakes421/status/1058455469134671873
2018-10-29 11:43:48,MasahiroBanno,,0,0,0,"The article, in which I participated as a co-author, has been published recently in Human Psychopharmacology: Clinical and Experimental https://onlinelibrary.wiley.com/doi/full/10.1002/hup.2678 https://rdcu.be/bag5G #NIRS #ramelteon #triazolam",,,#NIRS #ramelteon #triazolam,1056874237883899904,https://twitter.com/MasahiroBanno/status/1056874237883899904
2018-10-27 07:23:08,BehaviourPharma,,0,0,0,"The reinforcing, self-reported performance and physiological effects of Δ9-tetrahydrocannabinol, triazolam, hydromorphone, and methylphenidate in cannabis users http://dlvr.it/QpfkCc",,,,1056083860742537216,https://twitter.com/BehaviourPharma/status/1056083860742537216
2018-10-26 21:34:47,andrew_yacht,,0,0,0,"I fill my days with triazolam.",,,,1055935799999504385,https://twitter.com/andrew_yacht/status/1055935799999504385
2018-10-25 15:34:51,andrew_yacht,,0,0,0,"I fill my emptiness with triazolam.",,,,1055482833106558977,https://twitter.com/andrew_yacht/status/1055482833106558977
2018-10-25 15:33:19,SickAnimalBot,,0,0,0,"This chimpanzee needs Triazolam!",,,,1055482447129964544,https://twitter.com/SickAnimalBot/status/1055482447129964544
2018-10-25 11:29:38,Caferacer_Yoko,,1,0,0,"He gave me Triazolam too. ",,,,1055421122026455040,https://twitter.com/Caferacer_Yoko/status/1055421122026455040
2018-10-24 09:34:57,andrew_yacht,,0,0,0,"I fill my soul with triazolam.",,,,1055029871800451072,https://twitter.com/andrew_yacht/status/1055029871800451072
2018-10-21 01:36:07,alvaromns,,1,0,0,"welcome triazolam",,,,1053822206361382914,https://twitter.com/alvaromns/status/1053822206361382914
2018-10-20 12:57:13,haekawa,,0,0,0,"""It substitutes fully for the anxiolytic benzodiazepine chlordiazepoxide, but only partially substituted for the imidazopyridine hypnotic drug zolpidem and the benzodiazepine hypnotic triazolam"" / SL-651,498 https://en.wikipedia.org/wiki/SL-651,498",,,,1053631220930637824,https://twitter.com/haekawa/status/1053631220930637824
2018-10-19 06:29:03,GHGalKS,,0,0,3,"I could have gotten my Triazolam today, but I think I'm due a 90 day refill on the Zolpidem ER on the 22nd. I can hold out for that long. Also.. bought a locked pill case, lol. Part of trying to get back on track is having 90 days last 90 days.",,,,1053171148282888192,https://twitter.com/GHGalKS/status/1053171148282888192
2018-10-18 22:02:52,SickAnimalBot,,0,0,0,"This ocelot needs Triazolam!",,,,1053043764548304896,https://twitter.com/SickAnimalBot/status/1053043764548304896
2018-10-18 18:34:47,andrew_yacht,,0,0,0,"I fill my brain with triazolam.",,,,1052991398935445504,https://twitter.com/andrew_yacht/status/1052991398935445504
2018-10-14 21:34:25,andrew_yacht,,0,0,0,"I fill my life with triazolam.",,,,1051587054382043139,https://twitter.com/andrew_yacht/status/1051587054382043139
2018-10-08 17:09:40,Caferacer_Yoko,,1,0,0,"And Halcion (Triazolam) doesn't work at all.",,,,1049346100702797824,https://twitter.com/Caferacer_Yoko/status/1049346100702797824
2018-10-06 15:34:23,andrew_yacht,,0,0,0,"I fill my soul with triazolam.",,,,1048597345775112193,https://twitter.com/andrew_yacht/status/1048597345775112193
2018-10-06 06:34:27,andrew_yacht,,0,0,0,"I fill my emptiness with triazolam.",,,,1048461464095404032,https://twitter.com/andrew_yacht/status/1048461464095404032
