date,username,to,replies,retweets,favorites,text,geo,mentions,hashtags,id,permalink
2018-06-05 15:33:14,andrew_yacht,,0,0,0,"I fill my emptiness with triazolam.",,,,1004023347724869632,https://twitter.com/andrew_yacht/status/1004023347724869632
2018-06-05 00:33:14,andrew_yacht,,0,0,0,"I fill my soul with triazolam.",,,,1003796855967354881,https://twitter.com/andrew_yacht/status/1003796855967354881
2018-06-02 09:08:39,Asiyah_Dalhat,,2,1,1,"With the way am sleeping today,i think am gonna spend my day in bed today bcoz is like i have been injected with Triazolam ",,,,1002839401121140736,https://twitter.com/Asiyah_Dalhat/status/1002839401121140736
2018-05-31 15:52:49,Itz_Keri,,0,0,0,"Did all that stressing for nothing, he pulled it in about 5-7 minutes without any problems. That triazolam def. did what it was supposed to, had me super relaxed.",,,,1002216336540479488,https://twitter.com/Itz_Keri/status/1002216336540479488
2018-05-31 04:26:08,markjohnt2,markjohnt2,0,0,0,"Psychoactive drugs have tons. All of them I used to take Halcion, aka, triazolam. It's a dozy. Still have some clonazepam, kinda stout, too. The problem is body chemistry... were all unique.",,,,1002043528812232705,https://twitter.com/markjohnt2/status/1002043528812232705
2018-05-30 18:59:11,MissBeteNoire,,0,0,1,"I've been on Ambien, Zaleplon, Temazepam, Triazolam, to name a few. Do alcohol, meth, or cocaine excuse bad behavior? Why would Ambien? If you're a dumb twat or racist pile of shit on Ambien, I'm not sure why you think you seem different during the day when the drug's worn off. ",,,,1001900851126992897,https://twitter.com/MissBeteNoire/status/1001900851126992897
2018-05-30 17:30:30,kwame_teddy,,0,4,14,"(Triazolam + Temazepam) over dose of these drugs is the only solution for Hon Kennedy Agyapong on June 6 The intake ll make him wake up on 6 July 2018 #anasmoko",,,#anasmoko,1001878529880051713,https://twitter.com/kwame_teddy/status/1001878529880051713
2018-05-30 03:33:14,andrew_yacht,,0,0,0,"I fill my emptiness with triazolam.",,,,1001667824216141825,https://twitter.com/andrew_yacht/status/1001667824216141825
2018-05-27 03:33:11,andrew_yacht,,0,0,0,"I fill my soul with triazolam.",,,,1000580649231814657,https://twitter.com/andrew_yacht/status/1000580649231814657
2018-05-25 18:33:14,andrew_yacht,,0,0,0,"I fill my soul with triazolam.",,,,1000082380525223936,https://twitter.com/andrew_yacht/status/1000082380525223936
2018-05-22 20:53:02,heIIopapi,,0,0,0,"Brotizolam, midazolam, triazolam, loptazolam, lormetazepam, oxazepam, temazepam, nitrazepam, lorazepam or diazepam come and snatch my poor wig cuz I can't sleep .",,,,999030397278261249,https://twitter.com/heIIopapi/status/999030397278261249
2018-05-20 21:17:05,monosynth,,4,1,3,"there were drugs that ditched convention for some bullshit vaguely posi aspirational name (e.g., Halcion for triazolam or Prozac for fluoxetine) and I get that, but the current era is just like “god, I wish I could have named a pokémon” ",,,,998311672522551296,https://twitter.com/monosynth/status/998311672522551296
2018-05-19 18:33:14,andrew_yacht,,0,0,0,"I fill my brain with triazolam.",,,,997908054032166918,https://twitter.com/andrew_yacht/status/997908054032166918
2018-05-17 18:33:13,andrew_yacht,,0,0,0,"I fill my emptiness with triazolam.",,,,997183273938964480,https://twitter.com/andrew_yacht/status/997183273938964480
2018-05-16 01:29:08,lion_kiss_deer,,1,0,0,"#iVoteBTSBBMAs @BTS_twt Efavirenz triple bond reduce S/E of cocktail therapy contraindicated with midazolam, triazolam, ergot derivatives",,@BTS_twt,#iVoteBTSBBMAs,996563165277138944,https://twitter.com/lion_kiss_deer/status/996563165277138944
2018-05-15 18:47:04,CanadianKelli,,0,0,0,"Fucking relaxed slow cognition euphoria ... triazolam...I really feel like I could fly if I took these (&amp; had chaperone)",,,,996461983108022273,https://twitter.com/CanadianKelli/status/996461983108022273
2018-05-12 03:33:11,andrew_yacht,,0,0,0,"I fill my brain with triazolam.",,,,995144831889494017,https://twitter.com/andrew_yacht/status/995144831889494017
2018-05-08 20:55:23,HappyBaconDay,,1,0,0,"Notes (Sedatives): ***All S2 drugs BZD - short acting: Midazolam, Triazolam, Lorazepam - intermediate: Alprazolam - long: diazepam, flurazepam Barbs - ultra short: thiopental - short: secobarbital - long: phenobarbital",,,,993957559768776704,https://twitter.com/HappyBaconDay/status/993957559768776704
2018-05-06 21:19:52,villnlle,,0,0,1,"triazolam about to hit. gdnight gays and girls catch u on the flip side",,,,993238944153206785,https://twitter.com/villnlle/status/993238944153206785
2018-05-06 09:33:11,andrew_yacht,,0,0,0,"I fill my life with triazolam.",,,,993061101628772352,https://twitter.com/andrew_yacht/status/993061101628772352
2018-05-05 06:33:13,andrew_yacht,,0,0,0,"I fill my days with triazolam.",,,,992653425056903168,https://twitter.com/andrew_yacht/status/992653425056903168
2018-05-02 20:47:32,PharmaFactz,,4,200,401,"To remember short-acting benzodiazepines, think of the word ATOM: • Alprazolam • Triazolam • Oxazepam • Midazolam",,,,991781255422332928,https://twitter.com/PharmaFactz/status/991781255422332928
2018-05-01 00:33:11,andrew_yacht,,0,0,0,"I fill my emptiness with triazolam.",,,,991113265936773122,https://twitter.com/andrew_yacht/status/991113265936773122
2018-04-26 19:49:06,litescript,,0,0,2,"it’s ya boy, post dentist, tweeting on triazolam AMA",,,,989592222982062080,https://twitter.com/litescript/status/989592222982062080
2018-04-26 15:17:40,litescript,,1,0,0,"hopefully finish this root canal today. they gave me triazolam to take at the office before my appt this time to help with my anxiety. which is giving me anxiety, never used it for anything before.",,,,989523916992348160,https://twitter.com/litescript/status/989523916992348160
2018-04-26 09:18:20,BellaBeshoo,,0,3,2,"To remember short-acting benzodiazepines, think of the word ATOM: • Alprazolam • Triazolam • Oxazepam • Midazolam #مماطله_توظيف_الصيادله4",,,,989433485612941313,https://twitter.com/BellaBeshoo/status/989433485612941313
2018-04-25 01:21:51,web_rant,mkraju,6,8,40,"Alright everybody gather 'round The Candy Man is here What kind of candy do you want Sweet Ambien. Lunesta. Triazolam. Restoril. Zaleplon. Rozerem. Sonata Anything you want You've come to the right man 'Cause I'm the Candy Man ",,,,988951185242521601,https://twitter.com/web_rant/status/988951185242521601
2018-04-24 14:09:25,RawNene,,0,0,0,"I’m finna be on this triazolam lord ",,,,988781965146025984,https://twitter.com/RawNene/status/988781965146025984
2018-04-23 23:23:56,maybeeasian,RAVIOLIGOTH,0,0,1,"All you need is the triazolam and that's a living lobotomy",,,,988559125431795712,https://twitter.com/maybeeasian/status/988559125431795712
2018-04-23 05:27:27,alexieslatta13,Mfletcha18,0,0,0,"Beat You wouldn't believe the dreams I've been having.. mohasky triazolam horse tranq Data, how IMC-INU-PRF-1804230528",,,,988288219094499328,https://twitter.com/alexieslatta13/status/988288219094499328
2018-04-23 03:33:11,andrew_yacht,,0,0,0,"I fill my days with triazolam.",,,,988259463374229504,https://twitter.com/andrew_yacht/status/988259463374229504
2018-04-22 19:10:40,AToNCenter,,0,0,3,"There are three different classes of benzodiazepines: Short-acting – Triazolam, intermediate-acting – Alprazolam and long-acting – Diazepam. The use of Benzodiazepines for more than 3-6 weeks may lead to physical cravings and tolerance. https://www.atoncenter.com/benzodiazepines/ #substanceabuse",,,#substanceabuse,988133000679342080,https://twitter.com/AToNCenter/status/988133000679342080
2018-04-22 11:03:31,cruciolife,,0,1,2,"My best tweets come from Triazolam and clinical desperation",,,,988010405590061056,https://twitter.com/cruciolife/status/988010405590061056
2018-04-21 06:33:13,andrew_yacht,,0,0,0,"I fill my life with triazolam.",,,,987579995697631232,https://twitter.com/andrew_yacht/status/987579995697631232
2018-04-19 18:59:51,ffintervention,,0,2,2,"Learn about the impact, potential of addiction, and the withdrawal timeline for Triazolam and its brand name Halcion here http://qoo.ly/nsxna #FamiyFirstIntervention #AddictionHelp",,,#FamiyFirstIntervention #AddictionHelp,987043115621146625,https://twitter.com/ffintervention/status/987043115621146625
2018-04-17 08:31:54,SickAnimalBot,,0,0,0,"This finch needs Triazolam!",,,,986160308371820544,https://twitter.com/SickAnimalBot/status/986160308371820544
2018-04-17 00:28:16,Affygility,,0,0,0,"New OEL Fastrac monograph for Triazolam https://ift.tt/2H6n3nk #oelfastrac",,,#oelfastrac,986038601501872128,https://twitter.com/Affygility/status/986038601501872128
2018-04-16 17:55:10,FitKiwi,,1,0,2,"I missed last night's earthquake courtesy of triazolam. Must have knocked me out!",,,,985939672495828992,https://twitter.com/FitKiwi/status/985939672495828992
2018-04-14 14:11:44,pharmacovig,,1,0,0,"5/ Sedative/Hypnotics: triazolam, and orally administered midazolam Tyrosine kinase inhibitors: dasatinib, sunatinib Other drugs that are CYP3A substrates: disopyramide, quinine. #pharmacovigilance #druginteraction",,,#pharmacovigilance #druginteraction,985158667384311808,https://twitter.com/pharmacovig/status/985158667384311808
2018-04-14 06:10:30,slc_laurent,slc_laurent,1,0,0,"""Halcion, 125 micrograms."" she answered. Her head ducked. Hand groped into her purse, took out a small package of 0.125 milligrams dose triazolam tablets. A sign of ""ᴘʀᴇꜱᴄʀɪᴘᴛɪᴏɴ ᴏɴʟʏ"" firmly stamped on its label. Which definitely had been neglected for the time being.",,,,985037563063758848,https://twitter.com/slc_laurent/status/985037563063758848
2018-04-12 16:28:02,alexieslatta,,0,0,0,"Captain, I recommend we transfer all power to phasers, and arm the triazolam elephant tranquilizer pakistani black SFP-INU-PRF-1804121628",,,,984468193774153728,https://twitter.com/alexieslatta/status/984468193774153728
2018-04-11 19:08:40,mbarrymiddleton,,0,0,0,"Root canal in about two hours. Intense anxiety. What to expect? via /r/Dentistry I am also being perscribed Triazolam(sp?) to take before the appointment and this happens to be my first time experiencing major dental work. According to my paperwork, I am getting removal of…",,,,984146228740001792,https://twitter.com/mbarrymiddleton/status/984146228740001792
2018-04-11 01:48:28,SDDNP,harriekd,2,0,2,"At first I thought it was a typo: halcion (triazolam), a sedative-hypnotic for insomnia—it’s not prescribe much anymore—can be deadly",,,,983884455432482817,https://twitter.com/SDDNP/status/983884455432482817
2018-04-10 22:26:50,CanGovSciPubs,,0,0,0,"Effects of different doses of triazolam in the middle-of-the-night insomnia: a double-blind, randomized, parallel group study. http://dlvr.it/QP67sH",,,,983833713065705472,https://twitter.com/CanGovSciPubs/status/983833713065705472
2018-04-09 13:00:06,jlplanners,,0,0,0,"One small preliminary trial studying sleep quality compared the effect of a combination product containing an extract of lemon balm (Melissa officinalis) and an extract of valerian root with that of the sleeping drug triazolam... https://fieldandherbs.com/herb-lemon-balm/",,,,983328699780075520,https://twitter.com/jlplanners/status/983328699780075520
2018-04-09 02:51:50,SickAnimalBot,,0,0,0,"This snake needs Triazolam!",,,,983175628114550784,https://twitter.com/SickAnimalBot/status/983175628114550784
2018-04-07 18:33:14,andrew_yacht,,0,0,0,"I fill my soul with triazolam.",,,,982687760703283200,https://twitter.com/andrew_yacht/status/982687760703283200
2018-04-06 15:00:23,ChrisAikman2,,0,0,0,"Triazolam (Halcion and other brand names) is a fast-acting #benzodiazepine marketed in USA since 1982, but banned in UK since 1991 because of associated psychological side effects. http://articles.latimes.com/1991-10-03/news/mn-4409_1_halcion-sleeping-pill",,,#benzodiazepine,982271810082230272,https://twitter.com/ChrisAikman2/status/982271810082230272
2018-04-06 00:42:04,SickAnimalBot,,0,0,0,"This hyena needs Triazolam!",,,,982055805380890624,https://twitter.com/SickAnimalBot/status/982055805380890624
2018-04-04 21:35:02,addicthelp,,1,2,3,"Triazolam is used to help sedate dental surgery and also as a sleep aid for insomnia. https://www.addict-help.com/triazolam/ #triazolam,#benzo,#sleep",,,#triazolam #benzo #sleep,981646351212584960,https://twitter.com/addicthelp/status/981646351212584960
2018-04-04 00:33:11,andrew_yacht,,0,0,0,"I fill my days with triazolam.",,,,981328795159416832,https://twitter.com/andrew_yacht/status/981328795159416832
2018-04-03 20:06:22,outtadacrypt,,0,0,0,"https://soundcloud.com/outtadacrypt/triazolam Listen to ""Triazolam"" out now on my SoundCloud ! #producer #beatmaker #trap #cloudrap #lofi #vapor #instrumental #soundcloud",,,#producer #beatmaker #trap #cloudrap #lofi #vapor #instrumental #soundcloud,981261647267401730,https://twitter.com/outtadacrypt/status/981261647267401730
2018-04-01 21:32:32,PharmaFactz,,2,151,297,"To remember short-acting benzodiazepines, think of the word ATOM: • Alprazolam • Triazolam • Oxazepam • Midazolam",,,,980558556641538050,https://twitter.com/PharmaFactz/status/980558556641538050
2018-04-01 18:33:15,andrew_yacht,,0,0,0,"I fill my emptiness with triazolam.",,,,980513440430215168,https://twitter.com/andrew_yacht/status/980513440430215168
2018-03-31 05:28:53,realsaadkhan,__motato__,1,0,0,"Just 1 time,he gave me triazolam which made my condition even worse as I was addicted to it,after using it for 3 months left it forever.",,,,979953658036215808,https://twitter.com/realsaadkhan/status/979953658036215808
2018-03-30 12:33:17,andrew_yacht,,0,0,0,"I fill my soul with triazolam.",,,,979698074070257666,https://twitter.com/andrew_yacht/status/979698074070257666
2018-03-30 06:30:27,Keidras,,0,0,0,"Wisdom teeth extraction update: my dentist is pretty awesome (Thanks Jackie Munn!) Only took 30 minutes to pull all 4. No aesticia, just numbing agent and some hydrocone and triazolam. Stopped bleeding after a... https://www.facebook.com/steven.mccombs/posts/10101151858550190",,,,979606766068621313,https://twitter.com/Keidras/status/979606766068621313
2018-03-29 09:33:18,andrew_yacht,,0,0,0,"I fill my emptiness with triazolam.",,,,979290391408271361,https://twitter.com/andrew_yacht/status/979290391408271361
2018-03-28 05:54:01,rwbyluke,,0,0,0,"i take two halcyon/triazolam for my dentist appointments and i am still very well There and Conscious",,,,978872821001711616,https://twitter.com/rwbyluke/status/978872821001711616
2018-03-24 16:49:54,panduchowdary60,,0,4,3,"Probably sleepless night for Mahesh fans...Need of triazolam tabs!! THE SONG OF BHARAT TOMORROW",,,,977588328030601216,https://twitter.com/panduchowdary60/status/977588328030601216
2018-03-24 03:31:48,SickAnimalBot,,0,0,0,"This snake needs Triazolam!",,,,977387479899746304,https://twitter.com/SickAnimalBot/status/977387479899746304
2018-03-23 05:53:10,ThePinataTheory,,1,0,0,"I don't recall seeing ""may love everyone"", ""may sing show tunes"", or ""may channel your inner rockhound"" listed on the Possible Drug Side Effects blurb sheet for Triazolam. @RealScottWolter",,@RealScottWolter,,977060668607143936,https://twitter.com/ThePinataTheory/status/977060668607143936
2018-03-23 05:30:50,ThePinataTheory,,1,0,0,"My dental appointment today was... interesting. It was pain-free & I thought it went well. However, I took 2 Triazolam tablets (as prescribed &amp; directed for today). 1st time trying Triazolam. Not going to take it again. No anxiety or pain, but, on the down side... uh... ",,,,977055044364263426,https://twitter.com/ThePinataTheory/status/977055044364263426
2018-03-22 21:32:58,addicthelp,,0,1,4,"Halcion is prescribed primarily for the short-term treatment of insomnia. It is used in dentist's office to help patients relax. HALCION Tablets contain triazolam, a hypnotic agent. https://goo.gl/xani96 #drugs, #Halcion, #sleeping,",,,#drugs #Halcion #sleeping,976934786697641984,https://twitter.com/addicthelp/status/976934786697641984
2018-03-22 04:41:11,shimannchuu,that_N01_biatch,1,0,1,"From Google: Examples of Schedule IV substances include: alprazolam (Xanax),carisoprodol (Soma), clonazepam(Klonopin), clorazepate (Tranxene),diazepam (Valium), lorazepam(Ativan), midazolam (Versed),temazepam (Restoril), and triazolam(Halcion).",,,,976680164452003840,https://twitter.com/shimannchuu/status/976680164452003840
2018-03-18 12:33:28,andrew_yacht,,0,0,0,"I fill my life with triazolam.",,,,975349466566885376,https://twitter.com/andrew_yacht/status/975349466566885376
2018-03-16 18:33:17,andrew_yacht,,0,0,0,"I fill my soul with triazolam.",,,,974715242197520391,https://twitter.com/andrew_yacht/status/974715242197520391
2018-03-16 03:33:24,andrew_yacht,,0,0,1,"I fill my days with triazolam.",,,,974488778139193345,https://twitter.com/andrew_yacht/status/974488778139193345
2018-03-14 15:33:26,andrew_yacht,,0,0,1,"I fill my life with triazolam.",,,,973945205140357122,https://twitter.com/andrew_yacht/status/973945205140357122
2018-03-14 13:14:02,theactualfather,,1,0,0,"Doc gave me some shit called triazolam…it’s about to be litty",,,,973910124111671296,https://twitter.com/theactualfather/status/973910124111671296
2018-03-13 11:59:40,FruitNames,,0,0,0,"bing cherry? You mean disappointed triazolam oxheart!",,,,973529019776929792,https://twitter.com/FruitNames/status/973529019776929792
2018-03-13 03:33:16,andrew_yacht,,0,1,0,"I fill my days with triazolam.",,,,973401580887212033,https://twitter.com/andrew_yacht/status/973401580887212033
2018-03-12 16:31:21,mbarrymiddleton,,0,0,0,"anyone here take triazolam? via /r/Dentistry i've been prescribed two .25mg tablets. i know it affects people differently, but is there a ""most likely"" scenario i should be expecting in terms of being loopy and out of it? the info page that came with the pills said that som…",,,,973235005181788161,https://twitter.com/mbarrymiddleton/status/973235005181788161
2018-03-12 13:47:54,PharmaFactz,,1,147,296,"To remember short-acting benzodiazepines, think of the word ATOM: • Alprazolam • Triazolam • Oxazepam • Midazolam",,,,973193872250728448,https://twitter.com/PharmaFactz/status/973193872250728448
2018-03-11 14:46:02,ShouldBeInBed,freepearn,1,0,3,"Lorazepam and Triazolam are a good start. Might suggest Desvenlafaxine.",,,,972846112842309638,https://twitter.com/ShouldBeInBed/status/972846112842309638
2018-03-09 00:20:33,LaurenInPhilly,ChronicPainTeam,1,0,0,"I feel so much better if I get a nice sleep for 7-8 hours. My pain makes it difficult for me to fall asleep sometimes, so I will occasionally take triazolam. Its half life is only about 4 hours, so as long as I take it before 10pm it will be completely metabolized before I wake.",,,,971903529202933761,https://twitter.com/LaurenInPhilly/status/971903529202933761
2018-03-06 09:44:20,ReIgniteMD,LIRIK,0,0,0,"try white noise or any certain repetitive and cozy noise you like (for white noise, search for hair dryer/fan heater sounds etc, for cozy stuff you can check any combo of fireplace/snowstorm/rain etc sounds) or try low dose triazolam, but they don't work for half the users tho.",,,,970958249620099072,https://twitter.com/ReIgniteMD/status/970958249620099072
2018-03-03 00:33:11,andrew_yacht,,0,0,0,"I fill my emptiness with triazolam.",,,,969732383267328000,https://twitter.com/andrew_yacht/status/969732383267328000
2018-03-02 07:46:11,iamBullaN,modiabba,0,0,0,"Have you heard of Triazolam ",,,,969478964178714624,https://twitter.com/iamBullaN/status/969478964178714624
2018-03-01 05:52:59,thought_vendor,,0,1,1,"We could talk about cannabis or we could talk about alprazolam, lithium, dexmethylphenidate, dextroampehetamine, quetiapine, clonazepam, triazolam, thorazine, escitalopram, fluoxetine, sertraline....",,,,969088086582972416,https://twitter.com/thought_vendor/status/969088086582972416
2018-02-28 21:20:56,rwbyluke,,1,0,0,"triazolam would make me relax and like GOOD fine PLEASE ndjdjdn",,,,968959224318439425,https://twitter.com/rwbyluke/status/968959224318439425
2018-02-28 21:20:33,rwbyluke,,1,0,1,"im going to the dentist again which will probably mean more triazolam which is a big fuck yes",,,,968959128629587970,https://twitter.com/rwbyluke/status/968959128629587970
2018-02-27 09:33:12,andrew_yacht,,0,0,0,"I fill my emptiness with triazolam.",,,,968418729636913152,https://twitter.com/andrew_yacht/status/968418729636913152
2018-02-23 23:48:14,PharmaFactz,,1,425,864,"Benzodiazepine classification Short-acting (1-12 hour half-life) - Midazolam - Triazolam - Oxazepam Intermediate-acting (12-40 hour) - Alprazolam - Flunitrazepam - Clonazepam - Lorazepam - Nitrazepam - Temazepam Long-acting (40-250 hour) - Diazepam - Chlorazepate - Flurazepam",,,,967184355696275456,https://twitter.com/PharmaFactz/status/967184355696275456
2018-02-20 20:38:20,egirlabbacchio,,0,0,0,"i had to take some triazolam for a dentists appointment and now eveything feels like vaporwave",,,,966049400786219011,https://twitter.com/egirlabbacchio/status/966049400786219011
2018-02-20 15:33:30,andrew_yacht,,0,0,0,"I fill my emptiness with triazolam.",,,,965972687007907841,https://twitter.com/andrew_yacht/status/965972687007907841
2018-02-14 15:33:44,andrew_yacht,,0,0,0,"I fill my life with triazolam.",,,,963798420866719746,https://twitter.com/andrew_yacht/status/963798420866719746
2018-02-13 13:01:39,real_large,DrewTurner73,6,29,41,"22-year-old mentally ill man pops an ""unknown pill"" he bought online. - Also uses pipamperone, fluoxetine, queiapine, olanzapine, etizolam, pregabalin, lorazepam & triazolam. - Falls out a window, sleeps, chokes on vomit, dies. FDA says kratom killed him. #iamkratom",,,#iamkratom,963397760341995525,https://twitter.com/real_large/status/963397760341995525
2018-02-13 12:33:33,andrew_yacht,,0,0,0,"I fill my emptiness with triazolam.",,,,963390688908992514,https://twitter.com/andrew_yacht/status/963390688908992514
2018-02-13 09:33:36,andrew_yacht,,0,0,0,"I fill my brain with triazolam.",,,,963345403403034626,https://twitter.com/andrew_yacht/status/963345403403034626
2018-02-12 09:34:24,kayzeekat14,,0,0,0,"No sleep tonight.. took my triazolam about 9:30.... it ain’t workin...",,,,962983215635030016,https://twitter.com/kayzeekat14/status/962983215635030016
2018-02-11 23:07:53,geoffreylangham,DrSuperSalty,0,0,2,"These are very good comments. The low efficacy benzodiazepine triazolam definitely has a role in acute hyperactive delirium ",,,,962825548824166401,https://twitter.com/geoffreylangham/status/962825548824166401
2018-02-10 10:55:38,cruciolife,,0,0,0,"Triazolam? OxyContin? That missing sock to the pair?",,,,962278883553759232,https://twitter.com/cruciolife/status/962278883553759232
2018-02-07 12:33:37,andrew_yacht,,0,0,0,"I fill my life with triazolam.",,,,961216375644618756,https://twitter.com/andrew_yacht/status/961216375644618756
2018-02-06 04:28:37,rwbyluke,,0,0,1,"my dentist said that she was ""surprised"" that i was on two triazolam when we saw her (i was incredibly concious and could definitely recognize pain also i could walk and hold memory) which is like. The Story Of My Fucking Life",,,,960731936418353152,https://twitter.com/rwbyluke/status/960731936418353152
2018-02-06 01:27:40,rwbyluke,,2,0,1,"my dentist doesnt want to increase my triazolam and my mom thought i had a mobile distraction to bring (i dont) everything is :)))))",,,,960686395990913024,https://twitter.com/rwbyluke/status/960686395990913024
2018-02-05 17:05:26,Mfletcha18,,0,0,0,"He could have killed you He didn't triazolam poppers tranxene Alexilus Maybe the end begins with one boy putting HTG-INU-PRF-1802051705",,,,960560005421215744,https://twitter.com/Mfletcha18/status/960560005421215744
2018-02-05 15:33:34,andrew_yacht,,0,0,0,"I fill my soul with triazolam.",,,,960536886077984770,https://twitter.com/andrew_yacht/status/960536886077984770
2018-02-05 03:22:36,KarolineAnukhet,,0,0,0,"7:20am and it's time for question of the day. After #SuperBowlLII is it worth going to bed? Asking for a friend..... or a Triazolam",,,#SuperBowlLII,960352934239272970,https://twitter.com/KarolineAnukhet/status/960352934239272970
2018-02-02 21:33:45,andrew_yacht,,0,0,0,"I fill my brain with triazolam.",,,,959540368160317440,https://twitter.com/andrew_yacht/status/959540368160317440
2018-02-02 18:52:28,mackrosey,M2Nation,0,0,3,"I did this was after they gave me a triazolam so i was feelin a type of way *hair flip ",,,,959499779985195009,https://twitter.com/mackrosey/status/959499779985195009
2018-02-01 00:42:07,gxbbi01,tanamongeau,0,0,0,"I have really bad anxiety at the dentist. Now I ask them to prescribe me triazolam and it helps a lot! I definitely hallucinated the last time lol but it’s kinda like a sedative and you won’t remember after and it helps a ton with anxiety :)",,,,958862995664224257,https://twitter.com/gxbbi01/status/958862995664224257
2018-01-31 21:26:59,scc_pc,,0,1,3,"Benzodiazepine classification Short-acting(1-12 hour half-life) - Midazolam - Triazolam - Oxazepam Intermediate-acting (12-40 hour) - Alprazolam - Flunitrazepam - Clonazepam - Lorazepam - Nitrazepam - Temazepam Long-acting (40-250 hour) - Diazepam - Chlorazepate - Flurazepam",,,,958813887037665280,https://twitter.com/scc_pc/status/958813887037665280
2018-01-31 16:30:33,alexieslatta,,0,0,0,"Ahh.. Well, to be authentic I needed moose triazolam blow a fix/blow a shot benzidrine But, I couldn't find the s SFP-INU-PRF-1801311630",,,,958739287113056256,https://twitter.com/alexieslatta/status/958739287113056256
2018-01-29 03:25:36,rwbyluke,,1,0,1,"— 1. my mom after i took two triazolam because she didnt think i could walk lmfao",,,,957816975115411456,https://twitter.com/rwbyluke/status/957816975115411456
