date,username,to,replies,retweets,favorites,text,geo,mentions,hashtags,id,permalink
2018-11-16 16:49:26,adoreclau,aegonzalez1012,0,0,0,"Lurasidone once daily (>350 cal) Ziprasidone BID (&gt;500 cal)",,,,1063474132979986433,https://twitter.com/adoreclau/status/1063474132979986433
2018-11-16 03:59:58,TabithaH1M,,0,0,1,"One sure fire way of killing Karen's hoard of ugly kids is giving Dan Really for real Ziprasidone.",,,,1063280492097658880,https://twitter.com/TabithaH1M/status/1063280492097658880
2018-11-16 03:58:38,TabithaH1M,,0,0,1,"Lets see if Dan has ziprasidone how many Martha's die.",,,,1063280156356145152,https://twitter.com/TabithaH1M/status/1063280156356145152
2018-11-15 21:43:45,BipolarCorner,,0,0,1,"I added a video to a @YouTube playlist http://youtu.be/3L9srgQSOTU?a Geodon ( Ziprasidone ) Review And Side Effects",,@YouTube,,1063185814060974083,https://twitter.com/BipolarCorner/status/1063185814060974083
2018-11-14 03:54:22,drbotmd,,0,0,0,"Zipivafatoide (stimulant) Used recreationally as an antidepressant Developed in 1987 to replace ziprasidone",,,,1062554304677138433,https://twitter.com/drbotmd/status/1062554304677138433
2018-11-13 21:00:00,AACNme,,0,4,9,"Compared to placebo, neither haloperidol nor ziprasidone significantly changed the duration of #delirium in #patients with acute respiratory failure or shock. Consider the study results and share with your team. Read More: https://bit.ly/2OQ5gIE #Journal #AACN #ICU #CriticalCare",,,#delirium #patients #Journal #AACN #ICU #CriticalCare,1062450026612514816,https://twitter.com/AACNme/status/1062450026612514816
2018-11-13 04:54:05,drbotmd,,0,0,0,"Alepherlam (anti-infective) Treats the yugoslav symptoms of low inequity Decreases the activated effects of ziprasidone",,,,1062206948240773120,https://twitter.com/drbotmd/status/1062206948240773120
2018-11-12 14:25:15,HirstOfficial,,0,0,0,"Featured Art of the Day: ""Ziprasidone"". Buy it at: https://www.ArtPal.com/roberthirst?i=50107-75",,,,1061988295377330176,https://twitter.com/HirstOfficial/status/1061988295377330176
2018-11-11 12:17:17,aghoury79,,0,0,0,"Haloperidol, Ziprasidone Found Ineffective in Treating Patients With Delirium in the ICU ",,,,1061593706954842113,https://twitter.com/aghoury79/status/1061593706954842113
2018-11-09 14:48:55,PsychRecovery,,2,4,9,"""1/3 of those, randomly selected, were given haloperidol, another 1/3 got ziprasidone, and the final 1/3 got a placebo (saline). It didn't matter which the patients got, ultimately. By every measure, there were no significant differences in outcomes."" ",,,,1060907088572891138,https://twitter.com/PsychRecovery/status/1060907088572891138
2018-11-08 00:35:00,AACNme,,1,8,9,"Study Results: Compared to placebo, neither haloperidol nor ziprasidone significantly changes the duration of #delirium in #patients with acute #respiratory failure or shock. Keep the results in mind when considering treatment options. https://bit.ly/2OQ5gIE via @NEJM #AACN",,@NEJM,#delirium #patients #respiratory #AACN,1060329805936123904,https://twitter.com/AACNme/status/1060329805936123904
2018-11-07 20:00:21,MLMIC,,0,0,0,".@vumedicine study finds no significant difference in duration of delirium/coma among those on haloperidol or ziprasidone compared to placebo. Senior author says thousands are receiving ""unnecessary antipsychotics... bringing risk &amp; cost without benefit."" ",,@VUmedicine,,1060260689313492992,https://twitter.com/MLMIC/status/1060260689313492992
2018-11-07 18:00:05,DrDiegodelaVeg1,,0,0,0,"Great article: Haloperidol and Ziprasidone for Treatment of Delirium in Critical Illness. http://www.readbyqxmd.com/read/30346242 #ReadByQxMD",,,#ReadByQxMD,1060230424008495104,https://twitter.com/DrDiegodelaVeg1/status/1060230424008495104
2018-11-07 16:53:43,timothygirard,AndersPerner,1,1,4,"Agreed. The trial was not an equivalency trial and cannot prove that haloperidol and ziprasidone have absolutely no benefit. We can say that we found no evidence that these drugs have benefit.",,,,1060213718791925760,https://twitter.com/timothygirard/status/1060213718791925760
2018-11-06 11:49:43,nlantigua,,0,0,0,"Haloperidol and Ziprasidone for Treatment of Delirium in Critical Illness | NEJM https://www.nejm.org/doi/full/10.1056/NEJMoa1808217",,,,1059774829035995136,https://twitter.com/nlantigua/status/1059774829035995136
2018-11-04 19:19:14,FarMIC_SEFH,,0,0,3,"Haloperidol and Ziprasidone for Treatment of Delirium in Critical Illness | NEJM https://www.nejm.org/doi/full/10.1056/NEJMoa1808217#.W99GD4azYSs.twitter",,,,1059163176502263808,https://twitter.com/FarMIC_SEFH/status/1059163176502263808
2018-11-04 13:50:45,slpurvis,,1,0,1,"Interesting newly published delirium study by Timothy Gerard, Wes Ely, et al which concluded that ICU patients given Haloperidol or Ziprasidone demonstrated no significant improvements. #health #delirium #acutecare https://lnkd.in/e_RQYa3",,,#health #delirium #acutecare,1059080510335602688,https://twitter.com/slpurvis/status/1059080510335602688
2018-11-04 03:52:52,dominiccarney,,0,0,0,"The use of haloperidol or ziprasidone, as compared with placebo... in the ICU did not significantly alter the duration of delirium. https://www.ncbi.nlm.nih.gov/pubmed/30346242",,,,1058930048655183873,https://twitter.com/dominiccarney/status/1058930048655183873
2018-11-03 23:48:12,drbotmd,,0,0,0,"Oxyperitin (antithrombotic) Approved to treat flaky hi disorder and Sinatra's disease Contraindicated by ziprasidone",,,,1058868478839607296,https://twitter.com/drbotmd/status/1058868478839607296
2018-11-02 17:54:45,timothygirard,DrDaleNeedham,1,10,18,"When we were selecting an atypical to study as an IV treatment for @ICU_delirium during MIND-USA, we reviewed the existing safety data with the FDA, and they chose ziprasidone. #EDA2018",,@ICU_delirium,#EDA2018,1058417141215608832,https://twitter.com/timothygirard/status/1058417141215608832
2018-11-02 14:06:30,DrKarinNeufeld,,1,12,20,"#EDA2018 Tim Girard presents the MIND USA Study at EDA 2018- no significant difference in primary outcomes in a rigorous treatment trial of delirium comparing ziprasidone, haloperidol and placebo. ",,,#EDA2018,1058359698599092225,https://twitter.com/DrKarinNeufeld/status/1058359698599092225
2018-11-02 11:43:15,DrDaleNeedham,PharmDuprey,0,1,5,"Important info below for those wondering about use of ziprasidone in the recent MIND ICU RCT in NEJM first authored by @timothygirard #ICUrehab #EDA2018",,@timothygirard,#ICUrehab #EDA2018,1058323649273442304,https://twitter.com/DrDaleNeedham/status/1058323649273442304
2018-11-02 08:20:29,PharmDuprey,,0,2,6,"Ely: When MIND USA was being conceived, there were questions regarding the use of antipsychotics. Ziprasidone used in the study because it was the only atypical antipsychotic available in a clear liquid form with IV use data in humans #EDA2018",,,#EDA2018,1058272621048094720,https://twitter.com/PharmDuprey/status/1058272621048094720
2018-11-02 03:41:14,doctor_arun,,0,0,0,"Haloperidol and Ziprasidone for Treatment of Delirium in Critical Illness | NEJM https://www.nejm.org/doi/full/10.1056/NEJMoa1808217#.W9vHVpG-bG4.twitter",,,,1058202347309092865,https://twitter.com/doctor_arun/status/1058202347309092865
2018-11-02 00:47:36,drbotmd,,0,0,0,"Ropicaine (vitamin) Used recreationally for warning Developed in 1949 to replace ziprasidone",,,,1058158651075117057,https://twitter.com/drbotmd/status/1058158651075117057
2018-11-02 00:01:51,neil_orford,,0,1,1,"MIND-USA: haloperidol vs ziprasidone vs placebo, ICU patients with acute respiratory failure or shock, did not alter course of delirium...80% hypoactive delirium, 20% open-label antipsychotics. Can we really treat delirium with placebo? Patient experience? https://www.crit-iq.com/index.php/Journal_Club/Journals/2018/11/1392/Haloperidol-ziprasidone-delirium-psychosis-critical-intensive-ICU-agitation-ventilation",,,,1058147134745112576,https://twitter.com/neil_orford/status/1058147134745112576
2018-11-01 16:50:04,EMCCC2,,0,1,2,"Neither #haloperidol or #ziprasidone affect #delirium or #coma duration in adult medical or surgical #ICU patients with delirium vs. placebo. Most included patients had #hypoactive delirium (89%). #ABCDE bundle daily adherence was almost 90%. https://www.ncbi.nlm.nih.gov/pubmed/30346242",,,#haloperidol #ziprasidone #delirium #coma #ICU #hypoactive #ABCDE,1058038476057149440,https://twitter.com/EMCCC2/status/1058038476057149440
2018-11-01 01:49:42,JulianOwenEM_CC,,0,1,3,"Editorial: haloperidol and ziprasidone not helpful in ICU delirium ",,,,1057811891798597633,https://twitter.com/JulianOwenEM_CC/status/1057811891798597633
2018-10-31 23:10:40,SciSeekFeed,,0,0,0,"http://zpr.io/PqZKK Medical Research Interviews and News: Critical Illness: Haloperidol and Ziprasidone for Treatment of Delirium ",,,,1057771866398580738,https://twitter.com/SciSeekFeed/status/1057771866398580738
2018-10-31 22:47:19,Bill_Gardner,,1,2,1,"This was a surprise. ""The use of haloperidol or ziprasidone, as compared with placebo, in patients with acute respiratory failure or shock &amp;... delirium in the ICU did not significantly alter the duration of delirium. "" @nejm https://www.nejm.org/doi/full/10.1056/NEJMoa1808217",,@NEJM,,1057765993588486146,https://twitter.com/Bill_Gardner/status/1057765993588486146
2018-10-31 13:44:47,LukeDKimMD,,0,0,1,"Haloperidol and Ziprasidone for Treatment of Delirium in Critical Illness | NEJM https://www.nejm.org/doi/10.1056/NEJMoa1808217#.W9mxx_RiBps.twitter",,,,1057629459065528320,https://twitter.com/LukeDKimMD/status/1057629459065528320
2018-10-31 02:25:05,SandraWoodsMtl,,0,0,1,"Another example of why we still need folks trained in research ethics, #bioethics IRB allowed these to be administered to vulnerable agitated patients - without consent Ketamine, haloperidol, olanzapine, ziprasidone, midazolam https://www.statnews.com/2018/10/29/er-patients-given-ketamine-powerful-drugs-without-consent/?utm_source=STAT+Newsletters&amp;utm_campaign=56d4d18dfb-Daily_Recap&amp;utm_medium=email&amp;utm_term=0_8cab1d7961-56d4d18dfb-149508509 by @sxbegle @statnews",,@sxbegle @statnews,#bioethics,1057458407941255169,https://twitter.com/SandraWoodsMtl/status/1057458407941255169
2018-10-31 01:16:02,interneurona,NEJM,0,0,0,"#ICYMI 1, MIND-USA. : The use of haloperidol or ziprasidone, as compared with placebo, in patients with acute respiratory failure or shock and hypoactive or hyperactive delirium in the ICU did not significantly alter the duration of delirium ",,,#ICYMI,1057441028154761217,https://twitter.com/interneurona/status/1057441028154761217
2018-10-30 17:58:09,psychopharmacol,,0,0,2,"The use of haloperidol or ziprasidone, as compared with placebo, in patients with acute respiratory failure or shock and hypoactive or hyperactive delirium in the ICU did not significantly alter the duration of delirium ",,,,1057330834900992002,https://twitter.com/psychopharmacol/status/1057330834900992002
2018-10-30 16:05:25,ventilacionmeca,,0,7,9,"Haloperidol and Ziprasidone for Treatment of Delirium in Critical Illness | NEJM https://www.nejm.org/doi/full/10.1056/NEJMoa1808217#.W9iBJc1Ac_Y.twitter",,,,1057302463760474113,https://twitter.com/ventilacionmeca/status/1057302463760474113
2018-10-30 12:33:31,romiurrut,,1,0,0,"Haloperidol and Ziprasidone for Treatment of Delirium in Critical Illness | NEJM https://www.nejm.org/doi/full/10.1056/NEJMoa1808217#.W9hPjU_2cYw.twitter",,,,1057249135013912577,https://twitter.com/romiurrut/status/1057249135013912577
2018-10-29 19:30:08,MDEdgePsych,,0,3,6,"ICU Patients treated with #antipsychotics haloperidol and ziprasidone showed similar median days without delirium or coma, compared with those treated with placebo. #psychiatry Read more about the @NEJM study here:",,@NEJM,#antipsychotics #psychiatry,1056991592698011649,https://twitter.com/MDEdgePsych/status/1056991592698011649
2018-10-29 05:46:25,drbotmd,,0,0,0,"Lamopivagine (antibiotic) Used recreationally as a tetracyclic Contraindicated by ziprasidone",,,,1056784298395820038,https://twitter.com/drbotmd/status/1056784298395820038
2018-10-27 20:08:01,VUMChealth,,0,15,33,"Large new study finds that ICU patients do not benefit from 2 antipsychotic medications that have been used to treat delirium in #ICUs for 40+ years. Haloperidol, ziprasidone did not affect delirium, survival, length of stay or safety. http://spr.ly/6012D7vEQ",,,#ICUs,1056276349646790656,https://twitter.com/VUMChealth/status/1056276349646790656
2018-10-27 16:33:23,ResusOne,,0,0,1,"ICYMI: @NEJM paper on use of antipsychotic medications in ICU delirium - back to the drawing board? Haloperidol and Ziprasidone for Treatment of Delirium in Critical Illness https://www.nejm.org/doi/full/10.1056/NEJMoa1808217",,@NEJM,,1056222337312440320,https://twitter.com/ResusOne/status/1056222337312440320
2018-10-27 13:09:27,KTaylorMD,,1,2,6,"⁦@EmergencyDocs⁩ ⁦@ACEPNow⁩ - if using IM route for acute agitation Midazolam 5mg provided more rapid onset/more effective sedation than Haldol, Ziprasidone - olanzapine 10mg IM &gt; haldol https://www.annemergmed.com/article/S0196-0644(18)30373-1/fulltext",,@EmergencyDocs @ACEPNow,,1056171015825448965,https://twitter.com/KTaylorMD/status/1056171015825448965
2018-10-26 19:10:00,DrVes,,0,0,0,"NEJM continues its negative studies: Haloperidol and Ziprasidone for Treatment of Delirium in Critical Illness https://buff.ly/2CGAGdm - No difference from placebo",,,,1055899363782868992,https://twitter.com/DrVes/status/1055899363782868992
2018-10-26 08:39:05,DrEl,,0,1,1,"No effect on length of ICU delirium: Haloperidol and Ziprasidone for Treatment of Delirium in Critical Illness | NEJM https://www.nejm.org/doi/full/10.1056/NEJMoa1808217#.W9LSbaHvOvg.twitter",,,,1055740588853784576,https://twitter.com/DrEl/status/1055740588853784576
2018-10-26 07:15:39,drafabianalemos,,0,2,3,"Haloperidol and Ziprasidone for Treatment of Delirium in Critical Illness | NEJM https://www.nejm.org/doi/full/10.1056/NEJMoa1808217#.W9K_Fgmnikc.twitter",,,,1055719589265506304,https://twitter.com/drafabianalemos/status/1055719589265506304
2018-10-26 03:19:41,DrRPalmquist,,0,0,0,"Haloperidol and Ziprasidone for Treatment of Delirium in Critical Illness. - PubMed - NCBI No better than placebo. Now we know. https://www.ncbi.nlm.nih.gov/pubmed/30346242/",,,,1055660207584342016,https://twitter.com/DrRPalmquist/status/1055660207584342016
2018-10-26 01:04:16,drugnewsin,,0,0,0,"Neither Haloperidol, Ziprasidone Shortens Delirium in ICU - https://www.drugnews.in/2018/10/26/neither-haloperidol-ziprasidone-shortens-delirium-in-icu/",,,,1055626129770471429,https://twitter.com/drugnewsin/status/1055626129770471429
2018-10-26 01:03:18,Sandip_Thakrar,,0,0,0,"Haloperidol and ziprasidone for treatment of delirium in critical illness https://www.m3india.in/contents/journal/91046/haloperidol-and-ziprasidone-for-treatment-of?utm_campaign=f2j002z0&amp;utm_medium=share&amp;utm_source=ref_tw #m3india",,,#m3india,1055625888048521217,https://twitter.com/Sandip_Thakrar/status/1055625888048521217
2018-10-25 20:22:06,JesussCaballero,,0,1,1,"Haloperidol and Ziprasidone for Treatment of Delirium in Critical Illness | NEJM https://www.nejm.org/doi/full/10.1056/NEJMoa1808217",,,,1055555119411068928,https://twitter.com/JesussCaballero/status/1055555119411068928
2018-10-25 14:06:27,ventilacionmeca,,0,0,1,"In this large, double-blind, randomized, placebo-controlled trial, we found no evidence that the use of haloperidol (up to 20 mg daily) or ziprasidone (up 40 mg daily) had an effect on the duration of delirium among patients with acute respiratory failure or shock in the ICU.",,,,1055460582609035266,https://twitter.com/ventilacionmeca/status/1055460582609035266
2018-10-25 14:05:40,ventilacionmeca,,0,0,1,"Haloperidol and Ziprasidone for Treatment of Delirium in Critical Illness | NEJM https://www.nejm.org/doi/full/10.1056/NEJMoa1808217#.W9HNiFix0vk.twitter",,,,1055460388463144960,https://twitter.com/ventilacionmeca/status/1055460388463144960
2018-10-25 13:01:14,atscommunity,NEJM,0,1,5,"RT @NitinSeam: Important #CriticalCare trial published in @NEJM during #ESICM2018 @timothygirard &amp; MIND-USA team found no benefit of haldol or ziprasidone compared to placebo for treatment of hyper- or hypoactive #delirium",,@NitinSeam @NEJM @timothygirard,#CriticalCare #ESICM2018 #delirium,1055444172059148290,https://twitter.com/atscommunity/status/1055444172059148290
2018-10-25 12:56:41,LC_Analysis,,0,0,0,"Ultra‐performance liquid chromatography tandem mass spectrometry for the rapid, simultaneous analysis of ziprasidone and its impurities http://www.spectroscopynow.com/details/earlyview/10.1002/bmc.4384/Ultraperformance-liquid-chromatography-tandem-mass-spectrometry-for-the-rapid-si.html?tzcheck=1",,,,1055443025495764992,https://twitter.com/LC_Analysis/status/1055443025495764992
2018-10-25 09:48:09,caminalm,,0,1,0,"#Haloperidol and Ziprasidone for Treatment of Delirium in Critical Illness | NEJM https://www.nejm.org/doi/full/10.1056/NEJMoa1808217#.W9GRRmwlKnw.twitter",,,#Haloperidol,1055395581588324352,https://twitter.com/caminalm/status/1055395581588324352
2018-10-25 08:55:18,OCPhA_CA,,0,0,0,"Haloperidol and ziprasidone for treatment of delirium in critical illness https://ift.tt/2yyG0fX #pharmacist #pharmacy #health #healthcare",,,#pharmacist #pharmacy #health #healthcare,1055382279109918721,https://twitter.com/OCPhA_CA/status/1055382279109918721
2018-10-25 05:44:51,farmaciaclinico,,0,0,0,"Haloperidol and Ziprasidone for Treatment of Delirium in Critical Illness | NEJM https://www.nejm.org/doi/full/10.1056/NEJMoa1808217#.W9FYTL-VZ_o.twitter",,,,1055334353243381760,https://twitter.com/farmaciaclinico/status/1055334353243381760
2018-10-24 23:34:15,AlanaFlex,,1,5,10,"“The use of haloperidol or ziprasidone, as compared with placebo, in patients with acute respiratory failure or shock and hypoactive or hyperactive delirium in the ICU did not significantly alter the duration of delirium” ⁦@NEJM⁩ https://www.nejm.org/doi/full/10.1056/NEJMoa1808217",,@NEJM,,1055241088095506432,https://twitter.com/AlanaFlex/status/1055241088095506432
2018-10-24 19:43:09,austinaldenlam,,0,0,1,"""Haloperidol, Ziprasidone Found Ineffective in Treating Patients With Delirium in the ICU"" “Why did the trial fail to show benefit? It is likely that our concept of delirium is flawed"" http://alert.psychnews.org/2018/10/haloperidol-ziprasidone-found.html",,,,1055182929922613248,https://twitter.com/austinaldenlam/status/1055182929922613248
2018-10-24 14:28:10,AlysonMichener,,0,0,1,"Haloperidol and Ziprasidone did not decrease duration of delirium in the ICU according to large RCT published in @NEJM https://www.nejm.org/doi/full/10.1056/NEJMoa1808217",,@NEJM,,1055103663058894849,https://twitter.com/AlysonMichener/status/1055103663058894849
2018-10-24 14:14:15,LuisEChaparro4,,0,0,2,"Haloperidol and Ziprasidone for Treatment of Delirium in Critical Illness | NEJM https://www.nejm.org/doi/full/10.1056/NEJMoa1808217#.W9B-MxPKLWU.twitter",,,,1055100157526728704,https://twitter.com/LuisEChaparro4/status/1055100157526728704
2018-10-24 13:59:32,PsychiatricNews,,0,9,14,"Neither haloperidol nor ziprasidone, medications commonly used to treat #psychosis, had any benefit over placebo in treating patients for delirium in the intensive care unit. http://apapsy.ch/blg-delirium-icu #MentalHealth #Psychiatry",,,#psychosis #MentalHealth #Psychiatry,1055096455659220994,https://twitter.com/PsychiatricNews/status/1055096455659220994
2018-10-24 12:55:04,vito_fanelli,,0,0,0,"Haloperidol and Ziprasidone for Treatment of Delirium in Critical Illness | NEJM https://www.nejm.org/doi/full/10.1056/NEJMoa1808217",,,,1055080233030901761,https://twitter.com/vito_fanelli/status/1055080233030901761
2018-10-24 12:24:50,shantewhitehur6,,0,0,0,"If they can't prescribe me marijuana for my mental health issues shut the fuck up because im not taking prazosin or ziprasidone No damn more and i mean it",,,,1055072625964318721,https://twitter.com/shantewhitehur6/status/1055072625964318721
2018-10-24 09:29:00,KenSPope,,0,1,0,"Haloperidol, Ziprasidone Found Ineffective in Treating Patients With Delirium in the ICU: Double-Blind, Randomized, Placebo-Controlled Trial #delirium",,,#delirium,1055028374241005568,https://twitter.com/KenSPope/status/1055028374241005568
2018-10-24 05:58:45,EmergePharm,,0,0,1,"""Haloperidol and Ziprasidone for Treatment of Delirium in Critical Illness."" https://www.ncbi.nlm.nih.gov/pubmed/30346242?dopt=Abstract",,,,1054975464958242816,https://twitter.com/EmergePharm/status/1054975464958242816
2018-10-24 05:03:59,mtnhealthcare,,0,0,0,"Haloperidol and Ziprasidone for Treatment of Delirium in Critical Illness. https://goo.gl/fb/pYT4hF",,,,1054961682294935552,https://twitter.com/mtnhealthcare/status/1054961682294935552
2018-10-24 03:30:04,LeftOfCentrist,,0,0,0,"Haloperidol and Ziprasidone for Treatment of Delirium in Critical Illness | NEJM https://www.nejm.org/doi/full/10.1056/NEJMoa1808217",,,,1054938047563862016,https://twitter.com/LeftOfCentrist/status/1054938047563862016
2018-10-24 01:30:46,FibroFlutters,,0,0,0,"Haloperidol and Ziprasidone for Treatment of Delirium in Critical Illness | NEJM https://www.nejm.org/doi/full/10.1056/NEJMoa1808217#.W8_LQngWYWQ.twitter",,,,1054908022890344452,https://twitter.com/FibroFlutters/status/1054908022890344452
2018-10-24 01:30:37,scrufton73,,0,0,0,"Haloperidol and Ziprasidone for Treatment of Delirium in Critical Illness | NEJM https://www.nejm.org/doi/full/10.1056/NEJMoa1808217#.W8_LOe05HoY.twitter",,,,1054907983182868485,https://twitter.com/scrufton73/status/1054907983182868485
2018-10-24 01:10:51,AthenaNgoc,,0,0,0,"""In this large double-blind randomized trial, we found no evidence that the use of haloperidol or ziprasidone had an effect on the duration of delirium among patients with acute respiratory failure or shock in the ICU."" ",,,,1054903009682092032,https://twitter.com/AthenaNgoc/status/1054903009682092032
2018-10-24 00:42:42,NitinSeam,NEJM,0,1,9,"Important #CriticalCare trial published in @NEJM during #ESICM2018 @timothygirard &amp; MIND-USA team found no benefit of haldol or ziprasidone compared to placebo for treatment of hyper- or hypoactive #delirium",,@NEJM @timothygirard,#CriticalCare #ESICM2018 #delirium,1054895924714049537,https://twitter.com/NitinSeam/status/1054895924714049537
2018-10-23 23:50:11,LSinvani,torbati_ali,0,0,1,"The use of haloperidol or ziprasidone, as compared with placebo, in patients with acute respiratory failure or shock and hypoactive or hyperactive delirium in the ICU did not significantly alter the duration of #delirium.",,,#delirium,1054882710383157248,https://twitter.com/LSinvani/status/1054882710383157248
2018-10-23 23:05:45,wal_yas,,0,0,2,"Haloperidol and Ziprasidone for Treatment of Delirium in Critical Illness | NEJM https://www.nejm.org/doi/full/10.1056/NEJMoa1808217#.W8-pONzONKQ.twitter",,,,1054871530071457792,https://twitter.com/wal_yas/status/1054871530071457792
2018-10-23 21:37:01,MDavidKurlandDr,,0,0,0,"Haloperidol, Ziprasidone Found Ineffective in Treating Patients With Delirium in the ICU ",,,,1054849198615449600,https://twitter.com/MDavidKurlandDr/status/1054849198615449600
2018-10-23 21:27:38,_mamoon_,,0,0,0,"Haloperidol and Ziprasidone for Treatment of Delirium in Critical Illness | NEJM #icu More evidence to manage icu delrium non pharmacologically. https://lnkd.in/dywZPaH",,,#icu,1054846837730013184,https://twitter.com/_mamoon_/status/1054846837730013184
2018-10-23 20:38:17,aghoury79,,0,0,0,"Haloperidol, Ziprasidone Found Ineffective in Treating Patients With Delirium in the ICU http://bit.ly/2OJZXL6",,,,1054834416537747456,https://twitter.com/aghoury79/status/1054834416537747456
2018-10-23 20:13:20,meera_agar,,0,1,3,"MIND-USA results are out - Haloperidol and Ziprasidone for Treatment of Delirium in Critical Illness | NEJM ⁦@ANZDA_delirium⁩ ⁦@ANZSPM⁩ ⁦@palliverse⁩ https://www.nejm.org/doi/full/10.1056/NEJMoa1808217",,@ANZDA_delirium @ANZSPM @palliverse,,1054828137261879296,https://twitter.com/meera_agar/status/1054828137261879296
2018-10-23 17:52:26,Aboudeenamik,,0,0,0,"Haloperidol and Ziprasidone for Treatment of Delirium in Critical Illness | NEJM https://www.nejm.org/doi/full/10.1056/NEJMoa1808217",,,,1054792680314716160,https://twitter.com/Aboudeenamik/status/1054792680314716160
2018-10-23 16:50:01,VUMChealth,,0,0,0,"Large new study finds that ICU patients do not benefit from 2 antipsychotic medications that have been used to treat delirium in #ICUs for 40+ years. Haloperidol, ziprasidone did not affect delirium, survival, length of stay or safety. http://spr.ly/6013D7vEl",,,#ICUs,1054776970188410882,https://twitter.com/VUMChealth/status/1054776970188410882
2018-10-23 15:14:17,drjohnmorley,,0,0,0,"Haloperidol and Ziprasidone for Treatment of Delirium in Critical Illness | NEJM https://www.nejm.org/doi/full/10.1056/NEJMoa1808217#.W886x3c3z0N.twitter",,,,1054752878009741312,https://twitter.com/drjohnmorley/status/1054752878009741312
2018-10-23 15:12:58,dtmaust,,2,2,7,"In today's edition of things I learned in residency that are not true, thanks to @timothygirard: Haloperidol and Ziprasidone for Treatment of Delirium in Critical Illness https://www.nejm.org/doi/full/10.1056/NEJMoa1808217#.W885etXm3Uw.twitter",,@timothygirard,,1054752549503467521,https://twitter.com/dtmaust/status/1054752549503467521
2018-10-23 15:08:19,narindergrewal,,0,0,0,"Haloperidol and Ziprasidone Ineffective for Treatment of Delirium in the ICU #NEJM https://www.nejm.org/doi/full/10.1056/NEJMoa1808217#.W884_FWmmgw.twitter",,,#NEJM,1054751377539379206,https://twitter.com/narindergrewal/status/1054751377539379206
2018-10-23 15:07:31,anesthesianews,,0,3,5,"Haloperidol and Ziprasidone Ineffective for Treatment of Delirium in the ICU #NEJM https://www.nejm.org/doi/full/10.1056/NEJMoa1808217#.W884_FWmmgw.twitter",,,#NEJM,1054751176493805568,https://twitter.com/anesthesianews/status/1054751176493805568
