date,username,to,replies,retweets,favorites,text,geo,mentions,hashtags,id,permalink
2019-06-01 11:41:17,Kaelyrhn,,1,0,1,"ziprasidone can take up to two weeks to take effect, I could be in here that long, or longer... The psych said they want to reassess my diagnoses to make sure that I'm treated correctly, which could take a while on its own, let alone if my diagnoses change! *big sigh*",,,,1134786996629458944,https://twitter.com/Kaelyrhn/status/1134786996629458944
2019-05-30 18:39:18,pharmpearls,,1,1,6,"Ziprasidone is a second-generation antipsychotic that can cause dose-related prolongation of the QT interval For this reason - it’s C/I in patients with a known hx of QT prolongation, recent acute MI, or uncompensated failure",,,,1134167417561763840,https://twitter.com/pharmpearls/status/1134167417561763840
2019-05-29 16:51:44,candleknights,,1,0,0,"anybody know anything about geodon (ziprasidone) ??",,,,1133777956403204096,https://twitter.com/candleknights/status/1133777956403204096
2019-05-27 23:41:31,deacondee01,BrianCMulloy76,0,0,0,"Ziprasidone can help you with that.",,,,1133156307438116864,https://twitter.com/deacondee01/status/1133156307438116864
2019-05-26 23:27:21,CheiraBoa,,0,0,0,"(2019-2024) Worldwide Ziprasidone Hydrochloride Market Report – Market Size| Share| Price ... http://snip.ly/839wh3 #growthhacking #growth",,,#growthhacking #growth,1132790356779651081,https://twitter.com/CheiraBoa/status/1132790356779651081
2019-05-24 22:03:21,mikeandike9990,,0,0,0,"Im so sorry to hear. Im on ziprasidone and citalopram and trying move forward. I can relate tho.",,,,1132044440321835009,https://twitter.com/mikeandike9990/status/1132044440321835009
2019-05-23 13:30:33,TSAPhysicians,,0,0,0,"Haloperidol, Ziprasidone Ineffective For Delirium in Critical Illness. http://ow.ly/8FLp50umRC2",,,,1131553003419443200,https://twitter.com/TSAPhysicians/status/1131553003419443200
2019-05-22 14:58:54,narindergrewal,,0,0,0,"Two antipsychotic medications often used to treat delirium in the ICU, haloperidol and ziprasidone, do not significantly alter the duration of the disturbance VanderbiltU MayoClinic ",,,,1131212845855707136,https://twitter.com/narindergrewal/status/1131212845855707136
2019-05-22 14:53:12,anesthesianews,,0,3,6,"Two antipsychotic medications often used to treat delirium in the ICU, haloperidol and ziprasidone, do not significantly alter the duration of the disturbance @VanderbiltU @MayoClinic https://www.anesthesiologynews.com/Clinical-Anesthesiology/Article/05-19/Haloperidol-Ziprasidone-Ineffective-For-Delirium-in-Critical-Illness/54915",,@VanderbiltU @MayoClinic,,1131211415392522241,https://twitter.com/anesthesianews/status/1131211415392522241
2019-05-21 18:24:05,mind_aint_right,,2,0,4,"So I am staying at the same dose of duloxetine, but adding Wellbutrin, and we are going down to only once a day on ziprasidone and eventually probably going to get off it completely. I feel good about it. I’m also on topiramate for anxiety.",,,,1130902097388548096,https://twitter.com/mind_aint_right/status/1130902097388548096
2019-05-21 16:02:12,narindergrewal,,0,0,0,"Haloperidol and Ziprasidone Found Ineffective For Delirium in Critical Illness VanderbiltU MayoClinic https://www.anesthesiologynews.com/Clinical-Anesthesiology/Article/05-19/Haloperidol-Ziprasidone-Ineffective-For-Delirium-in-Critical-Illness/54915",,,,1130866388745297920,https://twitter.com/narindergrewal/status/1130866388745297920
2019-05-21 16:00:47,anesthesianews,,0,2,3,"Haloperidol and Ziprasidone Found Ineffective For Delirium in Critical Illness @VanderbiltU @MayoClinic https://www.anesthesiologynews.com/Clinical-Anesthesiology/Article/05-19/Haloperidol-Ziprasidone-Ineffective-For-Delirium-in-Critical-Illness/54915",,@VanderbiltU @MayoClinic,,1130866035131920385,https://twitter.com/anesthesianews/status/1130866035131920385
2019-05-18 15:13:13,drbotmd,,0,0,0,"Levositamine (probiotic) Used with ziprasidone to treat overemotional harbinger syndrome May cause unoccupied feelings",,,,1129766897254305792,https://twitter.com/drbotmd/status/1129766897254305792
2019-05-18 01:13:02,drbotmd,,0,0,0,"Bulane (sedative) Cures William Tindale's disease Contraindicated by ziprasidone",,,,1129555459998965761,https://twitter.com/drbotmd/status/1129555459998965761
2019-05-15 04:12:09,drbotmd,,0,0,0,"Lilane (antithyroid) Treats the immotile symptoms of ziprasidone overdose May cause optical feelings",,,,1128513373065363457,https://twitter.com/drbotmd/status/1128513373065363457
2019-05-14 12:45:21,tmarshallmph,drrickbarnett,0,0,0,"Yikes - giving a 3 year old quetiapine and ziprasidone?",,,,1128280135440822272,https://twitter.com/tmarshallmph/status/1128280135440822272
2019-05-13 06:27:58,angeleponco,,0,3,4,"ATYPICAL Weight gain (hyperglycemia and hyperlipidemia) Diabetes Mellitus Cardiac toxicity (Ziprasidone, Clozapine) Toxic/Allergic rxns Agranulocytosis (Clozapine) Safe for pregnancy (Luvasidone) Least sedation (Aripriprazole)",,,,1127822776989958145,https://twitter.com/angeleponco/status/1127822776989958145
2019-05-12 17:16:40,mikeandike9990,wack_a_noodle,0,0,1,"treated the psychotic episode with olanzapine initially so i gained a lot of weight. then onto ziprasidone which is weight neutral thank god... in remission fully. mostly no problems. i take meds and can't smoke weed. try to limit stress.",,,,1127623641393504258,https://twitter.com/mikeandike9990/status/1127623641393504258
2019-05-10 06:09:39,thinnandstoned,,0,0,0,"has anyone ever taken Geodon (ziprasidone) and did it make you dehydrated??? i literally cant drink enough water and my skin is even peeling bc its so dry like i always drink a ton of water but nothing is changing im just so. damn. thirsty.",,,,1126731002854821888,https://twitter.com/thinnandstoned/status/1126731002854821888
2019-05-09 21:02:30,drbotmd,,0,0,0,"Riscertin (antimigraine) Treats the septic symptoms of irritable radio syndrome Decreases the pampering effects of ziprasidone",,,,1126593309202370561,https://twitter.com/drbotmd/status/1126593309202370561
2019-05-08 18:02:08,drbotmd,,0,0,0,"Lioxypam (anti-inflammatory) Treats the flowerless symptoms of right-hand ballplayer disorder Decreases the immodest effects of ziprasidone",,,,1126185529702256640,https://twitter.com/drbotmd/status/1126185529702256640
2019-05-07 13:11:03,DeliriumPapers,,0,0,0,"Haloperidol and Ziprasidone for Treatment of Delirium in Critical Illness. http://dlvr.it/R4DN4N",,,,1125749887843295232,https://twitter.com/DeliriumPapers/status/1125749887843295232
2019-05-06 16:00:17,UpToDate,,1,4,6,"#ClinicalUpdates: In trial in ICU #patients with delirium, rx with haloperidol or ziprasidone did not decrease number of days with #delirium, compared with placebo http://bit.ly/13r50hI",,,#ClinicalUpdates #patients #delirium,1125430088466616321,https://twitter.com/UpToDate/status/1125430088466616321
2019-05-03 14:12:45,flipyourface,,0,0,1,"Ziprasidone, you are my best friend and I hate you",,,,1124315866240364549,https://twitter.com/flipyourface/status/1124315866240364549
2019-04-30 17:27:28,mind_aint_right,,1,0,0,"Plus I’m on an antipsychotic, which those usually cause weight gain, although I’m on ziprasidone which apparently is weight neutral my psychiatrist said. All I know is I’ve gained a shit ton of weight since I’ve been trying different meds for the last year and a half. It sucks.",,,,1123277703543697408,https://twitter.com/mind_aint_right/status/1123277703543697408
2019-04-29 20:03:56,ki_ki_graham,,0,0,0,"Anyone been prescribed geodon or ziprasidone? I have questions and I can't get ahold of my doctor. Feel free to inbox me.",,,,1122954692277915648,https://twitter.com/ki_ki_graham/status/1122954692277915648
2019-04-29 14:59:04,drbotmd,,0,0,0,"Estracerzexine (probiotic) Used recreationally for signing Decreases the pyaemic effects of ziprasidone",,,,1122877969498824705,https://twitter.com/drbotmd/status/1122877969498824705
2019-04-28 00:58:35,drbotmd,,0,0,0,"Aripiprapam (antiviral drug) Cures irritable hedonism syndrome Obsoleted by ziprasidone",,,,1122304065386446848,https://twitter.com/drbotmd/status/1122304065386446848
2019-04-27 05:21:44,BitterKolac,,0,0,0,"I support emailing doctors bc one of the toilet composed emails to my psych, entitled RANDO MED IDEA, changed my quality of life by 10 fold. I also support ziprasidone.",,,,1122007903844483073,https://twitter.com/BitterKolac/status/1122007903844483073
2019-04-25 22:31:05,SCCMSE,,0,1,2,"Q4. What is your experience using #haldol and #ziprasidone for #delirium? #SCCMSEChat",,,#haldol #ziprasidone #delirium #SCCMSEChat,1121542170601775110,https://twitter.com/SCCMSE/status/1121542170601775110
2019-04-25 21:57:56,drbotmd,,0,0,0,"Quetiacerfaxine (anaesthetic) Used with diazepam to treat Emmett Kelly's disease Decreases the left-of-center effects of ziprasidone",,,,1121533830345691136,https://twitter.com/drbotmd/status/1121533830345691136
2019-04-25 20:22:22,tyrone_squires,,0,0,0,"ZIPRASIDONE HCL 20MG x 60 CAPS: AAC = $19.99, AWP = $531.47 https://blog.transparentrx.com/2019/04/reference-pricing-gross-invoice-cost_25.html",,,,1121509778533101568,https://twitter.com/tyrone_squires/status/1121509778533101568
2019-04-24 11:57:26,drbotmd,,0,0,0,"Gabacitafin (antiulcer) Used with lamotrigine to treat boodle syndrome Obsoleted by ziprasidone",,,,1121020321828671488,https://twitter.com/drbotmd/status/1121020321828671488
2019-04-24 00:50:43,tranphillip89,,0,0,0,"I can finally stop questioning whether or not I have schizophrenia. All I can say is that I am grateful I have the medicine I need to function. I felt like a zombie, but the effects of ziprasidone began to help me think straight.",,,,1120852533616967680,https://twitter.com/tranphillip89/status/1120852533616967680
2019-04-22 17:56:52,drbotmd,,0,0,0,"Lidocerpam (tricyclic) Treats the water-soluble symptoms of ziprasidone overdose Often used off-label for Luvox overdose",,,,1120385999471894530,https://twitter.com/drbotmd/status/1120385999471894530
2019-04-21 19:56:36,drbotmd,,0,0,0,"Coperine (antianaemia) Prescribed for congenital hangnail disease Decreases the sixty-fourth effects of ziprasidone",,,,1120053740864720896,https://twitter.com/drbotmd/status/1120053740864720896
2019-04-21 04:43:59,AlertJantaINDIA,Retributions,0,0,0,"Typical antipsychotics used to treat hallucinations, and other psychotic symptoms include: risperidone aripiprazole olanzapine ziprasidone quetiapine pimavanserin clozapine See your GP straight away you're experiencing hallucinations Sir.",,,,1119824075772194816,https://twitter.com/AlertJantaINDIA/status/1119824075772194816
2019-04-20 21:06:37,elo_chan_,a_ngel_c_akes,2,0,0,"Okay so I got him some isperidone (Risperdal®), clozapine (Clozaril®), quetiapine (Seroquel®), ziprasidone (Geodon®), olanzapine (Zyprexa®), tranquilizers, antidepressants, vitamin B6, B12, folate, and some marijuana just in case. It cost me a shit ton of money though.",,,,1119708974767648769,https://twitter.com/elo_chan_/status/1119708974767648769
2019-04-19 07:15:23,seanhickey92,tommyeales,0,0,0,"Any reason why ziprasidone is mentioned and not olanzapine? What’s your agent of choice?",,,,1119137401924767744,https://twitter.com/seanhickey92/status/1119137401924767744
2019-04-18 06:55:22,drbotmd,,0,0,0,"Venzeepherlin (antiviral drug) Used with ziprasidone to treat hypoinsertism Often used off-label for oxytocin discontinuation syndrome",,,,1118769975878193157,https://twitter.com/drbotmd/status/1118769975878193157
2019-04-16 11:54:48,drbotmd,,0,0,0,"Levopivatin (contraceptive) Used to treat hypotagalongism Obsoleted by ziprasidone",,,,1118120556400918529,https://twitter.com/drbotmd/status/1118120556400918529
2019-04-16 10:55:14,ptmacdonald1,TulsiGabbard,0,0,0,"Tulsi you forgot your ziprasidone didn’t you?",,,,1118105565488660480,https://twitter.com/ptmacdonald1/status/1118105565488660480
2019-04-15 12:13:25,smith86n,,1,0,1,". Ziprasidone rebalances dopamine and serotonin to improve thinking, mood, and behavior.",,,,1117762851064754177,https://twitter.com/smith86n/status/1117762851064754177
2019-04-15 02:54:10,helsekh,EvilBobJ,0,0,7,"& lacking -Lithium -Clozapine -Sertraline -Paroxetine -Fluoxetine -Venlafaxine -Risperidone -Aripiprazole -Olanzapine -Ziprasidone -Quetiapine -Pimavanserin with an overdose of brainwashing from steeple building leaders talking about a book he hasnt read!",,,,1117622112087265280,https://twitter.com/helsekh/status/1117622112087265280
2019-04-14 16:20:42,VanessitaDeniz,,0,2,1,"No Reduction in Delirium with the Use of Haloperidol or Ziprasidone in Critically Ill Patients. https://www.qxmd.com/r/30932453",,,,1117462694574141440,https://twitter.com/VanessitaDeniz/status/1117462694574141440
2019-04-14 10:54:08,drbotmd,,0,0,0,"Flupivaine (antiandrogen) Prescribed for Woolley's disease Decreases the incognoscible effects of ziprasidone",,,,1117380512564301826,https://twitter.com/drbotmd/status/1117380512564301826
2019-04-10 03:14:11,OuijaParty,,0,0,0,"In life my doctor to die and bring ziprasidone.",,,,1115815211804573696,https://twitter.com/OuijaParty/status/1115815211804573696
2019-04-08 18:27:47,NoodleImperial,,1,0,3,"RANT TIME ABOUT DRUGS So there a drug for schizophrenia its called Ziprasidone i have no problem with it- it pops up i can write its chemical compound tell you some side effects and the max dose What i HATE is the brand name 1/2",,,,1115320347241402368,https://twitter.com/NoodleImperial/status/1115320347241402368
2019-04-08 02:52:01,drbotmd,,0,0,0,"Dupraline (anti-infective) Approved to treat severe oblique and Welbutrin overdose Decreases the nigh effects of ziprasidone",,,,1115084857187753984,https://twitter.com/drbotmd/status/1115084857187753984
2019-04-07 20:18:14,pratikadh,,0,0,1,"Haloperidol or ziprasidone was not effective in reducing the duration of deleriwm in patients with acute respiratory failure or shock and hypoactive or hyperactive delirium in the ICU! #UMKCRCT",,,#UMKCRCT,1114985757607960583,https://twitter.com/pratikadh/status/1114985757607960583
2019-04-06 22:51:37,drbotmd,,0,0,0,"Bustazzole (antiemetic) Prescribed for antiulcer overdose Decreases the gibelike effects of ziprasidone",,,,1114661971004207105,https://twitter.com/drbotmd/status/1114661971004207105
2019-04-05 19:32:35,HeWantsTheMD,,0,0,0,"QT prolongation resulting from use of an atypical antipsychotic (ziprasidone) (First Aid for the #USMLE Step 1 2018, p. 557) #LoveHowYouLearn #FlashFacts #USMLE #MedEd #FOAMed #HCSM",,,#USMLE #LoveHowYouLearn #FlashFacts #USMLE #MedEd #FOAMed #HCSM,1114249491778031616,https://twitter.com/HeWantsTheMD/status/1114249491778031616
2019-04-05 19:30:10,firstaidteam,,0,7,20,"QT prolongation resulting from use of an atypical antipsychotic (ziprasidone) (First Aid for the #USMLE Step 1 2018, p. 557) #LoveHowYouLearn #FlashFacts",,,#USMLE #LoveHowYouLearn #FlashFacts,1114248883025141761,https://twitter.com/firstaidteam/status/1114248883025141761
2019-04-05 15:32:41,HeWantsTheMD,,0,0,0,"A patient with schizophrenia who is taking ziprasidone has abnormal findings on an ECG. What abnormality do you see and why? #LoveHowYouLearn #FlashFacts #USMLE #MedEd #FOAMed #HCSM",,,#LoveHowYouLearn #FlashFacts #USMLE #MedEd #FOAMed #HCSM,1114189121763905536,https://twitter.com/HeWantsTheMD/status/1114189121763905536
2019-04-05 15:30:26,firstaidteam,,8,5,26,"A patient with schizophrenia who is taking ziprasidone has abnormal findings on an ECG. What abnormality do you see and why? #LoveHowYouLearn #FlashFacts",,,#LoveHowYouLearn #FlashFacts,1114188555658592257,https://twitter.com/firstaidteam/status/1114188555658592257
2019-04-05 12:51:08,drbotmd,,0,0,0,"Levolazole (anaesthetic) Treats the yellow-brown symptoms of sporty personality disorder Obsoleted by ziprasidone",,,,1114148465561538563,https://twitter.com/drbotmd/status/1114148465561538563
2019-04-02 14:59:47,DocCathart,gtconway3d,0,0,0,"Dump needs a mandatory psychiatric order for a 24/7 IV drip of ziprasidone, Lorazepam, and paroxetine. That would sufficiently calm him down plus reduce his delusional, disassociative, and hebephrenic psychosis Otherwise, this thug needs to be indicted &amp; prosecuted ASAP!",,,,1113093675792429061,https://twitter.com/DocCathart/status/1113093675792429061
2019-04-01 11:20:22,KomalGhare,,0,0,0,"Ziprasidone Market By Product Sales, Price, Revenue, Gross Margin, Share, Growth Rate and Forecasts 2026 https://thechemicalresearchreport.wordpress.com/2019/04/01/ziprasidone-market-by-product-sales-price-revenue-gross-margin-share-growth-rate-and-forecasts-2026/",,,,1112676071550451712,https://twitter.com/KomalGhare/status/1112676071550451712
2019-03-31 01:49:16,drbotmd,,0,0,0,"Gabaloxelam (antiepileptic) Used to treat Grace Ethel Cecile Rosalie Allen's disease Contraindicated by ziprasidone",,,,1112169959835226114,https://twitter.com/drbotmd/status/1112169959835226114
2019-03-27 22:48:14,drbotmd,,0,0,0,"Levolane (antiepileptic) Prescribed for antiarrhythmic overdose Decreases the plugged effects of ziprasidone",,,,1111037238601834496,https://twitter.com/drbotmd/status/1111037238601834496
2019-03-26 03:01:46,virenkaul,,2,1,10,"Coming to Rx: Antipsychotics don't seem to work (see slide) Early, tiny bit of data for using Dex (it's the new star!): DahLIA study MIND-USA (2018): no diff in delirium free days: Haldol vs ziprasidone vs placebo. H/T @timothygirard for nicely done study, sharing his insight!",,@timothygirard,,1110376266526609408,https://twitter.com/virenkaul/status/1110376266526609408
2019-03-25 21:14:41,LabPrestidge,,0,1,3,"Nanocrystal-silica-lipid hybrid particles for the improved oral delivery of ziprasidone in vitro. First author - PhD student Tahlia Meola https://www.sciencedirect.com/science/article/pii/S0939641118304053",,,,1110288920133066752,https://twitter.com/LabPrestidge/status/1110288920133066752
2019-03-24 21:47:14,drbotmd,,0,0,0,"Viacondone (psychedelic) Cures major terrible disorder Decreases the no-go effects of ziprasidone",,,,1109934724787695617,https://twitter.com/drbotmd/status/1109934724787695617
2019-03-24 03:47:02,drbotmd,,0,0,0,"Viapivaxine (hormone) Used with lithium to treat irritable dyssynergia syndrome Decreases the closemouthed effects of ziprasidone",,,,1109662882499829761,https://twitter.com/drbotmd/status/1109662882499829761
2019-03-21 17:37:28,KJPGehrden,HengartnerMP,1,0,1,"An old man turned ninety-eight He took ziprasidone and died the next day. Isn't it ironic Don't you think?",,,,1108784704784908293,https://twitter.com/KJPGehrden/status/1108784704784908293
2019-03-21 09:38:37,johnnaayyy_,,1,0,3,"Memorizing drug names which make no sense sometimes is AWFUL. Ziprasidone is generic for Geodon... how they come up with these drug names blows my mind",,,,1108664199209762817,https://twitter.com/johnnaayyy_/status/1108664199209762817
2019-03-21 04:45:58,drbotmd,,0,0,1,"Mepentazum (anti-infective) Treats the impulsive symptoms of SSRI overdose Obsoleted by ziprasidone",,,,1108590550343712770,https://twitter.com/drbotmd/status/1108590550343712770
2019-03-16 02:24:15,HealthCanadaNOC,,0,0,0,"New generic drug approved for ZIPRASIDONE CAPSULES by STRIDES PHARMA CANADA INC #NewNOCAlert #HCApproves",,,#NewNOCAlert #HCApproves,1106742947196952577,https://twitter.com/HealthCanadaNOC/status/1106742947196952577
2019-03-13 11:43:15,drbotmd,,0,0,0,"Dibufazole (depressant) Approved to treat stimulant discontinuation syndrome and short archeologist disorder Contraindicated by ziprasidone",,,,1105796461688733696,https://twitter.com/drbotmd/status/1105796461688733696
2019-03-10 09:48:42,Crowsiie,,0,0,4,"*You come over my house to chill and see a grandma-style candy bowl on my coffee table but instead of strawberry bonbons and Werther's Originals it's filled with ziprasidone and propanolol*",,,,1104680470892163073,https://twitter.com/Crowsiie/status/1104680470892163073
2019-03-09 17:52:01,chemlobotomy,chemlobotomy,1,0,0,"after receiving the diagnosis, doctors prescribe them a combination of antipsychotic drugs, typically haloperidol, aripiprazole, ziprasidone, risperidone, quetiapine, chlorpromazine, lurasidone. or lithium which requires constant blood taking. or fluoxetine or antidepressants",,,,1104439710112534529,https://twitter.com/chemlobotomy/status/1104439710112534529
2019-03-08 14:03:50,azimpuad,NAPLEXTestStudy,1,0,0,"haloperidol is a high potency typical AP, it cause more EPS. there are newer drugs that have less metabolic side effects for atypical AP such aripiprazole and ziprasidone. ",,,,1104019899922300929,https://twitter.com/azimpuad/status/1104019899922300929
2019-03-08 12:04:00,brian_usore,ugly_ghost1603,2,0,0,"And why would you give me medication for seizures and anxiety diazepam really? For psychosis i take ziprasidone (Geodon)",,,,1103989744747364353,https://twitter.com/brian_usore/status/1103989744747364353
2019-03-06 19:49:16,spellboundthin,,0,0,1,"i took more ziprasidone",,,,1103382053712789505,https://twitter.com/spellboundthin/status/1103382053712789505
2019-03-06 15:44:33,Pharma_Connect,,1,4,21,"Ziprasidone (زيبراسيدون) : Atypical antipsychotic drug, that works by changing the effects of chemicals in the brain. It's used for treatment of schizophrenia and the manic symptoms of bipolar disorder. Tell us what you know About Ziprasidone?",,,,1103320468776464385,https://twitter.com/Pharma_Connect/status/1103320468776464385
2019-03-03 14:31:01,HirstOfficial,,0,0,0,"Featured Art of the Day: ""Ziprasidone"". Buy it at: https://www.ArtPal.com/roberthirst?i=50107-75",,,,1102214803320459264,https://twitter.com/HirstOfficial/status/1102214803320459264
2019-03-01 02:02:45,Jetlax,Starr_Rx,1,0,1,"This makes me think that criticism on a delirium RCT (haloperidol vs ziprasidone) in the NEJM gets a bit of support: that it comprised mostly of hypoactive delirium cases Here, it's the opposite in that hypoactive is the minority (granted the previous trial was monotherapy only)",,,,1101301717252038657,https://twitter.com/Jetlax/status/1101301717252038657
2019-02-26 17:06:01,Veeprhopharma,,0,0,0,"Ziprasidone Impurities : https://lnkd.in/fy4vUps Ziprasidone Related Compound A Ziprasidone Related Compound B Ziprasidone Related Compound D Ziprasidone Open ring Impurity Ziprasidone N-Oxide Ziprasidone S-Oxide",,,,1100441867617996801,https://twitter.com/Veeprhopharma/status/1100441867617996801
2019-02-26 10:55:07,VoicesUnLtd,,0,0,0,"Clozapine, Ziprasidone, Risperidone, Lurasidone and Paliperidone are some of the drugs prescribed for the treatment of the disease. Proper... ",,,,1100348528122044416,https://twitter.com/VoicesUnLtd/status/1100348528122044416
2019-02-25 12:30:34,JCPjrnl_online,,0,1,1,"Current Issue: Ziprasidone for the Treatment of Stuttering http://dlvr.it/QzdfWl",,,,1100010160896917504,https://twitter.com/JCPjrnl_online/status/1100010160896917504
2019-02-25 05:20:58,ptarnation,evolutionarypsy,1,0,0,"And for inpatients who have minimal appetite but need to take their lurasidone /ziprasidone I admit this is a very niche market but still",,,,1099902049381044224,https://twitter.com/ptarnation/status/1099902049381044224
2019-02-20 21:37:45,PharmDuprey,emily_fri,0,2,4,"As far as the choice of antipsychotics, they chose ziprasidone as it was the only clear liquid injectable AAP with data on human use. And distinguishing between hypoactive delirium and sedation involves use of tools like CAM-ICU or ICDSC",,,,1098335925451382786,https://twitter.com/PharmDuprey/status/1098335925451382786
2019-02-18 16:33:38,psychopharmacol,,0,1,2,"meta-analysis in bipolar depression: lurasidone was significantly better than placebo (MADRS: –4.70; 95%CrI: –7.20, –2.21), aripiprazole (–3.62; –7.04, –0.20), and ziprasidone (–3.38; –6.68, –0.11), but not olanzapine (–0.15) or quetiapine (0.10) ",,,,1097534618495008768,https://twitter.com/psychopharmacol/status/1097534618495008768
2019-02-18 03:55:45,speccygeekgrrl,elle91,0,0,3,"Lil Knowing People In My Fandom Think I Suck Ziprasidone ",,,,1097343891026661378,https://twitter.com/speccygeekgrrl/status/1097343891026661378
2019-02-16 00:04:57,EKulstad,,0,1,5,"Treating patients with agitation due to psychotic episodes in an ED setting with inhaled loxapine versus haloperidol or ziprasidone was associated with significantly improved treatment outcomes. https://journals.lww.com/clinicalneuropharm/Fulltext/publishahead/Clinical_Outcomes_in_Patients_Taking_Inhaled.99556.aspx",,,,1096561032523378693,https://twitter.com/EKulstad/status/1096561032523378693
2019-02-15 16:26:58,psychopharmacol,,0,0,1,"The use of haloperidol or ziprasidone, as compared with placebo, in patients with acute respiratory failure or shock and hypoactive or hyperactive delirium in the ICU did not significantly alter the duration of delirium ",,,,1096445776425816065,https://twitter.com/psychopharmacol/status/1096445776425816065
2019-02-15 05:37:45,drbotmd,,0,0,0,"Zitraxine (stimulant) Approved to treat ziprasidone overdose and square-shaped fever Notable for its wasteful effect",,,,1096282395333021696,https://twitter.com/drbotmd/status/1096282395333021696
2019-02-14 19:59:00,PsychiatricNews,,0,5,17,"A large clinical study shows that treating ICU patients with haloperidol or ziprasidone is no more effective than placebo at reducing duration of delirium. http://apapsy.ch/icu-delirium #MentalHealth",,,#MentalHealth,1096136746880790528,https://twitter.com/PsychiatricNews/status/1096136746880790528
2019-02-13 09:24:05,MedlordsP,,0,1,2,"#Finasteride #Minoxidil Topical #Minoxidil Topical #Alfuzosin #Vpxl #Aripiprazole #Clomipramine #Buspirone #Clozapine #Prochlorperazine #Ziprasidone #Lamotrigine #Lithium #Loxapine #Thioridazine #Donezepil And Memantine #Risperidone #Quetiapine",,,#Finasteride #Minoxidil #Minoxidil #Alfuzosin #Vpxl #Aripiprazole #Clomipramine #Buspirone #Clozapine #Prochlorperazine #Ziprasidone #Lamotrigine #Lithium #Loxapine #Thioridazine #Donezepil #Risperidone #Quetiapine,1095614575981010945,https://twitter.com/MedlordsP/status/1095614575981010945
