date,username,to,replies,retweets,favorites,text,geo,mentions,hashtags,id,permalink
2018-08-22 02:12:24,drbotmd,,0,0,0,"Deslotamine (antipanic agent) Approved to treat antiarrhythmic overdose and alpha-adrenoceptor failure Obsoleted by ziprasidone",,,,1032088063546155010,https://twitter.com/drbotmd/status/1032088063546155010
2018-08-21 17:12:11,drbotmd,,0,0,0,"Cotaztine (antiseptic) Used recreationally for droning Often used off-label for ziprasidone overdose",,,,1031952116032655360,https://twitter.com/drbotmd/status/1031952116032655360
2018-08-19 02:34:08,SunnyCrittenden,,1,0,0,"oooooh god it's happening! the thoughts of, ""you should just go to bed, it's too late to start things tonight"" have begun. I swear that's the sole function of ziprasidone, to put those exact thoughts in my head 40 mins after I take it. &gt;:o(",,,,1031006370848337920,https://twitter.com/SunnyCrittenden/status/1031006370848337920
2018-08-17 18:16:48,drbotmd,,0,0,0,"Levopixine (antimigraine) Approved to treat ziprasidone overdose and major landed disorder Developed after 1997 Disarmer Pandemic",,,,1030518825660428288,https://twitter.com/drbotmd/status/1030518825660428288
2018-08-17 15:53:43,VS_SEH,,0,0,0,"Comparison of IM Midazolam, Olanzapine, Ziprasidone and Haloperidol for Behavioral Control - R.E.B.E.L. EM ",,,,1030482814901342208,https://twitter.com/VS_SEH/status/1030482814901342208
2018-08-17 11:42:04,TabithaH1M,,0,0,1,"Christine said when you ask for Geodon, ask for Ziprasidone, not Ziprasidone HCL",,,,1030419486032031745,https://twitter.com/TabithaH1M/status/1030419486032031745
2018-08-17 04:16:26,drbotmd,,0,0,0,"Hapivalin (antidepressant) Cures low indictability Obsoleted by ziprasidone",,,,1030307339864350721,https://twitter.com/drbotmd/status/1030307339864350721
2018-08-15 16:00:23,webO_o,BoingBoing,1,0,1,"Wow! This is a lifelong psychotic illness. He needs Ziprasidone or Olanzapine or something like that. ",,,,1029759717021810689,https://twitter.com/webO_o/status/1029759717021810689
2018-08-15 08:37:36,theobroekman,JimvanOs1,0,0,0,"Zie ook recente publicatie van Bogers et al. in European Neuropsychopharmacology ""study establishes that lowering high first- generation antipsychotics (FGA) doses to an equivalent of 5 mg/day haloperidol or switching to ziprasidone is feasible....."" http://doi.org/10.1016/j.euroneuro.2018.06.005",,,,1029648286368641024,https://twitter.com/theobroekman/status/1029648286368641024
2018-08-14 15:25:51,sheenvigeen,,0,0,1,"I think my body has finally adjusted to my lower klonopin dose so my headache has cleared up. Now I'm waiting for my ziprasidone withdrawal to start in like ~10 days",,,,1029388639606910976,https://twitter.com/sheenvigeen/status/1029388639606910976
2018-08-14 13:42:02,katelovesneuro,mnitabach,0,0,0,"POTUS ""bing bing bing"" & ALL no doubt ziprasidone (for psychotic violent war tweeting &amp; football fixation) lorazapam (lord its witching hour)&amp; donepezil (to recall what the f_ck address hes at tho it appears its not working)... No worries tho Doc Ronnie's in charge #$@&amp;¥¶#MFer",,,,1029362513329172482,https://twitter.com/katelovesneuro/status/1029362513329172482
2018-08-14 01:59:46,DipROM2,,0,2,0,"Comparison of IM Midazolam, Olanzapine, Ziprasidone and Haloperidol for Behavioral Control - R.E.B.E.L. EM - Emergency Medicine Blog http://rebelem.com/comparison-of-im-midazolam-olanzapine-ziprasidone-and-haloperidol-for-behavioral-control/",,,,1029185780609036289,https://twitter.com/DipROM2/status/1029185780609036289
2018-08-13 22:08:43,drbotmd,,0,0,0,"Rooxygra (antibiotic) Used recreationally for grasping Contraindicated by ziprasidone",,,,1029127634855387136,https://twitter.com/drbotmd/status/1029127634855387136
2018-08-13 19:19:06,research_er,,0,0,0,"Top EM evening stories: Comparison of IM Midazolam, Olanzapine, Ziprasidone and Haloperidol for Behavioral Control - R.E.B.E.L. EM - Emergency Medicine Blog http://rebelem.com/comparison-of-im-midazolam-olanzapine-ziprasidone-and-haloperidol-for-behavioral-control/, see more http://tweetedtimes.com/v/9201?s=tnp",,,,1029084949482274818,https://twitter.com/research_er/status/1029084949482274818
2018-08-13 18:55:50,ETtube,,0,0,0,"Comparison of IM Midazolam, Olanzapine, Ziprasidone and Haloperidol for Behavioral Control http://rebelem.com/comparison-of-im-midazolam-olanzapine-ziprasidone-and-haloperidol-for-behavioral-control/ #FOAMed",,,#FOAMed,1029079095659745280,https://twitter.com/ETtube/status/1029079095659745280
2018-08-13 12:59:23,srrezaie,,2,66,96,"Comparison of IM Midazolam, Olanzapine, Ziprasidone and Haloperidol for Behavioral Control via @EMSwami http://rebelem.com/comparison-of-im-midazolam-olanzapine-ziprasidone-and-haloperidol-for-behavioral-control/ #FOAMed",,@EMSwami,#FOAMed,1028989392788934657,https://twitter.com/srrezaie/status/1028989392788934657
2018-08-13 08:24:20,EnviPharm_19,,0,0,0,"Ziprasidone, an atypical antipsychotic, should be taken with food to enhance #bioavailability. failure to do so results in loss of bioavailability by about half. #EnviPharm2018 #Pharmacology #Chicago #USA https://goo.gl/db4WwK",,,#bioavailability #EnviPharm2018 #Pharmacology #Chicago #USA,1028920173770620928,https://twitter.com/EnviPharm_19/status/1028920173770620928
2018-08-10 22:06:36,drbotmd,,0,0,0,"Cotazlam (antiandrogen) Prescribed for stimulating cant disorder Decreases the low effects of ziprasidone",,,,1028039942432284672,https://twitter.com/drbotmd/status/1028039942432284672
2018-08-10 18:10:07,sheenvigeen,,0,0,0,"If I nees to go through six weeks of withdrawal from ziprasidone imma kms",,,,1027980425661218817,https://twitter.com/sheenvigeen/status/1027980425661218817
2018-08-09 17:05:03,HMMTLZ1,TomiLahren,0,0,1,"To busy washing their pink hats and taking Ziprasidone",,,,1027601666378366976,https://twitter.com/HMMTLZ1/status/1027601666378366976
2018-08-09 16:31:14,sheenvigeen,,0,0,1,"I'm officially off ziprasidone today, and i got my gabapentin lowered to 300mg",,,,1027593156798410752,https://twitter.com/sheenvigeen/status/1027593156798410752
2018-08-06 18:03:46,drbotmd,,0,0,0,"Busvadone (vitamin) Used recreationally for etching Contraindicated by ziprasidone",,,,1026529279469924352,https://twitter.com/drbotmd/status/1026529279469924352
2018-08-03 09:04:02,drbotmd,,0,0,0,"Estracitalazole (diuretic) Used with ziprasidone to treat James Cleveland Owens's disease Contraindicated by activated charcoal",,,,1025306286462783488,https://twitter.com/drbotmd/status/1025306286462783488
2018-08-01 12:22:41,PharmaFactz,,0,31,62,"* ZIPRASIDONE * It should be taken with food to enhance bioavailability. ROM - Oral and IM Side effects 1 - Sleepiness 2 - Headache 3 - Hypersalivation * Pharmacodynamics - - Full antagonist at D2 receptors / 5-HT2a - Partial agonist at 5-HT1a / 2c / 2d Half-life - 10 hr",,,,1024631503223959552,https://twitter.com/PharmaFactz/status/1024631503223959552
2018-07-31 20:13:41,resistbot,,5,16,24,"Among the drugs administered to children without their knowledge or consent: clonazepam, divalproex, duloxetine, guanfacine, lurasidone, ziprasidone, and olanzapine. These are powerful drugs with a lot of very serious side effects.",,,,1024387645705576448,https://twitter.com/resistbot/status/1024387645705576448
2018-07-28 14:03:05,med018118,,0,0,0,"""Intramuscular midazolam, olanzapine, ziprasidone, or haloperidol for treating acute agitation in the emergency department"" https://medicinaydemass.blogspot.com/2018/07/intramuscular-midazolam-olanzapine.html #medicinafamiliar #feedly",,,#medicinafamiliar #feedly,1023207217464598528,https://twitter.com/med018118/status/1023207217464598528
2018-07-27 08:59:34,drbotmd,,0,0,0,"Buzetin (immunosuppressive) Used with ziprasidone to treat different personality disorder Controlled in the US due to its voluptuous effect",,,,1022768446566789120,https://twitter.com/drbotmd/status/1022768446566789120
2018-07-26 04:58:10,drbotmd,,0,0,0,"Viazeum (antifungal) Prescribed for horn-rimmed mathematics syndrome Obsoleted by ziprasidone",,,,1022345307588370433,https://twitter.com/drbotmd/status/1022345307588370433
2018-07-24 14:35:15,HirstOfficial,,0,1,1,"Featured Art of the Day: ""Ziprasidone"". Buy it at: https://www.ArtPal.com/roberthirst?i=50107-75",,,,1021765760534945794,https://twitter.com/HirstOfficial/status/1021765760534945794
2018-07-24 12:25:16,smithECGBlog,813JAFERD,0,0,1,"As far as I know, ziprasidone has not been studied for headache. You should get olanzapine on formulary. Wide array of uses in the ED. See this article from my institution (Hennepin, HCMC) in Annals of EM: https://www.sciencedirect.com/science/article/pii/S0196064416304668 @hcmcEM @HennepinHC @jonbcole2 @kleinlaur",,@hcmcEM @HennepinHC @jonbcole2,,1021733047580979200,https://twitter.com/smithECGBlog/status/1021733047580979200
2018-07-21 22:16:20,sharenlove,,0,1,0,"The medications involved in FDA warning action are: Mellaril (thioridazine) Geodon (ziprasidone) Moban (molindrone) Invega (paliperidone) Navane (thithixene) Risperdal (risperidone) Orap (pimozide) Seroquel (quetiapine) Prolixin (fluphenazine) Zyprexa (olanzapine)",,,,1020794632924422144,https://twitter.com/sharenlove/status/1020794632924422144
2018-07-20 20:12:23,_Huntingtons,,0,0,0,"New Post: Geodon (Ziprasidone) ",,,,1020401052871544832,https://twitter.com/_Huntingtons/status/1020401052871544832
2018-07-19 16:39:27,midnightamerica,Feisty_FL,0,0,0,"Feisty. . The way things have been going for you lately and the litigious nature of the medical profession, just to play it safe add a disclaimer after your ziprasidone action plan stating you were kidding . I know it sounds ridiculous but I learned my lesson the hard way.",,,,1019985076686376960,https://twitter.com/midnightamerica/status/1019985076686376960
2018-07-19 15:53:40,drbotmd,,0,0,0,"Ibucerne (disinfectant) Cures self-centered personality disorder Developed in 1994 to replace ziprasidone",,,,1019973557479231488,https://twitter.com/drbotmd/status/1019973557479231488
2018-07-17 21:24:54,Psychia_Updates,,0,0,0,"ScienceDirect Publication: European Neuropsychopharmacology Dose reduction of high-dose first-generation antipsychotics or switch to ziprasidone in long-stay patients with schizophrenia: A... https://www.sciencedirect.com/science/article/pii/S0924977X18301652?dgcid=rss_sd_all",,,,1019332135868620800,https://twitter.com/Psychia_Updates/status/1019332135868620800
2018-07-17 18:56:08,AnnalsofEM,,0,29,47,"Articles in Press: Intramuscular Midazolam, Olanzapine, Ziprasidone, or Haloperidol for Treating Acute Agitation in the Emergency Department https://www.annemergmed.com/article/S0196-0644(18)30373-1/fulltext",,,,1019294699390152704,https://twitter.com/AnnalsofEM/status/1019294699390152704
2018-07-17 15:01:04,PFennen,BeschlossDC,0,0,1,"aripiprazole (Abilify), haloperidol (Haldol), olanzapine (Zyprexa), quetiapine (Seroquel), risperidone (Risperdal), and ziprasidone (Geodon) . Hey Pusssockets, try some of these. It may help",,,,1019235541181718529,https://twitter.com/PFennen/status/1019235541181718529
2018-07-15 18:58:57,dblckparade,,0,0,1,"So,,,, Schizo: aripripazole/risperdone/ziprasidone Bipolar: lithium/valproic acid Anxiety: paroxetine +/- BZD Depression: escitalopram +/- BZD Now if only I can actually remember the initial and usual dosing for these drugs ",,,,1018570631636381696,https://twitter.com/dblckparade/status/1018570631636381696
2018-07-15 04:17:50,Spencer4fire,,0,0,0,"@PulmCrit thoughts on off-label use of olanzapine or ziprasidone for dangerous agitation and ICU delirium when haldol doesn’t cut it? Seems like some docs love midaz for this situation while others avoid benzos completely.",,@PulmCrit,,1018348892826619905,https://twitter.com/Spencer4fire/status/1018348892826619905
2018-07-13 20:59:47,PFennen,ananavarro,0,0,0,"aripiprazole (Abilify) clozapine (Clozaril) haloperidol (Haldol) olanzapine (Zyprexa) quetiapine (Seroquel) risperidone (Risperdal) ziprasidone (Geodon) . Tell him to start with some of these. If they work get some to his buddy Rudy",,,,1017876264915521536,https://twitter.com/PFennen/status/1017876264915521536
2018-07-13 20:59:19,PFennen,laloalcaraz,0,0,0,"aripiprazole (Abilify) clozapine (Clozaril) haloperidol (Haldol) olanzapine (Zyprexa) quetiapine (Seroquel) risperidone (Risperdal) ziprasidone (Geodon) . Start with some of these and see if they help. If so get some to your buddy Rudy",,,,1017876146661322755,https://twitter.com/PFennen/status/1017876146661322755
2018-07-13 18:49:56,drbotmd,,0,0,0,"Viasizole (analgesic) Prescribed for severe pushing Obsoleted by ziprasidone",,,,1017843586090635265,https://twitter.com/drbotmd/status/1017843586090635265
2018-07-13 15:49:32,drbotmd,,0,0,0,"Duoxyrane (androgen) Used recreationally as a hormone Developed in 1959 to replace ziprasidone",,,,1017798186444959744,https://twitter.com/drbotmd/status/1017798186444959744
2018-07-13 01:05:45,gimmesomeloki,gimmesomeloki,1,0,0,"Two drugs named in one of the court documents I read, lurasidone (Latuda) and ziprasidone (Geodon) are indicated in cases of schizophrenia (rare in children, usually dxd in late adolescence, and historically used as a dx of control) and bipolar (often misdiagnosed). ",,,,1017575776441561088,https://twitter.com/gimmesomeloki/status/1017575776441561088
2018-07-11 01:38:53,PFennen,Amy_Siskind,0,0,2,"aripiprazole (Abilify) clozapine (Clozaril) haloperidol (Haldol) olanzapine (Zyprexa) quetiapine (Seroquel) risperidone (Risperdal) ziprasidone (Geodon) . Take your pick Rudy any one of these would surely help ",,,,1016859340333047808,https://twitter.com/PFennen/status/1016859340333047808
2018-07-10 08:49:23,gregorprosen,,0,0,1,"Intramuscular #Midazolam, #Olanzapine, #Ziprasidone, or #Haloperidol for Treating Acute #Agitation in the ED https://www.sciencedirect.com/science/article/pii/S0196064418303731",,,#Midazolam #Olanzapine #Ziprasidone #Haloperidol #Agitation,1016605291495002112,https://twitter.com/gregorprosen/status/1016605291495002112
2018-07-09 14:46:51,drbotmd,,0,0,0,"Priminophen (antidepressant) Used to treat major millenarian disorder Contraindicated by ziprasidone",,,,1016332862256242689,https://twitter.com/drbotmd/status/1016332862256242689
2018-07-05 12:28:56,EnviPharm2019,,0,0,0,"Ziprasidone, an atypical antipsychotic, should be taken with food to enhance #bioavailability. failure to do so results in loss of bioavailability by about half. #EnviPharm2018 #Pharmacology #Chicago #USA https://goo.gl/db4WwK",,,#bioavailability #EnviPharm2018 #Pharmacology #Chicago #USA,1014848602626088960,https://twitter.com/EnviPharm2019/status/1014848602626088960
2018-07-03 19:42:08,drbotmd,,0,0,0,"Eslorane (disinfectant) Used with ziprasidone to treat vaccine overdose Decreases the caecilian effects of morphine",,,,1014232846100246528,https://twitter.com/drbotmd/status/1014232846100246528
2018-07-03 16:42:05,drbotmd,,0,0,0,"Gabaloxetin (anxiolytic) Used recreationally for intersecting Obsoleted by ziprasidone",,,,1014187532286820352,https://twitter.com/drbotmd/status/1014187532286820352
2018-06-29 02:35:29,er_jason,,0,0,0,"https://ift.tt/2MxlgKd Conclusion Intramuscular midazolam achieved more effective sedation in agitated ED patients at 15 minutes than haloperidol, ziprasidone, and perhaps olanzapine. Olanzapine provided more effective sedation than haloperidol. N… https://ift.tt/2MxlgKd",,,,1012524929101762565,https://twitter.com/er_jason/status/1012524929101762565
2018-06-27 02:49:27,Mycroft6996,srhodesmfc,0,0,0,"@Sammie_Rhodes Sammie, have your CAM take two of these: Olanzapine (Zyprexa), Quetiapine (Seroquel), Risperidone (Risperdal), Ariprazole (Abilify), Ziprasidone (Geodon), and/or Clozapine (Clozaril) AND, call me in the morning... ",,@Sammie_Rhodes,,1011803669174644737,https://twitter.com/Mycroft6996/status/1011803669174644737
2018-06-26 11:13:21,K8withbatteries,,0,0,0,"nausea wave passed as quickly as it had come. Kate & her pathological fear of vomiting (emetephobia for all y'all playing along at home): 1 Stomach + antipsychotic: 0 Thanks for playing, ziprasidone. better luck next time",,,,1011568089261961216,https://twitter.com/K8withbatteries/status/1011568089261961216
2018-06-25 17:27:16,BrandCrazyMeds,sciencebeta,1,0,0,"As the worst offenders in AP-induced weight gain - olanzapine, quetiapine, and clozapine - are all potent anticholinergics, this study has some value. But it doesn't explain weight gain with meds like risperidone & aripiprazole, nor why weight gain is unlikely with ziprasidone. ",,,,1011299800921378816,https://twitter.com/BrandCrazyMeds/status/1011299800921378816
2018-06-25 09:51:26,SwissPedEmerg,,0,0,2,"Midazolam best. Olanzapine second ! Intramuscular Midazolam, Olanzapine, Ziprasidone, or Haloperidol for Treating Acute Agitation in the Emergency Department. https://www.ncbi.nlm.nih.gov/pubmed/29885904",,,,1011185087315050496,https://twitter.com/SwissPedEmerg/status/1011185087315050496
2018-06-24 14:19:53,ewoudterAvest,,0,0,1,"Great article: Intramuscular Midazolam, Olanzapine, Ziprasidone, or Haloperidol for Treating ... http://QxMD.com/r/29885904 #ReadByQxMD",,,#ReadByQxMD,1010890259041792001,https://twitter.com/ewoudterAvest/status/1010890259041792001
2018-06-24 13:39:45,alonsorizog,,0,0,0,"Intramuscular Midazolam, Olanzapine, Ziprasidone, or Haloperidol for Treating Acute Agitation in the Emergency Department. https://www.readbyqxmd.com/read/29885904/intramuscular-midazolam-olanzapine-ziprasidone-or-haloperidol-for-treating-acute-agitation-in-the-emergency-department#.Wy-euIZJYF8.twitter",,,,1010880159413604352,https://twitter.com/alonsorizog/status/1010880159413604352
2018-06-24 00:11:13,drbotmd,,0,0,0,"Mirpidone (anti-infective) Used with ziprasidone to treat respiratory askew disease Controlled in the US due to its restorative effect",,,,1010676682708135938,https://twitter.com/drbotmd/status/1010676682708135938
2018-06-23 13:48:01,SSeadon,,0,0,0,"Great article: Intramuscular Midazolam, Olanzapine, Ziprasidone, or Haloperidol for Treating Acute Agitation in the Emergency Department. http://QxMD.com/r/29885904 #ReadByQxMD",,,#ReadByQxMD,1010519850148495363,https://twitter.com/SSeadon/status/1010519850148495363
2018-06-23 05:05:29,Cesare1210Tom,reveal,0,0,0,"5) Per Rxlist: “Given the primary central nervous system effects of Ziprasidone, caution should be used when it is taken in combination with other centrally acting drugs.” Side effects include an abnormal heart rhythm, anxiety and headaches, a depressed mood,",,,,1010388350468050945,https://twitter.com/Cesare1210Tom/status/1010388350468050945
2018-06-23 05:01:54,Cesare1210Tom,reveal,0,0,0,"4) Geodon (Ziprasidone Hcl as a capsule, Z. Mesylate as an injection). This is a psychotropic drug. It should not be administered intravenously, only intramuscularly. It’s used to treat bipolar disorder and schizophrenia.",,,,1010387447207878656,https://twitter.com/Cesare1210Tom/status/1010387447207878656
2018-06-23 00:31:07,harmonfong,,0,0,0,"IM Midaz eh? Great article: Intramuscular Midazolam, Olanzapine, Ziprasidone, or Haloperidol for Treating Acute Agitation in the Emergency Department. http://www.readbyqxmd.com/read/29885904 #ReadByQxMD",,,#ReadByQxMD,1010319304263270400,https://twitter.com/harmonfong/status/1010319304263270400
2018-06-22 22:33:36,EMedCurious,,0,1,1,"Great article: Intramuscular Midazolam, Olanzapine, Ziprasidone, or Haloperidol for Treating Acute Agitat... http://QxMD.com/r/29885904 #ReadByQxMD",,,#ReadByQxMD,1010289728556429313,https://twitter.com/EMedCurious/status/1010289728556429313
2018-06-22 19:45:35,LWestafer,,0,6,13,"IM midazolam = greater proportion of adequately sedated agitated patients compared with haloperidol or ziprasidone (but doesn't compare beloved 5/2 combo) https://www.annemergmed.com/article/S0196-0644(18)30373-1/fulltext via @AnnalsofEM #AnnalsAIP",,@AnnalsofEM,#AnnalsAIP,1010247445656342528,https://twitter.com/LWestafer/status/1010247445656342528
2018-06-22 16:53:11,psychopharmacol,,0,3,0,"network meta-analysis in children and adol. with schizophrenia: Clozapine was more effective than all other antipsychotics. All antipsychotics were more efficacious vs placebo (exc. ziprasidone). Highest weight gain: clozapine, quetiapine and olanzapine https://www.sciencedirect.com/science/article/pii/S0924977X18300713",,,,1010204061419917313,https://twitter.com/psychopharmacol/status/1010204061419917313
2018-06-21 18:56:45,noodlemaz,,1,3,1,"Drugs being used to 'calm' (control) stolen children 2/3: Clonazepam: benzo tranquiliser Duloxetine: SNRI Guanfacine: sympatholytic (HBP, ADHD) Latuda: atypical antipsych (bd) Geodon (ziprasidone): atypical antipsych (schz, ac mania, bd) #FamiliesBelongTogether",,,#FamiliesBelongTogether,1009872768177922048,https://twitter.com/noodlemaz/status/1009872768177922048
2018-06-21 15:32:47,kirwinia,wolicyponk,1,0,0,"I always wonder how they name these things. Not the brand name, but the name of the drug itself. Like Ziprasidone. How did that come out? Who picked it, and why?",,,,1009821441313738753,https://twitter.com/kirwinia/status/1009821441313738753
2018-06-21 03:54:47,Michelechrisco,Michelechrisco,1,0,1,"Geodon (ziprasidone HCl and ziprasidone mesylate) is an atypical antipsychotic used to treat symptoms of schizophrenia and acute manic or mixed episodes associated with bipolar disorder. Geodon also can be used as maintenance treatment of bipolar disorder when added to lithium",,,,1009645781605740551,https://twitter.com/Michelechrisco/status/1009645781605740551
2018-06-21 01:41:21,Danielpcarry,,0,0,0,"A 16 year old Honduran boy forced to take the following cocktail of drugs by the fascists running the #TrumpConcentrationCamps - Lurasidone, Ziprasidone, Olanzapine, Benztropine, Clonazepam, valproate, Duloxetine, Guanfacine. A 16 year old boy. #Torture https://www.documentcloud.org/documents/4525292-420-2-Exhibit-Vol-2-Exs-21-30-Pages-109-73.html",,,#TrumpConcentrationCamps #Torture,1009612202196729858,https://twitter.com/Danielpcarry/status/1009612202196729858
2018-06-20 22:10:58,DrAnneMurphy,,0,1,1,"“One child was prescribed 10 different shots and pills, including the antipsychotic drugs Latuda (lurasidone), Geodon (ziprasidone) and Olanzapine, the Parkinson’s medication Benztropine; Clonazepam and Divalproex (valproate), Duloxetine, and Guanfacine” https://www.revealnews.org/blog/immigrant-children-forcibly-injected-with-drugs-lawsuit-claims/",,,,1009559258831183872,https://twitter.com/DrAnneMurphy/status/1009559258831183872
2018-06-20 21:38:13,KoalasWelcome,reveal,0,0,0,"just Ziprasidone (Geodon) is awful! That is very serious drug. I don't even know what to say if this is true :-( That mix!! ",,,,1009551015996112896,https://twitter.com/KoalasWelcome/status/1009551015996112896
2018-06-20 18:37:15,AStrobelMD,,1,0,4,"Consider atypical antipsychotics as first line for pediatric agitation in ED (olanzapine ODT, IM; ziprasidone IM; risperidone PO) #foamped #emconf #TwinCitiesPEMmetro @hcmcEM @UofMPedsRes @jonbcole2",,@hcmcEM @UofMPedsRes @jonbcole2,#foamped #emconf #TwinCitiesPEMmetro,1009505474016890880,https://twitter.com/AStrobelMD/status/1009505474016890880
2018-06-19 21:53:39,cookies_cpht,ClumsyHotMess,0,0,1,"I’m Texas transplant. I’m diagnosed bipolar II, anxiety, and depression. I take ziprasidone (antipsychotic) and lexapro (antidepressant) everyday. Without my daily medicine I wouldn’t be able to function ",,,,1009192511443734529,https://twitter.com/cookies_cpht/status/1009192511443734529
2018-06-19 04:58:58,MEDEST118,,0,1,1,"Intramuscular Midazolam, Olanzapine, Ziprasidone, or Haloperidol for Treating Acute Agitation in the Emergency Department https://www.annemergmed.com/article/S0196-0644(18)30373-1/fulltext",,,,1008937160530124800,https://twitter.com/MEDEST118/status/1008937160530124800
2018-06-18 02:36:36,ATCEMSOMD,mitchpage3,1,0,1,"Haloperidol is not bad in combination with benzos. Ziprasidone is another decent choice if you need an injection. Chlorpromazine has been around a while but causes orthostatic hypotension. When they get up to come after you, they get all dizzy and have to sit back down.",,,,1008538942273146881,https://twitter.com/ATCEMSOMD/status/1008538942273146881
2018-06-15 12:14:33,smithECGBlog,,0,7,19,"Sedation profile of agitated patients in Klein et al. “Intramuscular Midazolam, Olanzapine, Ziprasidone, or Haloperidol for Treating Acute Agitation in the Emergency Department”, in press in the Annals of Emergency Medicine. https://doi.org/10.1016/j.annemergmed.2018.04.027",,,,1007597224618913793,https://twitter.com/smithECGBlog/status/1007597224618913793
2018-06-14 09:18:29,EnviPharm2019,,0,0,0,"Ziprasidone, an atypical antipsychotic, should be taken with food to enhance #bioavailability. failure to do so results in loss of bioavailability by about half. #EnviPharm2018 #Pharmacology #Chicago #USA https://goo.gl/db4WwK",,,#bioavailability #EnviPharm2018 #Pharmacology #Chicago #USA,1007190528159465472,https://twitter.com/EnviPharm2019/status/1007190528159465472
2018-06-13 20:30:18,EMCCC2,,0,0,0,"In #ED patients with #agitation, #midazolam #IM achieves more rapid sedation than #haloperidol 5 or 10 mg, #ziprasidone 20 mg or #olanzapine 10 mg IM. No cases of #torsades in any of the patient groups. https://www.ncbi.nlm.nih.gov/pubmed/?term=29885904",,,#ED #agitation #midazolam #IM #haloperidol #ziprasidone #olanzapine #torsades,1006997210238611457,https://twitter.com/EMCCC2/status/1006997210238611457
2018-06-12 18:09:31,topcoatsandhats,sparklylovatos,0,0,0,"Are you on SSRI or anti psychotic? Zoloft (SSRI) didn’t make me gain any weight, and when I switched to ziprasidone (anti psychotic) from another weight gaining AP I lost all the weight and didn’t put any on. So those would be my recs depending on the type of med you’re on",,,,1006599393888362496,https://twitter.com/topcoatsandhats/status/1006599393888362496
