date,username,to,replies,retweets,favorites,text,geo,mentions,hashtags,id,permalink
2020-03-13 00:09:09,ZydisMining,cryptobombshell,0,0,1,"kill the trading bots! pull the plug!",,,,1238255743100424200,https://twitter.com/ZydisMining/status/1238255743100424200
2020-03-12 01:50:14,ZydisMining,,0,0,0,"NBA cancelled season... wawat!",,,,1237918793629937664,https://twitter.com/ZydisMining/status/1237918793629937664
2020-03-11 05:38:04,ZydisMining,elonmusk,0,0,0,"Palestine, TX We Luv Trux!",,,,1237613742516363270,https://twitter.com/ZydisMining/status/1237613742516363270
2020-03-10 05:27:06,ZydisMining,,2,0,0,"What happened to the Vaping epidemic?",,,,1237248593653673984,https://twitter.com/ZydisMining/status/1237248593653673984
2020-03-08 07:41:59,ZydisMining,VABGeohacker,1,0,1,"tommorow s my day, every two weeks! Coincides with my geo claim rewards pay out at 4pm. should have bout 3o,ooo to exchange.",,,,1236557762873577472,https://twitter.com/ZydisMining/status/1236557762873577472
2020-02-18 04:16:41,phillipmacon77,,0,0,0,"@POTUS How many motherfuckers got legalization didn’t realize man the green stuff they gave you is nothing but Zyprexa Zydis",,@POTUS,,1229620730045911041,https://twitter.com/phillipmacon77/status/1229620730045911041
2020-02-08 22:49:08,phrmacy2050,,0,0,0,"Today's Article about Zyprexa Zydis How it works, Uses, Side Effects, Interactions Benefits of using this medication Olanzapine belongs to group of medications known as antipsychotic/antimanic agents. #Olanzapine #Z #ZyprexaZydis #zyprexazydis15mg #zyp",,,#Olanzapine #Z #ZyprexaZydis #zyprexazydis15mg #zyp,1226276806371745793,https://twitter.com/phrmacy2050/status/1226276806371745793
2020-02-07 13:45:05,CatalentPharma,,0,2,3,"ALK Abelló A/S and Catalent collaborated to develop a sublingually administered #immunotherapy allergy tablet, using Zydis® ODT providing a more convenient treatment for patients. Download the #casestudy today. #casestudy #drugdelivery #oraldrug #allergy http://ow.ly/9UiC50yfNeg",,,#immunotherapy #casestudy #casestudy #drugdelivery #oraldrug #allergy,1225777504700555264,https://twitter.com/CatalentPharma/status/1225777504700555264
2020-01-26 18:34:51,secondplacelay,,1,0,0,"I have a medication I take called zyprexa zydis - the zydis on account of being administered sublingually it keeps me on even keel temperament as in affect I am not at all dangerous on or off the drug, I have an affliction called schizo effective disorder and no .I am legit.",,,,1221501772847599616,https://twitter.com/secondplacelay/status/1221501772847599616
2020-01-26 05:17:07,kow_alex,,0,0,0,"Using Zydis is the next best method, however Zydis is meant to weigh heavy by shaking the heart, you would have to be wear out while you perform life. I would say it works pressure pumping more than any.",,,,1221301016462626816,https://twitter.com/kow_alex/status/1221301016462626816
2020-01-19 23:51:20,talacko62,NFrechen,0,0,1,"She's off her meds. I guarantee it! I'd probably go with a heavy dose of Zyprexa Zydis and Ativan at this point.",,,,1219044702571376640,https://twitter.com/talacko62/status/1219044702571376640
2020-01-17 22:10:03,CatalentPharma,,0,1,0,"ALK Abelló A/S and Catalent collaborated to develop a sublingually administered #immunotherapy allergy tablet, using Zydis® ODT providing a more convenient treatment for patients. Download the #casestudy today. #casestudy #drugdelivery #oraldrug #allergy",,,#immunotherapy #casestudy #casestudy #drugdelivery #oraldrug #allergy,1218294438272913409,https://twitter.com/CatalentPharma/status/1218294438272913409
2020-01-15 16:31:09,JLCAustinTx,jmugele,0,0,1,"It was an interesting 10 Hour overnight shift for me too. Meth. PCP. BAL of 435. Zydis for when the ER meds wear off. #lovemyjob.",,,#lovemyjob,1217484377069969408,https://twitter.com/JLCAustinTx/status/1217484377069969408
2020-01-13 10:28:53,ByJoFagg,,0,0,0,"Biohaven's migraine prevention data due ""early Q1"" with rimegepant $BHVN. Also due: #FDA decision on Zydis ODT in acute setting. Our previous look at the prevention trial: ",,,#FDA,1216668433271676928,https://twitter.com/ByJoFagg/status/1216668433271676928
2020-01-13 07:07:52,iximeow,iximeow,0,0,2,"oh i'm also extremely lazy about reading operands. this is nice because it shrinks a decoded instruction down quite a bit, and makes reading operands much more consistent i believe zydis does this as well, and iced seems to (i'm looking forward to comparing with their rust port)",,,,1216617843757744131,https://twitter.com/iximeow/status/1216617843757744131
2020-01-13 06:27:11,iximeow,iximeow,1,0,6,"from there, about 47% of time in zydis, in this benchmark, is clearing a struct of decoder state. literally `rep stosb`. my decoder state is all locals or stored in the resulting decoder, no need to reset it",,,,1216607606657056768,https://twitter.com/iximeow/status/1216607606657056768
2020-01-13 06:25:58,iximeow,iximeow,1,0,4,"capstone is just kind of large and slow - i have a hard time reading it because the bulk of it is codegen'd from a modified tablegen description. the win there is the same as zydis and others observed: decoding and not formatting is useful. my formatting is as slow as capstone!",,,,1216607300787437569,https://twitter.com/iximeow/status/1216607300787437569
2020-01-09 11:27:09,msfizzofficial,kitzluvs,1,0,1,"Prescription - Sch 4 or 5 I think. Zofran Zydis u meant ?",,,,1215233543309287425,https://twitter.com/msfizzofficial/status/1215233543309287425
2019-12-25 19:36:09,aSandraKennelly,,0,0,0,"Apply now to work for #Catalent as Senior #Technologist, Zydis Ultra! (#Swindon) #job https://workfor.us/catalent/t04v2",,,#Catalent #Technologist #Swindon #job,1209920785546174464,https://twitter.com/aSandraKennelly/status/1209920785546174464
2019-12-19 17:38:39,EileenChoffnes,,0,0,0,"Catalent to formulate CBD multiple sclerosis treatment with Zydis ",,,,1207716888916250624,https://twitter.com/EileenChoffnes/status/1207716888916250624
2019-12-17 11:08:14,InPharmaTechno,,0,1,3,"@CatalentPharma to formulate #CBD multiple sclerosis treatment with Zydis @cbdglobalsummit",,@CatalentPharma @cbdglobalsummit,#CBD,1206893860930097154,https://twitter.com/InPharmaTechno/status/1206893860930097154
2019-12-16 22:46:59,SeedBankME,,0,0,0,"Catalent to formulate CBD/THC multiple sclerosis treatment with Zydis #Cannabis https://www.in-pharmatechnologist.com/Article/2019/12/16/Catalent-partners-with-Ethicann-on-CBD-treatment#.XfgJPu60Dw4.twitter",,,#Cannabis,1206707319813419010,https://twitter.com/SeedBankME/status/1206707319813419010
2019-12-16 14:50:37,Sherri_Kemp,,0,0,1,"Catalent to formulate CBD multiple sclerosis treatment with Zydis https://www.in-pharmatechnologist.com/Article/2019/12/16/Catalent-partners-with-Ethicann-on-CBD-treatment#.XfeZudjGCA0.twitter",,,,1206587441202622464,https://twitter.com/Sherri_Kemp/status/1206587441202622464
2019-12-16 13:16:27,ReeferAlJoint,,0,1,1,"@ReeferAlJoint Article Dated 12/16/2019 #MondayMorning #CBD #RT #followback #cannabisculture #monday Catalent to formulate CBD #multiplesclerosis treatment with Zydis https://www.in-pharmatechnologist.com/Article/2019/12/16/Catalent-partners-with-Ethicann-on-CBD-treatment#.XfeDkNts69I.twitter",,@ReeferAlJoint,#MondayMorning #CBD #RT #followback #cannabisculture #monday #multiplesclerosis,1206563742848294912,https://twitter.com/ReeferAlJoint/status/1206563742848294912
2019-12-10 15:49:24,ContractPharma,,0,1,3,".@CatalentPharma has completed clinical production of Bridge Therapeutics Inc.’s #opioidaddiction therapeutic product, BT-219, and executed an Exclusive Licensing Agreement to use Catalent’s #Zydis orally disintegrating tablet (ODT) technology. ",,@CatalentPharma,#opioidaddiction #Zydis,1204427904777703424,https://twitter.com/ContractPharma/status/1204427904777703424
2019-12-01 07:02:54,iximeow,iximeow,1,0,1,"also even in that case no project i've found has had a respectable corpus to test against - capstone has one string in a file, and zydis just .. doesn't anywhere (in-repo anyway)",,,,1201033915495931905,https://twitter.com/iximeow/status/1201033915495931905
2019-11-28 18:07:25,Kay_Giiegh,Spitta_Ferrari,1,0,0,"I don’t think the zydis is safe for pregnancy, I stuck with the 4mg",,,,1200113985133125634,https://twitter.com/Kay_Giiegh/status/1200113985133125634
2019-11-28 18:05:41,Spitta_Ferrari,Kay_Giiegh,1,0,0,"Yeah the Zoran Zydis is way better coz it dissolves on the tongue, demolishes nausea in seconds ",,,,1200113549592453122,https://twitter.com/Spitta_Ferrari/status/1200113549592453122
2019-11-24 02:35:15,jhnone,HeliJoc,0,0,0,"When I worked for RP Scherer the rumor was that our Zydis product the mfg to distributor price was 55% of gross to amortize R&amp;D costs Before Cass Sunstien raised FDA approval costs by 10X on all domestic testing Include failure $and nobody doing R&amp;D gets their $back at only 10%",,,,1198429843773366275,https://twitter.com/jhnone/status/1198429843773366275
2019-11-21 15:48:33,YvonneKaliOmer,Halluci46269114,1,0,0,"I will advise you to take the a PRN for increased hallucinations. Zyprexa Zydis may have quick effect if you have some in your meds cabinet.",,,,1197542323590238217,https://twitter.com/YvonneKaliOmer/status/1197542323590238217
2019-11-14 19:07:46,GauravDogra20,,0,0,0,"Check out this #job: Zydis® Ultra Scale Up #Manager at #Catalent in #Swindon https://workfor.us/catalent/149b",,,#job #Manager #Catalent #Swindon,1195055740685365248,https://twitter.com/GauravDogra20/status/1195055740685365248
2019-11-01 11:26:51,preipopharma,,0,2,0,"Cycle Pharmaceuticals and Catalent Partner to Develop Treatments for Rare Diseases Using Zydis ODT Technology http://www.preipopharma.com/press-releases/Cycle-Pharmaceuticals-and-Catalent-Partner-to-Develop-Treatments-for-Rare-Diseases-Using-Zydis-ODT-Technology #preIPO #biotech #pharmaceuticals",,,#preIPO #biotech #pharmaceuticals,1190228704963833861,https://twitter.com/preipopharma/status/1190228704963833861
2019-11-01 11:14:02,PBIForum,,0,0,0,"Partnership to develop treatments for rare diseases using Zydis ODT tech http://dlvr.it/RHPckF",,,,1190225479795523585,https://twitter.com/PBIForum/status/1190225479795523585
2019-10-31 16:06:15,ContractPharma,,0,2,2,"@CyclePharma has signed an agreement with @CatalentPharma to develop innovative formulations targeting #RareDiseases using Catalent’s #Zydis® oral disintegrating tablet (ODT) and Zydis Ultra® technologies. Read More: ",,@CyclePharma @CatalentPharma,#RareDiseases #Zydis,1189936631362531330,https://twitter.com/ContractPharma/status/1189936631362531330
2019-10-31 14:18:02,athre0z,trailofbits,1,0,7,"I think part of the reason why Zydis did comparably well on this is because diffing against other libs is already an important part of our workflow. Our approach is a lot cruder though, just a C diffing tool per lib + /dev/urand + GNU/Parallel.",,,,1189909397176299521,https://twitter.com/athre0z/status/1189909397176299521
2019-10-31 13:07:06,CatalentPharma,,0,3,3,"Breaking News: @CyclePharma and @CatalentPharma agree to partner to develop treatments for Rare Diseases using Zydis ODT Technology. Learn More. #PressRelease #Zydis #rarediseases",,@CyclePharma @CatalentPharma,#PressRelease #Zydis #rarediseases,1189891546872766467,https://twitter.com/CatalentPharma/status/1189891546872766467
2019-10-31 09:47:06,PharmacDaily,,0,0,0,"Cycle Pharmaceuticals and Catalent Partner to Develop Treatments for Rare Diseases Using Zydis ODT Technology http://www.pharmaceuticaldaily.com/cycle-pharmaceuticals-and-catalent-partner-to-develop-treatments-for-rare-diseases-using-zydis-odt-technology/",,,,1189841216428544000,https://twitter.com/PharmacDaily/status/1189841216428544000
2019-10-31 07:36:05,FN_Press2,,0,0,0,"Cycle Pharmaceuticals and Catalent Partner to Develop Treatments for Rare Diseases Using Zydis ODT Technology https://www.finanznachrichten.de/nachrichten-2019-10/48048152-cycle-pharmaceuticals-and-catalent-partner-to-develop-treatments-for-rare-diseases-using-zydis-odt-technology-004.htm",,,,1189808242064539648,https://twitter.com/FN_Press2/status/1189808242064539648
2019-10-31 07:34:32,Stock_Market_Pr,,0,0,0,"Cycle Pharmaceuticals and Catalent Partner to Develop Treatments for Rare Diseases Using Zydis ODT #technology http://dlvr.it/RHKBxN #stocktwits #stockmarketnews",,,#technology #stocktwits #stockmarketnews,1189807853696995328,https://twitter.com/Stock_Market_Pr/status/1189807853696995328
2019-10-31 07:24:33,feed_stocks,,0,0,0,"Cycle Pharmaceuticals and Catalent Partner to Develop Treatments for Rare Diseases Using Zydis ODT Technology http://dlvr.it/RHK9Ty",,,,1189805340050608128,https://twitter.com/feed_stocks/status/1189805340050608128
2019-10-31 07:09:32,DeliveryDrug,,0,1,0,"Cycle Pharmaceuticals and Catalent Partner to Develop Treatments for Rare Diseases Using Zydis ODT Technology: Cycle Pharmaceuticals Ltd Cycle is pleased to announce that it has signed an agreement with Catalent Inc. Catalent NYSE CTLT to develop… ",,,,1189801562048094208,https://twitter.com/DeliveryDrug/status/1189801562048094208
2019-10-31 07:09:07,CrweWorld,,0,0,0,"Cycle Pharmaceuticals and Catalent Partner to Develop Treatments for Rare Diseases Using Zydis ODT Technology http://crweworld.com/article/news-provided-by-business-wire/1296489/cycle-pharmaceuticals-and-catalent-partner-to-develop-treatments-for-rare-diseases-using-zydis-odt-technology",,,,1189801456720740353,https://twitter.com/CrweWorld/status/1189801456720740353
2019-10-31 07:08:08,NewsFromBW,,0,0,0,"Cycle Pharmaceuticals and Catalent Partner to Develop Treatments for Rare Diseases Using Zydis ODT Technology http://dlvr.it/RHK7BH",,,,1189801210297012225,https://twitter.com/NewsFromBW/status/1189801210297012225
2019-10-31 07:01:39,newsfilterio,,0,0,0,"Cycle Pharmaceuticals and Catalent Partner to Develop Treatments for Rare Diseases Using Zydis ODT Technology $CTLT https://newsfilter.io/articles/cycle-pharmaceuticals-and-catalent-partner-to-develop-treatments-for-rare-diseases-using-zydis-odt-t-0db5d433b766b55a5910d55f2dbbb433",,,,1189799576150036480,https://twitter.com/newsfilterio/status/1189799576150036480
2019-10-24 11:42:23,Uberdoshadow,bordie,1,0,1,"If you can get to the doctors they should be able to prescribe you Zofran-Zydis Wafer that stops the queasy feeling and they also prescribed me Panadol with codeine to deal with the pain/knock me out",,,,1187333514053574657,https://twitter.com/Uberdoshadow/status/1187333514053574657
2019-10-22 12:20:16,FirefoxCommit,,0,0,0,"Anthony Ramine - Include Zydis only if JS_JITSPEW is set; r=bbouvier - https://bugzilla.mozilla.org/1590081...",,,,1186618268045451265,https://twitter.com/FirefoxCommit/status/1186618268045451265
2019-10-21 13:32:39,AUR_updates,,0,0,0,"AUR Package Update: ""zydis"" (The ultimate, open-source X86 &amp; X86-64 decoder/disassembler library.) https://ift.tt/32AxKsR",,,,1186274099091398657,https://twitter.com/AUR_updates/status/1186274099091398657
2019-10-20 23:31:57,ptracesecurity,,0,8,9,"zydis : Fast and lightweight x86/x86-64 disassembler library https://github.com/zyantific/zydis #Pentesting #WebSecurity #CyberSecurity #Infosec",,,#Pentesting #WebSecurity #CyberSecurity #Infosec,1186062530873085952,https://twitter.com/ptracesecurity/status/1186062530873085952
2019-10-03 15:03:24,VitalAnon,,0,0,0,"http://anonymous.bravehost.com/main/2019/10/03/zydis-v3-0-is-now-final-x86-64-disassembler-library/ Zydis v3.0 is now final! (X86-64 disassembler library)",,,,1179773953989984257,https://twitter.com/VitalAnon/status/1179773953989984257
2019-10-03 08:30:21,binitamshah,,2,63,150,"zydis : Fast and lightweight x86/x86-64 disassembler library : https://github.com/zyantific/zydis",,,,1179675041258201088,https://twitter.com/binitamshah/status/1179675041258201088
2019-10-03 05:35:11,stephOnezy,,0,0,0,"I just told the security guard to strap me to the board and give me the zydis And I was only kind of joking",,,,1179630955998404610,https://twitter.com/stephOnezy/status/1179630955998404610
2019-10-02 17:19:23,athre0z,,0,11,18,"Zydis v3.0 is now final! v2.x will receive security fixes until 2021, but no new features. HF! ",,,,1179445786045759493,https://twitter.com/athre0z/status/1179445786045759493
2019-10-01 02:39:14,hinz_tamara,DrGolfShirt,0,1,23,"Psych: Zyprexa would be a pretty badass name. She could even have a twin brother named Zydis!",,,,1178861903084507136,https://twitter.com/hinz_tamara/status/1178861903084507136
2019-09-20 15:55:30,CatalentPharma,,0,0,2,"Catalent's Swindon campus broke ground last week on a new 40,000 sq. ft. extension that will hold the specialized API coating processing equipment for Zydis® Ultra. http://ow.ly/wXou50wi4SA #ZydisUltra #Groundbreaking #swindon",,,#ZydisUltra #Groundbreaking #swindon,1175076024767438854,https://twitter.com/CatalentPharma/status/1175076024767438854
2019-09-09 23:37:38,DynamicAirway,Rick_Pescatore,0,0,1,"Not following what you are giving Zydis is the tech for ODT",,,,1171206055164071937,https://twitter.com/DynamicAirway/status/1171206055164071937
2019-09-09 22:53:50,kfinmccarthy,Rick_Pescatore,0,0,1,"Is Zydis Olanzepine? What’s the rationale? I’m curious as it’s not something we do/use in paeds pain..",,,,1171195035272011781,https://twitter.com/kfinmccarthy/status/1171195035272011781
2019-08-21 14:39:15,athre0z,halvarflake,0,1,6,"Fun-fact: disassembling libxul is our go-to benchmark for testing Zydis perf. Whole code section takes ~1s with full decoding and ~0.4s in minimal mode. But I guess you are looking for something interactive along the lines of IDA / GHIDRA?",,,,1164185199820922880,https://twitter.com/athre0z/status/1164185199820922880
2019-08-20 22:10:12,FirefoxCommit,,0,0,0,"Ryan Hunt - Build Zydis even when not using Cranelift. r=lth - https://bugzilla.mozilla.org/1574002...",,,,1163936295741198342,https://twitter.com/FirefoxCommit/status/1163936295741198342
2019-08-20 17:20:16,FirefoxCommit,,0,0,0,"Ryan Hunt - Build Zydis even when not using Cranelift. r=lth - https://bugzilla.mozilla.org/1574002...",,,,1163863332719382533,https://twitter.com/FirefoxCommit/status/1163863332719382533
2019-08-19 18:00:20,FirefoxCommit,,0,0,0,"Ryan Hunt - Build Zydis even when not using Cranelift. r=lth - https://bugzilla.mozilla.org/1574002...",,,,1163511028438720512,https://twitter.com/FirefoxCommit/status/1163511028438720512
2019-08-14 14:39:26,semodough,,0,1,5,"$BHVN big 2h19 -Phase 3 rimegepant preventive treatment of migraine in 4Q19;Phase 2/3 top-line efficacy data intranasal BHV-3500 in acute migraine in 4Q19;Futility analysis Phase 2/3 Alzheimer’s of troriluzole 4Q19;Phase 3 FDA approval decision rimegepant Zydis ODT end of 2019 ",,,,1161648528810270721,https://twitter.com/semodough/status/1161648528810270721
2019-08-05 15:01:32,securisec,,0,0,0,"""RT RT Coldzer0x0: #Cmulator v0.2 https://github.com/Coldzer0/Cmulator/releases [+] Add Addr Hook [+] Implementing Api schema forworder [+] Change disassembler from Capstone to Zydis Engine [√] improvements for SEH handling [√] improvements with JS to API handle [√] Improve API detection by addr…",,,#Cmulator,1158392598723215360,https://twitter.com/securisec/status/1158392598723215360
2019-08-05 13:24:16,Coldzer0x0,,0,2,10,"#Cmulator v0.2 https://github.com/Coldzer0/Cmulator/releases [+] Add Addr Hook [+] Implementing Api schema forworder [+] Change disassembler from Capstone to Zydis Engine [√] improvements for SEH handling [√] improvements with JS to API handle [√] Improve API detection by address or name or ordinal",,,#Cmulator,1158368121243217920,https://twitter.com/Coldzer0x0/status/1158368121243217920
2019-08-04 23:41:37,securisec,,0,0,0,"""RT RT athre0z: If you're a Gopher in need of a disassembler lib for X86-64: jpap published some really solid Golang bindings for Zydis today, check them out! https://github.com/jpap/go-zydis""",,,,1158161094717976577,https://twitter.com/securisec/status/1158161094717976577
2019-08-04 17:18:56,AdmVonSchneider,athre0z,0,0,1,"Can someone please get some funding for Zydis?",,,,1158064791337996288,https://twitter.com/AdmVonSchneider/status/1158064791337996288
2019-08-04 08:29:03,athre0z,,1,7,19,"If you're a Gopher in need of a disassembler lib for X86-64: @jpap published some really solid Golang bindings for Zydis today, check them out! https://github.com/jpap/go-zydis",,@jpap,,1157931440069324800,https://twitter.com/athre0z/status/1157931440069324800
2019-07-27 09:51:52,facepalmhard,tylerblack32,0,0,2,"I also take issue w/ dispensary staff that wear white lab coats & make suggestions on which THC to buy based on the meds my pts take (pt was encouraged to drop Zydis &amp; start THC concentrate in “small doses”). I went myself to confirm. In my mind it’s the same predatory behav 2/2",,,,1155053178779570181,https://twitter.com/facepalmhard/status/1155053178779570181
2019-07-23 03:00:11,sevacrp,,0,0,0,"Rimegepant Eliminates #migraine Pain, Reduce Symptoms in #ClinicalTrial A phase 3 clinical trial for rimegepant (rimegepant Zydis), which is currently awaiting FDA approval for the acute treatment of migraines, has returned positive results. ",,,#migraine #ClinicalTrial,1153500025248538624,https://twitter.com/sevacrp/status/1153500025248538624
2019-07-15 16:10:01,algoally,,0,0,0,"$BHVN - Biohaven Pharmaceutical shares are trading higher after a publication of Phase 3 results for the company's migraine medicine, Zydis, was released. The drug demonstrated superiority against a placebo. @algoally",,@algoally,,1150799690734030848,https://twitter.com/algoally/status/1150799690734030848
2019-07-15 12:57:16,BionxHoldings,,0,1,3,"$BHVN https://finance.yahoo.com/news/biohavens-positive-phase-3-trial-113000800.html Biohaven's Positive Phase 3 Trial of Rimegepant Zydis® Orally Dissolving Tablet for Acute Treatment of Migraine Published in The Lancet",,,,1150751184074022912,https://twitter.com/BionxHoldings/status/1150751184074022912
2019-07-15 12:49:29,GoldCreekLLC,,0,0,0,"New post: Biohaven (BHVN) Reports Publication of Positive Phase 3 Trial of Rimegepant Zydis http://tpgold.com/features/biohaven-bhvn-reports-publication-of-positive-phase-3-trial-of-rimegepant-zydis/2019/07/15/biohaven-bhvn-reports-publication-of-positive-phase-3-trial-of-rimegepant-zydis/2019/07/biohaven-bhvn-reports-publication-of-positive-phase-3-trial-of-rimegepant-zydis/archives/134034/biohaven-bhvn-reports-publication-of-positive-phase-3-trial-of-rimegepant-zydis/",,,,1150749222192349186,https://twitter.com/GoldCreekLLC/status/1150749222192349186
2019-07-15 12:49:28,GoldCreekLLC,,0,0,0,"New post: Biohaven's Positive Phase 3 Trial of Rimegepant Zydis® Orally Dissolving Tablet for Acute … http://tpgold.com/features/biohavens-positive-phase-3-trial-of-rimegepant-zydis-orally-dissolving-tablet-for-acute/2019/07/15/biohavens-positive-phase-3-trial-of-rimegepant-zydis-orally-dissolving-tablet-for-acute/2019/07/biohavens-positive-phase-3-trial-of-rimegepant-zydis-orally-dissolving-tablet-for-acute/archives/134033/biohavens-positive-phase-3-trial-of-rimegepant-zydis-orally-dissolving-tablet-for-acute/",,,,1150749219281465344,https://twitter.com/GoldCreekLLC/status/1150749219281465344
2019-07-15 11:53:35,CrweWorld,,0,0,0,"Biohaven's Positive Phase 3 Trial of Rimegepant Zydis® Orally Dissolving Tablet for Acute Treatment of Migraine Pub http://crweworld.com/article/news-provided-by-pr-newswire/1165286/biohavens-positive-phase-3-trial-of-rimegepant-zydis-orally-dissolving-tablet-for-acute-treatment-of-migraine-published-in-the-lancet",,,,1150735156639985664,https://twitter.com/CrweWorld/status/1150735156639985664
2019-07-11 13:30:00,MDMagazine,,0,0,0,"A new study signals hope for acute migraine sufferers who do not see improvment using #triptanes. Investigators found that #Rimegepant (rimegepant Zydis OTD) eliminate migraine pain and reduced bother symptoms in a recent clinical trial. @BiohavenPharma https://www.mdmag.com/medical-news/rimegepant-eliminates-migraine-pain-reduce-symptoms-in-clinical-trial",,@BiohavenPharma,#triptanes #Rimegepant,1149309870157553664,https://twitter.com/MDMagazine/status/1149309870157553664
2019-07-10 21:00:00,MDMagazine,,0,1,0,"Results from a phase 3 clinical trial show that rimegepant (rimegepant Zydis OTD) eliminated migraine pain and reduce bothersome symptoms. The NDA for the novel therapy is currently under #FDA priority review. https://www.mdmag.com/medical-news/rimegepant-eliminates-migraine-pain-reduce-symptoms-in-clinical-trial",,,#FDA,1149060726285373441,https://twitter.com/MDMagazine/status/1149060726285373441
2019-07-08 21:09:33,CatalentPharma,,0,0,2,"Meet the grand winner of The Medicine Maker 2018 Innovation Awards: Catalent's Zydis® Ultra, an orally disintegrating tablet. #oraldrugdelivery #tastemasking #patientcentric @medicine_maker #pediatric #geriatric #dosedesign https://lnkd.in/eBYCpYk",,@medicine_maker,#oraldrugdelivery #tastemasking #patientcentric #pediatric #geriatric #dosedesign,1148338354901139458,https://twitter.com/CatalentPharma/status/1148338354901139458
2019-07-05 18:20:12,FirefoxCommit,,0,0,0,"Sylvestre Ledru - Add Zydis to the list of third party code r=andi - https://bugzilla.mozilla.org/1563718...",,,,1147208573497303040,https://twitter.com/FirefoxCommit/status/1147208573497303040
2019-07-05 06:18:49,ASouthernViolet,IAmDrIbrahim,0,0,0,"Top 5 Meds : Psych Edition 1. Haldol 2. Geodon 3. Ativan 4. Zyprexa Zydis 5. Seroquel/Lithium Lots of meth-induced psychosis, mania, and ETOH withdrawal in my neck of the woods. ",,,,1147027029918965761,https://twitter.com/ASouthernViolet/status/1147027029918965761
2019-06-18 03:02:00,Gupta_Calling,,1,1,0,"$bhvn 9 CATALYSTS 2H 2019 The Company expects to: Continue to advance the rimegepant Zydis® ODT (orally dissolving tablet) and tablet formulation development programs towards commercialization for the acute treatment of migraine. Report Phase 3 topline data for rimegepant in",,,,1140816908092104704,https://twitter.com/Gupta_Calling/status/1140816908092104704
